"Date_Published","FIPS","Admin2","Province_State","Country_Region","Last_Update","Latitude","Longitude","Confirmed","Deaths","Recovered","Active","Combined_Key"
"04-04-2020","46049","Faulk","South Dakota","United States",2020-04-04 23:34:00,45.07082625,-99.14535601,1,0,0,1,"Faulk, South Dakota, United States"
"04-04-2020","05045","Faulkner","Arkansas","United States",2020-04-04 23:34:00,35.14719007,-92.33717519,40,1,0,39,"Faulkner, Arkansas, United States"
"04-04-2020","51061","Fauquier","Virginia","United States",2020-04-04 23:34:00,38.73564842,-77.80647472,10,0,0,10,"Fauquier, Virginia, United States"
"04-04-2020","01057","Fayette","Alabama","United States",2020-04-04 23:34:00,33.72076938,-87.73886638,1,0,0,1,"Fayette, Alabama, United States"
"04-04-2020","13113","Fayette","Georgia","United States",2020-04-04 23:34:00,33.41357794,-84.49089434,62,4,0,58,"Fayette, Georgia, United States"
"04-04-2020","17051","Fayette","Illinois","United States",2020-04-04 23:34:00,39.00072038,-89.02452658,2,0,0,2,"Fayette, Illinois, United States"
"04-04-2020","18041","Fayette","Indiana","United States",2020-04-04 23:34:00,39.63684962,-85.17797541,14,3,0,11,"Fayette, Indiana, United States"
"04-04-2020","19065","Fayette","Iowa","United States",2020-04-04 23:34:00,42.86271799,-91.8441231,3,0,0,3,"Fayette, Iowa, United States"
"04-04-2020","21067","Fayette","Kentucky","United States",2020-04-04 23:34:00,38.0368225,-84.45576892,120,7,0,113,"Fayette, Kentucky, United States"
"04-04-2020","39047","Fayette","Ohio","United States",2020-04-04 23:34:00,39.56021306,-83.4562016,2,0,0,2,"Fayette, Ohio, United States"
"04-04-2020","42051","Fayette","Pennsylvania","United States",2020-04-04 23:34:00,39.92041012,-79.64291195,23,1,0,22,"Fayette, Pennsylvania, United States"
"04-04-2020","47047","Fayette","Tennessee","United States",2020-04-04 23:34:00,35.19615831,-89.41399032,18,0,0,18,"Fayette, Tennessee, United States"
"04-04-2020","48149","Fayette","Texas","United States",2020-04-04 23:34:00,29.87788372,-96.92076062,10,0,0,10,"Fayette, Texas, United States"
"04-04-2020","47049","Fentress","Tennessee","United States",2020-04-04 23:34:00,36.38128818,-84.92870012,1,0,0,1,"Fentress, Tennessee, United States"
"04-04-2020","53019","Ferry","Washington","United States",2020-04-04 23:34:00,48.4711431,-118.5154041,1,0,0,1,"Ferry, Washington, United States"
"04-04-2020","27045","Fillmore","Minnesota","United States",2020-04-04 23:34:00,43.67394126,-92.08980382,9,0,0,9,"Fillmore, Minnesota, United States"
"04-04-2020","20055","Finney","Kansas","United States",2020-04-04 23:34:00,38.04340344,-100.7381938,9,0,0,9,"Finney, Kansas, United States"
"04-04-2020","12035","Flagler","Florida","United States",2020-04-04 23:34:00,29.45933576,-81.31508595,29,1,0,28,"Flagler, Florida, United States"
"04-04-2020","30029","Flathead","Montana","United States",2020-04-04 23:34:00,48.29575866,-114.0520569,20,0,0,20,"Flathead, Montana, United States"
"04-04-2020","45041","Florence","South Carolina","United States",2020-04-04 23:34:00,34.02361754,-79.70189312,35,5,0,30,"Florence, South Carolina, United States"
"04-04-2020","13115","Floyd","Georgia","United States",2020-04-04 23:34:00,34.26268279,-85.21577392,79,3,0,76,"Floyd, Georgia, United States"
"04-04-2020","18043","Floyd","Indiana","United States",2020-04-04 23:34:00,38.32117957,-85.90385377,41,0,0,41,"Floyd, Indiana, United States"
"04-04-2020","51065","Fluvanna","Virginia","United States",2020-04-04 23:34:00,37.84157909,-78.27715475,5,0,0,5,"Fluvanna, Virginia, United States"
"04-04-2020","55039","Fond du Lac","Wisconsin","United States",2020-04-04 23:34:00,43.75354908,-88.48885325,30,2,0,28,"Fond du Lac, Wisconsin, United States"
"04-04-2020","17053","Ford","Illinois","United States",2020-04-04 23:34:00,40.59706922,-88.22350769,1,0,0,1,"Ford, Illinois, United States"
"04-04-2020","20057","Ford","Kansas","United States",2020-04-04 23:34:00,37.69200114,-99.88825298,1,0,0,1,"Ford, Kansas, United States"
"04-04-2020","42053","Forest","Pennsylvania","United States",2020-04-04 23:34:00,41.51095103,-79.23229292,2,0,0,2,"Forest, Pennsylvania, United States"
"04-04-2020","28035","Forrest","Mississippi","United States",2020-04-04 23:34:00,31.18961454,-89.25832496,34,0,0,34,"Forrest, Mississippi, United States"
"04-04-2020","13117","Forsyth","Georgia","United States",2020-04-04 23:34:00,34.22604035,-84.1231513,63,1,0,62,"Forsyth, Georgia, United States"
"04-04-2020","37067","Forsyth","North Carolina","United States",2020-04-04 23:34:00,36.12859861,-80.25459052,88,1,0,87,"Forsyth, North Carolina, United States"
"04-04-2020","48157","Fort Bend","Texas","United States",2020-04-04 23:34:00,29.52704478,-95.77219463,255,2,0,253,"Fort Bend, Texas, United States"
"04-04-2020","38031","Foster","North Dakota","United States",2020-04-04 23:34:00,47.4571084,-98.88279923,1,0,0,1,"Foster, North Dakota, United States"
"04-04-2020","18045","Fountain","Indiana","United States",2020-04-04 23:34:00,40.12361933,-87.24217689,2,1,0,1,"Fountain, Indiana, United States"
"04-04-2020","01059","Franklin","Alabama","United States",2020-04-04 23:34:00,34.44235334,-87.84289505,6,0,0,6,"Franklin, Alabama, United States"
"04-04-2020","12037","Franklin","Florida","United States",2020-04-04 23:34:00,29.83791238,-84.82731662,1,0,0,1,"Franklin, Florida, United States"
"04-04-2020","13119","Franklin","Georgia","United States",2020-04-04 23:34:00,34.37525597,-83.23159927,5,0,0,5,"Franklin, Georgia, United States"
"04-04-2020","17055","Franklin","Illinois","United States",2020-04-04 23:34:00,37.99189086,-88.92567818,1,0,0,1,"Franklin, Illinois, United States"
"04-04-2020","18047","Franklin","Indiana","United States",2020-04-04 23:34:00,39.4142482,-85.06062647,50,6,0,44,"Franklin, Indiana, United States"
"04-04-2020","20059","Franklin","Kansas","United States",2020-04-04 23:34:00,38.56443815,-95.28644341,9,0,0,9,"Franklin, Kansas, United States"
"04-04-2020","21073","Franklin","Kentucky","United States",2020-04-04 23:34:00,38.2379395,-84.87962551,7,0,0,7,"Franklin, Kentucky, United States"
"04-04-2020","22041","Franklin","Louisiana","United States",2020-04-04 23:34:00,32.13675181,-91.67589857,19,0,0,19,"Franklin, Louisiana, United States"
"04-04-2020","23007","Franklin","Maine","United States",2020-04-04 23:34:00,44.97330019,-70.44381045,4,0,0,4,"Franklin, Maine, United States"
"04-04-2020","25011","Franklin","Massachusetts","United States",2020-04-04 23:34:00,42.58119713,-72.58602547,95,12,0,83,"Franklin, Massachusetts, United States"
"04-04-2020","28037","Franklin","Mississippi","United States",2020-04-04 23:34:00,31.47786634,-90.89672989,4,0,0,4,"Franklin, Mississippi, United States"
"04-04-2020","29071","Franklin","Missouri","United States",2020-04-04 23:34:00,38.41127108,-91.07522826,24,0,0,24,"Franklin, Missouri, United States"
"04-04-2020","36033","Franklin","New York","United States",2020-04-04 23:34:00,44.59040891,-74.29926032,10,0,0,10,"Franklin, New York, United States"
"04-04-2020","37069","Franklin","North Carolina","United States",2020-04-04 23:34:00,36.081519,-78.28708884,14,0,0,14,"Franklin, North Carolina, United States"
"04-04-2020","39049","Franklin","Ohio","United States",2020-04-04 23:34:00,39.96995815,-83.01115755,557,6,0,551,"Franklin, Ohio, United States"
"04-04-2020","42055","Franklin","Pennsylvania","United States",2020-04-04 23:34:00,39.92956518,-77.72157791,27,0,0,27,"Franklin, Pennsylvania, United States"
"04-04-2020","47051","Franklin","Tennessee","United States",2020-04-04 23:34:00,35.15634626,-86.09201039,12,1,0,11,"Franklin, Tennessee, United States"
"04-04-2020","48159","Franklin","Texas","United States",2020-04-04 23:34:00,33.17653242,-95.21917243,1,0,0,1,"Franklin, Texas, United States"
"04-04-2020","50011","Franklin","Vermont","United States",2020-04-04 23:34:00,44.85627605,-72.91249563,23,0,0,23,"Franklin, Vermont, United States"
"04-04-2020","51067","Franklin","Virginia","United States",2020-04-04 23:34:00,36.99536167,-79.88023649,10,0,0,10,"Franklin, Virginia, United States"
"04-04-2020","53021","Franklin","Washington","United States",2020-04-04 23:34:00,46.53351425,-118.9018212,46,1,0,45,"Franklin, Washington, United States"
"04-04-2020","51620","Franklin City","Virginia","United States",2020-04-04 23:34:00,36.6831435,-76.93859681,4,0,0,4,"Franklin City, Virginia, United States"
"04-04-2020","24021","Frederick","Maryland","United States",2020-04-04 23:34:00,39.47296601,-77.39999394,73,3,0,70,"Frederick, Maryland, United States"
"04-04-2020","51069","Frederick","Virginia","United States",2020-04-04 23:34:00,39.20172582,-78.25974949,24,0,0,24,"Frederick, Virginia, United States"
"04-04-2020","51630","Fredericksburg","Virginia","United States",2020-04-04 23:34:00,38.2977863,-77.4922454,7,0,0,7,"Fredericksburg, Virginia, United States"
"04-04-2020","27047","Freeborn","Minnesota","United States",2020-04-04 23:34:00,43.67385583,-93.34884422,10,0,0,10,"Freeborn, Minnesota, United States"
"04-04-2020","08043","Fremont","Colorado","United States",2020-04-04 23:34:00,38.47362326,-105.4399667,2,0,0,2,"Fremont, Colorado, United States"
"04-04-2020","16043","Fremont","Idaho","United States",2020-04-04 23:34:00,44.22800938,-111.4809943,1,0,0,1,"Fremont, Idaho, United States"
"04-04-2020","56013","Fremont","Wyoming","United States",2020-04-04 23:34:00,43.04183996,-108.6296893,36,0,0,36,"Fremont, Wyoming, United States"
"04-04-2020","06019","Fresno","California","United States",2020-04-04 23:34:00,36.75733899,-119.6466953,100,1,0,99,"Fresno, California, United States"
"04-04-2020","13121","Fulton","Georgia","United States",2020-04-04 23:34:00,33.79216944,-84.46319413,941,26,0,915,"Fulton, Georgia, United States"
"04-04-2020","18049","Fulton","Indiana","United States",2020-04-04 23:34:00,41.0469907,-86.26252745,2,0,0,2,"Fulton, Indiana, United States"
"04-04-2020","36035","Fulton","New York","United States",2020-04-04 23:34:00,43.11363907,-74.41798804,9,0,0,9,"Fulton, New York, United States"
"04-04-2020","39051","Fulton","Ohio","United States",2020-04-04 23:34:00,41.60213491,-84.12571393,5,0,0,5,"Fulton, Ohio, United States"
"04-04-2020","12039","Gadsden","Florida","United States",2020-04-04 23:34:00,30.57796289,-84.61915825,4,0,0,4,"Gadsden, Florida, United States"
"04-04-2020","31067","Gage","Nebraska","United States",2020-04-04 23:34:00,40.26186809,-96.68946704,2,1,0,1,"Gage, Nebraska, United States"
"04-04-2020","48165","Gaines","Texas","United States",2020-04-04 23:34:00,32.74055318,-102.6353295,1,0,0,1,"Gaines, Texas, United States"
"04-04-2020","51640","Galax","Virginia","United States",2020-04-04 23:34:00,36.66601852,-80.91703124,1,0,0,1,"Galax, Virginia, United States"
"04-04-2020","30031","Gallatin","Montana","United States",2020-04-04 23:34:00,45.54486106,-111.1692571,101,0,0,101,"Gallatin, Montana, United States"
"04-04-2020","39053","Gallia","Ohio","United States",2020-04-04 23:34:00,38.82708533,-82.31647569,4,1,0,3,"Gallia, Ohio, United States"
"04-04-2020","48167","Galveston","Texas","United States",2020-04-04 23:34:00,29.40167322,-94.90469073,136,0,0,136,"Galveston, Texas, United States"
"04-04-2020","08045","Garfield","Colorado","United States",2020-04-04 23:34:00,39.59921777,-107.902708,45,1,0,44,"Garfield, Colorado, United States"
"04-04-2020","40047","Garfield","Oklahoma","United States",2020-04-04 23:34:00,36.3791334,-97.78265517,5,0,0,5,"Garfield, Oklahoma, United States"
"04-04-2020","49017","Garfield","Utah","United States",2020-04-04 23:34:00,37.85447192,-111.4418764,1,0,0,1,"Garfield, Utah, United States"
"04-04-2020","05051","Garland","Arkansas","United States",2020-04-04 23:34:00,34.57692074,-93.14921604,40,0,0,40,"Garland, Arkansas, United States"
"04-04-2020","24023","Garrett","Maryland","United States",2020-04-04 23:34:00,39.52786077,-79.27355126,3,0,0,3,"Garrett, Maryland, United States"
"04-04-2020","40049","Garvin","Oklahoma","United States",2020-04-04 23:34:00,34.70418038,-97.30811132,11,0,0,11,"Garvin, Oklahoma, United States"
"04-04-2020","29073","Gasconade","Missouri","United States",2020-04-04 23:34:00,38.43947277,-91.50847147,2,0,0,2,"Gasconade, Missouri, United States"
"04-04-2020","37071","Gaston","North Carolina","United States",2020-04-04 23:34:00,35.29373559,-81.17477045,43,1,0,42,"Gaston, North Carolina, United States"
"04-04-2020","37073","Gates","North Carolina","United States",2020-04-04 23:34:00,36.44667547,-76.69749701,1,0,0,1,"Gates, North Carolina, United States"
"04-04-2020","39055","Geauga","Ohio","United States",2020-04-04 23:34:00,41.49952319,-81.17935342,38,0,0,38,"Geauga, Ohio, United States"
"04-04-2020","16045","Gem","Idaho","United States",2020-04-04 23:34:00,44.06482372,-116.398376,7,0,0,7,"Gem, Idaho, United States"
"04-04-2020","26049","Genesee","Michigan","United States",2020-04-04 23:34:00,43.02244215,-83.70589709,464,15,0,449,"Genesee, Michigan, United States"
"04-04-2020","36037","Genesee","New York","United States",2020-04-04 23:34:00,43.0022601,-78.19135193,20,1,0,19,"Genesee, New York, United States"
"04-04-2020","28039","George","Mississippi","United States",2020-04-04 23:34:00,30.86259065,-88.64436789,4,0,0,4,"George, Mississippi, United States"
"04-04-2020","45043","Georgetown","South Carolina","United States",2020-04-04 23:34:00,33.43443342,-79.33202141,17,1,0,16,"Georgetown, South Carolina, United States"
"04-04-2020","18051","Gibson","Indiana","United States",2020-04-04 23:34:00,38.30393723,-87.58054938,4,0,0,4,"Gibson, Indiana, United States"
"04-04-2020","47053","Gibson","Tennessee","United States",2020-04-04 23:34:00,35.99438059,-88.93358327,8,0,0,8,"Gibson, Tennessee, United States"
"04-04-2020","04007","Gila","Arizona","United States",2020-04-04 23:34:00,33.80190085,-110.8132779,3,0,0,3,"Gila, Arizona, United States"
"04-04-2020","47055","Giles","Tennessee","United States",2020-04-04 23:34:00,35.20222469,-87.03992678,3,0,0,3,"Giles, Tennessee, United States"
"04-04-2020","48171","Gillespie","Texas","United States",2020-04-04 23:34:00,30.31824095,-98.94676915,2,0,0,2,"Gillespie, Texas, United States"
"04-04-2020","13123","Gilmer","Georgia","United States",2020-04-04 23:34:00,34.69316688,-84.45802506,1,0,0,1,"Gilmer, Georgia, United States"
"04-04-2020","30035","Glacier","Montana","United States",2020-04-04 23:34:00,48.70513576,-112.9934235,1,0,0,1,"Glacier, Montana, United States"
"04-04-2020","12043","Glades","Florida","United States",2020-04-04 23:34:00,26.95635849,-81.18996211,4,1,0,3,"Glades, Florida, United States"
"04-04-2020","26051","Gladwin","Michigan","United States",2020-04-04 23:34:00,43.98901072,-84.38774817,3,0,0,3,"Gladwin, Michigan, United States"
"04-04-2020","06021","Glenn","California","United States",2020-04-04 23:34:00,39.59875897,-122.3938452,2,0,0,2,"Glenn, California, United States"
"04-04-2020","34015","Gloucester","New Jersey","United States",2020-04-04 23:34:00,39.71581067,-75.13995546,215,3,0,212,"Gloucester, New Jersey, United States"
"04-04-2020","51073","Gloucester","Virginia","United States",2020-04-04 23:34:00,37.40809042,-76.53524337,9,0,0,9,"Gloucester, Virginia, United States"
"04-04-2020","13127","Glynn","Georgia","United States",2020-04-04 23:34:00,31.23279254,-81.53811412,27,0,0,27,"Glynn, Georgia, United States"
"04-04-2020","26053","Gogebic","Michigan","United States",2020-04-04 23:34:00,46.40862701,-89.69377193,3,1,0,2,"Gogebic, Michigan, United States"
"04-04-2020","48175","Goliad","Texas","United States",2020-04-04 23:34:00,28.65696592,-97.42760647,1,0,0,1,"Goliad, Texas, United States"
"04-04-2020","48177","Gonzales","Texas","United States",2020-04-04 23:34:00,29.45634206,-97.49424032,1,0,0,1,"Gonzales, Texas, United States"
"04-04-2020","51075","Goochland","Virginia","United States",2020-04-04 23:34:00,37.71714806,-77.90381514,10,0,0,10,"Goochland, Virginia, United States"
"04-04-2020","27049","Goodhue","Minnesota","United States",2020-04-04 23:34:00,44.40849741,-92.7234195,8,0,0,8,"Goodhue, Minnesota, United States"
"04-04-2020","16047","Gooding","Idaho","United States",2020-04-04 23:34:00,42.96927962,-114.8108306,1,0,0,1,"Gooding, Idaho, United States"
"04-04-2020","13129","Gordon","Georgia","United States",2020-04-04 23:34:00,34.50487351,-84.87296253,21,2,0,19,"Gordon, Georgia, United States"
"04-04-2020","56015","Goshen","Wyoming","United States",2020-04-04 23:34:00,42.08798185,-104.3534743,2,0,0,2,"Goshen, Wyoming, United States"
"04-04-2020","31073","Gosper","Nebraska","United States",2020-04-04 23:34:00,40.51481965,-99.83020279,1,0,0,1,"Gosper, Nebraska, United States"
"04-04-2020","20063","Gove","Kansas","United States",2020-04-04 23:34:00,38.91588178,-100.4829321,1,0,0,1,"Gove, Kansas, United States"
"04-04-2020","13131","Grady","Georgia","United States",2020-04-04 23:34:00,30.87454847,-84.23418364,3,0,0,3,"Grady, Georgia, United States"
"04-04-2020","40051","Grady","Oklahoma","United States",2020-04-04 23:34:00,35.0167709,-97.88339847,6,0,0,6,"Grady, Oklahoma, United States"
"04-04-2020","33009","Grafton","New Hampshire","United States",2020-04-04 23:34:00,43.93779815,-71.82057197,38,0,0,38,"Grafton, New Hampshire, United States"
"04-04-2020","04009","Graham","Arizona","United States",2020-04-04 23:34:00,32.93166885,-109.8882178,3,0,0,3,"Graham, Arizona, United States"
"04-04-2020","47057","Grainger","Tennessee","United States",2020-04-04 23:34:00,36.27469206,-83.51254721,3,0,0,3,"Grainger, Tennessee, United States"
"04-04-2020","08049","Grand","Colorado","United States",2020-04-04 23:34:00,40.10603347,-106.1178042,4,0,0,4,"Grand, Colorado, United States"
"04-04-2020","49019","Grand","Utah","United States",2020-04-04 23:34:00,38.98103848,-109.5704487,1,0,0,1,"Grand, Utah, United States"
"04-04-2020","38035","Grand Forks","North Dakota","United States",2020-04-04 23:34:00,47.92093639,-97.45450447,10,0,0,10,"Grand Forks, North Dakota, United States"
"04-04-2020","26055","Grand Traverse","Michigan","United States",2020-04-04 23:34:00,44.69565625,-85.55585247,12,3,0,9,"Grand Traverse, Michigan, United States"
"04-04-2020","05053","Grant","Arkansas","United States",2020-04-04 23:34:00,34.29017991,-92.42320562,3,0,0,3,"Grant, Arkansas, United States"
"04-04-2020","18053","Grant","Indiana","United States",2020-04-04 23:34:00,40.51587228,-85.65468702,15,0,0,15,"Grant, Indiana, United States"
"04-04-2020","21081","Grant","Kentucky","United States",2020-04-04 23:34:00,38.64962758,-84.62415957,2,1,0,1,"Grant, Kentucky, United States"
"04-04-2020","22043","Grant","Louisiana","United States",2020-04-04 23:34:00,31.59882456,-92.56124347,9,0,0,9,"Grant, Louisiana, United States"
"04-04-2020","35017","Grant","New Mexico","United States",2020-04-04 23:34:00,32.73911281,-108.3827845,1,0,0,1,"Grant, New Mexico, United States"
"04-04-2020","38037","Grant","North Dakota","United States",2020-04-04 23:34:00,46.35821257,-101.6390013,1,0,0,1,"Grant, North Dakota, United States"
"04-04-2020","40053","Grant","Oklahoma","United States",2020-04-04 23:34:00,36.796297,-97.78638765,1,0,0,1,"Grant, Oklahoma, United States"
"04-04-2020","41023","Grant","Oregon","United States",2020-04-04 23:34:00,44.49024544,-119.0068631,1,0,0,1,"Grant, Oregon, United States"
"04-04-2020","53025","Grant","Washington","United States",2020-04-04 23:34:00,47.20753737,-119.4500749,77,1,0,76,"Grant, Washington, United States"
"04-04-2020","55043","Grant","Wisconsin","United States",2020-04-04 23:34:00,42.8671731,-90.7063218,2,0,0,2,"Grant, Wisconsin, United States"
"04-04-2020","37077","Granville","North Carolina","United States",2020-04-04 23:34:00,36.30337451,-78.65184241,24,0,0,24,"Granville, North Carolina, United States"
"04-04-2020","26057","Gratiot","Michigan","United States",2020-04-04 23:34:00,43.29265605,-84.60505416,4,0,0,4,"Gratiot, Michigan, United States"
"04-04-2020","21083","Graves","Kentucky","United States",2020-04-04 23:34:00,36.72292505,-88.65143315,2,0,0,2,"Graves, Kentucky, United States"
"04-04-2020","48179","Gray","Texas","United States",2020-04-04 23:34:00,35.40081878,-100.8129222,5,0,0,5,"Gray, Texas, United States"
"04-04-2020","53027","Grays Harbor","Washington","United States",2020-04-04 23:34:00,47.14003705,-123.7820567,3,0,0,3,"Grays Harbor, Washington, United States"
"04-04-2020","21085","Grayson","Kentucky","United States",2020-04-04 23:34:00,37.46231118,-86.34248968,2,0,0,2,"Grayson, Kentucky, United States"
"04-04-2020","48181","Grayson","Texas","United States",2020-04-04 23:34:00,33.62744998,-96.67753461,12,0,0,12,"Grayson, Texas, United States"
"04-04-2020","55045","Green","Wisconsin","United States",2020-04-04 23:34:00,42.6794956,-89.60243287,8,0,0,8,"Green, Wisconsin, United States"
"04-04-2020","54025","Greenbrier","West Virginia","United States",2020-04-04 23:34:00,37.9463652,-80.45335881,3,0,0,3,"Greenbrier, West Virginia, United States"
"04-04-2020","01063","Greene","Alabama","United States",2020-04-04 23:34:00,32.85504247,-87.95684022,5,0,0,5,"Greene, Alabama, United States"
"04-04-2020","05055","Greene","Arkansas","United States",2020-04-04 23:34:00,36.1173546,-90.55832668,1,0,0,1,"Greene, Arkansas, United States"
"04-04-2020","13133","Greene","Georgia","United States",2020-04-04 23:34:00,33.5769205,-83.17139104,12,0,0,12,"Greene, Georgia, United States"
"04-04-2020","18055","Greene","Indiana","United States",2020-04-04 23:34:00,39.03630547,-86.96223202,9,0,0,9,"Greene, Indiana, United States"
"04-04-2020","29077","Greene","Missouri","United States",2020-04-04 23:34:00,37.2575872,-93.34230916,64,7,0,57,"Greene, Missouri, United States"
"04-04-2020","36039","Greene","New York","United States",2020-04-04 23:34:00,42.275797,-74.12384884,24,0,0,24,"Greene, New York, United States"
"04-04-2020","37079","Greene","North Carolina","United States",2020-04-04 23:34:00,35.48544173,-77.67578087,5,0,0,5,"Greene, North Carolina, United States"
"04-04-2020","39057","Greene","Ohio","United States",2020-04-04 23:34:00,39.69116283,-83.89032084,11,1,0,10,"Greene, Ohio, United States"
"04-04-2020","42059","Greene","Pennsylvania","United States",2020-04-04 23:34:00,39.85746531,-80.22357106,12,0,0,12,"Greene, Pennsylvania, United States"
"04-04-2020","47059","Greene","Tennessee","United States",2020-04-04 23:34:00,36.17470125,-82.84691273,16,1,0,15,"Greene, Tennessee, United States"
"04-04-2020","51079","Greene","Virginia","United States",2020-04-04 23:34:00,38.29545894,-78.46525378,2,0,0,2,"Greene, Virginia, United States"
"04-04-2020","04011","Greenlee","Arizona","United States",2020-04-04 23:34:00,33.21498827,-109.2405279,1,0,0,1,"Greenlee, Arizona, United States"
"04-04-2020","51081","Greensville","Virginia","United States",2020-04-04 23:34:00,36.67878901,-77.56351439,4,0,0,4,"Greensville, Virginia, United States"
"04-04-2020","21089","Greenup","Kentucky","United States",2020-04-04 23:34:00,38.54332505,-82.9215658,1,0,0,1,"Greenup, Kentucky, United States"
"04-04-2020","45045","Greenville","South Carolina","United States",2020-04-04 23:34:00,34.89502264,-82.37295012,183,2,0,181,"Greenville, South Carolina, United States"
"04-04-2020","20073","Greenwood","Kansas","United States",2020-04-04 23:34:00,37.8774388,-96.23250453,1,0,0,1,"Greenwood, Kansas, United States"
"04-04-2020","45047","Greenwood","South Carolina","United States",2020-04-04 23:34:00,34.15272415,-82.12715789,10,0,0,10,"Greenwood, South Carolina, United States"
"04-04-2020","40055","Greer","Oklahoma","United States",2020-04-04 23:34:00,34.93535801,-99.5605612,6,1,0,5,"Greer, Oklahoma, United States"
"04-04-2020","48183","Gregg","Texas","United States",2020-04-04 23:34:00,32.47940482,-94.81591935,16,0,0,16,"Gregg, Texas, United States"
"04-04-2020","28043","Grenada","Mississippi","United States",2020-04-04 23:34:00,33.77036166,-89.80245083,4,0,0,4,"Grenada, Mississippi, United States"
"04-04-2020","48185","Grimes","Texas","United States",2020-04-04 23:34:00,30.54579585,-95.98902499,3,0,0,3,"Grimes, Texas, United States"
"04-04-2020","17063","Grundy","Illinois","United States",2020-04-04 23:34:00,41.28569601,-88.41905692,9,0,0,9,"Grundy, Illinois, United States"
"04-04-2020","19075","Grundy","Iowa","United States",2020-04-04 23:34:00,42.40183723,-92.78829551,1,0,0,1,"Grundy, Iowa, United States"
"04-04-2020","47061","Grundy","Tennessee","United States",2020-04-04 23:34:00,35.38433717,-85.72142731,12,0,0,12,"Grundy, Tennessee, United States"
"04-04-2020","48187","Guadalupe","Texas","United States",2020-04-04 23:34:00,29.58165339,-97.94786822,26,0,0,26,"Guadalupe, Texas, United States"
"04-04-2020","39059","Guernsey","Ohio","United States",2020-04-04 23:34:00,40.05026529,-81.49248905,1,0,0,1,"Guernsey, Ohio, United States"
"04-04-2020","37081","Guilford","North Carolina","United States",2020-04-04 23:34:00,36.07959451,-79.78824948,94,5,0,89,"Guilford, North Carolina, United States"
"04-04-2020","12045","Gulf","Florida","United States",2020-04-04 23:34:00,29.93543004,-85.2427099,1,0,0,1,"Gulf, Florida, United States"
"04-04-2020","08051","Gunnison","Colorado","United States",2020-04-04 23:34:00,38.66611652,-107.0320729,88,1,0,87,"Gunnison, Colorado, United States"
"04-04-2020","19077","Guthrie","Iowa","United States",2020-04-04 23:34:00,41.68378965,-94.50111014,1,0,0,1,"Guthrie, Iowa, United States"
"04-04-2020","13135","Gwinnett","Georgia","United States",2020-04-04 23:34:00,33.96044201,-84.02137802,364,8,0,356,"Gwinnett, Georgia, United States"
"04-04-2020","13137","Habersham","Georgia","United States",2020-04-04 23:34:00,34.63331566,-83.53094677,2,0,0,2,"Habersham, Georgia, United States"
"04-04-2020","01065","Hale","Alabama","United States",2020-04-04 23:34:00,32.76039258,-87.63284988,3,0,0,3,"Hale, Alabama, United States"
"04-04-2020","48189","Hale","Texas","United States",2020-04-04 23:34:00,34.07044901,-101.8268114,6,0,0,6,"Hale, Texas, United States"
"04-04-2020","37083","Halifax","North Carolina","United States",2020-04-04 23:34:00,36.25669272,-77.6556109,10,0,0,10,"Halifax, North Carolina, United States"
"04-04-2020","51083","Halifax","Virginia","United States",2020-04-04 23:34:00,36.76654925,-78.93512622,1,0,0,1,"Halifax, Virginia, United States"
