"Date_Published","FIPS","Admin2","Province_State","Country_Region","Last_Update","Latitude","Longitude","Confirmed","Deaths","Recovered","Active","Combined_Key"
"04-01-2020","21059","Daviess","Kentucky","United States",2020-04-01 15:58:49,37.73028906,-87.0901948,34,0,0,34,"Daviess, Kentucky, United States"
"04-01-2020","49011","Davis","Utah","United States",2020-04-01 15:58:49,40.99001837,-112.1139997,84,1,0,83,"Davis, Utah, United States"
"04-01-2020","46035","Davison","South Dakota","United States",2020-04-01 15:58:49,43.67490933,-98.14458906,2,0,0,2,"Davison, South Dakota, United States"
"04-01-2020","13085","Dawson","Georgia","United States",2020-04-01 15:58:49,34.44244079,-84.16964071,11,0,0,11,"Dawson, Georgia, United States"
"04-01-2020","31047","Dawson","Nebraska","United States",2020-04-01 15:58:49,40.87028216,-99.8201461,1,0,0,1,"Dawson, Nebraska, United States"
"04-01-2020","48115","Dawson","Texas","United States",2020-04-01 15:58:49,32.74255572,-101.9477242,3,0,0,3,"Dawson, Texas, United States"
"04-01-2020","22031","De Soto","Louisiana","United States",2020-04-01 15:58:49,32.05457447,-93.74130302,39,1,0,38,"De Soto, Louisiana, United States"
"04-01-2020","01049","DeKalb","Alabama","United States",2020-04-01 15:58:49,34.45946862,-85.80782906,5,0,0,5,"DeKalb, Alabama, United States"
"04-01-2020","13089","DeKalb","Georgia","United States",2020-04-01 15:58:49,33.76944049,-84.22396017,365,4,0,361,"DeKalb, Georgia, United States"
"04-01-2020","17037","DeKalb","Illinois","United States",2020-04-01 15:58:49,41.89373302,-88.76958483,14,0,0,14,"DeKalb, Illinois, United States"
"04-01-2020","18033","DeKalb","Indiana","United States",2020-04-01 15:58:49,41.39804622,-84.99906934,2,0,0,2,"DeKalb, Indiana, United States"
"04-01-2020","29063","DeKalb","Missouri","United States",2020-04-01 15:58:49,39.89201062,-94.40476508,1,0,0,1,"DeKalb, Missouri, United States"
"04-01-2020","47041","DeKalb","Tennessee","United States",2020-04-01 15:58:49,35.97616272,-85.83689361,5,0,0,5,"DeKalb, Tennessee, United States"
"04-01-2020","12027","DeSoto","Florida","United States",2020-04-01 15:58:49,27.18677893,-81.80941373,7,1,0,6,"DeSoto, Florida, United States"
"04-01-2020","28033","DeSoto","Mississippi","United States",2020-04-01 15:58:49,34.87625235,-89.99091418,94,1,0,93,"DeSoto, Mississippi, United States"
"04-01-2020","48123","DeWitt","Texas","United States",2020-04-01 15:58:49,29.08101855,-97.3568117,6,0,0,6,"DeWitt, Texas, United States"
"04-01-2020","48117","Deaf Smith","Texas","United States",2020-04-01 15:58:49,34.96522957,-102.6054267,2,0,0,2,"Deaf Smith, Texas, United States"
"04-01-2020","18029","Dearborn","Indiana","United States",2020-04-01 15:58:49,39.14647946,-84.97333539,17,1,0,16,"Dearborn, Indiana, United States"
"04-01-2020","13087","Decatur","Georgia","United States",2020-04-01 15:58:49,30.87967778,-84.57619536,8,0,0,8,"Decatur, Georgia, United States"
"04-01-2020","18031","Decatur","Indiana","United States",2020-04-01 15:58:49,39.30712658,-85.50087166,48,1,0,47,"Decatur, Indiana, United States"
"04-01-2020","47039","Decatur","Tennessee","United States",2020-04-01 15:58:49,35.60048904,-88.11043779,0,0,0,0,"Decatur, Tennessee, United States"
"04-01-2020","30023","Deer Lodge","Montana","United States",2020-04-01 15:58:49,46.05953325,-113.073353,3,0,0,3,"Deer Lodge, Montana, United States"
"04-01-2020","39039","Defiance","Ohio","United States",2020-04-01 15:58:49,41.32398837,-84.49076944,6,0,0,6,"Defiance, Ohio, United States"
"04-01-2020","18035","Delaware","Indiana","United States",2020-04-01 15:58:49,40.22787247,-85.39732772,22,1,0,21,"Delaware, Indiana, United States"
"04-01-2020","36025","Delaware","New York","United States",2020-04-01 15:58:49,42.19837623,-74.96709306,20,0,0,20,"Delaware, New York, United States"
"04-01-2020","39041","Delaware","Ohio","United States",2020-04-01 15:58:49,40.27942393,-83.00457058,47,1,0,46,"Delaware, Ohio, United States"
"04-01-2020","40041","Delaware","Oklahoma","United States",2020-04-01 15:58:49,36.40823634,-94.80325046,8,0,0,8,"Delaware, Oklahoma, United States"
"04-01-2020","42045","Delaware","Pennsylvania","United States",2020-04-01 15:58:49,39.91680171,-75.40243663,390,7,0,383,"Delaware, Pennsylvania, United States"
"04-01-2020","08029","Delta","Colorado","United States",2020-04-01 15:58:49,38.86246243,-107.8631342,1,0,0,1,"Delta, Colorado, United States"
"04-01-2020","26041","Delta","Michigan","United States",2020-04-01 15:58:49,45.9048491,-86.9080745,3,0,0,3,"Delta, Michigan, United States"
"04-01-2020","48121","Denton","Texas","United States",2020-04-01 15:58:49,33.20521901,-97.11691153,206,4,0,202,"Denton, Texas, United States"
"04-01-2020","08031","Denver","Colorado","United States",2020-04-01 15:58:49,39.76018276,-104.8725695,539,7,0,532,"Denver, Colorado, United States"
"04-01-2020","19057","Des Moines","Iowa","United States",2020-04-01 15:58:49,40.92012606,-91.18326592,2,0,0,2,"Des Moines, Iowa, United States"
"04-01-2020","41017","Deschutes","Oregon","United States",2020-04-01 15:58:49,43.91570171,-121.2289121,27,0,0,27,"Deschutes, Oregon, United States"
"04-01-2020","05041","Desha","Arkansas","United States",2020-04-01 15:58:49,33.83011025,-91.25500948,2,0,0,2,"Desha, Arkansas, United States"
"04-01-2020","46039","Deuel","South Dakota","United States",2020-04-01 15:58:49,44.75994309,-96.66943645,1,0,0,1,"Deuel, South Dakota, United States"
"04-01-2020","19059","Dickinson","Iowa","United States",2020-04-01 15:58:49,43.37787725,-95.1510206,1,0,0,1,"Dickinson, Iowa, United States"
"04-01-2020","26043","Dickinson","Michigan","United States",2020-04-01 15:58:49,46.00999672,-87.86961634,0,0,0,0,"Dickinson, Michigan, United States"
"04-01-2020","47043","Dickson","Tennessee","United States",2020-04-01 15:58:49,36.14669837,-87.35891709,18,0,0,18,"Dickson, Tennessee, United States"
"04-01-2020","45033","Dillon","South Carolina","United States",2020-04-01 15:58:49,34.39007791,-79.37741872,1,0,0,1,"Dillon, South Carolina, United States"
"04-01-2020","11001","District of Columbia","District of Columbia","United States",2020-04-01 15:58:49,38.90417773,-77.01655992,586,9,0,577,"District of Columbia, District of Columbia, United States"
"04-01-2020","38023","Divide","North Dakota","United States",2020-04-01 15:58:49,48.8149387,-103.4873611,1,0,0,1,"Divide, North Dakota, United States"
"04-01-2020","13091","Dodge","Georgia","United States",2020-04-01 15:58:49,32.17265114,-83.16948926,3,0,0,3,"Dodge, Georgia, United States"
"04-01-2020","27039","Dodge","Minnesota","United States",2020-04-01 15:58:49,44.02238415,-92.86244324,10,0,0,10,"Dodge, Minnesota, United States"
"04-01-2020","31053","Dodge","Nebraska","United States",2020-04-01 15:58:49,41.58071748,-96.65598179,4,0,0,4,"Dodge, Nebraska, United States"
"04-01-2020","55027","Dodge","Wisconsin","United States",2020-04-01 15:58:49,43.41576662,-88.70928178,13,0,0,13,"Dodge, Wisconsin, United States"
"04-01-2020","35013","Dona Ana","New Mexico","United States",2020-04-01 15:58:49,32.35275771,-106.8329387,18,0,0,18,"Dona Ana, New Mexico, United States"
"04-01-2020","20043","Doniphan","Kansas","United States",2020-04-01 15:58:49,39.79067154,-95.14056866,1,0,0,1,"Doniphan, Kansas, United States"
"04-01-2020","48129","Donley","Texas","United States",2020-04-01 15:58:49,34.96517499,-100.8140093,1,0,0,1,"Donley, Texas, United States"
"04-01-2020","13093","Dooly","Georgia","United States",2020-04-01 15:58:49,32.15630737,-83.79746561,10,0,0,10,"Dooly, Georgia, United States"
"04-01-2020","55029","Door","Wisconsin","United States",2020-04-01 15:58:49,44.95856458,-87.30002707,1,0,0,1,"Door, Wisconsin, United States"
"04-01-2020","24019","Dorchester","Maryland","United States",2020-04-01 15:58:49,38.45413522,-76.02752426,1,0,0,1,"Dorchester, Maryland, United States"
"04-01-2020","45035","Dorchester","South Carolina","United States",2020-04-01 15:58:49,33.0794369,-80.40502652,27,0,0,27,"Dorchester, South Carolina, United States"
"04-01-2020","13095","Dougherty","Georgia","United States",2020-04-01 15:58:49,31.53328528,-84.21722377,480,27,0,453,"Dougherty, Georgia, United States"
"04-01-2020","08035","Douglas","Colorado","United States",2020-04-01 15:58:49,39.33133796,-104.930001,141,0,0,141,"Douglas, Colorado, United States"
"04-01-2020","13097","Douglas","Georgia","United States",2020-04-01 15:58:49,33.70291126,-84.77026156,55,2,0,53,"Douglas, Georgia, United States"
"04-01-2020","17041","Douglas","Illinois","United States",2020-04-01 15:58:49,39.76768052,-88.21854195,8,0,0,8,"Douglas, Illinois, United States"
"04-01-2020","20045","Douglas","Kansas","United States",2020-04-01 15:58:49,38.88503636,-95.2925121,31,0,0,31,"Douglas, Kansas, United States"
"04-01-2020","27041","Douglas","Minnesota","United States",2020-04-01 15:58:49,45.93348491,-95.45335469,1,0,0,1,"Douglas, Minnesota, United States"
"04-01-2020","31055","Douglas","Nebraska","United States",2020-04-01 15:58:49,41.29518299,-96.15085305,101,1,0,100,"Douglas, Nebraska, United States"
"04-01-2020","32005","Douglas","Nevada","United States",2020-04-01 15:58:49,38.912862,-119.6171333,6,0,0,6,"Douglas, Nevada, United States"
"04-01-2020","41019","Douglas","Oregon","United States",2020-04-01 15:58:49,43.27941273,-123.167291,10,0,0,10,"Douglas, Oregon, United States"
"04-01-2020","53017","Douglas","Washington","United States",2020-04-01 15:58:49,47.7361335,-119.692937,5,0,0,5,"Douglas, Washington, United States"
"04-01-2020","55031","Douglas","Wisconsin","United States",2020-04-01 15:58:49,46.43222285,-91.91595768,7,0,0,7,"Douglas, Wisconsin, United States"
"04-01-2020","05043","Drew","Arkansas","United States",2020-04-01 15:58:49,33.59035001,-91.71777921,1,0,0,1,"Drew, Arkansas, United States"
"04-01-2020","17043","DuPage","Illinois","United States",2020-04-01 15:58:49,41.85116968,-88.08642662,392,12,0,380,"DuPage, Illinois, United States"
"04-01-2020","18037","Dubois","Indiana","United States",2020-04-01 15:58:49,38.36597551,-86.8792417,3,0,0,3,"Dubois, Indiana, United States"
"04-01-2020","19061","Dubuque","Iowa","United States",2020-04-01 15:58:49,42.46815349,-90.88181925,22,1,0,21,"Dubuque, Iowa, United States"
"04-01-2020",NA,"Dukes and Nantucket","Massachusetts","United States",2020-04-01 15:58:49,41.40674725,-70.68763497,11,0,0,11,"Dukes and Nantucket, Massachusetts, United States"
"04-01-2020","29069","Dunklin","Missouri","United States",2020-04-01 15:58:49,36.27167174,-90.09122243,6,0,0,6,"Dunklin, Missouri, United States"
"04-01-2020","38025","Dunn","North Dakota","United States",2020-04-01 15:58:49,47.35423935,-102.6160468,1,0,0,1,"Dunn, North Dakota, United States"
"04-01-2020","55033","Dunn","Wisconsin","United States",2020-04-01 15:58:49,44.94562799,-91.8962481,3,0,0,3,"Dunn, Wisconsin, United States"
"04-01-2020","37061","Duplin","North Carolina","United States",2020-04-01 15:58:49,34.93449805,-77.93140529,2,0,0,2,"Duplin, North Carolina, United States"
"04-01-2020","37063","Durham","North Carolina","United States",2020-04-01 15:58:49,36.03638492,-78.87608331,126,0,0,126,"Durham, North Carolina, United States"
"04-01-2020","36027","Dutchess","New York","United States",2020-04-01 15:58:49,41.7648606,-73.74356679,547,4,0,543,"Dutchess, New York, United States"
"04-01-2020","12031","Duval","Florida","United States",2020-04-01 15:58:49,30.33225875,-81.66976468,218,4,0,214,"Duval, Florida, United States"
"04-01-2020","47045","Dyer","Tennessee","United States",2020-04-01 15:58:49,36.05931946,-89.41542855,3,0,0,3,"Dyer, Tennessee, United States"
"04-01-2020","08037","Eagle","Colorado","United States",2020-04-01 15:58:49,39.62754308,-106.6933637,227,4,0,223,"Eagle, Colorado, United States"
"04-01-2020","13099","Early","Georgia","United States",2020-04-01 15:58:49,31.32155345,-84.90255207,34,1,0,33,"Early, Georgia, United States"
"04-01-2020","22033","East Baton Rouge","Louisiana","United States",2020-04-01 15:58:49,30.53842039,-91.09777565,244,10,0,234,"East Baton Rouge, Louisiana, United States"
"04-01-2020","22035","East Carroll","Louisiana","United States",2020-04-01 15:58:49,32.73926954,-91.23425694,1,0,0,1,"East Carroll, Louisiana, United States"
"04-01-2020","22037","East Feliciana","Louisiana","United States",2020-04-01 15:58:49,30.84425359,-91.04976723,10,0,0,10,"East Feliciana, Louisiana, United States"
"04-01-2020","48133","Eastland","Texas","United States",2020-04-01 15:58:49,32.32743996,-98.83243566,4,0,0,4,"Eastland, Texas, United States"
"04-01-2020","26045","Eaton","Michigan","United States",2020-04-01 15:58:49,42.59599185,-84.83740035,27,0,0,27,"Eaton, Michigan, United States"
"04-01-2020","55035","Eau Claire","Wisconsin","United States",2020-04-01 15:58:49,44.726614,-91.28609183,12,0,0,12,"Eau Claire, Wisconsin, United States"
"04-01-2020","48135","Ector","Texas","United States",2020-04-01 15:58:49,31.86898877,-102.5429428,11,0,0,11,"Ector, Texas, United States"
"04-01-2020","35015","Eddy","New Mexico","United States",2020-04-01 15:58:49,32.47167456,-104.3053527,4,1,0,3,"Eddy, New Mexico, United States"
"04-01-2020","37065","Edgecombe","North Carolina","United States",2020-04-01 15:58:49,35.91230639,-77.59436892,3,0,0,3,"Edgecombe, North Carolina, United States"
"04-01-2020","45037","Edgefield","South Carolina","United States",2020-04-01 15:58:49,33.77221995,-81.96231108,4,0,0,4,"Edgefield, South Carolina, United States"
"04-01-2020","21061","Edmonson","Kentucky","United States",2020-04-01 15:58:49,37.21218923,-86.23955613,2,0,0,2,"Edmonson, Kentucky, United States"
"04-01-2020","13103","Effingham","Georgia","United States",2020-04-01 15:58:49,32.36616021,-81.34280942,5,0,0,5,"Effingham, Georgia, United States"
"04-01-2020","06017","El Dorado","California","United States",2020-04-01 15:58:49,38.77965956,-120.5233166,18,0,0,18,"El Dorado, California, United States"
"04-01-2020","08041","El Paso","Colorado","United States",2020-04-01 15:58:49,38.83240149,-104.5251411,286,13,0,273,"El Paso, Colorado, United States"
"04-01-2020","48141","El Paso","Texas","United States",2020-04-01 15:58:49,31.76980765,-106.2363275,57,0,0,57,"El Paso, Texas, United States"
"04-01-2020","08039","Elbert","Colorado","United States",2020-04-01 15:58:49,39.28656773,-104.1358721,5,0,0,5,"Elbert, Colorado, United States"
"04-01-2020","18039","Elkhart","Indiana","United States",2020-04-01 15:58:49,41.59761169,-85.85875695,23,2,0,21,"Elkhart, Indiana, United States"
"04-01-2020","32007","Elko","Nevada","United States",2020-04-01 15:58:49,41.14531606,-115.3577619,5,0,0,5,"Elko, Nevada, United States"
"04-01-2020","48139","Ellis","Texas","United States",2020-04-01 15:58:49,32.34894117,-96.79371841,20,0,0,20,"Ellis, Texas, United States"
"04-01-2020","01051","Elmore","Alabama","United States",2020-04-01 15:58:49,32.59785413,-86.14415284,14,0,0,14,"Elmore, Alabama, United States"
"04-01-2020","16039","Elmore","Idaho","United States",2020-04-01 15:58:49,43.3507101,-115.4701578,3,0,0,3,"Elmore, Idaho, United States"
"04-01-2020","13107","Emanuel","Georgia","United States",2020-04-01 15:58:49,32.59221302,-82.30239915,1,0,0,1,"Emanuel, Georgia, United States"
"04-01-2020","26047","Emmet","Michigan","United States",2020-04-01 15:58:49,45.52625509,-84.89083249,7,1,0,6,"Emmet, Michigan, United States"
"04-01-2020","48143","Erath","Texas","United States",2020-04-01 15:58:49,32.23602653,-98.21773417,7,1,0,6,"Erath, Texas, United States"
"04-01-2020","36029","Erie","New York","United States",2020-04-01 15:58:49,42.76249024,-78.73063652,582,11,0,571,"Erie, New York, United States"
"04-01-2020","39043","Erie","Ohio","United States",2020-04-01 15:58:49,41.36796058,-82.62904521,5,1,0,4,"Erie, Ohio, United States"
"04-01-2020","42049","Erie","Pennsylvania","United States",2020-04-01 15:58:49,41.99253829,-80.03301954,15,0,0,15,"Erie, Pennsylvania, United States"
"04-01-2020","01053","Escambia","Alabama","United States",2020-04-01 15:58:49,31.1256789,-87.15918694,1,0,0,1,"Escambia, Alabama, United States"
"04-01-2020","12033","Escambia","Florida","United States",2020-04-01 15:58:49,30.67652764,-87.37284571,94,0,0,94,"Escambia, Florida, United States"
"04-01-2020","25009","Essex","Massachusetts","United States",2020-04-01 15:58:49,42.6687626,-70.94687179,885,17,0,868,"Essex, Massachusetts, United States"
"04-01-2020","34013","Essex","New Jersey","United States",2020-04-01 15:58:49,40.78681335,-74.24657979,2262,69,0,2193,"Essex, New Jersey, United States"
"04-01-2020","36031","Essex","New York","United States",2020-04-01 15:58:49,44.11630765,-73.77297842,6,0,0,6,"Essex, New York, United States"
"04-01-2020","01055","Etowah","Alabama","United States",2020-04-01 15:58:49,34.04567266,-86.04051873,10,1,0,9,"Etowah, Alabama, United States"
"04-01-2020","22039","Evangeline","Louisiana","United States",2020-04-01 15:58:49,30.72985248,-92.39915924,11,0,0,11,"Evangeline, Louisiana, United States"
"04-01-2020","02090","Fairbanks North Star","Alaska","United States",2020-04-01 15:58:49,64.80726247,-146.5692662,35,0,0,35,"Fairbanks North Star, Alaska, United States"
"04-01-2020","51059","Fairfax","Virginia","United States",2020-04-01 15:58:49,38.83677558,-77.27565836,288,2,0,286,"Fairfax, Virginia, United States"
"04-01-2020","51600","Fairfax City","Virginia","United States",2020-04-01 15:58:49,38.85157547,-77.2977964,0,0,0,0,"Fairfax City, Virginia, United States"
"04-01-2020","09001","Fairfield","Connecticut","United States",2020-04-01 15:58:49,41.26809896,-73.3881171,1986,46,0,1940,"Fairfield, Connecticut, United States"
"04-01-2020","39045","Fairfield","Ohio","United States",2020-04-01 15:58:49,39.75107189,-82.63088163,22,0,0,22,"Fairfield, Ohio, United States"
"04-01-2020","45039","Fairfield","South Carolina","United States",2020-04-01 15:58:49,34.39287073,-81.1195624,7,0,0,7,"Fairfield, South Carolina, United States"
"04-01-2020","46047","Fall River","South Dakota","United States",2020-04-01 15:58:49,43.23929297,-103.5275691,1,0,0,1,"Fall River, South Dakota, United States"
"04-01-2020","48145","Falls","Texas","United States",2020-04-01 15:58:49,31.25350609,-96.93630086,1,0,0,1,"Falls, Texas, United States"
"04-01-2020","13111","Fannin","Georgia","United States",2020-04-01 15:58:49,34.86430205,-84.316964,5,0,0,5,"Fannin, Georgia, United States"
"04-01-2020","48147","Fannin","Texas","United States",2020-04-01 15:58:49,33.59564294,-96.10751083,1,0,0,1,"Fannin, Texas, United States"
"04-01-2020","27043","Faribault","Minnesota","United States",2020-04-01 15:58:49,43.67381499,-93.94787458,2,0,0,2,"Faribault, Minnesota, United States"
"04-01-2020","46049","Faulk","South Dakota","United States",2020-04-01 15:58:49,45.07082625,-99.14535601,1,0,0,1,"Faulk, South Dakota, United States"
"04-01-2020","05045","Faulkner","Arkansas","United States",2020-04-01 15:58:49,35.14719007,-92.33717519,36,1,0,35,"Faulkner, Arkansas, United States"
"04-01-2020","51061","Fauquier","Virginia","United States",2020-04-01 15:58:49,38.73564842,-77.80647472,7,0,0,7,"Fauquier, Virginia, United States"
"04-01-2020","01057","Fayette","Alabama","United States",2020-04-01 15:58:49,33.72076938,-87.73886638,1,0,0,1,"Fayette, Alabama, United States"
"04-01-2020","13113","Fayette","Georgia","United States",2020-04-01 15:58:49,33.41357794,-84.49089434,48,4,0,44,"Fayette, Georgia, United States"
"04-01-2020","17051","Fayette","Illinois","United States",2020-04-01 15:58:49,39.00072038,-89.02452658,2,0,0,2,"Fayette, Illinois, United States"
"04-01-2020","18041","Fayette","Indiana","United States",2020-04-01 15:58:49,39.63684962,-85.17797541,10,2,0,8,"Fayette, Indiana, United States"
"04-01-2020","19065","Fayette","Iowa","United States",2020-04-01 15:58:49,42.86271799,-91.8441231,2,0,0,2,"Fayette, Iowa, United States"
"04-01-2020","21067","Fayette","Kentucky","United States",2020-04-01 15:58:49,38.0368225,-84.45576892,110,3,0,107,"Fayette, Kentucky, United States"
"04-01-2020","39047","Fayette","Ohio","United States",2020-04-01 15:58:49,39.56021306,-83.4562016,1,0,0,1,"Fayette, Ohio, United States"
"04-01-2020","42051","Fayette","Pennsylvania","United States",2020-04-01 15:58:49,39.92041012,-79.64291195,14,1,0,13,"Fayette, Pennsylvania, United States"
"04-01-2020","47047","Fayette","Tennessee","United States",2020-04-01 15:58:49,35.19615831,-89.41399032,14,0,0,14,"Fayette, Tennessee, United States"
"04-01-2020","48149","Fayette","Texas","United States",2020-04-01 15:58:49,29.87788372,-96.92076062,4,0,0,4,"Fayette, Texas, United States"
"04-01-2020","47049","Fentress","Tennessee","United States",2020-04-01 15:58:49,36.38128818,-84.92870012,1,0,0,1,"Fentress, Tennessee, United States"
"04-01-2020","53019","Ferry","Washington","United States",2020-04-01 15:58:49,48.4711431,-118.5154041,1,0,0,1,"Ferry, Washington, United States"
"04-01-2020","27045","Fillmore","Minnesota","United States",2020-04-01 15:58:49,43.67394126,-92.08980382,8,0,0,8,"Fillmore, Minnesota, United States"
"04-01-2020","20055","Finney","Kansas","United States",2020-04-01 15:58:49,38.04340344,-100.7381938,1,0,0,1,"Finney, Kansas, United States"
"04-01-2020","12035","Flagler","Florida","United States",2020-04-01 15:58:49,29.45933576,-81.31508595,20,0,0,20,"Flagler, Florida, United States"
"04-01-2020","30029","Flathead","Montana","United States",2020-04-01 15:58:49,48.29575866,-114.0520569,14,0,0,14,"Flathead, Montana, United States"
"04-01-2020","45041","Florence","South Carolina","United States",2020-04-01 15:58:49,34.02361754,-79.70189312,21,3,0,18,"Florence, South Carolina, United States"
"04-01-2020","13115","Floyd","Georgia","United States",2020-04-01 15:58:49,34.26268279,-85.21577392,60,2,0,58,"Floyd, Georgia, United States"
"04-01-2020","18043","Floyd","Indiana","United States",2020-04-01 15:58:49,38.32117957,-85.90385377,21,0,0,21,"Floyd, Indiana, United States"
"04-01-2020","51065","Fluvanna","Virginia","United States",2020-04-01 15:58:49,37.84157909,-78.27715475,3,0,0,3,"Fluvanna, Virginia, United States"
"04-01-2020","55039","Fond du Lac","Wisconsin","United States",2020-04-01 15:58:49,43.75354908,-88.48885325,24,2,0,22,"Fond du Lac, Wisconsin, United States"
"04-01-2020","17053","Ford","Illinois","United States",2020-04-01 15:58:49,40.59706922,-88.22350769,1,0,0,1,"Ford, Illinois, United States"
"04-01-2020","20057","Ford","Kansas","United States",2020-04-01 15:58:49,37.69200114,-99.88825298,0,0,0,0,"Ford, Kansas, United States"
"04-01-2020","28035","Forrest","Mississippi","United States",2020-04-01 15:58:49,31.18961454,-89.25832496,27,0,0,27,"Forrest, Mississippi, United States"
"04-01-2020","13117","Forsyth","Georgia","United States",2020-04-01 15:58:49,34.22604035,-84.1231513,48,1,0,47,"Forsyth, Georgia, United States"
"04-01-2020","37067","Forsyth","North Carolina","United States",2020-04-01 15:58:49,36.12859861,-80.25459052,57,1,0,56,"Forsyth, North Carolina, United States"
"04-01-2020","48157","Fort Bend","Texas","United States",2020-04-01 15:58:49,29.52704478,-95.77219463,163,2,0,161,"Fort Bend, Texas, United States"
"04-01-2020","38031","Foster","North Dakota","United States",2020-04-01 15:58:49,47.4571084,-98.88279923,1,0,0,1,"Foster, North Dakota, United States"
"04-01-2020","18045","Fountain","Indiana","United States",2020-04-01 15:58:49,40.12361933,-87.24217689,1,0,0,1,"Fountain, Indiana, United States"
"04-01-2020","01059","Franklin","Alabama","United States",2020-04-01 15:58:49,34.44235334,-87.84289505,3,0,0,3,"Franklin, Alabama, United States"
"04-01-2020","13119","Franklin","Georgia","United States",2020-04-01 15:58:49,34.37525597,-83.23159927,5,0,0,5,"Franklin, Georgia, United States"
"04-01-2020","17055","Franklin","Illinois","United States",2020-04-01 15:58:49,37.99189086,-88.92567818,1,0,0,1,"Franklin, Illinois, United States"
"04-01-2020","18047","Franklin","Indiana","United States",2020-04-01 15:58:49,39.4142482,-85.06062647,39,5,0,34,"Franklin, Indiana, United States"
"04-01-2020","20059","Franklin","Kansas","United States",2020-04-01 15:58:49,38.56443815,-95.28644341,7,0,0,7,"Franklin, Kansas, United States"
"04-01-2020","21073","Franklin","Kentucky","United States",2020-04-01 15:58:49,38.2379395,-84.87962551,6,0,0,6,"Franklin, Kentucky, United States"
"04-01-2020","22041","Franklin","Louisiana","United States",2020-04-01 15:58:49,32.13675181,-91.67589857,5,0,0,5,"Franklin, Louisiana, United States"
"04-01-2020","23007","Franklin","Maine","United States",2020-04-01 15:58:49,44.97330019,-70.44381045,2,0,0,2,"Franklin, Maine, United States"
"04-01-2020","25011","Franklin","Massachusetts","United States",2020-04-01 15:58:49,42.58119713,-72.58602547,72,7,0,65,"Franklin, Massachusetts, United States"
"04-01-2020","28037","Franklin","Mississippi","United States",2020-04-01 15:58:49,31.47786634,-90.89672989,3,0,0,3,"Franklin, Mississippi, United States"
"04-01-2020","29071","Franklin","Missouri","United States",2020-04-01 15:58:49,38.41127108,-91.07522826,16,0,0,16,"Franklin, Missouri, United States"
"04-01-2020","36033","Franklin","New York","United States",2020-04-01 15:58:49,44.59040891,-74.29926032,9,0,0,9,"Franklin, New York, United States"
"04-01-2020","37069","Franklin","North Carolina","United States",2020-04-01 15:58:49,36.081519,-78.28708884,11,0,0,11,"Franklin, North Carolina, United States"
"04-01-2020","39049","Franklin","Ohio","United States",2020-04-01 15:58:49,39.96995815,-83.01115755,391,4,0,387,"Franklin, Ohio, United States"
"04-01-2020","42055","Franklin","Pennsylvania","United States",2020-04-01 15:58:49,39.92956518,-77.72157791,21,0,0,21,"Franklin, Pennsylvania, United States"
"04-01-2020","47051","Franklin","Tennessee","United States",2020-04-01 15:58:49,35.15634626,-86.09201039,7,0,0,7,"Franklin, Tennessee, United States"
"04-01-2020","48159","Franklin","Texas","United States",2020-04-01 15:58:49,33.17653242,-95.21917243,1,0,0,1,"Franklin, Texas, United States"
"04-01-2020","50011","Franklin","Vermont","United States",2020-04-01 15:58:49,44.85627605,-72.91249563,15,0,0,15,"Franklin, Vermont, United States"
