"Date_Published","FIPS","Admin2","Province_State","Country_Region","Last_Update","Latitude","Longitude","Confirmed","Deaths","Recovered","Active","Combined_Key"
"04-04-2020","28115","Pontotoc","Mississippi","United States",2020-04-04 23:34:00,34.226046,-89.03636807,12,1,0,11,"Pontotoc, Mississippi, United States"
"04-04-2020","40123","Pontotoc","Oklahoma","United States",2020-04-04 23:34:00,34.72959848,-96.68337199,7,0,0,7,"Pontotoc, Oklahoma, United States"
"04-04-2020","05115","Pope","Arkansas","United States",2020-04-04 23:34:00,35.44871474,-93.03212219,8,0,0,8,"Pope, Arkansas, United States"
"04-04-2020","51735","Poquoson","Virginia","United States",2020-04-04 23:34:00,37.14259351,-76.35798148,3,0,0,3,"Poquoson, Virginia, United States"
"04-04-2020","39133","Portage","Ohio","United States",2020-04-04 23:34:00,41.16793482,-81.19735782,74,3,0,71,"Portage, Ohio, United States"
"04-04-2020","55097","Portage","Wisconsin","United States",2020-04-04 23:34:00,44.47558711,-89.50152965,3,0,0,3,"Portage, Wisconsin, United States"
"04-04-2020","18127","Porter","Indiana","United States",2020-04-04 23:34:00,41.45986947,-87.06848888,51,0,0,51,"Porter, Indiana, United States"
"04-04-2020","51740","Portsmouth","Virginia","United States",2020-04-04 23:34:00,36.85914825,-76.35971629,26,0,0,26,"Portsmouth, Virginia, United States"
"04-04-2020","18129","Posey","Indiana","United States",2020-04-04 23:34:00,38.02097333,-87.86480429,5,0,0,5,"Posey, Indiana, United States"
"04-04-2020","20149","Pottawatomie","Kansas","United States",2020-04-04 23:34:00,39.37925655,-96.34564657,2,0,0,2,"Pottawatomie, Kansas, United States"
"04-04-2020","40125","Pottawatomie","Oklahoma","United States",2020-04-04 23:34:00,35.20614018,-96.94923008,11,0,0,11,"Pottawatomie, Oklahoma, United States"
"04-04-2020","19155","Pottawattamie","Iowa","United States",2020-04-04 23:34:00,41.33640314,-95.53907776,8,0,0,8,"Pottawattamie, Iowa, United States"
"04-04-2020","42105","Potter","Pennsylvania","United States",2020-04-04 23:34:00,41.74471626,-77.89559864,3,0,0,3,"Potter, Pennsylvania, United States"
"04-04-2020","48375","Potter","Texas","United States",2020-04-04 23:34:00,35.40133773,-101.893964,24,0,0,24,"Potter, Texas, United States"
"04-04-2020","21197","Powell","Kentucky","United States",2020-04-04 23:34:00,37.83218794,-83.82553961,1,0,0,1,"Powell, Kentucky, United States"
"04-04-2020","19157","Poweshiek","Iowa","United States",2020-04-04 23:34:00,41.68625425,-92.53155731,6,1,0,5,"Poweshiek, Iowa, United States"
"04-04-2020","51145","Powhatan","Virginia","United States",2020-04-04 23:34:00,37.55016038,-77.91267882,4,0,0,4,"Powhatan, Virginia, United States"
"04-04-2020","05117","Prairie","Arkansas","United States",2020-04-04 23:34:00,34.83624419,-91.55162157,1,0,0,1,"Prairie, Arkansas, United States"
"04-04-2020","20151","Pratt","Kansas","United States",2020-04-04 23:34:00,37.64780729,-98.73922153,1,0,0,1,"Pratt, Kansas, United States"
"04-04-2020","39135","Preble","Ohio","United States",2020-04-04 23:34:00,39.7420247,-84.64787018,4,0,0,4,"Preble, Ohio, United States"
"04-04-2020","28117","Prentiss","Mississippi","United States",2020-04-04 23:34:00,34.61810501,-88.51986294,9,0,0,9,"Prentiss, Mississippi, United States"
"04-04-2020","54077","Preston","West Virginia","United States",2020-04-04 23:34:00,39.46770987,-79.66712803,5,0,0,5,"Preston, West Virginia, United States"
"04-04-2020","51147","Prince Edward","Virginia","United States",2020-04-04 23:34:00,37.22554789,-78.43597949,3,0,0,3,"Prince Edward, Virginia, United States"
"04-04-2020","51149","Prince George","Virginia","United States",2020-04-04 23:34:00,37.18497668,-77.22922187,16,0,0,16,"Prince George, Virginia, United States"
"04-04-2020","24033","Prince George's","Maryland","United States",2020-04-04 23:34:00,38.83070039,-76.8496441,653,13,0,640,"Prince George's, Maryland, United States"
"04-04-2020","51153","Prince William","Virginia","United States",2020-04-04 23:34:00,38.70916224,-77.48713689,159,1,0,158,"Prince William, Virginia, United States"
"04-04-2020","44007","Providence","Rhode Island","United States",2020-04-04 23:34:00,41.87064746,-71.57753536,418,3,0,415,"Providence, Rhode Island, United States"
"04-04-2020","08101","Pueblo","Colorado","United States",2020-04-04 23:34:00,38.17359144,-104.5127437,31,2,0,29,"Pueblo, Colorado, United States"
"04-04-2020","05119","Pulaski","Arkansas","United States",2020-04-04 23:34:00,34.77054088,-92.31355101,137,2,0,135,"Pulaski, Arkansas, United States"
"04-04-2020","13235","Pulaski","Georgia","United States",2020-04-04 23:34:00,32.23334561,-83.4754996,7,0,0,7,"Pulaski, Georgia, United States"
"04-04-2020","21199","Pulaski","Kentucky","United States",2020-04-04 23:34:00,37.10466131,-84.57629079,12,1,0,11,"Pulaski, Kentucky, United States"
"04-04-2020","29169","Pulaski","Missouri","United States",2020-04-04 23:34:00,37.82462075,-92.20783203,10,0,0,10,"Pulaski, Missouri, United States"
"04-04-2020","51155","Pulaski","Virginia","United States",2020-04-04 23:34:00,37.06474963,-80.71229738,1,0,0,1,"Pulaski, Virginia, United States"
"04-04-2020","12107","Putnam","Florida","United States",2020-04-04 23:34:00,29.60779729,-81.74230285,18,1,0,17,"Putnam, Florida, United States"
"04-04-2020","13237","Putnam","Georgia","United States",2020-04-04 23:34:00,33.32056115,-83.37552891,2,0,0,2,"Putnam, Georgia, United States"
"04-04-2020","18133","Putnam","Indiana","United States",2020-04-04 23:34:00,39.66437981,-86.84517605,14,1,0,13,"Putnam, Indiana, United States"
"04-04-2020","36079","Putnam","New York","United States",2020-04-04 23:34:00,41.42630093,-73.74965532,283,7,0,276,"Putnam, New York, United States"
"04-04-2020","47141","Putnam","Tennessee","United States",2020-04-04 23:34:00,36.14005459,-85.50646123,52,0,0,52,"Putnam, Tennessee, United States"
"04-04-2020","54079","Putnam","West Virginia","United States",2020-04-04 23:34:00,38.50782345,-81.9082131,5,0,0,5,"Putnam, West Virginia, United States"
"04-04-2020","24035","Queen Anne's","Maryland","United States",2020-04-04 23:34:00,39.06198912,-76.03530977,13,0,0,13,"Queen Anne's, Maryland, United States"
"04-04-2020","13239","Quitman","Georgia","United States",2020-04-04 23:34:00,31.86728114,-85.01773177,1,0,0,1,"Quitman, Georgia, United States"
"04-04-2020","28119","Quitman","Mississippi","United States",2020-04-04 23:34:00,34.25157572,-90.28908,5,0,0,5,"Quitman, Mississippi, United States"
"04-04-2020","13241","Rabun","Georgia","United States",2020-04-04 23:34:00,34.88389445,-83.40304637,2,0,0,2,"Rabun, Georgia, United States"
"04-04-2020","55101","Racine","Wisconsin","United States",2020-04-04 23:34:00,42.74753117,-88.05941254,41,0,0,41,"Racine, Wisconsin, United States"
"04-04-2020","51750","Radford","Virginia","United States",2020-04-04 23:34:00,37.12222899,-80.5602732,1,0,0,1,"Radford, Virginia, United States"
"04-04-2020","54081","Raleigh","West Virginia","United States",2020-04-04 23:34:00,37.76936795,-81.2456041,4,0,0,4,"Raleigh, West Virginia, United States"
"04-04-2020","29173","Ralls","Missouri","United States",2020-04-04 23:34:00,39.52817427,-91.51838643,1,0,0,1,"Ralls, Missouri, United States"
"04-04-2020","27123","Ramsey","Minnesota","United States",2020-04-04 23:34:00,45.01625271,-93.09872295,79,2,0,77,"Ramsey, Minnesota, United States"
"04-04-2020","38071","Ramsey","North Dakota","United States",2020-04-04 23:34:00,48.26886249,-98.72223879,3,0,0,3,"Ramsey, North Dakota, United States"
"04-04-2020","48381","Randall","Texas","United States",2020-04-04 23:34:00,34.96585996,-101.8971322,24,0,0,24,"Randall, Texas, United States"
"04-04-2020","01111","Randolph","Alabama","United States",2020-04-04 23:34:00,33.29526734,-85.45708831,11,1,0,10,"Randolph, Alabama, United States"
"04-04-2020","05121","Randolph","Arkansas","United States",2020-04-04 23:34:00,36.3415714,-91.02455531,1,0,0,1,"Randolph, Arkansas, United States"
"04-04-2020","13243","Randolph","Georgia","United States",2020-04-04 23:34:00,31.76622818,-84.75732369,16,0,0,16,"Randolph, Georgia, United States"
"04-04-2020","17157","Randolph","Illinois","United States",2020-04-04 23:34:00,38.05095369,-89.82512254,20,0,0,20,"Randolph, Illinois, United States"
"04-04-2020","18135","Randolph","Indiana","United States",2020-04-04 23:34:00,40.15734772,-85.01139319,5,1,0,4,"Randolph, Indiana, United States"
"04-04-2020","29175","Randolph","Missouri","United States",2020-04-04 23:34:00,39.44007257,-92.4971374,7,0,0,7,"Randolph, Missouri, United States"
"04-04-2020","37151","Randolph","North Carolina","United States",2020-04-04 23:34:00,35.71015088,-79.80570339,26,1,0,25,"Randolph, North Carolina, United States"
"04-04-2020","54083","Randolph","West Virginia","United States",2020-04-04 23:34:00,38.769899,-79.87919615,3,0,0,3,"Randolph, West Virginia, United States"
"04-04-2020","28121","Rankin","Mississippi","United States",2020-04-04 23:34:00,32.26469147,-89.94537876,66,1,0,65,"Rankin, Mississippi, United States"
"04-04-2020","22079","Rapides","Louisiana","United States",2020-04-04 23:34:00,31.19778499,-92.52997303,97,4,0,93,"Rapides, Louisiana, United States"
"04-04-2020","30081","Ravalli","Montana","United States",2020-04-04 23:34:00,46.08520862,-114.1189164,2,0,0,2,"Ravalli, Montana, United States"
"04-04-2020","29177","Ray","Missouri","United States",2020-04-04 23:34:00,39.3537468,-93.98905745,3,0,0,3,"Ray, Missouri, United States"
"04-04-2020","22081","Red River","Louisiana","United States",2020-04-04 23:34:00,32.09530039,-93.34213308,2,0,0,2,"Red River, Louisiana, United States"
"04-04-2020","48389","Reeves","Texas","United States",2020-04-04 23:34:00,31.32323325,-103.6903896,1,0,0,1,"Reeves, Texas, United States"
"04-04-2020","20155","Reno","Kansas","United States",2020-04-04 23:34:00,37.95230263,-98.08607292,9,0,0,9,"Reno, Kansas, United States"
"04-04-2020","36083","Rensselaer","New York","United States",2020-04-04 23:34:00,42.71348136,-73.51089874,67,0,0,67,"Rensselaer, New York, United States"
"04-04-2020","27129","Renville","Minnesota","United States",2020-04-04 23:34:00,44.72836381,-94.94553734,2,0,0,2,"Renville, Minnesota, United States"
"04-04-2020","29179","Reynolds","Missouri","United States",2020-04-04 23:34:00,37.36085952,-90.97009925,2,0,0,2,"Reynolds, Missouri, United States"
"04-04-2020","27131","Rice","Minnesota","United States",2020-04-04 23:34:00,44.3543376,-93.29658715,4,0,0,4,"Rice, Minnesota, United States"
"04-04-2020","22083","Richland","Louisiana","United States",2020-04-04 23:34:00,32.41391005,-91.76634876,9,0,0,9,"Richland, Louisiana, United States"
"04-04-2020","39139","Richland","Ohio","United States",2020-04-04 23:34:00,40.77180308,-82.5379961,14,0,0,14,"Richland, Ohio, United States"
"04-04-2020","45079","Richland","South Carolina","United States",2020-04-04 23:34:00,34.01791263,-80.90267209,242,6,0,236,"Richland, South Carolina, United States"
"04-04-2020","55103","Richland","Wisconsin","United States",2020-04-04 23:34:00,43.3762778,-90.43012729,2,0,0,2,"Richland, Wisconsin, United States"
"04-04-2020","13245","Richmond","Georgia","United States",2020-04-04 23:34:00,33.35777107,-82.07026432,51,1,0,50,"Richmond, Georgia, United States"
"04-04-2020","51760","Richmond City","Virginia","United States",2020-04-04 23:34:00,37.53255773,-77.47966921,96,0,0,96,"Richmond City, Virginia, United States"
"04-04-2020","20161","Riley","Kansas","United States",2020-04-04 23:34:00,39.28935726,-96.73420026,11,0,0,11,"Riley, Kansas, United States"
"04-04-2020","35039","Rio Arriba","New Mexico","United States",2020-04-04 23:34:00,36.51072137,-106.6931674,5,0,0,5,"Rio Arriba, New Mexico, United States"
"04-04-2020","08103","Rio Blanco","Colorado","United States",2020-04-04 23:34:00,39.97913541,-108.2179009,1,0,0,1,"Rio Blanco, Colorado, United States"
"04-04-2020","08105","Rio Grande","Colorado","United States",2020-04-04 23:34:00,37.5836865,-106.3847838,5,0,0,5,"Rio Grande, Colorado, United States"
"04-04-2020","18137","Ripley","Indiana","United States",2020-04-04 23:34:00,39.10235626,-85.26212744,51,2,0,49,"Ripley, Indiana, United States"
"04-04-2020","29181","Ripley","Missouri","United States",2020-04-04 23:34:00,36.65460667,-90.85990261,2,0,0,2,"Ripley, Missouri, United States"
"04-04-2020","06065","Riverside","California","United States",2020-04-04 23:34:00,33.74314981,-115.9933578,638,15,0,623,"Riverside, California, United States"
"04-04-2020","47145","Roane","Tennessee","United States",2020-04-04 23:34:00,35.84923189,-84.52458689,5,0,0,5,"Roane, Tennessee, United States"
"04-04-2020","54087","Roane","West Virginia","United States",2020-04-04 23:34:00,38.71622686,-81.35243568,2,0,0,2,"Roane, West Virginia, United States"
"04-04-2020","51161","Roanoke","Virginia","United States",2020-04-04 23:34:00,37.26865804,-80.06396753,5,0,0,5,"Roanoke, Virginia, United States"
"04-04-2020","51770","Roanoke City","Virginia","United States",2020-04-04 23:34:00,37.27791025,-79.96189766,10,0,0,10,"Roanoke City, Virginia, United States"
"04-04-2020","46109","Roberts","South Dakota","United States",2020-04-04 23:34:00,45.62975048,-96.94672673,4,0,0,4,"Roberts, South Dakota, United States"
"04-04-2020","47147","Robertson","Tennessee","United States",2020-04-04 23:34:00,36.52454807,-86.87346725,51,0,0,51,"Robertson, Tennessee, United States"
"04-04-2020","48395","Robertson","Texas","United States",2020-04-04 23:34:00,31.02539637,-96.51272246,2,0,0,2,"Robertson, Texas, United States"
"04-04-2020","37155","Robeson","North Carolina","United States",2020-04-04 23:34:00,34.64244496,-79.1025053,5,0,0,5,"Robeson, North Carolina, United States"
"04-04-2020","55105","Rock","Wisconsin","United States",2020-04-04 23:34:00,42.67151616,-89.071479,20,1,0,19,"Rock, Wisconsin, United States"
"04-04-2020","17161","Rock Island","Illinois","United States",2020-04-04 23:34:00,41.46613806,-90.57042164,29,0,0,29,"Rock Island, Illinois, United States"
"04-04-2020","51163","Rockbridge","Virginia","United States",2020-04-04 23:34:00,37.81204314,-79.44605905,3,0,0,3,"Rockbridge, Virginia, United States"
"04-04-2020","21203","Rockcastle","Kentucky","United States",2020-04-04 23:34:00,37.36642393,-84.31176452,1,0,0,1,"Rockcastle, Kentucky, United States"
"04-04-2020","13247","Rockdale","Georgia","United States",2020-04-04 23:34:00,33.65145002,-84.02202167,70,2,0,68,"Rockdale, Georgia, United States"
"04-04-2020","33015","Rockingham","New Hampshire","United States",2020-04-04 23:34:00,42.98499744,-71.12883377,190,1,0,189,"Rockingham, New Hampshire, United States"
"04-04-2020","37157","Rockingham","North Carolina","United States",2020-04-04 23:34:00,36.39593137,-79.77504841,5,1,0,4,"Rockingham, North Carolina, United States"
"04-04-2020","51165","Rockingham","Virginia","United States",2020-04-04 23:34:00,38.51006137,-78.87260325,15,0,0,15,"Rockingham, Virginia, United States"
"04-04-2020","36087","Rockland","New York","United States",2020-04-04 23:34:00,41.15027894,-74.02560498,4872,69,0,4803,"Rockland, New York, United States"
"04-04-2020","48397","Rockwall","Texas","United States",2020-04-04 23:34:00,32.89779518,-96.40771592,11,0,0,11,"Rockwall, Texas, United States"
"04-04-2020","40131","Rogers","Oklahoma","United States",2020-04-04 23:34:00,36.37004357,-95.60406759,12,0,0,12,"Rogers, Oklahoma, United States"
"04-04-2020","30085","Roosevelt","Montana","United States",2020-04-04 23:34:00,48.29607488,-105.0079268,1,0,0,1,"Roosevelt, Montana, United States"
"04-04-2020","35041","Roosevelt","New Mexico","United States",2020-04-04 23:34:00,34.02097406,-103.4799493,1,0,0,1,"Roosevelt, New Mexico, United States"
"04-04-2020","26143","Roscommon","Michigan","United States",2020-04-04 23:34:00,44.33473082,-84.61067651,2,0,0,2,"Roscommon, Michigan, United States"
"04-04-2020","39141","Ross","Ohio","United States",2020-04-04 23:34:00,39.33705391,-83.06000914,4,0,0,4,"Ross, Ohio, United States"
"04-04-2020","08107","Routt","Colorado","United States",2020-04-04 23:34:00,40.48596505,-106.9905548,28,0,0,28,"Routt, Colorado, United States"
"04-04-2020","37159","Rowan","North Carolina","United States",2020-04-04 23:34:00,35.64003916,-80.52446628,44,1,0,43,"Rowan, North Carolina, United States"
"04-04-2020","18139","Rush","Indiana","United States",2020-04-04 23:34:00,39.62002287,-85.4655599,10,1,0,9,"Rush, Indiana, United States"
"04-04-2020","48401","Rusk","Texas","United States",2020-04-04 23:34:00,32.10773545,-94.76176432,11,0,0,11,"Rusk, Texas, United States"
"04-04-2020","55107","Rusk","Wisconsin","United States",2020-04-04 23:34:00,45.47498854,-91.1333012,1,0,0,1,"Rusk, Wisconsin, United States"
"04-04-2020","01113","Russell","Alabama","United States",2020-04-04 23:34:00,32.28725256,-85.18415324,4,0,0,4,"Russell, Alabama, United States"
"04-04-2020","21207","Russell","Kentucky","United States",2020-04-04 23:34:00,36.99308373,-85.06070117,1,0,0,1,"Russell, Kentucky, United States"
"04-04-2020","37161","Rutherford","North Carolina","United States",2020-04-04 23:34:00,35.40114178,-81.92112099,12,0,0,12,"Rutherford, North Carolina, United States"
"04-04-2020","47149","Rutherford","Tennessee","United States",2020-04-04 23:34:00,35.84591405,-86.4107263,140,3,0,137,"Rutherford, Tennessee, United States"
"04-04-2020","50021","Rutland","Vermont","United States",2020-04-04 23:34:00,43.57723578,-73.03741676,24,0,0,24,"Rutland, Vermont, United States"
"04-04-2020","22085","Sabine","Louisiana","United States",2020-04-04 23:34:00,31.56388699,-93.55433981,4,0,0,4,"Sabine, Louisiana, United States"
"04-04-2020","06067","Sacramento","California","United States",2020-04-04 23:34:00,38.45106826,-121.3425374,390,10,0,380,"Sacramento, California, United States"
"04-04-2020","23023","Sagadahoc","Maine","United States",2020-04-04 23:34:00,43.95415864,-69.85074999,13,0,0,13,"Sagadahoc, Maine, United States"
"04-04-2020","26145","Saginaw","Michigan","United States",2020-04-04 23:34:00,43.33433923,-84.0513121,103,0,0,103,"Saginaw, Michigan, United States"
"04-04-2020","08109","Saguache","Colorado","United States",2020-04-04 23:34:00,38.08054629,-106.282466,3,0,0,3,"Saguache, Colorado, United States"
"04-04-2020","34033","Salem","New Jersey","United States",2020-04-04 23:34:00,39.58719656,-75.3469663,25,2,0,23,"Salem, New Jersey, United States"
"04-04-2020","51775","Salem","Virginia","United States",2020-04-04 23:34:00,37.2836193,-80.06219455,1,0,0,1,"Salem, Virginia, United States"
"04-04-2020","05125","Saline","Arkansas","United States",2020-04-04 23:34:00,34.64916145,-92.67583224,21,0,0,21,"Saline, Arkansas, United States"
"04-04-2020","17165","Saline","Illinois","United States",2020-04-04 23:34:00,37.75332999,-88.54119706,1,0,0,1,"Saline, Illinois, United States"
"04-04-2020","20169","Saline","Kansas","United States",2020-04-04 23:34:00,38.78369175,-97.65185177,5,0,0,5,"Saline, Kansas, United States"
"04-04-2020","29195","Saline","Missouri","United States",2020-04-04 23:34:00,39.13734288,-93.20259964,2,0,0,2,"Saline, Missouri, United States"
"04-04-2020","49035","Salt Lake","Utah","United States",2020-04-04 23:34:00,40.66616532,-111.9216011,650,4,0,646,"Salt Lake, Utah, United States"
"04-04-2020","45081","Saluda","South Carolina","United States",2020-04-04 23:34:00,34.00795823,-81.72713237,4,0,0,4,"Saluda, South Carolina, United States"
"04-04-2020","37163","Sampson","North Carolina","United States",2020-04-04 23:34:00,34.98820368,-78.36914061,2,0,0,2,"Sampson, North Carolina, United States"
"04-04-2020","48405","San Augustine","Texas","United States",2020-04-04 23:34:00,31.39457611,-94.17000399,4,1,0,3,"San Augustine, Texas, United States"
"04-04-2020","06069","San Benito","California","United States",2020-04-04 23:34:00,36.60308176,-121.069975,23,2,0,21,"San Benito, California, United States"
"04-04-2020","06071","San Bernardino","California","United States",2020-04-04 23:34:00,34.84060306,-116.1774685,353,13,0,340,"San Bernardino, California, United States"
"04-04-2020","06073","San Diego","California","United States",2020-04-04 23:34:00,33.03484597,-116.7365326,1112,17,0,1095,"San Diego, California, United States"
"04-04-2020","06075","San Francisco","California","United States",2020-04-04 23:34:00,37.75215114,-122.4385672,529,8,0,521,"San Francisco, California, United States"
"04-04-2020","48407","San Jacinto","Texas","United States",2020-04-04 23:34:00,30.57933681,-95.16260304,1,0,0,1,"San Jacinto, Texas, United States"
"04-04-2020","06077","San Joaquin","California","United States",2020-04-04 23:34:00,37.93433732,-121.2730061,185,11,0,174,"San Joaquin, California, United States"
"04-04-2020","35045","San Juan","New Mexico","United States",2020-04-04 23:34:00,36.50838318,-108.320437,72,0,0,72,"San Juan, New Mexico, United States"
"04-04-2020","49037","San Juan","Utah","United States",2020-04-04 23:34:00,37.62762978,-109.8033714,12,0,0,12,"San Juan, Utah, United States"
"04-04-2020","53055","San Juan","Washington","United States",2020-04-04 23:34:00,48.60182783,-122.96745,6,0,0,6,"San Juan, Washington, United States"
"04-04-2020","06079","San Luis Obispo","California","United States",2020-04-04 23:34:00,35.38822029,-120.4039028,93,0,0,93,"San Luis Obispo, California, United States"
"04-04-2020","06081","San Mateo","California","United States",2020-04-04 23:34:00,37.4228808,-122.3275546,538,13,0,525,"San Mateo, California, United States"
"04-04-2020","08113","San Miguel","Colorado","United States",2020-04-04 23:34:00,38.00450883,-108.4020725,9,0,0,9,"San Miguel, Colorado, United States"
"04-04-2020","35047","San Miguel","New Mexico","United States",2020-04-04 23:34:00,35.48014807,-104.8163562,1,0,0,1,"San Miguel, New Mexico, United States"
"04-04-2020","48409","San Patricio","Texas","United States",2020-04-04 23:34:00,28.00880118,-97.51763891,4,0,0,4,"San Patricio, Texas, United States"
"04-04-2020","35043","Sandoval","New Mexico","United States",2020-04-04 23:34:00,35.68862401,-106.8687803,66,2,0,64,"Sandoval, New Mexico, United States"
"04-04-2020","39143","Sandusky","Ohio","United States",2020-04-04 23:34:00,41.35624126,-83.137872,5,0,0,5,"Sandusky, Ohio, United States"
"04-04-2020","17167","Sangamon","Illinois","United States",2020-04-04 23:34:00,39.75836914,-89.65872023,25,2,0,23,"Sangamon, Illinois, United States"
"04-04-2020","26151","Sanilac","Michigan","United States",2020-04-04 23:34:00,43.42406072,-82.82055898,13,1,0,12,"Sanilac, Michigan, United States"
"04-04-2020","06083","Santa Barbara","California","United States",2020-04-04 23:34:00,34.65329488,-120.0188492,152,1,0,151,"Santa Barbara, California, United States"
"04-04-2020","06085","Santa Clara","California","United States",2020-04-04 23:34:00,37.23104908,-121.6970462,1148,39,0,1109,"Santa Clara, California, United States"
"04-04-2020","04023","Santa Cruz","Arizona","United States",2020-04-04 23:34:00,31.52508998,-110.8479088,4,0,0,4,"Santa Cruz, Arizona, United States"
"04-04-2020","06087","Santa Cruz","California","United States",2020-04-04 23:34:00,37.05580291,-122.0066524,59,1,0,58,"Santa Cruz, California, United States"
"04-04-2020","35049","Santa Fe","New Mexico","United States",2020-04-04 23:34:00,35.50708973,-105.9774716,52,0,0,52,"Santa Fe, New Mexico, United States"
"04-04-2020","12113","Santa Rosa","Florida","United States",2020-04-04 23:34:00,30.6934145,-87.02458128,50,2,0,48,"Santa Rosa, Florida, United States"
"04-04-2020","12115","Sarasota","Florida","United States",2020-04-04 23:34:00,27.18546175,-82.33174248,129,7,0,122,"Sarasota, Florida, United States"
"04-04-2020","36091","Saratoga","New York","United States",2020-04-04 23:34:00,43.10904162,-73.86653895,141,1,0,140,"Saratoga, New York, United States"
"04-04-2020","31153","Sarpy","Nebraska","United States",2020-04-04 23:34:00,41.11314181,-96.11156432,26,0,0,26,"Sarpy, Nebraska, United States"
"04-04-2020","55111","Sauk","Wisconsin","United States",2020-04-04 23:34:00,43.42574087,-89.94966132,18,2,0,16,"Sauk, Wisconsin, United States"
"04-04-2020","31155","Saunders","Nebraska","United States",2020-04-04 23:34:00,41.2278103,-96.63773905,4,0,0,4,"Saunders, Nebraska, United States"
"04-04-2020","36093","Schenectady","New York","United States",2020-04-04 23:34:00,42.81668777,-74.05278291,117,5,0,112,"Schenectady, New York, United States"
"04-04-2020","13249","Schley","Georgia","United States",2020-04-04 23:34:00,32.2654021,-84.31258912,6,0,0,6,"Schley, Georgia, United States"
"04-04-2020","36095","Schoharie","New York","United States",2020-04-04 23:34:00,42.58831742,-74.4433903,11,0,0,11,"Schoharie, New York, United States"
"04-04-2020","36097","Schuyler","New York","United States",2020-04-04 23:34:00,42.39184015,-76.8773299,4,0,0,4,"Schuyler, New York, United States"
"04-04-2020","42107","Schuylkill","Pennsylvania","United States",2020-04-04 23:34:00,40.70497338,-76.2150785,77,0,0,77,"Schuylkill, Pennsylvania, United States"
"04-04-2020","37165","Scotland","North Carolina","United States",2020-04-04 23:34:00,34.8386299,-79.4757978,2,0,0,2,"Scotland, North Carolina, United States"
"04-04-2020","05127","Scott","Arkansas","United States",2020-04-04 23:34:00,34.85588887,-94.0632176,1,0,0,1,"Scott, Arkansas, United States"
"04-04-2020","18143","Scott","Indiana","United States",2020-04-04 23:34:00,38.68672078,-85.74627859,7,1,0,6,"Scott, Indiana, United States"
"04-04-2020","19163","Scott","Iowa","United States",2020-04-04 23:34:00,41.63935978,-90.61959493,38,0,0,38,"Scott, Iowa, United States"
"04-04-2020","21209","Scott","Kentucky","United States",2020-04-04 23:34:00,38.29622293,-84.5816631,12,0,0,12,"Scott, Kentucky, United States"
"04-04-2020","27139","Scott","Minnesota","United States",2020-04-04 23:34:00,44.6490231,-93.53340251,12,1,0,11,"Scott, Minnesota, United States"
"04-04-2020","28123","Scott","Mississippi","United States",2020-04-04 23:34:00,32.4067041,-89.53789439,17,0,0,17,"Scott, Mississippi, United States"
"04-04-2020","29201","Scott","Missouri","United States",2020-04-04 23:34:00,37.05588075,-89.56474493,7,0,0,7,"Scott, Missouri, United States"
