"Date_Published","FIPS","Admin2","Province_State","Country_Region","Last_Update","Latitude","Longitude","Confirmed","Deaths","Recovered","Active","Combined_Key"
"04-04-2020","28083","Leflore","Mississippi","United States",2020-04-04 23:34:00,33.55545125,-90.29900733,22,1,0,21,"Leflore, Mississippi, United States"
"04-04-2020","42077","Lehigh","Pennsylvania","United States",2020-04-04 23:34:00,40.6154815,-75.59435245,804,7,0,797,"Lehigh, Pennsylvania, United States"
"04-04-2020","26091","Lenawee","Michigan","United States",2020-04-04 23:34:00,41.89475156,-84.06603727,27,0,0,27,"Lenawee, Michigan, United States"
"04-04-2020","37107","Lenoir","North Carolina","United States",2020-04-04 23:34:00,35.2403259,-77.64245615,7,0,0,7,"Lenoir, North Carolina, United States"
"04-04-2020","12073","Leon","Florida","United States",2020-04-04 23:34:00,30.45955727,-84.27491114,42,0,0,42,"Leon, Florida, United States"
"04-04-2020","48289","Leon","Texas","United States",2020-04-04 23:34:00,31.29872538,-95.9936328,2,0,0,2,"Leon, Texas, United States"
"04-04-2020","12075","Levy","Florida","United States",2020-04-04 23:34:00,29.31829741,-82.74007147,2,0,0,2,"Levy, Florida, United States"
"04-04-2020","16061","Lewis","Idaho","United States",2020-04-04 23:34:00,46.23315327,-116.434146,1,0,0,1,"Lewis, Idaho, United States"
"04-04-2020","21135","Lewis","Kentucky","United States",2020-04-04 23:34:00,38.53184419,-83.37735618,2,0,0,2,"Lewis, Kentucky, United States"
"04-04-2020","36049","Lewis","New York","United States",2020-04-04 23:34:00,43.7844157,-75.44903992,2,0,0,2,"Lewis, New York, United States"
"04-04-2020","47101","Lewis","Tennessee","United States",2020-04-04 23:34:00,35.52853208,-87.49022694,2,0,0,2,"Lewis, Tennessee, United States"
"04-04-2020","53041","Lewis","Washington","United States",2020-04-04 23:34:00,46.57756476,-122.3925769,13,0,0,13,"Lewis, Washington, United States"
"04-04-2020","30049","Lewis and Clark","Montana","United States",2020-04-04 23:34:00,47.12610041,-112.394698,13,0,0,13,"Lewis and Clark, Montana, United States"
"04-04-2020","45063","Lexington","South Carolina","United States",2020-04-04 23:34:00,33.89665987,-81.27146426,95,3,0,92,"Lexington, South Carolina, United States"
"04-04-2020","51678","Lexington","Virginia","United States",2020-04-04 23:34:00,37.78258621,-79.44262866,3,0,0,3,"Lexington, Virginia, United States"
"04-04-2020","13179","Liberty","Georgia","United States",2020-04-04 23:34:00,31.82588896,-81.49251135,9,0,0,9,"Liberty, Georgia, United States"
"04-04-2020","30051","Liberty","Montana","United States",2020-04-04 23:34:00,48.56084317,-111.024307,1,0,0,1,"Liberty, Montana, United States"
"04-04-2020","48291","Liberty","Texas","United States",2020-04-04 23:34:00,30.15152688,-94.81205615,5,0,0,5,"Liberty, Texas, United States"
"04-04-2020","39089","Licking","Ohio","United States",2020-04-04 23:34:00,40.09136236,-82.48185785,50,1,0,49,"Licking, Ohio, United States"
"04-04-2020","01083","Limestone","Alabama","United States",2020-04-04 23:34:00,34.81185586,-86.98310072,31,0,0,31,"Limestone, Alabama, United States"
"04-04-2020","48293","Limestone","Texas","United States",2020-04-04 23:34:00,31.5454767,-96.58095444,3,1,0,2,"Limestone, Texas, United States"
"04-04-2020","05079","Lincoln","Arkansas","United States",2020-04-04 23:34:00,33.95317155,-91.74002806,6,0,0,6,"Lincoln, Arkansas, United States"
"04-04-2020","08073","Lincoln","Colorado","United States",2020-04-04 23:34:00,38.98749519,-103.5136649,1,0,0,1,"Lincoln, Colorado, United States"
"04-04-2020","13181","Lincoln","Georgia","United States",2020-04-04 23:34:00,33.79201475,-82.45024131,5,0,0,5,"Lincoln, Georgia, United States"
"04-04-2020","16063","Lincoln","Idaho","United States",2020-04-04 23:34:00,43.0012336,-114.1358773,7,0,0,7,"Lincoln, Idaho, United States"
"04-04-2020","22061","Lincoln","Louisiana","United States",2020-04-04 23:34:00,32.6003154,-92.6659741,17,0,0,17,"Lincoln, Louisiana, United States"
"04-04-2020","23015","Lincoln","Maine","United States",2020-04-04 23:34:00,44.05996956,-69.54227124,8,0,0,8,"Lincoln, Maine, United States"
"04-04-2020","27081","Lincoln","Minnesota","United States",2020-04-04 23:34:00,44.41311883,-96.26688165,1,0,0,1,"Lincoln, Minnesota, United States"
"04-04-2020","28085","Lincoln","Mississippi","United States",2020-04-04 23:34:00,31.53288662,-90.45391915,14,0,0,14,"Lincoln, Mississippi, United States"
"04-04-2020","29113","Lincoln","Missouri","United States",2020-04-04 23:34:00,39.05345619,-90.95588181,16,0,0,16,"Lincoln, Missouri, United States"
"04-04-2020","30053","Lincoln","Montana","United States",2020-04-04 23:34:00,48.54265777,-115.4046155,6,1,0,5,"Lincoln, Montana, United States"
"04-04-2020","31111","Lincoln","Nebraska","United States",2020-04-04 23:34:00,41.04658298,-100.7475374,15,1,0,14,"Lincoln, Nebraska, United States"
"04-04-2020","37109","Lincoln","North Carolina","United States",2020-04-04 23:34:00,35.48508185,-81.21740317,9,0,0,9,"Lincoln, North Carolina, United States"
"04-04-2020","40081","Lincoln","Oklahoma","United States",2020-04-04 23:34:00,35.70270942,-96.8812462,7,0,0,7,"Lincoln, Oklahoma, United States"
"04-04-2020","41041","Lincoln","Oregon","United States",2020-04-04 23:34:00,44.64252874,-123.869912,4,0,0,4,"Lincoln, Oregon, United States"
"04-04-2020","46083","Lincoln","South Dakota","United States",2020-04-04 23:34:00,43.27841182,-96.7203905,21,0,0,21,"Lincoln, South Dakota, United States"
"04-04-2020","47103","Lincoln","Tennessee","United States",2020-04-04 23:34:00,35.13738622,-86.58910106,5,0,0,5,"Lincoln, Tennessee, United States"
"04-04-2020","53043","Lincoln","Washington","United States",2020-04-04 23:34:00,47.57705241,-118.4194388,1,0,0,1,"Lincoln, Washington, United States"
"04-04-2020","56023","Lincoln","Wyoming","United States",2020-04-04 23:34:00,42.26376367,-110.6563997,1,0,0,1,"Lincoln, Wyoming, United States"
"04-04-2020","19113","Linn","Iowa","United States",2020-04-04 23:34:00,42.07923082,-91.59809485,139,4,0,135,"Linn, Iowa, United States"
"04-04-2020","20107","Linn","Kansas","United States",2020-04-04 23:34:00,38.21267844,-94.84254089,5,0,0,5,"Linn, Kansas, United States"
"04-04-2020","41043","Linn","Oregon","United States",2020-04-04 23:34:00,44.48899494,-122.5373154,37,2,0,35,"Linn, Oregon, United States"
"04-04-2020","09005","Litchfield","Connecticut","United States",2020-04-04 23:34:00,41.7937534,-73.2451475,182,5,0,177,"Litchfield, Connecticut, United States"
"04-04-2020","48297","Live Oak","Texas","United States",2020-04-04 23:34:00,28.35101362,-98.1246786,3,0,0,3,"Live Oak, Texas, United States"
"04-04-2020","17105","Livingston","Illinois","United States",2020-04-04 23:34:00,40.89188292,-88.55784752,6,0,0,6,"Livingston, Illinois, United States"
"04-04-2020","22063","Livingston","Louisiana","United States",2020-04-04 23:34:00,30.44143993,-90.73061664,64,1,0,63,"Livingston, Louisiana, United States"
"04-04-2020","26093","Livingston","Michigan","United States",2020-04-04 23:34:00,42.60302282,-83.91297209,129,2,0,127,"Livingston, Michigan, United States"
"04-04-2020","29117","Livingston","Missouri","United States",2020-04-04 23:34:00,39.78110272,-93.54645978,1,0,0,1,"Livingston, Missouri, United States"
"04-04-2020","36051","Livingston","New York","United States",2020-04-04 23:34:00,42.72596275,-77.77966158,18,1,0,17,"Livingston, New York, United States"
"04-04-2020","48299","Llano","Texas","United States",2020-04-04 23:34:00,30.70645047,-98.68475262,3,0,0,3,"Llano, Texas, United States"
"04-04-2020","08075","Logan","Colorado","United States",2020-04-04 23:34:00,40.7249637,-103.110817,7,0,0,7,"Logan, Colorado, United States"
"04-04-2020","17107","Logan","Illinois","United States",2020-04-04 23:34:00,40.12581572,-89.36638784,1,0,0,1,"Logan, Illinois, United States"
"04-04-2020","21141","Logan","Kentucky","United States",2020-04-04 23:34:00,36.85949479,-86.877635,4,0,0,4,"Logan, Kentucky, United States"
"04-04-2020","39091","Logan","Ohio","United States",2020-04-04 23:34:00,40.38996525,-83.76784341,3,0,0,3,"Logan, Ohio, United States"
"04-04-2020","40083","Logan","Oklahoma","United States",2020-04-04 23:34:00,35.91899576,-97.44352845,6,0,0,6,"Logan, Oklahoma, United States"
"04-04-2020","54045","Logan","West Virginia","United States",2020-04-04 23:34:00,37.8299889,-81.93528571,5,0,0,5,"Logan, West Virginia, United States"
"04-04-2020","13183","Long","Georgia","United States",2020-04-04 23:34:00,31.75218791,-81.74952375,1,0,0,1,"Long, Georgia, United States"
"04-04-2020","05085","Lonoke","Arkansas","United States",2020-04-04 23:34:00,34.75392199,-91.88742357,16,0,0,16,"Lonoke, Arkansas, United States"
"04-04-2020","39093","Lorain","Ohio","United States",2020-04-04 23:34:00,41.29553751,-82.15083537,105,2,0,103,"Lorain, Ohio, United States"
"04-04-2020","06037","Los Angeles","California","United States",2020-04-04 23:34:00,34.30828379,-118.2282411,4605,93,0,4512,"Los Angeles, California, United States"
"04-04-2020","47105","Loudon","Tennessee","United States",2020-04-04 23:34:00,35.73939663,-84.31145275,13,0,0,13,"Loudon, Tennessee, United States"
"04-04-2020","51107","Loudoun","Virginia","United States",2020-04-04 23:34:00,39.08990083,-77.63481877,150,1,0,149,"Loudoun, Virginia, United States"
"04-04-2020","19115","Louisa","Iowa","United States",2020-04-04 23:34:00,41.21842119,-91.26102611,1,0,0,1,"Louisa, Iowa, United States"
"04-04-2020","51109","Louisa","Virginia","United States",2020-04-04 23:34:00,37.97850256,-77.96274807,13,0,0,13,"Louisa, Virginia, United States"
"04-04-2020","40085","Love","Oklahoma","United States",2020-04-04 23:34:00,33.95273467,-97.23906784,2,0,0,2,"Love, Oklahoma, United States"
"04-04-2020","01085","Lowndes","Alabama","United States",2020-04-04 23:34:00,32.1597283,-86.65158371,3,0,0,3,"Lowndes, Alabama, United States"
"04-04-2020","13185","Lowndes","Georgia","United States",2020-04-04 23:34:00,30.83568832,-83.27056716,35,1,0,34,"Lowndes, Georgia, United States"
"04-04-2020","28087","Lowndes","Mississippi","United States",2020-04-04 23:34:00,33.47386518,-88.4419153,13,0,0,13,"Lowndes, Mississippi, United States"
"04-04-2020","48303","Lubbock","Texas","United States",2020-04-04 23:34:00,33.61008596,-101.8204789,138,4,0,134,"Lubbock, Texas, United States"
"04-04-2020","39095","Lucas","Ohio","United States",2020-04-04 23:34:00,41.62101218,-83.65468618,272,7,0,265,"Lucas, Ohio, United States"
"04-04-2020","26095","Luce","Michigan","United States",2020-04-04 23:34:00,46.47227431,-85.54471223,1,0,0,1,"Luce, Michigan, United States"
"04-04-2020","13187","Lumpkin","Georgia","United States",2020-04-04 23:34:00,34.57286511,-84.00425681,7,0,0,7,"Lumpkin, Georgia, United States"
"04-04-2020","42079","Luzerne","Pennsylvania","United States",2020-04-04 23:34:00,41.17823008,-75.98447579,648,5,0,643,"Luzerne, Pennsylvania, United States"
"04-04-2020","42081","Lycoming","Pennsylvania","United States",2020-04-04 23:34:00,41.34310539,-77.06629984,10,0,0,10,"Lycoming, Pennsylvania, United States"
"04-04-2020","46085","Lyman","South Dakota","United States",2020-04-04 23:34:00,43.89522709,-99.85201878,1,0,0,1,"Lyman, South Dakota, United States"
"04-04-2020","51680","Lynchburg","Virginia","United States",2020-04-04 23:34:00,37.40021399,-79.19888138,10,0,0,10,"Lynchburg, Virginia, United States"
"04-04-2020","48305","Lynn","Texas","United States",2020-04-04 23:34:00,33.17657705,-101.8162849,3,0,0,3,"Lynn, Texas, United States"
"04-04-2020","19119","Lyon","Iowa","United States",2020-04-04 23:34:00,43.38107862,-96.20926845,2,0,0,2,"Lyon, Iowa, United States"
"04-04-2020","20111","Lyon","Kansas","United States",2020-04-04 23:34:00,38.45576156,-96.15275715,19,0,0,19,"Lyon, Kansas, United States"
"04-04-2020","21143","Lyon","Kentucky","United States",2020-04-04 23:34:00,37.02080035,-88.07886257,4,0,0,4,"Lyon, Kentucky, United States"
"04-04-2020","27083","Lyon","Minnesota","United States",2020-04-04 23:34:00,44.41327865,-95.83806103,3,0,0,3,"Lyon, Minnesota, United States"
"04-04-2020","32019","Lyon","Nevada","United States",2020-04-04 23:34:00,39.01777974,-119.1870479,3,0,0,3,"Lyon, Nevada, United States"
"04-04-2020","26097","Mackinac","Michigan","United States",2020-04-04 23:34:00,46.07028979,-85.04980537,2,0,0,2,"Mackinac, Michigan, United States"
"04-04-2020","26099","Macomb","Michigan","United States",2020-04-04 23:34:00,42.69158356,-82.92752801,1838,78,0,1760,"Macomb, Michigan, United States"
"04-04-2020","01087","Macon","Alabama","United States",2020-04-04 23:34:00,32.38759944,-85.69267724,5,0,0,5,"Macon, Alabama, United States"
"04-04-2020","13193","Macon","Georgia","United States",2020-04-04 23:34:00,32.35207048,-84.04234127,4,0,0,4,"Macon, Georgia, United States"
"04-04-2020","17115","Macon","Illinois","United States",2020-04-04 23:34:00,39.86064913,-88.96342505,5,0,0,5,"Macon, Illinois, United States"
"04-04-2020","29121","Macon","Missouri","United States",2020-04-04 23:34:00,39.83049768,-92.56453089,3,0,0,3,"Macon, Missouri, United States"
"04-04-2020","37113","Macon","North Carolina","United States",2020-04-04 23:34:00,35.14867843,-83.41696617,1,0,0,1,"Macon, North Carolina, United States"
"04-04-2020","47111","Macon","Tennessee","United States",2020-04-04 23:34:00,36.53157855,-86.00778595,7,0,0,7,"Macon, Tennessee, United States"
"04-04-2020","17117","Macoupin","Illinois","United States",2020-04-04 23:34:00,39.26119767,-89.92424028,4,0,0,4,"Macoupin, Illinois, United States"
"04-04-2020","06039","Madera","California","United States",2020-04-04 23:34:00,37.21513971,-119.7665589,28,1,0,27,"Madera, California, United States"
"04-04-2020","01089","Madison","Alabama","United States",2020-04-04 23:34:00,34.76327133,-86.55069633,125,1,0,124,"Madison, Alabama, United States"
"04-04-2020","12079","Madison","Florida","United States",2020-04-04 23:34:00,30.44396917,-83.47398594,6,0,0,6,"Madison, Florida, United States"
"04-04-2020","13195","Madison","Georgia","United States",2020-04-04 23:34:00,34.12920917,-83.21218732,7,1,0,6,"Madison, Georgia, United States"
"04-04-2020","16065","Madison","Idaho","United States",2020-04-04 23:34:00,43.78141028,-111.6538474,4,0,0,4,"Madison, Idaho, United States"
"04-04-2020","17119","Madison","Illinois","United States",2020-04-04 23:34:00,38.83042506,-89.90422563,47,0,0,47,"Madison, Illinois, United States"
"04-04-2020","18095","Madison","Indiana","United States",2020-04-04 23:34:00,40.16143691,-85.71964711,72,9,0,63,"Madison, Indiana, United States"
"04-04-2020","19121","Madison","Iowa","United States",2020-04-04 23:34:00,41.33081904,-94.01554631,1,0,0,1,"Madison, Iowa, United States"
"04-04-2020","21151","Madison","Kentucky","United States",2020-04-04 23:34:00,37.71659336,-84.27220275,11,0,0,11,"Madison, Kentucky, United States"
"04-04-2020","22065","Madison","Louisiana","United States",2020-04-04 23:34:00,32.36918118,-91.23973355,1,0,0,1,"Madison, Louisiana, United States"
"04-04-2020","28089","Madison","Mississippi","United States",2020-04-04 23:34:00,32.63389156,-90.03513564,67,0,0,67,"Madison, Mississippi, United States"
"04-04-2020","30057","Madison","Montana","United States",2020-04-04 23:34:00,45.30080065,-111.9173017,6,1,0,5,"Madison, Montana, United States"
"04-04-2020","31119","Madison","Nebraska","United States",2020-04-04 23:34:00,41.91676024,-97.6005481,5,0,0,5,"Madison, Nebraska, United States"
"04-04-2020","36053","Madison","New York","United States",2020-04-04 23:34:00,42.91653905,-75.67266639,78,2,0,76,"Madison, New York, United States"
"04-04-2020","39097","Madison","Ohio","United States",2020-04-04 23:34:00,39.89381073,-83.40178317,15,2,0,13,"Madison, Ohio, United States"
"04-04-2020","47113","Madison","Tennessee","United States",2020-04-04 23:34:00,35.61181957,-88.84076036,19,0,0,19,"Madison, Tennessee, United States"
"04-04-2020","51113","Madison","Virginia","United States",2020-04-04 23:34:00,38.41531222,-78.28220331,2,0,0,2,"Madison, Virginia, United States"
"04-04-2020","19123","Mahaska","Iowa","United States",2020-04-04 23:34:00,41.33521503,-92.64083907,3,0,0,3,"Mahaska, Iowa, United States"
"04-04-2020","27087","Mahnomen","Minnesota","United States",2020-04-04 23:34:00,47.32557075,-95.80921485,1,0,0,1,"Mahnomen, Minnesota, United States"
"04-04-2020","39099","Mahoning","Ohio","United States",2020-04-04 23:34:00,41.01631101,-80.77287029,250,13,0,237,"Mahoning, Ohio, United States"
"04-04-2020","40093","Major","Oklahoma","United States",2020-04-04 23:34:00,36.31149996,-98.53467076,1,0,0,1,"Major, Oklahoma, United States"
"04-04-2020","41045","Malheur","Oregon","United States",2020-04-04 23:34:00,43.1937027,-117.6227395,2,0,0,2,"Malheur, Oregon, United States"
"04-04-2020","51683","Manassas","Virginia","United States",2020-04-04 23:34:00,38.7464321,-77.48509905,14,0,0,14,"Manassas, Virginia, United States"
"04-04-2020","51685","Manassas Park","Virginia","United States",2020-04-04 23:34:00,38.77058531,-77.44399307,2,0,0,2,"Manassas Park, Virginia, United States"
"04-04-2020","12081","Manatee","Florida","United States",2020-04-04 23:34:00,27.47196942,-82.31831044,129,3,0,126,"Manatee, Florida, United States"
"04-04-2020","26101","Manistee","Michigan","United States",2020-04-04 23:34:00,44.33352407,-86.05626916,4,0,0,4,"Manistee, Michigan, United States"
"04-04-2020","55071","Manitowoc","Wisconsin","United States",2020-04-04 23:34:00,44.11946801,-87.80928853,1,0,0,1,"Manitowoc, Wisconsin, United States"
"04-04-2020","55073","Marathon","Wisconsin","United States",2020-04-04 23:34:00,44.89792533,-89.75863384,9,0,0,9,"Marathon, Wisconsin, United States"
"04-04-2020","01091","Marengo","Alabama","United States",2020-04-04 23:34:00,32.24767634,-87.78796182,8,0,0,8,"Marengo, Alabama, United States"
"04-04-2020","04013","Maricopa","Arizona","United States",2020-04-04 23:34:00,33.34835867,-112.4918154,1171,28,0,1143,"Maricopa, Arizona, United States"
"04-04-2020","29125","Maries","Missouri","United States",2020-04-04 23:34:00,38.16193985,-91.92249662,2,0,0,2,"Maries, Missouri, United States"
"04-04-2020","06041","Marin","California","United States",2020-04-04 23:34:00,38.07122463,-122.7210631,131,6,0,125,"Marin, California, United States"
"04-04-2020","55075","Marinette","Wisconsin","United States",2020-04-04 23:34:00,45.38553432,-88.033246,2,0,0,2,"Marinette, Wisconsin, United States"
"04-04-2020","01093","Marion","Alabama","United States",2020-04-04 23:34:00,34.13697363,-87.88704173,17,2,0,15,"Marion, Alabama, United States"
"04-04-2020","12083","Marion","Florida","United States",2020-04-04 23:34:00,29.21227113,-82.05803627,42,0,0,42,"Marion, Florida, United States"
"04-04-2020","13197","Marion","Georgia","United States",2020-04-04 23:34:00,32.3483402,-84.52733571,2,0,0,2,"Marion, Georgia, United States"
"04-04-2020","17121","Marion","Illinois","United States",2020-04-04 23:34:00,38.64963204,-88.91899208,3,0,0,3,"Marion, Illinois, United States"
"04-04-2020","18097","Marion","Indiana","United States",2020-04-04 23:34:00,39.78163624,-86.13826325,1570,34,0,1536,"Marion, Indiana, United States"
"04-04-2020","20115","Marion","Kansas","United States",2020-04-04 23:34:00,38.35855394,-97.0985251,2,0,0,2,"Marion, Kansas, United States"
"04-04-2020","21155","Marion","Kentucky","United States",2020-04-04 23:34:00,37.55218078,-85.26898542,3,0,0,3,"Marion, Kentucky, United States"
"04-04-2020","28091","Marion","Mississippi","United States",2020-04-04 23:34:00,31.23132643,-89.8209217,6,0,0,6,"Marion, Mississippi, United States"
"04-04-2020","39101","Marion","Ohio","United States",2020-04-04 23:34:00,40.58610662,-83.15736305,12,0,0,12,"Marion, Ohio, United States"
"04-04-2020","41047","Marion","Oregon","United States",2020-04-04 23:34:00,44.90287942,-122.5815117,178,4,0,174,"Marion, Oregon, United States"
"04-04-2020","45067","Marion","South Carolina","United States",2020-04-04 23:34:00,34.07859748,-79.36400756,2,1,0,1,"Marion, South Carolina, United States"
"04-04-2020","47115","Marion","Tennessee","United States",2020-04-04 23:34:00,35.12997174,-85.62265895,16,1,0,15,"Marion, Tennessee, United States"
"04-04-2020","54049","Marion","West Virginia","United States",2020-04-04 23:34:00,39.50984542,-80.24244659,13,1,0,12,"Marion, West Virginia, United States"
"04-04-2020","45069","Marlboro","South Carolina","United States",2020-04-04 23:34:00,34.59905577,-79.67561152,3,0,0,3,"Marlboro, South Carolina, United States"
"04-04-2020","26103","Marquette","Michigan","United States",2020-04-04 23:34:00,46.4338914,-87.64043701,11,1,0,10,"Marquette, Michigan, United States"
"04-04-2020","55077","Marquette","Wisconsin","United States",2020-04-04 23:34:00,43.81911946,-89.40073763,2,0,0,2,"Marquette, Wisconsin, United States"
"04-04-2020","01095","Marshall","Alabama","United States",2020-04-04 23:34:00,34.36975964,-86.30486727,17,0,0,17,"Marshall, Alabama, United States"
"04-04-2020","17123","Marshall","Illinois","United States",2020-04-04 23:34:00,41.0327901,-89.34510444,1,0,0,1,"Marshall, Illinois, United States"
"04-04-2020","18099","Marshall","Indiana","United States",2020-04-04 23:34:00,41.32467367,-86.26185087,4,0,0,4,"Marshall, Indiana, United States"
"04-04-2020","19127","Marshall","Iowa","United States",2020-04-04 23:34:00,42.03586837,-92.9990819,10,0,0,10,"Marshall, Iowa, United States"
"04-04-2020","21157","Marshall","Kentucky","United States",2020-04-04 23:34:00,36.8800707,-88.32803576,2,0,0,2,"Marshall, Kentucky, United States"
"04-04-2020","28093","Marshall","Mississippi","United States",2020-04-04 23:34:00,34.76216286,-89.50299462,20,1,0,19,"Marshall, Mississippi, United States"
"04-04-2020","46091","Marshall","South Dakota","United States",2020-04-04 23:34:00,45.75870838,-97.59855639,1,0,0,1,"Marshall, South Dakota, United States"
"04-04-2020","47117","Marshall","Tennessee","United States",2020-04-04 23:34:00,35.45798777,-86.76420988,4,0,0,4,"Marshall, Tennessee, United States"
"04-04-2020","54051","Marshall","West Virginia","United States",2020-04-04 23:34:00,39.86064362,-80.66591062,4,0,0,4,"Marshall, West Virginia, United States"
"04-04-2020","12085","Martin","Florida","United States",2020-04-04 23:34:00,27.0772071,-80.43109784,53,0,0,53,"Martin, Florida, United States"
"04-04-2020","18101","Martin","Indiana","United States",2020-04-04 23:34:00,38.7099921,-86.80373186,1,0,0,1,"Martin, Indiana, United States"
"04-04-2020","21159","Martin","Kentucky","United States",2020-04-04 23:34:00,37.79990579,-82.51247478,1,0,0,1,"Martin, Kentucky, United States"
"04-04-2020","27091","Martin","Minnesota","United States",2020-04-04 23:34:00,43.67429718,-94.55099908,32,2,0,30,"Martin, Minnesota, United States"
"04-04-2020","37117","Martin","North Carolina","United States",2020-04-04 23:34:00,35.84326734,-77.10860251,3,0,0,3,"Martin, North Carolina, United States"
"04-04-2020","48317","Martin","Texas","United States",2020-04-04 23:34:00,32.30600051,-101.9513518,1,0,0,1,"Martin, Texas, United States"
"04-04-2020","17125","Mason","Illinois","United States",2020-04-04 23:34:00,40.23917274,-89.91824452,1,0,0,1,"Mason, Illinois, United States"
"04-04-2020","21161","Mason","Kentucky","United States",2020-04-04 23:34:00,38.59471935,-83.82151043,2,0,0,2,"Mason, Kentucky, United States"
"04-04-2020","48319","Mason","Texas","United States",2020-04-04 23:34:00,30.71780434,-99.22629416,1,0,0,1,"Mason, Texas, United States"
"04-04-2020","53045","Mason","Washington","United States",2020-04-04 23:34:00,47.35007586,-123.1863685,13,0,0,13,"Mason, Washington, United States"
"04-04-2020","54053","Mason","West Virginia","United States",2020-04-04 23:34:00,38.77071799,-82.02524219,4,0,0,4,"Mason, West Virginia, United States"
"04-04-2020","17127","Massac","Illinois","United States",2020-04-04 23:34:00,37.22078441,-88.71036614,1,0,0,1,"Massac, Illinois, United States"
"04-04-2020","48321","Matagorda","Texas","United States",2020-04-04 23:34:00,28.81955746,-96.01230294,36,2,0,34,"Matagorda, Texas, United States"
"04-04-2020","02170","Matanuska-Susitna","Alaska","United States",2020-04-04 23:34:00,62.31305045,-149.5741743,4,0,0,4,"Matanuska-Susitna, Alaska, United States"
"04-04-2020","51115","Mathews","Virginia","United States",2020-04-04 23:34:00,37.44164146,-76.34098896,2,0,0,2,"Mathews, Virginia, United States"
"04-04-2020","15009","Maui","Hawaii","United States",2020-04-04 23:34:00,20.86399628,-156.5689097,38,0,0,38,"Maui, Hawaii, United States"
"04-04-2020","47119","Maury","Tennessee","United States",2020-04-04 23:34:00,35.6187413,-87.07462444,21,0,0,21,"Maury, Tennessee, United States"
"04-04-2020","48323","Maverick","Texas","United States",2020-04-04 23:34:00,28.7429195,-100.3157686,4,0,0,4,"Maverick, Texas, United States"
"04-04-2020","40097","Mayes","Oklahoma","United States",2020-04-04 23:34:00,36.30179091,-95.23175116,7,1,0,6,"Mayes, Oklahoma, United States"
"04-04-2020","40087","McClain","Oklahoma","United States",2020-04-04 23:34:00,35.01123903,-97.44572302,11,0,0,11,"McClain, Oklahoma, United States"
"04-04-2020","46087","McCook","South Dakota","United States",2020-04-04 23:34:00,43.6742571,-97.36863144,2,0,0,2,"McCook, South Dakota, United States"
"04-04-2020","45065","McCormick","South Carolina","United States",2020-04-04 23:34:00,33.90161443,-82.30794338,1,0,0,1,"McCormick, South Carolina, United States"
"04-04-2020","21145","McCracken","Kentucky","United States",2020-04-04 23:34:00,37.05350953,-88.70445755,10,0,0,10,"McCracken, Kentucky, United States"
"04-04-2020","21147","McCreary","Kentucky","United States",2020-04-04 23:34:00,36.73874143,-84.48102924,1,0,0,1,"McCreary, Kentucky, United States"
"04-04-2020","40089","McCurtain","Oklahoma","United States",2020-04-04 23:34:00,34.11664328,-94.77222373,1,0,0,1,"McCurtain, Oklahoma, United States"
"04-04-2020","29119","McDonald","Missouri","United States",2020-04-04 23:34:00,36.62869595,-94.34867205,2,0,0,2,"McDonald, Missouri, United States"
"04-04-2020","37111","McDowell","North Carolina","United States",2020-04-04 23:34:00,35.67736232,-82.0482425,9,0,0,9,"McDowell, North Carolina, United States"
