"Date_Published","FIPS","Admin2","Province_State","Country_Region","Last_Update","Latitude","Longitude","Confirmed","Deaths","Recovered","Active","Combined_Key"
"04-01-2020","12115","Sarasota","Florida","United States",2020-04-01 15:58:49,27.18546175,-82.33174248,82,3,0,79,"Sarasota, Florida, United States"
"04-01-2020","36091","Saratoga","New York","United States",2020-04-01 15:58:49,43.10904162,-73.86653895,122,1,0,121,"Saratoga, New York, United States"
"04-01-2020","31153","Sarpy","Nebraska","United States",2020-04-01 15:58:49,41.11314181,-96.11156432,17,0,0,17,"Sarpy, Nebraska, United States"
"04-01-2020","55111","Sauk","Wisconsin","United States",2020-04-01 15:58:49,43.42574087,-89.94966132,14,2,0,12,"Sauk, Wisconsin, United States"
"04-01-2020","31155","Saunders","Nebraska","United States",2020-04-01 15:58:49,41.2278103,-96.63773905,2,0,0,2,"Saunders, Nebraska, United States"
"04-01-2020","36093","Schenectady","New York","United States",2020-04-01 15:58:49,42.81668777,-74.05278291,93,1,0,92,"Schenectady, New York, United States"
"04-01-2020","13249","Schley","Georgia","United States",2020-04-01 15:58:49,32.2654021,-84.31258912,4,0,0,4,"Schley, Georgia, United States"
"04-01-2020","36095","Schoharie","New York","United States",2020-04-01 15:58:49,42.58831742,-74.4433903,9,0,0,9,"Schoharie, New York, United States"
"04-01-2020","26153","Schoolcraft","Michigan","United States",2020-04-01 15:58:49,46.19235734,-86.19972234,0,0,0,0,"Schoolcraft, Michigan, United States"
"04-01-2020","36097","Schuyler","New York","United States",2020-04-01 15:58:49,42.39184015,-76.8773299,2,0,0,2,"Schuyler, New York, United States"
"04-01-2020","42107","Schuylkill","Pennsylvania","United States",2020-04-01 15:58:49,40.70497338,-76.2150785,47,0,0,47,"Schuylkill, Pennsylvania, United States"
"04-01-2020","37165","Scotland","North Carolina","United States",2020-04-01 15:58:49,34.8386299,-79.4757978,2,0,0,2,"Scotland, North Carolina, United States"
"04-01-2020","05127","Scott","Arkansas","United States",2020-04-01 15:58:49,34.85588887,-94.0632176,1,0,0,1,"Scott, Arkansas, United States"
"04-01-2020","18143","Scott","Indiana","United States",2020-04-01 15:58:49,38.68672078,-85.74627859,1,1,0,0,"Scott, Indiana, United States"
"04-01-2020","19163","Scott","Iowa","United States",2020-04-01 15:58:49,41.63935978,-90.61959493,21,0,0,21,"Scott, Iowa, United States"
"04-01-2020","21209","Scott","Kentucky","United States",2020-04-01 15:58:49,38.29622293,-84.5816631,6,0,0,6,"Scott, Kentucky, United States"
"04-01-2020","27139","Scott","Minnesota","United States",2020-04-01 15:58:49,44.6490231,-93.53340251,10,0,0,10,"Scott, Minnesota, United States"
"04-01-2020","28123","Scott","Mississippi","United States",2020-04-01 15:58:49,32.4067041,-89.53789439,12,0,0,12,"Scott, Mississippi, United States"
"04-01-2020","29201","Scott","Missouri","United States",2020-04-01 15:58:49,37.05588075,-89.56474493,6,0,0,6,"Scott, Missouri, United States"
"04-01-2020","47151","Scott","Tennessee","United States",2020-04-01 15:58:49,36.42325673,-84.50360494,3,0,0,3,"Scott, Tennessee, United States"
"04-01-2020","31157","Scotts Bluff","Nebraska","United States",2020-04-01 15:58:49,41.85070896,-103.7080986,3,0,0,3,"Scotts Bluff, Nebraska, United States"
"04-01-2020","13251","Screven","Georgia","United States",2020-04-01 15:58:49,32.74976524,-81.60779441,2,0,0,2,"Screven, Georgia, United States"
"04-01-2020","05129","Searcy","Arkansas","United States",2020-04-01 15:58:49,35.9109364,-92.69936482,2,0,0,2,"Searcy, Arkansas, United States"
"04-01-2020","05131","Sebastian","Arkansas","United States",2020-04-01 15:58:49,35.19605503,-94.27162713,8,0,0,8,"Sebastian, Arkansas, United States"
"04-01-2020","20173","Sedgwick","Kansas","United States",2020-04-01 15:58:49,37.6842718,-97.4608198,64,1,0,63,"Sedgwick, Kansas, United States"
"04-01-2020","12117","Seminole","Florida","United States",2020-04-01 15:58:49,28.7158582,-81.24060348,109,0,0,109,"Seminole, Florida, United States"
"04-01-2020","13253","Seminole","Georgia","United States",2020-04-01 15:58:49,30.93464824,-84.86823924,6,0,0,6,"Seminole, Georgia, United States"
"04-01-2020","40133","Seminole","Oklahoma","United States",2020-04-01 15:58:49,35.16478725,-96.61686741,1,0,0,1,"Seminole, Oklahoma, United States"
"04-01-2020","36099","Seneca","New York","United States",2020-04-01 15:58:49,42.78081007,-76.82497064,2,0,0,2,"Seneca, New York, United States"
"04-01-2020","39147","Seneca","Ohio","United States",2020-04-01 15:58:49,41.12351311,-83.12783209,4,1,0,3,"Seneca, Ohio, United States"
"04-01-2020","47153","Sequatchie","Tennessee","United States",2020-04-01 15:58:49,35.36979721,-85.41022136,1,0,0,1,"Sequatchie, Tennessee, United States"
"04-01-2020","40135","Sequoyah","Oklahoma","United States",2020-04-01 15:58:49,35.49447108,-94.75463785,2,1,0,1,"Sequoyah, Oklahoma, United States"
"04-01-2020","05133","Sevier","Arkansas","United States",2020-04-01 15:58:49,33.99780401,-94.2424869,1,0,0,1,"Sevier, Arkansas, United States"
"04-01-2020","47155","Sevier","Tennessee","United States",2020-04-01 15:58:49,35.78077323,-83.52244332,9,0,0,9,"Sevier, Tennessee, United States"
"04-01-2020","28125","Sharkey","Mississippi","United States",2020-04-01 15:58:49,32.88149103,-90.8159538,2,0,0,2,"Sharkey, Mississippi, United States"
"04-01-2020","06089","Shasta","California","United States",2020-04-01 15:58:49,40.76391419,-122.0396884,7,1,0,6,"Shasta, California, United States"
"04-01-2020","20177","Shawnee","Kansas","United States",2020-04-01 15:58:49,39.04100763,-95.7557264,18,1,0,17,"Shawnee, Kansas, United States"
"04-01-2020","55117","Sheboygan","Wisconsin","United States",2020-04-01 15:58:49,43.72099677,-87.94579284,12,0,0,12,"Sheboygan, Wisconsin, United States"
"04-01-2020","01117","Shelby","Alabama","United States",2020-04-01 15:58:49,33.26879845,-86.66232561,88,3,0,85,"Shelby, Alabama, United States"
"04-01-2020","18145","Shelby","Indiana","United States",2020-04-01 15:58:49,39.52305623,-85.7915857,19,0,0,19,"Shelby, Indiana, United States"
"04-01-2020","19165","Shelby","Iowa","United States",2020-04-01 15:58:49,41.6850066,-95.31015553,3,0,0,3,"Shelby, Iowa, United States"
"04-01-2020","21211","Shelby","Kentucky","United States",2020-04-01 15:58:49,38.21476019,-85.194223,2,0,0,2,"Shelby, Kentucky, United States"
"04-01-2020","29205","Shelby","Missouri","United States",2020-04-01 15:58:49,39.79742518,-92.07634971,1,0,0,1,"Shelby, Missouri, United States"
"04-01-2020","39149","Shelby","Ohio","United States",2020-04-01 15:58:49,40.33163494,-84.20258189,6,0,0,6,"Shelby, Ohio, United States"
"04-01-2020","47157","Shelby","Tennessee","United States",2020-04-01 15:58:49,35.1864775,-89.89692423,496,1,0,495,"Shelby, Tennessee, United States"
"04-01-2020","48419","Shelby","Texas","United States",2020-04-01 15:58:49,31.79211404,-94.14550696,4,0,0,4,"Shelby, Texas, United States"
"04-01-2020","51171","Shenandoah","Virginia","United States",2020-04-01 15:58:49,38.85905135,-78.56813762,8,0,0,8,"Shenandoah, Virginia, United States"
"04-01-2020","27141","Sherburne","Minnesota","United States",2020-04-01 15:58:49,45.44447208,-93.77617511,8,0,0,8,"Sherburne, Minnesota, United States"
"04-01-2020","56033","Sheridan","Wyoming","United States",2020-04-01 15:58:49,44.79048913,-106.8862389,10,0,0,10,"Sheridan, Wyoming, United States"
"04-01-2020","26155","Shiawassee","Michigan","United States",2020-04-01 15:58:49,42.953928,-84.14585902,11,0,0,11,"Shiawassee, Michigan, United States"
"04-01-2020","27143","Sibley","Minnesota","United States",2020-04-01 15:58:49,44.5796592,-94.23164924,1,0,0,1,"Sibley, Minnesota, United States"
"04-01-2020","30093","Silver Bow","Montana","United States",2020-04-01 15:58:49,45.90018933,-112.6620092,10,0,0,10,"Silver Bow, Montana, United States"
"04-01-2020","21213","Simpson","Kentucky","United States",2020-04-01 15:58:49,36.74058474,-86.58047435,9,0,0,9,"Simpson, Kentucky, United States"
"04-01-2020","28127","Simpson","Mississippi","United States",2020-04-01 15:58:49,31.91282117,-89.91716179,3,0,0,3,"Simpson, Mississippi, United States"
"04-01-2020","19167","Sioux","Iowa","United States",2020-04-01 15:58:49,43.08221074,-96.1767568,4,0,0,4,"Sioux, Iowa, United States"
"04-01-2020","38085","Sioux","North Dakota","United States",2020-04-01 15:58:49,46.11323337,-101.0440149,1,0,0,1,"Sioux, North Dakota, United States"
"04-01-2020","06093","Siskiyou","California","United States",2020-04-01 15:58:49,41.59198861,-122.5407434,3,0,0,3,"Siskiyou, California, United States"
"04-01-2020","53057","Skagit","Washington","United States",2020-04-01 15:58:49,48.48171488,-121.766131,128,3,0,125,"Skagit, Washington, United States"
"04-01-2020","53059","Skamania","Washington","United States",2020-04-01 15:58:49,46.02408726,-121.9164403,1,0,0,1,"Skamania, Washington, United States"
"04-01-2020","28129","Smith","Mississippi","United States",2020-04-01 15:58:49,32.01744532,-89.50644846,1,0,0,1,"Smith, Mississippi, United States"
"04-01-2020","47159","Smith","Tennessee","United States",2020-04-01 15:58:49,36.25359775,-85.95411046,3,0,0,3,"Smith, Tennessee, United States"
"04-01-2020","48423","Smith","Texas","United States",2020-04-01 15:58:49,32.37474036,-95.2717568,37,1,0,36,"Smith, Texas, United States"
"04-01-2020","51173","Smyth","Virginia","United States",2020-04-01 15:58:49,36.84455636,-81.53344948,2,0,0,2,"Smyth, Virginia, United States"
"04-01-2020","53061","Snohomish","Washington","United States",2020-04-01 15:58:49,48.04615983,-121.7170703,1304,40,0,1264,"Snohomish, Washington, United States"
"04-01-2020","42109","Snyder","Pennsylvania","United States",2020-04-01 15:58:49,40.77129231,-77.06840691,3,1,0,2,"Snyder, Pennsylvania, United States"
"04-01-2020","35053","Socorro","New Mexico","United States",2020-04-01 15:58:49,34.00715494,-106.9298354,3,0,0,3,"Socorro, New Mexico, United States"
"04-01-2020","06095","Solano","California","United States",2020-04-01 15:58:49,38.26827353,-121.9357113,49,0,0,49,"Solano, California, United States"
"04-01-2020","23025","Somerset","Maine","United States",2020-04-01 15:58:49,45.51229767,-69.95995554,1,0,0,1,"Somerset, Maine, United States"
"04-01-2020","24039","Somerset","Maryland","United States",2020-04-01 15:58:49,38.1163542,-75.75118623,4,0,0,4,"Somerset, Maryland, United States"
"04-01-2020","34035","Somerset","New Jersey","United States",2020-04-01 15:58:49,40.56465737,-74.61683016,472,15,0,457,"Somerset, New Jersey, United States"
"04-01-2020","42111","Somerset","Pennsylvania","United States",2020-04-01 15:58:49,39.97172723,-79.02699593,3,0,0,3,"Somerset, Pennsylvania, United States"
"04-01-2020","06097","Sonoma","California","United States",2020-04-01 15:58:49,38.52746429,-122.8862506,78,2,0,76,"Sonoma, California, United States"
"04-01-2020","51175","Southampton","Virginia","United States",2020-04-01 15:58:49,36.72231125,-77.10642712,1,0,0,1,"Southampton, Virginia, United States"
"04-01-2020","13255","Spalding","Georgia","United States",2020-04-01 15:58:49,33.26310031,-84.28013991,16,0,0,16,"Spalding, Georgia, United States"
"04-01-2020","45083","Spartanburg","South Carolina","United States",2020-04-01 15:58:49,34.92960077,-81.99225984,45,0,0,45,"Spartanburg, South Carolina, United States"
"04-01-2020","21215","Spencer","Kentucky","United States",2020-04-01 15:58:49,38.03223971,-85.32749335,2,0,0,2,"Spencer, Kentucky, United States"
"04-01-2020","53063","Spokane","Washington","United States",2020-04-01 15:58:49,47.62113146,-117.4046494,158,5,0,153,"Spokane, Washington, United States"
"04-01-2020","51177","Spotsylvania","Virginia","United States",2020-04-01 15:58:49,38.18574462,-77.655399,8,0,0,8,"Spotsylvania, Virginia, United States"
"04-01-2020","22087","St. Bernard","Louisiana","United States",2020-04-01 15:58:49,29.87761636,-89.51887093,94,3,0,91,"St. Bernard, Louisiana, United States"
"04-01-2020","22089","St. Charles","Louisiana","United States",2020-04-01 15:58:49,29.90709658,-90.35555967,82,7,0,75,"St. Charles, Louisiana, United States"
"04-01-2020","29183","St. Charles","Missouri","United States",2020-04-01 15:58:49,38.77875681,-90.66662425,93,2,0,91,"St. Charles, Missouri, United States"
"04-01-2020","01115","St. Clair","Alabama","United States",2020-04-01 15:58:49,33.71902176,-86.31029372,18,0,0,18,"St. Clair, Alabama, United States"
"04-01-2020","17163","St. Clair","Illinois","United States",2020-04-01 15:58:49,38.46996033,-89.93063427,53,2,0,51,"St. Clair, Illinois, United States"
"04-01-2020","26147","St. Clair","Michigan","United States",2020-04-01 15:58:49,42.92655373,-82.67937954,41,0,0,41,"St. Clair, Michigan, United States"
"04-01-2020","55109","St. Croix","Wisconsin","United States",2020-04-01 15:58:49,45.03437474,-92.45000068,6,0,0,6,"St. Croix, Wisconsin, United States"
"04-01-2020","05123","St. Francis","Arkansas","United States",2020-04-01 15:58:49,35.02201976,-90.74828138,1,0,0,1,"St. Francis, Arkansas, United States"
"04-01-2020","29187","St. Francois","Missouri","United States",2020-04-01 15:58:49,37.81214171,-90.47598685,6,0,0,6,"St. Francois, Missouri, United States"
"04-01-2020","22091","St. Helena","Louisiana","United States",2020-04-01 15:58:49,30.82210324,-90.71013176,1,0,0,1,"St. Helena, Louisiana, United States"
"04-01-2020","22093","St. James","Louisiana","United States",2020-04-01 15:58:49,30.02531716,-90.80212061,86,4,0,82,"St. James, Louisiana, United States"
"04-01-2020","22095","St. John the Baptist","Louisiana","United States",2020-04-01 15:58:49,30.12597499,-90.4753503,118,13,0,105,"St. John the Baptist, Louisiana, United States"
"04-01-2020","12109","St. Johns","Florida","United States",2020-04-01 15:58:49,29.90096506,-81.43589967,83,2,0,81,"St. Johns, Florida, United States"
"04-01-2020","18141","St. Joseph","Indiana","United States",2020-04-01 15:58:49,41.61756781,-86.29040834,57,1,0,56,"St. Joseph, Indiana, United States"
"04-01-2020","26149","St. Joseph","Michigan","United States",2020-04-01 15:58:49,41.91441767,-85.52797979,5,0,0,5,"St. Joseph, Michigan, United States"
"04-01-2020","22097","St. Landry","Louisiana","United States",2020-04-01 15:58:49,30.59724262,-92.00135806,45,1,0,44,"St. Landry, Louisiana, United States"
"04-01-2020","36089","St. Lawrence","New York","United States",2020-04-01 15:58:49,44.4976179,-75.06550039,34,0,0,34,"St. Lawrence, New York, United States"
"04-01-2020","27137","St. Louis","Minnesota","United States",2020-04-01 15:58:49,47.6048407,-92.46879855,13,0,0,13,"St. Louis, Minnesota, United States"
"04-01-2020","29189","St. Louis","Missouri","United States",2020-04-01 15:58:49,38.6377004,-90.4458375,605,3,0,602,"St. Louis, Missouri, United States"
"04-01-2020","29510","St. Louis City","Missouri","United States",2020-04-01 15:58:49,38.63555736,-90.24349225,195,1,0,194,"St. Louis City, Missouri, United States"
"04-01-2020","12111","St. Lucie","Florida","United States",2020-04-01 15:58:49,27.37763908,-80.47106649,40,2,0,38,"St. Lucie, Florida, United States"
"04-01-2020","22099","St. Martin","Louisiana","United States",2020-04-01 15:58:49,30.13112107,-91.61403569,41,3,0,38,"St. Martin, Louisiana, United States"
"04-01-2020","22101","St. Mary","Louisiana","United States",2020-04-01 15:58:49,29.69262097,-91.44702164,26,0,0,26,"St. Mary, Louisiana, United States"
"04-01-2020","24037","St. Mary's","Maryland","United States",2020-04-01 15:58:49,38.30058422,-76.6062928,19,0,0,19,"St. Mary's, Maryland, United States"
"04-01-2020","22103","St. Tammany","Louisiana","United States",2020-04-01 15:58:49,30.40942847,-89.95642711,270,6,0,264,"St. Tammany, Louisiana, United States"
"04-01-2020","20185","Stafford","Kansas","United States",2020-04-01 15:58:49,38.03100851,-98.71762001,1,0,0,1,"Stafford, Kansas, United States"
"04-01-2020","51179","Stafford","Virginia","United States",2020-04-01 15:58:49,38.41758738,-77.45917053,28,0,0,28,"Stafford, Virginia, United States"
"04-01-2020","06099","Stanislaus","California","United States",2020-04-01 15:58:49,37.55862499,-120.9970722,39,0,0,39,"Stanislaus, California, United States"
"04-01-2020","37167","Stanly","North Carolina","United States",2020-04-01 15:58:49,35.31647813,-80.25093221,5,0,0,5,"Stanly, North Carolina, United States"
"04-01-2020","38089","Stark","North Dakota","United States",2020-04-01 15:58:49,46.80851182,-102.6576326,14,0,0,14,"Stark, North Dakota, United States"
"04-01-2020","39151","Stark","Ohio","United States",2020-04-01 15:58:49,40.81482476,-81.36437305,52,3,0,49,"Stark, Ohio, United States"
"04-01-2020","18149","Starke","Indiana","United States",2020-04-01 15:58:49,41.27890281,-86.64686895,1,0,0,1,"Starke, Indiana, United States"
"04-01-2020","48427","Starr","Texas","United States",2020-04-01 15:58:49,26.56150059,-98.73892358,4,0,0,4,"Starr, Texas, United States"
"04-01-2020","29186","Ste. Genevieve","Missouri","United States",2020-04-01 15:58:49,37.89090059,-90.1949941,3,0,0,3,"Ste. Genevieve, Missouri, United States"
"04-01-2020","27145","Stearns","Minnesota","United States",2020-04-01 15:58:49,45.55192576,-94.61078221,5,0,0,5,"Stearns, Minnesota, United States"
"04-01-2020","27147","Steele","Minnesota","United States",2020-04-01 15:58:49,44.02240351,-93.22627088,6,0,0,6,"Steele, Minnesota, United States"
"04-01-2020","13257","Stephens","Georgia","United States",2020-04-01 15:58:49,34.55151201,-83.29405315,5,0,0,5,"Stephens, Georgia, United States"
"04-01-2020","40137","Stephens","Oklahoma","United States",2020-04-01 15:58:49,34.48556989,-97.85141892,6,0,0,6,"Stephens, Oklahoma, United States"
"04-01-2020","17177","Stephenson","Illinois","United States",2020-04-01 15:58:49,42.35129217,-89.662598,3,0,0,3,"Stephenson, Illinois, United States"
"04-01-2020","18151","Steuben","Indiana","United States",2020-04-01 15:58:49,41.64423868,-85.00101094,2,0,0,2,"Steuben, Indiana, United States"
"04-01-2020","36101","Steuben","New York","United States",2020-04-01 15:58:49,42.2689144,-77.3829924,38,0,0,38,"Steuben, New York, United States"
"04-01-2020","20189","Stevens","Kansas","United States",2020-04-01 15:58:49,37.1923008,-101.3118967,1,0,0,1,"Stevens, Kansas, United States"
"04-01-2020","53065","Stevens","Washington","United States",2020-04-01 15:58:49,48.40035475,-117.8542701,4,0,0,4,"Stevens, Washington, United States"
"04-01-2020","13259","Stewart","Georgia","United States",2020-04-01 15:58:49,32.07996777,-84.83208037,1,0,0,1,"Stewart, Georgia, United States"
"04-01-2020","29207","Stoddard","Missouri","United States",2020-04-01 15:58:49,36.85571651,-89.9444155,3,0,0,3,"Stoddard, Missouri, United States"
"04-01-2020","37169","Stokes","North Carolina","United States",2020-04-01 15:58:49,36.4017975,-80.23893369,2,0,0,2,"Stokes, North Carolina, United States"
"04-01-2020","05137","Stone","Arkansas","United States",2020-04-01 15:58:49,35.86251946,-92.15684085,5,0,0,5,"Stone, Arkansas, United States"
"04-01-2020","29209","Stone","Missouri","United States",2020-04-01 15:58:49,36.75000327,-93.45256475,2,0,0,2,"Stone, Missouri, United States"
"04-01-2020","19169","Story","Iowa","United States",2020-04-01 15:58:49,42.03621213,-93.46499005,4,0,0,4,"Story, Iowa, United States"
"04-01-2020","33017","Strafford","New Hampshire","United States",2020-04-01 15:58:49,43.291833,-71.02336013,28,0,0,28,"Strafford, New Hampshire, United States"
"04-01-2020","56035","Sublette","Wyoming","United States",2020-04-01 15:58:49,42.76558279,-109.9130922,1,0,0,1,"Sublette, Wyoming, United States"
"04-01-2020","25025","Suffolk","Massachusetts","United States",2020-04-01 15:58:49,42.3279514,-71.07850442,1624,13,0,1611,"Suffolk, Massachusetts, United States"
"04-01-2020","36103","Suffolk","New York","United States",2020-04-01 15:58:49,40.88320119,-72.8012172,7605,53,0,7552,"Suffolk, New York, United States"
"04-01-2020","51800","Suffolk","Virginia","United States",2020-04-01 15:58:49,36.70155394,-76.63603554,5,0,0,5,"Suffolk, Virginia, United States"
"04-01-2020","18153","Sullivan","Indiana","United States",2020-04-01 15:58:49,39.08952258,-87.41414469,3,0,0,3,"Sullivan, Indiana, United States"
"04-01-2020","33019","Sullivan","New Hampshire","United States",2020-04-01 15:58:49,43.36094111,-72.22203125,4,0,0,4,"Sullivan, New Hampshire, United States"
"04-01-2020","36105","Sullivan","New York","United States",2020-04-01 15:58:49,41.71579493,-74.76394559,121,1,0,120,"Sullivan, New York, United States"
"04-01-2020","47163","Sullivan","Tennessee","United States",2020-04-01 15:58:49,36.51240691,-82.30412917,17,0,0,17,"Sullivan, Tennessee, United States"
"04-01-2020","08117","Summit","Colorado","United States",2020-04-01 15:58:49,39.63803232,-106.1150762,34,0,0,34,"Summit, Colorado, United States"
"04-01-2020","39153","Summit","Ohio","United States",2020-04-01 15:58:49,41.12464734,-81.53123079,144,7,0,137,"Summit, Ohio, United States"
"04-01-2020","49043","Summit","Utah","United States",2020-04-01 15:58:49,40.86688146,-110.9535882,172,0,0,172,"Summit, Utah, United States"
"04-01-2020","20191","Sumner","Kansas","United States",2020-04-01 15:58:49,37.23682549,-97.47721621,1,0,0,1,"Sumner, Kansas, United States"
"04-01-2020","47165","Sumner","Tennessee","United States",2020-04-01 15:58:49,36.46824103,-86.45917204,201,4,0,197,"Sumner, Tennessee, United States"
"04-01-2020","01119","Sumter","Alabama","United States",2020-04-01 15:58:49,32.59117397,-88.19916205,2,0,0,2,"Sumter, Alabama, United States"
"04-01-2020","12119","Sumter","Florida","United States",2020-04-01 15:58:49,28.70181754,-82.0794267,52,0,0,52,"Sumter, Florida, United States"
"04-01-2020","13261","Sumter","Georgia","United States",2020-04-01 15:58:49,32.03650571,-84.19821492,37,2,0,35,"Sumter, Georgia, United States"
"04-01-2020","45085","Sumter","South Carolina","United States",2020-04-01 15:58:49,33.91826534,-80.37942316,48,2,0,46,"Sumter, South Carolina, United States"
"04-01-2020","28133","Sunflower","Mississippi","United States",2020-04-01 15:58:49,33.60192578,-90.58882684,12,1,0,11,"Sunflower, Mississippi, United States"
"04-01-2020","37171","Surry","North Carolina","United States",2020-04-01 15:58:49,36.41689489,-80.69102283,2,0,0,2,"Surry, North Carolina, United States"
"04-01-2020","51181","Surry","Virginia","United States",2020-04-01 15:58:49,37.11781893,-76.88450012,1,0,0,1,"Surry, Virginia, United States"
"04-01-2020","42115","Susquehanna","Pennsylvania","United States",2020-04-01 15:58:49,41.82147784,-75.80071959,2,0,0,2,"Susquehanna, Pennsylvania, United States"
"04-01-2020","10005","Sussex","Delaware","United States",2020-04-01 15:58:49,38.66143781,-75.39031349,101,3,0,98,"Sussex, Delaware, United States"
"04-01-2020","34037","Sussex","New Jersey","United States",2020-04-01 15:58:49,41.13891592,-74.69118243,158,6,0,152,"Sussex, New Jersey, United States"
"04-01-2020","51183","Sussex","Virginia","United States",2020-04-01 15:58:49,36.92432914,-77.25791182,1,0,0,1,"Sussex, Virginia, United States"
"04-01-2020","06101","Sutter","California","United States",2020-04-01 15:58:49,39.03417539,-121.6945899,10,0,0,10,"Sutter, California, United States"
"04-01-2020","12121","Suwannee","Florida","United States",2020-04-01 15:58:49,30.19746066,-82.9909967,4,0,0,4,"Suwannee, Florida, United States"
"04-01-2020","56037","Sweetwater","Wyoming","United States",2020-04-01 15:58:49,41.65943896,-108.8827882,2,0,0,2,"Sweetwater, Wyoming, United States"
"04-01-2020","48437","Swisher","Texas","United States",2020-04-01 15:58:49,34.53028891,-101.7349174,1,0,0,1,"Swisher, Texas, United States"
"04-01-2020","18155","Switzerland","Indiana","United States",2020-04-01 15:58:49,38.82767338,-85.03022429,3,0,0,3,"Switzerland, Indiana, United States"
"04-01-2020","13263","Talbot","Georgia","United States",2020-04-01 15:58:49,32.69642758,-84.53351366,1,0,0,1,"Talbot, Georgia, United States"
"04-01-2020","24041","Talbot","Maryland","United States",2020-04-01 15:58:49,38.76618159,-76.10882561,4,0,0,4,"Talbot, Maryland, United States"
"04-01-2020","01121","Talladega","Alabama","United States",2020-04-01 15:58:49,33.37823223,-86.16886178,7,0,0,7,"Talladega, Alabama, United States"
"04-01-2020","28135","Tallahatchie","Mississippi","United States",2020-04-01 15:58:49,33.95339918,-90.1729398,2,0,0,2,"Tallahatchie, Mississippi, United States"
"04-01-2020","01123","Tallapoosa","Alabama","United States",2020-04-01 15:58:49,32.86698258,-85.79833053,13,1,0,12,"Tallapoosa, Alabama, United States"
"04-01-2020","19171","Tama","Iowa","United States",2020-04-01 15:58:49,42.07991767,-92.53266945,14,0,0,14,"Tama, Iowa, United States"
"04-01-2020","29213","Taney","Missouri","United States",2020-04-01 15:58:49,36.65465345,-93.04075153,2,0,0,2,"Taney, Missouri, United States"
"04-01-2020","22105","Tangipahoa","Louisiana","United States",2020-04-01 15:58:49,30.62888673,-90.40664996,33,2,0,31,"Tangipahoa, Louisiana, United States"
"04-01-2020","35055","Taos","New Mexico","United States",2020-04-01 15:58:49,36.58006022,-105.6310198,11,0,0,11,"Taos, New Mexico, United States"
"04-01-2020","48439","Tarrant","Texas","United States",2020-04-01 15:58:49,32.77143818,-97.29101614,288,3,0,285,"Tarrant, Texas, United States"
"04-01-2020","28137","Tate","Mississippi","United States",2020-04-01 15:58:49,34.65133709,-89.94485778,11,0,0,11,"Tate, Mississippi, United States"
"04-01-2020","13267","Tattnall","Georgia","United States",2020-04-01 15:58:49,32.04785085,-82.05539188,2,0,0,2,"Tattnall, Georgia, United States"
"04-01-2020","13269","Taylor","Georgia","United States",2020-04-01 15:58:49,32.55792548,-84.25077141,2,0,0,2,"Taylor, Georgia, United States"
"04-01-2020","19173","Taylor","Iowa","United States",2020-04-01 15:58:49,40.73710579,-94.69778563,1,0,0,1,"Taylor, Iowa, United States"
"04-01-2020","21217","Taylor","Kentucky","United States",2020-04-01 15:58:49,37.3677562,-85.3329931,2,0,0,2,"Taylor, Kentucky, United States"
"04-01-2020","48441","Taylor","Texas","United States",2020-04-01 15:58:49,32.30163422,-99.89007449,14,0,0,14,"Taylor, Texas, United States"
