"Date_Published","FIPS","Admin2","Province_State","Country_Region","Last_Update","Latitude","Longitude","Confirmed","Deaths","Recovered","Active","Combined_Key"
"04-01-2020","41035","Klamath","Oregon","United States",2020-04-01 15:58:49,42.68762984,-121.6496461,5,0,0,5,"Klamath, Oregon, United States"
"04-01-2020","48273","Kleberg","Texas","United States",2020-04-01 15:58:49,27.42435506,-97.69894948,1,0,0,1,"Kleberg, Texas, United States"
"04-01-2020","53039","Klickitat","Washington","United States",2020-04-01 15:58:49,45.87325839,-120.7913598,9,1,0,8,"Klickitat, Washington, United States"
"04-01-2020","17095","Knox","Illinois","United States",2020-04-01 15:58:49,40.93148779,-90.2133034,1,0,0,1,"Knox, Illinois, United States"
"04-01-2020","18083","Knox","Indiana","United States",2020-04-01 15:58:49,38.68861576,-87.4194665,3,0,0,3,"Knox, Indiana, United States"
"04-01-2020","23013","Knox","Maine","United States",2020-04-01 15:58:49,44.11486325,-69.10529169,5,0,0,5,"Knox, Maine, United States"
"04-01-2020","31107","Knox","Nebraska","United States",2020-04-01 15:58:49,42.63758421,-97.89178836,2,0,0,2,"Knox, Nebraska, United States"
"04-01-2020","39083","Knox","Ohio","United States",2020-04-01 15:58:49,40.39830217,-82.42027563,4,0,0,4,"Knox, Ohio, United States"
"04-01-2020","47093","Knox","Tennessee","United States",2020-04-01 15:58:49,35.99508821,-83.94635435,78,1,0,77,"Knox, Tennessee, United States"
"04-01-2020","16055","Kootenai","Idaho","United States",2020-04-01 15:58:49,47.67282258,-116.7020872,30,0,0,30,"Kootenai, Idaho, United States"
"04-01-2020","18085","Kosciusko","Indiana","United States",2020-04-01 15:58:49,41.24521668,-85.86312322,5,0,0,5,"Kosciusko, Indiana, United States"
"04-01-2020","19109","Kossuth","Iowa","United States",2020-04-01 15:58:49,43.20405458,-94.20691791,1,0,0,1,"Kossuth, Iowa, United States"
"04-01-2020","55063","La Crosse","Wisconsin","United States",2020-04-01 15:58:49,43.90632465,-91.11451093,19,0,0,19,"La Crosse, Wisconsin, United States"
"04-01-2020","04012","La Paz","Arizona","United States",2020-04-01 15:58:49,33.72854224,-113.9810029,2,0,0,2,"La Paz, Arizona, United States"
"04-01-2020","08067","La Plata","Colorado","United States",2020-04-01 15:58:49,37.28632032,-107.8429014,23,0,0,23,"La Plata, Colorado, United States"
"04-01-2020","18087","LaGrange","Indiana","United States",2020-04-01 15:58:49,41.64232188,-85.42674232,2,0,0,2,"LaGrange, Indiana, United States"
"04-01-2020","18091","LaPorte","Indiana","United States",2020-04-01 15:58:49,41.54366008,-86.74072188,11,0,0,11,"LaPorte, Indiana, United States"
"04-01-2020","17099","LaSalle","Illinois","United States",2020-04-01 15:58:49,41.3442613,-88.88633881,6,1,0,5,"LaSalle, Illinois, United States"
"04-01-2020","22059","LaSalle","Louisiana","United States",2020-04-01 15:58:49,31.67884782,-92.15907765,2,0,0,2,"LaSalle, Louisiana, United States"
"04-01-2020","20099","Labette","Kansas","United States",2020-04-01 15:58:49,37.19113093,-95.29849679,1,0,0,1,"Labette, Kansas, United States"
"04-01-2020","27073","Lac qui Parle","Minnesota","United States",2020-04-01 15:58:49,44.9973857,-96.17488219,1,0,0,1,"Lac qui Parle, Minnesota, United States"
"04-01-2020","42069","Lackawanna","Pennsylvania","United States",2020-04-01 15:58:49,41.43564672,-75.60379201,85,3,0,82,"Lackawanna, Pennsylvania, United States"
"04-01-2020","22055","Lafayette","Louisiana","United States",2020-04-01 15:58:49,30.2049055,-92.06959876,159,2,0,157,"Lafayette, Louisiana, United States"
"04-01-2020","28071","Lafayette","Mississippi","United States",2020-04-01 15:58:49,34.35687874,-89.48490961,15,1,0,14,"Lafayette, Mississippi, United States"
"04-01-2020","29107","Lafayette","Missouri","United States",2020-04-01 15:58:49,39.06986886,-93.78076396,20,1,0,19,"Lafayette, Missouri, United States"
"04-01-2020","22057","Lafourche","Louisiana","United States",2020-04-01 15:58:49,29.52470226,-90.40976986,105,4,0,101,"Lafourche, Louisiana, United States"
"04-01-2020","08065","Lake","Colorado","United States",2020-04-01 15:58:49,39.20278823,-106.3555697,1,0,0,1,"Lake, Colorado, United States"
"04-01-2020","12069","Lake","Florida","United States",2020-04-01 15:58:49,28.76202069,-81.7125123,67,0,0,67,"Lake, Florida, United States"
"04-01-2020","17097","Lake","Illinois","United States",2020-04-01 15:58:49,42.3224907,-88.00367925,477,3,0,474,"Lake, Illinois, United States"
"04-01-2020","18089","Lake","Indiana","United States",2020-04-01 15:58:49,41.41874274,-87.38277575,180,6,0,174,"Lake, Indiana, United States"
"04-01-2020","30047","Lake","Montana","United States",2020-04-01 15:58:49,47.64514965,-114.0898013,4,0,0,4,"Lake, Montana, United States"
"04-01-2020","39085","Lake","Ohio","United States",2020-04-01 15:58:49,41.69710807,-81.23676539,48,2,0,46,"Lake, Ohio, United States"
"04-01-2020","01075","Lamar","Alabama","United States",2020-04-01 15:58:49,33.77995024,-88.09668032,1,0,0,1,"Lamar, Alabama, United States"
"04-01-2020","13171","Lamar","Georgia","United States",2020-04-01 15:58:49,33.07841647,-84.14263877,4,0,0,4,"Lamar, Georgia, United States"
"04-01-2020","28073","Lamar","Mississippi","United States",2020-04-01 15:58:49,31.20572971,-89.5077704,6,0,0,6,"Lamar, Mississippi, United States"
"04-01-2020","48277","Lamar","Texas","United States",2020-04-01 15:58:49,33.66981763,-95.57404777,3,0,0,3,"Lamar, Texas, United States"
"04-01-2020","48279","Lamb","Texas","United States",2020-04-01 15:58:49,34.06859623,-102.3516289,1,0,0,1,"Lamb, Texas, United States"
"04-01-2020","50015","Lamoille","Vermont","United States",2020-04-01 15:58:49,44.60353043,-72.64356694,13,0,0,13,"Lamoille, Vermont, United States"
"04-01-2020","31109","Lancaster","Nebraska","United States",2020-04-01 15:58:49,40.78416049,-96.68777155,9,0,0,9,"Lancaster, Nebraska, United States"
"04-01-2020","42071","Lancaster","Pennsylvania","United States",2020-04-01 15:58:49,40.03904563,-76.24770128,157,3,0,154,"Lancaster, Pennsylvania, United States"
"04-01-2020","45057","Lancaster","South Carolina","United States",2020-04-01 15:58:49,34.68270843,-80.70513032,17,0,0,17,"Lancaster, South Carolina, United States"
"04-01-2020","51103","Lancaster","Virginia","United States",2020-04-01 15:58:49,37.71889653,-76.46400482,1,0,0,1,"Lancaster, Virginia, United States"
"04-01-2020","41039","Lane","Oregon","United States",2020-04-01 15:58:49,43.93727035,-122.847753,18,1,0,17,"Lane, Oregon, United States"
"04-01-2020","26087","Lapeer","Michigan","United States",2020-04-01 15:58:49,43.09052506,-83.22153148,8,0,0,8,"Lapeer, Michigan, United States"
"04-01-2020","56021","Laramie","Wyoming","United States",2020-04-01 15:58:49,41.3070252,-104.6887497,29,0,0,29,"Laramie, Wyoming, United States"
"04-01-2020","08069","Larimer","Colorado","United States",2020-04-01 15:58:49,40.66671597,-105.4625784,99,6,0,93,"Larimer, Colorado, United States"
"04-01-2020","21123","Larue","Kentucky","United States",2020-04-01 15:58:49,37.54567114,-85.70138352,1,0,0,1,"Larue, Kentucky, United States"
"04-01-2020","16057","Latah","Idaho","United States",2020-04-01 15:58:49,46.81587887,-116.7113698,1,0,0,1,"Latah, Idaho, United States"
"04-01-2020","40077","Latimer","Oklahoma","United States",2020-04-01 15:58:49,34.87844729,-95.25215049,2,0,0,2,"Latimer, Oklahoma, United States"
"04-01-2020","01077","Lauderdale","Alabama","United States",2020-04-01 15:58:49,34.90171875,-87.65624729,12,1,0,11,"Lauderdale, Alabama, United States"
"04-01-2020","28075","Lauderdale","Mississippi","United States",2020-04-01 15:58:49,32.40419769,-88.66229662,39,0,0,39,"Lauderdale, Mississippi, United States"
"04-01-2020","47097","Lauderdale","Tennessee","United States",2020-04-01 15:58:49,35.75893438,-89.6301591,1,0,0,1,"Lauderdale, Tennessee, United States"
"04-01-2020","21125","Laurel","Kentucky","United States",2020-04-01 15:58:49,37.10975748,-84.11321779,2,0,0,2,"Laurel, Kentucky, United States"
"04-01-2020","13175","Laurens","Georgia","United States",2020-04-01 15:58:49,32.46325233,-82.92221316,14,0,0,14,"Laurens, Georgia, United States"
"04-01-2020","45059","Laurens","South Carolina","United States",2020-04-01 15:58:49,34.48244419,-82.00490796,4,0,0,4,"Laurens, South Carolina, United States"
"04-01-2020","48285","Lavaca","Texas","United States",2020-04-01 15:58:49,29.38508402,-96.93186692,1,0,0,1,"Lavaca, Texas, United States"
"04-01-2020","01079","Lawrence","Alabama","United States",2020-04-01 15:58:49,34.52041498,-87.31069453,3,0,0,3,"Lawrence, Alabama, United States"
"04-01-2020","05075","Lawrence","Arkansas","United States",2020-04-01 15:58:49,36.04188196,-91.10867198,1,0,0,1,"Lawrence, Arkansas, United States"
"04-01-2020","18093","Lawrence","Indiana","United States",2020-04-01 15:58:49,38.84112637,-86.48361629,11,1,0,10,"Lawrence, Indiana, United States"
"04-01-2020","21127","Lawrence","Kentucky","United States",2020-04-01 15:58:49,38.07136018,-82.72882223,1,0,0,1,"Lawrence, Kentucky, United States"
"04-01-2020","28077","Lawrence","Mississippi","United States",2020-04-01 15:58:49,31.55147224,-90.10841127,5,0,0,5,"Lawrence, Mississippi, United States"
"04-01-2020","39087","Lawrence","Ohio","United States",2020-04-01 15:58:49,38.59743452,-82.53466552,1,0,0,1,"Lawrence, Ohio, United States"
"04-01-2020","42073","Lawrence","Pennsylvania","United States",2020-04-01 15:58:49,40.99206278,-80.33393706,13,2,0,11,"Lawrence, Pennsylvania, United States"
"04-01-2020","46081","Lawrence","South Dakota","United States",2020-04-01 15:58:49,44.35919441,-103.7929428,6,0,0,6,"Lawrence, South Dakota, United States"
"04-01-2020","47099","Lawrence","Tennessee","United States",2020-04-01 15:58:49,35.21675201,-87.39787695,2,0,0,2,"Lawrence, Tennessee, United States"
"04-01-2020","40079","Le Flore","Oklahoma","United States",2020-04-01 15:58:49,34.89851864,-94.70392124,1,0,0,1,"Le Flore, Oklahoma, United States"
"04-01-2020","27079","Le Sueur","Minnesota","United States",2020-04-01 15:58:49,44.37136597,-93.72844721,15,0,0,15,"Le Sueur, Minnesota, United States"
"04-01-2020","35025","Lea","New Mexico","United States",2020-04-01 15:58:49,32.79215361,-103.4123733,2,0,0,2,"Lea, New Mexico, United States"
"04-01-2020","28079","Leake","Mississippi","United States",2020-04-01 15:58:49,32.7536828,-89.52402044,5,0,0,5,"Leake, Mississippi, United States"
"04-01-2020","20103","Leavenworth","Kansas","United States",2020-04-01 15:58:49,39.20183497,-95.03620809,25,0,0,25,"Leavenworth, Kansas, United States"
"04-01-2020","42075","Lebanon","Pennsylvania","United States",2020-04-01 15:58:49,40.36680311,-76.45651841,36,0,0,36,"Lebanon, Pennsylvania, United States"
"04-01-2020","01081","Lee","Alabama","United States",2020-04-01 15:58:49,32.60154883,-85.35132246,81,2,0,79,"Lee, Alabama, United States"
"04-01-2020","12071","Lee","Florida","United States",2020-04-01 15:58:49,26.58410348,-81.88399313,212,8,0,204,"Lee, Florida, United States"
"04-01-2020","13177","Lee","Georgia","United States",2020-04-01 15:58:49,31.7793306,-84.14324253,94,7,0,87,"Lee, Georgia, United States"
"04-01-2020","28081","Lee","Mississippi","United States",2020-04-01 15:58:49,34.2918775,-88.68149954,25,1,0,24,"Lee, Mississippi, United States"
"04-01-2020","37105","Lee","North Carolina","United States",2020-04-01 15:58:49,35.47623147,-79.17569362,3,0,0,3,"Lee, North Carolina, United States"
"04-01-2020","45061","Lee","South Carolina","United States",2020-04-01 15:58:49,34.16393091,-80.25690731,5,1,0,4,"Lee, South Carolina, United States"
"04-01-2020","51105","Lee","Virginia","United States",2020-04-01 15:58:49,36.70586667,-83.12606515,2,0,0,2,"Lee, Virginia, United States"
"04-01-2020","26089","Leelanau","Michigan","United States",2020-04-01 15:58:49,44.94430054,-85.80150326,1,0,0,1,"Leelanau, Michigan, United States"
"04-01-2020","28083","Leflore","Mississippi","United States",2020-04-01 15:58:49,33.55545125,-90.29900733,20,1,0,19,"Leflore, Mississippi, United States"
"04-01-2020","42077","Lehigh","Pennsylvania","United States",2020-04-01 15:58:49,40.6154815,-75.59435245,374,5,0,369,"Lehigh, Pennsylvania, United States"
"04-01-2020","26091","Lenawee","Michigan","United States",2020-04-01 15:58:49,41.89475156,-84.06603727,22,0,0,22,"Lenawee, Michigan, United States"
"04-01-2020","37107","Lenoir","North Carolina","United States",2020-04-01 15:58:49,35.2403259,-77.64245615,3,0,0,3,"Lenoir, North Carolina, United States"
"04-01-2020","12073","Leon","Florida","United States",2020-04-01 15:58:49,30.45955727,-84.27491114,28,0,0,28,"Leon, Florida, United States"
"04-01-2020","48289","Leon","Texas","United States",2020-04-01 15:58:49,31.29872538,-95.9936328,2,0,0,2,"Leon, Texas, United States"
"04-01-2020","12075","Levy","Florida","United States",2020-04-01 15:58:49,29.31829741,-82.74007147,2,0,0,2,"Levy, Florida, United States"
"04-01-2020","21135","Lewis","Kentucky","United States",2020-04-01 15:58:49,38.53184419,-83.37735618,1,0,0,1,"Lewis, Kentucky, United States"
"04-01-2020","36049","Lewis","New York","United States",2020-04-01 15:58:49,43.7844157,-75.44903992,2,0,0,2,"Lewis, New York, United States"
"04-01-2020","47101","Lewis","Tennessee","United States",2020-04-01 15:58:49,35.52853208,-87.49022694,2,0,0,2,"Lewis, Tennessee, United States"
"04-01-2020","53041","Lewis","Washington","United States",2020-04-01 15:58:49,46.57756476,-122.3925769,10,0,0,10,"Lewis, Washington, United States"
"04-01-2020","30049","Lewis and Clark","Montana","United States",2020-04-01 15:58:49,47.12610041,-112.394698,14,0,0,14,"Lewis and Clark, Montana, United States"
"04-01-2020","45063","Lexington","South Carolina","United States",2020-04-01 15:58:49,33.89665987,-81.27146426,61,1,0,60,"Lexington, South Carolina, United States"
"04-01-2020","13179","Liberty","Georgia","United States",2020-04-01 15:58:49,31.82588896,-81.49251135,5,0,0,5,"Liberty, Georgia, United States"
"04-01-2020","30051","Liberty","Montana","United States",2020-04-01 15:58:49,48.56084317,-111.024307,1,0,0,1,"Liberty, Montana, United States"
"04-01-2020","48291","Liberty","Texas","United States",2020-04-01 15:58:49,30.15152688,-94.81205615,3,0,0,3,"Liberty, Texas, United States"
"04-01-2020","39089","Licking","Ohio","United States",2020-04-01 15:58:49,40.09136236,-82.48185785,24,0,0,24,"Licking, Ohio, United States"
"04-01-2020","01083","Limestone","Alabama","United States",2020-04-01 15:58:49,34.81185586,-86.98310072,23,0,0,23,"Limestone, Alabama, United States"
"04-01-2020","48293","Limestone","Texas","United States",2020-04-01 15:58:49,31.5454767,-96.58095444,2,0,0,2,"Limestone, Texas, United States"
"04-01-2020","05079","Lincoln","Arkansas","United States",2020-04-01 15:58:49,33.95317155,-91.74002806,6,0,0,6,"Lincoln, Arkansas, United States"
"04-01-2020","08073","Lincoln","Colorado","United States",2020-04-01 15:58:49,38.98749519,-103.5136649,1,0,0,1,"Lincoln, Colorado, United States"
"04-01-2020","13181","Lincoln","Georgia","United States",2020-04-01 15:58:49,33.79201475,-82.45024131,4,0,0,4,"Lincoln, Georgia, United States"
"04-01-2020","16063","Lincoln","Idaho","United States",2020-04-01 15:58:49,43.0012336,-114.1358773,3,0,0,3,"Lincoln, Idaho, United States"
"04-01-2020","22061","Lincoln","Louisiana","United States",2020-04-01 15:58:49,32.6003154,-92.6659741,13,0,0,13,"Lincoln, Louisiana, United States"
"04-01-2020","23015","Lincoln","Maine","United States",2020-04-01 15:58:49,44.05996956,-69.54227124,8,0,0,8,"Lincoln, Maine, United States"
"04-01-2020","27081","Lincoln","Minnesota","United States",2020-04-01 15:58:49,44.41311883,-96.26688165,1,0,0,1,"Lincoln, Minnesota, United States"
"04-01-2020","28085","Lincoln","Mississippi","United States",2020-04-01 15:58:49,31.53288662,-90.45391915,13,0,0,13,"Lincoln, Mississippi, United States"
"04-01-2020","29113","Lincoln","Missouri","United States",2020-04-01 15:58:49,39.05345619,-90.95588181,10,0,0,10,"Lincoln, Missouri, United States"
"04-01-2020","30053","Lincoln","Montana","United States",2020-04-01 15:58:49,48.54265777,-115.4046155,5,1,0,4,"Lincoln, Montana, United States"
"04-01-2020","31111","Lincoln","Nebraska","United States",2020-04-01 15:58:49,41.04658298,-100.7475374,9,1,0,8,"Lincoln, Nebraska, United States"
"04-01-2020","37109","Lincoln","North Carolina","United States",2020-04-01 15:58:49,35.48508185,-81.21740317,4,0,0,4,"Lincoln, North Carolina, United States"
"04-01-2020","40081","Lincoln","Oklahoma","United States",2020-04-01 15:58:49,35.70270942,-96.8812462,5,0,0,5,"Lincoln, Oklahoma, United States"
"04-01-2020","41041","Lincoln","Oregon","United States",2020-04-01 15:58:49,44.64252874,-123.869912,3,0,0,3,"Lincoln, Oregon, United States"
"04-01-2020","46083","Lincoln","South Dakota","United States",2020-04-01 15:58:49,43.27841182,-96.7203905,11,0,0,11,"Lincoln, South Dakota, United States"
"04-01-2020","47103","Lincoln","Tennessee","United States",2020-04-01 15:58:49,35.13738622,-86.58910106,2,0,0,2,"Lincoln, Tennessee, United States"
"04-01-2020","53043","Lincoln","Washington","United States",2020-04-01 15:58:49,47.57705241,-118.4194388,1,0,0,1,"Lincoln, Washington, United States"
"04-01-2020","19113","Linn","Iowa","United States",2020-04-01 15:58:49,42.07923082,-91.59809485,94,2,0,92,"Linn, Iowa, United States"
"04-01-2020","20107","Linn","Kansas","United States",2020-04-01 15:58:49,38.21267844,-94.84254089,5,0,0,5,"Linn, Kansas, United States"
"04-01-2020","41043","Linn","Oregon","United States",2020-04-01 15:58:49,44.48899494,-122.5373154,37,2,0,35,"Linn, Oregon, United States"
"04-01-2020","09005","Litchfield","Connecticut","United States",2020-04-01 15:58:49,41.7937534,-73.2451475,131,1,0,130,"Litchfield, Connecticut, United States"
"04-01-2020","48297","Live Oak","Texas","United States",2020-04-01 15:58:49,28.35101362,-98.1246786,1,0,0,1,"Live Oak, Texas, United States"
"04-01-2020","17105","Livingston","Illinois","United States",2020-04-01 15:58:49,40.89188292,-88.55784752,5,0,0,5,"Livingston, Illinois, United States"
"04-01-2020","22063","Livingston","Louisiana","United States",2020-04-01 15:58:49,30.44143993,-90.73061664,25,0,0,25,"Livingston, Louisiana, United States"
"04-01-2020","26093","Livingston","Michigan","United States",2020-04-01 15:58:49,42.60302282,-83.91297209,102,2,0,100,"Livingston, Michigan, United States"
"04-01-2020","29117","Livingston","Missouri","United States",2020-04-01 15:58:49,39.78110272,-93.54645978,1,0,0,1,"Livingston, Missouri, United States"
"04-01-2020","36051","Livingston","New York","United States",2020-04-01 15:58:49,42.72596275,-77.77966158,18,0,0,18,"Livingston, New York, United States"
"04-01-2020","48299","Llano","Texas","United States",2020-04-01 15:58:49,30.70645047,-98.68475262,3,0,0,3,"Llano, Texas, United States"
"04-01-2020","08075","Logan","Colorado","United States",2020-04-01 15:58:49,40.7249637,-103.110817,6,0,0,6,"Logan, Colorado, United States"
"04-01-2020","21141","Logan","Kentucky","United States",2020-04-01 15:58:49,36.85949479,-86.877635,3,0,0,3,"Logan, Kentucky, United States"
"04-01-2020","39091","Logan","Ohio","United States",2020-04-01 15:58:49,40.38996525,-83.76784341,3,0,0,3,"Logan, Ohio, United States"
"04-01-2020","40083","Logan","Oklahoma","United States",2020-04-01 15:58:49,35.91899576,-97.44352845,4,0,0,4,"Logan, Oklahoma, United States"
"04-01-2020","54045","Logan","West Virginia","United States",2020-04-01 15:58:49,37.8299889,-81.93528571,3,0,0,3,"Logan, West Virginia, United States"
"04-01-2020","13183","Long","Georgia","United States",2020-04-01 15:58:49,31.75218791,-81.74952375,1,0,0,1,"Long, Georgia, United States"
"04-01-2020","05085","Lonoke","Arkansas","United States",2020-04-01 15:58:49,34.75392199,-91.88742357,6,0,0,6,"Lonoke, Arkansas, United States"
"04-01-2020","39093","Lorain","Ohio","United States",2020-04-01 15:58:49,41.29553751,-82.15083537,85,2,0,83,"Lorain, Ohio, United States"
"04-01-2020","06037","Los Angeles","California","United States",2020-04-01 15:58:49,34.30828379,-118.2282411,3518,64,0,3454,"Los Angeles, California, United States"
"04-01-2020","47105","Loudon","Tennessee","United States",2020-04-01 15:58:49,35.73939663,-84.31145275,8,0,0,8,"Loudon, Tennessee, United States"
"04-01-2020","51107","Loudoun","Virginia","United States",2020-04-01 15:58:49,39.08990083,-77.63481877,105,1,0,104,"Loudoun, Virginia, United States"
"04-01-2020","51109","Louisa","Virginia","United States",2020-04-01 15:58:49,37.97850256,-77.96274807,12,0,0,12,"Louisa, Virginia, United States"
"04-01-2020","40085","Love","Oklahoma","United States",2020-04-01 15:58:49,33.95273467,-97.23906784,1,0,0,1,"Love, Oklahoma, United States"
"04-01-2020","01085","Lowndes","Alabama","United States",2020-04-01 15:58:49,32.1597283,-86.65158371,1,0,0,1,"Lowndes, Alabama, United States"
"04-01-2020","13185","Lowndes","Georgia","United States",2020-04-01 15:58:49,30.83568832,-83.27056716,24,1,0,23,"Lowndes, Georgia, United States"
"04-01-2020","28087","Lowndes","Mississippi","United States",2020-04-01 15:58:49,33.47386518,-88.4419153,11,0,0,11,"Lowndes, Mississippi, United States"
"04-01-2020","48303","Lubbock","Texas","United States",2020-04-01 15:58:49,33.61008596,-101.8204789,100,2,0,98,"Lubbock, Texas, United States"
"04-01-2020","39095","Lucas","Ohio","United States",2020-04-01 15:58:49,41.62101218,-83.65468618,171,3,0,168,"Lucas, Ohio, United States"
"04-01-2020","13187","Lumpkin","Georgia","United States",2020-04-01 15:58:49,34.57286511,-84.00425681,7,0,0,7,"Lumpkin, Georgia, United States"
"04-01-2020","42079","Luzerne","Pennsylvania","United States",2020-04-01 15:58:49,41.17823008,-75.98447579,282,4,0,278,"Luzerne, Pennsylvania, United States"
"04-01-2020","42081","Lycoming","Pennsylvania","United States",2020-04-01 15:58:49,41.34310539,-77.06629984,7,0,0,7,"Lycoming, Pennsylvania, United States"
"04-01-2020","46085","Lyman","South Dakota","United States",2020-04-01 15:58:49,43.89522709,-99.85201878,1,0,0,1,"Lyman, South Dakota, United States"
"04-01-2020","51680","Lynchburg","Virginia","United States",2020-04-01 15:58:49,37.40021399,-79.19888138,7,0,0,7,"Lynchburg, Virginia, United States"
"04-01-2020","48305","Lynn","Texas","United States",2020-04-01 15:58:49,33.17657705,-101.8162849,2,0,0,2,"Lynn, Texas, United States"
"04-01-2020","20111","Lyon","Kansas","United States",2020-04-01 15:58:49,38.45576156,-96.15275715,12,0,0,12,"Lyon, Kansas, United States"
"04-01-2020","21143","Lyon","Kentucky","United States",2020-04-01 15:58:49,37.02080035,-88.07886257,1,0,0,1,"Lyon, Kentucky, United States"
"04-01-2020","27083","Lyon","Minnesota","United States",2020-04-01 15:58:49,44.41327865,-95.83806103,2,0,0,2,"Lyon, Minnesota, United States"
"04-01-2020","32019","Lyon","Nevada","United States",2020-04-01 15:58:49,39.01777974,-119.1870479,1,0,0,1,"Lyon, Nevada, United States"
"04-01-2020","26097","Mackinac","Michigan","United States",2020-04-01 15:58:49,46.07028979,-85.04980537,1,0,0,1,"Mackinac, Michigan, United States"
"04-01-2020","26099","Macomb","Michigan","United States",2020-04-01 15:58:49,42.69158356,-82.92752801,1088,51,0,1037,"Macomb, Michigan, United States"
"04-01-2020","01087","Macon","Alabama","United States",2020-04-01 15:58:49,32.38759944,-85.69267724,1,0,0,1,"Macon, Alabama, United States"
"04-01-2020","13193","Macon","Georgia","United States",2020-04-01 15:58:49,32.35207048,-84.04234127,2,0,0,2,"Macon, Georgia, United States"
"04-01-2020","17115","Macon","Illinois","United States",2020-04-01 15:58:49,39.86064913,-88.96342505,2,0,0,2,"Macon, Illinois, United States"
"04-01-2020","29121","Macon","Missouri","United States",2020-04-01 15:58:49,39.83049768,-92.56453089,3,0,0,3,"Macon, Missouri, United States"
"04-01-2020","47111","Macon","Tennessee","United States",2020-04-01 15:58:49,36.53157855,-86.00778595,4,0,0,4,"Macon, Tennessee, United States"
"04-01-2020","06039","Madera","California","United States",2020-04-01 15:58:49,37.21513971,-119.7665589,23,1,0,22,"Madera, California, United States"
"04-01-2020","01089","Madison","Alabama","United States",2020-04-01 15:58:49,34.76327133,-86.55069633,105,1,0,104,"Madison, Alabama, United States"
"04-01-2020","13195","Madison","Georgia","United States",2020-04-01 15:58:49,34.12920917,-83.21218732,3,1,0,2,"Madison, Georgia, United States"
"04-01-2020","16065","Madison","Idaho","United States",2020-04-01 15:58:49,43.78141028,-111.6538474,4,0,0,4,"Madison, Idaho, United States"
"04-01-2020","17119","Madison","Illinois","United States",2020-04-01 15:58:49,38.83042506,-89.90422563,25,0,0,25,"Madison, Illinois, United States"
"04-01-2020","18095","Madison","Indiana","United States",2020-04-01 15:58:49,40.16143691,-85.71964711,46,2,0,44,"Madison, Indiana, United States"
"04-01-2020","19121","Madison","Iowa","United States",2020-04-01 15:58:49,41.33081904,-94.01554631,1,0,0,1,"Madison, Iowa, United States"
"04-01-2020","21151","Madison","Kentucky","United States",2020-04-01 15:58:49,37.71659336,-84.27220275,10,0,0,10,"Madison, Kentucky, United States"
"04-01-2020","22065","Madison","Louisiana","United States",2020-04-01 15:58:49,32.36918118,-91.23973355,1,0,0,1,"Madison, Louisiana, United States"
"04-01-2020","28089","Madison","Mississippi","United States",2020-04-01 15:58:49,32.63389156,-90.03513564,53,0,0,53,"Madison, Mississippi, United States"
"04-01-2020","30057","Madison","Montana","United States",2020-04-01 15:58:49,45.30080065,-111.9173017,6,2,0,4,"Madison, Montana, United States"
"04-01-2020","31119","Madison","Nebraska","United States",2020-04-01 15:58:49,41.91676024,-97.6005481,3,0,0,3,"Madison, Nebraska, United States"
"04-01-2020","36053","Madison","New York","United States",2020-04-01 15:58:49,42.91653905,-75.67266639,62,2,0,60,"Madison, New York, United States"
"04-01-2020","39097","Madison","Ohio","United States",2020-04-01 15:58:49,39.89381073,-83.40178317,9,2,0,7,"Madison, Ohio, United States"
"04-01-2020","47113","Madison","Tennessee","United States",2020-04-01 15:58:49,35.61181957,-88.84076036,7,0,0,7,"Madison, Tennessee, United States"
"04-01-2020","51113","Madison","Virginia","United States",2020-04-01 15:58:49,38.41531222,-78.28220331,3,0,0,3,"Madison, Virginia, United States"
