"Date_Published","FIPS","Admin2","Province_State","Country_Region","Last_Update","Latitude","Longitude","Confirmed","Deaths","Recovered","Active","Combined_Key"
"04-01-2020","45001","Abbeville","South Carolina","United States",2020-04-01 15:58:49,34.22333378,-82.46170658,4,0,0,4,"Abbeville, South Carolina, United States"
"04-01-2020","22001","Acadia","Louisiana","United States",2020-04-01 15:58:49,30.2950649,-92.41419698,47,1,0,46,"Acadia, Louisiana, United States"
"04-01-2020","51001","Accomack","Virginia","United States",2020-04-01 15:58:49,37.76707161,-75.63234615,7,0,0,7,"Accomack, Virginia, United States"
"04-01-2020","16001","Ada","Idaho","United States",2020-04-01 15:58:49,43.4526575,-116.2415516,195,3,0,192,"Ada, Idaho, United States"
"04-01-2020","19001","Adair","Iowa","United States",2020-04-01 15:58:49,41.33075609,-94.47105874,1,0,0,1,"Adair, Iowa, United States"
"04-01-2020","29001","Adair","Missouri","United States",2020-04-01 15:58:49,40.19058551,-92.60078167,3,0,0,3,"Adair, Missouri, United States"
"04-01-2020","40001","Adair","Oklahoma","United States",2020-04-01 15:58:49,35.88494195,-94.65859267,8,0,0,8,"Adair, Oklahoma, United States"
"04-01-2020","08001","Adams","Colorado","United States",2020-04-01 15:58:49,39.87432092,-104.3362578,181,2,0,179,"Adams, Colorado, United States"
"04-01-2020","17001","Adams","Illinois","United States",2020-04-01 15:58:49,39.98815591,-91.18786813,2,0,0,2,"Adams, Illinois, United States"
"04-01-2020","18001","Adams","Indiana","United States",2020-04-01 15:58:49,40.7457653,-84.93671406,1,0,0,1,"Adams, Indiana, United States"
"04-01-2020","28001","Adams","Mississippi","United States",2020-04-01 15:58:49,31.47669768,-91.35326037,11,0,0,11,"Adams, Mississippi, United States"
"04-01-2020","31001","Adams","Nebraska","United States",2020-04-01 15:58:49,40.5244942,-98.50117804,4,0,0,4,"Adams, Nebraska, United States"
"04-01-2020","42001","Adams","Pennsylvania","United States",2020-04-01 15:58:49,39.87140411,-77.21610347,12,0,0,12,"Adams, Pennsylvania, United States"
"04-01-2020","53001","Adams","Washington","United States",2020-04-01 15:58:49,46.98299757,-118.5601734,14,0,0,14,"Adams, Washington, United States"
"04-01-2020","50001","Addison","Vermont","United States",2020-04-01 15:58:49,44.03217337,-73.14130877,24,0,0,24,"Addison, Vermont, United States"
"04-01-2020","45003","Aiken","South Carolina","United States",2020-04-01 15:58:49,33.54338026,-81.63645384,18,1,0,17,"Aiken, South Carolina, United States"
"04-01-2020","12001","Alachua","Florida","United States",2020-04-01 15:58:49,29.67866525,-82.35928158,90,0,0,90,"Alachua, Florida, United States"
"04-01-2020","37001","Alamance","North Carolina","United States",2020-04-01 15:58:49,36.0434701,-79.39976137,7,0,0,7,"Alamance, North Carolina, United States"
"04-01-2020","06001","Alameda","California","United States",2020-04-01 15:58:49,37.64629437,-121.8929271,313,7,0,306,"Alameda, California, United States"
"04-01-2020","08003","Alamosa","Colorado","United States",2020-04-01 15:58:49,37.57250606,-105.7885451,1,0,0,1,"Alamosa, Colorado, United States"
"04-01-2020","36001","Albany","New York","United States",2020-04-01 15:58:49,42.60060306,-73.97723916,240,1,0,239,"Albany, New York, United States"
"04-01-2020","56001","Albany","Wyoming","United States",2020-04-01 15:58:49,41.65498705,-105.7235415,3,0,0,3,"Albany, Wyoming, United States"
"04-01-2020","51003","Albemarle","Virginia","United States",2020-04-01 15:58:49,38.02080697,-78.55481085,21,0,0,21,"Albemarle, Virginia, United States"
"04-01-2020","28003","Alcorn","Mississippi","United States",2020-04-01 15:58:49,34.88084463,-88.57996173,3,0,0,3,"Alcorn, Mississippi, United States"
"04-01-2020","37003","Alexander","North Carolina","United States",2020-04-01 15:58:49,35.9223796,-81.17751948,2,0,0,2,"Alexander, North Carolina, United States"
"04-01-2020","51510","Alexandria","Virginia","United States",2020-04-01 15:58:49,38.814003,-77.08183073,32,0,0,32,"Alexandria, Virginia, United States"
"04-01-2020","19005","Allamakee","Iowa","United States",2020-04-01 15:58:49,43.28383218,-91.37860922,7,1,0,6,"Allamakee, Iowa, United States"
"04-01-2020","26005","Allegan","Michigan","United States",2020-04-01 15:58:49,42.59147037,-85.89102866,5,0,0,5,"Allegan, Michigan, United States"
"04-01-2020","36003","Allegany","New York","United States",2020-04-01 15:58:49,42.25748406,-78.02750466,10,1,0,9,"Allegany, New York, United States"
"04-01-2020","37005","Alleghany","North Carolina","United States",2020-04-01 15:58:49,36.49360862,-81.12857041,2,0,0,2,"Alleghany, North Carolina, United States"
"04-01-2020","51005","Alleghany","Virginia","United States",2020-04-01 15:58:49,37.78636074,-80.00222498,1,0,0,1,"Alleghany, Virginia, United States"
"04-01-2020","42003","Allegheny","Pennsylvania","United States",2020-04-01 15:58:49,40.46809875,-79.98167747,356,2,0,354,"Allegheny, Pennsylvania, United States"
"04-01-2020","18003","Allen","Indiana","United States",2020-04-01 15:58:49,41.09194313,-85.06800636,39,2,0,37,"Allen, Indiana, United States"
"04-01-2020","21003","Allen","Kentucky","United States",2020-04-01 15:58:49,36.75197631,-86.19457544,2,0,0,2,"Allen, Kentucky, United States"
"04-01-2020","22003","Allen","Louisiana","United States",2020-04-01 15:58:49,30.65385745,-92.82442028,19,0,0,19,"Allen, Louisiana, United States"
"04-01-2020","39003","Allen","Ohio","United States",2020-04-01 15:58:49,40.77285242,-84.10802343,6,0,0,6,"Allen, Ohio, United States"
"04-01-2020","45005","Allendale","South Carolina","United States",2020-04-01 15:58:49,32.98837386,-81.35321066,1,0,0,1,"Allendale, South Carolina, United States"
"04-01-2020","06003","Alpine","California","United States",2020-04-01 15:58:49,38.59678594,-119.8223594,1,0,0,1,"Alpine, California, United States"
"04-01-2020","06005","Amador","California","United States",2020-04-01 15:58:49,38.44583082,-120.65696,2,0,0,2,"Amador, California, United States"
"04-01-2020","51007","Amelia","Virginia","United States",2020-04-01 15:58:49,37.34081025,-77.98584649,2,0,0,2,"Amelia, Virginia, United States"
"04-01-2020","51009","Amherst","Virginia","United States",2020-04-01 15:58:49,37.60308293,-79.14548696,5,0,0,5,"Amherst, Virginia, United States"
"04-01-2020","28005","Amite","Mississippi","United States",2020-04-01 15:58:49,31.17467303,-90.80501621,4,1,0,3,"Amite, Mississippi, United States"
"04-01-2020","02020","Anchorage","Alaska","United States",2020-04-01 15:58:49,61.14998174,-149.1426986,65,1,0,64,"Anchorage, Alaska, United States"
"04-01-2020","21005","Anderson","Kentucky","United States",2020-04-01 15:58:49,38.00671029,-84.99171713,2,1,0,1,"Anderson, Kentucky, United States"
"04-01-2020","45007","Anderson","South Carolina","United States",2020-04-01 15:58:49,34.51828081,-82.63959517,47,2,0,45,"Anderson, South Carolina, United States"
"04-01-2020","47001","Anderson","Tennessee","United States",2020-04-01 15:58:49,36.12684348,-84.19965764,10,0,0,10,"Anderson, Tennessee, United States"
"04-01-2020","48001","Anderson","Texas","United States",2020-04-01 15:58:49,31.81534745,-95.65354823,1,0,0,1,"Anderson, Texas, United States"
"04-01-2020","48003","Andrews","Texas","United States",2020-04-01 15:58:49,32.30468633,-102.6376548,0,0,0,0,"Andrews, Texas, United States"
"04-01-2020","23001","Androscoggin","Maine","United States",2020-04-01 15:58:49,44.1664747,-70.20380627,11,0,0,11,"Androscoggin, Maine, United States"
"04-01-2020","48005","Angelina","Texas","United States",2020-04-01 15:58:49,31.25457347,-94.60901487,5,0,0,5,"Angelina, Texas, United States"
"04-01-2020","24003","Anne Arundel","Maryland","United States",2020-04-01 15:58:49,39.00670238,-76.60329337,158,1,0,157,"Anne Arundel, Maryland, United States"
"04-01-2020","27003","Anoka","Minnesota","United States",2020-04-01 15:58:49,45.27476015,-93.24604565,26,0,0,26,"Anoka, Minnesota, United States"
"04-01-2020","37007","Anson","North Carolina","United States",2020-04-01 15:58:49,34.97403241,-80.09953279,1,0,0,1,"Anson, North Carolina, United States"
"04-01-2020","31003","Antelope","Nebraska","United States",2020-04-01 15:58:49,42.17695516,-98.0666283,1,0,0,1,"Antelope, Nebraska, United States"
"04-01-2020","26009","Antrim","Michigan","United States",2020-04-01 15:58:49,44.99690221,-85.15503082,4,0,0,4,"Antrim, Michigan, United States"
"04-01-2020","04001","Apache","Arizona","United States",2020-04-01 15:58:49,35.39465006,-109.4892383,33,0,0,33,"Apache, Arizona, United States"
"04-01-2020","19007","Appanoose","Iowa","United States",2020-04-01 15:58:49,40.74324454,-92.86865906,1,0,0,1,"Appanoose, Iowa, United States"
"04-01-2020","13001","Appling","Georgia","United States",2020-04-01 15:58:49,31.74847232,-82.28909114,1,0,0,1,"Appling, Georgia, United States"
"04-01-2020","48007","Aransas","Texas","United States",2020-04-01 15:58:49,28.10556197,-96.9995047,0,0,0,0,"Aransas, Texas, United States"
"04-01-2020","08005","Arapahoe","Colorado","United States",2020-04-01 15:58:49,39.64977461,-104.3353617,333,6,0,327,"Arapahoe, Colorado, United States"
"04-01-2020","08007","Archuleta","Colorado","United States",2020-04-01 15:58:49,37.19474156,-107.0476867,1,0,0,1,"Archuleta, Colorado, United States"
"04-01-2020","26011","Arenac","Michigan","United States",2020-04-01 15:58:49,44.0636262,-83.89277559,1,0,0,1,"Arenac, Michigan, United States"
"04-01-2020","05001","Arkansas","Arkansas","United States",2020-04-01 15:58:49,34.29145151,-91.37277296,1,0,0,1,"Arkansas, Arkansas, United States"
"04-01-2020","51013","Arlington","Virginia","United States",2020-04-01 15:58:49,38.8767675,-77.10139853,119,2,0,117,"Arlington, Virginia, United States"
"04-01-2020","42005","Armstrong","Pennsylvania","United States",2020-04-01 15:58:49,40.81665618,-79.46290811,5,0,0,5,"Armstrong, Pennsylvania, United States"
"04-01-2020","22005","Ascension","Louisiana","United States",2020-04-01 15:58:49,30.20406249,-90.9132841,189,5,0,184,"Ascension, Louisiana, United States"
"04-01-2020","39005","Ashland","Ohio","United States",2020-04-01 15:58:49,40.84772277,-82.27280781,2,0,0,2,"Ashland, Ohio, United States"
"04-01-2020","55003","Ashland","Wisconsin","United States",2020-04-01 15:58:49,46.31956891,-90.67837132,1,0,0,1,"Ashland, Wisconsin, United States"
"04-01-2020","05003","Ashley","Arkansas","United States",2020-04-01 15:58:49,33.19153461,-91.7698471,1,0,0,1,"Ashley, Arkansas, United States"
"04-01-2020","39007","Ashtabula","Ohio","United States",2020-04-01 15:58:49,41.70860332,-80.74830218,6,0,0,6,"Ashtabula, Ohio, United States"
"04-01-2020","22007","Assumption","Louisiana","United States",2020-04-01 15:58:49,29.89946234,-91.06461642,25,0,0,25,"Assumption, Louisiana, United States"
"04-01-2020","48013","Atascosa","Texas","United States",2020-04-01 15:58:49,28.89333001,-98.52730485,2,0,0,2,"Atascosa, Texas, United States"
"04-01-2020","20005","Atchison","Kansas","United States",2020-04-01 15:58:49,39.53185661,-95.30870026,1,0,0,1,"Atchison, Kansas, United States"
"04-01-2020","29005","Atchison","Missouri","United States",2020-04-01 15:58:49,40.43238737,-95.42970639,1,0,0,1,"Atchison, Missouri, United States"
"04-01-2020","39009","Athens","Ohio","United States",2020-04-01 15:58:49,39.33425634,-82.04278644,3,1,0,2,"Athens, Ohio, United States"
"04-01-2020","34001","Atlantic","New Jersey","United States",2020-04-01 15:58:49,39.47538693,-74.65848483,40,0,0,40,"Atlantic, New Jersey, United States"
"04-01-2020","28007","Attala","Mississippi","United States",2020-04-01 15:58:49,33.08658803,-89.57838564,11,0,0,11,"Attala, Mississippi, United States"
"04-01-2020","19009","Audubon","Iowa","United States",2020-04-01 15:58:49,41.6844628,-94.90581859,1,0,0,1,"Audubon, Iowa, United States"
"04-01-2020","39011","Auglaize","Ohio","United States",2020-04-01 15:58:49,40.55998859,-84.2242143,3,0,0,3,"Auglaize, Ohio, United States"
"04-01-2020","51015","Augusta","Virginia","United States",2020-04-01 15:58:49,38.16404586,-79.12461614,1,0,0,1,"Augusta, Virginia, United States"
"04-01-2020","46003","Aurora","South Dakota","United States",2020-04-01 15:58:49,43.71757685,-98.56050467,1,0,0,1,"Aurora, South Dakota, United States"
"04-01-2020","48015","Austin","Texas","United States",2020-04-01 15:58:49,29.88548725,-96.27736949,2,0,0,2,"Austin, Texas, United States"
"04-01-2020","01001","Autauga","Alabama","United States",2020-04-01 15:58:49,32.53952745,-86.64408227,8,0,0,8,"Autauga, Alabama, United States"
"04-01-2020","22009","Avoyelles","Louisiana","United States",2020-04-01 15:58:49,31.07796211,-92.00079449,31,2,0,29,"Avoyelles, Louisiana, United States"
"04-01-2020","08009","Baca","Colorado","United States",2020-04-01 15:58:49,37.31940883,-102.5603223,3,0,0,3,"Baca, Colorado, United States"
"04-01-2020","13005","Bacon","Georgia","United States",2020-04-01 15:58:49,31.55456473,-82.45936528,6,0,0,6,"Bacon, Georgia, United States"
"04-01-2020","12003","Baker","Florida","United States",2020-04-01 15:58:49,30.33060121,-82.28467476,9,0,0,9,"Baker, Florida, United States"
"04-01-2020","13007","Baker","Georgia","United States",2020-04-01 15:58:49,31.32669878,-84.44218806,4,1,0,3,"Baker, Georgia, United States"
"04-01-2020","01003","Baldwin","Alabama","United States",2020-04-01 15:58:49,30.72774991,-87.72207058,20,1,0,19,"Baldwin, Alabama, United States"
"04-01-2020","13009","Baldwin","Georgia","United States",2020-04-01 15:58:49,33.06882326,-83.24701748,6,1,0,5,"Baldwin, Georgia, United States"
"04-01-2020","24005","Baltimore","Maryland","United States",2020-04-01 15:58:49,39.45784712,-76.62911955,289,1,0,288,"Baltimore, Maryland, United States"
"04-01-2020","24510","Baltimore City","Maryland","United States",2020-04-01 15:58:49,39.30211911,-76.61151012,221,2,0,219,"Baltimore City, Maryland, United States"
"04-01-2020","45009","Bamberg","South Carolina","United States",2020-04-01 15:58:49,33.21927586,-81.05659969,4,0,0,4,"Bamberg, South Carolina, United States"
"04-01-2020","13011","Banks","Georgia","United States",2020-04-01 15:58:49,34.35607081,-83.49644388,3,0,0,3,"Banks, Georgia, United States"
"04-01-2020","16005","Bannock","Idaho","United States",2020-04-01 15:58:49,42.67002716,-112.2233311,4,0,0,4,"Bannock, Idaho, United States"
"04-01-2020","54001","Barbour","West Virginia","United States",2020-04-01 15:58:49,39.1307219,-80.00350858,1,0,0,1,"Barbour, West Virginia, United States"
"04-01-2020","38003","Barnes","North Dakota","United States",2020-04-01 15:58:49,46.93579637,-98.06605978,2,0,0,2,"Barnes, North Dakota, United States"
"04-01-2020","25001","Barnstable","Massachusetts","United States",2020-04-01 15:58:49,41.72980578,-70.28854339,255,3,0,252,"Barnstable, Massachusetts, United States"
"04-01-2020","45011","Barnwell","South Carolina","United States",2020-04-01 15:58:49,33.26679302,-81.43584352,2,0,0,2,"Barnwell, South Carolina, United States"
"04-01-2020","21009","Barren","Kentucky","United States",2020-04-01 15:58:49,36.96469836,-85.93338945,1,0,0,1,"Barren, Kentucky, United States"
"04-01-2020","13013","Barrow","Georgia","United States",2020-04-01 15:58:49,33.99148694,-83.71436292,20,2,0,18,"Barrow, Georgia, United States"
"04-01-2020","26015","Barry","Michigan","United States",2020-04-01 15:58:49,42.59513984,-85.30834519,2,0,0,2,"Barry, Michigan, United States"
"04-01-2020","29009","Barry","Missouri","United States",2020-04-01 15:58:49,36.70978521,-93.82919888,1,0,0,1,"Barry, Missouri, United States"
"04-01-2020","18005","Bartholomew","Indiana","United States",2020-04-01 15:58:49,39.20744865,-85.89558181,13,0,0,13,"Bartholomew, Indiana, United States"
"04-01-2020","20009","Barton","Kansas","United States",2020-04-01 15:58:49,38.47889676,-98.75636726,1,0,0,1,"Barton, Kansas, United States"
"04-01-2020","13015","Bartow","Georgia","United States",2020-04-01 15:58:49,34.23732119,-84.83887523,144,4,0,140,"Bartow, Georgia, United States"
"04-01-2020","48021","Bastrop","Texas","United States",2020-04-01 15:58:49,30.10370699,-97.31206354,8,0,0,8,"Bastrop, Texas, United States"
"04-01-2020","29013","Bates","Missouri","United States",2020-04-01 15:58:49,38.25271289,-94.34113157,2,0,0,2,"Bates, Missouri, United States"
"04-01-2020","05005","Baxter","Arkansas","United States",2020-04-01 15:58:49,36.28784385,-92.33782872,1,0,0,1,"Baxter, Arkansas, United States"
"04-01-2020","12005","Bay","Florida","United States",2020-04-01 15:58:49,30.26548745,-85.62122584,10,0,0,10,"Bay, Florida, United States"
"04-01-2020","26017","Bay","Michigan","United States",2020-04-01 15:58:49,43.70639106,-83.98731479,10,0,0,10,"Bay, Michigan, United States"
"04-01-2020","55007","Bayfield","Wisconsin","United States",2020-04-01 15:58:49,46.52868768,-91.19716729,3,0,0,3,"Bayfield, Wisconsin, United States"
"04-01-2020","46005","Beadle","South Dakota","United States",2020-04-01 15:58:49,44.41464384,-98.27858469,21,1,0,20,"Beadle, South Dakota, United States"
"04-01-2020","37013","Beaufort","North Carolina","United States",2020-04-01 15:58:49,35.48531943,-76.84325809,7,0,0,7,"Beaufort, North Carolina, United States"
"04-01-2020","45013","Beaufort","South Carolina","United States",2020-04-01 15:58:49,32.39226291,-80.72619758,101,2,0,99,"Beaufort, South Carolina, United States"
"04-01-2020","22011","Beauregard","Louisiana","United States",2020-04-01 15:58:49,30.64836518,-93.34173616,8,0,0,8,"Beauregard, Louisiana, United States"
"04-01-2020","42007","Beaver","Pennsylvania","United States",2020-04-01 15:58:49,40.6825484,-80.34921611,54,2,0,52,"Beaver, Pennsylvania, United States"
"04-01-2020","40009","Beckham","Oklahoma","United States",2020-04-01 15:58:49,35.26862449,-99.68128023,1,0,0,1,"Beckham, Oklahoma, United States"
"04-01-2020","42009","Bedford","Pennsylvania","United States",2020-04-01 15:58:49,40.00522157,-78.48998442,3,0,0,3,"Bedford, Pennsylvania, United States"
"04-01-2020","47003","Bedford","Tennessee","United States",2020-04-01 15:58:49,35.51123746,-86.45549096,4,0,0,4,"Bedford, Tennessee, United States"
"04-01-2020","51019","Bedford","Virginia","United States",2020-04-01 15:58:49,37.3080028,-79.5281964,3,0,0,3,"Bedford, Virginia, United States"
"04-01-2020","33001","Belknap","New Hampshire","United States",2020-04-01 15:58:49,43.51637314,-71.41684235,12,0,0,12,"Belknap, New Hampshire, United States"
"04-01-2020","48027","Bell","Texas","United States",2020-04-01 15:58:49,31.03736027,-97.4785025,46,1,0,45,"Bell, Texas, United States"
"04-01-2020","39013","Belmont","Ohio","United States",2020-04-01 15:58:49,40.01625942,-80.9924051,11,0,0,11,"Belmont, Ohio, United States"
"04-01-2020","27007","Beltrami","Minnesota","United States",2020-04-01 15:58:49,47.97373527,-94.93732139,4,0,0,4,"Beltrami, Minnesota, United States"
"04-01-2020","13017","Ben Hill","Georgia","United States",2020-04-01 15:58:49,31.76095874,-83.22145359,3,0,0,3,"Ben Hill, Georgia, United States"
"04-01-2020","50003","Bennington","Vermont","United States",2020-04-01 15:58:49,43.03519828,-73.09048868,18,0,0,18,"Bennington, Vermont, United States"
"04-01-2020","05007","Benton","Arkansas","United States",2020-04-01 15:58:49,36.33644656,-94.25680817,39,0,0,39,"Benton, Arkansas, United States"
"04-01-2020","18007","Benton","Indiana","United States",2020-04-01 15:58:49,40.60626947,-87.31093999,1,0,0,1,"Benton, Indiana, United States"
"04-01-2020","19011","Benton","Iowa","United States",2020-04-01 15:58:49,42.08011739,-92.06463573,7,0,0,7,"Benton, Iowa, United States"
"04-01-2020","27009","Benton","Minnesota","United States",2020-04-01 15:58:49,45.69804958,-93.99514135,1,0,0,1,"Benton, Minnesota, United States"
"04-01-2020","28009","Benton","Mississippi","United States",2020-04-01 15:58:49,34.81681228,-89.18945516,4,0,0,4,"Benton, Mississippi, United States"
"04-01-2020","29015","Benton","Missouri","United States",2020-04-01 15:58:49,38.29503305,-93.28756116,3,0,0,3,"Benton, Missouri, United States"
"04-01-2020","41003","Benton","Oregon","United States",2020-04-01 15:58:49,44.49167306,-123.4316987,13,1,0,12,"Benton, Oregon, United States"
"04-01-2020","47005","Benton","Tennessee","United States",2020-04-01 15:58:49,36.07110411,-88.06849355,4,0,0,4,"Benton, Tennessee, United States"
"04-01-2020","53005","Benton","Washington","United States",2020-04-01 15:58:49,46.23946995,-119.5120834,108,7,0,101,"Benton, Washington, United States"
"04-01-2020","34003","Bergen","New Jersey","United States",2020-04-01 15:58:49,40.96010917,-74.07164325,3494,75,0,3419,"Bergen, New Jersey, United States"
"04-01-2020","45015","Berkeley","South Carolina","United States",2020-04-01 15:58:49,33.20222596,-79.94654523,18,0,0,18,"Berkeley, South Carolina, United States"
"04-01-2020","54003","Berkeley","West Virginia","United States",2020-04-01 15:58:49,39.46704621,-78.02414609,21,0,0,21,"Berkeley, West Virginia, United States"
"04-01-2020","42011","Berks","Pennsylvania","United States",2020-04-01 15:58:49,40.41570541,-75.92457766,151,0,0,151,"Berks, Pennsylvania, United States"
"04-01-2020","25003","Berkshire","Massachusetts","United States",2020-04-01 15:58:49,42.37428441,-73.20524838,183,4,0,179,"Berkshire, Massachusetts, United States"
"04-01-2020","35001","Bernalillo","New Mexico","United States",2020-04-01 15:58:49,35.05163625,-106.6703554,129,4,0,125,"Bernalillo, New Mexico, United States"
"04-01-2020","13019","Berrien","Georgia","United States",2020-04-01 15:58:49,31.27590016,-83.2252992,2,0,0,2,"Berrien, Georgia, United States"
"04-01-2020","26021","Berrien","Michigan","United States",2020-04-01 15:58:49,41.95447397,-86.4131308,38,1,0,37,"Berrien, Michigan, United States"
"04-01-2020","37015","Bertie","North Carolina","United States",2020-04-01 15:58:49,36.0688473,-76.96545943,6,0,0,6,"Bertie, North Carolina, United States"
"04-01-2020","48029","Bexar","Texas","United States",2020-04-01 15:58:49,29.44928723,-98.52019748,207,9,0,198,"Bexar, Texas, United States"
"04-01-2020","01007","Bibb","Alabama","United States",2020-04-01 15:58:49,32.99642064,-87.1251146,3,0,0,3,"Bibb, Alabama, United States"
"04-01-2020","13021","Bibb","Georgia","United States",2020-04-01 15:58:49,32.80904227,-83.70489165,22,0,0,22,"Bibb, Georgia, United States"
"04-01-2020","22013","Bienville","Louisiana","United States",2020-04-01 15:58:49,32.34569994,-93.05398492,6,1,0,5,"Bienville, Louisiana, United States"
"04-01-2020","27011","Big Stone","Minnesota","United States",2020-04-01 15:58:49,45.42712824,-96.41403739,1,0,0,1,"Big Stone, Minnesota, United States"
"04-01-2020","16011","Bingham","Idaho","United States",2020-04-01 15:58:49,43.2167288,-112.3978437,2,0,0,2,"Bingham, Idaho, United States"
"04-01-2020","19013","Black Hawk","Iowa","United States",2020-04-01 15:58:49,42.4704581,-92.30524729,7,0,0,7,"Black Hawk, Iowa, United States"
"04-01-2020","16013","Blaine","Idaho","United States",2020-04-01 15:58:49,43.4085812,-113.9752658,228,2,0,226,"Blaine, Idaho, United States"
"04-01-2020","42013","Blair","Pennsylvania","United States",2020-04-01 15:58:49,40.47961444,-78.34917412,4,0,0,4,"Blair, Pennsylvania, United States"
"04-01-2020","48031","Blanco","Texas","United States",2020-04-01 15:58:49,30.26640707,-98.3999852,1,0,0,1,"Blanco, Texas, United States"
"04-01-2020","13023","Bleckley","Georgia","United States",2020-04-01 15:58:49,32.43829035,-83.33035166,1,0,0,1,"Bleckley, Georgia, United States"
"04-01-2020","47007","Bledsoe","Tennessee","United States",2020-04-01 15:58:49,35.59942968,-85.20611967,2,0,0,2,"Bledsoe, Tennessee, United States"
"04-01-2020","01009","Blount","Alabama","United States",2020-04-01 15:58:49,33.98210918,-86.56790593,5,0,0,5,"Blount, Alabama, United States"
"04-01-2020","47009","Blount","Tennessee","United States",2020-04-01 15:58:49,35.68938198,-83.92847788,28,0,0,28,"Blount, Tennessee, United States"
"04-01-2020","27013","Blue Earth","Minnesota","United States",2020-04-01 15:58:49,44.03554215,-94.06699781,9,0,0,9,"Blue Earth, Minnesota, United States"
"04-01-2020","28011","Bolivar","Mississippi","United States",2020-04-01 15:58:49,33.79696941,-90.87372121,25,1,0,24,"Bolivar, Mississippi, United States"
"04-01-2020","29017","Bollinger","Missouri","United States",2020-04-01 15:58:49,37.32449052,-90.02725304,1,0,0,1,"Bollinger, Missouri, United States"
"04-01-2020","46009","Bon Homme","South Dakota","United States",2020-04-01 15:58:49,42.98914167,-97.88592746,1,0,0,1,"Bon Homme, South Dakota, United States"
"04-01-2020","17005","Bond","Illinois","United States",2020-04-01 15:58:49,38.88829622,-89.43534887,2,0,0,2,"Bond, Illinois, United States"
"04-01-2020","16017","Bonner","Idaho","United States",2020-04-01 15:58:49,48.29996017,-116.6017932,1,0,0,1,"Bonner, Idaho, United States"
"04-01-2020","16019","Bonneville","Idaho","United States",2020-04-01 15:58:49,43.38713372,-111.6161537,2,0,0,2,"Bonneville, Idaho, United States"
"04-01-2020","05009","Boone","Arkansas","United States",2020-04-01 15:58:49,36.3084504,-93.09374925,1,0,0,1,"Boone, Arkansas, United States"
"04-01-2020","18011","Boone","Indiana","United States",2020-04-01 15:58:49,40.0509304,-86.46841646,29,0,0,29,"Boone, Indiana, United States"
"04-01-2020","19015","Boone","Iowa","United States",2020-04-01 15:58:49,42.03657094,-93.9313999,1,0,0,1,"Boone, Iowa, United States"
"04-01-2020","21015","Boone","Kentucky","United States",2020-04-01 15:58:49,38.97065142,-84.72615357,8,0,0,8,"Boone, Kentucky, United States"
"04-01-2020","29019","Boone","Missouri","United States",2020-04-01 15:58:49,38.99186229,-92.30723575,66,1,0,65,"Boone, Missouri, United States"
"04-01-2020","22015","Bossier","Louisiana","United States",2020-04-01 15:58:49,32.67932307,-93.60460152,75,1,0,74,"Bossier, Louisiana, United States"
"04-01-2020","51023","Botetourt","Virginia","United States",2020-04-01 15:58:49,37.55531756,-79.80982182,6,0,0,6,"Botetourt, Virginia, United States"
"04-01-2020","08013","Boulder","Colorado","United States",2020-04-01 15:58:49,40.09313619,-105.3546767,107,2,0,105,"Boulder, Colorado, United States"
"04-01-2020","20011","Bourbon","Kansas","United States",2020-04-01 15:58:49,37.85508555,-94.84865997,3,0,0,3,"Bourbon, Kansas, United States"
