"Date_Published","FIPS","Admin2","Province_State","Country_Region","Last_Update","Latitude","Longitude","Confirmed","Deaths","Recovered","Active","Combined_Key"
"04-04-2020","45001","Abbeville","South Carolina","United States",2020-04-04 23:34:00,34.22333378,-82.46170658,6,0,0,6,"Abbeville, South Carolina, United States"
"04-04-2020","22001","Acadia","Louisiana","United States",2020-04-04 23:34:00,30.2950649,-92.41419698,65,2,0,63,"Acadia, Louisiana, United States"
"04-04-2020","51001","Accomack","Virginia","United States",2020-04-04 23:34:00,37.76707161,-75.63234615,8,0,0,8,"Accomack, Virginia, United States"
"04-04-2020","16001","Ada","Idaho","United States",2020-04-04 23:34:00,43.4526575,-116.2415516,360,3,0,357,"Ada, Idaho, United States"
"04-04-2020","19001","Adair","Iowa","United States",2020-04-04 23:34:00,41.33075609,-94.47105874,1,0,0,1,"Adair, Iowa, United States"
"04-04-2020","21001","Adair","Kentucky","United States",2020-04-04 23:34:00,37.10459774,-85.28129668,3,0,0,3,"Adair, Kentucky, United States"
"04-04-2020","29001","Adair","Missouri","United States",2020-04-04 23:34:00,40.19058551,-92.60078167,10,0,0,10,"Adair, Missouri, United States"
"04-04-2020","40001","Adair","Oklahoma","United States",2020-04-04 23:34:00,35.88494195,-94.65859267,14,0,0,14,"Adair, Oklahoma, United States"
"04-04-2020","08001","Adams","Colorado","United States",2020-04-04 23:34:00,39.87432092,-104.3362578,294,9,0,285,"Adams, Colorado, United States"
"04-04-2020","16003","Adams","Idaho","United States",2020-04-04 23:34:00,44.89333571,-116.4545247,1,0,0,1,"Adams, Idaho, United States"
"04-04-2020","17001","Adams","Illinois","United States",2020-04-04 23:34:00,39.98815591,-91.18786813,3,0,0,3,"Adams, Illinois, United States"
"04-04-2020","18001","Adams","Indiana","United States",2020-04-04 23:34:00,40.7457653,-84.93671406,2,0,0,2,"Adams, Indiana, United States"
"04-04-2020","28001","Adams","Mississippi","United States",2020-04-04 23:34:00,31.47669768,-91.35326037,16,0,0,16,"Adams, Mississippi, United States"
"04-04-2020","31001","Adams","Nebraska","United States",2020-04-04 23:34:00,40.5244942,-98.50117804,8,0,0,8,"Adams, Nebraska, United States"
"04-04-2020","39001","Adams","Ohio","United States",2020-04-04 23:34:00,38.84541072,-83.4718964,1,0,0,1,"Adams, Ohio, United States"
"04-04-2020","42001","Adams","Pennsylvania","United States",2020-04-04 23:34:00,39.87140411,-77.21610347,21,0,0,21,"Adams, Pennsylvania, United States"
"04-04-2020","53001","Adams","Washington","United States",2020-04-04 23:34:00,46.98299757,-118.5601734,20,0,0,20,"Adams, Washington, United States"
"04-04-2020","55001","Adams","Wisconsin","United States",2020-04-04 23:34:00,43.96974651,-89.76782777,1,0,0,1,"Adams, Wisconsin, United States"
"04-04-2020","50001","Addison","Vermont","United States",2020-04-04 23:34:00,44.03217337,-73.14130877,34,0,0,34,"Addison, Vermont, United States"
"04-04-2020","45003","Aiken","South Carolina","United States",2020-04-04 23:34:00,33.54338026,-81.63645384,24,1,0,23,"Aiken, South Carolina, United States"
"04-04-2020","12001","Alachua","Florida","United States",2020-04-04 23:34:00,29.67866525,-82.35928158,116,0,0,116,"Alachua, Florida, United States"
"04-04-2020","37001","Alamance","North Carolina","United States",2020-04-04 23:34:00,36.0434701,-79.39976137,16,0,0,16,"Alamance, North Carolina, United States"
"04-04-2020","06001","Alameda","California","United States",2020-04-04 23:34:00,37.64629437,-121.8929271,443,12,0,431,"Alameda, California, United States"
"04-04-2020","08003","Alamosa","Colorado","United States",2020-04-04 23:34:00,37.57250606,-105.7885451,4,0,0,4,"Alamosa, Colorado, United States"
"04-04-2020","36001","Albany","New York","United States",2020-04-04 23:34:00,42.60060306,-73.97723916,293,6,0,287,"Albany, New York, United States"
"04-04-2020","56001","Albany","Wyoming","United States",2020-04-04 23:34:00,41.65498705,-105.7235415,4,0,0,4,"Albany, Wyoming, United States"
"04-04-2020","51003","Albemarle","Virginia","United States",2020-04-04 23:34:00,38.02080697,-78.55481085,27,0,0,27,"Albemarle, Virginia, United States"
"04-04-2020","28003","Alcorn","Mississippi","United States",2020-04-04 23:34:00,34.88084463,-88.57996173,6,0,0,6,"Alcorn, Mississippi, United States"
"04-04-2020","37003","Alexander","North Carolina","United States",2020-04-04 23:34:00,35.9223796,-81.17751948,2,0,0,2,"Alexander, North Carolina, United States"
"04-04-2020","51510","Alexandria","Virginia","United States",2020-04-04 23:34:00,38.814003,-77.08183073,68,0,0,68,"Alexandria, Virginia, United States"
"04-04-2020","19005","Allamakee","Iowa","United States",2020-04-04 23:34:00,43.28383218,-91.37860922,16,1,0,15,"Allamakee, Iowa, United States"
"04-04-2020","26005","Allegan","Michigan","United States",2020-04-04 23:34:00,42.59147037,-85.89102866,10,0,0,10,"Allegan, Michigan, United States"
"04-04-2020","24001","Allegany","Maryland","United States",2020-04-04 23:34:00,39.62357628,-78.69280486,3,0,0,3,"Allegany, Maryland, United States"
"04-04-2020","36003","Allegany","New York","United States",2020-04-04 23:34:00,42.25748406,-78.02750466,16,1,0,15,"Allegany, New York, United States"
"04-04-2020","37005","Alleghany","North Carolina","United States",2020-04-04 23:34:00,36.49360862,-81.12857041,2,0,0,2,"Alleghany, North Carolina, United States"
"04-04-2020","51005","Alleghany","Virginia","United States",2020-04-04 23:34:00,37.78636074,-80.00222498,2,0,0,2,"Alleghany, Virginia, United States"
"04-04-2020","42003","Allegheny","Pennsylvania","United States",2020-04-04 23:34:00,40.46809875,-79.98167747,552,3,0,549,"Allegheny, Pennsylvania, United States"
"04-04-2020","18003","Allen","Indiana","United States",2020-04-04 23:34:00,41.09194313,-85.06800636,59,2,0,57,"Allen, Indiana, United States"
"04-04-2020","21003","Allen","Kentucky","United States",2020-04-04 23:34:00,36.75197631,-86.19457544,2,0,0,2,"Allen, Kentucky, United States"
"04-04-2020","22003","Allen","Louisiana","United States",2020-04-04 23:34:00,30.65385745,-92.82442028,39,3,0,36,"Allen, Louisiana, United States"
"04-04-2020","39003","Allen","Ohio","United States",2020-04-04 23:34:00,40.77285242,-84.10802343,15,0,0,15,"Allen, Ohio, United States"
"04-04-2020","45005","Allendale","South Carolina","United States",2020-04-04 23:34:00,32.98837386,-81.35321066,2,0,0,2,"Allendale, South Carolina, United States"
"04-04-2020","06003","Alpine","California","United States",2020-04-04 23:34:00,38.59678594,-119.8223594,1,0,0,1,"Alpine, California, United States"
"04-04-2020","06005","Amador","California","United States",2020-04-04 23:34:00,38.44583082,-120.65696,3,0,0,3,"Amador, California, United States"
"04-04-2020","51007","Amelia","Virginia","United States",2020-04-04 23:34:00,37.34081025,-77.98584649,6,0,0,6,"Amelia, Virginia, United States"
"04-04-2020","51009","Amherst","Virginia","United States",2020-04-04 23:34:00,37.60308293,-79.14548696,6,0,0,6,"Amherst, Virginia, United States"
"04-04-2020","28005","Amite","Mississippi","United States",2020-04-04 23:34:00,31.17467303,-90.80501621,6,1,0,5,"Amite, Mississippi, United States"
"04-04-2020","02020","Anchorage","Alaska","United States",2020-04-04 23:34:00,61.14998174,-149.1426986,81,1,0,80,"Anchorage, Alaska, United States"
"04-04-2020","21005","Anderson","Kentucky","United States",2020-04-04 23:34:00,38.00671029,-84.99171713,3,1,0,2,"Anderson, Kentucky, United States"
"04-04-2020","45007","Anderson","South Carolina","United States",2020-04-04 23:34:00,34.51828081,-82.63959517,68,3,0,65,"Anderson, South Carolina, United States"
"04-04-2020","47001","Anderson","Tennessee","United States",2020-04-04 23:34:00,36.12684348,-84.19965764,10,0,0,10,"Anderson, Tennessee, United States"
"04-04-2020","48001","Anderson","Texas","United States",2020-04-04 23:34:00,31.81534745,-95.65354823,1,0,0,1,"Anderson, Texas, United States"
"04-04-2020","48003","Andrews","Texas","United States",2020-04-04 23:34:00,32.30468633,-102.6376548,1,0,0,1,"Andrews, Texas, United States"
"04-04-2020","23001","Androscoggin","Maine","United States",2020-04-04 23:34:00,44.1664747,-70.20380627,20,0,0,20,"Androscoggin, Maine, United States"
"04-04-2020","48005","Angelina","Texas","United States",2020-04-04 23:34:00,31.25457347,-94.60901487,10,0,0,10,"Angelina, Texas, United States"
"04-04-2020","24003","Anne Arundel","Maryland","United States",2020-04-04 23:34:00,39.00670238,-76.60329337,289,6,0,283,"Anne Arundel, Maryland, United States"
"04-04-2020","27003","Anoka","Minnesota","United States",2020-04-04 23:34:00,45.27476015,-93.24604565,36,0,0,36,"Anoka, Minnesota, United States"
"04-04-2020","37007","Anson","North Carolina","United States",2020-04-04 23:34:00,34.97403241,-80.09953279,3,0,0,3,"Anson, North Carolina, United States"
"04-04-2020","31003","Antelope","Nebraska","United States",2020-04-04 23:34:00,42.17695516,-98.0666283,1,0,0,1,"Antelope, Nebraska, United States"
"04-04-2020","26009","Antrim","Michigan","United States",2020-04-04 23:34:00,44.99690221,-85.15503082,4,0,0,4,"Antrim, Michigan, United States"
"04-04-2020","04001","Apache","Arizona","United States",2020-04-04 23:34:00,35.39465006,-109.4892383,42,0,0,42,"Apache, Arizona, United States"
"04-04-2020","19007","Appanoose","Iowa","United States",2020-04-04 23:34:00,40.74324454,-92.86865906,1,0,0,1,"Appanoose, Iowa, United States"
"04-04-2020","13001","Appling","Georgia","United States",2020-04-04 23:34:00,31.74847232,-82.28909114,5,0,0,5,"Appling, Georgia, United States"
"04-04-2020","08005","Arapahoe","Colorado","United States",2020-04-04 23:34:00,39.64977461,-104.3353617,500,10,0,490,"Arapahoe, Colorado, United States"
"04-04-2020","08007","Archuleta","Colorado","United States",2020-04-04 23:34:00,37.19474156,-107.0476867,1,0,0,1,"Archuleta, Colorado, United States"
"04-04-2020","26011","Arenac","Michigan","United States",2020-04-04 23:34:00,44.0636262,-83.89277559,3,0,0,3,"Arenac, Michigan, United States"
"04-04-2020","05001","Arkansas","Arkansas","United States",2020-04-04 23:34:00,34.29145151,-91.37277296,1,0,0,1,"Arkansas, Arkansas, United States"
"04-04-2020","51013","Arlington","Virginia","United States",2020-04-04 23:34:00,38.8767675,-77.10139853,150,2,0,148,"Arlington, Virginia, United States"
"04-04-2020","42005","Armstrong","Pennsylvania","United States",2020-04-04 23:34:00,40.81665618,-79.46290811,12,0,0,12,"Armstrong, Pennsylvania, United States"
"04-04-2020","23003","Aroostook","Maine","United States",2020-04-04 23:34:00,46.65926321,-68.59841248,1,0,0,1,"Aroostook, Maine, United States"
"04-04-2020","22005","Ascension","Louisiana","United States",2020-04-04 23:34:00,30.20406249,-90.9132841,284,7,0,277,"Ascension, Louisiana, United States"
"04-04-2020","37009","Ashe","North Carolina","United States",2020-04-04 23:34:00,36.43296207,-81.49862729,1,0,0,1,"Ashe, North Carolina, United States"
"04-04-2020","39005","Ashland","Ohio","United States",2020-04-04 23:34:00,40.84772277,-82.27280781,3,0,0,3,"Ashland, Ohio, United States"
"04-04-2020","55003","Ashland","Wisconsin","United States",2020-04-04 23:34:00,46.31956891,-90.67837132,1,0,0,1,"Ashland, Wisconsin, United States"
"04-04-2020","05003","Ashley","Arkansas","United States",2020-04-04 23:34:00,33.19153461,-91.7698471,1,0,0,1,"Ashley, Arkansas, United States"
"04-04-2020","39007","Ashtabula","Ohio","United States",2020-04-04 23:34:00,41.70860332,-80.74830218,11,0,0,11,"Ashtabula, Ohio, United States"
"04-04-2020","53003","Asotin","Washington","United States",2020-04-04 23:34:00,46.18894415,-117.2022851,1,0,0,1,"Asotin, Washington, United States"
"04-04-2020","22007","Assumption","Louisiana","United States",2020-04-04 23:34:00,29.89946234,-91.06461642,56,0,0,56,"Assumption, Louisiana, United States"
"04-04-2020","48013","Atascosa","Texas","United States",2020-04-04 23:34:00,28.89333001,-98.52730485,2,0,0,2,"Atascosa, Texas, United States"
"04-04-2020","20005","Atchison","Kansas","United States",2020-04-04 23:34:00,39.53185661,-95.30870026,2,0,0,2,"Atchison, Kansas, United States"
"04-04-2020","29005","Atchison","Missouri","United States",2020-04-04 23:34:00,40.43238737,-95.42970639,1,0,0,1,"Atchison, Missouri, United States"
"04-04-2020","39009","Athens","Ohio","United States",2020-04-04 23:34:00,39.33425634,-82.04278644,3,1,0,2,"Athens, Ohio, United States"
"04-04-2020","34001","Atlantic","New Jersey","United States",2020-04-04 23:34:00,39.47538693,-74.65848483,98,1,0,97,"Atlantic, New Jersey, United States"
"04-04-2020","40005","Atoka","Oklahoma","United States",2020-04-04 23:34:00,34.37366573,-96.03802487,1,0,0,1,"Atoka, Oklahoma, United States"
"04-04-2020","28007","Attala","Mississippi","United States",2020-04-04 23:34:00,33.08658803,-89.57838564,14,0,0,14,"Attala, Mississippi, United States"
"04-04-2020","19009","Audubon","Iowa","United States",2020-04-04 23:34:00,41.6844628,-94.90581859,1,0,0,1,"Audubon, Iowa, United States"
"04-04-2020","39011","Auglaize","Ohio","United States",2020-04-04 23:34:00,40.55998859,-84.2242143,6,0,0,6,"Auglaize, Ohio, United States"
"04-04-2020","51015","Augusta","Virginia","United States",2020-04-04 23:34:00,38.16404586,-79.12461614,7,0,0,7,"Augusta, Virginia, United States"
"04-04-2020","46003","Aurora","South Dakota","United States",2020-04-04 23:34:00,43.71757685,-98.56050467,1,0,0,1,"Aurora, South Dakota, United States"
"04-04-2020","48015","Austin","Texas","United States",2020-04-04 23:34:00,29.88548725,-96.27736949,4,0,0,4,"Austin, Texas, United States"
"04-04-2020","01001","Autauga","Alabama","United States",2020-04-04 23:34:00,32.53952745,-86.64408227,12,0,0,12,"Autauga, Alabama, United States"
"04-04-2020","22009","Avoyelles","Louisiana","United States",2020-04-04 23:34:00,31.07796211,-92.00079449,36,1,0,35,"Avoyelles, Louisiana, United States"
"04-04-2020","08009","Baca","Colorado","United States",2020-04-04 23:34:00,37.31940883,-102.5603223,9,0,0,9,"Baca, Colorado, United States"
"04-04-2020","13005","Bacon","Georgia","United States",2020-04-04 23:34:00,31.55456473,-82.45936528,6,0,0,6,"Bacon, Georgia, United States"
"04-04-2020","12003","Baker","Florida","United States",2020-04-04 23:34:00,30.33060121,-82.28467476,11,0,0,11,"Baker, Florida, United States"
"04-04-2020","13007","Baker","Georgia","United States",2020-04-04 23:34:00,31.32669878,-84.44218806,4,1,0,3,"Baker, Georgia, United States"
"04-04-2020","01003","Baldwin","Alabama","United States",2020-04-04 23:34:00,30.72774991,-87.72207058,29,1,0,28,"Baldwin, Alabama, United States"
"04-04-2020","13009","Baldwin","Georgia","United States",2020-04-04 23:34:00,33.06882326,-83.24701748,11,1,0,10,"Baldwin, Georgia, United States"
"04-04-2020","24005","Baltimore","Maryland","United States",2020-04-04 23:34:00,39.45784712,-76.62911955,491,4,0,487,"Baltimore, Maryland, United States"
"04-04-2020","24510","Baltimore City","Maryland","United States",2020-04-04 23:34:00,39.30211911,-76.61151012,343,6,0,337,"Baltimore City, Maryland, United States"
"04-04-2020","45009","Bamberg","South Carolina","United States",2020-04-04 23:34:00,33.21927586,-81.05659969,5,0,0,5,"Bamberg, South Carolina, United States"
"04-04-2020","13011","Banks","Georgia","United States",2020-04-04 23:34:00,34.35607081,-83.49644388,3,0,0,3,"Banks, Georgia, United States"
"04-04-2020","16005","Bannock","Idaho","United States",2020-04-04 23:34:00,42.67002716,-112.2233311,5,0,0,5,"Bannock, Idaho, United States"
"04-04-2020","01005","Barbour","Alabama","United States",2020-04-04 23:34:00,31.868263,-85.3871286,2,0,0,2,"Barbour, Alabama, United States"
"04-04-2020","54001","Barbour","West Virginia","United States",2020-04-04 23:34:00,39.1307219,-80.00350858,2,0,0,2,"Barbour, West Virginia, United States"
"04-04-2020","38003","Barnes","North Dakota","United States",2020-04-04 23:34:00,46.93579637,-98.06605978,2,0,0,2,"Barnes, North Dakota, United States"
"04-04-2020","25001","Barnstable","Massachusetts","United States",2020-04-04 23:34:00,41.72980578,-70.28854339,330,6,0,324,"Barnstable, Massachusetts, United States"
"04-04-2020","45011","Barnwell","South Carolina","United States",2020-04-04 23:34:00,33.26679302,-81.43584352,2,0,0,2,"Barnwell, South Carolina, United States"
"04-04-2020","21009","Barren","Kentucky","United States",2020-04-04 23:34:00,36.96469836,-85.93338945,1,0,0,1,"Barren, Kentucky, United States"
"04-04-2020","55005","Barron","Wisconsin","United States",2020-04-04 23:34:00,45.42372701,-91.84833627,1,0,0,1,"Barron, Wisconsin, United States"
"04-04-2020","13013","Barrow","Georgia","United States",2020-04-04 23:34:00,33.99148694,-83.71436292,22,2,0,20,"Barrow, Georgia, United States"
"04-04-2020","26015","Barry","Michigan","United States",2020-04-04 23:34:00,42.59513984,-85.30834519,5,0,0,5,"Barry, Michigan, United States"
"04-04-2020","29009","Barry","Missouri","United States",2020-04-04 23:34:00,36.70978521,-93.82919888,1,0,0,1,"Barry, Missouri, United States"
"04-04-2020","18005","Bartholomew","Indiana","United States",2020-04-04 23:34:00,39.20744865,-85.89558181,45,0,0,45,"Bartholomew, Indiana, United States"
"04-04-2020","20009","Barton","Kansas","United States",2020-04-04 23:34:00,38.47889676,-98.75636726,3,0,0,3,"Barton, Kansas, United States"
"04-04-2020","13015","Bartow","Georgia","United States",2020-04-04 23:34:00,34.23732119,-84.83887523,160,7,0,153,"Bartow, Georgia, United States"
"04-04-2020","48021","Bastrop","Texas","United States",2020-04-04 23:34:00,30.10370699,-97.31206354,10,0,0,10,"Bastrop, Texas, United States"
"04-04-2020","29013","Bates","Missouri","United States",2020-04-04 23:34:00,38.25271289,-94.34113157,3,0,0,3,"Bates, Missouri, United States"
"04-04-2020","21011","Bath","Kentucky","United States",2020-04-04 23:34:00,38.14735938,-83.74588932,1,0,0,1,"Bath, Kentucky, United States"
"04-04-2020","05005","Baxter","Arkansas","United States",2020-04-04 23:34:00,36.28784385,-92.33782872,1,0,0,1,"Baxter, Arkansas, United States"
"04-04-2020","12005","Bay","Florida","United States",2020-04-04 23:34:00,30.26548745,-85.62122584,23,1,0,22,"Bay, Florida, United States"
"04-04-2020","26017","Bay","Michigan","United States",2020-04-04 23:34:00,43.70639106,-83.98731479,24,0,0,24,"Bay, Michigan, United States"
"04-04-2020","55007","Bayfield","Wisconsin","United States",2020-04-04 23:34:00,46.52868768,-91.19716729,3,0,0,3,"Bayfield, Wisconsin, United States"
"04-04-2020","46005","Beadle","South Dakota","United States",2020-04-04 23:34:00,44.41464384,-98.27858469,21,1,0,20,"Beadle, South Dakota, United States"
"04-04-2020","37013","Beaufort","North Carolina","United States",2020-04-04 23:34:00,35.48531943,-76.84325809,9,0,0,9,"Beaufort, North Carolina, United States"
"04-04-2020","45013","Beaufort","South Carolina","United States",2020-04-04 23:34:00,32.39226291,-80.72619758,148,3,0,145,"Beaufort, South Carolina, United States"
"04-04-2020","22011","Beauregard","Louisiana","United States",2020-04-04 23:34:00,30.64836518,-93.34173616,15,0,0,15,"Beauregard, Louisiana, United States"
"04-04-2020","42007","Beaver","Pennsylvania","United States",2020-04-04 23:34:00,40.6825484,-80.34921611,69,6,0,63,"Beaver, Pennsylvania, United States"
"04-04-2020","30001","Beaverhead","Montana","United States",2020-04-04 23:34:00,45.13434354,-112.8984694,1,0,0,1,"Beaverhead, Montana, United States"
"04-04-2020","40009","Beckham","Oklahoma","United States",2020-04-04 23:34:00,35.26862449,-99.68128023,1,0,0,1,"Beckham, Oklahoma, United States"
"04-04-2020","42009","Bedford","Pennsylvania","United States",2020-04-04 23:34:00,40.00522157,-78.48998442,4,0,0,4,"Bedford, Pennsylvania, United States"
"04-04-2020","47003","Bedford","Tennessee","United States",2020-04-04 23:34:00,35.51123746,-86.45549096,8,0,0,8,"Bedford, Tennessee, United States"
"04-04-2020","51019","Bedford","Virginia","United States",2020-04-04 23:34:00,37.3080028,-79.5281964,4,0,0,4,"Bedford, Virginia, United States"
"04-04-2020","33001","Belknap","New Hampshire","United States",2020-04-04 23:34:00,43.51637314,-71.41684235,14,0,0,14,"Belknap, New Hampshire, United States"
"04-04-2020","48027","Bell","Texas","United States",2020-04-04 23:34:00,31.03736027,-97.4785025,58,1,0,57,"Bell, Texas, United States"
"04-04-2020","39013","Belmont","Ohio","United States",2020-04-04 23:34:00,40.01625942,-80.9924051,17,0,0,17,"Belmont, Ohio, United States"
"04-04-2020","27007","Beltrami","Minnesota","United States",2020-04-04 23:34:00,47.97373527,-94.93732139,5,0,0,5,"Beltrami, Minnesota, United States"
"04-04-2020","13017","Ben Hill","Georgia","United States",2020-04-04 23:34:00,31.76095874,-83.22145359,4,0,0,4,"Ben Hill, Georgia, United States"
"04-04-2020","50003","Bennington","Vermont","United States",2020-04-04 23:34:00,43.03519828,-73.09048868,23,0,0,23,"Bennington, Vermont, United States"
"04-04-2020","05007","Benton","Arkansas","United States",2020-04-04 23:34:00,36.33644656,-94.25680817,42,0,0,42,"Benton, Arkansas, United States"
"04-04-2020","19011","Benton","Iowa","United States",2020-04-04 23:34:00,42.08011739,-92.06463573,7,0,0,7,"Benton, Iowa, United States"
"04-04-2020","27009","Benton","Minnesota","United States",2020-04-04 23:34:00,45.69804958,-93.99514135,1,0,0,1,"Benton, Minnesota, United States"
"04-04-2020","28009","Benton","Mississippi","United States",2020-04-04 23:34:00,34.81681228,-89.18945516,5,0,0,5,"Benton, Mississippi, United States"
"04-04-2020","29015","Benton","Missouri","United States",2020-04-04 23:34:00,38.29503305,-93.28756116,3,0,0,3,"Benton, Missouri, United States"
"04-04-2020","41003","Benton","Oregon","United States",2020-04-04 23:34:00,44.49167306,-123.4316987,17,1,0,16,"Benton, Oregon, United States"
"04-04-2020","47005","Benton","Tennessee","United States",2020-04-04 23:34:00,36.07110411,-88.06849355,4,0,0,4,"Benton, Tennessee, United States"
"04-04-2020","53005","Benton","Washington","United States",2020-04-04 23:34:00,46.23946995,-119.5120834,151,13,0,138,"Benton, Washington, United States"
"04-04-2020","34003","Bergen","New Jersey","United States",2020-04-04 23:34:00,40.96010917,-74.07164325,5760,179,0,5581,"Bergen, New Jersey, United States"
"04-04-2020","45015","Berkeley","South Carolina","United States",2020-04-04 23:34:00,33.20222596,-79.94654523,45,0,0,45,"Berkeley, South Carolina, United States"
"04-04-2020","54003","Berkeley","West Virginia","United States",2020-04-04 23:34:00,39.46704621,-78.02414609,49,0,0,49,"Berkeley, West Virginia, United States"
"04-04-2020","42011","Berks","Pennsylvania","United States",2020-04-04 23:34:00,40.41570541,-75.92457766,235,2,0,233,"Berks, Pennsylvania, United States"
"04-04-2020","25003","Berkshire","Massachusetts","United States",2020-04-04 23:34:00,42.37428441,-73.20524838,253,8,0,245,"Berkshire, Massachusetts, United States"
"04-04-2020","35001","Bernalillo","New Mexico","United States",2020-04-04 23:34:00,35.05163625,-106.6703554,202,7,0,195,"Bernalillo, New Mexico, United States"
"04-04-2020","13019","Berrien","Georgia","United States",2020-04-04 23:34:00,31.27590016,-83.2252992,3,0,0,3,"Berrien, Georgia, United States"
"04-04-2020","26021","Berrien","Michigan","United States",2020-04-04 23:34:00,41.95447397,-86.4131308,56,1,0,55,"Berrien, Michigan, United States"
"04-04-2020","37015","Bertie","North Carolina","United States",2020-04-04 23:34:00,36.0688473,-76.96545943,7,1,0,6,"Bertie, North Carolina, United States"
"04-04-2020","48029","Bexar","Texas","United States",2020-04-04 23:34:00,29.44928723,-98.52019748,342,9,0,333,"Bexar, Texas, United States"
"04-04-2020","01007","Bibb","Alabama","United States",2020-04-04 23:34:00,32.99642064,-87.1251146,4,0,0,4,"Bibb, Alabama, United States"
"04-04-2020","13021","Bibb","Georgia","United States",2020-04-04 23:34:00,32.80904227,-83.70489165,36,1,0,35,"Bibb, Georgia, United States"
"04-04-2020","22013","Bienville","Louisiana","United States",2020-04-04 23:34:00,32.34569994,-93.05398492,10,1,0,9,"Bienville, Louisiana, United States"
"04-04-2020","27011","Big Stone","Minnesota","United States",2020-04-04 23:34:00,45.42712824,-96.41403739,1,0,0,1,"Big Stone, Minnesota, United States"
"04-04-2020","16011","Bingham","Idaho","United States",2020-04-04 23:34:00,43.2167288,-112.3978437,2,0,0,2,"Bingham, Idaho, United States"
"04-04-2020","19013","Black Hawk","Iowa","United States",2020-04-04 23:34:00,42.4704581,-92.30524729,10,0,0,10,"Black Hawk, Iowa, United States"
"04-04-2020","18009","Blackford","Indiana","United States",2020-04-04 23:34:00,40.47388153,-85.32499702,2,0,0,2,"Blackford, Indiana, United States"
"04-04-2020","37017","Bladen","North Carolina","United States",2020-04-04 23:34:00,34.61296243,-78.56180059,1,0,0,1,"Bladen, North Carolina, United States"
"04-04-2020","16013","Blaine","Idaho","United States",2020-04-04 23:34:00,43.4085812,-113.9752658,405,2,0,403,"Blaine, Idaho, United States"
"04-04-2020","42013","Blair","Pennsylvania","United States",2020-04-04 23:34:00,40.47961444,-78.34917412,5,0,0,5,"Blair, Pennsylvania, United States"
"04-04-2020","48031","Blanco","Texas","United States",2020-04-04 23:34:00,30.26640707,-98.3999852,2,0,0,2,"Blanco, Texas, United States"
"04-04-2020","13023","Bleckley","Georgia","United States",2020-04-04 23:34:00,32.43829035,-83.33035166,1,0,0,1,"Bleckley, Georgia, United States"
"04-04-2020","47007","Bledsoe","Tennessee","United States",2020-04-04 23:34:00,35.59942968,-85.20611967,2,0,0,2,"Bledsoe, Tennessee, United States"
"04-04-2020","01009","Blount","Alabama","United States",2020-04-04 23:34:00,33.98210918,-86.56790593,10,0,0,10,"Blount, Alabama, United States"
"04-04-2020","47009","Blount","Tennessee","United States",2020-04-04 23:34:00,35.68938198,-83.92847788,34,0,0,34,"Blount, Tennessee, United States"
"04-04-2020","27013","Blue Earth","Minnesota","United States",2020-04-04 23:34:00,44.03554215,-94.06699781,14,0,0,14,"Blue Earth, Minnesota, United States"
"04-04-2020","28011","Bolivar","Mississippi","United States",2020-04-04 23:34:00,33.79696941,-90.87372121,34,1,0,33,"Bolivar, Mississippi, United States"
