"Date_Published","FIPS","Admin2","Province_State","Country_Region","Last_Update","Latitude","Longitude","Confirmed","Deaths","Recovered","Active","Combined_Key"
"04-20-2020","45001","Abbeville","South Carolina","United States",2020-04-20 23:36:47,34.22333378,-82.46170658,17,0,0,17,"Abbeville, South Carolina, United States"
"04-20-2020","22001","Acadia","Louisiana","United States",2020-04-20 23:36:47,30.2950649,-92.41419698,114,7,0,107,"Acadia, Louisiana, United States"
"04-20-2020","51001","Accomack","Virginia","United States",2020-04-20 23:36:47,37.76707161,-75.63234615,52,0,0,52,"Accomack, Virginia, United States"
"04-20-2020","16001","Ada","Idaho","United States",2020-04-20 23:36:47,43.4526575,-116.2415516,598,10,0,588,"Ada, Idaho, United States"
"04-20-2020","19001","Adair","Iowa","United States",2020-04-20 23:36:47,41.33075609,-94.47105874,1,0,0,1,"Adair, Iowa, United States"
"04-20-2020","21001","Adair","Kentucky","United States",2020-04-20 23:36:47,37.10459774,-85.28129668,54,4,0,50,"Adair, Kentucky, United States"
"04-20-2020","29001","Adair","Missouri","United States",2020-04-20 23:36:47,40.19058551,-92.60078167,12,0,0,12,"Adair, Missouri, United States"
"04-20-2020","40001","Adair","Oklahoma","United States",2020-04-20 23:36:47,35.88494195,-94.65859267,46,3,0,43,"Adair, Oklahoma, United States"
"04-20-2020","08001","Adams","Colorado","United States",2020-04-20 23:36:47,39.87432092,-104.3362578,915,35,0,880,"Adams, Colorado, United States"
"04-20-2020","16003","Adams","Idaho","United States",2020-04-20 23:36:47,44.89333571,-116.4545247,1,0,0,1,"Adams, Idaho, United States"
"04-20-2020","17001","Adams","Illinois","United States",2020-04-20 23:36:47,39.98815591,-91.18786813,34,0,0,34,"Adams, Illinois, United States"
"04-20-2020","18001","Adams","Indiana","United States",2020-04-20 23:36:47,40.7457653,-84.93671406,7,1,0,6,"Adams, Indiana, United States"
"04-20-2020","28001","Adams","Mississippi","United States",2020-04-20 23:36:47,31.47669768,-91.35326037,83,6,0,77,"Adams, Mississippi, United States"
"04-20-2020","31001","Adams","Nebraska","United States",2020-04-20 23:36:47,40.5244942,-98.50117804,100,0,0,100,"Adams, Nebraska, United States"
"04-20-2020","39001","Adams","Ohio","United States",2020-04-20 23:36:47,38.84541072,-83.4718964,3,0,0,3,"Adams, Ohio, United States"
"04-20-2020","42001","Adams","Pennsylvania","United States",2020-04-20 23:36:47,39.87140411,-77.21610347,85,1,0,84,"Adams, Pennsylvania, United States"
"04-20-2020","53001","Adams","Washington","United States",2020-04-20 23:36:47,46.98299757,-118.5601734,41,0,0,41,"Adams, Washington, United States"
"04-20-2020","55001","Adams","Wisconsin","United States",2020-04-20 23:36:47,43.96974651,-89.76782777,4,1,0,3,"Adams, Wisconsin, United States"
"04-20-2020","50001","Addison","Vermont","United States",2020-04-20 23:36:47,44.03217337,-73.14130877,61,2,0,59,"Addison, Vermont, United States"
"04-20-2020","45003","Aiken","South Carolina","United States",2020-04-20 23:36:47,33.54338026,-81.63645384,70,4,0,66,"Aiken, South Carolina, United States"
"04-20-2020","27001","Aitkin","Minnesota","United States",2020-04-20 23:36:47,46.60962049,-93.4116826,1,0,0,1,"Aitkin, Minnesota, United States"
"04-20-2020","12001","Alachua","Florida","United States",2020-04-20 23:36:47,29.67866525,-82.35928158,218,0,0,218,"Alachua, Florida, United States"
"04-20-2020","37001","Alamance","North Carolina","United States",2020-04-20 23:36:47,36.0434701,-79.39976137,50,0,0,50,"Alamance, North Carolina, United States"
"04-20-2020","06001","Alameda","California","United States",2020-04-20 23:36:47,37.64629437,-121.8929271,1193,42,0,1151,"Alameda, California, United States"
"04-20-2020","08003","Alamosa","Colorado","United States",2020-04-20 23:36:47,37.57250606,-105.7885451,7,2,0,5,"Alamosa, Colorado, United States"
"04-20-2020","36001","Albany","New York","United States",2020-04-20 23:36:47,42.60060306,-73.97723916,687,22,0,665,"Albany, New York, United States"
"04-20-2020","56001","Albany","Wyoming","United States",2020-04-20 23:36:47,41.65498705,-105.7235415,6,0,0,6,"Albany, Wyoming, United States"
"04-20-2020","51003","Albemarle","Virginia","United States",2020-04-20 23:36:47,38.02080697,-78.55481085,61,0,0,61,"Albemarle, Virginia, United States"
"04-20-2020","26001","Alcona","Michigan","United States",2020-04-20 23:36:47,44.6846864,-83.59507875,4,0,0,4,"Alcona, Michigan, United States"
"04-20-2020","28003","Alcorn","Mississippi","United States",2020-04-20 23:36:47,34.88084463,-88.57996173,7,0,0,7,"Alcorn, Mississippi, United States"
"04-20-2020","17003","Alexander","Illinois","United States",2020-04-20 23:36:47,37.18049267,-89.32910838,2,0,0,2,"Alexander, Illinois, United States"
"04-20-2020","37003","Alexander","North Carolina","United States",2020-04-20 23:36:47,35.9223796,-81.17751948,3,0,0,3,"Alexander, North Carolina, United States"
"04-20-2020","51510","Alexandria","Virginia","United States",2020-04-20 23:36:47,38.814003,-77.08183073,421,8,0,413,"Alexandria, Virginia, United States"
"04-20-2020","40003","Alfalfa","Oklahoma","United States",2020-04-20 23:36:47,36.73090616,-98.32408495,1,0,0,1,"Alfalfa, Oklahoma, United States"
"04-20-2020","19005","Allamakee","Iowa","United States",2020-04-20 23:36:47,43.28383218,-91.37860922,40,3,0,37,"Allamakee, Iowa, United States"
"04-20-2020","26005","Allegan","Michigan","United States",2020-04-20 23:36:47,42.59147037,-85.89102866,42,0,0,42,"Allegan, Michigan, United States"
"04-20-2020","24001","Allegany","Maryland","United States",2020-04-20 23:44:33,39.62357628,-78.69280486,32,1,0,31,"Allegany, Maryland, United States"
"04-20-2020","36003","Allegany","New York","United States",2020-04-20 23:36:47,42.25748406,-78.02750466,30,2,0,28,"Allegany, New York, United States"
"04-20-2020","37005","Alleghany","North Carolina","United States",2020-04-20 23:36:47,36.49360862,-81.12857041,2,0,0,2,"Alleghany, North Carolina, United States"
"04-20-2020","51005","Alleghany","Virginia","United States",2020-04-20 23:36:47,37.78636074,-80.00222498,5,0,0,5,"Alleghany, Virginia, United States"
"04-20-2020","42003","Allegheny","Pennsylvania","United States",2020-04-20 23:36:47,40.46809875,-79.98167747,1042,55,0,987,"Allegheny, Pennsylvania, United States"
"04-20-2020","18003","Allen","Indiana","United States",2020-04-20 23:36:47,41.09194313,-85.06800636,327,27,0,300,"Allen, Indiana, United States"
"04-20-2020","21003","Allen","Kentucky","United States",2020-04-20 23:36:47,36.75197631,-86.19457544,4,0,0,4,"Allen, Kentucky, United States"
"04-20-2020","22003","Allen","Louisiana","United States",2020-04-20 23:36:47,30.65385745,-92.82442028,79,9,0,70,"Allen, Louisiana, United States"
"04-20-2020","39003","Allen","Ohio","United States",2020-04-20 23:36:47,40.77285242,-84.10802343,84,11,0,73,"Allen, Ohio, United States"
"04-20-2020","45005","Allendale","South Carolina","United States",2020-04-20 23:36:47,32.98837386,-81.35321066,6,0,0,6,"Allendale, South Carolina, United States"
"04-20-2020","26007","Alpena","Michigan","United States",2020-04-20 23:36:47,45.03477666,-83.62212411,15,1,0,14,"Alpena, Michigan, United States"
"04-20-2020","06003","Alpine","California","United States",2020-04-20 23:36:47,38.59678594,-119.8223594,1,0,0,1,"Alpine, California, United States"
"04-20-2020","06005","Amador","California","United States",2020-04-20 23:36:47,38.44583082,-120.65696,7,0,0,7,"Amador, California, United States"
"04-20-2020","51007","Amelia","Virginia","United States",2020-04-20 23:36:47,37.34081025,-77.98584649,14,0,0,14,"Amelia, Virginia, United States"
"04-20-2020","51009","Amherst","Virginia","United States",2020-04-20 23:36:47,37.60308293,-79.14548696,10,0,0,10,"Amherst, Virginia, United States"
"04-20-2020","28005","Amite","Mississippi","United States",2020-04-20 23:36:47,31.17467303,-90.80501621,17,0,0,17,"Amite, Mississippi, United States"
"04-20-2020","02020","Anchorage","Alaska","United States",2020-04-20 23:36:47,61.14998174,-149.1426986,155,4,0,151,"Anchorage, Alaska, United States"
"04-20-2020","20003","Anderson","Kansas","United States",2020-04-20 23:36:47,38.21413251,-95.29272815,0,0,0,0,"Anderson, Kansas, United States"
"04-20-2020","21005","Anderson","Kentucky","United States",2020-04-20 23:36:47,38.00671029,-84.99171713,6,1,0,5,"Anderson, Kentucky, United States"
"04-20-2020","45007","Anderson","South Carolina","United States",2020-04-20 23:36:47,34.51828081,-82.63959517,134,5,0,129,"Anderson, South Carolina, United States"
"04-20-2020","47001","Anderson","Tennessee","United States",2020-04-20 23:36:47,36.12684348,-84.19965764,16,1,0,15,"Anderson, Tennessee, United States"
"04-20-2020","48001","Anderson","Texas","United States",2020-04-20 23:36:47,31.81534745,-95.65354823,8,0,0,8,"Anderson, Texas, United States"
"04-20-2020","29003","Andrew","Missouri","United States",2020-04-20 23:36:47,39.98492163,-94.80163024,1,0,0,1,"Andrew, Missouri, United States"
"04-20-2020","48003","Andrews","Texas","United States",2020-04-20 23:36:47,32.30468633,-102.6376548,19,0,0,19,"Andrews, Texas, United States"
"04-20-2020","23001","Androscoggin","Maine","United States",2020-04-20 23:36:47,44.1664747,-70.20380627,35,1,0,34,"Androscoggin, Maine, United States"
"04-20-2020","48005","Angelina","Texas","United States",2020-04-20 23:36:47,31.25457347,-94.60901487,23,0,0,23,"Angelina, Texas, United States"
"04-20-2020","24003","Anne Arundel","Maryland","United States",2020-04-20 23:44:33,39.00670238,-76.60329337,1098,48,0,1050,"Anne Arundel, Maryland, United States"
"04-20-2020","27003","Anoka","Minnesota","United States",2020-04-20 23:36:47,45.27476015,-93.24604565,95,2,0,93,"Anoka, Minnesota, United States"
"04-20-2020","37007","Anson","North Carolina","United States",2020-04-20 23:36:47,34.97403241,-80.09953279,18,0,0,18,"Anson, North Carolina, United States"
"04-20-2020","31003","Antelope","Nebraska","United States",2020-04-20 23:36:47,42.17695516,-98.0666283,1,0,0,1,"Antelope, Nebraska, United States"
"04-20-2020","26009","Antrim","Michigan","United States",2020-04-20 23:36:47,44.99690221,-85.15503082,9,0,0,9,"Antrim, Michigan, United States"
"04-20-2020","04001","Apache","Arizona","United States",2020-04-20 23:36:47,35.39465006,-109.4892383,202,4,0,198,"Apache, Arizona, United States"
"04-20-2020","19007","Appanoose","Iowa","United States",2020-04-20 23:36:47,40.74324454,-92.86865906,2,2,0,0,"Appanoose, Iowa, United States"
"04-20-2020","13001","Appling","Georgia","United States",2020-04-20 23:36:47,31.74847232,-82.28909114,21,0,0,21,"Appling, Georgia, United States"
"04-20-2020","51011","Appomattox","Virginia","United States",2020-04-20 23:36:47,37.37569884,-78.81340003,7,0,0,7,"Appomattox, Virginia, United States"
"04-20-2020","48007","Aransas","Texas","United States",2020-04-20 23:36:47,28.10556197,-96.9995047,2,0,0,2,"Aransas, Texas, United States"
"04-20-2020","08005","Arapahoe","Colorado","United States",2020-04-20 23:36:47,39.64977461,-104.3353617,1536,65,0,1471,"Arapahoe, Colorado, United States"
"04-20-2020","08007","Archuleta","Colorado","United States",2020-04-20 23:36:47,37.19474156,-107.0476867,7,0,0,7,"Archuleta, Colorado, United States"
"04-20-2020","26011","Arenac","Michigan","United States",2020-04-20 23:36:47,44.0636262,-83.89277559,12,1,0,11,"Arenac, Michigan, United States"
"04-20-2020","05001","Arkansas","Arkansas","United States",2020-04-20 23:36:47,34.29145151,-91.37277296,2,0,0,2,"Arkansas, Arkansas, United States"
"04-20-2020","51013","Arlington","Virginia","United States",2020-04-20 23:36:47,38.8767675,-77.10139853,593,22,0,571,"Arlington, Virginia, United States"
"04-20-2020","42005","Armstrong","Pennsylvania","United States",2020-04-20 23:36:47,40.81665618,-79.46290811,38,2,0,36,"Armstrong, Pennsylvania, United States"
"04-20-2020","48011","Armstrong","Texas","United States",2020-04-20 23:36:47,34.96507426,-101.3574874,1,0,0,1,"Armstrong, Texas, United States"
"04-20-2020","23003","Aroostook","Maine","United States",2020-04-20 23:36:47,46.65926321,-68.59841248,2,0,0,2,"Aroostook, Maine, United States"
"04-20-2020","22005","Ascension","Louisiana","United States",2020-04-20 23:36:47,30.20406249,-90.9132841,512,31,0,481,"Ascension, Louisiana, United States"
"04-20-2020","37009","Ashe","North Carolina","United States",2020-04-20 23:36:47,36.43296207,-81.49862729,4,0,0,4,"Ashe, North Carolina, United States"
"04-20-2020","39005","Ashland","Ohio","United States",2020-04-20 23:36:47,40.84772277,-82.27280781,5,0,0,5,"Ashland, Ohio, United States"
"04-20-2020","55003","Ashland","Wisconsin","United States",2020-04-20 23:36:47,46.31956891,-90.67837132,2,0,0,2,"Ashland, Wisconsin, United States"
"04-20-2020","05003","Ashley","Arkansas","United States",2020-04-20 23:36:47,33.19153461,-91.7698471,12,0,0,12,"Ashley, Arkansas, United States"
"04-20-2020","39007","Ashtabula","Ohio","United States",2020-04-20 23:36:47,41.70860332,-80.74830218,68,6,0,62,"Ashtabula, Ohio, United States"
"04-20-2020","53003","Asotin","Washington","United States",2020-04-20 23:36:47,46.18894415,-117.2022851,13,1,0,12,"Asotin, Washington, United States"
"04-20-2020","22007","Assumption","Louisiana","United States",2020-04-20 23:36:47,29.89946234,-91.06461642,146,1,0,145,"Assumption, Louisiana, United States"
"04-20-2020","48013","Atascosa","Texas","United States",2020-04-20 23:36:47,28.89333001,-98.52730485,12,1,0,11,"Atascosa, Texas, United States"
"04-20-2020","20005","Atchison","Kansas","United States",2020-04-20 23:36:47,39.53185661,-95.30870026,6,0,0,6,"Atchison, Kansas, United States"
"04-20-2020","29005","Atchison","Missouri","United States",2020-04-20 23:36:47,40.43238737,-95.42970639,2,0,0,2,"Atchison, Missouri, United States"
"04-20-2020","39009","Athens","Ohio","United States",2020-04-20 23:36:47,39.33425634,-82.04278644,3,1,0,2,"Athens, Ohio, United States"
"04-20-2020","13003","Atkinson","Georgia","United States",2020-04-20 23:36:47,31.29633502,-82.87545866,5,0,0,5,"Atkinson, Georgia, United States"
"04-20-2020","34001","Atlantic","New Jersey","United States",2020-04-20 23:36:47,39.47538693,-74.65848483,410,19,0,391,"Atlantic, New Jersey, United States"
"04-20-2020","40005","Atoka","Oklahoma","United States",2020-04-20 23:36:47,34.37366573,-96.03802487,1,0,0,1,"Atoka, Oklahoma, United States"
"04-20-2020","28007","Attala","Mississippi","United States",2020-04-20 23:36:47,33.08658803,-89.57838564,44,0,0,44,"Attala, Mississippi, United States"
"04-20-2020","19009","Audubon","Iowa","United States",2020-04-20 23:36:47,41.6844628,-94.90581859,1,0,0,1,"Audubon, Iowa, United States"
"04-20-2020","39011","Auglaize","Ohio","United States",2020-04-20 23:36:47,40.55998859,-84.2242143,23,2,0,21,"Auglaize, Ohio, United States"
"04-20-2020","51015","Augusta","Virginia","United States",2020-04-20 23:36:47,38.16404586,-79.12461614,24,0,0,24,"Augusta, Virginia, United States"
"04-20-2020","46003","Aurora","South Dakota","United States",2020-04-20 23:36:47,43.71757685,-98.56050467,1,0,0,1,"Aurora, South Dakota, United States"
"04-20-2020","48015","Austin","Texas","United States",2020-04-20 23:36:47,29.88548725,-96.27736949,12,0,0,12,"Austin, Texas, United States"
"04-20-2020","01001","Autauga","Alabama","United States",2020-04-20 23:36:47,32.53952745,-86.64408227,28,1,0,27,"Autauga, Alabama, United States"
"04-20-2020","22009","Avoyelles","Louisiana","United States",2020-04-20 23:36:47,31.07796211,-92.00079449,69,3,0,66,"Avoyelles, Louisiana, United States"
"04-20-2020","08009","Baca","Colorado","United States",2020-04-20 23:36:47,37.31940883,-102.5603223,10,0,0,10,"Baca, Colorado, United States"
"04-20-2020","13005","Bacon","Georgia","United States",2020-04-20 23:36:47,31.55456473,-82.45936528,19,1,0,18,"Bacon, Georgia, United States"
"04-20-2020","12003","Baker","Florida","United States",2020-04-20 23:36:47,30.33060121,-82.28467476,17,3,0,14,"Baker, Florida, United States"
"04-20-2020","13007","Baker","Georgia","United States",2020-04-20 23:36:47,31.32669878,-84.44218806,20,2,0,18,"Baker, Georgia, United States"
"04-20-2020","01003","Baldwin","Alabama","United States",2020-04-20 23:36:47,30.72774991,-87.72207058,120,3,0,117,"Baldwin, Alabama, United States"
"04-20-2020","13009","Baldwin","Georgia","United States",2020-04-20 23:36:47,33.06882326,-83.24701748,130,4,0,126,"Baldwin, Georgia, United States"
"04-20-2020","21007","Ballard","Kentucky","United States",2020-04-20 23:36:47,37.05842757,-88.99427697,4,0,0,4,"Ballard, Kentucky, United States"
"04-20-2020","24005","Baltimore","Maryland","United States",2020-04-20 23:44:33,39.45784712,-76.62911955,1875,50,0,1825,"Baltimore, Maryland, United States"
"04-20-2020","24510","Baltimore City","Maryland","United States",2020-04-20 23:44:33,39.30211911,-76.61151012,1511,54,0,1457,"Baltimore City, Maryland, United States"
"04-20-2020","45009","Bamberg","South Carolina","United States",2020-04-20 23:36:47,33.21927586,-81.05659969,7,0,0,7,"Bamberg, South Carolina, United States"
"04-20-2020","48019","Bandera","Texas","United States",2020-04-20 23:36:47,29.74619598,-99.24598147,4,0,0,4,"Bandera, Texas, United States"
"04-20-2020","13011","Banks","Georgia","United States",2020-04-20 23:36:47,34.35607081,-83.49644388,15,0,0,15,"Banks, Georgia, United States"
"04-20-2020","16005","Bannock","Idaho","United States",2020-04-20 23:36:47,42.67002716,-112.2233311,8,0,0,8,"Bannock, Idaho, United States"
"04-20-2020","26013","Baraga","Michigan","United States",2020-04-20 23:36:47,46.6720582,-88.36363591,0,0,0,0,"Baraga, Michigan, United States"
"04-20-2020","20007","Barber","Kansas","United States",2020-04-20 23:36:47,37.2288586,-98.68460053,1,0,0,1,"Barber, Kansas, United States"
"04-20-2020","01005","Barbour","Alabama","United States",2020-04-20 23:36:47,31.868263,-85.3871286,22,0,0,22,"Barbour, Alabama, United States"
"04-20-2020","54001","Barbour","West Virginia","United States",2020-04-20 23:36:47,39.1307219,-80.00350858,4,0,0,4,"Barbour, West Virginia, United States"
"04-20-2020","38003","Barnes","North Dakota","United States",2020-04-20 23:36:47,46.93579637,-98.06605978,3,0,0,3,"Barnes, North Dakota, United States"
"04-20-2020","25001","Barnstable","Massachusetts","United States",2020-04-20 23:36:47,41.72980578,-70.28854339,632,21,0,611,"Barnstable, Massachusetts, United States"
"04-20-2020","45011","Barnwell","South Carolina","United States",2020-04-20 23:36:47,33.26679302,-81.43584352,6,0,0,6,"Barnwell, South Carolina, United States"
"04-20-2020","21009","Barren","Kentucky","United States",2020-04-20 23:36:47,36.96469836,-85.93338945,6,0,0,6,"Barren, Kentucky, United States"
"04-20-2020","55005","Barron","Wisconsin","United States",2020-04-20 23:36:47,45.42372701,-91.84833627,6,0,0,6,"Barron, Wisconsin, United States"
"04-20-2020","13013","Barrow","Georgia","United States",2020-04-20 23:36:47,33.99148694,-83.71436292,93,3,0,90,"Barrow, Georgia, United States"
"04-20-2020","26015","Barry","Michigan","United States",2020-04-20 23:36:47,42.59513984,-85.30834519,26,1,0,25,"Barry, Michigan, United States"
"04-20-2020","29009","Barry","Missouri","United States",2020-04-20 23:36:47,36.70978521,-93.82919888,4,0,0,4,"Barry, Missouri, United States"
"04-20-2020","18005","Bartholomew","Indiana","United States",2020-04-20 23:36:47,39.20744865,-85.89558181,140,6,0,134,"Bartholomew, Indiana, United States"
"04-20-2020","20009","Barton","Kansas","United States",2020-04-20 23:36:47,38.47889676,-98.75636726,7,0,0,7,"Barton, Kansas, United States"
"04-20-2020","13015","Bartow","Georgia","United States",2020-04-20 23:36:47,34.23732119,-84.83887523,255,24,0,231,"Bartow, Georgia, United States"
"04-20-2020","48021","Bastrop","Texas","United States",2020-04-20 23:36:47,30.10370699,-97.31206354,44,2,0,42,"Bastrop, Texas, United States"
"04-20-2020","29013","Bates","Missouri","United States",2020-04-20 23:36:47,38.25271289,-94.34113157,6,1,0,5,"Bates, Missouri, United States"
"04-20-2020","21011","Bath","Kentucky","United States",2020-04-20 23:36:47,38.14735938,-83.74588932,3,0,0,3,"Bath, Kentucky, United States"
"04-20-2020","51017","Bath","Virginia","United States",2020-04-20 23:36:47,38.05852573,-79.73912095,0,0,0,0,"Bath, Virginia, United States"
"04-20-2020","05005","Baxter","Arkansas","United States",2020-04-20 23:36:47,36.28784385,-92.33782872,5,0,0,5,"Baxter, Arkansas, United States"
"04-20-2020","12005","Bay","Florida","United States",2020-04-20 23:36:47,30.26548745,-85.62122584,57,2,0,55,"Bay, Florida, United States"
"04-20-2020","26017","Bay","Michigan","United States",2020-04-20 23:36:47,43.70639106,-83.98731479,85,2,0,83,"Bay, Michigan, United States"
"04-20-2020","55007","Bayfield","Wisconsin","United States",2020-04-20 23:36:47,46.52868768,-91.19716729,3,1,0,2,"Bayfield, Wisconsin, United States"
"04-20-2020","46005","Beadle","South Dakota","United States",2020-04-20 23:36:47,44.41464384,-98.27858469,21,2,0,19,"Beadle, South Dakota, United States"
"04-20-2020",NA,"Bear River","Utah","United States",2020-04-20 23:36:47,41.52106798,-113.0832816,55,1,0,54,"Bear River, Utah, United States"
"04-20-2020","37013","Beaufort","North Carolina","United States",2020-04-20 23:36:47,35.48531943,-76.84325809,15,0,0,15,"Beaufort, North Carolina, United States"
"04-20-2020","45013","Beaufort","South Carolina","United States",2020-04-20 23:36:47,32.39226291,-80.72619758,225,6,0,219,"Beaufort, South Carolina, United States"
"04-20-2020","22011","Beauregard","Louisiana","United States",2020-04-20 23:36:47,30.64836518,-93.34173616,36,2,0,34,"Beauregard, Louisiana, United States"
"04-20-2020","40007","Beaver","Oklahoma","United States",2020-04-20 23:36:47,36.7496847,-100.4758872,1,0,0,1,"Beaver, Oklahoma, United States"
"04-20-2020","42007","Beaver","Pennsylvania","United States",2020-04-20 23:36:47,40.6825484,-80.34921611,298,36,0,262,"Beaver, Pennsylvania, United States"
"04-20-2020","30001","Beaverhead","Montana","United States",2020-04-20 23:36:47,45.13434354,-112.8984694,1,0,0,1,"Beaverhead, Montana, United States"
"04-20-2020","27005","Becker","Minnesota","United States",2020-04-20 23:36:47,46.93479392,-95.67158144,1,0,0,1,"Becker, Minnesota, United States"
"04-20-2020","40009","Beckham","Oklahoma","United States",2020-04-20 23:36:47,35.26862449,-99.68128023,2,0,0,2,"Beckham, Oklahoma, United States"
"04-20-2020","42009","Bedford","Pennsylvania","United States",2020-04-20 23:36:47,40.00522157,-78.48998442,15,1,0,14,"Bedford, Pennsylvania, United States"
"04-20-2020","47003","Bedford","Tennessee","United States",2020-04-20 23:36:47,35.51123746,-86.45549096,76,2,0,74,"Bedford, Tennessee, United States"
"04-20-2020","51019","Bedford","Virginia","United States",2020-04-20 23:36:47,37.3080028,-79.5281964,18,0,0,18,"Bedford, Virginia, United States"
"04-20-2020","48025","Bee","Texas","United States",2020-04-20 23:36:47,28.41761668,-97.74215593,5,0,0,5,"Bee, Texas, United States"
"04-20-2020","33001","Belknap","New Hampshire","United States",2020-04-20 23:36:47,43.51637314,-71.41684235,26,0,0,26,"Belknap, New Hampshire, United States"
"04-20-2020","48027","Bell","Texas","United States",2020-04-20 23:36:47,31.03736027,-97.4785025,126,3,0,123,"Bell, Texas, United States"
"04-20-2020","39013","Belmont","Ohio","United States",2020-04-20 23:36:47,40.01625942,-80.9924051,73,5,0,68,"Belmont, Ohio, United States"
"04-20-2020","27007","Beltrami","Minnesota","United States",2020-04-20 23:36:47,47.97373527,-94.93732139,5,0,0,5,"Beltrami, Minnesota, United States"
"04-20-2020","13017","Ben Hill","Georgia","United States",2020-04-20 23:36:47,31.76095874,-83.22145359,15,0,0,15,"Ben Hill, Georgia, United States"
"04-20-2020","50003","Bennington","Vermont","United States",2020-04-20 23:36:47,43.03519828,-73.09048868,37,1,0,36,"Bennington, Vermont, United States"
"04-20-2020","05007","Benton","Arkansas","United States",2020-04-20 23:36:47,36.33644656,-94.25680817,62,0,0,62,"Benton, Arkansas, United States"
"04-20-2020","18007","Benton","Indiana","United States",2020-04-20 23:36:47,40.60626947,-87.31093999,4,0,0,4,"Benton, Indiana, United States"
"04-20-2020","19011","Benton","Iowa","United States",2020-04-20 23:36:47,42.08011739,-92.06463573,23,1,0,22,"Benton, Iowa, United States"
"04-20-2020","27009","Benton","Minnesota","United States",2020-04-20 23:36:47,45.69804958,-93.99514135,4,0,0,4,"Benton, Minnesota, United States"
"04-20-2020","28009","Benton","Mississippi","United States",2020-04-20 23:36:47,34.81681228,-89.18945516,8,0,0,8,"Benton, Mississippi, United States"
"04-20-2020","29015","Benton","Missouri","United States",2020-04-20 23:36:47,38.29503305,-93.28756116,3,0,0,3,"Benton, Missouri, United States"
"04-20-2020","41003","Benton","Oregon","United States",2020-04-20 23:36:47,44.49167306,-123.4316987,28,5,0,23,"Benton, Oregon, United States"
"04-20-2020","47005","Benton","Tennessee","United States",2020-04-20 23:36:47,36.07110411,-88.06849355,4,0,0,4,"Benton, Tennessee, United States"
"04-20-2020","53005","Benton","Washington","United States",2020-04-20 23:36:47,46.23946995,-119.5120834,314,37,0,277,"Benton, Washington, United States"
"04-20-2020","26019","Benzie","Michigan","United States",2020-04-20 23:36:47,44.63899297,-86.01608482,4,0,0,4,"Benzie, Michigan, United States"
"04-20-2020","34003","Bergen","New Jersey","United States",2020-04-20 23:36:47,40.96010917,-74.07164325,13011,787,0,12224,"Bergen, New Jersey, United States"
"04-20-2020","45015","Berkeley","South Carolina","United States",2020-04-20 23:36:47,33.20222596,-79.94654523,138,3,0,135,"Berkeley, South Carolina, United States"
"04-20-2020","54003","Berkeley","West Virginia","United States",2020-04-20 23:36:47,39.46704621,-78.02414609,111,1,0,110,"Berkeley, West Virginia, United States"
"04-20-2020","42011","Berks","Pennsylvania","United States",2020-04-20 23:36:47,40.41570541,-75.92457766,1945,74,0,1871,"Berks, Pennsylvania, United States"
"04-20-2020","25003","Berkshire","Massachusetts","United States",2020-04-20 23:36:47,42.37428441,-73.20524838,387,27,0,360,"Berkshire, Massachusetts, United States"
