"Date_Published","FIPS","Admin2","Province_State","Country_Region","Last_Update","Latitude","Longitude","Confirmed","Deaths","Recovered","Active","Combined_Key"
"04-20-2020","20175","Seward","Kansas","United States",2020-04-20 23:36:47,37.19324632,-100.8507201,79,0,0,79,"Seward, Kansas, United States"
"04-20-2020","31159","Seward","Nebraska","United States",2020-04-20 23:36:47,40.87241834,-97.139673,2,0,0,2,"Seward, Nebraska, United States"
"04-20-2020","28125","Sharkey","Mississippi","United States",2020-04-20 23:36:47,32.88149103,-90.8159538,3,0,0,3,"Sharkey, Mississippi, United States"
"04-20-2020","05135","Sharp","Arkansas","United States",2020-04-20 23:36:47,36.16258158,-91.47819342,2,0,0,2,"Sharp, Arkansas, United States"
"04-20-2020","06089","Shasta","California","United States",2020-04-20 23:36:47,40.76391419,-122.0396884,26,3,0,23,"Shasta, California, United States"
"04-20-2020","55115","Shawano","Wisconsin","United States",2020-04-20 23:36:47,44.78902246,-88.76443896,6,0,0,6,"Shawano, Wisconsin, United States"
"04-20-2020","20177","Shawnee","Kansas","United States",2020-04-20 23:36:47,39.04100763,-95.7557264,94,5,0,89,"Shawnee, Kansas, United States"
"04-20-2020","55117","Sheboygan","Wisconsin","United States",2020-04-20 23:36:47,43.72099677,-87.94579284,43,2,0,41,"Sheboygan, Wisconsin, United States"
"04-20-2020","01117","Shelby","Alabama","United States",2020-04-20 23:36:47,33.26879845,-86.66232561,275,6,0,269,"Shelby, Alabama, United States"
"04-20-2020","17173","Shelby","Illinois","United States",2020-04-20 23:36:47,39.39133527,-88.80611122,4,0,0,4,"Shelby, Illinois, United States"
"04-20-2020","18145","Shelby","Indiana","United States",2020-04-20 23:36:47,39.52305623,-85.7915857,111,4,0,107,"Shelby, Indiana, United States"
"04-20-2020","19165","Shelby","Iowa","United States",2020-04-20 23:36:47,41.6850066,-95.31015553,9,0,0,9,"Shelby, Iowa, United States"
"04-20-2020","21211","Shelby","Kentucky","United States",2020-04-20 23:36:47,38.21476019,-85.194223,22,2,0,20,"Shelby, Kentucky, United States"
"04-20-2020","29205","Shelby","Missouri","United States",2020-04-20 23:36:47,39.79742518,-92.07634971,1,0,0,1,"Shelby, Missouri, United States"
"04-20-2020","39149","Shelby","Ohio","United States",2020-04-20 23:36:47,40.33163494,-84.20258189,28,0,0,28,"Shelby, Ohio, United States"
"04-20-2020","47157","Shelby","Tennessee","United States",2020-04-20 23:36:47,35.1864775,-89.89692423,1839,35,0,1804,"Shelby, Tennessee, United States"
"04-20-2020","48419","Shelby","Texas","United States",2020-04-20 23:36:47,31.79211404,-94.14550696,60,0,0,60,"Shelby, Texas, United States"
"04-20-2020","51171","Shenandoah","Virginia","United States",2020-04-20 23:36:47,38.85905135,-78.56813762,41,0,0,41,"Shenandoah, Virginia, United States"
"04-20-2020","27141","Sherburne","Minnesota","United States",2020-04-20 23:36:47,45.44447208,-93.77617511,13,0,0,13,"Sherburne, Minnesota, United States"
"04-20-2020","20179","Sheridan","Kansas","United States",2020-04-20 23:36:47,39.35018161,-100.4418259,1,0,0,1,"Sheridan, Kansas, United States"
"04-20-2020","56033","Sheridan","Wyoming","United States",2020-04-20 23:36:47,44.79048913,-106.8862389,12,0,0,12,"Sheridan, Wyoming, United States"
"04-20-2020","20181","Sherman","Kansas","United States",2020-04-20 23:36:47,39.35147699,-101.7197624,1,0,0,1,"Sherman, Kansas, United States"
"04-20-2020","41055","Sherman","Oregon","United States",2020-04-20 23:36:47,45.41501554,-120.6827834,1,0,0,1,"Sherman, Oregon, United States"
"04-20-2020","48421","Sherman","Texas","United States",2020-04-20 23:36:47,36.27751473,-101.8933156,7,0,0,7,"Sherman, Texas, United States"
"04-20-2020","26155","Shiawassee","Michigan","United States",2020-04-20 23:36:47,42.953928,-84.14585902,109,2,0,107,"Shiawassee, Michigan, United States"
"04-20-2020","27143","Sibley","Minnesota","United States",2020-04-20 23:36:47,44.5796592,-94.23164924,1,0,0,1,"Sibley, Minnesota, United States"
"04-20-2020","30093","Silver Bow","Montana","United States",2020-04-20 23:36:47,45.90018933,-112.6620092,11,0,0,11,"Silver Bow, Montana, United States"
"04-20-2020","21213","Simpson","Kentucky","United States",2020-04-20 23:36:47,36.74058474,-86.58047435,21,2,0,19,"Simpson, Kentucky, United States"
"04-20-2020","28127","Simpson","Mississippi","United States",2020-04-20 23:36:47,31.91282117,-89.91716179,28,0,0,28,"Simpson, Mississippi, United States"
"04-20-2020","19167","Sioux","Iowa","United States",2020-04-20 23:36:47,43.08221074,-96.1767568,7,0,0,7,"Sioux, Iowa, United States"
"04-20-2020","38085","Sioux","North Dakota","United States",2020-04-20 23:36:47,46.11323337,-101.0440149,1,0,0,1,"Sioux, North Dakota, United States"
"04-20-2020","06093","Siskiyou","California","United States",2020-04-20 23:36:47,41.59198861,-122.5407434,5,0,0,5,"Siskiyou, California, United States"
"04-20-2020","53057","Skagit","Washington","United States",2020-04-20 23:36:47,48.48171488,-121.766131,245,9,0,236,"Skagit, Washington, United States"
"04-20-2020","53059","Skamania","Washington","United States",2020-04-20 23:36:47,46.02408726,-121.9164403,3,0,0,3,"Skamania, Washington, United States"
"04-20-2020","38087","Slope","North Dakota","United States",2020-04-20 23:36:47,46.44737738,-103.4601547,3,0,0,3,"Slope, North Dakota, United States"
"04-20-2020","20183","Smith","Kansas","United States",2020-04-20 23:36:47,39.78516566,-98.78566062,2,0,0,2,"Smith, Kansas, United States"
"04-20-2020","28129","Smith","Mississippi","United States",2020-04-20 23:36:47,32.01744532,-89.50644846,47,2,0,45,"Smith, Mississippi, United States"
"04-20-2020","47159","Smith","Tennessee","United States",2020-04-20 23:36:47,36.25359775,-85.95411046,14,1,0,13,"Smith, Tennessee, United States"
"04-20-2020","48423","Smith","Texas","United States",2020-04-20 23:36:47,32.37474036,-95.2717568,121,2,0,119,"Smith, Texas, United States"
"04-20-2020","51173","Smyth","Virginia","United States",2020-04-20 23:36:47,36.84455636,-81.53344948,13,0,0,13,"Smyth, Virginia, United States"
"04-20-2020","53061","Snohomish","Washington","United States",2020-04-20 23:36:47,48.04615983,-121.7170703,2163,101,0,2062,"Snohomish, Washington, United States"
"04-20-2020","42109","Snyder","Pennsylvania","United States",2020-04-20 23:36:47,40.77129231,-77.06840691,28,1,0,27,"Snyder, Pennsylvania, United States"
"04-20-2020","35053","Socorro","New Mexico","United States",2020-04-20 23:36:47,34.00715494,-106.9298354,31,1,0,30,"Socorro, New Mexico, United States"
"04-20-2020","06095","Solano","California","United States",2020-04-20 23:36:47,38.26827353,-121.9357113,180,2,0,178,"Solano, California, United States"
"04-20-2020","23025","Somerset","Maine","United States",2020-04-20 23:36:47,45.51229767,-69.95995554,16,0,0,16,"Somerset, Maine, United States"
"04-20-2020","24039","Somerset","Maryland","United States",2020-04-20 23:44:33,38.1163542,-75.75118623,11,0,0,11,"Somerset, Maryland, United States"
"04-20-2020","34035","Somerset","New Jersey","United States",2020-04-20 23:36:47,40.56465737,-74.61683016,2488,170,0,2318,"Somerset, New Jersey, United States"
"04-20-2020","42111","Somerset","Pennsylvania","United States",2020-04-20 23:36:47,39.97172723,-79.02699593,19,0,0,19,"Somerset, Pennsylvania, United States"
"04-20-2020","06097","Sonoma","California","United States",2020-04-20 23:36:47,38.52746429,-122.8862506,181,2,0,179,"Sonoma, California, United States"
"04-20-2020","51175","Southampton","Virginia","United States",2020-04-20 23:36:47,36.72231125,-77.10642712,17,0,0,17,"Southampton, Virginia, United States"
"04-20-2020","02240","Southeast Fairbanks","Alaska","United States",2020-04-20 23:36:47,63.87692095,-143.2127643,1,0,0,1,"Southeast Fairbanks, Alaska, United States"
"04-20-2020",NA,"Southeast Utah","Utah","United States",2020-04-20 23:36:47,38.99617072,-110.7013958,7,0,0,7,"Southeast Utah, Utah, United States"
"04-20-2020",NA,"Southwest Utah","Utah","United States",2020-04-20 23:36:47,37.85447192,-111.4418764,70,1,0,69,"Southwest Utah, Utah, United States"
"04-20-2020","13255","Spalding","Georgia","United States",2020-04-20 23:36:47,33.26310031,-84.28013991,135,7,0,128,"Spalding, Georgia, United States"
"04-20-2020","45083","Spartanburg","South Carolina","United States",2020-04-20 23:36:47,34.92960077,-81.99225984,219,5,0,214,"Spartanburg, South Carolina, United States"
"04-20-2020","18147","Spencer","Indiana","United States",2020-04-20 23:36:47,38.01519732,-87.0079644,4,0,0,4,"Spencer, Indiana, United States"
"04-20-2020","21215","Spencer","Kentucky","United States",2020-04-20 23:36:47,38.03223971,-85.32749335,9,0,0,9,"Spencer, Kentucky, United States"
"04-20-2020","46115","Spink","South Dakota","United States",2020-04-20 23:36:47,44.93837606,-98.34626602,3,0,0,3,"Spink, South Dakota, United States"
"04-20-2020","53063","Spokane","Washington","United States",2020-04-20 23:36:47,47.62113146,-117.4046494,313,18,0,295,"Spokane, Washington, United States"
"04-20-2020","51177","Spotsylvania","Virginia","United States",2020-04-20 23:36:47,38.18574462,-77.655399,77,0,0,77,"Spotsylvania, Virginia, United States"
"04-20-2020","22087","St. Bernard","Louisiana","United States",2020-04-20 23:36:47,29.87761636,-89.51887093,423,12,0,411,"St. Bernard, Louisiana, United States"
"04-20-2020","22089","St. Charles","Louisiana","United States",2020-04-20 23:36:47,29.90709658,-90.35555967,508,28,0,480,"St. Charles, Louisiana, United States"
"04-20-2020","29183","St. Charles","Missouri","United States",2020-04-20 23:36:47,38.77875681,-90.66662425,458,19,0,439,"St. Charles, Missouri, United States"
"04-20-2020","01115","St. Clair","Alabama","United States",2020-04-20 23:36:47,33.71902176,-86.31029372,62,0,0,62,"St. Clair, Alabama, United States"
"04-20-2020","17163","St. Clair","Illinois","United States",2020-04-20 23:36:47,38.46996033,-89.93063427,276,18,0,258,"St. Clair, Illinois, United States"
"04-20-2020","26147","St. Clair","Michigan","United States",2020-04-20 23:36:47,42.92655373,-82.67937954,252,11,0,241,"St. Clair, Michigan, United States"
"04-20-2020","29185","St. Clair","Missouri","United States",2020-04-20 23:36:47,38.03699437,-93.77631447,2,0,0,2,"St. Clair, Missouri, United States"
"04-20-2020","55109","St. Croix","Wisconsin","United States",2020-04-20 23:36:47,45.03437474,-92.45000068,11,0,0,11,"St. Croix, Wisconsin, United States"
"04-20-2020","05123","St. Francis","Arkansas","United States",2020-04-20 23:36:47,35.02201976,-90.74828138,65,0,0,65,"St. Francis, Arkansas, United States"
"04-20-2020","29187","St. Francois","Missouri","United States",2020-04-20 23:36:47,37.81214171,-90.47598685,24,1,0,23,"St. Francois, Missouri, United States"
"04-20-2020","22091","St. Helena","Louisiana","United States",2020-04-20 23:36:47,30.82210324,-90.71013176,20,1,0,19,"St. Helena, Louisiana, United States"
"04-20-2020","22093","St. James","Louisiana","United States",2020-04-20 23:36:47,30.02531716,-90.80212061,222,15,0,207,"St. James, Louisiana, United States"
"04-20-2020","22095","St. John the Baptist","Louisiana","United States",2020-04-20 23:36:47,30.12597499,-90.4753503,669,53,0,616,"St. John the Baptist, Louisiana, United States"
"04-20-2020","12109","St. Johns","Florida","United States",2020-04-20 23:36:47,29.90096506,-81.43589967,192,4,0,188,"St. Johns, Florida, United States"
"04-20-2020","18141","St. Joseph","Indiana","United States",2020-04-20 23:36:47,41.61756781,-86.29040834,412,9,0,403,"St. Joseph, Indiana, United States"
"04-20-2020","26149","St. Joseph","Michigan","United States",2020-04-20 23:36:47,41.91441767,-85.52797979,25,1,0,24,"St. Joseph, Michigan, United States"
"04-20-2020","22097","St. Landry","Louisiana","United States",2020-04-20 23:36:47,30.59724262,-92.00135806,136,20,0,116,"St. Landry, Louisiana, United States"
"04-20-2020","36089","St. Lawrence","New York","United States",2020-04-20 23:36:47,44.4976179,-75.06550039,110,0,0,110,"St. Lawrence, New York, United States"
"04-20-2020","27137","St. Louis","Minnesota","United States",2020-04-20 23:36:47,47.6048407,-92.46879855,52,10,0,42,"St. Louis, Minnesota, United States"
"04-20-2020","29189","St. Louis","Missouri","United States",2020-04-20 23:36:47,38.6377004,-90.4458375,2289,82,0,2207,"St. Louis, Missouri, United States"
"04-20-2020","29510","St. Louis City","Missouri","United States",2020-04-20 23:36:47,38.63555736,-90.24349225,859,30,0,829,"St. Louis City, Missouri, United States"
"04-20-2020","12111","St. Lucie","Florida","United States",2020-04-20 23:36:47,27.37763908,-80.47106649,204,15,0,189,"St. Lucie, Florida, United States"
"04-20-2020","22099","St. Martin","Louisiana","United States",2020-04-20 23:36:47,30.13112107,-91.61403569,193,12,0,181,"St. Martin, Louisiana, United States"
"04-20-2020","22101","St. Mary","Louisiana","United States",2020-04-20 23:36:47,29.69262097,-91.44702164,156,12,0,144,"St. Mary, Louisiana, United States"
"04-20-2020","24037","St. Mary's","Maryland","United States",2020-04-20 23:44:33,38.30058422,-76.6062928,107,2,0,105,"St. Mary's, Maryland, United States"
"04-20-2020","22103","St. Tammany","Louisiana","United States",2020-04-20 23:36:47,30.40942847,-89.95642711,1057,73,0,984,"St. Tammany, Louisiana, United States"
"04-20-2020","20185","Stafford","Kansas","United States",2020-04-20 23:36:47,38.03100851,-98.71762001,1,0,0,1,"Stafford, Kansas, United States"
"04-20-2020","51179","Stafford","Virginia","United States",2020-04-20 23:36:47,38.41758738,-77.45917053,161,0,0,161,"Stafford, Virginia, United States"
"04-20-2020","06099","Stanislaus","California","United States",2020-04-20 23:36:47,37.55862499,-120.9970722,226,4,0,222,"Stanislaus, California, United States"
"04-20-2020","37167","Stanly","North Carolina","United States",2020-04-20 23:36:47,35.31647813,-80.25093221,21,3,0,18,"Stanly, North Carolina, United States"
"04-20-2020","20187","Stanton","Kansas","United States",2020-04-20 23:36:47,37.56304714,-101.7843534,4,0,0,4,"Stanton, Kansas, United States"
"04-20-2020","31167","Stanton","Nebraska","United States",2020-04-20 23:36:47,41.9169835,-97.19394708,2,0,0,2,"Stanton, Nebraska, United States"
"04-20-2020","17175","Stark","Illinois","United States",2020-04-20 23:36:47,41.09309773,-89.79745866,1,0,0,1,"Stark, Illinois, United States"
"04-20-2020","38089","Stark","North Dakota","United States",2020-04-20 23:36:47,46.80851182,-102.6576326,39,2,0,37,"Stark, North Dakota, United States"
"04-20-2020","39151","Stark","Ohio","United States",2020-04-20 23:36:47,40.81482476,-81.36437305,237,25,0,212,"Stark, Ohio, United States"
"04-20-2020","18149","Starke","Indiana","United States",2020-04-20 23:36:47,41.27890281,-86.64686895,11,1,0,10,"Starke, Indiana, United States"
"04-20-2020","48427","Starr","Texas","United States",2020-04-20 23:36:47,26.56150059,-98.73892358,7,0,0,7,"Starr, Texas, United States"
"04-20-2020","51790","Staunton","Virginia","United States",2020-04-20 23:36:47,38.15965544,-79.05979937,8,0,0,8,"Staunton, Virginia, United States"
"04-20-2020","29186","Ste. Genevieve","Missouri","United States",2020-04-20 23:36:47,37.89090059,-90.1949941,7,1,0,6,"Ste. Genevieve, Missouri, United States"
"04-20-2020","27145","Stearns","Minnesota","United States",2020-04-20 23:36:47,45.55192576,-94.61078221,17,0,0,17,"Stearns, Minnesota, United States"
"04-20-2020","27147","Steele","Minnesota","United States",2020-04-20 23:36:47,44.02240351,-93.22627088,9,0,0,9,"Steele, Minnesota, United States"
"04-20-2020","13257","Stephens","Georgia","United States",2020-04-20 23:36:47,34.55151201,-83.29405315,40,1,0,39,"Stephens, Georgia, United States"
"04-20-2020","40137","Stephens","Oklahoma","United States",2020-04-20 23:36:47,34.48556989,-97.85141892,19,1,0,18,"Stephens, Oklahoma, United States"
"04-20-2020","48429","Stephens","Texas","United States",2020-04-20 23:36:47,32.73553157,-98.83631615,1,0,0,1,"Stephens, Texas, United States"
"04-20-2020","17177","Stephenson","Illinois","United States",2020-04-20 23:36:47,42.35129217,-89.662598,12,0,0,12,"Stephenson, Illinois, United States"
"04-20-2020","18151","Steuben","Indiana","United States",2020-04-20 23:36:47,41.64423868,-85.00101094,17,1,0,16,"Steuben, Indiana, United States"
"04-20-2020","36101","Steuben","New York","United States",2020-04-20 23:36:47,42.2689144,-77.3829924,195,27,0,168,"Steuben, New York, United States"
"04-20-2020","20189","Stevens","Kansas","United States",2020-04-20 23:36:47,37.1923008,-101.3118967,4,0,0,4,"Stevens, Kansas, United States"
"04-20-2020","53065","Stevens","Washington","United States",2020-04-20 23:36:47,48.40035475,-117.8542701,8,1,0,7,"Stevens, Washington, United States"
"04-20-2020","13259","Stewart","Georgia","United States",2020-04-20 23:36:47,32.07996777,-84.83208037,17,0,0,17,"Stewart, Georgia, United States"
"04-20-2020","47161","Stewart","Tennessee","United States",2020-04-20 23:36:47,36.50235092,-87.83920548,6,0,0,6,"Stewart, Tennessee, United States"
"04-20-2020","30095","Stillwater","Montana","United States",2020-04-20 23:36:47,45.67071407,-109.3950061,1,0,0,1,"Stillwater, Montana, United States"
"04-20-2020","29207","Stoddard","Missouri","United States",2020-04-20 23:36:47,36.85571651,-89.9444155,18,0,0,18,"Stoddard, Missouri, United States"
"04-20-2020","37169","Stokes","North Carolina","United States",2020-04-20 23:36:47,36.4017975,-80.23893369,10,0,0,10,"Stokes, North Carolina, United States"
"04-20-2020","05137","Stone","Arkansas","United States",2020-04-20 23:36:47,35.86251946,-92.15684085,7,0,0,7,"Stone, Arkansas, United States"
"04-20-2020","28131","Stone","Mississippi","United States",2020-04-20 23:36:47,30.79187949,-89.11547539,19,0,0,19,"Stone, Mississippi, United States"
"04-20-2020","29209","Stone","Missouri","United States",2020-04-20 23:36:47,36.75000327,-93.45256475,3,0,0,3,"Stone, Missouri, United States"
"04-20-2020","19169","Story","Iowa","United States",2020-04-20 23:36:47,42.03621213,-93.46499005,20,0,0,20,"Story, Iowa, United States"
"04-20-2020","33017","Strafford","New Hampshire","United States",2020-04-20 23:36:47,43.291833,-71.02336013,111,0,0,111,"Strafford, New Hampshire, United States"
"04-20-2020","38093","Stutsman","North Dakota","United States",2020-04-20 23:36:47,46.97962541,-98.95637318,3,0,0,3,"Stutsman, North Dakota, United States"
"04-20-2020","56035","Sublette","Wyoming","United States",2020-04-20 23:36:47,42.76558279,-109.9130922,1,0,0,1,"Sublette, Wyoming, United States"
"04-20-2020","25025","Suffolk","Massachusetts","United States",2020-04-20 23:36:47,42.3279514,-71.07850442,8074,236,0,7838,"Suffolk, Massachusetts, United States"
"04-20-2020","36103","Suffolk","New York","United States",2020-04-20 23:36:47,40.88320119,-72.8012172,28127,859,0,27268,"Suffolk, New York, United States"
"04-20-2020","51800","Suffolk","Virginia","United States",2020-04-20 23:36:47,36.70155394,-76.63603554,92,0,0,92,"Suffolk, Virginia, United States"
"04-20-2020","18153","Sullivan","Indiana","United States",2020-04-20 23:36:47,39.08952258,-87.41414469,9,0,0,9,"Sullivan, Indiana, United States"
"04-20-2020","33019","Sullivan","New Hampshire","United States",2020-04-20 23:36:47,43.36094111,-72.22203125,10,0,0,10,"Sullivan, New Hampshire, United States"
"04-20-2020","36105","Sullivan","New York","United States",2020-04-20 23:36:47,41.71579493,-74.76394559,560,13,0,547,"Sullivan, New York, United States"
"04-20-2020","42113","Sullivan","Pennsylvania","United States",2020-04-20 23:36:47,41.44634738,-76.51246591,1,0,0,1,"Sullivan, Pennsylvania, United States"
"04-20-2020","47163","Sullivan","Tennessee","United States",2020-04-20 23:36:47,36.51240691,-82.30412917,45,1,0,44,"Sullivan, Tennessee, United States"
"04-20-2020","46119","Sully","South Dakota","United States",2020-04-20 23:36:47,44.71571812,-100.1278092,1,0,0,1,"Sully, South Dakota, United States"
"04-20-2020","54089","Summers","West Virginia","United States",2020-04-20 23:36:47,37.65390597,-80.86009693,1,0,0,1,"Summers, West Virginia, United States"
"04-20-2020","08117","Summit","Colorado","United States",2020-04-20 23:36:47,39.63803232,-106.1150762,93,1,0,92,"Summit, Colorado, United States"
"04-20-2020","39153","Summit","Ohio","United States",2020-04-20 23:36:47,41.12464734,-81.53123079,370,24,0,346,"Summit, Ohio, United States"
"04-20-2020","49043","Summit","Utah","United States",2020-04-20 23:36:47,40.86688146,-110.9535882,331,0,0,331,"Summit, Utah, United States"
"04-20-2020","20191","Sumner","Kansas","United States",2020-04-20 23:36:47,37.23682549,-97.47721621,3,1,0,2,"Sumner, Kansas, United States"
"04-20-2020","47165","Sumner","Tennessee","United States",2020-04-20 23:36:47,36.46824103,-86.45917204,518,31,0,487,"Sumner, Tennessee, United States"
"04-20-2020","01119","Sumter","Alabama","United States",2020-04-20 23:36:47,32.59117397,-88.19916205,40,0,0,40,"Sumter, Alabama, United States"
"04-20-2020","12119","Sumter","Florida","United States",2020-04-20 23:36:47,28.70181754,-82.0794267,153,11,0,142,"Sumter, Florida, United States"
"04-20-2020","13261","Sumter","Georgia","United States",2020-04-20 23:36:47,32.03650571,-84.19821492,332,18,0,314,"Sumter, Georgia, United States"
"04-20-2020","45085","Sumter","South Carolina","United States",2020-04-20 23:36:47,33.91826534,-80.37942316,185,6,0,179,"Sumter, South Carolina, United States"
"04-20-2020","28133","Sunflower","Mississippi","United States",2020-04-20 23:36:47,33.60192578,-90.58882684,47,2,0,45,"Sunflower, Mississippi, United States"
"04-20-2020","37171","Surry","North Carolina","United States",2020-04-20 23:36:47,36.41689489,-80.69102283,17,0,0,17,"Surry, North Carolina, United States"
"04-20-2020","51181","Surry","Virginia","United States",2020-04-20 23:36:47,37.11781893,-76.88450012,4,0,0,4,"Surry, Virginia, United States"
"04-20-2020","42115","Susquehanna","Pennsylvania","United States",2020-04-20 23:36:47,41.82147784,-75.80071959,66,4,0,62,"Susquehanna, Pennsylvania, United States"
"04-20-2020","10005","Sussex","Delaware","United States",2020-04-20 23:36:47,38.66143781,-75.39031349,1055,26,0,1029,"Sussex, Delaware, United States"
"04-20-2020","34037","Sussex","New Jersey","United States",2020-04-20 23:36:47,41.13891592,-74.69118243,680,64,0,616,"Sussex, New Jersey, United States"
"04-20-2020","51183","Sussex","Virginia","United States",2020-04-20 23:36:47,36.92432914,-77.25791182,12,0,0,12,"Sussex, Virginia, United States"
"04-20-2020","06101","Sutter","California","United States",2020-04-20 23:36:47,39.03417539,-121.6945899,26,2,0,24,"Sutter, California, United States"
"04-20-2020","12121","Suwannee","Florida","United States",2020-04-20 23:36:47,30.19746066,-82.9909967,98,8,0,90,"Suwannee, Florida, United States"
"04-20-2020","56037","Sweetwater","Wyoming","United States",2020-04-20 23:36:47,41.65943896,-108.8827882,10,0,0,10,"Sweetwater, Wyoming, United States"
"04-20-2020","27151","Swift","Minnesota","United States",2020-04-20 23:36:47,45.2829032,-95.68264092,1,0,0,1,"Swift, Minnesota, United States"
"04-20-2020","48437","Swisher","Texas","United States",2020-04-20 23:36:47,34.53028891,-101.7349174,5,0,0,5,"Swisher, Texas, United States"
"04-20-2020","18155","Switzerland","Indiana","United States",2020-04-20 23:36:47,38.82767338,-85.03022429,13,0,0,13,"Switzerland, Indiana, United States"
"04-20-2020","13263","Talbot","Georgia","United States",2020-04-20 23:36:47,32.69642758,-84.53351366,19,1,0,18,"Talbot, Georgia, United States"
"04-20-2020","24041","Talbot","Maryland","United States",2020-04-20 23:44:33,38.76618159,-76.10882561,22,1,0,21,"Talbot, Maryland, United States"
"04-20-2020","01121","Talladega","Alabama","United States",2020-04-20 23:36:47,33.37823223,-86.16886178,50,1,0,49,"Talladega, Alabama, United States"
"04-20-2020","28135","Tallahatchie","Mississippi","United States",2020-04-20 23:36:47,33.95339918,-90.1729398,8,1,0,7,"Tallahatchie, Mississippi, United States"
"04-20-2020","01123","Tallapoosa","Alabama","United States",2020-04-20 23:36:47,32.86698258,-85.79833053,194,12,0,182,"Tallapoosa, Alabama, United States"
"04-20-2020","19171","Tama","Iowa","United States",2020-04-20 23:36:47,42.07991767,-92.53266945,197,6,0,191,"Tama, Iowa, United States"
"04-20-2020","29213","Taney","Missouri","United States",2020-04-20 23:36:47,36.65465345,-93.04075153,9,1,0,8,"Taney, Missouri, United States"
"04-20-2020","22105","Tangipahoa","Louisiana","United States",2020-04-20 23:36:47,30.62888673,-90.40664996,452,19,0,433,"Tangipahoa, Louisiana, United States"
"04-20-2020","35055","Taos","New Mexico","United States",2020-04-20 23:36:47,36.58006022,-105.6310198,16,0,0,16,"Taos, New Mexico, United States"
"04-20-2020","48439","Tarrant","Texas","United States",2020-04-20 23:36:47,32.77143818,-97.29101614,1242,39,0,1203,"Tarrant, Texas, United States"
"04-20-2020","28137","Tate","Mississippi","United States",2020-04-20 23:36:47,34.65133709,-89.94485778,34,0,0,34,"Tate, Mississippi, United States"
"04-20-2020","13267","Tattnall","Georgia","United States",2020-04-20 23:36:47,32.04785085,-82.05539188,5,0,0,5,"Tattnall, Georgia, United States"
"04-20-2020","12123","Taylor","Florida","United States",2020-04-20 23:36:47,30.04848048,-83.60445406,2,0,0,2,"Taylor, Florida, United States"
"04-20-2020","13269","Taylor","Georgia","United States",2020-04-20 23:36:47,32.55792548,-84.25077141,13,2,0,11,"Taylor, Georgia, United States"
"04-20-2020","19173","Taylor","Iowa","United States",2020-04-20 23:36:47,40.73710579,-94.69778563,1,0,0,1,"Taylor, Iowa, United States"
"04-20-2020","21217","Taylor","Kentucky","United States",2020-04-20 23:36:47,37.3677562,-85.3329931,4,0,0,4,"Taylor, Kentucky, United States"
"04-20-2020","48441","Taylor","Texas","United States",2020-04-20 23:36:47,32.30163422,-99.89007449,144,2,0,142,"Taylor, Texas, United States"
"04-20-2020","54091","Taylor","West Virginia","United States",2020-04-20 23:36:47,39.33602617,-80.0421439,5,0,0,5,"Taylor, West Virginia, United States"
"04-20-2020","17179","Tazewell","Illinois","United States",2020-04-20 23:36:47,40.50716185,-89.51404662,26,3,0,23,"Tazewell, Illinois, United States"
