"Date_Published","FIPS","Admin2","Province_State","Country_Region","Last_Update","Latitude","Longitude","Confirmed","Deaths","Recovered","Active","Combined_Key"
"04-20-2020","28077","Lawrence","Mississippi","United States",2020-04-20 23:36:47,31.55147224,-90.10841127,17,0,0,17,"Lawrence, Mississippi, United States"
"04-20-2020","39087","Lawrence","Ohio","United States",2020-04-20 23:36:47,38.59743452,-82.53466552,21,0,0,21,"Lawrence, Ohio, United States"
"04-20-2020","42073","Lawrence","Pennsylvania","United States",2020-04-20 23:36:47,40.99206278,-80.33393706,59,5,0,54,"Lawrence, Pennsylvania, United States"
"04-20-2020","46081","Lawrence","South Dakota","United States",2020-04-20 23:36:47,44.35919441,-103.7929428,9,0,0,9,"Lawrence, South Dakota, United States"
"04-20-2020","47099","Lawrence","Tennessee","United States",2020-04-20 23:36:47,35.21675201,-87.39787695,15,0,0,15,"Lawrence, Tennessee, United States"
"04-20-2020","40079","Le Flore","Oklahoma","United States",2020-04-20 23:36:47,34.89851864,-94.70392124,6,0,0,6,"Le Flore, Oklahoma, United States"
"04-20-2020","27079","Le Sueur","Minnesota","United States",2020-04-20 23:36:47,44.37136597,-93.72844721,22,0,0,22,"Le Sueur, Minnesota, United States"
"04-20-2020","35025","Lea","New Mexico","United States",2020-04-20 23:36:47,32.79215361,-103.4123733,2,0,0,2,"Lea, New Mexico, United States"
"04-20-2020","28079","Leake","Mississippi","United States",2020-04-20 23:36:47,32.7536828,-89.52402044,86,1,0,85,"Leake, Mississippi, United States"
"04-20-2020","20103","Leavenworth","Kansas","United States",2020-04-20 23:36:47,39.20183497,-95.03620809,135,3,0,132,"Leavenworth, Kansas, United States"
"04-20-2020","42075","Lebanon","Pennsylvania","United States",2020-04-20 23:36:47,40.36680311,-76.45651841,502,5,0,497,"Lebanon, Pennsylvania, United States"
"04-20-2020","01081","Lee","Alabama","United States",2020-04-20 23:36:47,32.60154883,-85.35132246,322,15,0,307,"Lee, Alabama, United States"
"04-20-2020","05077","Lee","Arkansas","United States",2020-04-20 23:36:47,34.78498904,-90.78383866,3,1,0,2,"Lee, Arkansas, United States"
"04-20-2020","12071","Lee","Florida","United States",2020-04-20 23:36:47,26.58410348,-81.88399313,785,28,0,757,"Lee, Florida, United States"
"04-20-2020","13177","Lee","Georgia","United States",2020-04-20 23:36:47,31.7793306,-84.14324253,276,16,0,260,"Lee, Georgia, United States"
"04-20-2020","17103","Lee","Illinois","United States",2020-04-20 23:36:47,41.74583951,-89.29977132,17,0,0,17,"Lee, Illinois, United States"
"04-20-2020","19111","Lee","Iowa","United States",2020-04-20 23:36:47,40.64181461,-91.48183025,3,0,0,3,"Lee, Iowa, United States"
"04-20-2020","28081","Lee","Mississippi","United States",2020-04-20 23:36:47,34.2918775,-88.68149954,63,4,0,59,"Lee, Mississippi, United States"
"04-20-2020","37105","Lee","North Carolina","United States",2020-04-20 23:36:47,35.47623147,-79.17569362,38,0,0,38,"Lee, North Carolina, United States"
"04-20-2020","45061","Lee","South Carolina","United States",2020-04-20 23:36:47,34.16393091,-80.25690731,42,5,0,37,"Lee, South Carolina, United States"
"04-20-2020","48287","Lee","Texas","United States",2020-04-20 23:36:47,30.31120597,-96.97045773,2,0,0,2,"Lee, Texas, United States"
"04-20-2020","51105","Lee","Virginia","United States",2020-04-20 23:36:47,36.70586667,-83.12606515,7,0,0,7,"Lee, Virginia, United States"
"04-20-2020","26089","Leelanau","Michigan","United States",2020-04-20 23:36:47,44.94430054,-85.80150326,7,0,0,7,"Leelanau, Michigan, United States"
"04-20-2020","28083","Leflore","Mississippi","United States",2020-04-20 23:36:47,33.55545125,-90.29900733,105,10,0,95,"Leflore, Mississippi, United States"
"04-20-2020","42077","Lehigh","Pennsylvania","United States",2020-04-20 23:36:47,40.6154815,-75.59435245,2245,33,0,2212,"Lehigh, Pennsylvania, United States"
"04-20-2020","26091","Lenawee","Michigan","United States",2020-04-20 23:36:47,41.89475156,-84.06603727,65,0,0,65,"Lenawee, Michigan, United States"
"04-20-2020","37107","Lenoir","North Carolina","United States",2020-04-20 23:36:47,35.2403259,-77.64245615,21,1,0,20,"Lenoir, North Carolina, United States"
"04-20-2020","12073","Leon","Florida","United States",2020-04-20 23:36:47,30.45955727,-84.27491114,184,1,0,183,"Leon, Florida, United States"
"04-20-2020","48289","Leon","Texas","United States",2020-04-20 23:36:47,31.29872538,-95.9936328,5,0,0,5,"Leon, Texas, United States"
"04-20-2020","21131","Leslie","Kentucky","United States",2020-04-20 23:36:47,37.09246661,-83.37999606,2,0,0,2,"Leslie, Kentucky, United States"
"04-20-2020","21133","Letcher","Kentucky","United States",2020-04-20 23:36:47,37.12306748,-82.85346474,1,0,0,1,"Letcher, Kentucky, United States"
"04-20-2020","12075","Levy","Florida","United States",2020-04-20 23:36:47,29.31829741,-82.74007147,13,0,0,13,"Levy, Florida, United States"
"04-20-2020","16061","Lewis","Idaho","United States",2020-04-20 23:36:47,46.23315327,-116.434146,0,0,0,0,"Lewis, Idaho, United States"
"04-20-2020","21135","Lewis","Kentucky","United States",2020-04-20 23:36:47,38.53184419,-83.37735618,3,0,0,3,"Lewis, Kentucky, United States"
"04-20-2020","36049","Lewis","New York","United States",2020-04-20 23:36:47,43.7844157,-75.44903992,9,0,0,9,"Lewis, New York, United States"
"04-20-2020","47101","Lewis","Tennessee","United States",2020-04-20 23:36:47,35.52853208,-87.49022694,2,0,0,2,"Lewis, Tennessee, United States"
"04-20-2020","53041","Lewis","Washington","United States",2020-04-20 23:36:47,46.57756476,-122.3925769,21,3,0,18,"Lewis, Washington, United States"
"04-20-2020","54041","Lewis","West Virginia","United States",2020-04-20 23:36:47,38.9947249,-80.49988181,2,0,0,2,"Lewis, West Virginia, United States"
"04-20-2020","30049","Lewis and Clark","Montana","United States",2020-04-20 23:36:47,47.12610041,-112.394698,16,0,0,16,"Lewis and Clark, Montana, United States"
"04-20-2020","45063","Lexington","South Carolina","United States",2020-04-20 23:36:47,33.89665987,-81.27146426,274,9,0,265,"Lexington, South Carolina, United States"
"04-20-2020","51678","Lexington","Virginia","United States",2020-04-20 23:36:47,37.78258621,-79.44262866,3,0,0,3,"Lexington, Virginia, United States"
"04-20-2020","12077","Liberty","Florida","United States",2020-04-20 23:36:47,30.23766008,-84.8829258,2,0,0,2,"Liberty, Florida, United States"
"04-20-2020","13179","Liberty","Georgia","United States",2020-04-20 23:36:47,31.82588896,-81.49251135,34,0,0,34,"Liberty, Georgia, United States"
"04-20-2020","30051","Liberty","Montana","United States",2020-04-20 23:36:47,48.56084317,-111.024307,1,0,0,1,"Liberty, Montana, United States"
"04-20-2020","48291","Liberty","Texas","United States",2020-04-20 23:36:47,30.15152688,-94.81205615,32,0,0,32,"Liberty, Texas, United States"
"04-20-2020","39089","Licking","Ohio","United States",2020-04-20 23:36:47,40.09136236,-82.48185785,100,4,0,96,"Licking, Ohio, United States"
"04-20-2020","01083","Limestone","Alabama","United States",2020-04-20 23:36:47,34.81185586,-86.98310072,41,0,0,41,"Limestone, Alabama, United States"
"04-20-2020","48293","Limestone","Texas","United States",2020-04-20 23:36:47,31.5454767,-96.58095444,11,1,0,10,"Limestone, Texas, United States"
"04-20-2020","05079","Lincoln","Arkansas","United States",2020-04-20 23:36:47,33.95317155,-91.74002806,258,0,0,258,"Lincoln, Arkansas, United States"
"04-20-2020","08073","Lincoln","Colorado","United States",2020-04-20 23:36:47,38.98749519,-103.5136649,3,0,0,3,"Lincoln, Colorado, United States"
"04-20-2020","13181","Lincoln","Georgia","United States",2020-04-20 23:36:47,33.79201475,-82.45024131,9,0,0,9,"Lincoln, Georgia, United States"
"04-20-2020","16063","Lincoln","Idaho","United States",2020-04-20 23:36:47,43.0012336,-114.1358773,17,0,0,17,"Lincoln, Idaho, United States"
"04-20-2020","21137","Lincoln","Kentucky","United States",2020-04-20 23:36:47,37.45475628,-84.6565327,4,1,0,3,"Lincoln, Kentucky, United States"
"04-20-2020","22061","Lincoln","Louisiana","United States",2020-04-20 23:36:47,32.6003154,-92.6659741,51,2,0,49,"Lincoln, Louisiana, United States"
"04-20-2020","23015","Lincoln","Maine","United States",2020-04-20 23:36:47,44.05996956,-69.54227124,12,0,0,12,"Lincoln, Maine, United States"
"04-20-2020","27081","Lincoln","Minnesota","United States",2020-04-20 23:36:47,44.41311883,-96.26688165,2,0,0,2,"Lincoln, Minnesota, United States"
"04-20-2020","28085","Lincoln","Mississippi","United States",2020-04-20 23:36:47,31.53288662,-90.45391915,107,6,0,101,"Lincoln, Mississippi, United States"
"04-20-2020","29113","Lincoln","Missouri","United States",2020-04-20 23:36:47,39.05345619,-90.95588181,56,1,0,55,"Lincoln, Missouri, United States"
"04-20-2020","30053","Lincoln","Montana","United States",2020-04-20 23:36:47,48.54265777,-115.4046155,7,1,0,6,"Lincoln, Montana, United States"
"04-20-2020","31111","Lincoln","Nebraska","United States",2020-04-20 23:36:47,41.04658298,-100.7475374,18,1,0,17,"Lincoln, Nebraska, United States"
"04-20-2020","32017","Lincoln","Nevada","United States",2020-04-20 23:36:47,37.64268459,-114.8790388,0,0,0,0,"Lincoln, Nevada, United States"
"04-20-2020","35027","Lincoln","New Mexico","United States",2020-04-20 23:36:47,33.74526079,-105.4586166,1,0,0,1,"Lincoln, New Mexico, United States"
"04-20-2020","37109","Lincoln","North Carolina","United States",2020-04-20 23:36:47,35.48508185,-81.21740317,19,0,0,19,"Lincoln, North Carolina, United States"
"04-20-2020","40081","Lincoln","Oklahoma","United States",2020-04-20 23:36:47,35.70270942,-96.8812462,10,0,0,10,"Lincoln, Oklahoma, United States"
"04-20-2020","41041","Lincoln","Oregon","United States",2020-04-20 23:36:47,44.64252874,-123.869912,5,0,0,5,"Lincoln, Oregon, United States"
"04-20-2020","46083","Lincoln","South Dakota","United States",2020-04-20 23:36:47,43.27841182,-96.7203905,95,0,0,95,"Lincoln, South Dakota, United States"
"04-20-2020","47103","Lincoln","Tennessee","United States",2020-04-20 23:36:47,35.13738622,-86.58910106,10,0,0,10,"Lincoln, Tennessee, United States"
"04-20-2020","53043","Lincoln","Washington","United States",2020-04-20 23:36:47,47.57705241,-118.4194388,2,0,0,2,"Lincoln, Washington, United States"
"04-20-2020","54043","Lincoln","West Virginia","United States",2020-04-20 23:36:47,38.172154,-82.07017953,1,0,0,1,"Lincoln, West Virginia, United States"
"04-20-2020","56023","Lincoln","Wyoming","United States",2020-04-20 23:36:47,42.26376367,-110.6563997,5,0,0,5,"Lincoln, Wyoming, United States"
"04-20-2020","19113","Linn","Iowa","United States",2020-04-20 23:36:47,42.07923082,-91.59809485,409,27,0,382,"Linn, Iowa, United States"
"04-20-2020","20107","Linn","Kansas","United States",2020-04-20 23:36:47,38.21267844,-94.84254089,6,0,0,6,"Linn, Kansas, United States"
"04-20-2020","29115","Linn","Missouri","United States",2020-04-20 23:36:47,39.87001769,-93.10704106,5,1,0,4,"Linn, Missouri, United States"
"04-20-2020","41043","Linn","Oregon","United States",2020-04-20 23:36:47,44.48899494,-122.5373154,61,6,0,55,"Linn, Oregon, United States"
"04-20-2020","09005","Litchfield","Connecticut","United States",2020-04-20 23:36:47,41.7937534,-73.2451475,639,58,0,581,"Litchfield, Connecticut, United States"
"04-20-2020","48297","Live Oak","Texas","United States",2020-04-20 23:36:47,28.35101362,-98.1246786,3,0,0,3,"Live Oak, Texas, United States"
"04-20-2020","17105","Livingston","Illinois","United States",2020-04-20 23:36:47,40.89188292,-88.55784752,17,0,0,17,"Livingston, Illinois, United States"
"04-20-2020","21139","Livingston","Kentucky","United States",2020-04-20 23:36:47,37.21137452,-88.34797529,1,0,0,1,"Livingston, Kentucky, United States"
"04-20-2020","22063","Livingston","Louisiana","United States",2020-04-20 23:36:47,30.44143993,-90.73061664,149,8,0,141,"Livingston, Louisiana, United States"
"04-20-2020","26093","Livingston","Michigan","United States",2020-04-20 23:36:47,42.60302282,-83.91297209,288,11,0,277,"Livingston, Michigan, United States"
"04-20-2020","29117","Livingston","Missouri","United States",2020-04-20 23:36:47,39.78110272,-93.54645978,2,0,0,2,"Livingston, Missouri, United States"
"04-20-2020","36051","Livingston","New York","United States",2020-04-20 23:36:47,42.72596275,-77.77966158,39,3,0,36,"Livingston, New York, United States"
"04-20-2020","48299","Llano","Texas","United States",2020-04-20 23:36:47,30.70645047,-98.68475262,3,0,0,3,"Llano, Texas, United States"
"04-20-2020","05083","Logan","Arkansas","United States",2020-04-20 23:36:47,35.21413234,-93.71951016,3,0,0,3,"Logan, Arkansas, United States"
"04-20-2020","08075","Logan","Colorado","United States",2020-04-20 23:36:47,40.7249637,-103.110817,17,1,0,16,"Logan, Colorado, United States"
"04-20-2020","17107","Logan","Illinois","United States",2020-04-20 23:36:47,40.12581572,-89.36638784,4,0,0,4,"Logan, Illinois, United States"
"04-20-2020","21141","Logan","Kentucky","United States",2020-04-20 23:36:47,36.85949479,-86.877635,8,0,0,8,"Logan, Kentucky, United States"
"04-20-2020","31113","Logan","Nebraska","United States",2020-04-20 23:36:47,41.56650314,-100.4817851,0,0,0,0,"Logan, Nebraska, United States"
"04-20-2020","39091","Logan","Ohio","United States",2020-04-20 23:36:47,40.38996525,-83.76784341,13,0,0,13,"Logan, Ohio, United States"
"04-20-2020","40083","Logan","Oklahoma","United States",2020-04-20 23:36:47,35.91899576,-97.44352845,9,0,0,9,"Logan, Oklahoma, United States"
"04-20-2020","54045","Logan","West Virginia","United States",2020-04-20 23:36:47,37.8299889,-81.93528571,8,1,0,7,"Logan, West Virginia, United States"
"04-20-2020","13183","Long","Georgia","United States",2020-04-20 23:36:47,31.75218791,-81.74952375,2,0,0,2,"Long, Georgia, United States"
"04-20-2020","05085","Lonoke","Arkansas","United States",2020-04-20 23:36:47,34.75392199,-91.88742357,26,0,0,26,"Lonoke, Arkansas, United States"
"04-20-2020","39093","Lorain","Ohio","United States",2020-04-20 23:36:47,41.29553751,-82.15083537,303,18,0,285,"Lorain, Ohio, United States"
"04-20-2020","35028","Los Alamos","New Mexico","United States",2020-04-20 23:36:47,35.86631386,-106.3134985,6,0,0,6,"Los Alamos, New Mexico, United States"
"04-20-2020","06037","Los Angeles","California","United States",2020-04-20 23:36:47,34.30828379,-118.2282411,13823,619,0,13204,"Los Angeles, California, United States"
"04-20-2020","47105","Loudon","Tennessee","United States",2020-04-20 23:36:47,35.73939663,-84.31145275,23,0,0,23,"Loudon, Tennessee, United States"
"04-20-2020","51107","Loudoun","Virginia","United States",2020-04-20 23:36:47,39.08990083,-77.63481877,446,8,0,438,"Loudoun, Virginia, United States"
"04-20-2020","19115","Louisa","Iowa","United States",2020-04-20 23:36:47,41.21842119,-91.26102611,215,2,0,213,"Louisa, Iowa, United States"
"04-20-2020","51109","Louisa","Virginia","United States",2020-04-20 23:36:47,37.97850256,-77.96274807,33,0,0,33,"Louisa, Virginia, United States"
"04-20-2020","40085","Love","Oklahoma","United States",2020-04-20 23:36:47,33.95273467,-97.23906784,2,0,0,2,"Love, Oklahoma, United States"
"04-20-2020","01085","Lowndes","Alabama","United States",2020-04-20 23:36:47,32.1597283,-86.65158371,31,0,0,31,"Lowndes, Alabama, United States"
"04-20-2020","13185","Lowndes","Georgia","United States",2020-04-20 23:36:47,30.83568832,-83.27056716,101,3,0,98,"Lowndes, Georgia, United States"
"04-20-2020","28087","Lowndes","Mississippi","United States",2020-04-20 23:36:47,33.47386518,-88.4419153,34,1,0,33,"Lowndes, Mississippi, United States"
"04-20-2020","48303","Lubbock","Texas","United States",2020-04-20 23:36:47,33.61008596,-101.8204789,430,32,0,398,"Lubbock, Texas, United States"
"04-20-2020","39095","Lucas","Ohio","United States",2020-04-20 23:36:47,41.62101218,-83.65468618,823,33,0,790,"Lucas, Ohio, United States"
"04-20-2020","26095","Luce","Michigan","United States",2020-04-20 23:36:47,46.47227431,-85.54471223,1,0,0,1,"Luce, Michigan, United States"
"04-20-2020","13187","Lumpkin","Georgia","United States",2020-04-20 23:36:47,34.57286511,-84.00425681,24,0,0,24,"Lumpkin, Georgia, United States"
"04-20-2020","35029","Luna","New Mexico","United States",2020-04-20 23:36:47,32.18179341,-107.7508826,3,0,0,3,"Luna, New Mexico, United States"
"04-20-2020","51111","Lunenburg","Virginia","United States",2020-04-20 23:36:47,36.94618528,-78.24133319,3,0,0,3,"Lunenburg, Virginia, United States"
"04-20-2020","42079","Luzerne","Pennsylvania","United States",2020-04-20 23:36:47,41.17823008,-75.98447579,1767,36,0,1731,"Luzerne, Pennsylvania, United States"
"04-20-2020","42081","Lycoming","Pennsylvania","United States",2020-04-20 23:36:47,41.34310539,-77.06629984,40,0,0,40,"Lycoming, Pennsylvania, United States"
"04-20-2020","46085","Lyman","South Dakota","United States",2020-04-20 23:36:47,43.89522709,-99.85201878,2,0,0,2,"Lyman, South Dakota, United States"
"04-20-2020","51680","Lynchburg","Virginia","United States",2020-04-20 23:36:47,37.40021399,-79.19888138,38,0,0,38,"Lynchburg, Virginia, United States"
"04-20-2020","48305","Lynn","Texas","United States",2020-04-20 23:36:47,33.17657705,-101.8162849,5,0,0,5,"Lynn, Texas, United States"
"04-20-2020","19119","Lyon","Iowa","United States",2020-04-20 23:36:47,43.38107862,-96.20926845,5,0,0,5,"Lyon, Iowa, United States"
"04-20-2020","20111","Lyon","Kansas","United States",2020-04-20 23:36:47,38.45576156,-96.15275715,77,1,0,76,"Lyon, Kansas, United States"
"04-20-2020","21143","Lyon","Kentucky","United States",2020-04-20 23:36:47,37.02080035,-88.07886257,13,2,0,11,"Lyon, Kentucky, United States"
"04-20-2020","27083","Lyon","Minnesota","United States",2020-04-20 23:36:47,44.41327865,-95.83806103,5,0,0,5,"Lyon, Minnesota, United States"
"04-20-2020","32019","Lyon","Nevada","United States",2020-04-20 23:36:47,39.01777974,-119.1870479,18,0,0,18,"Lyon, Nevada, United States"
"04-20-2020","26097","Mackinac","Michigan","United States",2020-04-20 23:36:47,46.07028979,-85.04980537,4,0,0,4,"Mackinac, Michigan, United States"
"04-20-2020","26099","Macomb","Michigan","United States",2020-04-20 23:36:47,42.69158356,-82.92752801,4425,403,0,4022,"Macomb, Michigan, United States"
"04-20-2020","01087","Macon","Alabama","United States",2020-04-20 23:36:47,32.38759944,-85.69267724,25,2,0,23,"Macon, Alabama, United States"
"04-20-2020","13193","Macon","Georgia","United States",2020-04-20 23:36:47,32.35207048,-84.04234127,53,1,0,52,"Macon, Georgia, United States"
"04-20-2020","17115","Macon","Illinois","United States",2020-04-20 23:36:47,39.86064913,-88.96342505,55,9,0,46,"Macon, Illinois, United States"
"04-20-2020","29121","Macon","Missouri","United States",2020-04-20 23:36:47,39.83049768,-92.56453089,2,0,0,2,"Macon, Missouri, United States"
"04-20-2020","37113","Macon","North Carolina","United States",2020-04-20 23:36:47,35.14867843,-83.41696617,2,1,0,1,"Macon, North Carolina, United States"
"04-20-2020","47111","Macon","Tennessee","United States",2020-04-20 23:36:47,36.53157855,-86.00778595,34,3,0,31,"Macon, Tennessee, United States"
"04-20-2020","17117","Macoupin","Illinois","United States",2020-04-20 23:36:47,39.26119767,-89.92424028,21,0,0,21,"Macoupin, Illinois, United States"
"04-20-2020","06039","Madera","California","United States",2020-04-20 23:36:47,37.21513971,-119.7665589,34,2,0,32,"Madera, California, United States"
"04-20-2020","01089","Madison","Alabama","United States",2020-04-20 23:36:47,34.76327133,-86.55069633,212,4,0,208,"Madison, Alabama, United States"
"04-20-2020","05087","Madison","Arkansas","United States",2020-04-20 23:36:47,36.01038185,-93.72524943,1,0,0,1,"Madison, Arkansas, United States"
"04-20-2020","12079","Madison","Florida","United States",2020-04-20 23:36:47,30.44396917,-83.47398594,23,0,0,23,"Madison, Florida, United States"
"04-20-2020","13195","Madison","Georgia","United States",2020-04-20 23:36:47,34.12920917,-83.21218732,15,1,0,14,"Madison, Georgia, United States"
"04-20-2020","16065","Madison","Idaho","United States",2020-04-20 23:36:47,43.78141028,-111.6538474,8,0,0,8,"Madison, Idaho, United States"
"04-20-2020","17119","Madison","Illinois","United States",2020-04-20 23:36:47,38.83042506,-89.90422563,184,8,0,176,"Madison, Illinois, United States"
"04-20-2020","18095","Madison","Indiana","United States",2020-04-20 23:36:47,40.16143691,-85.71964711,340,32,0,308,"Madison, Indiana, United States"
"04-20-2020","19121","Madison","Iowa","United States",2020-04-20 23:36:47,41.33081904,-94.01554631,3,1,0,2,"Madison, Iowa, United States"
"04-20-2020","21151","Madison","Kentucky","United States",2020-04-20 23:36:47,37.71659336,-84.27220275,21,1,0,20,"Madison, Kentucky, United States"
"04-20-2020","22065","Madison","Louisiana","United States",2020-04-20 23:36:47,32.36918118,-91.23973355,4,0,0,4,"Madison, Louisiana, United States"
"04-20-2020","28089","Madison","Mississippi","United States",2020-04-20 23:36:47,32.63389156,-90.03513564,140,4,0,136,"Madison, Mississippi, United States"
"04-20-2020","29123","Madison","Missouri","United States",2020-04-20 23:36:47,37.47865134,-90.3467143,1,0,0,1,"Madison, Missouri, United States"
"04-20-2020","30057","Madison","Montana","United States",2020-04-20 23:36:47,45.30080065,-111.9173017,8,1,0,7,"Madison, Montana, United States"
"04-20-2020","31119","Madison","Nebraska","United States",2020-04-20 23:36:47,41.91676024,-97.6005481,11,2,0,9,"Madison, Nebraska, United States"
"04-20-2020","36053","Madison","New York","United States",2020-04-20 23:36:47,42.91653905,-75.67266639,117,5,0,112,"Madison, New York, United States"
"04-20-2020","39097","Madison","Ohio","United States",2020-04-20 23:36:47,39.89381073,-83.40178317,30,3,0,27,"Madison, Ohio, United States"
"04-20-2020","47113","Madison","Tennessee","United States",2020-04-20 23:36:47,35.61181957,-88.84076036,87,1,0,86,"Madison, Tennessee, United States"
"04-20-2020","48313","Madison","Texas","United States",2020-04-20 23:36:47,30.96694679,-95.93003775,2,0,0,2,"Madison, Texas, United States"
"04-20-2020","51113","Madison","Virginia","United States",2020-04-20 23:36:47,38.41531222,-78.28220331,8,0,0,8,"Madison, Virginia, United States"
"04-20-2020","19123","Mahaska","Iowa","United States",2020-04-20 23:36:47,41.33521503,-92.64083907,8,1,0,7,"Mahaska, Iowa, United States"
"04-20-2020","27087","Mahnomen","Minnesota","United States",2020-04-20 23:36:47,47.32557075,-95.80921485,1,0,0,1,"Mahnomen, Minnesota, United States"
"04-20-2020","39099","Mahoning","Ohio","United States",2020-04-20 23:36:47,41.01631101,-80.77287029,604,50,0,554,"Mahoning, Ohio, United States"
"04-20-2020","40093","Major","Oklahoma","United States",2020-04-20 23:36:47,36.31149996,-98.53467076,2,1,0,1,"Major, Oklahoma, United States"
"04-20-2020","41045","Malheur","Oregon","United States",2020-04-20 23:36:47,43.1937027,-117.6227395,5,0,0,5,"Malheur, Oregon, United States"
"04-20-2020","51683","Manassas","Virginia","United States",2020-04-20 23:36:47,38.7464321,-77.48509905,96,0,0,96,"Manassas, Virginia, United States"
"04-20-2020","51685","Manassas Park","Virginia","United States",2020-04-20 23:36:47,38.77058531,-77.44399307,30,0,0,30,"Manassas Park, Virginia, United States"
"04-20-2020","12081","Manatee","Florida","United States",2020-04-20 23:36:47,27.47196942,-82.31831044,433,33,0,400,"Manatee, Florida, United States"
"04-20-2020","26101","Manistee","Michigan","United States",2020-04-20 23:36:47,44.33352407,-86.05626916,11,0,0,11,"Manistee, Michigan, United States"
"04-20-2020","55071","Manitowoc","Wisconsin","United States",2020-04-20 23:36:47,44.11946801,-87.80928853,7,0,0,7,"Manitowoc, Wisconsin, United States"
"04-20-2020","55073","Marathon","Wisconsin","United States",2020-04-20 23:36:47,44.89792533,-89.75863384,17,1,0,16,"Marathon, Wisconsin, United States"
"04-20-2020","01091","Marengo","Alabama","United States",2020-04-20 23:36:47,32.24767634,-87.78796182,27,2,0,25,"Marengo, Alabama, United States"
"04-20-2020","04013","Maricopa","Arizona","United States",2020-04-20 23:36:47,33.34835867,-112.4918154,2636,75,0,2561,"Maricopa, Arizona, United States"
"04-20-2020","29125","Maries","Missouri","United States",2020-04-20 23:36:47,38.16193985,-91.92249662,2,0,0,2,"Maries, Missouri, United States"
"04-20-2020","06041","Marin","California","United States",2020-04-20 23:36:47,38.07122463,-122.7210631,195,10,0,185,"Marin, California, United States"
"04-20-2020","55075","Marinette","Wisconsin","United States",2020-04-20 23:36:47,45.38553432,-88.033246,5,1,0,4,"Marinette, Wisconsin, United States"
"04-20-2020","01093","Marion","Alabama","United States",2020-04-20 23:36:47,34.13697363,-87.88704173,68,5,0,63,"Marion, Alabama, United States"
"04-20-2020","05089","Marion","Arkansas","United States",2020-04-20 23:36:47,36.26844485,-92.68451899,1,0,0,1,"Marion, Arkansas, United States"
"04-20-2020","12083","Marion","Florida","United States",2020-04-20 23:36:47,29.21227113,-82.05803627,129,3,0,126,"Marion, Florida, United States"
"04-20-2020","13197","Marion","Georgia","United States",2020-04-20 23:36:47,32.3483402,-84.52733571,29,1,0,28,"Marion, Georgia, United States"
"04-20-2020","17121","Marion","Illinois","United States",2020-04-20 23:36:47,38.64963204,-88.91899208,20,0,0,20,"Marion, Illinois, United States"
"04-20-2020","18097","Marion","Indiana","United States",2020-04-20 23:36:47,39.78163624,-86.13826325,4052,192,0,3860,"Marion, Indiana, United States"
"04-20-2020","19125","Marion","Iowa","United States",2020-04-20 23:36:47,41.33445101,-93.09934783,5,0,0,5,"Marion, Iowa, United States"
"04-20-2020","20115","Marion","Kansas","United States",2020-04-20 23:36:47,38.35855394,-97.0985251,5,0,0,5,"Marion, Kansas, United States"
"04-20-2020","21155","Marion","Kentucky","United States",2020-04-20 23:36:47,37.55218078,-85.26898542,13,0,0,13,"Marion, Kentucky, United States"
"04-20-2020","28091","Marion","Mississippi","United States",2020-04-20 23:36:47,31.23132643,-89.8209217,47,1,0,46,"Marion, Mississippi, United States"
"04-20-2020","39101","Marion","Ohio","United States",2020-04-20 23:36:47,40.58610662,-83.15736305,2073,1,0,2072,"Marion, Ohio, United States"
