"Date_Published","FIPS","Admin2","Province_State","Country_Region","Last_Update","Latitude","Longitude","Confirmed","Deaths","Recovered","Active","Combined_Key"
"04-20-2020","11001","District of Columbia","District of Columbia","United States",2020-04-20 23:36:47,38.90417773,-77.01655992,2927,105,0,2822,"District of Columbia, District of Columbia, United States"
"04-20-2020","38023","Divide","North Dakota","United States",2020-04-20 23:36:47,48.8149387,-103.4873611,1,0,0,1,"Divide, North Dakota, United States"
"04-20-2020","12029","Dixie","Florida","United States",2020-04-20 23:36:47,29.60631086,-83.15724673,4,0,0,4,"Dixie, Florida, United States"
"04-20-2020","31051","Dixon","Nebraska","United States",2020-04-20 23:36:47,42.49188363,-96.86782408,1,0,0,1,"Dixon, Nebraska, United States"
"04-20-2020","13091","Dodge","Georgia","United States",2020-04-20 23:36:47,32.17265114,-83.16948926,19,0,0,19,"Dodge, Georgia, United States"
"04-20-2020","27039","Dodge","Minnesota","United States",2020-04-20 23:36:47,44.02238415,-92.86244324,18,0,0,18,"Dodge, Minnesota, United States"
"04-20-2020","31053","Dodge","Nebraska","United States",2020-04-20 23:36:47,41.58071748,-96.65598179,18,0,0,18,"Dodge, Nebraska, United States"
"04-20-2020","55027","Dodge","Wisconsin","United States",2020-04-20 23:36:47,43.41576662,-88.70928178,19,1,0,18,"Dodge, Wisconsin, United States"
"04-20-2020","35013","Dona Ana","New Mexico","United States",2020-04-20 23:36:47,32.35275771,-106.8329387,73,1,0,72,"Dona Ana, New Mexico, United States"
"04-20-2020","20043","Doniphan","Kansas","United States",2020-04-20 23:36:47,39.79067154,-95.14056866,1,0,0,1,"Doniphan, Kansas, United States"
"04-20-2020","48129","Donley","Texas","United States",2020-04-20 23:36:47,34.96517499,-100.8140093,23,0,0,23,"Donley, Texas, United States"
"04-20-2020","13093","Dooly","Georgia","United States",2020-04-20 23:36:47,32.15630737,-83.79746561,71,5,0,66,"Dooly, Georgia, United States"
"04-20-2020","55029","Door","Wisconsin","United States",2020-04-20 23:36:47,44.95856458,-87.30002707,9,1,0,8,"Door, Wisconsin, United States"
"04-20-2020","24019","Dorchester","Maryland","United States",2020-04-20 23:44:33,38.45413522,-76.02752426,23,1,0,22,"Dorchester, Maryland, United States"
"04-20-2020","45035","Dorchester","South Carolina","United States",2020-04-20 23:36:47,33.0794369,-80.40502652,88,1,0,87,"Dorchester, South Carolina, United States"
"04-20-2020","13095","Dougherty","Georgia","United States",2020-04-20 23:36:47,31.53328528,-84.21722377,1436,98,0,1338,"Dougherty, Georgia, United States"
"04-20-2020","08035","Douglas","Colorado","United States",2020-04-20 23:36:47,39.33133796,-104.930001,368,16,0,352,"Douglas, Colorado, United States"
"04-20-2020","13097","Douglas","Georgia","United States",2020-04-20 23:36:47,33.70291126,-84.77026156,243,6,0,237,"Douglas, Georgia, United States"
"04-20-2020","17041","Douglas","Illinois","United States",2020-04-20 23:36:47,39.76768052,-88.21854195,12,0,0,12,"Douglas, Illinois, United States"
"04-20-2020","20045","Douglas","Kansas","United States",2020-04-20 23:36:47,38.88503636,-95.2925121,43,0,0,43,"Douglas, Kansas, United States"
"04-20-2020","27041","Douglas","Minnesota","United States",2020-04-20 23:36:47,45.93348491,-95.45335469,2,0,0,2,"Douglas, Minnesota, United States"
"04-20-2020","31055","Douglas","Nebraska","United States",2020-04-20 23:36:47,41.29518299,-96.15085305,291,8,0,283,"Douglas, Nebraska, United States"
"04-20-2020","32005","Douglas","Nevada","United States",2020-04-20 23:36:47,38.912862,-119.6171333,15,0,0,15,"Douglas, Nevada, United States"
"04-20-2020","41019","Douglas","Oregon","United States",2020-04-20 23:36:47,43.27941273,-123.167291,23,0,0,23,"Douglas, Oregon, United States"
"04-20-2020","53017","Douglas","Washington","United States",2020-04-20 23:36:47,47.7361335,-119.692937,32,1,0,31,"Douglas, Washington, United States"
"04-20-2020","55031","Douglas","Wisconsin","United States",2020-04-20 23:36:47,46.43222285,-91.91595768,8,0,0,8,"Douglas, Wisconsin, United States"
"04-20-2020","05043","Drew","Arkansas","United States",2020-04-20 23:36:47,33.59035001,-91.71777921,6,1,0,5,"Drew, Arkansas, United States"
"04-20-2020","17043","DuPage","Illinois","United States",2020-04-20 23:36:47,41.85116968,-88.08642662,1761,90,0,1671,"DuPage, Illinois, United States"
"04-20-2020","18037","Dubois","Indiana","United States",2020-04-20 23:36:47,38.36597551,-86.8792417,16,0,0,16,"Dubois, Indiana, United States"
"04-20-2020","19061","Dubuque","Iowa","United States",2020-04-20 23:36:47,42.46815349,-90.88181925,46,1,0,45,"Dubuque, Iowa, United States"
"04-20-2020",NA,"Dukes and Nantucket","Massachusetts","United States",2020-04-20 23:36:47,41.40674725,-70.68763497,23,1,0,22,"Dukes and Nantucket, Massachusetts, United States"
"04-20-2020","29069","Dunklin","Missouri","United States",2020-04-20 23:36:47,36.27167174,-90.09122243,19,2,0,17,"Dunklin, Missouri, United States"
"04-20-2020","38025","Dunn","North Dakota","United States",2020-04-20 23:36:47,47.35423935,-102.6160468,10,0,0,10,"Dunn, North Dakota, United States"
"04-20-2020","55033","Dunn","Wisconsin","United States",2020-04-20 23:36:47,44.94562799,-91.8962481,9,0,0,9,"Dunn, Wisconsin, United States"
"04-20-2020","37061","Duplin","North Carolina","United States",2020-04-20 23:36:47,34.93449805,-77.93140529,26,0,0,26,"Duplin, North Carolina, United States"
"04-20-2020","37063","Durham","North Carolina","United States",2020-04-20 23:36:47,36.03638492,-78.87608331,435,5,0,430,"Durham, North Carolina, United States"
"04-20-2020","36027","Dutchess","New York","United States",2020-04-20 23:36:47,41.7648606,-73.74356679,2284,28,0,2256,"Dutchess, New York, United States"
"04-20-2020","12031","Duval","Florida","United States",2020-04-20 23:36:47,30.33225875,-81.66976468,896,16,0,880,"Duval, Florida, United States"
"04-20-2020","48131","Duval","Texas","United States",2020-04-20 23:36:47,27.68184592,-98.50864568,1,0,0,1,"Duval, Texas, United States"
"04-20-2020","47045","Dyer","Tennessee","United States",2020-04-20 23:36:47,36.05931946,-89.41542855,28,0,0,28,"Dyer, Tennessee, United States"
"04-20-2020","08037","Eagle","Colorado","United States",2020-04-20 23:36:47,39.62754308,-106.6933637,485,7,0,478,"Eagle, Colorado, United States"
"04-20-2020","13099","Early","Georgia","United States",2020-04-20 23:36:47,31.32155345,-84.90255207,173,10,0,163,"Early, Georgia, United States"
"04-20-2020","22033","East Baton Rouge","Louisiana","United States",2020-04-20 23:36:47,30.53842039,-91.09777565,1534,74,0,1460,"East Baton Rouge, Louisiana, United States"
"04-20-2020","22035","East Carroll","Louisiana","United States",2020-04-20 23:36:47,32.73926954,-91.23425694,1,0,0,1,"East Carroll, Louisiana, United States"
"04-20-2020","22037","East Feliciana","Louisiana","United States",2020-04-20 23:36:47,30.84425359,-91.04976723,95,7,0,88,"East Feliciana, Louisiana, United States"
"04-20-2020","48133","Eastland","Texas","United States",2020-04-20 23:36:47,32.32743996,-98.83243566,3,0,0,3,"Eastland, Texas, United States"
"04-20-2020","26045","Eaton","Michigan","United States",2020-04-20 23:36:47,42.59599185,-84.83740035,90,5,0,85,"Eaton, Michigan, United States"
"04-20-2020","55035","Eau Claire","Wisconsin","United States",2020-04-20 23:36:47,44.726614,-91.28609183,22,0,0,22,"Eau Claire, Wisconsin, United States"
"04-20-2020","13101","Echols","Georgia","United States",2020-04-20 23:36:47,30.71101099,-82.89687287,4,0,0,4,"Echols, Georgia, United States"
"04-20-2020","48135","Ector","Texas","United States",2020-04-20 23:36:47,31.86898877,-102.5429428,58,4,0,54,"Ector, Texas, United States"
"04-20-2020","35015","Eddy","New Mexico","United States",2020-04-20 23:36:47,32.47167456,-104.3053527,10,1,0,9,"Eddy, New Mexico, United States"
"04-20-2020","38027","Eddy","North Dakota","United States",2020-04-20 23:36:47,47.71701474,-98.90432337,1,0,0,1,"Eddy, North Dakota, United States"
"04-20-2020","37065","Edgecombe","North Carolina","United States",2020-04-20 23:36:47,35.91230639,-77.59436892,58,1,0,57,"Edgecombe, North Carolina, United States"
"04-20-2020","45037","Edgefield","South Carolina","United States",2020-04-20 23:36:47,33.77221995,-81.96231108,12,0,0,12,"Edgefield, South Carolina, United States"
"04-20-2020","21061","Edmonson","Kentucky","United States",2020-04-20 23:36:47,37.21218923,-86.23955613,7,0,0,7,"Edmonson, Kentucky, United States"
"04-20-2020","20047","Edwards","Kansas","United States",2020-04-20 23:36:47,37.88735543,-99.31263309,1,0,0,1,"Edwards, Kansas, United States"
"04-20-2020","13103","Effingham","Georgia","United States",2020-04-20 23:36:47,32.36616021,-81.34280942,27,1,0,26,"Effingham, Georgia, United States"
"04-20-2020","17049","Effingham","Illinois","United States",2020-04-20 23:36:47,39.05935711,-88.58969584,4,1,0,3,"Effingham, Illinois, United States"
"04-20-2020","06017","El Dorado","California","United States",2020-04-20 23:36:47,38.77965956,-120.5233166,36,0,0,36,"El Dorado, California, United States"
"04-20-2020","08041","El Paso","Colorado","United States",2020-04-20 23:36:47,38.83240149,-104.5251411,731,49,0,682,"El Paso, Colorado, United States"
"04-20-2020","48141","El Paso","Texas","United States",2020-04-20 23:36:47,31.76980765,-106.2363275,531,8,0,523,"El Paso, Texas, United States"
"04-20-2020","08039","Elbert","Colorado","United States",2020-04-20 23:36:47,39.28656773,-104.1358721,23,1,0,22,"Elbert, Colorado, United States"
"04-20-2020","13105","Elbert","Georgia","United States",2020-04-20 23:36:47,34.11302332,-82.83936148,7,0,0,7,"Elbert, Georgia, United States"
"04-20-2020","42047","Elk","Pennsylvania","United States",2020-04-20 23:36:47,41.42822061,-78.64524744,2,0,0,2,"Elk, Pennsylvania, United States"
"04-20-2020","18039","Elkhart","Indiana","United States",2020-04-20 23:36:47,41.59761169,-85.85875695,164,3,0,161,"Elkhart, Indiana, United States"
"04-20-2020","32007","Elko","Nevada","United States",2020-04-20 23:36:47,41.14531606,-115.3577619,12,1,0,11,"Elko, Nevada, United States"
"04-20-2020","20051","Ellis","Kansas","United States",2020-04-20 23:36:47,38.91458712,-99.31751551,8,0,0,8,"Ellis, Kansas, United States"
"04-20-2020","48139","Ellis","Texas","United States",2020-04-20 23:36:47,32.34894117,-96.79371841,90,3,0,87,"Ellis, Texas, United States"
"04-20-2020","01051","Elmore","Alabama","United States",2020-04-20 23:36:47,32.59785413,-86.14415284,68,1,0,67,"Elmore, Alabama, United States"
"04-20-2020","16039","Elmore","Idaho","United States",2020-04-20 23:36:47,43.3507101,-115.4701578,22,0,0,22,"Elmore, Idaho, United States"
"04-20-2020","13107","Emanuel","Georgia","United States",2020-04-20 23:36:47,32.59221302,-82.30239915,14,0,0,14,"Emanuel, Georgia, United States"
"04-20-2020","26047","Emmet","Michigan","United States",2020-04-20 23:36:47,45.52625509,-84.89083249,21,2,0,19,"Emmet, Michigan, United States"
"04-20-2020","38029","Emmons","North Dakota","United States",2020-04-20 23:36:47,46.28398398,-100.2389766,1,1,0,0,"Emmons, North Dakota, United States"
"04-20-2020","51595","Emporia","Virginia","United States",2020-04-20 23:36:47,36.69455571,-77.53406129,11,0,0,11,"Emporia, Virginia, United States"
"04-20-2020","48143","Erath","Texas","United States",2020-04-20 23:36:47,32.23602653,-98.21773417,13,1,0,12,"Erath, Texas, United States"
"04-20-2020","36029","Erie","New York","United States",2020-04-20 23:36:47,42.76249024,-78.73063652,2192,135,0,2057,"Erie, New York, United States"
"04-20-2020","39043","Erie","Ohio","United States",2020-04-20 23:36:47,41.36796058,-82.62904521,37,2,0,35,"Erie, Ohio, United States"
"04-20-2020","42049","Erie","Pennsylvania","United States",2020-04-20 23:36:47,41.99253829,-80.03301954,60,0,0,60,"Erie, Pennsylvania, United States"
"04-20-2020","01053","Escambia","Alabama","United States",2020-04-20 23:36:47,31.1256789,-87.15918694,15,0,0,15,"Escambia, Alabama, United States"
"04-20-2020","12033","Escambia","Florida","United States",2020-04-20 23:36:47,30.67652764,-87.37284571,315,8,0,307,"Escambia, Florida, United States"
"04-20-2020","25009","Essex","Massachusetts","United States",2020-04-20 23:36:47,42.6687626,-70.94687179,5153,209,0,4944,"Essex, Massachusetts, United States"
"04-20-2020","34013","Essex","New Jersey","United States",2020-04-20 23:36:47,40.78681335,-74.24657979,10729,751,0,9978,"Essex, New Jersey, United States"
"04-20-2020","36031","Essex","New York","United States",2020-04-20 23:36:47,44.11630765,-73.77297842,20,0,0,20,"Essex, New York, United States"
"04-20-2020","50009","Essex","Vermont","United States",2020-04-20 23:36:47,44.72736416,-71.73579864,2,0,0,2,"Essex, Vermont, United States"
"04-20-2020","51057","Essex","Virginia","United States",2020-04-20 23:36:47,37.93357639,-76.94230311,2,0,0,2,"Essex, Virginia, United States"
"04-20-2020","01055","Etowah","Alabama","United States",2020-04-20 23:36:47,34.04567266,-86.04051873,100,7,0,93,"Etowah, Alabama, United States"
"04-20-2020","22039","Evangeline","Louisiana","United States",2020-04-20 23:36:47,30.72985248,-92.39915924,43,0,0,43,"Evangeline, Louisiana, United States"
"04-20-2020","13109","Evans","Georgia","United States",2020-04-20 23:36:47,32.15328841,-81.8870105,3,0,0,3,"Evans, Georgia, United States"
"04-20-2020","02090","Fairbanks North Star","Alaska","United States",2020-04-20 23:36:47,64.80726247,-146.5692662,79,1,0,78,"Fairbanks North Star, Alaska, United States"
"04-20-2020","51059","Fairfax","Virginia","United States",2020-04-20 23:36:47,38.83677558,-77.27565836,1925,37,0,1888,"Fairfax, Virginia, United States"
"04-20-2020","51600","Fairfax City","Virginia","United States",2020-04-20 23:36:47,38.85157547,-77.2977964,21,0,0,21,"Fairfax City, Virginia, United States"
"04-20-2020","09001","Fairfield","Connecticut","United States",2020-04-20 23:36:47,41.26809896,-73.3881171,8320,512,0,7808,"Fairfield, Connecticut, United States"
"04-20-2020","39045","Fairfield","Ohio","United States",2020-04-20 23:36:47,39.75107189,-82.63088163,99,2,0,97,"Fairfield, Ohio, United States"
"04-20-2020","45039","Fairfield","South Carolina","United States",2020-04-20 23:36:47,34.39287073,-81.1195624,25,0,0,25,"Fairfield, South Carolina, United States"
"04-20-2020","46047","Fall River","South Dakota","United States",2020-04-20 23:36:47,43.23929297,-103.5275691,1,0,0,1,"Fall River, South Dakota, United States"
"04-20-2020","48145","Falls","Texas","United States",2020-04-20 23:36:47,31.25350609,-96.93630086,1,0,0,1,"Falls, Texas, United States"
"04-20-2020","51610","Falls Church","Virginia","United States",2020-04-20 23:36:47,38.88485255,-77.17560759,24,0,0,24,"Falls Church, Virginia, United States"
"04-20-2020","13111","Fannin","Georgia","United States",2020-04-20 23:36:47,34.86430205,-84.316964,19,1,0,18,"Fannin, Georgia, United States"
"04-20-2020","48147","Fannin","Texas","United States",2020-04-20 23:36:47,33.59564294,-96.10751083,8,0,0,8,"Fannin, Texas, United States"
"04-20-2020","27043","Faribault","Minnesota","United States",2020-04-20 23:36:47,43.67381499,-93.94787458,4,0,0,4,"Faribault, Minnesota, United States"
"04-20-2020","46049","Faulk","South Dakota","United States",2020-04-20 23:36:47,45.07082625,-99.14535601,1,0,0,1,"Faulk, South Dakota, United States"
"04-20-2020","05045","Faulkner","Arkansas","United States",2020-04-20 23:36:47,35.14719007,-92.33717519,62,2,0,60,"Faulkner, Arkansas, United States"
"04-20-2020","51061","Fauquier","Virginia","United States",2020-04-20 23:36:47,38.73564842,-77.80647472,41,0,0,41,"Fauquier, Virginia, United States"
"04-20-2020","01057","Fayette","Alabama","United States",2020-04-20 23:36:47,33.72076938,-87.73886638,6,0,0,6,"Fayette, Alabama, United States"
"04-20-2020","13113","Fayette","Georgia","United States",2020-04-20 23:36:47,33.41357794,-84.49089434,143,8,0,135,"Fayette, Georgia, United States"
"04-20-2020","17051","Fayette","Illinois","United States",2020-04-20 23:36:47,39.00072038,-89.02452658,15,1,0,14,"Fayette, Illinois, United States"
"04-20-2020","18041","Fayette","Indiana","United States",2020-04-20 23:36:47,39.63684962,-85.17797541,22,4,0,18,"Fayette, Indiana, United States"
"04-20-2020","19065","Fayette","Iowa","United States",2020-04-20 23:36:47,42.86271799,-91.8441231,6,0,0,6,"Fayette, Iowa, United States"
"04-20-2020","21067","Fayette","Kentucky","United States",2020-04-20 23:36:47,38.0368225,-84.45576892,219,7,0,212,"Fayette, Kentucky, United States"
"04-20-2020","39047","Fayette","Ohio","United States",2020-04-20 23:36:47,39.56021306,-83.4562016,13,0,0,13,"Fayette, Ohio, United States"
"04-20-2020","42051","Fayette","Pennsylvania","United States",2020-04-20 23:36:47,39.92041012,-79.64291195,67,3,0,64,"Fayette, Pennsylvania, United States"
"04-20-2020","47047","Fayette","Tennessee","United States",2020-04-20 23:36:47,35.19615831,-89.41399032,46,1,0,45,"Fayette, Tennessee, United States"
"04-20-2020","48149","Fayette","Texas","United States",2020-04-20 23:36:47,29.87788372,-96.92076062,15,0,0,15,"Fayette, Texas, United States"
"04-20-2020","54019","Fayette","West Virginia","United States",2020-04-20 23:36:47,38.02974928,-81.08286634,5,0,0,5,"Fayette, West Virginia, United States"
"04-20-2020",NA,"Federal Correctional Institution (FCI)","Michigan","United States",2020-04-20 23:36:47,NA,NA,55,0,0,55,"Federal Correctional Institution (FCI), Michigan, United States"
"04-20-2020","47049","Fentress","Tennessee","United States",2020-04-20 23:36:47,36.38128818,-84.92870012,4,0,0,4,"Fentress, Tennessee, United States"
"04-20-2020","53019","Ferry","Washington","United States",2020-04-20 23:36:47,48.4711431,-118.5154041,1,0,0,1,"Ferry, Washington, United States"
"04-20-2020","27045","Fillmore","Minnesota","United States",2020-04-20 23:36:47,43.67394126,-92.08980382,11,0,0,11,"Fillmore, Minnesota, United States"
"04-20-2020","20055","Finney","Kansas","United States",2020-04-20 23:36:47,38.04340344,-100.7381938,41,1,0,40,"Finney, Kansas, United States"
"04-20-2020","12035","Flagler","Florida","United States",2020-04-20 23:36:47,29.45933576,-81.31508595,76,2,0,74,"Flagler, Florida, United States"
"04-20-2020","30029","Flathead","Montana","United States",2020-04-20 23:36:47,48.29575866,-114.0520569,37,1,0,36,"Flathead, Montana, United States"
"04-20-2020","21069","Fleming","Kentucky","United States",2020-04-20 23:36:47,38.36758311,-83.69657514,2,0,0,2,"Fleming, Kentucky, United States"
"04-20-2020","45041","Florence","South Carolina","United States",2020-04-20 23:36:47,34.02361754,-79.70189312,153,8,0,145,"Florence, South Carolina, United States"
"04-20-2020","55037","Florence","Wisconsin","United States",2020-04-20 23:36:47,45.84963535,-88.39804137,2,0,0,2,"Florence, Wisconsin, United States"
"04-20-2020","13115","Floyd","Georgia","United States",2020-04-20 23:36:47,34.26268279,-85.21577392,126,9,0,117,"Floyd, Georgia, United States"
"04-20-2020","18043","Floyd","Indiana","United States",2020-04-20 23:36:47,38.32117957,-85.90385377,142,7,0,135,"Floyd, Indiana, United States"
"04-20-2020","21071","Floyd","Kentucky","United States",2020-04-20 23:36:47,37.56213922,-82.74750924,4,0,0,4,"Floyd, Kentucky, United States"
"04-20-2020","48153","Floyd","Texas","United States",2020-04-20 23:36:47,34.07227468,-101.3031546,2,0,0,2,"Floyd, Texas, United States"
"04-20-2020","51063","Floyd","Virginia","United States",2020-04-20 23:36:47,36.9302126,-80.36738849,1,0,0,1,"Floyd, Virginia, United States"
"04-20-2020","51065","Fluvanna","Virginia","United States",2020-04-20 23:36:47,37.84157909,-78.27715475,68,0,0,68,"Fluvanna, Virginia, United States"
"04-20-2020","55039","Fond du Lac","Wisconsin","United States",2020-04-20 23:36:47,43.75354908,-88.48885325,65,3,0,62,"Fond du Lac, Wisconsin, United States"
"04-20-2020","17053","Ford","Illinois","United States",2020-04-20 23:36:47,40.59706922,-88.22350769,6,1,0,5,"Ford, Illinois, United States"
"04-20-2020","20057","Ford","Kansas","United States",2020-04-20 23:36:47,37.69200114,-99.88825298,180,0,0,180,"Ford, Kansas, United States"
"04-20-2020","42053","Forest","Pennsylvania","United States",2020-04-20 23:36:47,41.51095103,-79.23229292,7,0,0,7,"Forest, Pennsylvania, United States"
"04-20-2020","28035","Forrest","Mississippi","United States",2020-04-20 23:36:47,31.18961454,-89.25832496,147,4,0,143,"Forrest, Mississippi, United States"
"04-20-2020","13117","Forsyth","Georgia","United States",2020-04-20 23:36:47,34.22604035,-84.1231513,211,7,0,204,"Forsyth, Georgia, United States"
"04-20-2020","37067","Forsyth","North Carolina","United States",2020-04-20 23:36:47,36.12859861,-80.25459052,126,5,0,121,"Forsyth, North Carolina, United States"
"04-20-2020","48157","Fort Bend","Texas","United States",2020-04-20 23:36:47,29.52704478,-95.77219463,783,17,0,766,"Fort Bend, Texas, United States"
"04-20-2020","38031","Foster","North Dakota","United States",2020-04-20 23:36:47,47.4571084,-98.88279923,1,0,0,1,"Foster, North Dakota, United States"
"04-20-2020","18045","Fountain","Indiana","United States",2020-04-20 23:36:47,40.12361933,-87.24217689,8,2,0,6,"Fountain, Indiana, United States"
"04-20-2020","01059","Franklin","Alabama","United States",2020-04-20 23:36:47,34.44235334,-87.84289505,22,0,0,22,"Franklin, Alabama, United States"
"04-20-2020","05047","Franklin","Arkansas","United States",2020-04-20 23:36:47,35.51202821,-93.89299569,1,0,0,1,"Franklin, Arkansas, United States"
"04-20-2020","12037","Franklin","Florida","United States",2020-04-20 23:36:47,29.83791238,-84.82731662,2,0,0,2,"Franklin, Florida, United States"
"04-20-2020","13119","Franklin","Georgia","United States",2020-04-20 23:36:47,34.37525597,-83.23159927,12,0,0,12,"Franklin, Georgia, United States"
"04-20-2020","17055","Franklin","Illinois","United States",2020-04-20 23:36:47,37.99189086,-88.92567818,5,0,0,5,"Franklin, Illinois, United States"
"04-20-2020","18047","Franklin","Indiana","United States",2020-04-20 23:36:47,39.4142482,-85.06062647,90,7,0,83,"Franklin, Indiana, United States"
"04-20-2020","19069","Franklin","Iowa","United States",2020-04-20 23:36:47,42.73270384,-93.26256925,1,0,0,1,"Franklin, Iowa, United States"
"04-20-2020","20059","Franklin","Kansas","United States",2020-04-20 23:36:47,38.56443815,-95.28644341,12,0,0,12,"Franklin, Kansas, United States"
"04-20-2020","21073","Franklin","Kentucky","United States",2020-04-20 23:36:47,38.2379395,-84.87962551,13,0,0,13,"Franklin, Kentucky, United States"
"04-20-2020","22041","Franklin","Louisiana","United States",2020-04-20 23:36:47,32.13675181,-91.67589857,83,2,0,81,"Franklin, Louisiana, United States"
"04-20-2020","23007","Franklin","Maine","United States",2020-04-20 23:36:47,44.97330019,-70.44381045,13,0,0,13,"Franklin, Maine, United States"
"04-20-2020","25011","Franklin","Massachusetts","United States",2020-04-20 23:36:47,42.58119713,-72.58602547,181,26,0,155,"Franklin, Massachusetts, United States"
"04-20-2020","28037","Franklin","Mississippi","United States",2020-04-20 23:36:47,31.47786634,-90.89672989,16,0,0,16,"Franklin, Mississippi, United States"
"04-20-2020","29071","Franklin","Missouri","United States",2020-04-20 23:36:47,38.41127108,-91.07522826,99,7,0,92,"Franklin, Missouri, United States"
"04-20-2020","31061","Franklin","Nebraska","United States",2020-04-20 23:36:47,40.17636348,-98.95299073,3,0,0,3,"Franklin, Nebraska, United States"
"04-20-2020","36033","Franklin","New York","United States",2020-04-20 23:36:47,44.59040891,-74.29926032,13,0,0,13,"Franklin, New York, United States"
"04-20-2020","37069","Franklin","North Carolina","United States",2020-04-20 23:36:47,36.081519,-78.28708884,71,8,0,63,"Franklin, North Carolina, United States"
"04-20-2020","39049","Franklin","Ohio","United States",2020-04-20 23:36:47,39.96995815,-83.01115755,1510,35,0,1475,"Franklin, Ohio, United States"
"04-20-2020","42055","Franklin","Pennsylvania","United States",2020-04-20 23:36:47,39.92956518,-77.72157791,115,0,0,115,"Franklin, Pennsylvania, United States"
"04-20-2020","47051","Franklin","Tennessee","United States",2020-04-20 23:36:47,35.15634626,-86.09201039,27,1,0,26,"Franklin, Tennessee, United States"
"04-20-2020","48159","Franklin","Texas","United States",2020-04-20 23:36:47,33.17653242,-95.21917243,1,0,0,1,"Franklin, Texas, United States"
"04-20-2020","50011","Franklin","Vermont","United States",2020-04-20 23:36:47,44.85627605,-72.91249563,93,3,0,90,"Franklin, Vermont, United States"
"04-20-2020","51067","Franklin","Virginia","United States",2020-04-20 23:36:47,36.99536167,-79.88023649,16,0,0,16,"Franklin, Virginia, United States"
"04-20-2020","53021","Franklin","Washington","United States",2020-04-20 23:36:47,46.53351425,-118.9018212,191,5,0,186,"Franklin, Washington, United States"
"04-20-2020","51620","Franklin City","Virginia","United States",2020-04-20 23:36:47,36.6831435,-76.93859681,12,0,0,12,"Franklin City, Virginia, United States"
"04-20-2020","24021","Frederick","Maryland","United States",2020-04-20 23:44:33,39.47296601,-77.39999394,616,30,0,586,"Frederick, Maryland, United States"
"04-20-2020","51069","Frederick","Virginia","United States",2020-04-20 23:36:47,39.20172582,-78.25974949,81,0,0,81,"Frederick, Virginia, United States"
"04-20-2020","51630","Fredericksburg","Virginia","United States",2020-04-20 23:36:47,38.2977863,-77.4922454,17,0,0,17,"Fredericksburg, Virginia, United States"
"04-20-2020","27047","Freeborn","Minnesota","United States",2020-04-20 23:36:47,43.67385583,-93.34884422,33,0,0,33,"Freeborn, Minnesota, United States"
"04-20-2020","48161","Freestone","Texas","United States",2020-04-20 23:36:47,31.70422788,-96.15072516,3,0,0,3,"Freestone, Texas, United States"
"04-20-2020","08043","Fremont","Colorado","United States",2020-04-20 23:36:47,38.47362326,-105.4399667,10,0,0,10,"Fremont, Colorado, United States"
"04-20-2020","16043","Fremont","Idaho","United States",2020-04-20 23:36:47,44.22800938,-111.4809943,2,0,0,2,"Fremont, Idaho, United States"
"04-20-2020","56013","Fremont","Wyoming","United States",2020-04-20 23:36:47,43.04183996,-108.6296893,51,0,0,51,"Fremont, Wyoming, United States"
