"Date_Published","FIPS","Admin2","Province_State","Country_Region","Last_Update","Latitude","Longitude","Confirmed","Deaths","Recovered","Active","Combined_Key"
"05-20-2020","22031","De Soto","Louisiana","United States",2020-05-21 02:32:48,32.05457447,-93.74130302,228,16,0,212,"De Soto, Louisiana, United States"
"05-20-2020","17039","De Witt","Illinois","United States",2020-05-21 02:32:48,40.17514519,-88.90959682,4,0,0,4,"De Witt, Illinois, United States"
"05-20-2020","01049","DeKalb","Alabama","United States",2020-05-21 02:32:48,34.45946862,-85.80782906,206,3,0,203,"DeKalb, Alabama, United States"
"05-20-2020","13089","DeKalb","Georgia","United States",2020-05-21 02:32:48,33.76944049,-84.22396017,2979,88,0,2891,"DeKalb, Georgia, United States"
"05-20-2020","17037","DeKalb","Illinois","United States",2020-05-21 02:32:48,41.89373302,-88.76958483,276,3,0,273,"DeKalb, Illinois, United States"
"05-20-2020","18033","DeKalb","Indiana","United States",2020-05-21 02:32:48,41.39804622,-84.99906934,26,1,0,25,"DeKalb, Indiana, United States"
"05-20-2020","29063","DeKalb","Missouri","United States",2020-05-21 02:32:48,39.89201062,-94.40476508,5,0,0,5,"DeKalb, Missouri, United States"
"05-20-2020","47041","DeKalb","Tennessee","United States",2020-05-21 02:32:48,35.97616272,-85.83689361,32,0,0,32,"DeKalb, Tennessee, United States"
"05-20-2020","12027","DeSoto","Florida","United States",2020-05-21 02:32:48,27.18677893,-81.80941373,80,7,0,73,"DeSoto, Florida, United States"
"05-20-2020","28033","DeSoto","Mississippi","United States",2020-05-21 02:32:48,34.87625235,-89.99091418,418,5,0,413,"DeSoto, Mississippi, United States"
"05-20-2020","48123","DeWitt","Texas","United States",2020-05-21 02:32:48,29.08101855,-97.3568117,17,1,0,16,"DeWitt, Texas, United States"
"05-20-2020","48117","Deaf Smith","Texas","United States",2020-05-21 02:32:48,34.96522957,-102.6054267,139,7,0,132,"Deaf Smith, Texas, United States"
"05-20-2020","18029","Dearborn","Indiana","United States",2020-05-21 02:32:48,39.14647946,-84.97333539,158,21,0,137,"Dearborn, Indiana, United States"
"05-20-2020","13087","Decatur","Georgia","United States",2020-05-21 02:32:48,30.87967778,-84.57619536,140,4,0,136,"Decatur, Georgia, United States"
"05-20-2020","18031","Decatur","Indiana","United States",2020-05-21 02:32:48,39.30712658,-85.50087166,220,31,0,189,"Decatur, Indiana, United States"
"05-20-2020","19053","Decatur","Iowa","United States",2020-05-21 02:32:48,40.73742757,-93.78645949,0,0,0,0,"Decatur, Iowa, United States"
"05-20-2020","47039","Decatur","Tennessee","United States",2020-05-21 02:32:48,35.60048904,-88.11043779,5,0,0,5,"Decatur, Tennessee, United States"
"05-20-2020","30023","Deer Lodge","Montana","United States",2020-05-21 02:32:48,46.05953325,-113.073353,3,0,0,3,"Deer Lodge, Montana, United States"
"05-20-2020","39039","Defiance","Ohio","United States",2020-05-21 02:32:48,41.32398837,-84.49076944,30,1,0,29,"Defiance, Ohio, United States"
"05-20-2020","06015","Del Norte","California","United States",2020-05-21 02:32:48,41.74228275,-123.8974063,15,0,0,15,"Del Norte, California, United States"
"05-20-2020","18035","Delaware","Indiana","United States",2020-05-21 02:32:48,40.22787247,-85.39732772,297,24,0,273,"Delaware, Indiana, United States"
"05-20-2020","19055","Delaware","Iowa","United States",2020-05-21 02:32:48,42.47104597,-91.3664492,13,0,0,13,"Delaware, Iowa, United States"
"05-20-2020","36025","Delaware","New York","United States",2020-05-21 02:32:48,42.19837623,-74.96709306,69,4,0,65,"Delaware, New York, United States"
"05-20-2020","39041","Delaware","Ohio","United States",2020-05-21 02:32:48,40.27942393,-83.00457058,277,10,0,267,"Delaware, Ohio, United States"
"05-20-2020","40041","Delaware","Oklahoma","United States",2020-05-21 02:32:48,36.40823634,-94.80325046,96,16,0,80,"Delaware, Oklahoma, United States"
"05-20-2020","42045","Delaware","Pennsylvania","United States",2020-05-21 02:32:48,39.91680171,-75.40243663,5844,472,0,5372,"Delaware, Pennsylvania, United States"
"05-20-2020","08029","Delta","Colorado","United States",2020-05-21 02:32:48,38.86246243,-107.8631342,55,1,0,54,"Delta, Colorado, United States"
"05-20-2020","26041","Delta","Michigan","United States",2020-05-21 02:32:48,45.9048491,-86.9080745,16,2,0,14,"Delta, Michigan, United States"
"05-20-2020","48119","Delta","Texas","United States",2020-05-21 02:32:48,33.38570922,-95.66921122,1,0,0,1,"Delta, Texas, United States"
"05-20-2020","48121","Denton","Texas","United States",2020-05-21 02:32:48,33.20521901,-97.11691153,1116,28,0,1088,"Denton, Texas, United States"
"05-20-2020","08031","Denver","Colorado","United States",2020-05-21 02:32:48,39.76018276,-104.8725695,4858,294,0,4564,"Denver, Colorado, United States"
"05-20-2020","19057","Des Moines","Iowa","United States",2020-05-21 02:32:48,40.92012606,-91.18326592,43,1,0,42,"Des Moines, Iowa, United States"
"05-20-2020","41017","Deschutes","Oregon","United States",2020-05-21 02:32:48,43.91570171,-121.2289121,116,0,0,116,"Deschutes, Oregon, United States"
"05-20-2020","05041","Desha","Arkansas","United States",2020-05-21 02:32:48,33.83011025,-91.25500948,18,0,0,18,"Desha, Arkansas, United States"
"05-20-2020","46039","Deuel","South Dakota","United States",2020-05-21 02:32:48,44.75994309,-96.66943645,1,0,0,1,"Deuel, South Dakota, United States"
"05-20-2020","40043","Dewey","Oklahoma","United States",2020-05-21 02:32:48,35.98772922,-99.00730714,2,0,0,2,"Dewey, Oklahoma, United States"
"05-20-2020","46041","Dewey","South Dakota","United States",2020-05-21 02:32:48,45.15639647,-100.8709139,0,0,0,0,"Dewey, South Dakota, United States"
"05-20-2020","48125","Dickens","Texas","United States",2020-05-21 02:32:48,33.61616822,-100.7788855,1,0,0,1,"Dickens, Texas, United States"
"05-20-2020","51051","Dickenson","Virginia","United States",2020-05-21 02:32:48,37.12560977,-82.35124171,0,0,0,0,"Dickenson, Virginia, United States"
"05-20-2020","19059","Dickinson","Iowa","United States",2020-05-21 02:32:48,43.37787725,-95.1510206,8,0,0,8,"Dickinson, Iowa, United States"
"05-20-2020","20041","Dickinson","Kansas","United States",2020-05-21 02:32:48,38.86600962,-97.15532383,2,0,0,2,"Dickinson, Kansas, United States"
"05-20-2020","26043","Dickinson","Michigan","United States",2020-05-21 02:32:48,46.00999672,-87.86961634,5,2,0,3,"Dickinson, Michigan, United States"
"05-20-2020","47043","Dickson","Tennessee","United States",2020-05-21 02:32:48,36.14669837,-87.35891709,93,0,0,93,"Dickson, Tennessee, United States"
"05-20-2020","45033","Dillon","South Carolina","United States",2020-05-21 02:32:48,34.39007791,-79.37741872,135,2,0,133,"Dillon, South Carolina, United States"
"05-20-2020","48127","Dimmit","Texas","United States",2020-05-21 02:32:48,28.42270064,-99.75645095,1,0,0,1,"Dimmit, Texas, United States"
"05-20-2020","51053","Dinwiddie","Virginia","United States",2020-05-21 02:32:48,37.07544585,-77.63451754,47,0,0,47,"Dinwiddie, Virginia, United States"
"05-20-2020","11001","District of Columbia","District of Columbia","United States",2020-05-21 02:32:48,38.90417773,-77.01655992,7551,407,0,7144,"District of Columbia, District of Columbia, United States"
"05-20-2020","38023","Divide","North Dakota","United States",2020-05-21 02:32:48,48.8149387,-103.4873611,1,0,0,1,"Divide, North Dakota, United States"
"05-20-2020","12029","Dixie","Florida","United States",2020-05-21 02:32:48,29.60631086,-83.15724673,26,1,0,25,"Dixie, Florida, United States"
"05-20-2020","31051","Dixon","Nebraska","United States",2020-05-21 02:32:48,42.49188363,-96.86782408,27,0,0,27,"Dixon, Nebraska, United States"
"05-20-2020","13091","Dodge","Georgia","United States",2020-05-21 02:32:48,32.17265114,-83.16948926,47,2,0,45,"Dodge, Georgia, United States"
"05-20-2020","27039","Dodge","Minnesota","United States",2020-05-21 02:32:48,44.02238415,-92.86244324,40,0,0,40,"Dodge, Minnesota, United States"
"05-20-2020","31053","Dodge","Nebraska","United States",2020-05-21 02:32:48,41.58071748,-96.65598179,282,1,0,281,"Dodge, Nebraska, United States"
"05-20-2020","55027","Dodge","Wisconsin","United States",2020-05-21 02:32:48,43.41576662,-88.70928178,112,1,0,111,"Dodge, Wisconsin, United States"
"05-20-2020","35013","Dona Ana","New Mexico","United States",2020-05-21 02:32:48,32.35275771,-106.8329387,326,2,0,324,"Dona Ana, New Mexico, United States"
"05-20-2020","20043","Doniphan","Kansas","United States",2020-05-21 02:32:48,39.79067154,-95.14056866,9,0,0,9,"Doniphan, Kansas, United States"
"05-20-2020","48129","Donley","Texas","United States",2020-05-21 02:32:48,34.96517499,-100.8140093,26,0,0,26,"Donley, Texas, United States"
"05-20-2020","13093","Dooly","Georgia","United States",2020-05-21 02:32:48,32.15630737,-83.79746561,163,12,0,151,"Dooly, Georgia, United States"
"05-20-2020","55029","Door","Wisconsin","United States",2020-05-21 02:32:48,44.95856458,-87.30002707,34,3,0,31,"Door, Wisconsin, United States"
"05-20-2020","24019","Dorchester","Maryland","United States",2020-05-21 02:32:48,38.45413522,-76.02752426,122,2,0,120,"Dorchester, Maryland, United States"
"05-20-2020","45035","Dorchester","South Carolina","United States",2020-05-21 02:32:48,33.0794369,-80.40502652,118,3,0,115,"Dorchester, South Carolina, United States"
"05-20-2020","13095","Dougherty","Georgia","United States",2020-05-21 02:32:48,31.53328528,-84.21722377,1672,139,0,1533,"Dougherty, Georgia, United States"
"05-20-2020","08035","Douglas","Colorado","United States",2020-05-21 02:32:48,39.33133796,-104.930001,659,43,0,616,"Douglas, Colorado, United States"
"05-20-2020","13097","Douglas","Georgia","United States",2020-05-21 02:32:48,33.70291126,-84.77026156,452,19,0,433,"Douglas, Georgia, United States"
"05-20-2020","17041","Douglas","Illinois","United States",2020-05-21 02:32:48,39.76768052,-88.21854195,26,0,0,26,"Douglas, Illinois, United States"
"05-20-2020","20045","Douglas","Kansas","United States",2020-05-21 02:32:48,38.88503636,-95.2925121,62,0,0,62,"Douglas, Kansas, United States"
"05-20-2020","27041","Douglas","Minnesota","United States",2020-05-21 02:32:48,45.93348491,-95.45335469,24,0,0,24,"Douglas, Minnesota, United States"
"05-20-2020","31055","Douglas","Nebraska","United States",2020-05-21 02:32:48,41.29518299,-96.15085305,2692,23,0,2669,"Douglas, Nebraska, United States"
"05-20-2020","32005","Douglas","Nevada","United States",2020-05-21 02:32:48,38.912862,-119.6171333,26,0,0,26,"Douglas, Nevada, United States"
"05-20-2020","41019","Douglas","Oregon","United States",2020-05-21 02:32:48,43.27941273,-123.167291,25,0,0,25,"Douglas, Oregon, United States"
"05-20-2020","46043","Douglas","South Dakota","United States",2020-05-21 02:32:48,43.38520741,-98.36978007,1,0,0,1,"Douglas, South Dakota, United States"
"05-20-2020","53017","Douglas","Washington","United States",2020-05-21 02:32:48,47.7361335,-119.692937,132,3,0,129,"Douglas, Washington, United States"
"05-20-2020","55031","Douglas","Wisconsin","United States",2020-05-21 02:32:48,46.43222285,-91.91595768,15,0,0,15,"Douglas, Wisconsin, United States"
"05-20-2020","05043","Drew","Arkansas","United States",2020-05-21 02:32:48,33.59035001,-91.71777921,19,1,0,18,"Drew, Arkansas, United States"
"05-20-2020","17043","DuPage","Illinois","United States",2020-05-21 02:32:48,41.85116968,-88.08642662,6308,326,0,5982,"DuPage, Illinois, United States"
"05-20-2020","18037","Dubois","Indiana","United States",2020-05-21 02:32:48,38.36597551,-86.8792417,162,2,0,160,"Dubois, Indiana, United States"
"05-20-2020","19061","Dubuque","Iowa","United States",2020-05-21 02:32:48,42.46815349,-90.88181925,296,13,0,283,"Dubuque, Iowa, United States"
"05-20-2020",NA,"Dukes and Nantucket","Massachusetts","United States",2020-05-21 02:32:48,41.40674725,-70.68763497,38,1,0,37,"Dukes and Nantucket, Massachusetts, United States"
"05-20-2020","29069","Dunklin","Missouri","United States",2020-05-21 02:32:48,36.27167174,-90.09122243,26,2,0,24,"Dunklin, Missouri, United States"
"05-20-2020","38025","Dunn","North Dakota","United States",2020-05-21 02:32:48,47.35423935,-102.6160468,12,0,0,12,"Dunn, North Dakota, United States"
"05-20-2020","55033","Dunn","Wisconsin","United States",2020-05-21 02:32:48,44.94562799,-91.8962481,20,0,0,20,"Dunn, Wisconsin, United States"
"05-20-2020","37061","Duplin","North Carolina","United States",2020-05-21 02:32:48,34.93449805,-77.93140529,470,12,0,458,"Duplin, North Carolina, United States"
"05-20-2020","37063","Durham","North Carolina","United States",2020-05-21 02:32:48,36.03638492,-78.87608331,1105,41,0,1064,"Durham, North Carolina, United States"
"05-20-2020","36027","Dutchess","New York","United States",2020-05-21 02:32:48,41.7648606,-73.74356679,3724,126,0,3598,"Dutchess, New York, United States"
"05-20-2020","12031","Duval","Florida","United States",2020-05-21 02:32:48,30.33225875,-81.66976468,1336,36,0,1300,"Duval, Florida, United States"
"05-20-2020","48131","Duval","Texas","United States",2020-05-21 02:32:48,27.68184592,-98.50864568,6,0,0,6,"Duval, Texas, United States"
"05-20-2020","47045","Dyer","Tennessee","United States",2020-05-21 02:32:48,36.05931946,-89.41542855,45,0,0,45,"Dyer, Tennessee, United States"
"05-20-2020","08037","Eagle","Colorado","United States",2020-05-21 02:32:48,39.62754308,-106.6933637,572,8,0,564,"Eagle, Colorado, United States"
"05-20-2020","13099","Early","Georgia","United States",2020-05-21 02:32:48,31.32155345,-84.90255207,236,29,0,207,"Early, Georgia, United States"
"05-20-2020","22033","East Baton Rouge","Louisiana","United States",2020-05-21 02:32:48,30.53842039,-91.09777565,3213,221,0,2992,"East Baton Rouge, Louisiana, United States"
"05-20-2020","22035","East Carroll","Louisiana","United States",2020-05-21 02:32:48,32.73926954,-91.23425694,46,0,0,46,"East Carroll, Louisiana, United States"
"05-20-2020","22037","East Feliciana","Louisiana","United States",2020-05-21 02:32:48,30.84425359,-91.04976723,179,27,0,152,"East Feliciana, Louisiana, United States"
"05-20-2020","48133","Eastland","Texas","United States",2020-05-21 02:32:48,32.32743996,-98.83243566,5,0,0,5,"Eastland, Texas, United States"
"05-20-2020","26045","Eaton","Michigan","United States",2020-05-21 02:32:48,42.59599185,-84.83740035,168,6,0,162,"Eaton, Michigan, United States"
"05-20-2020","55035","Eau Claire","Wisconsin","United States",2020-05-21 02:32:48,44.726614,-91.28609183,78,0,0,78,"Eau Claire, Wisconsin, United States"
"05-20-2020","13101","Echols","Georgia","United States",2020-05-21 02:32:48,30.71101099,-82.89687287,53,0,0,53,"Echols, Georgia, United States"
"05-20-2020","48135","Ector","Texas","United States",2020-05-21 02:32:48,31.86898877,-102.5429428,124,4,0,120,"Ector, Texas, United States"
"05-20-2020","35015","Eddy","New Mexico","United States",2020-05-21 02:32:48,32.47167456,-104.3053527,17,1,0,16,"Eddy, New Mexico, United States"
"05-20-2020","38027","Eddy","North Dakota","United States",2020-05-21 02:32:48,47.71701474,-98.90432337,2,0,0,2,"Eddy, North Dakota, United States"
"05-20-2020","17045","Edgar","Illinois","United States",2020-05-21 02:32:48,39.6809186,-87.74759563,0,0,0,0,"Edgar, Illinois, United States"
"05-20-2020","37065","Edgecombe","North Carolina","United States",2020-05-21 02:32:48,35.91230639,-77.59436892,174,9,0,165,"Edgecombe, North Carolina, United States"
"05-20-2020","45037","Edgefield","South Carolina","United States",2020-05-21 02:32:48,33.77221995,-81.96231108,45,2,0,43,"Edgefield, South Carolina, United States"
"05-20-2020","21061","Edmonson","Kentucky","United States",2020-05-21 02:32:48,37.21218923,-86.23955613,51,9,0,42,"Edmonson, Kentucky, United States"
"05-20-2020","17047","Edwards","Illinois","United States",2020-05-21 02:32:48,38.41353228,-88.05720863,2,0,0,2,"Edwards, Illinois, United States"
"05-20-2020","20047","Edwards","Kansas","United States",2020-05-21 02:32:48,37.88735543,-99.31263309,5,0,0,5,"Edwards, Kansas, United States"
"05-20-2020","13103","Effingham","Georgia","United States",2020-05-21 02:32:48,32.36616021,-81.34280942,48,1,0,47,"Effingham, Georgia, United States"
"05-20-2020","17049","Effingham","Illinois","United States",2020-05-21 02:32:48,39.05935711,-88.58969584,6,1,0,5,"Effingham, Illinois, United States"
"05-20-2020","06017","El Dorado","California","United States",2020-05-21 02:32:48,38.77965956,-120.5233166,67,0,0,67,"El Dorado, California, United States"
"05-20-2020","08041","El Paso","Colorado","United States",2020-05-21 02:32:48,38.83240149,-104.5251411,1386,88,0,1298,"El Paso, Colorado, United States"
"05-20-2020","48141","El Paso","Texas","United States",2020-05-21 02:32:48,31.76980765,-106.2363275,1930,54,0,1876,"El Paso, Texas, United States"
"05-20-2020","08039","Elbert","Colorado","United States",2020-05-21 02:32:48,39.28656773,-104.1358721,48,2,0,46,"Elbert, Colorado, United States"
"05-20-2020","13105","Elbert","Georgia","United States",2020-05-21 02:32:48,34.11302332,-82.83936148,69,0,0,69,"Elbert, Georgia, United States"
"05-20-2020","20049","Elk","Kansas","United States",2020-05-21 02:32:48,37.45338105,-96.24369667,0,0,0,0,"Elk, Kansas, United States"
"05-20-2020","42047","Elk","Pennsylvania","United States",2020-05-21 02:32:48,41.42822061,-78.64524744,6,0,0,6,"Elk, Pennsylvania, United States"
"05-20-2020","18039","Elkhart","Indiana","United States",2020-05-21 02:32:48,41.59761169,-85.85875695,777,26,0,751,"Elkhart, Indiana, United States"
"05-20-2020","32007","Elko","Nevada","United States",2020-05-21 02:32:48,41.14531606,-115.3577619,21,1,0,20,"Elko, Nevada, United States"
"05-20-2020","21063","Elliott","Kentucky","United States",2020-05-21 02:32:48,38.11624059,-83.09771563,1,0,0,1,"Elliott, Kentucky, United States"
"05-20-2020","20051","Ellis","Kansas","United States",2020-05-21 02:32:48,38.91458712,-99.31751551,8,0,0,8,"Ellis, Kansas, United States"
"05-20-2020","48139","Ellis","Texas","United States",2020-05-21 02:32:48,32.34894117,-96.79371841,264,12,0,252,"Ellis, Texas, United States"
"05-20-2020","20053","Ellsworth","Kansas","United States",2020-05-21 02:32:48,38.69677695,-98.20462799,2,0,0,2,"Ellsworth, Kansas, United States"
"05-20-2020","01051","Elmore","Alabama","United States",2020-05-21 02:32:48,32.59785413,-86.14415284,226,7,0,219,"Elmore, Alabama, United States"
"05-20-2020","16039","Elmore","Idaho","United States",2020-05-21 02:32:48,43.3507101,-115.4701578,31,2,0,29,"Elmore, Idaho, United States"
"05-20-2020","13107","Emanuel","Georgia","United States",2020-05-21 02:32:48,32.59221302,-82.30239915,26,2,0,24,"Emanuel, Georgia, United States"
"05-20-2020","19063","Emmet","Iowa","United States",2020-05-21 02:32:48,43.37782951,-94.67858943,6,0,0,6,"Emmet, Iowa, United States"
"05-20-2020","26047","Emmet","Michigan","United States",2020-05-21 02:32:48,45.52625509,-84.89083249,21,2,0,19,"Emmet, Michigan, United States"
"05-20-2020","38029","Emmons","North Dakota","United States",2020-05-21 02:32:48,46.28398398,-100.2389766,1,1,0,0,"Emmons, North Dakota, United States"
"05-20-2020","51595","Emporia","Virginia","United States",2020-05-21 02:32:48,36.69455571,-77.53406129,58,3,0,55,"Emporia, Virginia, United States"
"05-20-2020","48143","Erath","Texas","United States",2020-05-21 02:32:48,32.23602653,-98.21773417,15,1,0,14,"Erath, Texas, United States"
"05-20-2020","36029","Erie","New York","United States",2020-05-21 02:32:48,42.76249024,-78.73063652,5131,449,0,4682,"Erie, New York, United States"
"05-20-2020","39043","Erie","Ohio","United States",2020-05-21 02:32:48,41.36796058,-82.62904521,124,4,0,120,"Erie, Ohio, United States"
"05-20-2020","42049","Erie","Pennsylvania","United States",2020-05-21 02:32:48,41.99253829,-80.03301954,163,4,0,159,"Erie, Pennsylvania, United States"
"05-20-2020","01053","Escambia","Alabama","United States",2020-05-21 02:32:48,31.1256789,-87.15918694,39,3,0,36,"Escambia, Alabama, United States"
"05-20-2020","12033","Escambia","Florida","United States",2020-05-21 02:32:48,30.67652764,-87.37284571,723,21,0,702,"Escambia, Florida, United States"
"05-20-2020","25009","Essex","Massachusetts","United States",2020-05-21 02:32:48,42.6687626,-70.94687179,12920,817,0,12103,"Essex, Massachusetts, United States"
"05-20-2020","34013","Essex","New Jersey","United States",2020-05-21 02:32:48,40.78681335,-74.24657979,16952,1571,0,15381,"Essex, New Jersey, United States"
"05-20-2020","36031","Essex","New York","United States",2020-05-21 02:32:48,44.11630765,-73.77297842,34,0,0,34,"Essex, New York, United States"
"05-20-2020","50009","Essex","Vermont","United States",2020-05-21 02:32:48,44.72736416,-71.73579864,2,0,0,2,"Essex, Vermont, United States"
"05-20-2020","51057","Essex","Virginia","United States",2020-05-21 02:32:48,37.93357639,-76.94230311,35,0,0,35,"Essex, Virginia, United States"
"05-20-2020","01055","Etowah","Alabama","United States",2020-05-21 02:32:48,34.04567266,-86.04051873,223,10,0,213,"Etowah, Alabama, United States"
"05-20-2020","32011","Eureka","Nevada","United States",2020-05-21 02:32:48,39.98100864,-116.2683204,0,0,0,0,"Eureka, Nevada, United States"
"05-20-2020","22039","Evangeline","Louisiana","United States",2020-05-21 02:32:48,30.72985248,-92.39915924,67,1,0,66,"Evangeline, Louisiana, United States"
"05-20-2020","13109","Evans","Georgia","United States",2020-05-21 02:32:48,32.15328841,-81.8870105,5,0,0,5,"Evans, Georgia, United States"
"05-20-2020","02090","Fairbanks North Star","Alaska","United States",2020-05-21 02:32:48,64.80726247,-146.5692662,85,2,0,83,"Fairbanks North Star, Alaska, United States"
"05-20-2020","51059","Fairfax","Virginia","United States",2020-05-21 02:32:48,38.83677558,-77.27565836,8163,302,0,7861,"Fairfax, Virginia, United States"
"05-20-2020","51600","Fairfax City","Virginia","United States",2020-05-21 02:32:48,38.85157547,-77.2977964,47,3,0,44,"Fairfax City, Virginia, United States"
"05-20-2020","09001","Fairfield","Connecticut","United States",2020-05-21 02:32:48,41.26809896,-73.3881171,14719,1167,0,13552,"Fairfield, Connecticut, United States"
"05-20-2020","39045","Fairfield","Ohio","United States",2020-05-21 02:32:48,39.75107189,-82.63088163,217,3,0,214,"Fairfield, Ohio, United States"
"05-20-2020","45039","Fairfield","South Carolina","United States",2020-05-21 02:32:48,34.39287073,-81.1195624,139,9,0,130,"Fairfield, South Carolina, United States"
"05-20-2020","46047","Fall River","South Dakota","United States",2020-05-21 02:32:48,43.23929297,-103.5275691,4,0,0,4,"Fall River, South Dakota, United States"
"05-20-2020","48145","Falls","Texas","United States",2020-05-21 02:32:48,31.25350609,-96.93630086,6,0,0,6,"Falls, Texas, United States"
"05-20-2020","51610","Falls Church","Virginia","United States",2020-05-21 02:32:48,38.88485255,-77.17560759,44,5,0,39,"Falls Church, Virginia, United States"
"05-20-2020","13111","Fannin","Georgia","United States",2020-05-21 02:32:48,34.86430205,-84.316964,39,1,0,38,"Fannin, Georgia, United States"
"05-20-2020","48147","Fannin","Texas","United States",2020-05-21 02:32:48,33.59564294,-96.10751083,28,2,0,26,"Fannin, Texas, United States"
"05-20-2020","27043","Faribault","Minnesota","United States",2020-05-21 02:32:48,43.67381499,-93.94787458,10,0,0,10,"Faribault, Minnesota, United States"
"05-20-2020","46049","Faulk","South Dakota","United States",2020-05-21 02:32:48,45.07082625,-99.14535601,1,0,0,1,"Faulk, South Dakota, United States"
"05-20-2020","05045","Faulkner","Arkansas","United States",2020-05-21 02:32:48,35.14719007,-92.33717519,95,3,0,92,"Faulkner, Arkansas, United States"
"05-20-2020","51061","Fauquier","Virginia","United States",2020-05-21 02:32:48,38.73564842,-77.80647472,251,5,0,246,"Fauquier, Virginia, United States"
"05-20-2020","01057","Fayette","Alabama","United States",2020-05-21 02:32:48,33.72076938,-87.73886638,9,0,0,9,"Fayette, Alabama, United States"
"05-20-2020","13113","Fayette","Georgia","United States",2020-05-21 02:32:48,33.41357794,-84.49089434,215,11,0,204,"Fayette, Georgia, United States"
"05-20-2020","17051","Fayette","Illinois","United States",2020-05-21 02:32:48,39.00072038,-89.02452658,19,2,0,17,"Fayette, Illinois, United States"
"05-20-2020","18041","Fayette","Indiana","United States",2020-05-21 02:32:48,39.63684962,-85.17797541,43,4,0,39,"Fayette, Indiana, United States"
"05-20-2020","19065","Fayette","Iowa","United States",2020-05-21 02:32:48,42.86271799,-91.8441231,25,0,0,25,"Fayette, Iowa, United States"
"05-20-2020","21067","Fayette","Kentucky","United States",2020-05-21 02:32:48,38.0368225,-84.45576892,591,12,0,579,"Fayette, Kentucky, United States"
"05-20-2020","39047","Fayette","Ohio","United States",2020-05-21 02:32:48,39.56021306,-83.4562016,32,0,0,32,"Fayette, Ohio, United States"
"05-20-2020","42051","Fayette","Pennsylvania","United States",2020-05-21 02:32:48,39.92041012,-79.64291195,93,4,0,89,"Fayette, Pennsylvania, United States"
"05-20-2020","47047","Fayette","Tennessee","United States",2020-05-21 02:32:48,35.19615831,-89.41399032,95,2,0,93,"Fayette, Tennessee, United States"
"05-20-2020","48149","Fayette","Texas","United States",2020-05-21 02:32:48,29.87788372,-96.92076062,31,2,0,29,"Fayette, Texas, United States"
"05-20-2020","54019","Fayette","West Virginia","United States",2020-05-21 02:32:48,38.02974928,-81.08286634,39,3,0,36,"Fayette, West Virginia, United States"
"05-20-2020",NA,"Federal Correctional Institution (FCI)","Michigan","United States",2020-05-21 02:32:48,NA,NA,122,3,0,119,"Federal Correctional Institution (FCI), Michigan, United States"
"05-20-2020","47049","Fentress","Tennessee","United States",2020-05-21 02:32:48,36.38128818,-84.92870012,9,0,0,9,"Fentress, Tennessee, United States"
"05-20-2020","30027","Fergus","Montana","United States",2020-05-21 02:32:48,47.26331584,-109.2245206,0,0,0,0,"Fergus, Montana, United States"
"05-20-2020","53019","Ferry","Washington","United States",2020-05-21 02:32:48,48.4711431,-118.5154041,1,0,0,1,"Ferry, Washington, United States"
"05-20-2020","27045","Fillmore","Minnesota","United States",2020-05-21 02:32:48,43.67394126,-92.08980382,17,1,0,16,"Fillmore, Minnesota, United States"
