"Date_Published","FIPS","Admin2","Province_State","Country_Region","Last_Update","Latitude","Longitude","Confirmed","Deaths","Recovered","Active","Combined_Key"
"05-20-2020","55069","Lincoln","Wisconsin","United States",2020-05-21 02:32:48,45.33737523,-89.73411273,3,0,0,3,"Lincoln, Wisconsin, United States"
"05-20-2020","56023","Lincoln","Wyoming","United States",2020-05-21 02:32:48,42.26376367,-110.6563997,14,0,0,14,"Lincoln, Wyoming, United States"
"05-20-2020","19113","Linn","Iowa","United States",2020-05-21 02:32:48,42.07923082,-91.59809485,902,73,0,829,"Linn, Iowa, United States"
"05-20-2020","20107","Linn","Kansas","United States",2020-05-21 02:32:48,38.21267844,-94.84254089,7,0,0,7,"Linn, Kansas, United States"
"05-20-2020","29115","Linn","Missouri","United States",2020-05-21 02:32:48,39.87001769,-93.10704106,5,1,0,4,"Linn, Missouri, United States"
"05-20-2020","41043","Linn","Oregon","United States",2020-05-21 02:32:48,44.48899494,-122.5373154,110,9,0,101,"Linn, Oregon, United States"
"05-20-2020","48295","Lipscomb","Texas","United States",2020-05-21 02:32:48,36.27783108,-100.2733151,2,0,0,2,"Lipscomb, Texas, United States"
"05-20-2020","09005","Litchfield","Connecticut","United States",2020-05-21 02:32:48,41.7937534,-73.2451475,1299,121,0,1178,"Litchfield, Connecticut, United States"
"05-20-2020","05081","Little River","Arkansas","United States",2020-05-21 02:32:48,33.70375665,-94.23468591,1,0,0,1,"Little River, Arkansas, United States"
"05-20-2020","48297","Live Oak","Texas","United States",2020-05-21 02:32:48,28.35101362,-98.1246786,7,0,0,7,"Live Oak, Texas, United States"
"05-20-2020","17105","Livingston","Illinois","United States",2020-05-21 02:32:48,40.89188292,-88.55784752,28,1,0,27,"Livingston, Illinois, United States"
"05-20-2020","21139","Livingston","Kentucky","United States",2020-05-21 02:32:48,37.21137452,-88.34797529,7,0,0,7,"Livingston, Kentucky, United States"
"05-20-2020","22063","Livingston","Louisiana","United States",2020-05-21 02:32:48,30.44143993,-90.73061664,358,26,0,332,"Livingston, Louisiana, United States"
"05-20-2020","26093","Livingston","Michigan","United States",2020-05-21 02:32:48,42.60302282,-83.91297209,387,26,0,361,"Livingston, Michigan, United States"
"05-20-2020","29117","Livingston","Missouri","United States",2020-05-21 02:32:48,39.78110272,-93.54645978,3,0,0,3,"Livingston, Missouri, United States"
"05-20-2020","36051","Livingston","New York","United States",2020-05-21 02:32:48,42.72596275,-77.77966158,111,7,0,104,"Livingston, New York, United States"
"05-20-2020","48299","Llano","Texas","United States",2020-05-21 02:32:48,30.70645047,-98.68475262,3,0,0,3,"Llano, Texas, United States"
"05-20-2020","05083","Logan","Arkansas","United States",2020-05-21 02:32:48,35.21413234,-93.71951016,4,0,0,4,"Logan, Arkansas, United States"
"05-20-2020","08075","Logan","Colorado","United States",2020-05-21 02:32:48,40.7249637,-103.110817,489,3,0,486,"Logan, Colorado, United States"
"05-20-2020","17107","Logan","Illinois","United States",2020-05-21 02:32:48,40.12581572,-89.36638784,10,0,0,10,"Logan, Illinois, United States"
"05-20-2020","21141","Logan","Kentucky","United States",2020-05-21 02:32:48,36.85949479,-86.877635,101,3,0,98,"Logan, Kentucky, United States"
"05-20-2020","31113","Logan","Nebraska","United States",2020-05-21 02:32:48,41.56650314,-100.4817851,0,0,0,0,"Logan, Nebraska, United States"
"05-20-2020","39091","Logan","Ohio","United States",2020-05-21 02:32:48,40.38996525,-83.76784341,25,0,0,25,"Logan, Ohio, United States"
"05-20-2020","40083","Logan","Oklahoma","United States",2020-05-21 02:32:48,35.91899576,-97.44352845,18,1,0,17,"Logan, Oklahoma, United States"
"05-20-2020","54045","Logan","West Virginia","United States",2020-05-21 02:32:48,37.8299889,-81.93528571,15,1,0,14,"Logan, West Virginia, United States"
"05-20-2020","13183","Long","Georgia","United States",2020-05-21 02:32:48,31.75218791,-81.74952375,6,0,0,6,"Long, Georgia, United States"
"05-20-2020","05085","Lonoke","Arkansas","United States",2020-05-21 02:32:48,34.75392199,-91.88742357,46,0,0,46,"Lonoke, Arkansas, United States"
"05-20-2020","39093","Lorain","Ohio","United States",2020-05-21 02:32:48,41.29553751,-82.15083537,620,58,0,562,"Lorain, Ohio, United States"
"05-20-2020","35028","Los Alamos","New Mexico","United States",2020-05-21 02:32:48,35.86631386,-106.3134985,6,0,0,6,"Los Alamos, New Mexico, United States"
"05-20-2020","06037","Los Angeles","California","United States",2020-05-21 02:32:48,34.30828379,-118.2282411,40895,1973,0,38922,"Los Angeles, California, United States"
"05-20-2020","47105","Loudon","Tennessee","United States",2020-05-21 02:32:48,35.73939663,-84.31145275,97,0,0,97,"Loudon, Tennessee, United States"
"05-20-2020","51107","Loudoun","Virginia","United States",2020-05-21 02:32:48,39.08990083,-77.63481877,1579,49,0,1530,"Loudoun, Virginia, United States"
"05-20-2020","19115","Louisa","Iowa","United States",2020-05-21 02:32:48,41.21842119,-91.26102611,322,6,0,316,"Louisa, Iowa, United States"
"05-20-2020","51109","Louisa","Virginia","United States",2020-05-21 02:32:48,37.97850256,-77.96274807,61,0,0,61,"Louisa, Virginia, United States"
"05-20-2020","40085","Love","Oklahoma","United States",2020-05-21 02:32:48,33.95273467,-97.23906784,4,0,0,4,"Love, Oklahoma, United States"
"05-20-2020","01085","Lowndes","Alabama","United States",2020-05-21 02:32:48,32.1597283,-86.65158371,155,10,0,145,"Lowndes, Alabama, United States"
"05-20-2020","13185","Lowndes","Georgia","United States",2020-05-21 02:32:48,30.83568832,-83.27056716,226,5,0,221,"Lowndes, Georgia, United States"
"05-20-2020","28087","Lowndes","Mississippi","United States",2020-05-21 02:32:48,33.47386518,-88.4419153,135,6,0,129,"Lowndes, Mississippi, United States"
"05-20-2020","48303","Lubbock","Texas","United States",2020-05-21 02:32:48,33.61008596,-101.8204789,630,50,0,580,"Lubbock, Texas, United States"
"05-20-2020","19117","Lucas","Iowa","United States",2020-05-21 02:32:48,41.02958964,-93.32780803,3,0,0,3,"Lucas, Iowa, United States"
"05-20-2020","39095","Lucas","Ohio","United States",2020-05-21 02:32:48,41.62101218,-83.65468618,2021,214,0,1807,"Lucas, Ohio, United States"
"05-20-2020","26095","Luce","Michigan","United States",2020-05-21 02:32:48,46.47227431,-85.54471223,2,0,0,2,"Luce, Michigan, United States"
"05-20-2020","13187","Lumpkin","Georgia","United States",2020-05-21 02:32:48,34.57286511,-84.00425681,88,1,0,87,"Lumpkin, Georgia, United States"
"05-20-2020","35029","Luna","New Mexico","United States",2020-05-21 02:32:48,32.18179341,-107.7508826,8,1,0,7,"Luna, New Mexico, United States"
"05-20-2020","51111","Lunenburg","Virginia","United States",2020-05-21 02:32:48,36.94618528,-78.24133319,7,0,0,7,"Lunenburg, Virginia, United States"
"05-20-2020","42079","Luzerne","Pennsylvania","United States",2020-05-21 02:32:48,41.17823008,-75.98447579,2572,128,0,2444,"Luzerne, Pennsylvania, United States"
"05-20-2020","42081","Lycoming","Pennsylvania","United States",2020-05-21 02:32:48,41.34310539,-77.06629984,152,9,0,143,"Lycoming, Pennsylvania, United States"
"05-20-2020","46085","Lyman","South Dakota","United States",2020-05-21 02:32:48,43.89522709,-99.85201878,9,0,0,9,"Lyman, South Dakota, United States"
"05-20-2020","51680","Lynchburg","Virginia","United States",2020-05-21 02:32:48,37.40021399,-79.19888138,75,1,0,74,"Lynchburg, Virginia, United States"
"05-20-2020","48305","Lynn","Texas","United States",2020-05-21 02:32:48,33.17657705,-101.8162849,5,1,0,4,"Lynn, Texas, United States"
"05-20-2020","19119","Lyon","Iowa","United States",2020-05-21 02:32:48,43.38107862,-96.20926845,19,0,0,19,"Lyon, Iowa, United States"
"05-20-2020","20111","Lyon","Kansas","United States",2020-05-21 02:32:48,38.45576156,-96.15275715,317,3,0,314,"Lyon, Kansas, United States"
"05-20-2020","21143","Lyon","Kentucky","United States",2020-05-21 02:32:48,37.02080035,-88.07886257,14,3,0,11,"Lyon, Kentucky, United States"
"05-20-2020","27083","Lyon","Minnesota","United States",2020-05-21 02:32:48,44.41327865,-95.83806103,26,0,0,26,"Lyon, Minnesota, United States"
"05-20-2020","32019","Lyon","Nevada","United States",2020-05-21 02:32:48,39.01777974,-119.1870479,49,0,0,49,"Lyon, Nevada, United States"
"05-20-2020","26097","Mackinac","Michigan","United States",2020-05-21 02:32:48,46.07028979,-85.04980537,6,0,0,6,"Mackinac, Michigan, United States"
"05-20-2020","26099","Macomb","Michigan","United States",2020-05-21 02:32:48,42.69158356,-82.92752801,6392,763,0,5629,"Macomb, Michigan, United States"
"05-20-2020","01087","Macon","Alabama","United States",2020-05-21 02:32:48,32.38759944,-85.69267724,58,2,0,56,"Macon, Alabama, United States"
"05-20-2020","13193","Macon","Georgia","United States",2020-05-21 02:32:48,32.35207048,-84.04234127,95,6,0,89,"Macon, Georgia, United States"
"05-20-2020","17115","Macon","Illinois","United States",2020-05-21 02:32:48,39.86064913,-88.96342505,176,17,0,159,"Macon, Illinois, United States"
"05-20-2020","29121","Macon","Missouri","United States",2020-05-21 02:32:48,39.83049768,-92.56453089,2,0,0,2,"Macon, Missouri, United States"
"05-20-2020","37113","Macon","North Carolina","United States",2020-05-21 02:32:48,35.14867843,-83.41696617,5,1,0,4,"Macon, North Carolina, United States"
"05-20-2020","47111","Macon","Tennessee","United States",2020-05-21 02:32:48,36.53157855,-86.00778595,93,3,0,90,"Macon, Tennessee, United States"
"05-20-2020","17117","Macoupin","Illinois","United States",2020-05-21 02:32:48,39.26119767,-89.92424028,41,1,0,40,"Macoupin, Illinois, United States"
"05-20-2020","06039","Madera","California","United States",2020-05-21 02:32:48,37.21513971,-119.7665589,82,2,0,80,"Madera, California, United States"
"05-20-2020","01089","Madison","Alabama","United States",2020-05-21 02:32:48,34.76327133,-86.55069633,285,4,0,281,"Madison, Alabama, United States"
"05-20-2020","05087","Madison","Arkansas","United States",2020-05-21 02:32:48,36.01038185,-93.72524943,2,0,0,2,"Madison, Arkansas, United States"
"05-20-2020","12079","Madison","Florida","United States",2020-05-21 02:32:48,30.44396917,-83.47398594,66,3,0,63,"Madison, Florida, United States"
"05-20-2020","13195","Madison","Georgia","United States",2020-05-21 02:32:48,34.12920917,-83.21218732,32,1,0,31,"Madison, Georgia, United States"
"05-20-2020","16065","Madison","Idaho","United States",2020-05-21 02:32:48,43.78141028,-111.6538474,20,0,0,20,"Madison, Idaho, United States"
"05-20-2020","17119","Madison","Illinois","United States",2020-05-21 02:32:48,38.83042506,-89.90422563,502,46,0,456,"Madison, Illinois, United States"
"05-20-2020","18095","Madison","Indiana","United States",2020-05-21 02:32:48,40.16143691,-85.71964711,568,57,0,511,"Madison, Indiana, United States"
"05-20-2020","19121","Madison","Iowa","United States",2020-05-21 02:32:48,41.33081904,-94.01554631,20,1,0,19,"Madison, Iowa, United States"
"05-20-2020","21151","Madison","Kentucky","United States",2020-05-21 02:32:48,37.71659336,-84.27220275,45,1,0,44,"Madison, Kentucky, United States"
"05-20-2020","22065","Madison","Louisiana","United States",2020-05-21 02:32:48,32.36918118,-91.23973355,33,0,0,33,"Madison, Louisiana, United States"
"05-20-2020","28089","Madison","Mississippi","United States",2020-05-21 02:32:48,32.63389156,-90.03513564,573,18,0,555,"Madison, Mississippi, United States"
"05-20-2020","29123","Madison","Missouri","United States",2020-05-21 02:32:48,37.47865134,-90.3467143,3,0,0,3,"Madison, Missouri, United States"
"05-20-2020","30057","Madison","Montana","United States",2020-05-21 02:32:48,45.30080065,-111.9173017,8,1,0,7,"Madison, Montana, United States"
"05-20-2020","31119","Madison","Nebraska","United States",2020-05-21 02:32:48,41.91676024,-97.6005481,289,3,0,286,"Madison, Nebraska, United States"
"05-20-2020","36053","Madison","New York","United States",2020-05-21 02:32:48,42.91653905,-75.67266639,292,8,0,284,"Madison, New York, United States"
"05-20-2020","37115","Madison","North Carolina","United States",2020-05-21 02:32:48,35.85402722,-82.71346418,2,0,0,2,"Madison, North Carolina, United States"
"05-20-2020","39097","Madison","Ohio","United States",2020-05-21 02:32:48,39.89381073,-83.40178317,102,7,0,95,"Madison, Ohio, United States"
"05-20-2020","47113","Madison","Tennessee","United States",2020-05-21 02:32:48,35.61181957,-88.84076036,162,2,0,160,"Madison, Tennessee, United States"
"05-20-2020","48313","Madison","Texas","United States",2020-05-21 02:32:48,30.96694679,-95.93003775,8,0,0,8,"Madison, Texas, United States"
"05-20-2020","51113","Madison","Virginia","United States",2020-05-21 02:32:48,38.41531222,-78.28220331,27,1,0,26,"Madison, Virginia, United States"
"05-20-2020","21153","Magoffin","Kentucky","United States",2020-05-21 02:32:48,37.70820545,-83.0657714,1,0,0,1,"Magoffin, Kentucky, United States"
"05-20-2020","19123","Mahaska","Iowa","United States",2020-05-21 02:32:48,41.33521503,-92.64083907,45,2,0,43,"Mahaska, Iowa, United States"
"05-20-2020","27087","Mahnomen","Minnesota","United States",2020-05-21 02:32:48,47.32557075,-95.80921485,5,1,0,4,"Mahnomen, Minnesota, United States"
"05-20-2020","39099","Mahoning","Ohio","United States",2020-05-21 02:32:48,41.01631101,-80.77287029,1252,160,0,1092,"Mahoning, Ohio, United States"
"05-20-2020","40093","Major","Oklahoma","United States",2020-05-21 02:32:48,36.31149996,-98.53467076,6,1,0,5,"Major, Oklahoma, United States"
"05-20-2020","41045","Malheur","Oregon","United States",2020-05-21 02:32:48,43.1937027,-117.6227395,21,0,0,21,"Malheur, Oregon, United States"
"05-20-2020","51683","Manassas","Virginia","United States",2020-05-21 02:32:48,38.7464321,-77.48509905,699,6,0,693,"Manassas, Virginia, United States"
"05-20-2020","51685","Manassas Park","Virginia","United States",2020-05-21 02:32:48,38.77058531,-77.44399307,207,3,0,204,"Manassas Park, Virginia, United States"
"05-20-2020","12081","Manatee","Florida","United States",2020-05-21 02:32:48,27.47196942,-82.31831044,893,84,0,809,"Manatee, Florida, United States"
"05-20-2020","26101","Manistee","Michigan","United States",2020-05-21 02:32:48,44.33352407,-86.05626916,11,0,0,11,"Manistee, Michigan, United States"
"05-20-2020","55071","Manitowoc","Wisconsin","United States",2020-05-21 02:32:48,44.11946801,-87.80928853,26,1,0,25,"Manitowoc, Wisconsin, United States"
"05-20-2020","55073","Marathon","Wisconsin","United States",2020-05-21 02:32:48,44.89792533,-89.75863384,35,1,0,34,"Marathon, Wisconsin, United States"
"05-20-2020","01091","Marengo","Alabama","United States",2020-05-21 02:32:48,32.24767634,-87.78796182,118,6,0,112,"Marengo, Alabama, United States"
"05-20-2020","04013","Maricopa","Arizona","United States",2020-05-21 02:32:48,33.34835867,-112.4918154,7644,357,0,7287,"Maricopa, Arizona, United States"
"05-20-2020","29125","Maries","Missouri","United States",2020-05-21 02:32:48,38.16193985,-91.92249662,2,0,0,2,"Maries, Missouri, United States"
"05-20-2020","06041","Marin","California","United States",2020-05-21 02:32:48,38.07122463,-122.7210631,343,14,0,329,"Marin, California, United States"
"05-20-2020","55075","Marinette","Wisconsin","United States",2020-05-21 02:32:48,45.38553432,-88.033246,28,2,0,26,"Marinette, Wisconsin, United States"
"05-20-2020","01093","Marion","Alabama","United States",2020-05-21 02:32:48,34.13697363,-87.88704173,108,10,0,98,"Marion, Alabama, United States"
"05-20-2020","05089","Marion","Arkansas","United States",2020-05-21 02:32:48,36.26844485,-92.68451899,1,0,0,1,"Marion, Arkansas, United States"
"05-20-2020","12083","Marion","Florida","United States",2020-05-21 02:32:48,29.21227113,-82.05803627,228,5,0,223,"Marion, Florida, United States"
"05-20-2020","13197","Marion","Georgia","United States",2020-05-21 02:32:48,32.3483402,-84.52733571,47,2,0,45,"Marion, Georgia, United States"
"05-20-2020","17121","Marion","Illinois","United States",2020-05-21 02:32:48,38.64963204,-88.91899208,49,0,0,49,"Marion, Illinois, United States"
"05-20-2020","18097","Marion","Indiana","United States",2020-05-21 02:32:48,39.78163624,-86.13826325,8656,505,0,8151,"Marion, Indiana, United States"
"05-20-2020","19125","Marion","Iowa","United States",2020-05-21 02:32:48,41.33445101,-93.09934783,24,0,0,24,"Marion, Iowa, United States"
"05-20-2020","20115","Marion","Kansas","United States",2020-05-21 02:32:48,38.35855394,-97.0985251,5,1,0,4,"Marion, Kansas, United States"
"05-20-2020","21155","Marion","Kentucky","United States",2020-05-21 02:32:48,37.55218078,-85.26898542,17,0,0,17,"Marion, Kentucky, United States"
"05-20-2020","28091","Marion","Mississippi","United States",2020-05-21 02:32:48,31.23132643,-89.8209217,97,8,0,89,"Marion, Mississippi, United States"
"05-20-2020","29127","Marion","Missouri","United States",2020-05-21 02:32:48,39.80601912,-91.62203062,5,0,0,5,"Marion, Missouri, United States"
"05-20-2020","39101","Marion","Ohio","United States",2020-05-21 02:32:48,40.58610662,-83.15736305,2540,18,0,2522,"Marion, Ohio, United States"
"05-20-2020","41047","Marion","Oregon","United States",2020-05-21 02:32:48,44.90287942,-122.5815117,879,24,0,855,"Marion, Oregon, United States"
"05-20-2020","45067","Marion","South Carolina","United States",2020-05-21 02:32:48,34.07859748,-79.36400756,56,4,0,52,"Marion, South Carolina, United States"
"05-20-2020","47115","Marion","Tennessee","United States",2020-05-21 02:32:48,35.12997174,-85.62265895,34,1,0,33,"Marion, Tennessee, United States"
"05-20-2020","48315","Marion","Texas","United States",2020-05-21 02:32:48,32.79868409,-94.3566123,15,0,0,15,"Marion, Texas, United States"
"05-20-2020","54049","Marion","West Virginia","United States",2020-05-21 02:32:48,39.50984542,-80.24244659,48,2,0,46,"Marion, West Virginia, United States"
"05-20-2020","06043","Mariposa","California","United States",2020-05-21 02:32:48,37.57978556,-119.9073334,15,1,0,14,"Mariposa, California, United States"
"05-20-2020","45069","Marlboro","South Carolina","United States",2020-05-21 02:32:48,34.59905577,-79.67561152,80,0,0,80,"Marlboro, South Carolina, United States"
"05-20-2020","26103","Marquette","Michigan","United States",2020-05-21 02:32:48,46.4338914,-87.64043701,52,10,0,42,"Marquette, Michigan, United States"
"05-20-2020","55077","Marquette","Wisconsin","United States",2020-05-21 02:32:48,43.81911946,-89.40073763,3,1,0,2,"Marquette, Wisconsin, United States"
"05-20-2020","01095","Marshall","Alabama","United States",2020-05-21 02:32:48,34.36975964,-86.30486727,641,9,0,632,"Marshall, Alabama, United States"
"05-20-2020","17123","Marshall","Illinois","United States",2020-05-21 02:32:48,41.0327901,-89.34510444,5,0,0,5,"Marshall, Illinois, United States"
"05-20-2020","18099","Marshall","Indiana","United States",2020-05-21 02:32:48,41.32467367,-86.26185087,50,1,0,49,"Marshall, Indiana, United States"
"05-20-2020","19127","Marshall","Iowa","United States",2020-05-21 02:32:48,42.03586837,-92.9990819,827,7,0,820,"Marshall, Iowa, United States"
"05-20-2020","21157","Marshall","Kentucky","United States",2020-05-21 02:32:48,36.8800707,-88.32803576,36,2,0,34,"Marshall, Kentucky, United States"
"05-20-2020","27089","Marshall","Minnesota","United States",2020-05-21 02:32:48,48.35825983,-96.37017407,8,0,0,8,"Marshall, Minnesota, United States"
"05-20-2020","28093","Marshall","Mississippi","United States",2020-05-21 02:32:48,34.76216286,-89.50299462,68,3,0,65,"Marshall, Mississippi, United States"
"05-20-2020","40095","Marshall","Oklahoma","United States",2020-05-21 02:32:48,34.02311222,-96.76855464,6,0,0,6,"Marshall, Oklahoma, United States"
"05-20-2020","46091","Marshall","South Dakota","United States",2020-05-21 02:32:48,45.75870838,-97.59855639,3,0,0,3,"Marshall, South Dakota, United States"
"05-20-2020","47117","Marshall","Tennessee","United States",2020-05-21 02:32:48,35.45798777,-86.76420988,26,1,0,25,"Marshall, Tennessee, United States"
"05-20-2020","54051","Marshall","West Virginia","United States",2020-05-21 02:32:48,39.86064362,-80.66591062,25,0,0,25,"Marshall, West Virginia, United States"
"05-20-2020","12085","Martin","Florida","United States",2020-05-21 02:32:48,27.0772071,-80.43109784,419,8,0,411,"Martin, Florida, United States"
"05-20-2020","18101","Martin","Indiana","United States",2020-05-21 02:32:48,38.7099921,-86.80373186,8,0,0,8,"Martin, Indiana, United States"
"05-20-2020","21159","Martin","Kentucky","United States",2020-05-21 02:32:48,37.79990579,-82.51247478,3,0,0,3,"Martin, Kentucky, United States"
"05-20-2020","27091","Martin","Minnesota","United States",2020-05-21 02:32:48,43.67429718,-94.55099908,123,5,0,118,"Martin, Minnesota, United States"
"05-20-2020","37117","Martin","North Carolina","United States",2020-05-21 02:32:48,35.84326734,-77.10860251,39,4,0,35,"Martin, North Carolina, United States"
"05-20-2020","48317","Martin","Texas","United States",2020-05-21 02:32:48,32.30600051,-101.9513518,3,1,0,2,"Martin, Texas, United States"
"05-20-2020","51690","Martinsville","Virginia","United States",2020-05-21 02:32:48,36.68212094,-79.86352771,20,0,0,20,"Martinsville, Virginia, United States"
"05-20-2020","17125","Mason","Illinois","United States",2020-05-21 02:32:48,40.23917274,-89.91824452,16,0,0,16,"Mason, Illinois, United States"
"05-20-2020","21161","Mason","Kentucky","United States",2020-05-21 02:32:48,38.59471935,-83.82151043,8,0,0,8,"Mason, Kentucky, United States"
"05-20-2020","26105","Mason","Michigan","United States",2020-05-21 02:32:48,43.99509218,-86.24988902,28,0,0,28,"Mason, Michigan, United States"
"05-20-2020","48319","Mason","Texas","United States",2020-05-21 02:32:48,30.71780434,-99.22629416,31,0,0,31,"Mason, Texas, United States"
"05-20-2020","53045","Mason","Washington","United States",2020-05-21 02:32:48,47.35007586,-123.1863685,33,1,0,32,"Mason, Washington, United States"
"05-20-2020","54053","Mason","West Virginia","United States",2020-05-21 02:32:48,38.77071799,-82.02524219,15,0,0,15,"Mason, West Virginia, United States"
"05-20-2020","17127","Massac","Illinois","United States",2020-05-21 02:32:48,37.22078441,-88.71036614,6,0,0,6,"Massac, Illinois, United States"
"05-20-2020","48321","Matagorda","Texas","United States",2020-05-21 02:32:48,28.81955746,-96.01230294,66,5,0,61,"Matagorda, Texas, United States"
"05-20-2020","02170","Matanuska-Susitna","Alaska","United States",2020-05-21 02:32:48,62.31305045,-149.5741743,22,1,0,21,"Matanuska-Susitna, Alaska, United States"
"05-20-2020","51115","Mathews","Virginia","United States",2020-05-21 02:32:48,37.44164146,-76.34098896,5,0,0,5,"Mathews, Virginia, United States"
"05-20-2020","15009","Maui","Hawaii","United States",2020-05-21 02:32:48,20.86399628,-156.5689097,117,6,0,111,"Maui, Hawaii, United States"
"05-20-2020","47119","Maury","Tennessee","United States",2020-05-21 02:32:48,35.6187413,-87.07462444,71,0,0,71,"Maury, Tennessee, United States"
"05-20-2020","48323","Maverick","Texas","United States",2020-05-21 02:32:48,28.7429195,-100.3157686,93,1,0,92,"Maverick, Texas, United States"
"05-20-2020","40097","Mayes","Oklahoma","United States",2020-05-21 02:32:48,36.30179091,-95.23175116,28,4,0,24,"Mayes, Oklahoma, United States"
"05-20-2020","40087","McClain","Oklahoma","United States",2020-05-21 02:32:48,35.01123903,-97.44572302,95,2,0,93,"McClain, Oklahoma, United States"
"05-20-2020","46087","McCook","South Dakota","United States",2020-05-21 02:32:48,43.6742571,-97.36863144,5,1,0,4,"McCook, South Dakota, United States"
"05-20-2020","45065","McCormick","South Carolina","United States",2020-05-21 02:32:48,33.90161443,-82.30794338,7,1,0,6,"McCormick, South Carolina, United States"
"05-20-2020","21145","McCracken","Kentucky","United States",2020-05-21 02:32:48,37.05350953,-88.70445755,85,2,0,83,"McCracken, Kentucky, United States"
"05-20-2020","21147","McCreary","Kentucky","United States",2020-05-21 02:32:48,36.73874143,-84.48102924,13,0,0,13,"McCreary, Kentucky, United States"
"05-20-2020","48307","McCulloch","Texas","United States",2020-05-21 02:32:48,31.1925468,-99.34682807,3,0,0,3,"McCulloch, Texas, United States"
"05-20-2020","40089","McCurtain","Oklahoma","United States",2020-05-21 02:32:48,34.11664328,-94.77222373,13,0,0,13,"McCurtain, Oklahoma, United States"
"05-20-2020","29119","McDonald","Missouri","United States",2020-05-21 02:32:48,36.62869595,-94.34867205,14,0,0,14,"McDonald, Missouri, United States"
"05-20-2020","17109","McDonough","Illinois","United States",2020-05-21 02:32:48,40.45674722,-90.67775541,73,4,0,69,"McDonough, Illinois, United States"
"05-20-2020","37111","McDowell","North Carolina","United States",2020-05-21 02:32:48,35.67736232,-82.0482425,33,1,0,32,"McDowell, North Carolina, United States"
"05-20-2020","54047","McDowell","West Virginia","United States",2020-05-21 02:32:48,37.38002939,-81.65083669,6,0,0,6,"McDowell, West Virginia, United States"
"05-20-2020","13189","McDuffie","Georgia","United States",2020-05-21 02:32:48,33.47851918,-82.48252774,57,5,0,52,"McDuffie, Georgia, United States"
"05-20-2020","17111","McHenry","Illinois","United States",2020-05-21 02:32:48,42.32451172,-88.45248227,1255,66,0,1189,"McHenry, Illinois, United States"
"05-20-2020","38049","McHenry","North Dakota","United States",2020-05-21 02:32:48,48.23104458,-100.6324822,2,1,0,1,"McHenry, North Dakota, United States"
"05-20-2020","13191","McIntosh","Georgia","United States",2020-05-21 02:32:48,31.49683595,-81.40163426,11,0,0,11,"McIntosh, Georgia, United States"
"05-20-2020","38051","McIntosh","North Dakota","United States",2020-05-21 02:32:48,46.11182017,-99.44145858,1,0,0,1,"McIntosh, North Dakota, United States"
"05-20-2020","40091","McIntosh","Oklahoma","United States",2020-05-21 02:32:48,35.37235506,-95.66599306,10,1,0,9,"McIntosh, Oklahoma, United States"
"05-20-2020","42083","McKean","Pennsylvania","United States",2020-05-21 02:32:48,41.80938602,-78.56478358,11,1,0,10,"McKean, Pennsylvania, United States"
"05-20-2020","38053","McKenzie","North Dakota","United States",2020-05-21 02:32:48,47.7413337,-103.395905,16,0,0,16,"McKenzie, North Dakota, United States"
