"Date_Published","FIPS","Admin2","Province_State","Country_Region","Last_Update","Latitude","Longitude","Confirmed","Deaths","Recovered","Active","Combined_Key"
"05-20-2020","47157","Shelby","Tennessee","United States",2020-05-21 02:32:48,35.1864775,-89.89692423,3936,87,0,3849,"Shelby, Tennessee, United States"
"05-20-2020","48419","Shelby","Texas","United States",2020-05-21 02:32:48,31.79211404,-94.14550696,177,5,0,172,"Shelby, Texas, United States"
"05-20-2020","51171","Shenandoah","Virginia","United States",2020-05-21 02:32:48,38.85905135,-78.56813762,345,12,0,333,"Shenandoah, Virginia, United States"
"05-20-2020","27141","Sherburne","Minnesota","United States",2020-05-21 02:32:48,45.44447208,-93.77617511,178,1,0,177,"Sherburne, Minnesota, United States"
"05-20-2020","20179","Sheridan","Kansas","United States",2020-05-21 02:32:48,39.35018161,-100.4418259,2,0,0,2,"Sheridan, Kansas, United States"
"05-20-2020","56033","Sheridan","Wyoming","United States",2020-05-21 02:32:48,44.79048913,-106.8862389,16,0,0,16,"Sheridan, Wyoming, United States"
"05-20-2020","20181","Sherman","Kansas","United States",2020-05-21 02:32:48,39.35147699,-101.7197624,6,0,0,6,"Sherman, Kansas, United States"
"05-20-2020","31163","Sherman","Nebraska","United States",2020-05-21 02:32:48,41.22045983,-98.97588642,2,0,0,2,"Sherman, Nebraska, United States"
"05-20-2020","41055","Sherman","Oregon","United States",2020-05-21 02:32:48,45.41501554,-120.6827834,1,0,0,1,"Sherman, Oregon, United States"
"05-20-2020","48421","Sherman","Texas","United States",2020-05-21 02:32:48,36.27751473,-101.8933156,23,0,0,23,"Sherman, Texas, United States"
"05-20-2020","26155","Shiawassee","Michigan","United States",2020-05-21 02:32:48,42.953928,-84.14585902,246,21,0,225,"Shiawassee, Michigan, United States"
"05-20-2020","27143","Sibley","Minnesota","United States",2020-05-21 02:32:48,44.5796592,-94.23164924,11,0,0,11,"Sibley, Minnesota, United States"
"05-20-2020","35051","Sierra","New Mexico","United States",2020-05-21 02:32:48,33.13028233,-107.1925893,1,0,0,1,"Sierra, New Mexico, United States"
"05-20-2020","30093","Silver Bow","Montana","United States",2020-05-21 02:32:48,45.90018933,-112.6620092,11,0,0,11,"Silver Bow, Montana, United States"
"05-20-2020","21213","Simpson","Kentucky","United States",2020-05-21 02:32:48,36.74058474,-86.58047435,43,2,0,41,"Simpson, Kentucky, United States"
"05-20-2020","28127","Simpson","Mississippi","United States",2020-05-21 02:32:48,31.91282117,-89.91716179,79,0,0,79,"Simpson, Mississippi, United States"
"05-20-2020","19167","Sioux","Iowa","United States",2020-05-21 02:32:48,43.08221074,-96.1767568,159,0,0,159,"Sioux, Iowa, United States"
"05-20-2020","38085","Sioux","North Dakota","United States",2020-05-21 02:32:48,46.11323337,-101.0440149,2,0,0,2,"Sioux, North Dakota, United States"
"05-20-2020","06093","Siskiyou","California","United States",2020-05-21 02:32:48,41.59198861,-122.5407434,6,0,0,6,"Siskiyou, California, United States"
"05-20-2020","02220","Sitka","Alaska","United States",2020-05-21 02:32:48,57.24124555,-135.3206587,1,0,0,1,"Sitka, Alaska, United States"
"05-20-2020","53057","Skagit","Washington","United States",2020-05-21 02:32:48,48.48171488,-121.766131,426,15,0,411,"Skagit, Washington, United States"
"05-20-2020","53059","Skamania","Washington","United States",2020-05-21 02:32:48,46.02408726,-121.9164403,3,0,0,3,"Skamania, Washington, United States"
"05-20-2020","38087","Slope","North Dakota","United States",2020-05-21 02:32:48,46.44737738,-103.4601547,3,0,0,3,"Slope, North Dakota, United States"
"05-20-2020","20183","Smith","Kansas","United States",2020-05-21 02:32:48,39.78516566,-98.78566062,2,0,0,2,"Smith, Kansas, United States"
"05-20-2020","28129","Smith","Mississippi","United States",2020-05-21 02:32:48,32.01744532,-89.50644846,121,10,0,111,"Smith, Mississippi, United States"
"05-20-2020","47159","Smith","Tennessee","United States",2020-05-21 02:32:48,36.25359775,-85.95411046,29,1,0,28,"Smith, Tennessee, United States"
"05-20-2020","48423","Smith","Texas","United States",2020-05-21 02:32:48,32.37474036,-95.2717568,192,4,0,188,"Smith, Texas, United States"
"05-20-2020","51173","Smyth","Virginia","United States",2020-05-21 02:32:48,36.84455636,-81.53344948,15,0,0,15,"Smyth, Virginia, United States"
"05-20-2020","53061","Snohomish","Washington","United States",2020-05-21 02:32:48,48.04615983,-121.7170703,2826,132,0,2694,"Snohomish, Washington, United States"
"05-20-2020","42109","Snyder","Pennsylvania","United States",2020-05-21 02:32:48,40.77129231,-77.06840691,33,1,0,32,"Snyder, Pennsylvania, United States"
"05-20-2020","35053","Socorro","New Mexico","United States",2020-05-21 02:32:48,34.00715494,-106.9298354,49,4,0,45,"Socorro, New Mexico, United States"
"05-20-2020","06095","Solano","California","United States",2020-05-21 02:32:48,38.26827353,-121.9357113,435,18,0,417,"Solano, California, United States"
"05-20-2020","23025","Somerset","Maine","United States",2020-05-21 02:32:48,45.51229767,-69.95995554,20,0,0,20,"Somerset, Maine, United States"
"05-20-2020","24039","Somerset","Maryland","United States",2020-05-21 02:32:48,38.1163542,-75.75118623,64,1,0,63,"Somerset, Maryland, United States"
"05-20-2020","34035","Somerset","New Jersey","United States",2020-05-21 02:32:48,40.56465737,-74.61683016,4349,384,0,3965,"Somerset, New Jersey, United States"
"05-20-2020","42111","Somerset","Pennsylvania","United States",2020-05-21 02:32:48,39.97172723,-79.02699593,37,0,0,37,"Somerset, Pennsylvania, United States"
"05-20-2020","06097","Sonoma","California","United States",2020-05-21 02:32:48,38.52746429,-122.8862506,411,4,0,407,"Sonoma, California, United States"
"05-20-2020","51175","Southampton","Virginia","United States",2020-05-21 02:32:48,36.72231125,-77.10642712,137,2,0,135,"Southampton, Virginia, United States"
"05-20-2020","02240","Southeast Fairbanks","Alaska","United States",2020-05-21 02:32:48,63.87692095,-143.2127643,3,0,0,3,"Southeast Fairbanks, Alaska, United States"
"05-20-2020",NA,"Southeast Utah","Utah","United States",2020-05-21 02:32:48,38.99617072,-110.7013958,16,0,0,16,"Southeast Utah, Utah, United States"
"05-20-2020",NA,"Southwest Utah","Utah","United States",2020-05-21 02:32:48,37.85447192,-111.4418764,260,4,0,256,"Southwest Utah, Utah, United States"
"05-20-2020","13255","Spalding","Georgia","United States",2020-05-21 02:32:48,33.26310031,-84.28013991,251,14,0,237,"Spalding, Georgia, United States"
"05-20-2020","45083","Spartanburg","South Carolina","United States",2020-05-21 02:32:48,34.92960077,-81.99225984,415,13,0,402,"Spartanburg, South Carolina, United States"
"05-20-2020","18147","Spencer","Indiana","United States",2020-05-21 02:32:48,38.01519732,-87.0079644,13,1,0,12,"Spencer, Indiana, United States"
"05-20-2020","21215","Spencer","Kentucky","United States",2020-05-21 02:32:48,38.03223971,-85.32749335,16,0,0,16,"Spencer, Kentucky, United States"
"05-20-2020","46115","Spink","South Dakota","United States",2020-05-21 02:32:48,44.93837606,-98.34626602,4,0,0,4,"Spink, South Dakota, United States"
"05-20-2020","53063","Spokane","Washington","United States",2020-05-21 02:32:48,47.62113146,-117.4046494,415,31,0,384,"Spokane, Washington, United States"
"05-20-2020","51177","Spotsylvania","Virginia","United States",2020-05-21 02:32:48,38.18574462,-77.655399,351,4,0,347,"Spotsylvania, Virginia, United States"
"05-20-2020","22087","St. Bernard","Louisiana","United States",2020-05-21 02:32:48,29.87761636,-89.51887093,518,21,0,497,"St. Bernard, Louisiana, United States"
"05-20-2020","22089","St. Charles","Louisiana","United States",2020-05-21 02:32:48,29.90709658,-90.35555967,615,42,0,573,"St. Charles, Louisiana, United States"
"05-20-2020","29183","St. Charles","Missouri","United States",2020-05-21 02:32:48,38.77875681,-90.66662425,712,55,0,657,"St. Charles, Missouri, United States"
"05-20-2020","01115","St. Clair","Alabama","United States",2020-05-21 02:32:48,33.71902176,-86.31029372,95,1,0,94,"St. Clair, Alabama, United States"
"05-20-2020","17163","St. Clair","Illinois","United States",2020-05-21 02:32:48,38.46996033,-89.93063427,858,69,0,789,"St. Clair, Illinois, United States"
"05-20-2020","26147","St. Clair","Michigan","United States",2020-05-21 02:32:48,42.92655373,-82.67937954,419,33,0,386,"St. Clair, Michigan, United States"
"05-20-2020","29185","St. Clair","Missouri","United States",2020-05-21 02:32:48,38.03699437,-93.77631447,3,0,0,3,"St. Clair, Missouri, United States"
"05-20-2020","55109","St. Croix","Wisconsin","United States",2020-05-21 02:32:48,45.03437474,-92.45000068,52,0,0,52,"St. Croix, Wisconsin, United States"
"05-20-2020","05123","St. Francis","Arkansas","United States",2020-05-21 02:32:48,35.02201976,-90.74828138,365,0,0,365,"St. Francis, Arkansas, United States"
"05-20-2020","29187","St. Francois","Missouri","United States",2020-05-21 02:32:48,37.81214171,-90.47598685,33,2,0,31,"St. Francois, Missouri, United States"
"05-20-2020","22091","St. Helena","Louisiana","United States",2020-05-21 02:32:48,30.82210324,-90.71013176,42,1,0,41,"St. Helena, Louisiana, United States"
"05-20-2020","22093","St. James","Louisiana","United States",2020-05-21 02:32:48,30.02531716,-90.80212061,284,23,0,261,"St. James, Louisiana, United States"
"05-20-2020","22095","St. John the Baptist","Louisiana","United States",2020-05-21 02:32:48,30.12597499,-90.4753503,832,77,0,755,"St. John the Baptist, Louisiana, United States"
"05-20-2020","12109","St. Johns","Florida","United States",2020-05-21 02:32:48,29.90096506,-81.43589967,233,5,0,228,"St. Johns, Florida, United States"
"05-20-2020","18141","St. Joseph","Indiana","United States",2020-05-21 02:32:48,41.61756781,-86.29040834,1054,31,0,1023,"St. Joseph, Indiana, United States"
"05-20-2020","26149","St. Joseph","Michigan","United States",2020-05-21 02:32:48,41.91441767,-85.52797979,92,2,0,90,"St. Joseph, Michigan, United States"
"05-20-2020","22097","St. Landry","Louisiana","United States",2020-05-21 02:32:48,30.59724262,-92.00135806,237,52,0,185,"St. Landry, Louisiana, United States"
"05-20-2020","36089","St. Lawrence","New York","United States",2020-05-21 02:32:48,44.4976179,-75.06550039,195,2,0,193,"St. Lawrence, New York, United States"
"05-20-2020","27137","St. Louis","Minnesota","United States",2020-05-21 02:32:48,47.6048407,-92.46879855,110,13,0,97,"St. Louis, Minnesota, United States"
"05-20-2020","29189","St. Louis","Missouri","United States",2020-05-21 02:32:48,38.6377004,-90.4458375,4410,350,0,4060,"St. Louis, Missouri, United States"
"05-20-2020","29510","St. Louis City","Missouri","United States",2020-05-21 02:32:48,38.63555736,-90.24349225,1717,109,0,1608,"St. Louis City, Missouri, United States"
"05-20-2020","12111","St. Lucie","Florida","United States",2020-05-21 02:32:48,27.37763908,-80.47106649,336,28,0,308,"St. Lucie, Florida, United States"
"05-20-2020","22099","St. Martin","Louisiana","United States",2020-05-21 02:32:48,30.13112107,-91.61403569,275,22,0,253,"St. Martin, Louisiana, United States"
"05-20-2020","22101","St. Mary","Louisiana","United States",2020-05-21 02:32:48,29.69262097,-91.44702164,281,29,0,252,"St. Mary, Louisiana, United States"
"05-20-2020","24037","St. Mary's","Maryland","United States",2020-05-21 02:32:48,38.30058422,-76.6062928,340,12,0,328,"St. Mary's, Maryland, United States"
"05-20-2020","22103","St. Tammany","Louisiana","United States",2020-05-21 02:32:48,30.40942847,-89.95642711,1572,151,0,1421,"St. Tammany, Louisiana, United States"
"05-20-2020","20185","Stafford","Kansas","United States",2020-05-21 02:32:48,38.03100851,-98.71762001,1,0,0,1,"Stafford, Kansas, United States"
"05-20-2020","51179","Stafford","Virginia","United States",2020-05-21 02:32:48,38.41758738,-77.45917053,514,4,0,510,"Stafford, Virginia, United States"
"05-20-2020","06099","Stanislaus","California","United States",2020-05-21 02:32:48,37.55862499,-120.9970722,598,26,0,572,"Stanislaus, California, United States"
"05-20-2020","46117","Stanley","South Dakota","United States",2020-05-21 02:32:48,44.41381872,-100.7349153,9,0,0,9,"Stanley, South Dakota, United States"
"05-20-2020","37167","Stanly","North Carolina","United States",2020-05-21 02:32:48,35.31647813,-80.25093221,33,4,0,29,"Stanly, North Carolina, United States"
"05-20-2020","20187","Stanton","Kansas","United States",2020-05-21 02:32:48,37.56304714,-101.7843534,9,0,0,9,"Stanton, Kansas, United States"
"05-20-2020","31167","Stanton","Nebraska","United States",2020-05-21 02:32:48,41.9169835,-97.19394708,15,0,0,15,"Stanton, Nebraska, United States"
"05-20-2020","17175","Stark","Illinois","United States",2020-05-21 02:32:48,41.09309773,-89.79745866,2,0,0,2,"Stark, Illinois, United States"
"05-20-2020","38089","Stark","North Dakota","United States",2020-05-21 02:32:48,46.80851182,-102.6576326,61,2,0,59,"Stark, North Dakota, United States"
"05-20-2020","39151","Stark","Ohio","United States",2020-05-21 02:32:48,40.81482476,-81.36437305,620,79,0,541,"Stark, Ohio, United States"
"05-20-2020","18149","Starke","Indiana","United States",2020-05-21 02:32:48,41.27890281,-86.64686895,28,3,0,25,"Starke, Indiana, United States"
"05-20-2020","48427","Starr","Texas","United States",2020-05-21 02:32:48,26.56150059,-98.73892358,23,0,0,23,"Starr, Texas, United States"
"05-20-2020","51790","Staunton","Virginia","United States",2020-05-21 02:32:48,38.15965544,-79.05979937,33,0,0,33,"Staunton, Virginia, United States"
"05-20-2020","29186","Ste. Genevieve","Missouri","United States",2020-05-21 02:32:48,37.89090059,-90.1949941,8,1,0,7,"Ste. Genevieve, Missouri, United States"
"05-20-2020","27145","Stearns","Minnesota","United States",2020-05-21 02:32:48,45.55192576,-94.61078221,1831,11,0,1820,"Stearns, Minnesota, United States"
"05-20-2020","27147","Steele","Minnesota","United States",2020-05-21 02:32:48,44.02240351,-93.22627088,116,0,0,116,"Steele, Minnesota, United States"
"05-20-2020","38091","Steele","North Dakota","United States",2020-05-21 02:32:48,47.45611548,-97.72728747,1,0,0,1,"Steele, North Dakota, United States"
"05-20-2020","13257","Stephens","Georgia","United States",2020-05-21 02:32:48,34.55151201,-83.29405315,117,2,0,115,"Stephens, Georgia, United States"
"05-20-2020","40137","Stephens","Oklahoma","United States",2020-05-21 02:32:48,34.48556989,-97.85141892,25,1,0,24,"Stephens, Oklahoma, United States"
"05-20-2020","48429","Stephens","Texas","United States",2020-05-21 02:32:48,32.73553157,-98.83631615,2,0,0,2,"Stephens, Texas, United States"
"05-20-2020","17177","Stephenson","Illinois","United States",2020-05-21 02:32:48,42.35129217,-89.662598,161,1,0,160,"Stephenson, Illinois, United States"
"05-20-2020","18151","Steuben","Indiana","United States",2020-05-21 02:32:48,41.64423868,-85.00101094,71,2,0,69,"Steuben, Indiana, United States"
"05-20-2020","36101","Steuben","New York","United States",2020-05-21 02:32:48,42.2689144,-77.3829924,237,41,0,196,"Steuben, New York, United States"
"05-20-2020","20189","Stevens","Kansas","United States",2020-05-21 02:32:48,37.1923008,-101.3118967,26,0,0,26,"Stevens, Kansas, United States"
"05-20-2020","53065","Stevens","Washington","United States",2020-05-21 02:32:48,48.40035475,-117.8542701,10,1,0,9,"Stevens, Washington, United States"
"05-20-2020","13259","Stewart","Georgia","United States",2020-05-21 02:32:48,32.07996777,-84.83208037,40,0,0,40,"Stewart, Georgia, United States"
"05-20-2020","47161","Stewart","Tennessee","United States",2020-05-21 02:32:48,36.50235092,-87.83920548,8,0,0,8,"Stewart, Tennessee, United States"
"05-20-2020","30095","Stillwater","Montana","United States",2020-05-21 02:32:48,45.67071407,-109.3950061,1,0,0,1,"Stillwater, Montana, United States"
"05-20-2020","29207","Stoddard","Missouri","United States",2020-05-21 02:32:48,36.85571651,-89.9444155,61,0,0,61,"Stoddard, Missouri, United States"
"05-20-2020","37169","Stokes","North Carolina","United States",2020-05-21 02:32:48,36.4017975,-80.23893369,39,0,0,39,"Stokes, North Carolina, United States"
"05-20-2020","05137","Stone","Arkansas","United States",2020-05-21 02:32:48,35.86251946,-92.15684085,8,0,0,8,"Stone, Arkansas, United States"
"05-20-2020","28131","Stone","Mississippi","United States",2020-05-21 02:32:48,30.79187949,-89.11547539,26,0,0,26,"Stone, Mississippi, United States"
"05-20-2020","29209","Stone","Missouri","United States",2020-05-21 02:32:48,36.75000327,-93.45256475,4,0,0,4,"Stone, Missouri, United States"
"05-20-2020","32029","Storey","Nevada","United States",2020-05-21 02:32:48,39.44875482,-119.5250207,1,0,0,1,"Storey, Nevada, United States"
"05-20-2020","19169","Story","Iowa","United States",2020-05-21 02:32:48,42.03621213,-93.46499005,82,1,0,81,"Story, Iowa, United States"
"05-20-2020","33017","Strafford","New Hampshire","United States",2020-05-21 02:32:48,43.291833,-71.02336013,242,11,0,231,"Strafford, New Hampshire, United States"
"05-20-2020","38093","Stutsman","North Dakota","United States",2020-05-21 02:32:48,46.97962541,-98.95637318,17,0,0,17,"Stutsman, North Dakota, United States"
"05-20-2020","56035","Sublette","Wyoming","United States",2020-05-21 02:32:48,42.76558279,-109.9130922,3,0,0,3,"Sublette, Wyoming, United States"
"05-20-2020","25025","Suffolk","Massachusetts","United States",2020-05-21 02:32:48,42.3279514,-71.07850442,16962,807,0,16155,"Suffolk, Massachusetts, United States"
"05-20-2020","36103","Suffolk","New York","United States",2020-05-21 02:32:48,40.88320119,-72.8012172,38411,1791,0,36620,"Suffolk, New York, United States"
"05-20-2020","51800","Suffolk","Virginia","United States",2020-05-21 02:32:48,36.70155394,-76.63603554,274,25,0,249,"Suffolk, Virginia, United States"
"05-20-2020","18153","Sullivan","Indiana","United States",2020-05-21 02:32:48,39.08952258,-87.41414469,29,1,0,28,"Sullivan, Indiana, United States"
"05-20-2020","29211","Sullivan","Missouri","United States",2020-05-21 02:32:48,40.2099105,-93.11150106,37,0,0,37,"Sullivan, Missouri, United States"
"05-20-2020","33019","Sullivan","New Hampshire","United States",2020-05-21 02:32:48,43.36094111,-72.22203125,16,1,0,15,"Sullivan, New Hampshire, United States"
"05-20-2020","36105","Sullivan","New York","United States",2020-05-21 02:32:48,41.71579493,-74.76394559,1267,28,0,1239,"Sullivan, New York, United States"
"05-20-2020","42113","Sullivan","Pennsylvania","United States",2020-05-21 02:32:48,41.44634738,-76.51246591,2,0,0,2,"Sullivan, Pennsylvania, United States"
"05-20-2020","47163","Sullivan","Tennessee","United States",2020-05-21 02:32:48,36.51240691,-82.30412917,57,2,0,55,"Sullivan, Tennessee, United States"
"05-20-2020","46119","Sully","South Dakota","United States",2020-05-21 02:32:48,44.71571812,-100.1278092,1,0,0,1,"Sully, South Dakota, United States"
"05-20-2020","54089","Summers","West Virginia","United States",2020-05-21 02:32:48,37.65390597,-80.86009693,1,0,0,1,"Summers, West Virginia, United States"
"05-20-2020","08117","Summit","Colorado","United States",2020-05-21 02:32:48,39.63803232,-106.1150762,194,2,0,192,"Summit, Colorado, United States"
"05-20-2020","39153","Summit","Ohio","United States",2020-05-21 02:32:48,41.12464734,-81.53123079,1077,131,0,946,"Summit, Ohio, United States"
"05-20-2020","49043","Summit","Utah","United States",2020-05-21 02:32:48,40.86688146,-110.9535882,403,0,0,403,"Summit, Utah, United States"
"05-20-2020","20191","Sumner","Kansas","United States",2020-05-21 02:32:48,37.23682549,-97.47721621,6,1,0,5,"Sumner, Kansas, United States"
"05-20-2020","47165","Sumner","Tennessee","United States",2020-05-21 02:32:48,36.46824103,-86.45917204,768,41,0,727,"Sumner, Tennessee, United States"
"05-20-2020","01119","Sumter","Alabama","United States",2020-05-21 02:32:48,32.59117397,-88.19916205,164,5,0,159,"Sumter, Alabama, United States"
"05-20-2020","12119","Sumter","Florida","United States",2020-05-21 02:32:48,28.70181754,-82.0794267,253,17,0,236,"Sumter, Florida, United States"
"05-20-2020","13261","Sumter","Georgia","United States",2020-05-21 02:32:48,32.03650571,-84.19821492,425,40,0,385,"Sumter, Georgia, United States"
"05-20-2020","45085","Sumter","South Carolina","United States",2020-05-21 02:32:48,33.91826534,-80.37942316,324,17,0,307,"Sumter, South Carolina, United States"
"05-20-2020","28133","Sunflower","Mississippi","United States",2020-05-21 02:32:48,33.60192578,-90.58882684,70,3,0,67,"Sunflower, Mississippi, United States"
"05-20-2020","37171","Surry","North Carolina","United States",2020-05-21 02:32:48,36.41689489,-80.69102283,102,1,0,101,"Surry, North Carolina, United States"
"05-20-2020","51181","Surry","Virginia","United States",2020-05-21 02:32:48,37.11781893,-76.88450012,6,1,0,5,"Surry, Virginia, United States"
"05-20-2020","42115","Susquehanna","Pennsylvania","United States",2020-05-21 02:32:48,41.82147784,-75.80071959,87,15,0,72,"Susquehanna, Pennsylvania, United States"
"05-20-2020","10005","Sussex","Delaware","United States",2020-05-21 02:32:48,38.66143781,-75.39031349,3960,116,0,3844,"Sussex, Delaware, United States"
"05-20-2020","34037","Sussex","New Jersey","United States",2020-05-21 02:32:48,41.13891592,-74.69118243,1069,140,0,929,"Sussex, New Jersey, United States"
"05-20-2020","51183","Sussex","Virginia","United States",2020-05-21 02:32:48,36.92432914,-77.25791182,99,1,0,98,"Sussex, Virginia, United States"
"05-20-2020","06101","Sutter","California","United States",2020-05-21 02:32:48,39.03417539,-121.6945899,40,2,0,38,"Sutter, California, United States"
"05-20-2020","12121","Suwannee","Florida","United States",2020-05-21 02:32:48,30.19746066,-82.9909967,160,18,0,142,"Suwannee, Florida, United States"
"05-20-2020","37173","Swain","North Carolina","United States",2020-05-21 02:32:48,35.48665845,-83.48748932,6,0,0,6,"Swain, North Carolina, United States"
"05-20-2020","56037","Sweetwater","Wyoming","United States",2020-05-21 02:32:48,41.65943896,-108.8827882,25,0,0,25,"Sweetwater, Wyoming, United States"
"05-20-2020","27151","Swift","Minnesota","United States",2020-05-21 02:32:48,45.2829032,-95.68264092,13,0,0,13,"Swift, Minnesota, United States"
"05-20-2020","48437","Swisher","Texas","United States",2020-05-21 02:32:48,34.53028891,-101.7349174,15,0,0,15,"Swisher, Texas, United States"
"05-20-2020","18155","Switzerland","Indiana","United States",2020-05-21 02:32:48,38.82767338,-85.03022429,18,0,0,18,"Switzerland, Indiana, United States"
"05-20-2020","13263","Talbot","Georgia","United States",2020-05-21 02:32:48,32.69642758,-84.53351366,31,1,0,30,"Talbot, Georgia, United States"
"05-20-2020","24041","Talbot","Maryland","United States",2020-05-21 02:32:48,38.76618159,-76.10882561,69,1,0,68,"Talbot, Maryland, United States"
"05-20-2020","13265","Taliaferro","Georgia","United States",2020-05-21 02:32:48,33.56543317,-82.88136816,1,0,0,1,"Taliaferro, Georgia, United States"
"05-20-2020","01121","Talladega","Alabama","United States",2020-05-21 02:32:48,33.37823223,-86.16886178,82,2,0,80,"Talladega, Alabama, United States"
"05-20-2020","28135","Tallahatchie","Mississippi","United States",2020-05-21 02:32:48,33.95339918,-90.1729398,21,1,0,20,"Tallahatchie, Mississippi, United States"
"05-20-2020","01123","Tallapoosa","Alabama","United States",2020-05-21 02:32:48,32.86698258,-85.79833053,379,59,0,320,"Tallapoosa, Alabama, United States"
"05-20-2020","19171","Tama","Iowa","United States",2020-05-21 02:32:48,42.07991767,-92.53266945,368,21,0,347,"Tama, Iowa, United States"
"05-20-2020","29213","Taney","Missouri","United States",2020-05-21 02:32:48,36.65465345,-93.04075153,12,2,0,10,"Taney, Missouri, United States"
"05-20-2020","22105","Tangipahoa","Louisiana","United States",2020-05-21 02:32:48,30.62888673,-90.40664996,752,30,0,722,"Tangipahoa, Louisiana, United States"
"05-20-2020","35055","Taos","New Mexico","United States",2020-05-21 02:32:48,36.58006022,-105.6310198,22,0,0,22,"Taos, New Mexico, United States"
"05-20-2020","48439","Tarrant","Texas","United States",2020-05-21 02:32:48,32.77143818,-97.29101614,4643,130,0,4513,"Tarrant, Texas, United States"
"05-20-2020","28137","Tate","Mississippi","United States",2020-05-21 02:32:48,34.65133709,-89.94485778,56,1,0,55,"Tate, Mississippi, United States"
"05-20-2020","13267","Tattnall","Georgia","United States",2020-05-21 02:32:48,32.04785085,-82.05539188,13,0,0,13,"Tattnall, Georgia, United States"
"05-20-2020","12123","Taylor","Florida","United States",2020-05-21 02:32:48,30.04848048,-83.60445406,5,0,0,5,"Taylor, Florida, United States"
"05-20-2020","13269","Taylor","Georgia","United States",2020-05-21 02:32:48,32.55792548,-84.25077141,22,2,0,20,"Taylor, Georgia, United States"
"05-20-2020","19173","Taylor","Iowa","United States",2020-05-21 02:32:48,40.73710579,-94.69778563,4,0,0,4,"Taylor, Iowa, United States"
"05-20-2020","21217","Taylor","Kentucky","United States",2020-05-21 02:32:48,37.3677562,-85.3329931,9,0,0,9,"Taylor, Kentucky, United States"
"05-20-2020","48441","Taylor","Texas","United States",2020-05-21 02:32:48,32.30163422,-99.89007449,225,6,0,219,"Taylor, Texas, United States"
"05-20-2020","54091","Taylor","West Virginia","United States",2020-05-21 02:32:48,39.33602617,-80.0421439,8,0,0,8,"Taylor, West Virginia, United States"
"05-20-2020","17179","Tazewell","Illinois","United States",2020-05-21 02:32:48,40.50716185,-89.51404662,65,3,0,62,"Tazewell, Illinois, United States"
"05-20-2020","51185","Tazewell","Virginia","United States",2020-05-21 02:32:48,37.12191123,-81.56685568,6,0,0,6,"Tazewell, Virginia, United States"
"05-20-2020","06103","Tehama","California","United States",2020-05-21 02:32:48,40.12570935,-122.2370171,2,1,0,1,"Tehama, California, United States"
"05-20-2020","13271","Telfair","Georgia","United States",2020-05-21 02:32:48,31.92829517,-82.93491155,29,1,0,28,"Telfair, Georgia, United States"
"05-20-2020","08119","Teller","Colorado","United States",2020-05-21 02:32:48,38.88133511,-105.1614893,32,2,0,30,"Teller, Colorado, United States"
"05-20-2020","22107","Tensas","Louisiana","United States",2020-05-21 02:32:48,32.00760749,-91.32915234,5,0,0,5,"Tensas, Louisiana, United States"
