"Date_Published","FIPS","Admin2","Province_State","Country_Region","Last_Update","Latitude","Longitude","Confirmed","Deaths","Recovered","Active","Combined_Key"
"05-20-2020","45001","Abbeville","South Carolina","United States",2020-05-21 02:32:48,34.22333378,-82.46170658,36,0,0,36,"Abbeville, South Carolina, United States"
"05-20-2020","22001","Acadia","Louisiana","United States",2020-05-21 02:32:48,30.2950649,-92.41419698,262,12,0,250,"Acadia, Louisiana, United States"
"05-20-2020","51001","Accomack","Virginia","United States",2020-05-21 02:32:48,37.76707161,-75.63234615,709,11,0,698,"Accomack, Virginia, United States"
"05-20-2020","16001","Ada","Idaho","United States",2020-05-21 02:32:48,43.4526575,-116.2415516,792,23,0,769,"Ada, Idaho, United States"
"05-20-2020","19001","Adair","Iowa","United States",2020-05-21 02:32:48,41.33075609,-94.47105874,6,0,0,6,"Adair, Iowa, United States"
"05-20-2020","21001","Adair","Kentucky","United States",2020-05-21 02:32:48,37.10459774,-85.28129668,94,17,0,77,"Adair, Kentucky, United States"
"05-20-2020","29001","Adair","Missouri","United States",2020-05-21 02:32:48,40.19058551,-92.60078167,34,0,0,34,"Adair, Missouri, United States"
"05-20-2020","40001","Adair","Oklahoma","United States",2020-05-21 02:32:48,35.88494195,-94.65859267,78,3,0,75,"Adair, Oklahoma, United States"
"05-20-2020","08001","Adams","Colorado","United States",2020-05-21 02:32:48,39.87432092,-104.3362578,2737,108,0,2629,"Adams, Colorado, United States"
"05-20-2020","16003","Adams","Idaho","United States",2020-05-21 02:32:48,44.89333571,-116.4545247,3,0,0,3,"Adams, Idaho, United States"
"05-20-2020","17001","Adams","Illinois","United States",2020-05-21 02:32:48,39.98815591,-91.18786813,43,1,0,42,"Adams, Illinois, United States"
"05-20-2020","18001","Adams","Indiana","United States",2020-05-21 02:32:48,40.7457653,-84.93671406,11,1,0,10,"Adams, Indiana, United States"
"05-20-2020","19003","Adams","Iowa","United States",2020-05-21 02:32:48,41.02903567,-94.69932645,2,0,0,2,"Adams, Iowa, United States"
"05-20-2020","28001","Adams","Mississippi","United States",2020-05-21 02:32:48,31.47669768,-91.35326037,178,15,0,163,"Adams, Mississippi, United States"
"05-20-2020","31001","Adams","Nebraska","United States",2020-05-21 02:32:48,40.5244942,-98.50117804,256,11,0,245,"Adams, Nebraska, United States"
"05-20-2020","39001","Adams","Ohio","United States",2020-05-21 02:32:48,38.84541072,-83.4718964,8,1,0,7,"Adams, Ohio, United States"
"05-20-2020","42001","Adams","Pennsylvania","United States",2020-05-21 02:32:48,39.87140411,-77.21610347,197,5,0,192,"Adams, Pennsylvania, United States"
"05-20-2020","53001","Adams","Washington","United States",2020-05-21 02:32:48,46.98299757,-118.5601734,50,0,0,50,"Adams, Washington, United States"
"05-20-2020","55001","Adams","Wisconsin","United States",2020-05-21 02:32:48,43.96974651,-89.76782777,4,1,0,3,"Adams, Wisconsin, United States"
"05-20-2020","50001","Addison","Vermont","United States",2020-05-21 02:32:48,44.03217337,-73.14130877,62,2,0,60,"Addison, Vermont, United States"
"05-20-2020","45003","Aiken","South Carolina","United States",2020-05-21 02:32:48,33.54338026,-81.63645384,160,7,0,153,"Aiken, South Carolina, United States"
"05-20-2020","27001","Aitkin","Minnesota","United States",2020-05-21 02:32:48,46.60962049,-93.4116826,4,0,0,4,"Aitkin, Minnesota, United States"
"05-20-2020","12001","Alachua","Florida","United States",2020-05-21 02:32:48,29.67866525,-82.35928158,344,7,0,337,"Alachua, Florida, United States"
"05-20-2020","37001","Alamance","North Carolina","United States",2020-05-21 02:32:48,36.0434701,-79.39976137,234,13,0,221,"Alamance, North Carolina, United States"
"05-20-2020","06001","Alameda","California","United States",2020-05-21 02:32:48,37.64629437,-121.8929271,2560,88,0,2472,"Alameda, California, United States"
"05-20-2020","08003","Alamosa","Colorado","United States",2020-05-21 02:32:48,37.57250606,-105.7885451,43,2,0,41,"Alamosa, Colorado, United States"
"05-20-2020","36001","Albany","New York","United States",2020-05-21 02:32:48,42.60060306,-73.97723916,1682,69,0,1613,"Albany, New York, United States"
"05-20-2020","56001","Albany","Wyoming","United States",2020-05-21 02:32:48,41.65498705,-105.7235415,10,0,0,10,"Albany, Wyoming, United States"
"05-20-2020","51003","Albemarle","Virginia","United States",2020-05-21 02:32:48,38.02080697,-78.55481085,142,4,0,138,"Albemarle, Virginia, United States"
"05-20-2020","26001","Alcona","Michigan","United States",2020-05-21 02:32:48,44.6846864,-83.59507875,8,1,0,7,"Alcona, Michigan, United States"
"05-20-2020","28003","Alcorn","Mississippi","United States",2020-05-21 02:32:48,34.88084463,-88.57996173,12,1,0,11,"Alcorn, Mississippi, United States"
"05-20-2020","17003","Alexander","Illinois","United States",2020-05-21 02:32:48,37.18049267,-89.32910838,8,0,0,8,"Alexander, Illinois, United States"
"05-20-2020","37003","Alexander","North Carolina","United States",2020-05-21 02:32:48,35.9223796,-81.17751948,23,0,0,23,"Alexander, North Carolina, United States"
"05-20-2020","51510","Alexandria","Virginia","United States",2020-05-21 02:32:48,38.814003,-77.08183073,1577,34,0,1543,"Alexandria, Virginia, United States"
"05-20-2020","40003","Alfalfa","Oklahoma","United States",2020-05-21 02:32:48,36.73090616,-98.32408495,1,0,0,1,"Alfalfa, Oklahoma, United States"
"05-20-2020","19005","Allamakee","Iowa","United States",2020-05-21 02:32:48,43.28383218,-91.37860922,116,4,0,112,"Allamakee, Iowa, United States"
"05-20-2020","26005","Allegan","Michigan","United States",2020-05-21 02:32:48,42.59147037,-85.89102866,191,5,0,186,"Allegan, Michigan, United States"
"05-20-2020","24001","Allegany","Maryland","United States",2020-05-21 02:32:48,39.62357628,-78.69280486,166,14,0,152,"Allegany, Maryland, United States"
"05-20-2020","36003","Allegany","New York","United States",2020-05-21 02:32:48,42.25748406,-78.02750466,44,0,0,44,"Allegany, New York, United States"
"05-20-2020","37005","Alleghany","North Carolina","United States",2020-05-21 02:32:48,36.49360862,-81.12857041,12,0,0,12,"Alleghany, North Carolina, United States"
"05-20-2020","51005","Alleghany","Virginia","United States",2020-05-21 02:32:48,37.78636074,-80.00222498,10,0,0,10,"Alleghany, Virginia, United States"
"05-20-2020","42003","Allegheny","Pennsylvania","United States",2020-05-21 02:32:48,40.46809875,-79.98167747,1687,147,0,1540,"Allegheny, Pennsylvania, United States"
"05-20-2020","18003","Allen","Indiana","United States",2020-05-21 02:32:48,41.09194313,-85.06800636,1106,65,0,1041,"Allen, Indiana, United States"
"05-20-2020","21003","Allen","Kentucky","United States",2020-05-21 02:32:48,36.75197631,-86.19457544,43,2,0,41,"Allen, Kentucky, United States"
"05-20-2020","22003","Allen","Louisiana","United States",2020-05-21 02:32:48,30.65385745,-92.82442028,157,10,0,147,"Allen, Louisiana, United States"
"05-20-2020","39003","Allen","Ohio","United States",2020-05-21 02:32:48,40.77285242,-84.10802343,172,30,0,142,"Allen, Ohio, United States"
"05-20-2020","45005","Allendale","South Carolina","United States",2020-05-21 02:32:48,32.98837386,-81.35321066,33,3,0,30,"Allendale, South Carolina, United States"
"05-20-2020","26007","Alpena","Michigan","United States",2020-05-21 02:32:48,45.03477666,-83.62212411,91,9,0,82,"Alpena, Michigan, United States"
"05-20-2020","06003","Alpine","California","United States",2020-05-21 02:32:48,38.59678594,-119.8223594,2,0,0,2,"Alpine, California, United States"
"05-20-2020","06005","Amador","California","United States",2020-05-21 02:32:48,38.44583082,-120.65696,10,0,0,10,"Amador, California, United States"
"05-20-2020","51007","Amelia","Virginia","United States",2020-05-21 02:32:48,37.34081025,-77.98584649,21,1,0,20,"Amelia, Virginia, United States"
"05-20-2020","51009","Amherst","Virginia","United States",2020-05-21 02:32:48,37.60308293,-79.14548696,25,0,0,25,"Amherst, Virginia, United States"
"05-20-2020","28005","Amite","Mississippi","United States",2020-05-21 02:32:48,31.17467303,-90.80501621,48,1,0,47,"Amite, Mississippi, United States"
"05-20-2020","02020","Anchorage","Alaska","United States",2020-05-21 02:32:48,61.14998174,-149.1426986,206,4,0,202,"Anchorage, Alaska, United States"
"05-20-2020","20003","Anderson","Kansas","United States",2020-05-21 02:32:48,38.21413251,-95.29272815,1,0,0,1,"Anderson, Kansas, United States"
"05-20-2020","21005","Anderson","Kentucky","United States",2020-05-21 02:32:48,38.00671029,-84.99171713,15,1,0,14,"Anderson, Kentucky, United States"
"05-20-2020","45007","Anderson","South Carolina","United States",2020-05-21 02:32:48,34.51828081,-82.63959517,213,8,0,205,"Anderson, South Carolina, United States"
"05-20-2020","47001","Anderson","Tennessee","United States",2020-05-21 02:32:48,36.12684348,-84.19965764,37,1,0,36,"Anderson, Tennessee, United States"
"05-20-2020","48001","Anderson","Texas","United States",2020-05-21 02:32:48,31.81534745,-95.65354823,61,0,0,61,"Anderson, Texas, United States"
"05-20-2020","29003","Andrew","Missouri","United States",2020-05-21 02:32:48,39.98492163,-94.80163024,20,0,0,20,"Andrew, Missouri, United States"
"05-20-2020","48003","Andrews","Texas","United States",2020-05-21 02:32:48,32.30468633,-102.6376548,22,0,0,22,"Andrews, Texas, United States"
"05-20-2020","23001","Androscoggin","Maine","United States",2020-05-21 02:32:48,44.1664747,-70.20380627,185,2,0,183,"Androscoggin, Maine, United States"
"05-20-2020","48005","Angelina","Texas","United States",2020-05-21 02:32:48,31.25457347,-94.60901487,154,2,0,152,"Angelina, Texas, United States"
"05-20-2020","24003","Anne Arundel","Maryland","United States",2020-05-21 02:32:48,39.00670238,-76.60329337,3033,145,0,2888,"Anne Arundel, Maryland, United States"
"05-20-2020","27003","Anoka","Minnesota","United States",2020-05-21 02:32:48,45.27476015,-93.24604565,955,45,0,910,"Anoka, Minnesota, United States"
"05-20-2020","37007","Anson","North Carolina","United States",2020-05-21 02:32:48,34.97403241,-80.09953279,50,0,0,50,"Anson, North Carolina, United States"
"05-20-2020","31003","Antelope","Nebraska","United States",2020-05-21 02:32:48,42.17695516,-98.0666283,7,0,0,7,"Antelope, Nebraska, United States"
"05-20-2020","26009","Antrim","Michigan","United States",2020-05-21 02:32:48,44.99690221,-85.15503082,11,0,0,11,"Antrim, Michigan, United States"
"05-20-2020","04001","Apache","Arizona","United States",2020-05-21 02:32:48,35.39465006,-109.4892383,1080,22,0,1058,"Apache, Arizona, United States"
"05-20-2020","19007","Appanoose","Iowa","United States",2020-05-21 02:32:48,40.74324454,-92.86865906,8,3,0,5,"Appanoose, Iowa, United States"
"05-20-2020","13001","Appling","Georgia","United States",2020-05-21 02:32:48,31.74847232,-82.28909114,115,11,0,104,"Appling, Georgia, United States"
"05-20-2020","51011","Appomattox","Virginia","United States",2020-05-21 02:32:48,37.37569884,-78.81340003,24,0,0,24,"Appomattox, Virginia, United States"
"05-20-2020","48007","Aransas","Texas","United States",2020-05-21 02:32:48,28.10556197,-96.9995047,4,0,0,4,"Aransas, Texas, United States"
"05-20-2020","08005","Arapahoe","Colorado","United States",2020-05-21 02:32:48,39.64977461,-104.3353617,3889,272,0,3617,"Arapahoe, Colorado, United States"
"05-20-2020","48009","Archer","Texas","United States",2020-05-21 02:32:48,33.61569967,-98.68754589,1,0,0,1,"Archer, Texas, United States"
"05-20-2020","08007","Archuleta","Colorado","United States",2020-05-21 02:32:48,37.19474156,-107.0476867,8,0,0,8,"Archuleta, Colorado, United States"
"05-20-2020","26011","Arenac","Michigan","United States",2020-05-21 02:32:48,44.0636262,-83.89277559,32,1,0,31,"Arenac, Michigan, United States"
"05-20-2020","05001","Arkansas","Arkansas","United States",2020-05-21 02:32:48,34.29145151,-91.37277296,2,0,0,2,"Arkansas, Arkansas, United States"
"05-20-2020","51013","Arlington","Virginia","United States",2020-05-21 02:32:48,38.8767675,-77.10139853,1728,81,0,1647,"Arlington, Virginia, United States"
"05-20-2020","42005","Armstrong","Pennsylvania","United States",2020-05-21 02:32:48,40.81665618,-79.46290811,58,2,0,56,"Armstrong, Pennsylvania, United States"
"05-20-2020","48011","Armstrong","Texas","United States",2020-05-21 02:32:48,34.96507426,-101.3574874,2,0,0,2,"Armstrong, Texas, United States"
"05-20-2020","23003","Aroostook","Maine","United States",2020-05-21 02:32:48,46.65926321,-68.59841248,8,0,0,8,"Aroostook, Maine, United States"
"05-20-2020","31005","Arthur","Nebraska","United States",2020-05-21 02:32:48,41.56896142,-101.6959559,0,0,0,0,"Arthur, Nebraska, United States"
"05-20-2020","22005","Ascension","Louisiana","United States",2020-05-21 02:32:48,30.20406249,-90.9132841,768,52,0,716,"Ascension, Louisiana, United States"
"05-20-2020","37009","Ashe","North Carolina","United States",2020-05-21 02:32:48,36.43296207,-81.49862729,28,0,0,28,"Ashe, North Carolina, United States"
"05-20-2020","39005","Ashland","Ohio","United States",2020-05-21 02:32:48,40.84772277,-82.27280781,17,0,0,17,"Ashland, Ohio, United States"
"05-20-2020","55003","Ashland","Wisconsin","United States",2020-05-21 02:32:48,46.31956891,-90.67837132,2,0,0,2,"Ashland, Wisconsin, United States"
"05-20-2020","05003","Ashley","Arkansas","United States",2020-05-21 02:32:48,33.19153461,-91.7698471,19,0,0,19,"Ashley, Arkansas, United States"
"05-20-2020","39007","Ashtabula","Ohio","United States",2020-05-21 02:32:48,41.70860332,-80.74830218,250,28,0,222,"Ashtabula, Ohio, United States"
"05-20-2020","53003","Asotin","Washington","United States",2020-05-21 02:32:48,46.18894415,-117.2022851,18,2,0,16,"Asotin, Washington, United States"
"05-20-2020","22007","Assumption","Louisiana","United States",2020-05-21 02:32:48,29.89946234,-91.06461642,233,11,0,222,"Assumption, Louisiana, United States"
"05-20-2020","48013","Atascosa","Texas","United States",2020-05-21 02:32:48,28.89333001,-98.52730485,32,1,0,31,"Atascosa, Texas, United States"
"05-20-2020","20005","Atchison","Kansas","United States",2020-05-21 02:32:48,39.53185661,-95.30870026,17,0,0,17,"Atchison, Kansas, United States"
"05-20-2020","29005","Atchison","Missouri","United States",2020-05-21 02:32:48,40.43238737,-95.42970639,3,0,0,3,"Atchison, Missouri, United States"
"05-20-2020","39009","Athens","Ohio","United States",2020-05-21 02:32:48,39.33425634,-82.04278644,13,1,0,12,"Athens, Ohio, United States"
"05-20-2020","13003","Atkinson","Georgia","United States",2020-05-21 02:32:48,31.29633502,-82.87545866,24,2,0,22,"Atkinson, Georgia, United States"
"05-20-2020","34001","Atlantic","New Jersey","United States",2020-05-21 02:32:48,39.47538693,-74.65848483,1875,126,0,1749,"Atlantic, New Jersey, United States"
"05-20-2020","40005","Atoka","Oklahoma","United States",2020-05-21 02:32:48,34.37366573,-96.03802487,1,0,0,1,"Atoka, Oklahoma, United States"
"05-20-2020","28007","Attala","Mississippi","United States",2020-05-21 02:32:48,33.08658803,-89.57838564,259,10,0,249,"Attala, Mississippi, United States"
"05-20-2020","29007","Audrain","Missouri","United States",2020-05-21 02:32:48,39.215877,-91.84242683,18,0,0,18,"Audrain, Missouri, United States"
"05-20-2020","19009","Audubon","Iowa","United States",2020-05-21 02:32:48,41.6844628,-94.90581859,11,1,0,10,"Audubon, Iowa, United States"
"05-20-2020","39011","Auglaize","Ohio","United States",2020-05-21 02:32:48,40.55998859,-84.2242143,57,3,0,54,"Auglaize, Ohio, United States"
"05-20-2020","51015","Augusta","Virginia","United States",2020-05-21 02:32:48,38.16404586,-79.12461614,88,1,0,87,"Augusta, Virginia, United States"
"05-20-2020","46003","Aurora","South Dakota","United States",2020-05-21 02:32:48,43.71757685,-98.56050467,8,0,0,8,"Aurora, South Dakota, United States"
"05-20-2020","48015","Austin","Texas","United States",2020-05-21 02:32:48,29.88548725,-96.27736949,20,0,0,20,"Austin, Texas, United States"
"05-20-2020","01001","Autauga","Alabama","United States",2020-05-21 02:32:48,32.53952745,-86.64408227,136,3,0,133,"Autauga, Alabama, United States"
"05-20-2020","37011","Avery","North Carolina","United States",2020-05-21 02:32:48,36.07569796,-81.92308483,1,0,0,1,"Avery, North Carolina, United States"
"05-20-2020","22009","Avoyelles","Louisiana","United States",2020-05-21 02:32:48,31.07796211,-92.00079449,96,9,0,87,"Avoyelles, Louisiana, United States"
"05-20-2020","08009","Baca","Colorado","United States",2020-05-21 02:32:48,37.31940883,-102.5603223,12,0,0,12,"Baca, Colorado, United States"
"05-20-2020","13005","Bacon","Georgia","United States",2020-05-21 02:32:48,31.55456473,-82.45936528,68,2,0,66,"Bacon, Georgia, United States"
"05-20-2020","48017","Bailey","Texas","United States",2020-05-21 02:32:48,34.06854817,-102.8299707,10,0,0,10,"Bailey, Texas, United States"
"05-20-2020","12003","Baker","Florida","United States",2020-05-21 02:32:48,30.33060121,-82.28467476,26,3,0,23,"Baker, Florida, United States"
"05-20-2020","13007","Baker","Georgia","United States",2020-05-21 02:32:48,31.32669878,-84.44218806,32,2,0,30,"Baker, Georgia, United States"
"05-20-2020","41001","Baker","Oregon","United States",2020-05-21 02:32:48,44.70915557,-117.6749883,1,0,0,1,"Baker, Oregon, United States"
"05-20-2020","01003","Baldwin","Alabama","United States",2020-05-21 02:32:48,30.72774991,-87.72207058,270,8,0,262,"Baldwin, Alabama, United States"
"05-20-2020","13009","Baldwin","Georgia","United States",2020-05-21 02:32:48,33.06882326,-83.24701748,296,14,0,282,"Baldwin, Georgia, United States"
"05-20-2020","21007","Ballard","Kentucky","United States",2020-05-21 02:32:48,37.05842757,-88.99427697,9,0,0,9,"Ballard, Kentucky, United States"
"05-20-2020","24005","Baltimore","Maryland","United States",2020-05-21 02:32:48,39.45784712,-76.62911955,5025,277,0,4748,"Baltimore, Maryland, United States"
"05-20-2020","24510","Baltimore City","Maryland","United States",2020-05-21 02:32:48,39.30211911,-76.61151012,4152,215,0,3937,"Baltimore City, Maryland, United States"
"05-20-2020","45009","Bamberg","South Carolina","United States",2020-05-21 02:32:48,33.21927586,-81.05659969,18,0,0,18,"Bamberg, South Carolina, United States"
"05-20-2020","48019","Bandera","Texas","United States",2020-05-21 02:32:48,29.74619598,-99.24598147,6,0,0,6,"Bandera, Texas, United States"
"05-20-2020","13011","Banks","Georgia","United States",2020-05-21 02:32:48,34.35607081,-83.49644388,46,0,0,46,"Banks, Georgia, United States"
"05-20-2020","16005","Bannock","Idaho","United States",2020-05-21 02:32:48,42.67002716,-112.2233311,16,0,0,16,"Bannock, Idaho, United States"
"05-20-2020","26013","Baraga","Michigan","United States",2020-05-21 02:32:48,46.6720582,-88.36363591,1,0,0,1,"Baraga, Michigan, United States"
"05-20-2020","20007","Barber","Kansas","United States",2020-05-21 02:32:48,37.2288586,-98.68460053,1,0,0,1,"Barber, Kansas, United States"
"05-20-2020","01005","Barbour","Alabama","United States",2020-05-21 02:32:48,31.868263,-85.3871286,96,1,0,95,"Barbour, Alabama, United States"
"05-20-2020","54001","Barbour","West Virginia","United States",2020-05-21 02:32:48,39.1307219,-80.00350858,7,1,0,6,"Barbour, West Virginia, United States"
"05-20-2020","38003","Barnes","North Dakota","United States",2020-05-21 02:32:48,46.93579637,-98.06605978,4,0,0,4,"Barnes, North Dakota, United States"
"05-20-2020","25001","Barnstable","Massachusetts","United States",2020-05-21 02:32:48,41.72980578,-70.28854339,1197,98,0,1099,"Barnstable, Massachusetts, United States"
"05-20-2020","45011","Barnwell","South Carolina","United States",2020-05-21 02:32:48,33.26679302,-81.43584352,41,1,0,40,"Barnwell, South Carolina, United States"
"05-20-2020","21009","Barren","Kentucky","United States",2020-05-21 02:32:48,36.96469836,-85.93338945,38,0,0,38,"Barren, Kentucky, United States"
"05-20-2020","55005","Barron","Wisconsin","United States",2020-05-21 02:32:48,45.42372701,-91.84833627,11,0,0,11,"Barron, Wisconsin, United States"
"05-20-2020","13013","Barrow","Georgia","United States",2020-05-21 02:32:48,33.99148694,-83.71436292,272,8,0,264,"Barrow, Georgia, United States"
"05-20-2020","26015","Barry","Michigan","United States",2020-05-21 02:32:48,42.59513984,-85.30834519,57,1,0,56,"Barry, Michigan, United States"
"05-20-2020","29009","Barry","Missouri","United States",2020-05-21 02:32:48,36.70978521,-93.82919888,6,0,0,6,"Barry, Missouri, United States"
"05-20-2020","18005","Bartholomew","Indiana","United States",2020-05-21 02:32:48,39.20744865,-85.89558181,448,31,0,417,"Bartholomew, Indiana, United States"
"05-20-2020","20009","Barton","Kansas","United States",2020-05-21 02:32:48,38.47889676,-98.75636726,31,1,0,30,"Barton, Kansas, United States"
"05-20-2020","13015","Bartow","Georgia","United States",2020-05-21 02:32:48,34.23732119,-84.83887523,419,35,0,384,"Bartow, Georgia, United States"
"05-20-2020","48021","Bastrop","Texas","United States",2020-05-21 02:32:48,30.10370699,-97.31206354,152,2,0,150,"Bastrop, Texas, United States"
"05-20-2020","29013","Bates","Missouri","United States",2020-05-21 02:32:48,38.25271289,-94.34113157,7,1,0,6,"Bates, Missouri, United States"
"05-20-2020","21011","Bath","Kentucky","United States",2020-05-21 02:32:48,38.14735938,-83.74588932,7,1,0,6,"Bath, Kentucky, United States"
"05-20-2020","51017","Bath","Virginia","United States",2020-05-21 02:32:48,38.05852573,-79.73912095,0,0,0,0,"Bath, Virginia, United States"
"05-20-2020","05005","Baxter","Arkansas","United States",2020-05-21 02:32:48,36.28784385,-92.33782872,6,0,0,6,"Baxter, Arkansas, United States"
"05-20-2020","12005","Bay","Florida","United States",2020-05-21 02:32:48,30.26548745,-85.62122584,86,3,0,83,"Bay, Florida, United States"
"05-20-2020","26017","Bay","Michigan","United States",2020-05-21 02:32:48,43.70639106,-83.98731479,255,16,0,239,"Bay, Michigan, United States"
"05-20-2020","55007","Bayfield","Wisconsin","United States",2020-05-21 02:32:48,46.52868768,-91.19716729,3,1,0,2,"Bayfield, Wisconsin, United States"
"05-20-2020","46005","Beadle","South Dakota","United States",2020-05-21 02:32:48,44.41464384,-98.27858469,68,2,0,66,"Beadle, South Dakota, United States"
"05-20-2020",NA,"Bear River","Utah","United States",2020-05-21 02:32:48,41.52106798,-113.0832816,93,1,0,92,"Bear River, Utah, United States"
"05-20-2020","37013","Beaufort","North Carolina","United States",2020-05-21 02:32:48,35.48531943,-76.84325809,33,0,0,33,"Beaufort, North Carolina, United States"
"05-20-2020","45013","Beaufort","South Carolina","United States",2020-05-21 02:32:48,32.39226291,-80.72619758,304,12,0,292,"Beaufort, South Carolina, United States"
"05-20-2020","22011","Beauregard","Louisiana","United States",2020-05-21 02:32:48,30.64836518,-93.34173616,52,4,0,48,"Beauregard, Louisiana, United States"
"05-20-2020","40007","Beaver","Oklahoma","United States",2020-05-21 02:32:48,36.7496847,-100.4758872,23,0,0,23,"Beaver, Oklahoma, United States"
"05-20-2020","42007","Beaver","Pennsylvania","United States",2020-05-21 02:32:48,40.6825484,-80.34921611,539,70,0,469,"Beaver, Pennsylvania, United States"
"05-20-2020","30001","Beaverhead","Montana","United States",2020-05-21 02:32:48,45.13434354,-112.8984694,1,0,0,1,"Beaverhead, Montana, United States"
"05-20-2020","27005","Becker","Minnesota","United States",2020-05-21 02:32:48,46.93479392,-95.67158144,32,0,0,32,"Becker, Minnesota, United States"
"05-20-2020","40009","Beckham","Oklahoma","United States",2020-05-21 02:32:48,35.26862449,-99.68128023,6,0,0,6,"Beckham, Oklahoma, United States"
"05-20-2020","42009","Bedford","Pennsylvania","United States",2020-05-21 02:32:48,40.00522157,-78.48998442,32,2,0,30,"Bedford, Pennsylvania, United States"
"05-20-2020","47003","Bedford","Tennessee","United States",2020-05-21 02:32:48,35.51123746,-86.45549096,257,4,0,253,"Bedford, Tennessee, United States"
"05-20-2020","51019","Bedford","Virginia","United States",2020-05-21 02:32:48,37.3080028,-79.5281964,41,1,0,40,"Bedford, Virginia, United States"
"05-20-2020","48025","Bee","Texas","United States",2020-05-21 02:32:48,28.41761668,-97.74215593,7,0,0,7,"Bee, Texas, United States"
"05-20-2020","33001","Belknap","New Hampshire","United States",2020-05-21 02:32:48,43.51637314,-71.41684235,54,0,0,54,"Belknap, New Hampshire, United States"
"05-20-2020","21013","Bell","Kentucky","United States",2020-05-21 02:32:48,36.73355174,-83.67766671,1,0,0,1,"Bell, Kentucky, United States"
"05-20-2020","48027","Bell","Texas","United States",2020-05-21 02:32:48,31.03736027,-97.4785025,267,3,0,264,"Bell, Texas, United States"
"05-20-2020","39013","Belmont","Ohio","United States",2020-05-21 02:32:48,40.01625942,-80.9924051,352,11,0,341,"Belmont, Ohio, United States"
"05-20-2020","27007","Beltrami","Minnesota","United States",2020-05-21 02:32:48,47.97373527,-94.93732139,9,0,0,9,"Beltrami, Minnesota, United States"
"05-20-2020","13017","Ben Hill","Georgia","United States",2020-05-21 02:32:48,31.76095874,-83.22145359,48,1,0,47,"Ben Hill, Georgia, United States"
"05-20-2020","50003","Bennington","Vermont","United States",2020-05-21 02:32:48,43.03519828,-73.09048868,60,1,0,59,"Bennington, Vermont, United States"
"05-20-2020","38005","Benson","North Dakota","United States",2020-05-21 02:32:48,48.0683985,-99.35916363,1,0,0,1,"Benson, North Dakota, United States"
"05-20-2020","08011","Bent","Colorado","United States",2020-05-21 02:32:48,37.95474293,-103.0720195,1,0,0,1,"Bent, Colorado, United States"
"05-20-2020","05007","Benton","Arkansas","United States",2020-05-21 02:32:48,36.33644656,-94.25680817,163,0,0,163,"Benton, Arkansas, United States"
"05-20-2020","18007","Benton","Indiana","United States",2020-05-21 02:32:48,40.60626947,-87.31093999,24,0,0,24,"Benton, Indiana, United States"
"05-20-2020","19011","Benton","Iowa","United States",2020-05-21 02:32:48,42.08011739,-92.06463573,36,1,0,35,"Benton, Iowa, United States"
"05-20-2020","27009","Benton","Minnesota","United States",2020-05-21 02:32:48,45.69804958,-93.99514135,148,2,0,146,"Benton, Minnesota, United States"
"05-20-2020","28009","Benton","Mississippi","United States",2020-05-21 02:32:48,34.81681228,-89.18945516,13,0,0,13,"Benton, Mississippi, United States"
