"Date_Published","FIPS","Admin2","Province_State","Country_Region","Last_Update","Latitude","Longitude","Confirmed","Deaths","Recovered","Active","Combined_Key"
"06-05-2020","12119","Sumter","Florida","United States",2020-06-06 02:33:00,28.70181754,-82.0794267,261,17,0,244,"Sumter, Florida, United States"
"06-05-2020","13261","Sumter","Georgia","United States",2020-06-06 02:33:00,32.03650571,-84.19821492,493,45,0,448,"Sumter, Georgia, United States"
"06-05-2020","45085","Sumter","South Carolina","United States",2020-06-06 02:33:00,33.91826534,-80.37942316,426,19,0,407,"Sumter, South Carolina, United States"
"06-05-2020","28133","Sunflower","Mississippi","United States",2020-06-06 02:33:00,33.60192578,-90.58882684,96,3,0,93,"Sunflower, Mississippi, United States"
"06-05-2020","37171","Surry","North Carolina","United States",2020-06-06 02:33:00,36.41689489,-80.69102283,269,2,0,267,"Surry, North Carolina, United States"
"06-05-2020","51181","Surry","Virginia","United States",2020-06-06 02:33:00,37.11781893,-76.88450012,10,1,0,9,"Surry, Virginia, United States"
"06-05-2020","42115","Susquehanna","Pennsylvania","United States",2020-06-06 02:33:00,41.82147784,-75.80071959,124,16,0,108,"Susquehanna, Pennsylvania, United States"
"06-05-2020","10005","Sussex","Delaware","United States",2020-06-06 02:33:00,38.66143781,-75.39031349,4322,144,0,4178,"Sussex, Delaware, United States"
"06-05-2020","34037","Sussex","New Jersey","United States",2020-06-06 02:33:00,41.13891592,-74.69118243,1155,149,0,1006,"Sussex, New Jersey, United States"
"06-05-2020","51183","Sussex","Virginia","United States",2020-06-06 02:33:00,36.92432914,-77.25791182,174,2,0,172,"Sussex, Virginia, United States"
"06-05-2020","06101","Sutter","California","United States",2020-06-06 02:33:00,39.03417539,-121.6945899,51,2,0,49,"Sutter, California, United States"
"06-05-2020","12121","Suwannee","Florida","United States",2020-06-06 02:33:00,30.19746066,-82.9909967,174,18,0,156,"Suwannee, Florida, United States"
"06-05-2020","37173","Swain","North Carolina","United States",2020-06-06 02:33:00,35.48665845,-83.48748932,22,0,0,22,"Swain, North Carolina, United States"
"06-05-2020","56037","Sweetwater","Wyoming","United States",2020-06-06 02:33:00,41.65943896,-108.8827882,32,0,0,32,"Sweetwater, Wyoming, United States"
"06-05-2020","27151","Swift","Minnesota","United States",2020-06-06 02:33:00,45.2829032,-95.68264092,19,1,0,18,"Swift, Minnesota, United States"
"06-05-2020","48437","Swisher","Texas","United States",2020-06-06 02:33:00,34.53028891,-101.7349174,18,0,0,18,"Swisher, Texas, United States"
"06-05-2020","18155","Switzerland","Indiana","United States",2020-06-06 02:33:00,38.82767338,-85.03022429,22,0,0,22,"Switzerland, Indiana, United States"
"06-05-2020","13263","Talbot","Georgia","United States",2020-06-06 02:33:00,32.69642758,-84.53351366,40,2,0,38,"Talbot, Georgia, United States"
"06-05-2020","24041","Talbot","Maryland","United States",2020-06-06 02:33:00,38.76618159,-76.10882561,106,4,0,102,"Talbot, Maryland, United States"
"06-05-2020","13265","Taliaferro","Georgia","United States",2020-06-06 02:33:00,33.56543317,-82.88136816,1,0,0,1,"Taliaferro, Georgia, United States"
"06-05-2020","01121","Talladega","Alabama","United States",2020-06-06 02:33:00,33.37823223,-86.16886178,121,5,0,116,"Talladega, Alabama, United States"
"06-05-2020","28135","Tallahatchie","Mississippi","United States",2020-06-06 02:33:00,33.95339918,-90.1729398,31,1,0,30,"Tallahatchie, Mississippi, United States"
"06-05-2020","01123","Tallapoosa","Alabama","United States",2020-06-06 02:33:00,32.86698258,-85.79833053,435,66,0,369,"Tallapoosa, Alabama, United States"
"06-05-2020","19171","Tama","Iowa","United States",2020-06-06 02:33:00,42.07991767,-92.53266945,411,29,0,382,"Tama, Iowa, United States"
"06-05-2020","29213","Taney","Missouri","United States",2020-06-06 02:33:00,36.65465345,-93.04075153,14,2,0,12,"Taney, Missouri, United States"
"06-05-2020","22105","Tangipahoa","Louisiana","United States",2020-06-06 02:33:00,30.62888673,-90.40664996,916,39,0,877,"Tangipahoa, Louisiana, United States"
"06-05-2020","35055","Taos","New Mexico","United States",2020-06-06 02:33:00,36.58006022,-105.6310198,31,0,0,31,"Taos, New Mexico, United States"
"06-05-2020","48439","Tarrant","Texas","United States",2020-06-06 02:33:00,32.77143818,-97.29101614,5985,174,0,5811,"Tarrant, Texas, United States"
"06-05-2020","28137","Tate","Mississippi","United States",2020-06-06 02:33:00,34.65133709,-89.94485778,93,1,0,92,"Tate, Mississippi, United States"
"06-05-2020","13267","Tattnall","Georgia","United States",2020-06-06 02:33:00,32.04785085,-82.05539188,30,0,0,30,"Tattnall, Georgia, United States"
"06-05-2020","12123","Taylor","Florida","United States",2020-06-06 02:33:00,30.04848048,-83.60445406,27,0,0,27,"Taylor, Florida, United States"
"06-05-2020","13269","Taylor","Georgia","United States",2020-06-06 02:33:00,32.55792548,-84.25077141,23,2,0,21,"Taylor, Georgia, United States"
"06-05-2020","19173","Taylor","Iowa","United States",2020-06-06 02:33:00,40.73710579,-94.69778563,66,0,0,66,"Taylor, Iowa, United States"
"06-05-2020","21217","Taylor","Kentucky","United States",2020-06-06 02:33:00,37.3677562,-85.3329931,13,1,0,12,"Taylor, Kentucky, United States"
"06-05-2020","48441","Taylor","Texas","United States",2020-06-06 02:33:00,32.30163422,-99.89007449,245,5,0,240,"Taylor, Texas, United States"
"06-05-2020","54091","Taylor","West Virginia","United States",2020-06-06 02:33:00,39.33602617,-80.0421439,9,0,0,9,"Taylor, West Virginia, United States"
"06-05-2020","55119","Taylor","Wisconsin","United States",2020-06-06 02:33:00,45.21179252,-90.5004405,2,0,0,2,"Taylor, Wisconsin, United States"
"06-05-2020","17179","Tazewell","Illinois","United States",2020-06-06 02:33:00,40.50716185,-89.51404662,81,5,0,76,"Tazewell, Illinois, United States"
"06-05-2020","51185","Tazewell","Virginia","United States",2020-06-06 02:33:00,37.12191123,-81.56685568,9,0,0,9,"Tazewell, Virginia, United States"
"06-05-2020","06103","Tehama","California","United States",2020-06-06 02:33:00,40.12570935,-122.2370171,7,1,0,6,"Tehama, California, United States"
"06-05-2020","13271","Telfair","Georgia","United States",2020-06-06 02:33:00,31.92829517,-82.93491155,38,1,0,37,"Telfair, Georgia, United States"
"06-05-2020","08119","Teller","Colorado","United States",2020-06-06 02:33:00,38.88133511,-105.1614893,33,2,0,31,"Teller, Colorado, United States"
"06-05-2020","22107","Tensas","Louisiana","United States",2020-06-06 02:33:00,32.00760749,-91.32915234,20,0,0,20,"Tensas, Louisiana, United States"
"06-05-2020","22109","Terrebonne","Louisiana","United States",2020-06-06 02:33:00,29.37343766,-90.82626855,724,55,0,669,"Terrebonne, Louisiana, United States"
"06-05-2020","13273","Terrell","Georgia","United States",2020-06-06 02:33:00,31.77527543,-84.44069698,217,26,0,191,"Terrell, Georgia, United States"
"06-05-2020","48445","Terry","Texas","United States",2020-06-06 02:33:00,33.17402785,-102.3354521,13,0,0,13,"Terry, Texas, United States"
"06-05-2020","16081","Teton","Idaho","United States",2020-06-06 02:33:00,43.75303583,-111.2056773,11,0,0,11,"Teton, Idaho, United States"
"06-05-2020","56039","Teton","Wyoming","United States",2020-06-06 02:33:00,43.93522482,-110.5890801,100,0,0,100,"Teton, Wyoming, United States"
"06-05-2020","29215","Texas","Missouri","United States",2020-06-06 02:33:00,37.31728859,-91.96564727,1,0,0,1,"Texas, Missouri, United States"
"06-05-2020","40139","Texas","Oklahoma","United States",2020-06-06 02:33:00,36.74777635,-101.4889765,944,6,0,938,"Texas, Oklahoma, United States"
"06-05-2020","31169","Thayer","Nebraska","United States",2020-06-06 02:33:00,40.17626377,-97.59504381,1,0,0,1,"Thayer, Nebraska, United States"
"06-05-2020","13275","Thomas","Georgia","United States",2020-06-06 02:33:00,30.86392347,-83.91847289,350,33,0,317,"Thomas, Georgia, United States"
"06-05-2020","31171","Thomas","Nebraska","United States",2020-06-06 02:33:00,41.91358968,-100.5556632,1,0,0,1,"Thomas, Nebraska, United States"
"06-05-2020","48447","Throckmorton","Texas","United States",2020-06-06 02:33:00,33.17751417,-99.21226795,1,0,0,1,"Throckmorton, Texas, United States"
"06-05-2020","31173","Thurston","Nebraska","United States",2020-06-06 02:33:00,42.15725356,-96.54157099,50,0,0,50,"Thurston, Nebraska, United States"
"06-05-2020","53067","Thurston","Washington","United States",2020-06-06 02:33:00,46.9291895,-122.8290656,157,2,0,155,"Thurston, Washington, United States"
"06-05-2020","13277","Tift","Georgia","United States",2020-06-06 02:33:00,31.45743864,-83.5236119,291,19,0,272,"Tift, Georgia, United States"
"06-05-2020","41057","Tillamook","Oregon","United States",2020-06-06 02:33:00,45.46248721,-123.712066,6,0,0,6,"Tillamook, Oregon, United States"
"06-05-2020","40141","Tillman","Oklahoma","United States",2020-06-06 02:33:00,34.37288446,-98.92426619,23,1,0,22,"Tillman, Oklahoma, United States"
"06-05-2020","36107","Tioga","New York","United States",2020-06-06 02:33:00,42.16852837,-76.30835812,134,22,0,112,"Tioga, New York, United States"
"06-05-2020","42117","Tioga","Pennsylvania","United States",2020-06-06 02:33:00,41.77255149,-77.25433032,19,2,0,17,"Tioga, Pennsylvania, United States"
"06-05-2020","28139","Tippah","Mississippi","United States",2020-06-06 02:33:00,34.76872156,-88.90988194,76,11,0,65,"Tippah, Mississippi, United States"
"06-05-2020","18157","Tippecanoe","Indiana","United States",2020-06-06 02:33:00,40.38872739,-86.89413959,434,4,0,430,"Tippecanoe, Indiana, United States"
"06-05-2020","18159","Tipton","Indiana","United States",2020-06-06 02:33:00,40.31123252,-86.05234925,26,1,0,25,"Tipton, Indiana, United States"
"06-05-2020","47167","Tipton","Tennessee","United States",2020-06-06 02:33:00,35.501942,-89.73694895,467,3,0,464,"Tipton, Tennessee, United States"
"06-05-2020","28141","Tishomingo","Mississippi","United States",2020-06-06 02:33:00,34.74023475,-88.23917219,36,0,0,36,"Tishomingo, Mississippi, United States"
"06-05-2020","48449","Titus","Texas","United States",2020-06-06 02:33:00,33.21339719,-94.96797273,583,3,0,580,"Titus, Texas, United States"
"06-05-2020","21219","Todd","Kentucky","United States",2020-06-06 02:33:00,36.8381152,-87.17878374,23,0,0,23,"Todd, Kentucky, United States"
"06-05-2020","27153","Todd","Minnesota","United States",2020-06-06 02:33:00,46.06996226,-94.89785296,344,1,0,343,"Todd, Minnesota, United States"
"06-05-2020","46121","Todd","South Dakota","United States",2020-06-06 02:33:00,43.19338568,-100.7195503,33,1,0,32,"Todd, South Dakota, United States"
"06-05-2020","09013","Tolland","Connecticut","United States",2020-06-06 02:33:00,41.85853803,-72.3308481,859,60,0,799,"Tolland, Connecticut, United States"
"06-05-2020","48451","Tom Green","Texas","United States",2020-06-06 02:33:00,31.40464436,-100.462443,109,1,0,108,"Tom Green, Texas, United States"
"06-05-2020","36109","Tompkins","New York","United States",2020-06-06 02:33:00,42.44945765,-76.47229843,167,0,0,167,"Tompkins, New York, United States"
"06-05-2020","49045","Tooele","Utah","United States",2020-06-06 02:33:00,40.44862644,-113.1295715,144,0,0,144,"Tooele, Utah, United States"
"06-05-2020","30101","Toole","Montana","United States",2020-06-06 02:33:00,48.65577551,-111.6942414,29,6,0,23,"Toole, Montana, United States"
"06-05-2020","13279","Toombs","Georgia","United States",2020-06-06 02:33:00,32.12059861,-82.32957247,62,4,0,58,"Toombs, Georgia, United States"
"06-05-2020","35057","Torrance","New Mexico","United States",2020-06-06 02:33:00,34.64048375,-105.8508949,34,1,0,33,"Torrance, New Mexico, United States"
"06-05-2020","13281","Towns","Georgia","United States",2020-06-06 02:33:00,34.91369188,-83.7410746,29,1,0,28,"Towns, Georgia, United States"
"06-05-2020","38097","Traill","North Dakota","United States",2020-06-06 02:33:00,47.45367788,-97.16323288,14,0,0,14,"Traill, North Dakota, United States"
"06-05-2020","37175","Transylvania","North Carolina","United States",2020-06-06 02:33:00,35.20383864,-82.79638423,16,1,0,15,"Transylvania, North Carolina, United States"
"06-05-2020","27155","Traverse","Minnesota","United States",2020-06-06 02:33:00,45.77298854,-96.47062949,4,0,0,4,"Traverse, Minnesota, United States"
"06-05-2020","48453","Travis","Texas","United States",2020-06-06 02:33:00,30.33432034,-97.7853562,3562,95,0,3467,"Travis, Texas, United States"
"06-05-2020","20195","Trego","Kansas","United States",2020-06-06 02:33:00,38.91467218,-99.87284448,1,0,0,1,"Trego, Kansas, United States"
"06-05-2020","55121","Trempealeau","Wisconsin","United States",2020-06-06 02:33:00,44.30360275,-91.35893614,32,0,0,32,"Trempealeau, Wisconsin, United States"
"06-05-2020","13283","Treutlen","Georgia","United States",2020-06-06 02:33:00,32.40422134,-82.56904553,14,0,0,14,"Treutlen, Georgia, United States"
"06-05-2020",NA,"TriCounty","Utah","United States",2020-06-06 02:33:00,40.12491499,-109.5174415,20,0,0,20,"TriCounty, Utah, United States"
"06-05-2020","21221","Trigg","Kentucky","United States",2020-06-06 02:33:00,36.80767017,-87.87333656,11,0,0,11,"Trigg, Kentucky, United States"
"06-05-2020","21223","Trimble","Kentucky","United States",2020-06-06 02:33:00,38.61056487,-85.33775972,6,0,0,6,"Trimble, Kentucky, United States"
"06-05-2020","06105","Trinity","California","United States",2020-06-06 02:33:00,40.6491767,-123.114713,2,0,0,2,"Trinity, California, United States"
"06-05-2020","48455","Trinity","Texas","United States",2020-06-06 02:33:00,31.0879489,-95.1367187,20,0,0,20,"Trinity, Texas, United States"
"06-05-2020","46123","Tripp","South Dakota","United States",2020-06-06 02:33:00,43.34459388,-99.8854891,6,0,0,6,"Tripp, South Dakota, United States"
"06-05-2020","13285","Troup","Georgia","United States",2020-06-06 02:33:00,33.03349196,-85.02812115,395,11,0,384,"Troup, Georgia, United States"
"06-05-2020","47169","Trousdale","Tennessee","United States",2020-06-06 02:33:00,36.39026213,-86.16087954,1394,4,0,1390,"Trousdale, Tennessee, United States"
"06-05-2020","39155","Trumbull","Ohio","United States",2020-06-06 02:33:00,41.31735028,-80.76109643,600,52,0,548,"Trumbull, Ohio, United States"
"06-05-2020","54093","Tucker","West Virginia","United States",2020-06-06 02:33:00,39.11240885,-79.57053576,4,0,0,4,"Tucker, West Virginia, United States"
"06-05-2020","06107","Tulare","California","United States",2020-06-06 02:33:00,36.22026558,-118.8020203,2116,92,0,2024,"Tulare, California, United States"
"06-05-2020","40143","Tulsa","Oklahoma","United States",2020-06-06 02:33:00,36.11939621,-95.94013939,1134,59,0,1075,"Tulsa, Oklahoma, United States"
"06-05-2020","28143","Tunica","Mississippi","United States",2020-06-06 02:33:00,34.64967704,-90.37481167,58,3,0,55,"Tunica, Mississippi, United States"
"06-05-2020","06109","Tuolumne","California","United States",2020-06-06 02:33:00,38.02644018,-119.9525093,5,0,0,5,"Tuolumne, California, United States"
"06-05-2020","13287","Turner","Georgia","United States",2020-06-06 02:33:00,31.71612656,-83.62069378,139,13,0,126,"Turner, Georgia, United States"
"06-05-2020","46125","Turner","South Dakota","United States",2020-06-06 02:33:00,43.3109081,-97.14865776,25,0,0,25,"Turner, South Dakota, United States"
"06-05-2020","01125","Tuscaloosa","Alabama","United States",2020-06-06 02:33:00,33.28726072,-87.52556818,853,16,0,837,"Tuscaloosa, Alabama, United States"
"06-05-2020","39157","Tuscarawas","Ohio","United States",2020-06-06 02:33:00,40.44214695,-81.47226262,371,4,0,367,"Tuscarawas, Ohio, United States"
"06-05-2020","26157","Tuscola","Michigan","United States",2020-06-06 02:33:00,43.46606813,-83.41897025,195,25,0,170,"Tuscola, Michigan, United States"
"06-05-2020","13289","Twiggs","Georgia","United States",2020-06-06 02:33:00,32.67435595,-83.43078662,18,1,0,17,"Twiggs, Georgia, United States"
"06-05-2020","16083","Twin Falls","Idaho","United States",2020-06-06 02:33:00,42.35440512,-114.6685381,437,23,0,414,"Twin Falls, Idaho, United States"
"06-05-2020","48457","Tyler","Texas","United States",2020-06-06 02:33:00,30.77031716,-94.37690895,14,0,0,14,"Tyler, Texas, United States"
"06-05-2020","54095","Tyler","West Virginia","United States",2020-06-06 02:33:00,39.46811972,-80.88772676,3,0,0,3,"Tyler, West Virginia, United States"
"06-05-2020","37177","Tyrrell","North Carolina","United States",2020-06-06 02:33:00,35.87147226,-76.17055253,4,0,0,4,"Tyrrell, North Carolina, United States"
"06-05-2020","56041","Uinta","Wyoming","United States",2020-06-06 02:33:00,41.2878183,-110.5475782,19,0,0,19,"Uinta, Wyoming, United States"
"06-05-2020","36111","Ulster","New York","United States",2020-06-06 02:33:00,41.89027881,-74.26252104,1711,77,0,1634,"Ulster, New York, United States"
"06-05-2020","41059","Umatilla","Oregon","United States",2020-06-06 02:33:00,45.59073056,-118.7353826,125,3,0,122,"Umatilla, Oregon, United States"
"06-05-2020","90001","Unassigned","Alabama","United States",2020-06-06 02:33:00,NA,NA,314,4,0,310,"Unassigned, Alabama, United States"
"06-05-2020","90002","Unassigned","Alaska","United States",2020-06-06 02:33:00,NA,NA,0,0,0,0,"Unassigned, Alaska, United States"
"06-05-2020","90004","Unassigned","Arizona","United States",2020-06-06 02:33:00,NA,NA,0,2,0,NA,"Unassigned, Arizona, United States"
"06-05-2020","90005","Unassigned","Arkansas","United States",2020-06-06 02:33:00,NA,NA,244,0,0,244,"Unassigned, Arkansas, United States"
"06-05-2020","90006","Unassigned","California","United States",2020-06-06 02:33:00,NA,NA,0,0,0,0,"Unassigned, California, United States"
"06-05-2020","90009","Unassigned","Connecticut","United States",2020-06-06 02:33:00,NA,NA,245,0,0,245,"Unassigned, Connecticut, United States"
"06-05-2020","90010","Unassigned","Delaware","United States",2020-06-06 02:33:00,NA,NA,49,0,0,49,"Unassigned, Delaware, United States"
"06-05-2020","90012","Unassigned","Florida","United States",2020-06-06 02:33:00,NA,NA,95,0,0,95,"Unassigned, Florida, United States"
"06-05-2020","90013","Unassigned","Georgia","United States",2020-06-06 02:33:00,NA,NA,1043,2,0,1041,"Unassigned, Georgia, United States"
"06-05-2020","90015","Unassigned","Hawaii","United States",2020-06-06 02:33:00,NA,NA,0,0,0,0,"Unassigned, Hawaii, United States"
"06-05-2020","90016","Unassigned","Idaho","United States",2020-06-06 02:33:00,NA,NA,0,0,0,0,"Unassigned, Idaho, United States"
"06-05-2020","90017","Unassigned","Illinois","United States",2020-06-06 02:33:00,NA,NA,90,0,0,90,"Unassigned, Illinois, United States"
"06-05-2020","90018","Unassigned","Indiana","United States",2020-06-06 02:33:00,NA,NA,0,180,0,NA,"Unassigned, Indiana, United States"
"06-05-2020","90019","Unassigned","Iowa","United States",2020-06-06 02:33:00,NA,NA,2,0,0,2,"Unassigned, Iowa, United States"
"06-05-2020","90020","Unassigned","Kansas","United States",2020-06-06 02:33:00,NA,NA,0,0,0,0,"Unassigned, Kansas, United States"
"06-05-2020","90021","Unassigned","Kentucky","United States",2020-06-06 02:33:00,NA,NA,9,0,0,9,"Unassigned, Kentucky, United States"
"06-05-2020","90022","Unassigned","Louisiana","United States",2020-06-06 02:33:00,NA,NA,88,111,0,NA,"Unassigned, Louisiana, United States"
"06-05-2020","90023","Unassigned","Maine","United States",2020-06-06 02:33:00,NA,NA,4,0,0,4,"Unassigned, Maine, United States"
"06-05-2020","90024","Unassigned","Maryland","United States",2020-06-06 02:33:00,NA,NA,0,41,0,NA,"Unassigned, Maryland, United States"
"06-05-2020","90025","Unassigned","Massachusetts","United States",2020-06-06 02:33:00,NA,NA,313,7,0,306,"Unassigned, Massachusetts, United States"
"06-05-2020","90026","Unassigned","Michigan","United States",2020-06-06 02:33:00,NA,NA,104,2,0,102,"Unassigned, Michigan, United States"
"06-05-2020","90027","Unassigned","Minnesota","United States",2020-06-06 02:33:00,NA,NA,96,11,0,85,"Unassigned, Minnesota, United States"
"06-05-2020","90028","Unassigned","Mississippi","United States",2020-06-06 02:33:00,NA,NA,0,0,0,0,"Unassigned, Mississippi, United States"
"06-05-2020","90029","Unassigned","Missouri","United States",2020-06-06 02:33:00,NA,NA,0,0,0,0,"Unassigned, Missouri, United States"
"06-05-2020","90030","Unassigned","Montana","United States",2020-06-06 02:33:00,NA,NA,0,0,0,0,"Unassigned, Montana, United States"
"06-05-2020","90031","Unassigned","Nebraska","United States",2020-06-06 02:33:00,NA,NA,217,0,0,217,"Unassigned, Nebraska, United States"
"06-05-2020","90032","Unassigned","Nevada","United States",2020-06-06 02:33:00,NA,NA,0,0,0,0,"Unassigned, Nevada, United States"
"06-05-2020","90033","Unassigned","New Hampshire","United States",2020-06-06 02:33:00,NA,NA,85,5,0,80,"Unassigned, New Hampshire, United States"
"06-05-2020","90034","Unassigned","New Jersey","United States",2020-06-06 02:33:00,NA,NA,403,0,0,403,"Unassigned, New Jersey, United States"
"06-05-2020","90035","Unassigned","New Mexico","United States",2020-06-06 02:33:00,NA,NA,605,0,0,605,"Unassigned, New Mexico, United States"
"06-05-2020","90036","Unassigned","New York","United States",2020-06-06 02:33:00,NA,NA,0,0,0,0,"Unassigned, New York, United States"
"06-05-2020","90037","Unassigned","North Carolina","United States",2020-06-06 02:33:00,NA,NA,0,0,0,0,"Unassigned, North Carolina, United States"
"06-05-2020","90038","Unassigned","North Dakota","United States",2020-06-06 02:33:00,NA,NA,0,0,0,0,"Unassigned, North Dakota, United States"
"06-05-2020","90039","Unassigned","Ohio","United States",2020-06-06 02:33:00,NA,NA,0,0,0,0,"Unassigned, Ohio, United States"
"06-05-2020","90040","Unassigned","Oklahoma","United States",2020-06-06 02:33:00,NA,NA,0,0,0,0,"Unassigned, Oklahoma, United States"
"06-05-2020","90041","Unassigned","Oregon","United States",2020-06-06 02:33:00,NA,NA,0,0,0,0,"Unassigned, Oregon, United States"
"06-05-2020","90042","Unassigned","Pennsylvania","United States",2020-06-06 02:33:00,NA,NA,0,0,0,0,"Unassigned, Pennsylvania, United States"
"06-05-2020","90044","Unassigned","Rhode Island","United States",2020-06-06 02:33:00,NA,NA,2370,772,0,1598,"Unassigned, Rhode Island, United States"
"06-05-2020","90045","Unassigned","South Carolina","United States",2020-06-06 02:33:00,NA,NA,0,0,0,0,"Unassigned, South Carolina, United States"
"06-05-2020","90046","Unassigned","South Dakota","United States",2020-06-06 02:33:00,NA,NA,0,0,0,0,"Unassigned, South Dakota, United States"
"06-05-2020","90047","Unassigned","Tennessee","United States",2020-06-06 02:33:00,NA,NA,161,0,0,161,"Unassigned, Tennessee, United States"
"06-05-2020","90048","Unassigned","Texas","United States",2020-06-06 02:33:00,NA,NA,0,0,0,0,"Unassigned, Texas, United States"
"06-05-2020","90049","Unassigned","Utah","United States",2020-06-06 02:33:00,NA,NA,0,0,0,0,"Unassigned, Utah, United States"
"06-05-2020","90050","Unassigned","Vermont","United States",2020-06-06 02:33:00,NA,NA,5,0,0,5,"Unassigned, Vermont, United States"
"06-05-2020","90051","Unassigned","Virginia","United States",2020-06-06 02:33:00,NA,NA,0,0,0,0,"Unassigned, Virginia, United States"
"06-05-2020","90053","Unassigned","Washington","United States",2020-06-06 02:33:00,NA,NA,19,0,0,19,"Unassigned, Washington, United States"
"06-05-2020","90054","Unassigned","West Virginia","United States",2020-06-06 02:33:00,NA,NA,0,0,0,0,"Unassigned, West Virginia, United States"
"06-05-2020","90055","Unassigned","Wisconsin","United States",2020-06-06 02:33:00,NA,NA,0,0,0,0,"Unassigned, Wisconsin, United States"
"06-05-2020","90056","Unassigned","Wyoming","United States",2020-06-06 02:33:00,NA,NA,0,16,0,NA,"Unassigned, Wyoming, United States"
"06-05-2020","47171","Unicoi","Tennessee","United States",2020-06-06 02:33:00,36.10890856,-82.43709629,49,0,0,49,"Unicoi, Tennessee, United States"
"06-05-2020","05139","Union","Arkansas","United States",2020-06-06 02:33:00,33.16887091,-92.59746952,185,11,0,174,"Union, Arkansas, United States"
"06-05-2020","12125","Union","Florida","United States",2020-06-06 02:33:00,30.04412971,-82.37497443,34,1,0,33,"Union, Florida, United States"
"06-05-2020","13291","Union","Georgia","United States",2020-06-06 02:33:00,34.82995757,-83.98967069,48,1,0,47,"Union, Georgia, United States"
"06-05-2020","17181","Union","Illinois","United States",2020-06-06 02:33:00,37.47119609,-89.25548938,171,14,0,157,"Union, Illinois, United States"
"06-05-2020","18161","Union","Indiana","United States",2020-06-06 02:33:00,39.62550777,-84.92497066,10,0,0,10,"Union, Indiana, United States"
"06-05-2020","19175","Union","Iowa","United States",2020-06-06 02:33:00,41.0277278,-94.24234847,10,0,0,10,"Union, Iowa, United States"
"06-05-2020","21225","Union","Kentucky","United States",2020-06-06 02:33:00,37.66166713,-87.94300009,15,0,0,15,"Union, Kentucky, United States"
"06-05-2020","22111","Union","Louisiana","United States",2020-06-06 02:33:00,32.83121059,-92.3749373,343,20,0,323,"Union, Louisiana, United States"
"06-05-2020","28145","Union","Mississippi","United States",2020-06-06 02:33:00,34.49162015,-89.00776006,89,7,0,82,"Union, Mississippi, United States"
"06-05-2020","34039","Union","New Jersey","United States",2020-06-06 02:33:00,40.65835409,-74.30680092,16038,1092,0,14946,"Union, New Jersey, United States"
"06-05-2020","35059","Union","New Mexico","United States",2020-06-06 02:33:00,36.48126404,-103.4709624,5,0,0,5,"Union, New Mexico, United States"
"06-05-2020","37179","Union","North Carolina","United States",2020-06-06 02:33:00,34.98960527,-80.52955873,540,21,0,519,"Union, North Carolina, United States"
"06-05-2020","39159","Union","Ohio","United States",2020-06-06 02:33:00,40.30016061,-83.37239023,56,1,0,55,"Union, Ohio, United States"
"06-05-2020","41061","Union","Oregon","United States",2020-06-06 02:33:00,45.30915495,-118.0068979,6,0,0,6,"Union, Oregon, United States"
"06-05-2020","42119","Union","Pennsylvania","United States",2020-06-06 02:33:00,40.96188846,-77.05996014,70,1,0,69,"Union, Pennsylvania, United States"
"06-05-2020","45087","Union","South Carolina","United States",2020-06-06 02:33:00,34.68835752,-81.61730349,40,0,0,40,"Union, South Carolina, United States"
