"Date_Published","FIPS","Admin2","Province_State","Country_Region","Last_Update","Latitude","Longitude","Confirmed","Deaths","Recovered","Active","Combined_Key"
"06-05-2020","26105","Mason","Michigan","United States",2020-06-06 02:33:00,43.99509218,-86.24988902,38,0,0,38,"Mason, Michigan, United States"
"06-05-2020","48319","Mason","Texas","United States",2020-06-06 02:33:00,30.71780434,-99.22629416,32,0,0,32,"Mason, Texas, United States"
"06-05-2020","53045","Mason","Washington","United States",2020-06-06 02:33:00,47.35007586,-123.1863685,37,1,0,36,"Mason, Washington, United States"
"06-05-2020","54053","Mason","West Virginia","United States",2020-06-06 02:33:00,38.77071799,-82.02524219,15,0,0,15,"Mason, West Virginia, United States"
"06-05-2020","17127","Massac","Illinois","United States",2020-06-06 02:33:00,37.22078441,-88.71036614,7,0,0,7,"Massac, Illinois, United States"
"06-05-2020","48321","Matagorda","Texas","United States",2020-06-06 02:33:00,28.81955746,-96.01230294,71,5,0,66,"Matagorda, Texas, United States"
"06-05-2020","02170","Matanuska-Susitna","Alaska","United States",2020-06-06 02:33:00,62.31305045,-149.5741743,35,1,0,34,"Matanuska-Susitna, Alaska, United States"
"06-05-2020","51115","Mathews","Virginia","United States",2020-06-06 02:33:00,37.44164146,-76.34098896,5,0,0,5,"Mathews, Virginia, United States"
"06-05-2020","15009","Maui","Hawaii","United States",2020-06-06 02:33:00,20.86399628,-156.5689097,120,6,0,114,"Maui, Hawaii, United States"
"06-05-2020","47119","Maury","Tennessee","United States",2020-06-06 02:33:00,35.6187413,-87.07462444,108,1,0,107,"Maury, Tennessee, United States"
"06-05-2020","48323","Maverick","Texas","United States",2020-06-06 02:33:00,28.7429195,-100.3157686,129,1,0,128,"Maverick, Texas, United States"
"06-05-2020","40097","Mayes","Oklahoma","United States",2020-06-06 02:33:00,36.30179091,-95.23175116,31,4,0,27,"Mayes, Oklahoma, United States"
"06-05-2020","40087","McClain","Oklahoma","United States",2020-06-06 02:33:00,35.01123903,-97.44572302,109,3,0,106,"McClain, Oklahoma, United States"
"06-05-2020","46087","McCook","South Dakota","United States",2020-06-06 02:33:00,43.6742571,-97.36863144,6,1,0,5,"McCook, South Dakota, United States"
"06-05-2020","45065","McCormick","South Carolina","United States",2020-06-06 02:33:00,33.90161443,-82.30794338,10,1,0,9,"McCormick, South Carolina, United States"
"06-05-2020","21145","McCracken","Kentucky","United States",2020-06-06 02:33:00,37.05350953,-88.70445755,111,2,0,109,"McCracken, Kentucky, United States"
"06-05-2020","21147","McCreary","Kentucky","United States",2020-06-06 02:33:00,36.73874143,-84.48102924,13,0,0,13,"McCreary, Kentucky, United States"
"06-05-2020","48307","McCulloch","Texas","United States",2020-06-06 02:33:00,31.1925468,-99.34682807,3,0,0,3,"McCulloch, Texas, United States"
"06-05-2020","40089","McCurtain","Oklahoma","United States",2020-06-06 02:33:00,34.11664328,-94.77222373,79,1,0,78,"McCurtain, Oklahoma, United States"
"06-05-2020","29119","McDonald","Missouri","United States",2020-06-06 02:33:00,36.62869595,-94.34867205,23,0,0,23,"McDonald, Missouri, United States"
"06-05-2020","17109","McDonough","Illinois","United States",2020-06-06 02:33:00,40.45674722,-90.67775541,91,13,0,78,"McDonough, Illinois, United States"
"06-05-2020","37111","McDowell","North Carolina","United States",2020-06-06 02:33:00,35.67736232,-82.0482425,86,1,0,85,"McDowell, North Carolina, United States"
"06-05-2020","54047","McDowell","West Virginia","United States",2020-06-06 02:33:00,37.38002939,-81.65083669,6,0,0,6,"McDowell, West Virginia, United States"
"06-05-2020","13189","McDuffie","Georgia","United States",2020-06-06 02:33:00,33.47851918,-82.48252774,72,5,0,67,"McDuffie, Georgia, United States"
"06-05-2020","17111","McHenry","Illinois","United States",2020-06-06 02:33:00,42.32451172,-88.45248227,1677,79,0,1598,"McHenry, Illinois, United States"
"06-05-2020","38049","McHenry","North Dakota","United States",2020-06-06 02:33:00,48.23104458,-100.6324822,2,1,0,1,"McHenry, North Dakota, United States"
"06-05-2020","13191","McIntosh","Georgia","United States",2020-06-06 02:33:00,31.49683595,-81.40163426,15,1,0,14,"McIntosh, Georgia, United States"
"06-05-2020","38051","McIntosh","North Dakota","United States",2020-06-06 02:33:00,46.11182017,-99.44145858,1,0,0,1,"McIntosh, North Dakota, United States"
"06-05-2020","40091","McIntosh","Oklahoma","United States",2020-06-06 02:33:00,35.37235506,-95.66599306,14,1,0,13,"McIntosh, Oklahoma, United States"
"06-05-2020","42083","McKean","Pennsylvania","United States",2020-06-06 02:33:00,41.80938602,-78.56478358,13,1,0,12,"McKean, Pennsylvania, United States"
"06-05-2020","38053","McKenzie","North Dakota","United States",2020-06-06 02:33:00,47.7413337,-103.395905,18,0,0,18,"McKenzie, North Dakota, United States"
"06-05-2020","35031","McKinley","New Mexico","United States",2020-06-06 02:33:00,35.5800772,-108.262245,2617,125,0,2492,"McKinley, New Mexico, United States"
"06-05-2020","17113","McLean","Illinois","United States",2020-06-06 02:33:00,40.48996987,-88.84621113,226,13,0,213,"McLean, Illinois, United States"
"06-05-2020","21149","McLean","Kentucky","United States",2020-06-06 02:33:00,37.5301951,-87.26803443,22,1,0,21,"McLean, Kentucky, United States"
"06-05-2020","38055","McLean","North Dakota","United States",2020-06-06 02:33:00,47.60766714,-101.3182418,7,0,0,7,"McLean, North Dakota, United States"
"06-05-2020","48309","McLennan","Texas","United States",2020-06-06 02:33:00,31.55255453,-97.20217694,125,4,0,121,"McLennan, Texas, United States"
"06-05-2020","27085","McLeod","Minnesota","United States",2020-06-06 02:33:00,44.82367677,-94.27287017,41,0,0,41,"McLeod, Minnesota, United States"
"06-05-2020","47107","McMinn","Tennessee","United States",2020-06-06 02:33:00,35.42812616,-84.61520715,146,14,0,132,"McMinn, Tennessee, United States"
"06-05-2020","47109","McNairy","Tennessee","United States",2020-06-06 02:33:00,35.17468549,-88.5647812,15,0,0,15,"McNairy, Tennessee, United States"
"06-05-2020","20113","McPherson","Kansas","United States",2020-06-06 02:33:00,38.39184858,-97.64769869,30,0,0,30,"McPherson, Kansas, United States"
"06-05-2020","31117","McPherson","Nebraska","United States",2020-06-06 02:33:00,41.56797682,-101.0599362,0,0,0,0,"McPherson, Nebraska, United States"
"06-05-2020","46089","McPherson","South Dakota","United States",2020-06-06 02:33:00,45.76626028,-99.22118798,1,0,0,1,"McPherson, South Dakota, United States"
"06-05-2020","20119","Meade","Kansas","United States",2020-06-06 02:33:00,37.23859987,-100.364831,30,0,0,30,"Meade, Kansas, United States"
"06-05-2020","21163","Meade","Kentucky","United States",2020-06-06 02:33:00,37.96163597,-86.21028219,23,2,0,21,"Meade, Kentucky, United States"
"06-05-2020","46093","Meade","South Dakota","United States",2020-06-06 02:33:00,44.56676791,-102.7162741,24,0,0,24,"Meade, South Dakota, United States"
"06-05-2020","30059","Meagher","Montana","United States",2020-06-06 02:33:00,46.59907074,-110.8898557,1,0,0,1,"Meagher, Montana, United States"
"06-05-2020","37119","Mecklenburg","North Carolina","United States",2020-06-06 02:33:00,35.24469268,-80.8317671,5057,102,0,4955,"Mecklenburg, North Carolina, United States"
"06-05-2020","51117","Mecklenburg","Virginia","United States",2020-06-06 02:33:00,36.67882005,-78.36131056,220,23,0,197,"Mecklenburg, Virginia, United States"
"06-05-2020","26107","Mecosta","Michigan","United States",2020-06-06 02:33:00,43.64064262,-85.32463223,24,2,0,22,"Mecosta, Michigan, United States"
"06-05-2020","39103","Medina","Ohio","United States",2020-06-06 02:33:00,41.11770589,-81.8998621,376,24,0,352,"Medina, Ohio, United States"
"06-05-2020","48325","Medina","Texas","United States",2020-06-06 02:33:00,29.3557301,-99.11030298,78,2,0,76,"Medina, Texas, United States"
"06-05-2020","27093","Meeker","Minnesota","United States",2020-06-06 02:33:00,45.12328869,-94.52839455,46,0,0,46,"Meeker, Minnesota, United States"
"06-05-2020","39105","Meigs","Ohio","United States",2020-06-06 02:33:00,39.09224872,-82.0305041,6,0,0,6,"Meigs, Ohio, United States"
"06-05-2020","47121","Meigs","Tennessee","United States",2020-06-06 02:33:00,35.51558739,-84.81482914,27,0,0,27,"Meigs, Tennessee, United States"
"06-05-2020","17129","Menard","Illinois","United States",2020-06-06 02:33:00,40.02742725,-89.80246001,22,0,0,22,"Menard, Illinois, United States"
"06-05-2020","06045","Mendocino","California","United States",2020-06-06 02:33:00,39.4381191,-123.3911313,33,0,0,33,"Mendocino, California, United States"
"06-05-2020","21165","Menifee","Kentucky","United States",2020-06-06 02:33:00,37.94090733,-83.59985712,10,0,0,10,"Menifee, Kentucky, United States"
"06-05-2020","26109","Menominee","Michigan","United States",2020-06-06 02:33:00,45.58038692,-87.55370409,8,0,0,8,"Menominee, Michigan, United States"
"06-05-2020","55078","Menominee","Wisconsin","United States",2020-06-06 02:33:00,45.00422544,-88.70950714,3,0,0,3,"Menominee, Wisconsin, United States"
"06-05-2020","06047","Merced","California","United States",2020-06-06 02:33:00,37.18922369,-120.7209035,320,7,0,313,"Merced, California, United States"
"06-05-2020","17131","Mercer","Illinois","United States",2020-06-06 02:33:00,41.20596782,-90.74290052,18,0,0,18,"Mercer, Illinois, United States"
"06-05-2020","21167","Mercer","Kentucky","United States",2020-06-06 02:33:00,37.81474237,-84.87488475,15,0,0,15,"Mercer, Kentucky, United States"
"06-05-2020","34021","Mercer","New Jersey","United States",2020-06-06 02:33:00,40.28047017,-74.70479631,7120,499,0,6621,"Mercer, New Jersey, United States"
"06-05-2020","38057","Mercer","North Dakota","United States",2020-06-06 02:33:00,47.31213126,-101.8318399,6,0,0,6,"Mercer, North Dakota, United States"
"06-05-2020","39107","Mercer","Ohio","United States",2020-06-06 02:33:00,40.54043046,-84.62912742,227,8,0,219,"Mercer, Ohio, United States"
"06-05-2020","42085","Mercer","Pennsylvania","United States",2020-06-06 02:33:00,41.30248872,-80.25816981,110,6,0,104,"Mercer, Pennsylvania, United States"
"06-05-2020","54055","Mercer","West Virginia","United States",2020-06-06 02:33:00,37.40481169,-81.11023142,13,0,0,13,"Mercer, West Virginia, United States"
"06-05-2020","13199","Meriwether","Georgia","United States",2020-06-06 02:33:00,33.04163534,-84.68859732,105,2,0,103,"Meriwether, Georgia, United States"
"06-05-2020","31121","Merrick","Nebraska","United States",2020-06-06 02:33:00,41.16624273,-98.0374887,34,0,0,34,"Merrick, Nebraska, United States"
"06-05-2020","33013","Merrimack","New Hampshire","United States",2020-06-06 02:33:00,43.29662971,-71.6811573,359,18,0,341,"Merrimack, New Hampshire, United States"
"06-05-2020","08077","Mesa","Colorado","United States",2020-06-06 02:33:00,39.01787888,-108.469799,60,0,0,60,"Mesa, Colorado, United States"
"06-05-2020","21169","Metcalfe","Kentucky","United States",2020-06-06 02:33:00,36.99459295,-85.63123699,7,2,0,5,"Metcalfe, Kentucky, United States"
"06-05-2020","18103","Miami","Indiana","United States",2020-06-06 02:33:00,40.76940965,-86.04525048,146,1,0,145,"Miami, Indiana, United States"
"06-05-2020","20121","Miami","Kansas","United States",2020-06-06 02:33:00,38.56383358,-94.83832189,7,0,0,7,"Miami, Kansas, United States"
"06-05-2020","39109","Miami","Ohio","United States",2020-06-06 02:33:00,40.0543329,-84.22871271,367,30,0,337,"Miami, Ohio, United States"
"06-05-2020","12086","Miami-Dade","Florida","United States",2020-06-06 02:33:00,25.6112362,-80.55170587,19056,760,0,18296,"Miami-Dade, Florida, United States"
"06-05-2020",NA,"Michigan Department of Corrections (MDOC)","Michigan","United States",2020-06-06 02:33:00,NA,NA,3993,68,0,3925,"Michigan Department of Corrections (MDOC), Michigan, United States"
"06-05-2020","09007","Middlesex","Connecticut","United States",2020-06-06 02:33:00,41.45949668,-72.53714864,1170,155,0,1015,"Middlesex, Connecticut, United States"
"06-05-2020","25017","Middlesex","Massachusetts","United States",2020-06-06 02:33:00,42.48607732,-71.39049229,22583,1695,0,20888,"Middlesex, Massachusetts, United States"
"06-05-2020","34023","Middlesex","New Jersey","United States",2020-06-06 02:33:00,40.43629879,-74.41426991,16137,1025,0,15112,"Middlesex, New Jersey, United States"
"06-05-2020","51119","Middlesex","Virginia","United States",2020-06-06 02:33:00,37.63191998,-76.55064617,14,0,0,14,"Middlesex, Virginia, United States"
"06-05-2020","26111","Midland","Michigan","United States",2020-06-06 02:33:00,43.64330771,-84.38804374,120,9,0,111,"Midland, Michigan, United States"
"06-05-2020","48329","Midland","Texas","United States",2020-06-06 02:33:00,31.86904128,-102.0315682,146,13,0,133,"Midland, Texas, United States"
"06-05-2020","42087","Mifflin","Pennsylvania","United States",2020-06-06 02:33:00,40.61116939,-77.61070738,59,1,0,58,"Mifflin, Pennsylvania, United States"
"06-05-2020","48331","Milam","Texas","United States",2020-06-06 02:33:00,30.7858183,-96.97718698,32,1,0,31,"Milam, Texas, United States"
"06-05-2020","27095","Mille Lacs","Minnesota","United States",2020-06-06 02:33:00,45.93705297,-93.63236823,24,1,0,23,"Mille Lacs, Minnesota, United States"
"06-05-2020","05091","Miller","Arkansas","United States",2020-06-06 02:33:00,33.31403423,-93.89285258,52,1,0,51,"Miller, Arkansas, United States"
"06-05-2020","13201","Miller","Georgia","United States",2020-06-06 02:33:00,31.16568912,-84.73151117,42,0,0,42,"Miller, Georgia, United States"
"06-05-2020","29131","Miller","Missouri","United States",2020-06-06 02:33:00,38.21450288,-92.42610898,4,0,0,4,"Miller, Missouri, United States"
"06-05-2020","19129","Mills","Iowa","United States",2020-06-06 02:33:00,41.03299766,-95.61920963,20,0,0,20,"Mills, Iowa, United States"
"06-05-2020","48333","Mills","Texas","United States",2020-06-06 02:33:00,31.49557106,-98.59272068,1,0,0,1,"Mills, Texas, United States"
"06-05-2020","55079","Milwaukee","Wisconsin","United States",2020-06-06 02:33:00,43.00486062,-87.96733172,8547,317,0,8230,"Milwaukee, Wisconsin, United States"
"06-05-2020","46097","Miner","South Dakota","United States",2020-06-06 02:33:00,44.02197882,-97.60992207,2,0,0,2,"Miner, South Dakota, United States"
"06-05-2020","08079","Mineral","Colorado","United States",2020-06-06 02:33:00,37.66954283,-106.9281698,2,0,0,2,"Mineral, Colorado, United States"
"06-05-2020","32021","Mineral","Nevada","United States",2020-06-06 02:33:00,38.53841696,-118.4344506,4,0,0,4,"Mineral, Nevada, United States"
"06-05-2020","54057","Mineral","West Virginia","United States",2020-06-06 02:33:00,39.41561583,-78.94104895,50,1,0,49,"Mineral, West Virginia, United States"
"06-05-2020","54059","Mingo","West Virginia","United States",2020-06-06 02:33:00,37.73048351,-82.13338365,8,1,0,7,"Mingo, West Virginia, United States"
"06-05-2020","16067","Minidoka","Idaho","United States",2020-06-06 02:33:00,42.85518524,-113.6357257,71,0,0,71,"Minidoka, Idaho, United States"
"06-05-2020","46099","Minnehaha","South Dakota","United States",2020-06-06 02:33:00,43.67441641,-96.7910885,3387,50,0,3337,"Minnehaha, South Dakota, United States"
"06-05-2020","26113","Missaukee","Michigan","United States",2020-06-06 02:33:00,44.33772443,-85.09256478,22,1,0,21,"Missaukee, Michigan, United States"
"06-05-2020","05093","Mississippi","Arkansas","United States",2020-06-06 02:33:00,35.76271485,-90.0519437,79,2,0,77,"Mississippi, Arkansas, United States"
"06-05-2020","29133","Mississippi","Missouri","United States",2020-06-06 02:33:00,36.82516239,-89.29505753,61,0,0,61,"Mississippi, Missouri, United States"
"06-05-2020","30063","Missoula","Montana","United States",2020-06-06 02:33:00,47.03728583,-113.9213508,40,1,0,39,"Missoula, Montana, United States"
"06-05-2020","13205","Mitchell","Georgia","United States",2020-06-06 02:33:00,31.22483255,-84.19381821,416,34,0,382,"Mitchell, Georgia, United States"
"06-05-2020","19131","Mitchell","Iowa","United States",2020-06-06 02:33:00,43.35638371,-92.78887719,4,0,0,4,"Mitchell, Iowa, United States"
"06-05-2020","20123","Mitchell","Kansas","United States",2020-06-06 02:33:00,39.39331582,-98.20906732,4,0,0,4,"Mitchell, Kansas, United States"
"06-05-2020","37121","Mitchell","North Carolina","United States",2020-06-06 02:33:00,36.01059309,-82.1582442,17,0,0,17,"Mitchell, North Carolina, United States"
"06-05-2020","48335","Mitchell","Texas","United States",2020-06-06 02:33:00,32.30623474,-100.9212058,1,0,0,1,"Mitchell, Texas, United States"
"06-05-2020","01097","Mobile","Alabama","United States",2020-06-06 02:33:00,30.78472347,-88.20842409,2341,123,0,2218,"Mobile, Alabama, United States"
"06-05-2020","08081","Moffat","Colorado","United States",2020-06-06 02:33:00,40.61810999,-108.2070876,8,0,0,8,"Moffat, Colorado, United States"
"06-05-2020","04015","Mohave","Arizona","United States",2020-06-06 02:33:00,35.70471703,-113.7577902,447,50,0,397,"Mohave, Arizona, United States"
"06-05-2020","29135","Moniteau","Missouri","United States",2020-06-06 02:33:00,38.63571781,-92.57976951,49,0,0,49,"Moniteau, Missouri, United States"
"06-05-2020","34025","Monmouth","New Jersey","United States",2020-06-06 02:33:00,40.26549699,-74.22240686,8428,630,0,7798,"Monmouth, New Jersey, United States"
"06-05-2020","06051","Mono","California","United States",2020-06-06 02:33:00,37.93899289,-118.8872409,37,1,0,36,"Mono, California, United States"
"06-05-2020","19133","Monona","Iowa","United States",2020-06-06 02:33:00,42.05220391,-95.95743843,26,0,0,26,"Monona, Iowa, United States"
"06-05-2020","54061","Monongalia","West Virginia","United States",2020-06-06 02:33:00,39.63218457,-80.04766838,138,5,0,133,"Monongalia, West Virginia, United States"
"06-05-2020","01099","Monroe","Alabama","United States",2020-06-06 02:33:00,31.56729412,-87.36995001,49,2,0,47,"Monroe, Alabama, United States"
"06-05-2020","05095","Monroe","Arkansas","United States",2020-06-06 02:33:00,34.6815935,-91.20540287,5,0,0,5,"Monroe, Arkansas, United States"
"06-05-2020","12087","Monroe","Florida","United States",2020-06-06 02:33:00,25.20904673,-81.07812416,110,4,0,106,"Monroe, Florida, United States"
"06-05-2020","13207","Monroe","Georgia","United States",2020-06-06 02:33:00,33.014289,-83.92097166,123,11,0,112,"Monroe, Georgia, United States"
"06-05-2020","17133","Monroe","Illinois","United States",2020-06-06 02:33:00,38.27594376,-90.17761038,100,12,0,88,"Monroe, Illinois, United States"
"06-05-2020","18105","Monroe","Indiana","United States",2020-06-06 02:33:00,39.16130004,-86.52414358,171,13,0,158,"Monroe, Indiana, United States"
"06-05-2020","19135","Monroe","Iowa","United States",2020-06-06 02:33:00,41.02988815,-92.8690667,41,5,0,36,"Monroe, Iowa, United States"
"06-05-2020","21171","Monroe","Kentucky","United States",2020-06-06 02:33:00,36.71225341,-85.71596443,25,0,0,25,"Monroe, Kentucky, United States"
"06-05-2020","26115","Monroe","Michigan","United States",2020-06-06 02:33:00,41.92734151,-83.53749864,553,21,0,532,"Monroe, Michigan, United States"
"06-05-2020","28095","Monroe","Mississippi","United States",2020-06-06 02:33:00,33.89236763,-88.4808438,269,25,0,244,"Monroe, Mississippi, United States"
"06-05-2020","36055","Monroe","New York","United States",2020-06-06 02:33:00,43.14638895,-77.69322942,3117,230,0,2887,"Monroe, New York, United States"
"06-05-2020","39111","Monroe","Ohio","United States",2020-06-06 02:33:00,39.72984936,-81.08464734,80,15,0,65,"Monroe, Ohio, United States"
"06-05-2020","42089","Monroe","Pennsylvania","United States",2020-06-06 02:33:00,41.05934058,-75.34031025,1335,102,0,1233,"Monroe, Pennsylvania, United States"
"06-05-2020","47123","Monroe","Tennessee","United States",2020-06-06 02:33:00,35.44550387,-84.24902965,74,3,0,71,"Monroe, Tennessee, United States"
"06-05-2020","54063","Monroe","West Virginia","United States",2020-06-06 02:33:00,37.56274716,-80.54577965,8,0,0,8,"Monroe, West Virginia, United States"
"06-05-2020","55081","Monroe","Wisconsin","United States",2020-06-06 02:33:00,43.94641218,-90.618819,18,1,0,17,"Monroe, Wisconsin, United States"
"06-05-2020","48337","Montague","Texas","United States",2020-06-06 02:33:00,33.67521893,-97.72500958,9,1,0,8,"Montague, Texas, United States"
"06-05-2020","26117","Montcalm","Michigan","United States",2020-06-06 02:33:00,43.31082541,-85.15252824,74,1,0,73,"Montcalm, Michigan, United States"
"06-05-2020","06053","Monterey","California","United States",2020-06-06 02:33:00,36.21862405,-121.2413397,640,10,0,630,"Monterey, California, United States"
"06-05-2020","08083","Montezuma","Colorado","United States",2020-06-06 02:33:00,37.33859579,-108.5958857,46,3,0,43,"Montezuma, Colorado, United States"
"06-05-2020","01101","Montgomery","Alabama","United States",2020-06-06 02:33:00,32.2206831,-86.20969272,1905,44,0,1861,"Montgomery, Alabama, United States"
"06-05-2020","05097","Montgomery","Arkansas","United States",2020-06-06 02:33:00,34.53704874,-93.65824478,2,0,0,2,"Montgomery, Arkansas, United States"
"06-05-2020","13209","Montgomery","Georgia","United States",2020-06-06 02:33:00,32.17201038,-82.53527476,12,0,0,12,"Montgomery, Georgia, United States"
"06-05-2020","17135","Montgomery","Illinois","United States",2020-06-06 02:33:00,39.23198845,-89.47809254,41,1,0,40,"Montgomery, Illinois, United States"
"06-05-2020","18107","Montgomery","Indiana","United States",2020-06-06 02:33:00,40.04034823,-86.89335024,249,17,0,232,"Montgomery, Indiana, United States"
"06-05-2020","19137","Montgomery","Iowa","United States",2020-06-06 02:33:00,41.03018714,-95.15642896,9,2,0,7,"Montgomery, Iowa, United States"
"06-05-2020","20125","Montgomery","Kansas","United States",2020-06-06 02:33:00,37.19236568,-95.74329258,20,2,0,18,"Montgomery, Kansas, United States"
"06-05-2020","21173","Montgomery","Kentucky","United States",2020-06-06 02:33:00,38.03253032,-83.9145241,25,0,0,25,"Montgomery, Kentucky, United States"
"06-05-2020","24031","Montgomery","Maryland","United States",2020-06-06 02:33:00,39.13676329,-77.20358245,12434,645,0,11789,"Montgomery, Maryland, United States"
"06-05-2020","28097","Montgomery","Mississippi","United States",2020-06-06 02:33:00,33.49419589,-89.61729103,84,1,0,83,"Montgomery, Mississippi, United States"
"06-05-2020","29139","Montgomery","Missouri","United States",2020-06-06 02:33:00,38.94022054,-91.47000721,10,0,0,10,"Montgomery, Missouri, United States"
"06-05-2020","36057","Montgomery","New York","United States",2020-06-06 02:33:00,42.90123494,-74.44011632,96,4,0,92,"Montgomery, New York, United States"
"06-05-2020","37123","Montgomery","North Carolina","United States",2020-06-06 02:33:00,35.33155144,-79.90416657,162,5,0,157,"Montgomery, North Carolina, United States"
"06-05-2020","39113","Montgomery","Ohio","United States",2020-06-06 02:33:00,39.75394919,-84.29050975,734,17,0,717,"Montgomery, Ohio, United States"
"06-05-2020","42091","Montgomery","Pennsylvania","United States",2020-06-06 02:33:00,40.21053671,-75.36652296,7416,721,0,6695,"Montgomery, Pennsylvania, United States"
"06-05-2020","47125","Montgomery","Tennessee","United States",2020-06-06 02:33:00,36.49609412,-87.38550661,287,3,0,284,"Montgomery, Tennessee, United States"
"06-05-2020","48339","Montgomery","Texas","United States",2020-06-06 02:33:00,30.30079133,-95.50572772,1064,28,0,1036,"Montgomery, Texas, United States"
"06-05-2020","51121","Montgomery","Virginia","United States",2020-06-06 02:33:00,37.17746986,-80.37868691,85,1,0,84,"Montgomery, Virginia, United States"
"06-05-2020","26119","Montmorency","Michigan","United States",2020-06-06 02:33:00,45.0275929,-84.12696227,5,0,0,5,"Montmorency, Michigan, United States"
"06-05-2020","42093","Montour","Pennsylvania","United States",2020-06-06 02:33:00,41.03023987,-76.66345939,53,0,0,53,"Montour, Pennsylvania, United States"
"06-05-2020","08085","Montrose","Colorado","United States",2020-06-06 02:33:00,38.40214114,-108.2639022,183,12,0,171,"Montrose, Colorado, United States"
"06-05-2020","46101","Moody","South Dakota","United States",2020-06-06 02:33:00,44.02266214,-96.67081159,19,0,0,19,"Moody, South Dakota, United States"
"06-05-2020","37125","Moore","North Carolina","United States",2020-06-06 02:33:00,35.30885257,-79.48474178,248,11,0,237,"Moore, North Carolina, United States"
"06-05-2020","47127","Moore","Tennessee","United States",2020-06-06 02:33:00,35.27724699,-86.36230578,5,0,0,5,"Moore, Tennessee, United States"
"06-05-2020","48341","Moore","Texas","United States",2020-06-06 02:33:00,35.83769242,-101.8930281,851,13,0,838,"Moore, Texas, United States"
"06-05-2020","22067","Morehouse","Louisiana","United States",2020-06-06 02:33:00,32.81686191,-91.80421614,132,5,0,127,"Morehouse, Louisiana, United States"
"06-05-2020","01103","Morgan","Alabama","United States",2020-06-06 02:33:00,34.45500589,-86.85475946,314,1,0,313,"Morgan, Alabama, United States"
"06-05-2020","08087","Morgan","Colorado","United States",2020-06-06 02:33:00,40.2627981,-103.8093302,641,46,0,595,"Morgan, Colorado, United States"
"06-05-2020","13211","Morgan","Georgia","United States",2020-06-06 02:33:00,33.59232073,-83.49129491,39,0,0,39,"Morgan, Georgia, United States"
"06-05-2020","17137","Morgan","Illinois","United States",2020-06-06 02:33:00,39.71654544,-90.20255104,42,1,0,41,"Morgan, Illinois, United States"
"06-05-2020","18109","Morgan","Indiana","United States",2020-06-06 02:33:00,39.47899078,-86.44573375,286,26,0,260,"Morgan, Indiana, United States"
"06-05-2020","21175","Morgan","Kentucky","United States",2020-06-06 02:33:00,37.92465657,-83.25558245,3,0,0,3,"Morgan, Kentucky, United States"
"06-05-2020","29141","Morgan","Missouri","United States",2020-06-06 02:33:00,38.4181765,-92.88791859,9,0,0,9,"Morgan, Missouri, United States"
"06-05-2020","39115","Morgan","Ohio","United States",2020-06-06 02:33:00,39.62081738,-81.85308173,5,0,0,5,"Morgan, Ohio, United States"
"06-05-2020","47129","Morgan","Tennessee","United States",2020-06-06 02:33:00,36.13248031,-84.64880098,18,0,0,18,"Morgan, Tennessee, United States"
