"Date_Published","FIPS","Admin2","Province_State","Country_Region","Last_Update","Latitude","Longitude","Confirmed","Deaths","Recovered","Active","Combined_Key"
"06-05-2020","19065","Fayette","Iowa","United States",2020-06-06 02:33:00,42.86271799,-91.8441231,27,0,0,27,"Fayette, Iowa, United States"
"06-05-2020","21067","Fayette","Kentucky","United States",2020-06-06 02:33:00,38.0368225,-84.45576892,840,14,0,826,"Fayette, Kentucky, United States"
"06-05-2020","39047","Fayette","Ohio","United States",2020-06-06 02:33:00,39.56021306,-83.4562016,41,0,0,41,"Fayette, Ohio, United States"
"06-05-2020","42051","Fayette","Pennsylvania","United States",2020-06-06 02:33:00,39.92041012,-79.64291195,95,4,0,91,"Fayette, Pennsylvania, United States"
"06-05-2020","47047","Fayette","Tennessee","United States",2020-06-06 02:33:00,35.19615831,-89.41399032,144,2,0,142,"Fayette, Tennessee, United States"
"06-05-2020","48149","Fayette","Texas","United States",2020-06-06 02:33:00,29.87788372,-96.92076062,38,2,0,36,"Fayette, Texas, United States"
"06-05-2020","54019","Fayette","West Virginia","United States",2020-06-06 02:33:00,38.02974928,-81.08286634,54,4,0,50,"Fayette, West Virginia, United States"
"06-05-2020",NA,"Federal Correctional Institution (FCI)","Michigan","United States",2020-06-06 02:33:00,NA,NA,154,4,0,150,"Federal Correctional Institution (FCI), Michigan, United States"
"06-05-2020","47049","Fentress","Tennessee","United States",2020-06-06 02:33:00,36.38128818,-84.92870012,12,0,0,12,"Fentress, Tennessee, United States"
"06-05-2020","30027","Fergus","Montana","United States",2020-06-06 02:33:00,47.26331584,-109.2245206,0,0,0,0,"Fergus, Montana, United States"
"06-05-2020","53019","Ferry","Washington","United States",2020-06-06 02:33:00,48.4711431,-118.5154041,1,0,0,1,"Ferry, Washington, United States"
"06-05-2020","27045","Fillmore","Minnesota","United States",2020-06-06 02:33:00,43.67394126,-92.08980382,17,1,0,16,"Fillmore, Minnesota, United States"
"06-05-2020","31059","Fillmore","Nebraska","United States",2020-06-06 02:33:00,40.52458567,-97.59646937,7,1,0,6,"Fillmore, Nebraska, United States"
"06-05-2020","20055","Finney","Kansas","United States",2020-06-06 02:33:00,38.04340344,-100.7381938,1526,10,0,1516,"Finney, Kansas, United States"
"06-05-2020","48151","Fisher","Texas","United States",2020-06-06 02:33:00,32.74281316,-100.4019302,2,1,0,1,"Fisher, Texas, United States"
"06-05-2020","12035","Flagler","Florida","United States",2020-06-06 02:33:00,29.45933576,-81.31508595,195,4,0,191,"Flagler, Florida, United States"
"06-05-2020","30029","Flathead","Montana","United States",2020-06-06 02:33:00,48.29575866,-114.0520569,37,2,0,35,"Flathead, Montana, United States"
"06-05-2020","21069","Fleming","Kentucky","United States",2020-06-06 02:33:00,38.36758311,-83.69657514,2,0,0,2,"Fleming, Kentucky, United States"
"06-05-2020","45041","Florence","South Carolina","United States",2020-06-06 02:33:00,34.02361754,-79.70189312,707,39,0,668,"Florence, South Carolina, United States"
"06-05-2020","55037","Florence","Wisconsin","United States",2020-06-06 02:33:00,45.84963535,-88.39804137,2,0,0,2,"Florence, Wisconsin, United States"
"06-05-2020","13115","Floyd","Georgia","United States",2020-06-06 02:33:00,34.26268279,-85.21577392,311,15,0,296,"Floyd, Georgia, United States"
"06-05-2020","18043","Floyd","Indiana","United States",2020-06-06 02:33:00,38.32117957,-85.90385377,319,41,0,278,"Floyd, Indiana, United States"
"06-05-2020","19067","Floyd","Iowa","United States",2020-06-06 02:33:00,43.0600053,-92.78940097,19,1,0,18,"Floyd, Iowa, United States"
"06-05-2020","21071","Floyd","Kentucky","United States",2020-06-06 02:33:00,37.56213922,-82.74750924,17,0,0,17,"Floyd, Kentucky, United States"
"06-05-2020","48153","Floyd","Texas","United States",2020-06-06 02:33:00,34.07227468,-101.3031546,16,0,0,16,"Floyd, Texas, United States"
"06-05-2020","51063","Floyd","Virginia","United States",2020-06-06 02:33:00,36.9302126,-80.36738849,6,1,0,5,"Floyd, Virginia, United States"
"06-05-2020","51065","Fluvanna","Virginia","United States",2020-06-06 02:33:00,37.84157909,-78.27715475,94,6,0,88,"Fluvanna, Virginia, United States"
"06-05-2020","55039","Fond du Lac","Wisconsin","United States",2020-06-06 02:33:00,43.75354908,-88.48885325,226,5,0,221,"Fond du Lac, Wisconsin, United States"
"06-05-2020","17053","Ford","Illinois","United States",2020-06-06 02:33:00,40.59706922,-88.22350769,21,1,0,20,"Ford, Illinois, United States"
"06-05-2020","20057","Ford","Kansas","United States",2020-06-06 02:33:00,37.69200114,-99.88825298,1813,8,0,1805,"Ford, Kansas, United States"
"06-05-2020","42053","Forest","Pennsylvania","United States",2020-06-06 02:33:00,41.51095103,-79.23229292,7,0,0,7,"Forest, Pennsylvania, United States"
"06-05-2020","55041","Forest","Wisconsin","United States",2020-06-06 02:33:00,45.66678019,-88.77084892,34,2,0,32,"Forest, Wisconsin, United States"
"06-05-2020","28035","Forrest","Mississippi","United States",2020-06-06 02:33:00,31.18961454,-89.25832496,600,39,0,561,"Forrest, Mississippi, United States"
"06-05-2020","13117","Forsyth","Georgia","United States",2020-06-06 02:33:00,34.22604035,-84.1231513,541,12,0,529,"Forsyth, Georgia, United States"
"06-05-2020","37067","Forsyth","North Carolina","United States",2020-06-06 02:33:00,36.12859861,-80.25459052,1660,17,0,1643,"Forsyth, North Carolina, United States"
"06-05-2020","48157","Fort Bend","Texas","United States",2020-06-06 02:33:00,29.52704478,-95.77219463,2032,47,0,1985,"Fort Bend, Texas, United States"
"06-05-2020","38031","Foster","North Dakota","United States",2020-06-06 02:33:00,47.4571084,-98.88279923,1,0,0,1,"Foster, North Dakota, United States"
"06-05-2020","18045","Fountain","Indiana","United States",2020-06-06 02:33:00,40.12361933,-87.24217689,22,2,0,20,"Fountain, Indiana, United States"
"06-05-2020","01059","Franklin","Alabama","United States",2020-06-06 02:33:00,34.44235334,-87.84289505,593,9,0,584,"Franklin, Alabama, United States"
"06-05-2020","05047","Franklin","Arkansas","United States",2020-06-06 02:33:00,35.51202821,-93.89299569,5,0,0,5,"Franklin, Arkansas, United States"
"06-05-2020","12037","Franklin","Florida","United States",2020-06-06 02:33:00,29.83791238,-84.82731662,2,0,0,2,"Franklin, Florida, United States"
"06-05-2020","13119","Franklin","Georgia","United States",2020-06-06 02:33:00,34.37525597,-83.23159927,132,1,0,131,"Franklin, Georgia, United States"
"06-05-2020","16041","Franklin","Idaho","United States",2020-06-06 02:33:00,42.18332217,-111.8149666,8,0,0,8,"Franklin, Idaho, United States"
"06-05-2020","17055","Franklin","Illinois","United States",2020-06-06 02:33:00,37.99189086,-88.92567818,12,0,0,12,"Franklin, Illinois, United States"
"06-05-2020","18047","Franklin","Indiana","United States",2020-06-06 02:33:00,39.4142482,-85.06062647,116,8,0,108,"Franklin, Indiana, United States"
"06-05-2020","19069","Franklin","Iowa","United States",2020-06-06 02:33:00,42.73270384,-93.26256925,20,0,0,20,"Franklin, Iowa, United States"
"06-05-2020","20059","Franklin","Kansas","United States",2020-06-06 02:33:00,38.56443815,-95.28644341,35,0,0,35,"Franklin, Kansas, United States"
"06-05-2020","21073","Franklin","Kentucky","United States",2020-06-06 02:33:00,38.2379395,-84.87962551,73,2,0,71,"Franklin, Kentucky, United States"
"06-05-2020","22041","Franklin","Louisiana","United States",2020-06-06 02:33:00,32.13675181,-91.67589857,383,12,0,371,"Franklin, Louisiana, United States"
"06-05-2020","23007","Franklin","Maine","United States",2020-06-06 02:33:00,44.97330019,-70.44381045,36,1,0,35,"Franklin, Maine, United States"
"06-05-2020","25011","Franklin","Massachusetts","United States",2020-06-06 02:33:00,42.58119713,-72.58602547,337,48,0,289,"Franklin, Massachusetts, United States"
"06-05-2020","28037","Franklin","Mississippi","United States",2020-06-06 02:33:00,31.47786634,-90.89672989,29,2,0,27,"Franklin, Mississippi, United States"
"06-05-2020","29071","Franklin","Missouri","United States",2020-06-06 02:33:00,38.41127108,-91.07522826,149,17,0,132,"Franklin, Missouri, United States"
"06-05-2020","31061","Franklin","Nebraska","United States",2020-06-06 02:33:00,40.17636348,-98.95299073,6,0,0,6,"Franklin, Nebraska, United States"
"06-05-2020","36033","Franklin","New York","United States",2020-06-06 02:33:00,44.59040891,-74.29926032,23,0,0,23,"Franklin, New York, United States"
"06-05-2020","37069","Franklin","North Carolina","United States",2020-06-06 02:33:00,36.081519,-78.28708884,179,22,0,157,"Franklin, North Carolina, United States"
"06-05-2020","39049","Franklin","Ohio","United States",2020-06-06 02:33:00,39.96995815,-83.01115755,6323,295,0,6028,"Franklin, Ohio, United States"
"06-05-2020","42055","Franklin","Pennsylvania","United States",2020-06-06 02:33:00,39.92956518,-77.72157791,788,39,0,749,"Franklin, Pennsylvania, United States"
"06-05-2020","47051","Franklin","Tennessee","United States",2020-06-06 02:33:00,35.15634626,-86.09201039,54,1,0,53,"Franklin, Tennessee, United States"
"06-05-2020","48159","Franklin","Texas","United States",2020-06-06 02:33:00,33.17653242,-95.21917243,18,0,0,18,"Franklin, Texas, United States"
"06-05-2020","50011","Franklin","Vermont","United States",2020-06-06 02:33:00,44.85627605,-72.91249563,100,5,0,95,"Franklin, Vermont, United States"
"06-05-2020","51067","Franklin","Virginia","United States",2020-06-06 02:33:00,36.99536167,-79.88023649,38,1,0,37,"Franklin, Virginia, United States"
"06-05-2020","53021","Franklin","Washington","United States",2020-06-06 02:33:00,46.53351425,-118.9018212,670,21,0,649,"Franklin, Washington, United States"
"06-05-2020","51620","Franklin City","Virginia","United States",2020-06-06 02:33:00,36.6831435,-76.93859681,42,2,0,40,"Franklin City, Virginia, United States"
"06-05-2020","24021","Frederick","Maryland","United States",2020-06-06 02:33:00,39.47296601,-77.39999394,2069,110,0,1959,"Frederick, Maryland, United States"
"06-05-2020","51069","Frederick","Virginia","United States",2020-06-06 02:33:00,39.20172582,-78.25974949,388,4,0,384,"Frederick, Virginia, United States"
"06-05-2020","51630","Fredericksburg","Virginia","United States",2020-06-06 02:33:00,38.2977863,-77.4922454,186,1,0,185,"Fredericksburg, Virginia, United States"
"06-05-2020","27047","Freeborn","Minnesota","United States",2020-06-06 02:33:00,43.67385583,-93.34884422,159,0,0,159,"Freeborn, Minnesota, United States"
"06-05-2020","48161","Freestone","Texas","United States",2020-06-06 02:33:00,31.70422788,-96.15072516,10,0,0,10,"Freestone, Texas, United States"
"06-05-2020","08043","Fremont","Colorado","United States",2020-06-06 02:33:00,38.47362326,-105.4399667,26,0,0,26,"Fremont, Colorado, United States"
"06-05-2020","16043","Fremont","Idaho","United States",2020-06-06 02:33:00,44.22800938,-111.4809943,4,0,0,4,"Fremont, Idaho, United States"
"06-05-2020","19071","Fremont","Iowa","United States",2020-06-06 02:33:00,40.7454272,-95.60129045,4,0,0,4,"Fremont, Iowa, United States"
"06-05-2020","56013","Fremont","Wyoming","United States",2020-06-06 02:33:00,43.04183996,-108.6296893,289,0,0,289,"Fremont, Wyoming, United States"
"06-05-2020","06019","Fresno","California","United States",2020-06-06 02:33:00,36.75733899,-119.6466953,2014,40,0,1974,"Fresno, California, United States"
"06-05-2020","48163","Frio","Texas","United States",2020-06-06 02:33:00,28.86751206,-99.10804207,40,0,0,40,"Frio, Texas, United States"
"06-05-2020","31063","Frontier","Nebraska","United States",2020-06-06 02:33:00,40.52993007,-100.3924658,1,0,0,1,"Frontier, Nebraska, United States"
"06-05-2020","05049","Fulton","Arkansas","United States",2020-06-06 02:33:00,36.38177105,-91.81729127,7,0,0,7,"Fulton, Arkansas, United States"
"06-05-2020","13121","Fulton","Georgia","United States",2020-06-06 02:33:00,33.79216944,-84.46319413,4790,250,0,4540,"Fulton, Georgia, United States"
"06-05-2020","17057","Fulton","Illinois","United States",2020-06-06 02:33:00,40.47289135,-90.20862357,12,0,0,12,"Fulton, Illinois, United States"
"06-05-2020","18049","Fulton","Indiana","United States",2020-06-06 02:33:00,41.0469907,-86.26252745,51,1,0,50,"Fulton, Indiana, United States"
"06-05-2020","21075","Fulton","Kentucky","United States",2020-06-06 02:33:00,36.55238827,-89.20140068,10,0,0,10,"Fulton, Kentucky, United States"
"06-05-2020","36035","Fulton","New York","United States",2020-06-06 02:33:00,43.11363907,-74.41798804,219,24,0,195,"Fulton, New York, United States"
"06-05-2020","39051","Fulton","Ohio","United States",2020-06-06 02:33:00,41.60213491,-84.12571393,45,0,0,45,"Fulton, Ohio, United States"
"06-05-2020","42057","Fulton","Pennsylvania","United States",2020-06-06 02:33:00,39.92913544,-78.11163677,16,1,0,15,"Fulton, Pennsylvania, United States"
"06-05-2020","31065","Furnas","Nebraska","United States",2020-06-06 02:33:00,40.17642064,-99.91247454,9,0,0,9,"Furnas, Nebraska, United States"
"06-05-2020","12039","Gadsden","Florida","United States",2020-06-06 02:33:00,30.57796289,-84.61915825,289,4,0,285,"Gadsden, Florida, United States"
"06-05-2020","31067","Gage","Nebraska","United States",2020-06-06 02:33:00,40.26186809,-96.68946704,45,4,0,41,"Gage, Nebraska, United States"
"06-05-2020","48165","Gaines","Texas","United States",2020-06-06 02:33:00,32.74055318,-102.6353295,7,0,0,7,"Gaines, Texas, United States"
"06-05-2020","51640","Galax","Virginia","United States",2020-06-06 02:33:00,36.66601852,-80.91703124,140,1,0,139,"Galax, Virginia, United States"
"06-05-2020","17059","Gallatin","Illinois","United States",2020-06-06 02:33:00,37.76430935,-88.22953869,2,0,0,2,"Gallatin, Illinois, United States"
"06-05-2020","21077","Gallatin","Kentucky","United States",2020-06-06 02:33:00,38.75398691,-84.8558382,46,5,0,41,"Gallatin, Kentucky, United States"
"06-05-2020","30031","Gallatin","Montana","United States",2020-06-06 02:33:00,45.54486106,-111.1692571,163,1,0,162,"Gallatin, Montana, United States"
"06-05-2020","39053","Gallia","Ohio","United States",2020-06-06 02:33:00,38.82708533,-82.31647569,8,1,0,7,"Gallia, Ohio, United States"
"06-05-2020","48167","Galveston","Texas","United States",2020-06-06 02:33:00,29.40167322,-94.90469073,906,38,0,868,"Galveston, Texas, United States"
"06-05-2020","31069","Garden","Nebraska","United States",2020-06-06 02:33:00,41.61703149,-102.3313973,4,0,0,4,"Garden, Nebraska, United States"
"06-05-2020","08045","Garfield","Colorado","United States",2020-06-06 02:33:00,39.59921777,-107.902708,158,2,0,156,"Garfield, Colorado, United States"
"06-05-2020","31071","Garfield","Nebraska","United States",2020-06-06 02:33:00,41.91428955,-98.99111827,1,0,0,1,"Garfield, Nebraska, United States"
"06-05-2020","40047","Garfield","Oklahoma","United States",2020-06-06 02:33:00,36.3791334,-97.78265517,29,1,0,28,"Garfield, Oklahoma, United States"
"06-05-2020","53023","Garfield","Washington","United States",2020-06-06 02:33:00,46.43197502,-117.5454032,0,0,0,0,"Garfield, Washington, United States"
"06-05-2020","05051","Garland","Arkansas","United States",2020-06-06 02:33:00,34.57692074,-93.14921604,138,1,0,137,"Garland, Arkansas, United States"
"06-05-2020","21079","Garrard","Kentucky","United States",2020-06-06 02:33:00,37.6388668,-84.53289319,5,0,0,5,"Garrard, Kentucky, United States"
"06-05-2020","24023","Garrett","Maryland","United States",2020-06-06 02:33:00,39.52786077,-79.27355126,10,0,0,10,"Garrett, Maryland, United States"
"06-05-2020","40049","Garvin","Oklahoma","United States",2020-06-06 02:33:00,34.70418038,-97.30811132,18,1,0,17,"Garvin, Oklahoma, United States"
"06-05-2020","48169","Garza","Texas","United States",2020-06-06 02:33:00,33.17969345,-101.2984114,6,0,0,6,"Garza, Texas, United States"
"06-05-2020","29073","Gasconade","Missouri","United States",2020-06-06 02:33:00,38.43947277,-91.50847147,2,0,0,2,"Gasconade, Missouri, United States"
"06-05-2020","37071","Gaston","North Carolina","United States",2020-06-06 02:33:00,35.29373559,-81.17477045,320,8,0,312,"Gaston, North Carolina, United States"
"06-05-2020","37073","Gates","North Carolina","United States",2020-06-06 02:33:00,36.44667547,-76.69749701,24,1,0,23,"Gates, North Carolina, United States"
"06-05-2020","20061","Geary","Kansas","United States",2020-06-06 02:33:00,38.99871131,-96.7577178,26,1,0,25,"Geary, Kansas, United States"
"06-05-2020","39055","Geauga","Ohio","United States",2020-06-06 02:33:00,41.49952319,-81.17935342,303,34,0,269,"Geauga, Ohio, United States"
"06-05-2020","16045","Gem","Idaho","United States",2020-06-06 02:33:00,44.06482372,-116.398376,17,0,0,17,"Gem, Idaho, United States"
"06-05-2020","26049","Genesee","Michigan","United States",2020-06-06 02:33:00,43.02244215,-83.70589709,2511,279,0,2232,"Genesee, Michigan, United States"
"06-05-2020","36037","Genesee","New York","United States",2020-06-06 02:33:00,43.0022601,-78.19135193,205,5,0,200,"Genesee, New York, United States"
"06-05-2020","01061","Geneva","Alabama","United States",2020-06-06 02:33:00,31.09389027,-85.83572839,45,0,0,45,"Geneva, Alabama, United States"
"06-05-2020","29075","Gentry","Missouri","United States",2020-06-06 02:33:00,40.21097916,-94.40944419,46,0,0,46,"Gentry, Missouri, United States"
"06-05-2020","28039","George","Mississippi","United States",2020-06-06 02:33:00,30.86259065,-88.64436789,30,2,0,28,"George, Mississippi, United States"
"06-05-2020","45043","Georgetown","South Carolina","United States",2020-06-06 02:33:00,33.43443342,-79.33202141,82,3,0,79,"Georgetown, South Carolina, United States"
"06-05-2020","18051","Gibson","Indiana","United States",2020-06-06 02:33:00,38.30393723,-87.58054938,20,2,0,18,"Gibson, Indiana, United States"
"06-05-2020","47053","Gibson","Tennessee","United States",2020-06-06 02:33:00,35.99438059,-88.93358327,63,1,0,62,"Gibson, Tennessee, United States"
"06-05-2020","04007","Gila","Arizona","United States",2020-06-06 02:33:00,33.80190085,-110.8132779,42,3,0,39,"Gila, Arizona, United States"
"06-05-2020","12041","Gilchrist","Florida","United States",2020-06-06 02:33:00,29.72856978,-82.79880657,19,0,0,19,"Gilchrist, Florida, United States"
"06-05-2020","47055","Giles","Tennessee","United States",2020-06-06 02:33:00,35.20222469,-87.03992678,14,0,0,14,"Giles, Tennessee, United States"
"06-05-2020","51071","Giles","Virginia","United States",2020-06-06 02:33:00,37.31234791,-80.70636931,5,0,0,5,"Giles, Virginia, United States"
"06-05-2020","48171","Gillespie","Texas","United States",2020-06-06 02:33:00,30.31824095,-98.94676915,5,0,0,5,"Gillespie, Texas, United States"
"06-05-2020","13123","Gilmer","Georgia","United States",2020-06-06 02:33:00,34.69316688,-84.45802506,159,1,0,158,"Gilmer, Georgia, United States"
"06-05-2020","54021","Gilmer","West Virginia","United States",2020-06-06 02:33:00,38.9251277,-80.85952723,10,0,0,10,"Gilmer, West Virginia, United States"
"06-05-2020","08047","Gilpin","Colorado","United States",2020-06-06 02:33:00,39.85646523,-105.5252597,4,0,0,4,"Gilpin, Colorado, United States"
"06-05-2020","30035","Glacier","Montana","United States",2020-06-06 02:33:00,48.70513576,-112.9934235,6,0,0,6,"Glacier, Montana, United States"
"06-05-2020","12043","Glades","Florida","United States",2020-06-06 02:33:00,26.95635849,-81.18996211,81,1,0,80,"Glades, Florida, United States"
"06-05-2020","26051","Gladwin","Michigan","United States",2020-06-06 02:33:00,43.98901072,-84.38774817,18,1,0,17,"Gladwin, Michigan, United States"
"06-05-2020","13125","Glascock","Georgia","United States",2020-06-06 02:33:00,33.22879932,-82.61297636,1,0,0,1,"Glascock, Georgia, United States"
"06-05-2020","48173","Glasscock","Texas","United States",2020-06-06 02:33:00,31.86942909,-101.5207776,1,0,0,1,"Glasscock, Texas, United States"
"06-05-2020","06021","Glenn","California","United States",2020-06-06 02:33:00,39.59875897,-122.3938452,17,0,0,17,"Glenn, California, United States"
"06-05-2020","34015","Gloucester","New Jersey","United States",2020-06-06 02:33:00,39.71581067,-75.13995546,2310,151,0,2159,"Gloucester, New Jersey, United States"
"06-05-2020","51073","Gloucester","Virginia","United States",2020-06-06 02:33:00,37.40809042,-76.53524337,32,1,0,31,"Gloucester, Virginia, United States"
"06-05-2020","13127","Glynn","Georgia","United States",2020-06-06 02:33:00,31.23279254,-81.53811412,147,2,0,145,"Glynn, Georgia, United States"
"06-05-2020","26053","Gogebic","Michigan","United States",2020-06-06 02:33:00,46.40862701,-89.69377193,5,1,0,4,"Gogebic, Michigan, United States"
"06-05-2020","30037","Golden Valley","Montana","United States",2020-06-06 02:33:00,46.3816474,-109.1768522,3,0,0,3,"Golden Valley, Montana, United States"
"06-05-2020","48175","Goliad","Texas","United States",2020-06-06 02:33:00,28.65696592,-97.42760647,7,0,0,7,"Goliad, Texas, United States"
"06-05-2020","48177","Gonzales","Texas","United States",2020-06-06 02:33:00,29.45634206,-97.49424032,147,3,0,144,"Gonzales, Texas, United States"
"06-05-2020","51075","Goochland","Virginia","United States",2020-06-06 02:33:00,37.71714806,-77.90381514,105,6,0,99,"Goochland, Virginia, United States"
"06-05-2020","27049","Goodhue","Minnesota","United States",2020-06-06 02:33:00,44.40849741,-92.7234195,73,6,0,67,"Goodhue, Minnesota, United States"
"06-05-2020","16047","Gooding","Idaho","United States",2020-06-06 02:33:00,42.96927962,-114.8108306,55,0,0,55,"Gooding, Idaho, United States"
"06-05-2020","13129","Gordon","Georgia","United States",2020-06-06 02:33:00,34.50487351,-84.87296253,194,16,0,178,"Gordon, Georgia, United States"
"06-05-2020","56015","Goshen","Wyoming","United States",2020-06-06 02:33:00,42.08798185,-104.3534743,5,0,0,5,"Goshen, Wyoming, United States"
"06-05-2020","31073","Gosper","Nebraska","United States",2020-06-06 02:33:00,40.51481965,-99.83020279,13,0,0,13,"Gosper, Nebraska, United States"
"06-05-2020","20063","Gove","Kansas","United States",2020-06-06 02:33:00,38.91588178,-100.4829321,1,0,0,1,"Gove, Kansas, United States"
"06-05-2020","13131","Grady","Georgia","United States",2020-06-06 02:33:00,30.87454847,-84.23418364,119,4,0,115,"Grady, Georgia, United States"
"06-05-2020","40051","Grady","Oklahoma","United States",2020-06-06 02:33:00,35.0167709,-97.88339847,107,3,0,104,"Grady, Oklahoma, United States"
"06-05-2020","33009","Grafton","New Hampshire","United States",2020-06-06 02:33:00,43.93779815,-71.82057197,76,1,0,75,"Grafton, New Hampshire, United States"
"06-05-2020","04009","Graham","Arizona","United States",2020-06-06 02:33:00,32.93166885,-109.8882178,40,1,0,39,"Graham, Arizona, United States"
"06-05-2020","37075","Graham","North Carolina","United States",2020-06-06 02:33:00,35.3506925,-83.83369267,4,0,0,4,"Graham, North Carolina, United States"
"06-05-2020","47057","Grainger","Tennessee","United States",2020-06-06 02:33:00,36.27469206,-83.51254721,15,0,0,15,"Grainger, Tennessee, United States"
"06-05-2020","08049","Grand","Colorado","United States",2020-06-06 02:33:00,40.10603347,-106.1178042,15,0,0,15,"Grand, Colorado, United States"
"06-05-2020","38035","Grand Forks","North Dakota","United States",2020-06-06 02:33:00,47.92093639,-97.45450447,336,4,0,332,"Grand Forks, North Dakota, United States"
"06-05-2020","50013","Grand Isle","Vermont","United States",2020-06-06 02:33:00,44.7975824,-73.29679772,7,0,0,7,"Grand Isle, Vermont, United States"
"06-05-2020","26055","Grand Traverse","Michigan","United States",2020-06-06 02:33:00,44.69565625,-85.55585247,34,5,0,29,"Grand Traverse, Michigan, United States"
"06-05-2020","05053","Grant","Arkansas","United States",2020-06-06 02:33:00,34.29017991,-92.42320562,18,0,0,18,"Grant, Arkansas, United States"
"06-05-2020","18053","Grant","Indiana","United States",2020-06-06 02:33:00,40.51587228,-85.65468702,229,23,0,206,"Grant, Indiana, United States"
"06-05-2020","20067","Grant","Kansas","United States",2020-06-06 02:33:00,37.56227336,-101.3079758,18,1,0,17,"Grant, Kansas, United States"
"06-05-2020","21081","Grant","Kentucky","United States",2020-06-06 02:33:00,38.64962758,-84.62415957,47,4,0,43,"Grant, Kentucky, United States"
"06-05-2020","22043","Grant","Louisiana","United States",2020-06-06 02:33:00,31.59882456,-92.56124347,34,1,0,33,"Grant, Louisiana, United States"
"06-05-2020","27051","Grant","Minnesota","United States",2020-06-06 02:33:00,45.93424769,-96.01139609,4,0,0,4,"Grant, Minnesota, United States"
"06-05-2020","35017","Grant","New Mexico","United States",2020-06-06 02:33:00,32.73911281,-108.3827845,15,0,0,15,"Grant, New Mexico, United States"
"06-05-2020","38037","Grant","North Dakota","United States",2020-06-06 02:33:00,46.35821257,-101.6390013,2,0,0,2,"Grant, North Dakota, United States"
"06-05-2020","40053","Grant","Oklahoma","United States",2020-06-06 02:33:00,36.796297,-97.78638765,2,0,0,2,"Grant, Oklahoma, United States"
"06-05-2020","41023","Grant","Oregon","United States",2020-06-06 02:33:00,44.49024544,-119.0068631,1,0,0,1,"Grant, Oregon, United States"
"06-05-2020","46051","Grant","South Dakota","United States",2020-06-06 02:33:00,45.1723937,-96.77002276,13,0,0,13,"Grant, South Dakota, United States"
"06-05-2020","53025","Grant","Washington","United States",2020-06-06 02:33:00,47.20753737,-119.4500749,214,4,0,210,"Grant, Washington, United States"
"06-05-2020","54023","Grant","West Virginia","United States",2020-06-06 02:33:00,39.10314817,-79.19440518,12,0,0,12,"Grant, West Virginia, United States"
"06-05-2020","55043","Grant","Wisconsin","United States",2020-06-06 02:33:00,42.8671731,-90.7063218,98,12,0,86,"Grant, Wisconsin, United States"
"06-05-2020","37077","Granville","North Carolina","United States",2020-06-06 02:33:00,36.30337451,-78.65184241,354,13,0,341,"Granville, North Carolina, United States"
"06-05-2020","26057","Gratiot","Michigan","United States",2020-06-06 02:33:00,43.29265605,-84.60505416,86,11,0,75,"Gratiot, Michigan, United States"
"06-05-2020","21083","Graves","Kentucky","United States",2020-06-06 02:33:00,36.72292505,-88.65143315,166,20,0,146,"Graves, Kentucky, United States"
"06-05-2020","20069","Gray","Kansas","United States",2020-06-06 02:33:00,37.73836671,-100.4369088,23,0,0,23,"Gray, Kansas, United States"
