"Date_Published","FIPS","Admin2","Province_State","Country_Region","Last_Update","Latitude","Longitude","Confirmed","Deaths","Recovered","Active","Combined_Key"
"06-05-2020","45001","Abbeville","South Carolina","United States",2020-06-06 02:33:00,34.22333378,-82.46170658,47,0,0,47,"Abbeville, South Carolina, United States"
"06-05-2020","22001","Acadia","Louisiana","United States",2020-06-06 02:33:00,30.2950649,-92.41419698,467,26,0,441,"Acadia, Louisiana, United States"
"06-05-2020","51001","Accomack","Virginia","United States",2020-06-06 02:33:00,37.76707161,-75.63234615,969,12,0,957,"Accomack, Virginia, United States"
"06-05-2020","16001","Ada","Idaho","United States",2020-06-06 02:33:00,43.4526575,-116.2415516,833,22,0,811,"Ada, Idaho, United States"
"06-05-2020","19001","Adair","Iowa","United States",2020-06-06 02:33:00,41.33075609,-94.47105874,9,0,0,9,"Adair, Iowa, United States"
"06-05-2020","21001","Adair","Kentucky","United States",2020-06-06 02:33:00,37.10459774,-85.28129668,98,19,0,79,"Adair, Kentucky, United States"
"06-05-2020","29001","Adair","Missouri","United States",2020-06-06 02:33:00,40.19058551,-92.60078167,67,0,0,67,"Adair, Missouri, United States"
"06-05-2020","40001","Adair","Oklahoma","United States",2020-06-06 02:33:00,35.88494195,-94.65859267,93,4,0,89,"Adair, Oklahoma, United States"
"06-05-2020","08001","Adams","Colorado","United States",2020-06-06 02:33:00,39.87432092,-104.3362578,3515,135,0,3380,"Adams, Colorado, United States"
"06-05-2020","16003","Adams","Idaho","United States",2020-06-06 02:33:00,44.89333571,-116.4545247,3,0,0,3,"Adams, Idaho, United States"
"06-05-2020","17001","Adams","Illinois","United States",2020-06-06 02:33:00,39.98815591,-91.18786813,44,1,0,43,"Adams, Illinois, United States"
"06-05-2020","18001","Adams","Indiana","United States",2020-06-06 02:33:00,40.7457653,-84.93671406,23,1,0,22,"Adams, Indiana, United States"
"06-05-2020","19003","Adams","Iowa","United States",2020-06-06 02:33:00,41.02903567,-94.69932645,7,0,0,7,"Adams, Iowa, United States"
"06-05-2020","28001","Adams","Mississippi","United States",2020-06-06 02:33:00,31.47669768,-91.35326037,204,16,0,188,"Adams, Mississippi, United States"
"06-05-2020","31001","Adams","Nebraska","United States",2020-06-06 02:33:00,40.5244942,-98.50117804,275,11,0,264,"Adams, Nebraska, United States"
"06-05-2020","39001","Adams","Ohio","United States",2020-06-06 02:33:00,38.84541072,-83.4718964,11,1,0,10,"Adams, Ohio, United States"
"06-05-2020","42001","Adams","Pennsylvania","United States",2020-06-06 02:33:00,39.87140411,-77.21610347,264,8,0,256,"Adams, Pennsylvania, United States"
"06-05-2020","53001","Adams","Washington","United States",2020-06-06 02:33:00,46.98299757,-118.5601734,78,0,0,78,"Adams, Washington, United States"
"06-05-2020","55001","Adams","Wisconsin","United States",2020-06-06 02:33:00,43.96974651,-89.76782777,5,1,0,4,"Adams, Wisconsin, United States"
"06-05-2020","50001","Addison","Vermont","United States",2020-06-06 02:33:00,44.03217337,-73.14130877,64,2,0,62,"Addison, Vermont, United States"
"06-05-2020","45003","Aiken","South Carolina","United States",2020-06-06 02:33:00,33.54338026,-81.63645384,216,8,0,208,"Aiken, South Carolina, United States"
"06-05-2020","27001","Aitkin","Minnesota","United States",2020-06-06 02:33:00,46.60962049,-93.4116826,12,0,0,12,"Aitkin, Minnesota, United States"
"06-05-2020","12001","Alachua","Florida","United States",2020-06-06 02:33:00,29.67866525,-82.35928158,392,8,0,384,"Alachua, Florida, United States"
"06-05-2020","37001","Alamance","North Carolina","United States",2020-06-06 02:33:00,36.0434701,-79.39976137,458,30,0,428,"Alamance, North Carolina, United States"
"06-05-2020","06001","Alameda","California","United States",2020-06-06 02:33:00,37.64629437,-121.8929271,3725,101,0,3624,"Alameda, California, United States"
"06-05-2020","08003","Alamosa","Colorado","United States",2020-06-06 02:33:00,37.57250606,-105.7885451,87,2,0,85,"Alamosa, Colorado, United States"
"06-05-2020","36001","Albany","New York","United States",2020-06-06 02:33:00,42.60060306,-73.97723916,1941,112,0,1829,"Albany, New York, United States"
"06-05-2020","56001","Albany","Wyoming","United States",2020-06-06 02:33:00,41.65498705,-105.7235415,26,0,0,26,"Albany, Wyoming, United States"
"06-05-2020","51003","Albemarle","Virginia","United States",2020-06-06 02:33:00,38.02080697,-78.55481085,217,8,0,209,"Albemarle, Virginia, United States"
"06-05-2020","26001","Alcona","Michigan","United States",2020-06-06 02:33:00,44.6846864,-83.59507875,21,1,0,20,"Alcona, Michigan, United States"
"06-05-2020","28003","Alcorn","Mississippi","United States",2020-06-06 02:33:00,34.88084463,-88.57996173,19,1,0,18,"Alcorn, Mississippi, United States"
"06-05-2020","17003","Alexander","Illinois","United States",2020-06-06 02:33:00,37.18049267,-89.32910838,14,0,0,14,"Alexander, Illinois, United States"
"06-05-2020","37003","Alexander","North Carolina","United States",2020-06-06 02:33:00,35.9223796,-81.17751948,38,0,0,38,"Alexander, North Carolina, United States"
"06-05-2020","51510","Alexandria","Virginia","United States",2020-06-06 02:33:00,38.814003,-77.08183073,2045,45,0,2000,"Alexandria, Virginia, United States"
"06-05-2020","40003","Alfalfa","Oklahoma","United States",2020-06-06 02:33:00,36.73090616,-98.32408495,1,0,0,1,"Alfalfa, Oklahoma, United States"
"06-05-2020","19005","Allamakee","Iowa","United States",2020-06-06 02:33:00,43.28383218,-91.37860922,120,4,0,116,"Allamakee, Iowa, United States"
"06-05-2020","26005","Allegan","Michigan","United States",2020-06-06 02:33:00,42.59147037,-85.89102866,263,6,0,257,"Allegan, Michigan, United States"
"06-05-2020","24001","Allegany","Maryland","United States",2020-06-06 02:33:00,39.62357628,-78.69280486,183,16,0,167,"Allegany, Maryland, United States"
"06-05-2020","36003","Allegany","New York","United States",2020-06-06 02:33:00,42.25748406,-78.02750466,51,0,0,51,"Allegany, New York, United States"
"06-05-2020","37005","Alleghany","North Carolina","United States",2020-06-06 02:33:00,36.49360862,-81.12857041,27,0,0,27,"Alleghany, North Carolina, United States"
"06-05-2020","51005","Alleghany","Virginia","United States",2020-06-06 02:33:00,37.78636074,-80.00222498,24,2,0,22,"Alleghany, Virginia, United States"
"06-05-2020","42003","Allegheny","Pennsylvania","United States",2020-06-06 02:33:00,40.46809875,-79.98167747,1973,168,0,1805,"Allegheny, Pennsylvania, United States"
"06-05-2020","18003","Allen","Indiana","United States",2020-06-06 02:33:00,41.09194313,-85.06800636,1810,71,0,1739,"Allen, Indiana, United States"
"06-05-2020","20001","Allen","Kansas","United States",2020-06-06 02:33:00,37.88582951,-95.30030847,1,0,0,1,"Allen, Kansas, United States"
"06-05-2020","21003","Allen","Kentucky","United States",2020-06-06 02:33:00,36.75197631,-86.19457544,102,3,0,99,"Allen, Kentucky, United States"
"06-05-2020","22003","Allen","Louisiana","United States",2020-06-06 02:33:00,30.65385745,-92.82442028,186,10,0,176,"Allen, Louisiana, United States"
"06-05-2020","39003","Allen","Ohio","United States",2020-06-06 02:33:00,40.77285242,-84.10802343,221,33,0,188,"Allen, Ohio, United States"
"06-05-2020","45005","Allendale","South Carolina","United States",2020-06-06 02:33:00,32.98837386,-81.35321066,39,3,0,36,"Allendale, South Carolina, United States"
"06-05-2020","26007","Alpena","Michigan","United States",2020-06-06 02:33:00,45.03477666,-83.62212411,103,9,0,94,"Alpena, Michigan, United States"
"06-05-2020","06003","Alpine","California","United States",2020-06-06 02:33:00,38.59678594,-119.8223594,2,0,0,2,"Alpine, California, United States"
"06-05-2020","06005","Amador","California","United States",2020-06-06 02:33:00,38.44583082,-120.65696,10,0,0,10,"Amador, California, United States"
"06-05-2020","51007","Amelia","Virginia","United States",2020-06-06 02:33:00,37.34081025,-77.98584649,28,1,0,27,"Amelia, Virginia, United States"
"06-05-2020","51009","Amherst","Virginia","United States",2020-06-06 02:33:00,37.60308293,-79.14548696,27,0,0,27,"Amherst, Virginia, United States"
"06-05-2020","28005","Amite","Mississippi","United States",2020-06-06 02:33:00,31.17467303,-90.80501621,65,1,0,64,"Amite, Mississippi, United States"
"06-05-2020","02020","Anchorage","Alaska","United States",2020-06-06 02:33:00,61.14998174,-149.1426986,264,4,0,260,"Anchorage, Alaska, United States"
"06-05-2020","20003","Anderson","Kansas","United States",2020-06-06 02:33:00,38.21413251,-95.29272815,1,0,0,1,"Anderson, Kansas, United States"
"06-05-2020","21005","Anderson","Kentucky","United States",2020-06-06 02:33:00,38.00671029,-84.99171713,22,1,0,21,"Anderson, Kentucky, United States"
"06-05-2020","45007","Anderson","South Carolina","United States",2020-06-06 02:33:00,34.51828081,-82.63959517,263,9,0,254,"Anderson, South Carolina, United States"
"06-05-2020","47001","Anderson","Tennessee","United States",2020-06-06 02:33:00,36.12684348,-84.19965764,42,2,0,40,"Anderson, Tennessee, United States"
"06-05-2020","48001","Anderson","Texas","United States",2020-06-06 02:33:00,31.81534745,-95.65354823,87,0,0,87,"Anderson, Texas, United States"
"06-05-2020","29003","Andrew","Missouri","United States",2020-06-06 02:33:00,39.98492163,-94.80163024,32,0,0,32,"Andrew, Missouri, United States"
"06-05-2020","48003","Andrews","Texas","United States",2020-06-06 02:33:00,32.30468633,-102.6376548,27,0,0,27,"Andrews, Texas, United States"
"06-05-2020","23001","Androscoggin","Maine","United States",2020-06-06 02:33:00,44.1664747,-70.20380627,338,3,0,335,"Androscoggin, Maine, United States"
"06-05-2020","48005","Angelina","Texas","United States",2020-06-06 02:33:00,31.25457347,-94.60901487,232,5,0,227,"Angelina, Texas, United States"
"06-05-2020","24003","Anne Arundel","Maryland","United States",2020-06-06 02:33:00,39.00670238,-76.60329337,4150,182,0,3968,"Anne Arundel, Maryland, United States"
"06-05-2020","27003","Anoka","Minnesota","United States",2020-06-06 02:33:00,45.27476015,-93.24604565,1527,79,0,1448,"Anoka, Minnesota, United States"
"06-05-2020","37007","Anson","North Carolina","United States",2020-06-06 02:33:00,34.97403241,-80.09953279,70,1,0,69,"Anson, North Carolina, United States"
"06-05-2020","31003","Antelope","Nebraska","United States",2020-06-06 02:33:00,42.17695516,-98.0666283,8,0,0,8,"Antelope, Nebraska, United States"
"06-05-2020","26009","Antrim","Michigan","United States",2020-06-06 02:33:00,44.99690221,-85.15503082,13,0,0,13,"Antrim, Michigan, United States"
"06-05-2020","04001","Apache","Arizona","United States",2020-06-06 02:33:00,35.39465006,-109.4892383,1656,46,0,1610,"Apache, Arizona, United States"
"06-05-2020","19007","Appanoose","Iowa","United States",2020-06-06 02:33:00,40.74324454,-92.86865906,17,3,0,14,"Appanoose, Iowa, United States"
"06-05-2020","13001","Appling","Georgia","United States",2020-06-06 02:33:00,31.74847232,-82.28909114,180,13,0,167,"Appling, Georgia, United States"
"06-05-2020","51011","Appomattox","Virginia","United States",2020-06-06 02:33:00,37.37569884,-78.81340003,33,0,0,33,"Appomattox, Virginia, United States"
"06-05-2020","48007","Aransas","Texas","United States",2020-06-06 02:33:00,28.10556197,-96.9995047,5,0,0,5,"Aransas, Texas, United States"
"06-05-2020","08005","Arapahoe","Colorado","United States",2020-06-06 02:33:00,39.64977461,-104.3353617,4591,326,0,4265,"Arapahoe, Colorado, United States"
"06-05-2020","48009","Archer","Texas","United States",2020-06-06 02:33:00,33.61569967,-98.68754589,2,0,0,2,"Archer, Texas, United States"
"06-05-2020","08007","Archuleta","Colorado","United States",2020-06-06 02:33:00,37.19474156,-107.0476867,8,0,0,8,"Archuleta, Colorado, United States"
"06-05-2020","26011","Arenac","Michigan","United States",2020-06-06 02:33:00,44.0636262,-83.89277559,38,1,0,37,"Arenac, Michigan, United States"
"06-05-2020","05001","Arkansas","Arkansas","United States",2020-06-06 02:33:00,34.29145151,-91.37277296,7,0,0,7,"Arkansas, Arkansas, United States"
"06-05-2020","51013","Arlington","Virginia","United States",2020-06-06 02:33:00,38.8767675,-77.10139853,2173,121,0,2052,"Arlington, Virginia, United States"
"06-05-2020","42005","Armstrong","Pennsylvania","United States",2020-06-06 02:33:00,40.81665618,-79.46290811,64,5,0,59,"Armstrong, Pennsylvania, United States"
"06-05-2020","48011","Armstrong","Texas","United States",2020-06-06 02:33:00,34.96507426,-101.3574874,3,0,0,3,"Armstrong, Texas, United States"
"06-05-2020","23003","Aroostook","Maine","United States",2020-06-06 02:33:00,46.65926321,-68.59841248,10,1,0,9,"Aroostook, Maine, United States"
"06-05-2020","31005","Arthur","Nebraska","United States",2020-06-06 02:33:00,41.56896142,-101.6959559,0,0,0,0,"Arthur, Nebraska, United States"
"06-05-2020","22005","Ascension","Louisiana","United States",2020-06-06 02:33:00,30.20406249,-90.9132841,865,58,0,807,"Ascension, Louisiana, United States"
"06-05-2020","37009","Ashe","North Carolina","United States",2020-06-06 02:33:00,36.43296207,-81.49862729,39,0,0,39,"Ashe, North Carolina, United States"
"06-05-2020","39005","Ashland","Ohio","United States",2020-06-06 02:33:00,40.84772277,-82.27280781,23,0,0,23,"Ashland, Ohio, United States"
"06-05-2020","55003","Ashland","Wisconsin","United States",2020-06-06 02:33:00,46.31956891,-90.67837132,3,0,0,3,"Ashland, Wisconsin, United States"
"06-05-2020","05003","Ashley","Arkansas","United States",2020-06-06 02:33:00,33.19153461,-91.7698471,29,0,0,29,"Ashley, Arkansas, United States"
"06-05-2020","39007","Ashtabula","Ohio","United States",2020-06-06 02:33:00,41.70860332,-80.74830218,369,38,0,331,"Ashtabula, Ohio, United States"
"06-05-2020","53003","Asotin","Washington","United States",2020-06-06 02:33:00,46.18894415,-117.2022851,19,2,0,17,"Asotin, Washington, United States"
"06-05-2020","22007","Assumption","Louisiana","United States",2020-06-06 02:33:00,29.89946234,-91.06461642,253,13,0,240,"Assumption, Louisiana, United States"
"06-05-2020","48013","Atascosa","Texas","United States",2020-06-06 02:33:00,28.89333001,-98.52730485,41,2,0,39,"Atascosa, Texas, United States"
"06-05-2020","20005","Atchison","Kansas","United States",2020-06-06 02:33:00,39.53185661,-95.30870026,23,0,0,23,"Atchison, Kansas, United States"
"06-05-2020","29005","Atchison","Missouri","United States",2020-06-06 02:33:00,40.43238737,-95.42970639,3,0,0,3,"Atchison, Missouri, United States"
"06-05-2020","39009","Athens","Ohio","United States",2020-06-06 02:33:00,39.33425634,-82.04278644,18,1,0,17,"Athens, Ohio, United States"
"06-05-2020","13003","Atkinson","Georgia","United States",2020-06-06 02:33:00,31.29633502,-82.87545866,55,2,0,53,"Atkinson, Georgia, United States"
"06-05-2020","34001","Atlantic","New Jersey","United States",2020-06-06 02:33:00,39.47538693,-74.65848483,2309,167,0,2142,"Atlantic, New Jersey, United States"
"06-05-2020","40005","Atoka","Oklahoma","United States",2020-06-06 02:33:00,34.37366573,-96.03802487,4,0,0,4,"Atoka, Oklahoma, United States"
"06-05-2020","28007","Attala","Mississippi","United States",2020-06-06 02:33:00,33.08658803,-89.57838564,312,18,0,294,"Attala, Mississippi, United States"
"06-05-2020","29007","Audrain","Missouri","United States",2020-06-06 02:33:00,39.215877,-91.84242683,108,0,0,108,"Audrain, Missouri, United States"
"06-05-2020","19009","Audubon","Iowa","United States",2020-06-06 02:33:00,41.6844628,-94.90581859,13,1,0,12,"Audubon, Iowa, United States"
"06-05-2020","39011","Auglaize","Ohio","United States",2020-06-06 02:33:00,40.55998859,-84.2242143,77,3,0,74,"Auglaize, Ohio, United States"
"06-05-2020","51015","Augusta","Virginia","United States",2020-06-06 02:33:00,38.16404586,-79.12461614,124,2,0,122,"Augusta, Virginia, United States"
"06-05-2020","46003","Aurora","South Dakota","United States",2020-06-06 02:33:00,43.71757685,-98.56050467,27,0,0,27,"Aurora, South Dakota, United States"
"06-05-2020","48015","Austin","Texas","United States",2020-06-06 02:33:00,29.88548725,-96.27736949,29,0,0,29,"Austin, Texas, United States"
"06-05-2020","01001","Autauga","Alabama","United States",2020-06-06 02:33:00,32.53952745,-86.64408227,248,5,0,243,"Autauga, Alabama, United States"
"06-05-2020","37011","Avery","North Carolina","United States",2020-06-06 02:33:00,36.07569796,-81.92308483,3,0,0,3,"Avery, North Carolina, United States"
"06-05-2020","22009","Avoyelles","Louisiana","United States",2020-06-06 02:33:00,31.07796211,-92.00079449,151,9,0,142,"Avoyelles, Louisiana, United States"
"06-05-2020","08009","Baca","Colorado","United States",2020-06-06 02:33:00,37.31940883,-102.5603223,12,0,0,12,"Baca, Colorado, United States"
"06-05-2020","13005","Bacon","Georgia","United States",2020-06-06 02:33:00,31.55456473,-82.45936528,141,3,0,138,"Bacon, Georgia, United States"
"06-05-2020","48017","Bailey","Texas","United States",2020-06-06 02:33:00,34.06854817,-102.8299707,24,0,0,24,"Bailey, Texas, United States"
"06-05-2020","12003","Baker","Florida","United States",2020-06-06 02:33:00,30.33060121,-82.28467476,29,4,0,25,"Baker, Florida, United States"
"06-05-2020","13007","Baker","Georgia","United States",2020-06-06 02:33:00,31.32669878,-84.44218806,35,3,0,32,"Baker, Georgia, United States"
"06-05-2020","41001","Baker","Oregon","United States",2020-06-06 02:33:00,44.70915557,-117.6749883,1,0,0,1,"Baker, Oregon, United States"
"06-05-2020","01003","Baldwin","Alabama","United States",2020-06-06 02:33:00,30.72774991,-87.72207058,296,9,0,287,"Baldwin, Alabama, United States"
"06-05-2020","13009","Baldwin","Georgia","United States",2020-06-06 02:33:00,33.06882326,-83.24701748,387,27,0,360,"Baldwin, Georgia, United States"
"06-05-2020","21007","Ballard","Kentucky","United States",2020-06-06 02:33:00,37.05842757,-88.99427697,12,0,0,12,"Ballard, Kentucky, United States"
"06-05-2020","24005","Baltimore","Maryland","United States",2020-06-06 02:33:00,39.45784712,-76.62911955,6590,376,0,6214,"Baltimore, Maryland, United States"
"06-05-2020","24510","Baltimore City","Maryland","United States",2020-06-06 02:33:00,39.30211911,-76.61151012,6038,272,0,5766,"Baltimore City, Maryland, United States"
"06-05-2020","45009","Bamberg","South Carolina","United States",2020-06-06 02:33:00,33.21927586,-81.05659969,33,0,0,33,"Bamberg, South Carolina, United States"
"06-05-2020","48019","Bandera","Texas","United States",2020-06-06 02:33:00,29.74619598,-99.24598147,6,0,0,6,"Bandera, Texas, United States"
"06-05-2020","13011","Banks","Georgia","United States",2020-06-06 02:33:00,34.35607081,-83.49644388,88,1,0,87,"Banks, Georgia, United States"
"06-05-2020","16005","Bannock","Idaho","United States",2020-06-06 02:33:00,42.67002716,-112.2233311,45,1,0,44,"Bannock, Idaho, United States"
"06-05-2020","26013","Baraga","Michigan","United States",2020-06-06 02:33:00,46.6720582,-88.36363591,1,0,0,1,"Baraga, Michigan, United States"
"06-05-2020","20007","Barber","Kansas","United States",2020-06-06 02:33:00,37.2288586,-98.68460053,1,0,0,1,"Barber, Kansas, United States"
"06-05-2020","01005","Barbour","Alabama","United States",2020-06-06 02:33:00,31.868263,-85.3871286,183,1,0,182,"Barbour, Alabama, United States"
"06-05-2020","54001","Barbour","West Virginia","United States",2020-06-06 02:33:00,39.1307219,-80.00350858,8,1,0,7,"Barbour, West Virginia, United States"
"06-05-2020","38003","Barnes","North Dakota","United States",2020-06-06 02:33:00,46.93579637,-98.06605978,6,0,0,6,"Barnes, North Dakota, United States"
"06-05-2020","25001","Barnstable","Massachusetts","United States",2020-06-06 02:33:00,41.72980578,-70.28854339,1446,123,0,1323,"Barnstable, Massachusetts, United States"
"06-05-2020","45011","Barnwell","South Carolina","United States",2020-06-06 02:33:00,33.26679302,-81.43584352,52,1,0,51,"Barnwell, South Carolina, United States"
"06-05-2020","21009","Barren","Kentucky","United States",2020-06-06 02:33:00,36.96469836,-85.93338945,53,1,0,52,"Barren, Kentucky, United States"
"06-05-2020","55005","Barron","Wisconsin","United States",2020-06-06 02:33:00,45.42372701,-91.84833627,20,0,0,20,"Barron, Wisconsin, United States"
"06-05-2020","13013","Barrow","Georgia","United States",2020-06-06 02:33:00,33.99148694,-83.71436292,341,20,0,321,"Barrow, Georgia, United States"
"06-05-2020","26015","Barry","Michigan","United States",2020-06-06 02:33:00,42.59513984,-85.30834519,84,2,0,82,"Barry, Michigan, United States"
"06-05-2020","29009","Barry","Missouri","United States",2020-06-06 02:33:00,36.70978521,-93.82919888,9,0,0,9,"Barry, Missouri, United States"
"06-05-2020","18005","Bartholomew","Indiana","United States",2020-06-06 02:33:00,39.20744865,-85.89558181,531,39,0,492,"Bartholomew, Indiana, United States"
"06-05-2020","20009","Barton","Kansas","United States",2020-06-06 02:33:00,38.47889676,-98.75636726,44,2,0,42,"Barton, Kansas, United States"
"06-05-2020","13015","Bartow","Georgia","United States",2020-06-06 02:33:00,34.23732119,-84.83887523,514,39,0,475,"Bartow, Georgia, United States"
"06-05-2020","48021","Bastrop","Texas","United States",2020-06-06 02:33:00,30.10370699,-97.31206354,245,3,0,242,"Bastrop, Texas, United States"
"06-05-2020","29013","Bates","Missouri","United States",2020-06-06 02:33:00,38.25271289,-94.34113157,12,1,0,11,"Bates, Missouri, United States"
"06-05-2020","21011","Bath","Kentucky","United States",2020-06-06 02:33:00,38.14735938,-83.74588932,9,1,0,8,"Bath, Kentucky, United States"
"06-05-2020","51017","Bath","Virginia","United States",2020-06-06 02:33:00,38.05852573,-79.73912095,0,0,0,0,"Bath, Virginia, United States"
"06-05-2020","05005","Baxter","Arkansas","United States",2020-06-06 02:33:00,36.28784385,-92.33782872,12,0,0,12,"Baxter, Arkansas, United States"
"06-05-2020","12005","Bay","Florida","United States",2020-06-06 02:33:00,30.26548745,-85.62122584,115,4,0,111,"Bay, Florida, United States"
"06-05-2020","26017","Bay","Michigan","United States",2020-06-06 02:33:00,43.70639106,-83.98731479,370,26,0,344,"Bay, Michigan, United States"
"06-05-2020","55007","Bayfield","Wisconsin","United States",2020-06-06 02:33:00,46.52868768,-91.19716729,3,1,0,2,"Bayfield, Wisconsin, United States"
"06-05-2020","48023","Baylor","Texas","United States",2020-06-06 02:33:00,33.61640794,-99.21352901,3,0,0,3,"Baylor, Texas, United States"
"06-05-2020","46005","Beadle","South Dakota","United States",2020-06-06 02:33:00,44.41464384,-98.27858469,343,5,0,338,"Beadle, South Dakota, United States"
"06-05-2020",NA,"Bear River","Utah","United States",2020-06-06 02:33:00,41.52106798,-113.0832816,491,2,0,489,"Bear River, Utah, United States"
"06-05-2020","37013","Beaufort","North Carolina","United States",2020-06-06 02:33:00,35.48531943,-76.84325809,43,0,0,43,"Beaufort, North Carolina, United States"
"06-05-2020","45013","Beaufort","South Carolina","United States",2020-06-06 02:33:00,32.39226291,-80.72619758,417,14,0,403,"Beaufort, South Carolina, United States"
"06-05-2020","22011","Beauregard","Louisiana","United States",2020-06-06 02:33:00,30.64836518,-93.34173616,99,4,0,95,"Beauregard, Louisiana, United States"
"06-05-2020","40007","Beaver","Oklahoma","United States",2020-06-06 02:33:00,36.7496847,-100.4758872,24,0,0,24,"Beaver, Oklahoma, United States"
"06-05-2020","42007","Beaver","Pennsylvania","United States",2020-06-06 02:33:00,40.6825484,-80.34921611,598,74,0,524,"Beaver, Pennsylvania, United States"
"06-05-2020","30001","Beaverhead","Montana","United States",2020-06-06 02:33:00,45.13434354,-112.8984694,1,0,0,1,"Beaverhead, Montana, United States"
"06-05-2020","27005","Becker","Minnesota","United States",2020-06-06 02:33:00,46.93479392,-95.67158144,44,0,0,44,"Becker, Minnesota, United States"
"06-05-2020","40009","Beckham","Oklahoma","United States",2020-06-06 02:33:00,35.26862449,-99.68128023,7,0,0,7,"Beckham, Oklahoma, United States"
"06-05-2020","42009","Bedford","Pennsylvania","United States",2020-06-06 02:33:00,40.00522157,-78.48998442,43,2,0,41,"Bedford, Pennsylvania, United States"
"06-05-2020","47003","Bedford","Tennessee","United States",2020-06-06 02:33:00,35.51123746,-86.45549096,302,4,0,298,"Bedford, Tennessee, United States"
"06-05-2020","51019","Bedford","Virginia","United States",2020-06-06 02:33:00,37.3080028,-79.5281964,72,2,0,70,"Bedford, Virginia, United States"
"06-05-2020","48025","Bee","Texas","United States",2020-06-06 02:33:00,28.41761668,-97.74215593,18,0,0,18,"Bee, Texas, United States"
"06-05-2020","33001","Belknap","New Hampshire","United States",2020-06-06 02:33:00,43.51637314,-71.41684235,64,0,0,64,"Belknap, New Hampshire, United States"
"06-05-2020","21013","Bell","Kentucky","United States",2020-06-06 02:33:00,36.73355174,-83.67766671,2,0,0,2,"Bell, Kentucky, United States"
"06-05-2020","48027","Bell","Texas","United States",2020-06-06 02:33:00,31.03736027,-97.4785025,432,5,0,427,"Bell, Texas, United States"
"06-05-2020","39013","Belmont","Ohio","United States",2020-06-06 02:33:00,40.01625942,-80.9924051,449,15,0,434,"Belmont, Ohio, United States"
"06-05-2020","27007","Beltrami","Minnesota","United States",2020-06-06 02:33:00,47.97373527,-94.93732139,18,0,0,18,"Beltrami, Minnesota, United States"
"06-05-2020","13017","Ben Hill","Georgia","United States",2020-06-06 02:33:00,31.76095874,-83.22145359,87,1,0,86,"Ben Hill, Georgia, United States"
"06-05-2020","16009","Benewah","Idaho","United States",2020-06-06 02:33:00,47.21754179,-116.6586851,17,0,0,17,"Benewah, Idaho, United States"
"06-05-2020","50003","Bennington","Vermont","United States",2020-06-06 02:33:00,43.03519828,-73.09048868,66,1,0,65,"Bennington, Vermont, United States"
"06-05-2020","38005","Benson","North Dakota","United States",2020-06-06 02:33:00,48.0683985,-99.35916363,1,0,0,1,"Benson, North Dakota, United States"
"06-05-2020","08011","Bent","Colorado","United States",2020-06-06 02:33:00,37.95474293,-103.0720195,2,0,0,2,"Bent, Colorado, United States"
"06-05-2020","05007","Benton","Arkansas","United States",2020-06-06 02:33:00,36.33644656,-94.25680817,826,3,0,823,"Benton, Arkansas, United States"
"06-05-2020","18007","Benton","Indiana","United States",2020-06-06 02:33:00,40.60626947,-87.31093999,32,0,0,32,"Benton, Indiana, United States"
