"Date_Published","FIPS","Admin2","Province_State","Country_Region","Last_Update","Latitude","Longitude","Confirmed","Deaths","Recovered","Active","Combined_Key"
"06-30-2020","45001","Abbeville","South Carolina","United States",2020-07-01 04:33:52,34.22333378,-82.46170658,113,0,0,113,"Abbeville, South Carolina, United States"
"06-30-2020","22001","Acadia","Louisiana","United States",2020-07-01 04:33:52,30.2950649,-92.41419698,878,36,0,842,"Acadia, Louisiana, United States"
"06-30-2020","51001","Accomack","Virginia","United States",2020-07-01 04:33:52,37.76707161,-75.63234615,1042,14,0,1028,"Accomack, Virginia, United States"
"06-30-2020","16001","Ada","Idaho","United States",2020-07-01 04:33:52,43.4526575,-116.2415516,2169,23,0,2146,"Ada, Idaho, United States"
"06-30-2020","19001","Adair","Iowa","United States",2020-07-01 04:33:52,41.33075609,-94.47105874,15,0,0,15,"Adair, Iowa, United States"
"06-30-2020","21001","Adair","Kentucky","United States",2020-07-01 04:33:52,37.10459774,-85.28129668,117,19,0,98,"Adair, Kentucky, United States"
"06-30-2020","29001","Adair","Missouri","United States",2020-07-01 04:33:52,40.19058551,-92.60078167,90,0,0,90,"Adair, Missouri, United States"
"06-30-2020","40001","Adair","Oklahoma","United States",2020-07-01 04:33:52,35.88494195,-94.65859267,115,4,0,111,"Adair, Oklahoma, United States"
"06-30-2020","08001","Adams","Colorado","United States",2020-07-01 04:33:52,39.87432092,-104.3362578,4185,155,0,4030,"Adams, Colorado, United States"
"06-30-2020","16003","Adams","Idaho","United States",2020-07-01 04:33:52,44.89333571,-116.4545247,11,0,0,11,"Adams, Idaho, United States"
"06-30-2020","17001","Adams","Illinois","United States",2020-07-01 04:33:52,39.98815591,-91.18786813,87,1,0,86,"Adams, Illinois, United States"
"06-30-2020","18001","Adams","Indiana","United States",2020-07-01 04:33:52,40.7457653,-84.93671406,45,1,0,44,"Adams, Indiana, United States"
"06-30-2020","19003","Adams","Iowa","United States",2020-07-01 04:33:52,41.02903567,-94.69932645,8,0,0,8,"Adams, Iowa, United States"
"06-30-2020","28001","Adams","Mississippi","United States",2020-07-01 04:33:52,31.47669768,-91.35326037,263,18,0,245,"Adams, Mississippi, United States"
"06-30-2020","31001","Adams","Nebraska","United States",2020-07-01 04:33:52,40.5244942,-98.50117804,294,11,0,283,"Adams, Nebraska, United States"
"06-30-2020","39001","Adams","Ohio","United States",2020-07-01 04:33:52,38.84541072,-83.4718964,21,1,0,20,"Adams, Ohio, United States"
"06-30-2020","42001","Adams","Pennsylvania","United States",2020-07-01 04:33:52,39.87140411,-77.21610347,339,12,0,327,"Adams, Pennsylvania, United States"
"06-30-2020","53001","Adams","Washington","United States",2020-07-01 04:33:52,46.98299757,-118.5601734,141,0,0,141,"Adams, Washington, United States"
"06-30-2020","55001","Adams","Wisconsin","United States",2020-07-01 04:33:52,43.96974651,-89.76782777,19,2,0,17,"Adams, Wisconsin, United States"
"06-30-2020","50001","Addison","Vermont","United States",2020-07-01 04:33:52,44.03217337,-73.14130877,68,2,0,66,"Addison, Vermont, United States"
"06-30-2020","45003","Aiken","South Carolina","United States",2020-07-01 04:33:52,33.54338026,-81.63645384,387,10,0,377,"Aiken, South Carolina, United States"
"06-30-2020","27001","Aitkin","Minnesota","United States",2020-07-01 04:33:52,46.60962049,-93.4116826,14,0,0,14,"Aitkin, Minnesota, United States"
"06-30-2020","12001","Alachua","Florida","United States",2020-07-01 04:33:52,29.67866525,-82.35928158,1197,12,0,1185,"Alachua, Florida, United States"
"06-30-2020","37001","Alamance","North Carolina","United States",2020-07-01 04:33:52,36.0434701,-79.39976137,1146,37,0,1109,"Alamance, North Carolina, United States"
"06-30-2020","06001","Alameda","California","United States",2020-07-01 04:33:52,37.64629437,-121.8929271,5964,135,0,5829,"Alameda, California, United States"
"06-30-2020","08003","Alamosa","Colorado","United States",2020-07-01 04:33:52,37.57250606,-105.7885451,191,3,0,188,"Alamosa, Colorado, United States"
"06-30-2020","36001","Albany","New York","United States",2020-07-01 04:33:52,42.60060306,-73.97723916,2102,121,0,1981,"Albany, New York, United States"
"06-30-2020","56001","Albany","Wyoming","United States",2020-07-01 04:33:52,41.65498705,-105.7235415,34,0,0,34,"Albany, Wyoming, United States"
"06-30-2020","51003","Albemarle","Virginia","United States",2020-07-01 04:33:52,38.02080697,-78.55481085,401,8,0,393,"Albemarle, Virginia, United States"
"06-30-2020","26001","Alcona","Michigan","United States",2020-07-01 04:33:52,44.6846864,-83.59507875,22,1,0,21,"Alcona, Michigan, United States"
"06-30-2020","28003","Alcorn","Mississippi","United States",2020-07-01 04:33:52,34.88084463,-88.57996173,55,1,0,54,"Alcorn, Mississippi, United States"
"06-30-2020","17003","Alexander","Illinois","United States",2020-07-01 04:33:52,37.18049267,-89.32910838,22,0,0,22,"Alexander, Illinois, United States"
"06-30-2020","37003","Alexander","North Carolina","United States",2020-07-01 04:33:52,35.9223796,-81.17751948,91,1,0,90,"Alexander, North Carolina, United States"
"06-30-2020","51510","Alexandria","Virginia","United States",2020-07-01 04:33:52,38.814003,-77.08183073,2325,57,0,2268,"Alexandria, Virginia, United States"
"06-30-2020","40003","Alfalfa","Oklahoma","United States",2020-07-01 04:33:52,36.73090616,-98.32408495,1,0,0,1,"Alfalfa, Oklahoma, United States"
"06-30-2020","26003","Alger","Michigan","United States",2020-07-01 04:33:52,46.41292944,-86.60260122,3,0,0,3,"Alger, Michigan, United States"
"06-30-2020","19005","Allamakee","Iowa","United States",2020-07-01 04:33:52,43.28383218,-91.37860922,124,4,0,120,"Allamakee, Iowa, United States"
"06-30-2020","26005","Allegan","Michigan","United States",2020-07-01 04:33:52,42.59147037,-85.89102866,312,7,0,305,"Allegan, Michigan, United States"
"06-30-2020","24001","Allegany","Maryland","United States",2020-07-01 04:33:52,39.62357628,-78.69280486,205,17,0,188,"Allegany, Maryland, United States"
"06-30-2020","36003","Allegany","New York","United States",2020-07-01 04:33:52,42.25748406,-78.02750466,59,0,0,59,"Allegany, New York, United States"
"06-30-2020","37005","Alleghany","North Carolina","United States",2020-07-01 04:33:52,36.49360862,-81.12857041,31,0,0,31,"Alleghany, North Carolina, United States"
"06-30-2020","51005","Alleghany","Virginia","United States",2020-07-01 04:33:52,37.78636074,-80.00222498,31,2,0,29,"Alleghany, Virginia, United States"
"06-30-2020","42003","Allegheny","Pennsylvania","United States",2020-07-01 04:33:52,40.46809875,-79.98167747,2760,183,0,2577,"Allegheny, Pennsylvania, United States"
"06-30-2020","18003","Allen","Indiana","United States",2020-07-01 04:33:52,41.09194313,-85.06800636,2649,110,0,2539,"Allen, Indiana, United States"
"06-30-2020","20001","Allen","Kansas","United States",2020-07-01 04:33:52,37.88582951,-95.30030847,4,0,0,4,"Allen, Kansas, United States"
"06-30-2020","21003","Allen","Kentucky","United States",2020-07-01 04:33:52,36.75197631,-86.19457544,166,5,0,161,"Allen, Kentucky, United States"
"06-30-2020","22003","Allen","Louisiana","United States",2020-07-01 04:33:52,30.65385745,-92.82442028,304,10,0,294,"Allen, Louisiana, United States"
"06-30-2020","39003","Allen","Ohio","United States",2020-07-01 04:33:52,40.77285242,-84.10802343,293,38,0,255,"Allen, Ohio, United States"
"06-30-2020","45005","Allendale","South Carolina","United States",2020-07-01 04:33:52,32.98837386,-81.35321066,48,3,0,45,"Allendale, South Carolina, United States"
"06-30-2020","26007","Alpena","Michigan","United States",2020-07-01 04:33:52,45.03477666,-83.62212411,120,11,0,109,"Alpena, Michigan, United States"
"06-30-2020","06003","Alpine","California","United States",2020-07-01 04:33:52,38.59678594,-119.8223594,2,0,0,2,"Alpine, California, United States"
"06-30-2020","06005","Amador","California","United States",2020-07-01 04:33:52,38.44583082,-120.65696,22,0,0,22,"Amador, California, United States"
"06-30-2020","51007","Amelia","Virginia","United States",2020-07-01 04:33:52,37.34081025,-77.98584649,44,1,0,43,"Amelia, Virginia, United States"
"06-30-2020","51009","Amherst","Virginia","United States",2020-07-01 04:33:52,37.60308293,-79.14548696,36,0,0,36,"Amherst, Virginia, United States"
"06-30-2020","28005","Amite","Mississippi","United States",2020-07-01 04:33:52,31.17467303,-90.80501621,81,2,0,79,"Amite, Mississippi, United States"
"06-30-2020","02020","Anchorage","Alaska","United States",2020-07-01 04:33:52,61.14998174,-149.1426986,440,6,0,434,"Anchorage, Alaska, United States"
"06-30-2020","20003","Anderson","Kansas","United States",2020-07-01 04:33:52,38.21413251,-95.29272815,4,0,0,4,"Anderson, Kansas, United States"
"06-30-2020","21005","Anderson","Kentucky","United States",2020-07-01 04:33:52,38.00671029,-84.99171713,26,1,0,25,"Anderson, Kentucky, United States"
"06-30-2020","45007","Anderson","South Carolina","United States",2020-07-01 04:33:52,34.51828081,-82.63959517,608,11,0,597,"Anderson, South Carolina, United States"
"06-30-2020","47001","Anderson","Tennessee","United States",2020-07-01 04:33:52,36.12684348,-84.19965764,102,2,0,100,"Anderson, Tennessee, United States"
"06-30-2020","48001","Anderson","Texas","United States",2020-07-01 04:33:52,31.81534745,-95.65354823,1032,2,0,1030,"Anderson, Texas, United States"
"06-30-2020","29003","Andrew","Missouri","United States",2020-07-01 04:33:52,39.98492163,-94.80163024,49,0,0,49,"Andrew, Missouri, United States"
"06-30-2020","48003","Andrews","Texas","United States",2020-07-01 04:33:52,32.30468633,-102.6376548,75,0,0,75,"Andrews, Texas, United States"
"06-30-2020","23001","Androscoggin","Maine","United States",2020-07-01 04:33:52,44.1664747,-70.20380627,483,4,0,479,"Androscoggin, Maine, United States"
"06-30-2020","48005","Angelina","Texas","United States",2020-07-01 04:33:52,31.25457347,-94.60901487,476,6,0,470,"Angelina, Texas, United States"
"06-30-2020","24003","Anne Arundel","Maryland","United States",2020-07-01 04:33:52,39.00670238,-76.60329337,5109,207,0,4902,"Anne Arundel, Maryland, United States"
"06-30-2020","27003","Anoka","Minnesota","United States",2020-07-01 04:33:52,45.27476015,-93.24604565,2097,107,0,1990,"Anoka, Minnesota, United States"
"06-30-2020","37007","Anson","North Carolina","United States",2020-07-01 04:33:52,34.97403241,-80.09953279,128,2,0,126,"Anson, North Carolina, United States"
"06-30-2020","31003","Antelope","Nebraska","United States",2020-07-01 04:33:52,42.17695516,-98.0666283,9,1,0,8,"Antelope, Nebraska, United States"
"06-30-2020","26009","Antrim","Michigan","United States",2020-07-01 04:33:52,44.99690221,-85.15503082,18,0,0,18,"Antrim, Michigan, United States"
"06-30-2020","04001","Apache","Arizona","United States",2020-07-01 04:33:52,35.39465006,-109.4892383,2337,86,0,2251,"Apache, Arizona, United States"
"06-30-2020","19007","Appanoose","Iowa","United States",2020-07-01 04:33:52,40.74324454,-92.86865906,20,3,0,17,"Appanoose, Iowa, United States"
"06-30-2020","13001","Appling","Georgia","United States",2020-07-01 04:33:52,31.74847232,-82.28909114,258,14,0,244,"Appling, Georgia, United States"
"06-30-2020","51011","Appomattox","Virginia","United States",2020-07-01 04:33:52,37.37569884,-78.81340003,40,0,0,40,"Appomattox, Virginia, United States"
"06-30-2020","48007","Aransas","Texas","United States",2020-07-01 04:33:52,28.10556197,-96.9995047,23,0,0,23,"Aransas, Texas, United States"
"06-30-2020","08005","Arapahoe","Colorado","United States",2020-07-01 04:33:52,39.64977461,-104.3353617,5202,344,0,4858,"Arapahoe, Colorado, United States"
"06-30-2020","48009","Archer","Texas","United States",2020-07-01 04:33:52,33.61569967,-98.68754589,7,0,0,7,"Archer, Texas, United States"
"06-30-2020","08007","Archuleta","Colorado","United States",2020-07-01 04:33:52,37.19474156,-107.0476867,8,0,0,8,"Archuleta, Colorado, United States"
"06-30-2020","26011","Arenac","Michigan","United States",2020-07-01 04:33:52,44.0636262,-83.89277559,38,2,0,36,"Arenac, Michigan, United States"
"06-30-2020","05001","Arkansas","Arkansas","United States",2020-07-01 04:33:52,34.29145151,-91.37277296,28,0,0,28,"Arkansas, Arkansas, United States"
"06-30-2020","51013","Arlington","Virginia","United States",2020-07-01 04:33:52,38.8767675,-77.10139853,2479,132,0,2347,"Arlington, Virginia, United States"
"06-30-2020","42005","Armstrong","Pennsylvania","United States",2020-07-01 04:33:52,40.81665618,-79.46290811,74,6,0,68,"Armstrong, Pennsylvania, United States"
"06-30-2020","48011","Armstrong","Texas","United States",2020-07-01 04:33:52,34.96507426,-101.3574874,3,0,0,3,"Armstrong, Texas, United States"
"06-30-2020","23003","Aroostook","Maine","United States",2020-07-01 04:33:52,46.65926321,-68.59841248,23,1,0,22,"Aroostook, Maine, United States"
"06-30-2020","31005","Arthur","Nebraska","United States",2020-07-01 04:33:52,41.56896142,-101.6959559,0,0,0,0,"Arthur, Nebraska, United States"
"06-30-2020","22005","Ascension","Louisiana","United States",2020-07-01 04:33:52,30.20406249,-90.9132841,1171,58,0,1113,"Ascension, Louisiana, United States"
"06-30-2020","37009","Ashe","North Carolina","United States",2020-07-01 04:33:52,36.43296207,-81.49862729,54,1,0,53,"Ashe, North Carolina, United States"
"06-30-2020","39005","Ashland","Ohio","United States",2020-07-01 04:33:52,40.84772277,-82.27280781,53,1,0,52,"Ashland, Ohio, United States"
"06-30-2020","55003","Ashland","Wisconsin","United States",2020-07-01 04:33:52,46.31956891,-90.67837132,3,0,0,3,"Ashland, Wisconsin, United States"
"06-30-2020","05003","Ashley","Arkansas","United States",2020-07-01 04:33:52,33.19153461,-91.7698471,71,1,0,70,"Ashley, Arkansas, United States"
"06-30-2020","39007","Ashtabula","Ohio","United States",2020-07-01 04:33:52,41.70860332,-80.74830218,420,43,0,377,"Ashtabula, Ohio, United States"
"06-30-2020","53003","Asotin","Washington","United States",2020-07-01 04:33:52,46.18894415,-117.2022851,21,2,0,19,"Asotin, Washington, United States"
"06-30-2020","22007","Assumption","Louisiana","United States",2020-07-01 04:33:52,29.89946234,-91.06461642,352,14,0,338,"Assumption, Louisiana, United States"
"06-30-2020","48013","Atascosa","Texas","United States",2020-07-01 04:33:52,28.89333001,-98.52730485,106,2,0,104,"Atascosa, Texas, United States"
"06-30-2020","20005","Atchison","Kansas","United States",2020-07-01 04:33:52,39.53185661,-95.30870026,34,0,0,34,"Atchison, Kansas, United States"
"06-30-2020","29005","Atchison","Missouri","United States",2020-07-01 04:33:52,40.43238737,-95.42970639,3,0,0,3,"Atchison, Missouri, United States"
"06-30-2020","39009","Athens","Ohio","United States",2020-07-01 04:33:52,39.33425634,-82.04278644,33,1,0,32,"Athens, Ohio, United States"
"06-30-2020","13003","Atkinson","Georgia","United States",2020-07-01 04:33:52,31.29633502,-82.87545866,147,2,0,145,"Atkinson, Georgia, United States"
"06-30-2020","34001","Atlantic","New Jersey","United States",2020-07-01 04:33:52,39.47538693,-74.65848483,2863,216,0,2647,"Atlantic, New Jersey, United States"
"06-30-2020","40005","Atoka","Oklahoma","United States",2020-07-01 04:33:52,34.37366573,-96.03802487,22,0,0,22,"Atoka, Oklahoma, United States"
"06-30-2020","28007","Attala","Mississippi","United States",2020-07-01 04:33:52,33.08658803,-89.57838564,350,23,0,327,"Attala, Mississippi, United States"
"06-30-2020","29007","Audrain","Missouri","United States",2020-07-01 04:33:52,39.215877,-91.84242683,138,1,0,137,"Audrain, Missouri, United States"
"06-30-2020","19009","Audubon","Iowa","United States",2020-07-01 04:33:52,41.6844628,-94.90581859,17,1,0,16,"Audubon, Iowa, United States"
"06-30-2020","39011","Auglaize","Ohio","United States",2020-07-01 04:33:52,40.55998859,-84.2242143,99,3,0,96,"Auglaize, Ohio, United States"
"06-30-2020","51015","Augusta","Virginia","United States",2020-07-01 04:33:52,38.16404586,-79.12461614,185,2,0,183,"Augusta, Virginia, United States"
"06-30-2020","46003","Aurora","South Dakota","United States",2020-07-01 04:33:52,43.71757685,-98.56050467,34,0,0,34,"Aurora, South Dakota, United States"
"06-30-2020","48015","Austin","Texas","United States",2020-07-01 04:33:52,29.88548725,-96.27736949,71,0,0,71,"Austin, Texas, United States"
"06-30-2020","01001","Autauga","Alabama","United States",2020-07-01 04:33:52,32.53952745,-86.64408227,554,11,0,543,"Autauga, Alabama, United States"
"06-30-2020","37011","Avery","North Carolina","United States",2020-07-01 04:33:52,36.07569796,-81.92308483,12,0,0,12,"Avery, North Carolina, United States"
"06-30-2020","22009","Avoyelles","Louisiana","United States",2020-07-01 04:33:52,31.07796211,-92.00079449,319,13,0,306,"Avoyelles, Louisiana, United States"
"06-30-2020","08009","Baca","Colorado","United States",2020-07-01 04:33:52,37.31940883,-102.5603223,14,0,0,14,"Baca, Colorado, United States"
"06-30-2020","13005","Bacon","Georgia","United States",2020-07-01 04:33:52,31.55456473,-82.45936528,236,4,0,232,"Bacon, Georgia, United States"
"06-30-2020","48017","Bailey","Texas","United States",2020-07-01 04:33:52,34.06854817,-102.8299707,94,1,0,93,"Bailey, Texas, United States"
"06-30-2020","12003","Baker","Florida","United States",2020-07-01 04:33:52,30.33060121,-82.28467476,63,4,0,59,"Baker, Florida, United States"
"06-30-2020","13007","Baker","Georgia","United States",2020-07-01 04:33:52,31.32669878,-84.44218806,43,3,0,40,"Baker, Georgia, United States"
"06-30-2020","41001","Baker","Oregon","United States",2020-07-01 04:33:52,44.70915557,-117.6749883,1,0,0,1,"Baker, Oregon, United States"
"06-30-2020","01003","Baldwin","Alabama","United States",2020-07-01 04:33:52,30.72774991,-87.72207058,691,9,0,682,"Baldwin, Alabama, United States"
"06-30-2020","13009","Baldwin","Georgia","United States",2020-07-01 04:33:52,33.06882326,-83.24701748,499,34,0,465,"Baldwin, Georgia, United States"
"06-30-2020","21007","Ballard","Kentucky","United States",2020-07-01 04:33:52,37.05842757,-88.99427697,14,0,0,14,"Ballard, Kentucky, United States"
"06-30-2020","24005","Baltimore","Maryland","United States",2020-07-01 04:33:52,39.45784712,-76.62911955,7985,473,0,7512,"Baltimore, Maryland, United States"
"06-30-2020","24510","Baltimore City","Maryland","United States",2020-07-01 04:33:52,39.30211911,-76.61151012,7546,337,0,7209,"Baltimore City, Maryland, United States"
"06-30-2020","45009","Bamberg","South Carolina","United States",2020-07-01 04:33:52,33.21927586,-81.05659969,113,1,0,112,"Bamberg, South Carolina, United States"
"06-30-2020","48019","Bandera","Texas","United States",2020-07-01 04:33:52,29.74619598,-99.24598147,16,0,0,16,"Bandera, Texas, United States"
"06-30-2020","13011","Banks","Georgia","United States",2020-07-01 04:33:52,34.35607081,-83.49644388,133,0,0,133,"Banks, Georgia, United States"
"06-30-2020","31007","Banner","Nebraska","United States",2020-07-01 04:33:52,41.54634427,-103.7114332,1,0,0,1,"Banner, Nebraska, United States"
"06-30-2020","16005","Bannock","Idaho","United States",2020-07-01 04:33:52,42.67002716,-112.2233311,102,1,0,101,"Bannock, Idaho, United States"
"06-30-2020","26013","Baraga","Michigan","United States",2020-07-01 04:33:52,46.6720582,-88.36363591,5,0,0,5,"Baraga, Michigan, United States"
"06-30-2020","20007","Barber","Kansas","United States",2020-07-01 04:33:52,37.2288586,-98.68460053,1,0,0,1,"Barber, Kansas, United States"
"06-30-2020","01005","Barbour","Alabama","United States",2020-07-01 04:33:52,31.868263,-85.3871286,328,1,0,327,"Barbour, Alabama, United States"
"06-30-2020","54001","Barbour","West Virginia","United States",2020-07-01 04:33:52,39.1307219,-80.00350858,15,1,0,14,"Barbour, West Virginia, United States"
"06-30-2020","38003","Barnes","North Dakota","United States",2020-07-01 04:33:52,46.93579637,-98.06605978,19,0,0,19,"Barnes, North Dakota, United States"
"06-30-2020","25001","Barnstable","Massachusetts","United States",2020-07-01 04:33:52,41.72980578,-70.28854339,1538,144,0,1394,"Barnstable, Massachusetts, United States"
"06-30-2020","45011","Barnwell","South Carolina","United States",2020-07-01 04:33:52,33.26679302,-81.43584352,79,1,0,78,"Barnwell, South Carolina, United States"
"06-30-2020","21009","Barren","Kentucky","United States",2020-07-01 04:33:52,36.96469836,-85.93338945,86,2,0,84,"Barren, Kentucky, United States"
"06-30-2020","55005","Barron","Wisconsin","United States",2020-07-01 04:33:52,45.42372701,-91.84833627,34,1,0,33,"Barron, Wisconsin, United States"
"06-30-2020","13013","Barrow","Georgia","United States",2020-07-01 04:33:52,33.99148694,-83.71436292,523,25,0,498,"Barrow, Georgia, United States"
"06-30-2020","26015","Barry","Michigan","United States",2020-07-01 04:33:52,42.59513984,-85.30834519,102,2,0,100,"Barry, Michigan, United States"
"06-30-2020","29009","Barry","Missouri","United States",2020-07-01 04:33:52,36.70978521,-93.82919888,43,0,0,43,"Barry, Missouri, United States"
"06-30-2020","18005","Bartholomew","Indiana","United States",2020-07-01 04:33:52,39.20744865,-85.89558181,578,44,0,534,"Bartholomew, Indiana, United States"
"06-30-2020","20009","Barton","Kansas","United States",2020-07-01 04:33:52,38.47889676,-98.75636726,56,2,0,54,"Barton, Kansas, United States"
"06-30-2020","29011","Barton","Missouri","United States",2020-07-01 04:33:52,37.50207671,-94.34757022,21,0,0,21,"Barton, Missouri, United States"
"06-30-2020","13015","Bartow","Georgia","United States",2020-07-01 04:33:52,34.23732119,-84.83887523,688,42,0,646,"Bartow, Georgia, United States"
"06-30-2020","48021","Bastrop","Texas","United States",2020-07-01 04:33:52,30.10370699,-97.31206354,442,6,0,436,"Bastrop, Texas, United States"
"06-30-2020","29013","Bates","Missouri","United States",2020-07-01 04:33:52,38.25271289,-94.34113157,12,1,0,11,"Bates, Missouri, United States"
"06-30-2020","21011","Bath","Kentucky","United States",2020-07-01 04:33:52,38.14735938,-83.74588932,15,1,0,14,"Bath, Kentucky, United States"
"06-30-2020","51017","Bath","Virginia","United States",2020-07-01 04:33:52,38.05852573,-79.73912095,0,0,0,0,"Bath, Virginia, United States"
"06-30-2020","05005","Baxter","Arkansas","United States",2020-07-01 04:33:52,36.28784385,-92.33782872,20,0,0,20,"Baxter, Arkansas, United States"
"06-30-2020","12005","Bay","Florida","United States",2020-07-01 04:33:52,30.26548745,-85.62122584,384,4,0,380,"Bay, Florida, United States"
"06-30-2020","26017","Bay","Michigan","United States",2020-07-01 04:33:52,43.70639106,-83.98731479,392,30,0,362,"Bay, Michigan, United States"
"06-30-2020","55007","Bayfield","Wisconsin","United States",2020-07-01 04:33:52,46.52868768,-91.19716729,3,1,0,2,"Bayfield, Wisconsin, United States"
"06-30-2020","48023","Baylor","Texas","United States",2020-07-01 04:33:52,33.61640794,-99.21352901,1,0,0,1,"Baylor, Texas, United States"
"06-30-2020","46005","Beadle","South Dakota","United States",2020-07-01 04:33:52,44.41464384,-98.27858469,524,6,0,518,"Beadle, South Dakota, United States"
"06-30-2020","16007","Bear Lake","Idaho","United States",2020-07-01 04:33:52,42.28269683,-111.3289238,1,0,0,1,"Bear Lake, Idaho, United States"
"06-30-2020",NA,"Bear River","Utah","United States",2020-07-01 04:33:52,41.52106798,-113.0832816,1521,2,0,1519,"Bear River, Utah, United States"
"06-30-2020","37013","Beaufort","North Carolina","United States",2020-07-01 04:33:52,35.48531943,-76.84325809,83,0,0,83,"Beaufort, North Carolina, United States"
"06-30-2020","45013","Beaufort","South Carolina","United States",2020-07-01 04:33:52,32.39226291,-80.72619758,1223,18,0,1205,"Beaufort, South Carolina, United States"
"06-30-2020","22011","Beauregard","Louisiana","United States",2020-07-01 04:33:52,30.64836518,-93.34173616,201,8,0,193,"Beauregard, Louisiana, United States"
"06-30-2020","40007","Beaver","Oklahoma","United States",2020-07-01 04:33:52,36.7496847,-100.4758872,30,0,0,30,"Beaver, Oklahoma, United States"
"06-30-2020","42007","Beaver","Pennsylvania","United States",2020-07-01 04:33:52,40.6825484,-80.34921611,669,78,0,591,"Beaver, Pennsylvania, United States"
"06-30-2020","30001","Beaverhead","Montana","United States",2020-07-01 04:33:52,45.13434354,-112.8984694,1,0,0,1,"Beaverhead, Montana, United States"
"06-30-2020","27005","Becker","Minnesota","United States",2020-07-01 04:33:52,46.93479392,-95.67158144,54,0,0,54,"Becker, Minnesota, United States"
"06-30-2020","40009","Beckham","Oklahoma","United States",2020-07-01 04:33:52,35.26862449,-99.68128023,11,0,0,11,"Beckham, Oklahoma, United States"
"06-30-2020","42009","Bedford","Pennsylvania","United States",2020-07-01 04:33:52,40.00522157,-78.48998442,82,3,0,79,"Bedford, Pennsylvania, United States"
"06-30-2020","47003","Bedford","Tennessee","United States",2020-07-01 04:33:52,35.51123746,-86.45549096,513,5,0,508,"Bedford, Tennessee, United States"
"06-30-2020","51019","Bedford","Virginia","United States",2020-07-01 04:33:52,37.3080028,-79.5281964,118,3,0,115,"Bedford, Virginia, United States"
"06-30-2020","48025","Bee","Texas","United States",2020-07-01 04:33:52,28.41761668,-97.74215593,46,0,0,46,"Bee, Texas, United States"
"06-30-2020","33001","Belknap","New Hampshire","United States",2020-07-01 04:33:52,43.51637314,-71.41684235,81,1,0,80,"Belknap, New Hampshire, United States"
"06-30-2020","21013","Bell","Kentucky","United States",2020-07-01 04:33:52,36.73355174,-83.67766671,8,0,0,8,"Bell, Kentucky, United States"
"06-30-2020","48027","Bell","Texas","United States",2020-07-01 04:33:52,31.03736027,-97.4785025,1187,13,0,1174,"Bell, Texas, United States"
"06-30-2020","39013","Belmont","Ohio","United States",2020-07-01 04:33:52,40.01625942,-80.9924051,528,21,0,507,"Belmont, Ohio, United States"
"06-30-2020","27007","Beltrami","Minnesota","United States",2020-07-01 04:33:52,47.97373527,-94.93732139,27,0,0,27,"Beltrami, Minnesota, United States"
"06-30-2020","13017","Ben Hill","Georgia","United States",2020-07-01 04:33:52,31.76095874,-83.22145359,165,1,0,164,"Ben Hill, Georgia, United States"
"06-30-2020","16009","Benewah","Idaho","United States",2020-07-01 04:33:52,47.21754179,-116.6586851,21,0,0,21,"Benewah, Idaho, United States"
