"Date_Published","FIPS","Admin2","Province_State","Country_Region","Last_Update","Latitude","Longitude","Confirmed","Deaths","Recovered","Active","Combined_Key"
"06-30-2020","26149","St. Joseph","Michigan","United States",2020-07-01 04:33:52,41.91441767,-85.52797979,320,4,0,316,"St. Joseph, Michigan, United States"
"06-30-2020","22097","St. Landry","Louisiana","United States",2020-07-01 04:33:52,30.59724262,-92.00135806,626,57,0,569,"St. Landry, Louisiana, United States"
"06-30-2020","36089","St. Lawrence","New York","United States",2020-07-01 04:33:52,44.4976179,-75.06550039,219,2,0,217,"St. Lawrence, New York, United States"
"06-30-2020","27137","St. Louis","Minnesota","United States",2020-07-01 04:33:52,47.6048407,-92.46879855,161,14,0,147,"St. Louis, Minnesota, United States"
"06-30-2020","29189","St. Louis","Missouri","United States",2020-07-01 04:33:52,38.6377004,-90.4458375,6582,568,0,6014,"St. Louis, Missouri, United States"
"06-30-2020","29510","St. Louis City","Missouri","United States",2020-07-01 04:33:52,38.63555736,-90.24349225,2493,156,0,2337,"St. Louis City, Missouri, United States"
"06-30-2020","12111","St. Lucie","Florida","United States",2020-07-01 04:33:52,27.37763908,-80.47106649,1724,47,0,1677,"St. Lucie, Florida, United States"
"06-30-2020","22099","St. Martin","Louisiana","United States",2020-07-01 04:33:52,30.13112107,-91.61403569,712,26,0,686,"St. Martin, Louisiana, United States"
"06-30-2020","22101","St. Mary","Louisiana","United States",2020-07-01 04:33:52,29.69262097,-91.44702164,469,38,0,431,"St. Mary, Louisiana, United States"
"06-30-2020","24037","St. Mary's","Maryland","United States",2020-07-01 04:33:52,38.30058422,-76.6062928,637,51,0,586,"St. Mary's, Maryland, United States"
"06-30-2020","22103","St. Tammany","Louisiana","United States",2020-07-01 04:33:52,30.40942847,-89.95642711,2308,175,0,2133,"St. Tammany, Louisiana, United States"
"06-30-2020","20185","Stafford","Kansas","United States",2020-07-01 04:33:52,38.03100851,-98.71762001,1,0,0,1,"Stafford, Kansas, United States"
"06-30-2020","51179","Stafford","Virginia","United States",2020-07-01 04:33:52,38.41758738,-77.45917053,988,5,0,983,"Stafford, Virginia, United States"
"06-30-2020","06099","Stanislaus","California","United States",2020-07-01 04:33:52,37.55862499,-120.9970722,2165,42,0,2123,"Stanislaus, California, United States"
"06-30-2020","46117","Stanley","South Dakota","United States",2020-07-01 04:33:52,44.41381872,-100.7349153,12,0,0,12,"Stanley, South Dakota, United States"
"06-30-2020","37167","Stanly","North Carolina","United States",2020-07-01 04:33:52,35.31647813,-80.25093221,378,5,0,373,"Stanly, North Carolina, United States"
"06-30-2020","20187","Stanton","Kansas","United States",2020-07-01 04:33:52,37.56304714,-101.7843534,10,0,0,10,"Stanton, Kansas, United States"
"06-30-2020","31167","Stanton","Nebraska","United States",2020-07-01 04:33:52,41.9169835,-97.19394708,21,0,0,21,"Stanton, Nebraska, United States"
"06-30-2020","17175","Stark","Illinois","United States",2020-07-01 04:33:52,41.09309773,-89.79745866,3,0,0,3,"Stark, Illinois, United States"
"06-30-2020","38089","Stark","North Dakota","United States",2020-07-01 04:33:52,46.80851182,-102.6576326,73,2,0,71,"Stark, North Dakota, United States"
"06-30-2020","39151","Stark","Ohio","United States",2020-07-01 04:33:52,40.81482476,-81.36437305,1042,112,0,930,"Stark, Ohio, United States"
"06-30-2020","18149","Starke","Indiana","United States",2020-07-01 04:33:52,41.27890281,-86.64686895,68,3,0,65,"Starke, Indiana, United States"
"06-30-2020","48427","Starr","Texas","United States",2020-07-01 04:33:52,26.56150059,-98.73892358,598,3,0,595,"Starr, Texas, United States"
"06-30-2020","51790","Staunton","Virginia","United States",2020-07-01 04:33:52,38.15965544,-79.05979937,73,0,0,73,"Staunton, Virginia, United States"
"06-30-2020","29186","Ste. Genevieve","Missouri","United States",2020-07-01 04:33:52,37.89090059,-90.1949941,17,1,0,16,"Ste. Genevieve, Missouri, United States"
"06-30-2020","27145","Stearns","Minnesota","United States",2020-07-01 04:33:52,45.55192576,-94.61078221,2265,19,0,2246,"Stearns, Minnesota, United States"
"06-30-2020","27147","Steele","Minnesota","United States",2020-07-01 04:33:52,44.02240351,-93.22627088,215,0,0,215,"Steele, Minnesota, United States"
"06-30-2020","38091","Steele","North Dakota","United States",2020-07-01 04:33:52,47.45611548,-97.72728747,1,0,0,1,"Steele, North Dakota, United States"
"06-30-2020","13257","Stephens","Georgia","United States",2020-07-01 04:33:52,34.55151201,-83.29405315,224,6,0,218,"Stephens, Georgia, United States"
"06-30-2020","40137","Stephens","Oklahoma","United States",2020-07-01 04:33:52,34.48556989,-97.85141892,63,1,0,62,"Stephens, Oklahoma, United States"
"06-30-2020","48429","Stephens","Texas","United States",2020-07-01 04:33:52,32.73553157,-98.83631615,8,0,0,8,"Stephens, Texas, United States"
"06-30-2020","17177","Stephenson","Illinois","United States",2020-07-01 04:33:52,42.35129217,-89.662598,270,5,0,265,"Stephenson, Illinois, United States"
"06-30-2020","18151","Steuben","Indiana","United States",2020-07-01 04:33:52,41.64423868,-85.00101094,123,2,0,121,"Steuben, Indiana, United States"
"06-30-2020","36101","Steuben","New York","United States",2020-07-01 04:33:52,42.2689144,-77.3829924,266,41,0,225,"Steuben, New York, United States"
"06-30-2020","20189","Stevens","Kansas","United States",2020-07-01 04:33:52,37.1923008,-101.3118967,31,0,0,31,"Stevens, Kansas, United States"
"06-30-2020","27149","Stevens","Minnesota","United States",2020-07-01 04:33:52,45.58613007,-96.00163705,4,0,0,4,"Stevens, Minnesota, United States"
"06-30-2020","53065","Stevens","Washington","United States",2020-07-01 04:33:52,48.40035475,-117.8542701,18,1,0,17,"Stevens, Washington, United States"
"06-30-2020","13259","Stewart","Georgia","United States",2020-07-01 04:33:52,32.07996777,-84.83208037,119,3,0,116,"Stewart, Georgia, United States"
"06-30-2020","47161","Stewart","Tennessee","United States",2020-07-01 04:33:52,36.50235092,-87.83920548,21,0,0,21,"Stewart, Tennessee, United States"
"06-30-2020","30095","Stillwater","Montana","United States",2020-07-01 04:33:52,45.67071407,-109.3950061,5,0,0,5,"Stillwater, Montana, United States"
"06-30-2020","29207","Stoddard","Missouri","United States",2020-07-01 04:33:52,36.85571651,-89.9444155,134,8,0,126,"Stoddard, Missouri, United States"
"06-30-2020","37169","Stokes","North Carolina","United States",2020-07-01 04:33:52,36.4017975,-80.23893369,125,1,0,124,"Stokes, North Carolina, United States"
"06-30-2020","05137","Stone","Arkansas","United States",2020-07-01 04:33:52,35.86251946,-92.15684085,14,0,0,14,"Stone, Arkansas, United States"
"06-30-2020","28131","Stone","Mississippi","United States",2020-07-01 04:33:52,30.79187949,-89.11547539,51,1,0,50,"Stone, Mississippi, United States"
"06-30-2020","29209","Stone","Missouri","United States",2020-07-01 04:33:52,36.75000327,-93.45256475,12,0,0,12,"Stone, Missouri, United States"
"06-30-2020","32029","Storey","Nevada","United States",2020-07-01 04:33:52,39.44875482,-119.5250207,2,0,0,2,"Storey, Nevada, United States"
"06-30-2020","19169","Story","Iowa","United States",2020-07-01 04:33:52,42.03621213,-93.46499005,694,3,0,691,"Story, Iowa, United States"
"06-30-2020","33017","Strafford","New Hampshire","United States",2020-07-01 04:33:52,43.291833,-71.02336013,292,13,0,279,"Strafford, New Hampshire, United States"
"06-30-2020","38093","Stutsman","North Dakota","United States",2020-07-01 04:33:52,46.97962541,-98.95637318,63,1,0,62,"Stutsman, North Dakota, United States"
"06-30-2020","56035","Sublette","Wyoming","United States",2020-07-01 04:33:52,42.76558279,-109.9130922,6,0,0,6,"Sublette, Wyoming, United States"
"06-30-2020","25025","Suffolk","Massachusetts","United States",2020-07-01 04:33:52,42.3279514,-71.07850442,19819,1002,0,18817,"Suffolk, Massachusetts, United States"
"06-30-2020","36103","Suffolk","New York","United States",2020-07-01 04:33:52,40.88320119,-72.8012172,41385,1981,0,39404,"Suffolk, New York, United States"
"06-30-2020","51800","Suffolk","Virginia","United States",2020-07-01 04:33:52,36.70155394,-76.63603554,414,34,0,380,"Suffolk, Virginia, United States"
"06-30-2020","18153","Sullivan","Indiana","United States",2020-07-01 04:33:52,39.08952258,-87.41414469,45,1,0,44,"Sullivan, Indiana, United States"
"06-30-2020","29211","Sullivan","Missouri","United States",2020-07-01 04:33:52,40.2099105,-93.11150106,108,0,0,108,"Sullivan, Missouri, United States"
"06-30-2020","33019","Sullivan","New Hampshire","United States",2020-07-01 04:33:52,43.36094111,-72.22203125,32,1,0,31,"Sullivan, New Hampshire, United States"
"06-30-2020","36105","Sullivan","New York","United States",2020-07-01 04:33:52,41.71579493,-74.76394559,1451,45,0,1406,"Sullivan, New York, United States"
"06-30-2020","42113","Sullivan","Pennsylvania","United States",2020-07-01 04:33:52,41.44634738,-76.51246591,5,0,0,5,"Sullivan, Pennsylvania, United States"
"06-30-2020","47163","Sullivan","Tennessee","United States",2020-07-01 04:33:52,36.51240691,-82.30412917,89,2,0,87,"Sullivan, Tennessee, United States"
"06-30-2020","46119","Sully","South Dakota","United States",2020-07-01 04:33:52,44.71571812,-100.1278092,1,0,0,1,"Sully, South Dakota, United States"
"06-30-2020","54089","Summers","West Virginia","United States",2020-07-01 04:33:52,37.65390597,-80.86009693,2,0,0,2,"Summers, West Virginia, United States"
"06-30-2020","08117","Summit","Colorado","United States",2020-07-01 04:33:52,39.63803232,-106.1150762,269,3,0,266,"Summit, Colorado, United States"
"06-30-2020","39153","Summit","Ohio","United States",2020-07-01 04:33:52,41.12464734,-81.53123079,1953,205,0,1748,"Summit, Ohio, United States"
"06-30-2020","49043","Summit","Utah","United States",2020-07-01 04:33:52,40.86688146,-110.9535882,488,0,0,488,"Summit, Utah, United States"
"06-30-2020","20191","Sumner","Kansas","United States",2020-07-01 04:33:52,37.23682549,-97.47721621,11,1,0,10,"Sumner, Kansas, United States"
"06-30-2020","47165","Sumner","Tennessee","United States",2020-07-01 04:33:52,36.46824103,-86.45917204,1417,52,0,1365,"Sumner, Tennessee, United States"
"06-30-2020","01119","Sumter","Alabama","United States",2020-07-01 04:33:52,32.59117397,-88.19916205,275,12,0,263,"Sumter, Alabama, United States"
"06-30-2020","12119","Sumter","Florida","United States",2020-07-01 04:33:52,28.70181754,-82.0794267,345,17,0,328,"Sumter, Florida, United States"
"06-30-2020","13261","Sumter","Georgia","United States",2020-07-01 04:33:52,32.03650571,-84.19821492,554,50,0,504,"Sumter, Georgia, United States"
"06-30-2020","45085","Sumter","South Carolina","United States",2020-07-01 04:33:52,33.91826534,-80.37942316,1059,23,0,1036,"Sumter, South Carolina, United States"
"06-30-2020","28133","Sunflower","Mississippi","United States",2020-07-01 04:33:52,33.60192578,-90.58882684,280,6,0,274,"Sunflower, Mississippi, United States"
"06-30-2020","37171","Surry","North Carolina","United States",2020-07-01 04:33:52,36.41689489,-80.69102283,470,2,0,468,"Surry, North Carolina, United States"
"06-30-2020","51181","Surry","Virginia","United States",2020-07-01 04:33:52,37.11781893,-76.88450012,15,1,0,14,"Surry, Virginia, United States"
"06-30-2020","42115","Susquehanna","Pennsylvania","United States",2020-07-01 04:33:52,41.82147784,-75.80071959,182,23,0,159,"Susquehanna, Pennsylvania, United States"
"06-30-2020","10005","Sussex","Delaware","United States",2020-07-01 04:33:52,38.66143781,-75.39031349,4681,176,0,4505,"Sussex, Delaware, United States"
"06-30-2020","34037","Sussex","New Jersey","United States",2020-07-01 04:33:52,41.13891592,-74.69118243,1192,191,0,1001,"Sussex, New Jersey, United States"
"06-30-2020","51183","Sussex","Virginia","United States",2020-07-01 04:33:52,36.92432914,-77.25791182,194,2,0,192,"Sussex, Virginia, United States"
"06-30-2020","06101","Sutter","California","United States",2020-07-01 04:33:52,39.03417539,-121.6945899,176,3,0,173,"Sutter, California, United States"
"06-30-2020","48435","Sutton","Texas","United States",2020-07-01 04:33:52,30.49856623,-100.5382014,5,0,0,5,"Sutton, Texas, United States"
"06-30-2020","12121","Suwannee","Florida","United States",2020-07-01 04:33:52,30.19746066,-82.9909967,499,20,0,479,"Suwannee, Florida, United States"
"06-30-2020","37173","Swain","North Carolina","United States",2020-07-01 04:33:52,35.48665845,-83.48748932,58,0,0,58,"Swain, North Carolina, United States"
"06-30-2020","56037","Sweetwater","Wyoming","United States",2020-07-01 04:33:52,41.65943896,-108.8827882,90,0,0,90,"Sweetwater, Wyoming, United States"
"06-30-2020","27151","Swift","Minnesota","United States",2020-07-01 04:33:52,45.2829032,-95.68264092,20,1,0,19,"Swift, Minnesota, United States"
"06-30-2020","48437","Swisher","Texas","United States",2020-07-01 04:33:52,34.53028891,-101.7349174,31,1,0,30,"Swisher, Texas, United States"
"06-30-2020","18155","Switzerland","Indiana","United States",2020-07-01 04:33:52,38.82767338,-85.03022429,24,0,0,24,"Switzerland, Indiana, United States"
"06-30-2020","13263","Talbot","Georgia","United States",2020-07-01 04:33:52,32.69642758,-84.53351366,73,2,0,71,"Talbot, Georgia, United States"
"06-30-2020","24041","Talbot","Maryland","United States",2020-07-01 04:33:52,38.76618159,-76.10882561,137,4,0,133,"Talbot, Maryland, United States"
"06-30-2020","13265","Taliaferro","Georgia","United States",2020-07-01 04:33:52,33.56543317,-82.88136816,2,0,0,2,"Taliaferro, Georgia, United States"
"06-30-2020","01121","Talladega","Alabama","United States",2020-07-01 04:33:52,33.37823223,-86.16886178,272,6,0,266,"Talladega, Alabama, United States"
"06-30-2020","28135","Tallahatchie","Mississippi","United States",2020-07-01 04:33:52,33.95339918,-90.1729398,94,3,0,91,"Tallahatchie, Mississippi, United States"
"06-30-2020","01123","Tallapoosa","Alabama","United States",2020-07-01 04:33:52,32.86698258,-85.79833053,564,69,0,495,"Tallapoosa, Alabama, United States"
"06-30-2020","19171","Tama","Iowa","United States",2020-07-01 04:33:52,42.07991767,-92.53266945,445,29,0,416,"Tama, Iowa, United States"
"06-30-2020","29213","Taney","Missouri","United States",2020-07-01 04:33:52,36.65465345,-93.04075153,48,2,0,46,"Taney, Missouri, United States"
"06-30-2020","22105","Tangipahoa","Louisiana","United States",2020-07-01 04:33:52,30.62888673,-90.40664996,1304,43,0,1261,"Tangipahoa, Louisiana, United States"
"06-30-2020","35055","Taos","New Mexico","United States",2020-07-01 04:33:52,36.58006022,-105.6310198,42,1,0,41,"Taos, New Mexico, United States"
"06-30-2020","48439","Tarrant","Texas","United States",2020-07-01 04:33:52,32.77143818,-97.29101614,12344,228,0,12116,"Tarrant, Texas, United States"
"06-30-2020","28137","Tate","Mississippi","United States",2020-07-01 04:33:52,34.65133709,-89.94485778,245,7,0,238,"Tate, Mississippi, United States"
"06-30-2020","13267","Tattnall","Georgia","United States",2020-07-01 04:33:52,32.04785085,-82.05539188,138,0,0,138,"Tattnall, Georgia, United States"
"06-30-2020","12123","Taylor","Florida","United States",2020-07-01 04:33:52,30.04848048,-83.60445406,79,0,0,79,"Taylor, Florida, United States"
"06-30-2020","13269","Taylor","Georgia","United States",2020-07-01 04:33:52,32.55792548,-84.25077141,28,2,0,26,"Taylor, Georgia, United States"
"06-30-2020","19173","Taylor","Iowa","United States",2020-07-01 04:33:52,40.73710579,-94.69778563,78,0,0,78,"Taylor, Iowa, United States"
"06-30-2020","21217","Taylor","Kentucky","United States",2020-07-01 04:33:52,37.3677562,-85.3329931,41,1,0,40,"Taylor, Kentucky, United States"
"06-30-2020","48441","Taylor","Texas","United States",2020-07-01 04:33:52,32.30163422,-99.89007449,400,5,0,395,"Taylor, Texas, United States"
"06-30-2020","54091","Taylor","West Virginia","United States",2020-07-01 04:33:52,39.33602617,-80.0421439,16,0,0,16,"Taylor, West Virginia, United States"
"06-30-2020","55119","Taylor","Wisconsin","United States",2020-07-01 04:33:52,45.21179252,-90.5004405,12,0,0,12,"Taylor, Wisconsin, United States"
"06-30-2020","17179","Tazewell","Illinois","United States",2020-07-01 04:33:52,40.50716185,-89.51404662,127,8,0,119,"Tazewell, Illinois, United States"
"06-30-2020","51185","Tazewell","Virginia","United States",2020-07-01 04:33:52,37.12191123,-81.56685568,15,0,0,15,"Tazewell, Virginia, United States"
"06-30-2020","06103","Tehama","California","United States",2020-07-01 04:33:52,40.12570935,-122.2370171,75,1,0,74,"Tehama, California, United States"
"06-30-2020","13271","Telfair","Georgia","United States",2020-07-01 04:33:52,31.92829517,-82.93491155,118,3,0,115,"Telfair, Georgia, United States"
"06-30-2020","08119","Teller","Colorado","United States",2020-07-01 04:33:52,38.88133511,-105.1614893,41,2,0,39,"Teller, Colorado, United States"
"06-30-2020","22107","Tensas","Louisiana","United States",2020-07-01 04:33:52,32.00760749,-91.32915234,26,0,0,26,"Tensas, Louisiana, United States"
"06-30-2020","22109","Terrebonne","Louisiana","United States",2020-07-01 04:33:52,29.37343766,-90.82626855,1030,61,0,969,"Terrebonne, Louisiana, United States"
"06-30-2020","13273","Terrell","Georgia","United States",2020-07-01 04:33:52,31.77527543,-84.44069698,225,27,0,198,"Terrell, Georgia, United States"
"06-30-2020","48443","Terrell","Texas","United States",2020-07-01 04:33:52,30.22429013,-102.0766732,2,0,0,2,"Terrell, Texas, United States"
"06-30-2020","48445","Terry","Texas","United States",2020-07-01 04:33:52,33.17402785,-102.3354521,17,0,0,17,"Terry, Texas, United States"
"06-30-2020","16081","Teton","Idaho","United States",2020-07-01 04:33:52,43.75303583,-111.2056773,17,0,0,17,"Teton, Idaho, United States"
"06-30-2020","56039","Teton","Wyoming","United States",2020-07-01 04:33:52,43.93522482,-110.5890801,129,0,0,129,"Teton, Wyoming, United States"
"06-30-2020","29215","Texas","Missouri","United States",2020-07-01 04:33:52,37.31728859,-91.96564727,4,0,0,4,"Texas, Missouri, United States"
"06-30-2020","40139","Texas","Oklahoma","United States",2020-07-01 04:33:52,36.74777635,-101.4889765,987,6,0,981,"Texas, Oklahoma, United States"
"06-30-2020","31169","Thayer","Nebraska","United States",2020-07-01 04:33:52,40.17626377,-97.59504381,1,0,0,1,"Thayer, Nebraska, United States"
"06-30-2020","13275","Thomas","Georgia","United States",2020-07-01 04:33:52,30.86392347,-83.91847289,435,32,0,403,"Thomas, Georgia, United States"
"06-30-2020","20193","Thomas","Kansas","United States",2020-07-01 04:33:52,39.35107575,-101.0553705,15,0,0,15,"Thomas, Kansas, United States"
"06-30-2020","31171","Thomas","Nebraska","United States",2020-07-01 04:33:52,41.91358968,-100.5556632,1,0,0,1,"Thomas, Nebraska, United States"
"06-30-2020","48447","Throckmorton","Texas","United States",2020-07-01 04:33:52,33.17751417,-99.21226795,1,0,0,1,"Throckmorton, Texas, United States"
"06-30-2020","31173","Thurston","Nebraska","United States",2020-07-01 04:33:52,42.15725356,-96.54157099,85,1,0,84,"Thurston, Nebraska, United States"
"06-30-2020","53067","Thurston","Washington","United States",2020-07-01 04:33:52,46.9291895,-122.8290656,265,4,0,261,"Thurston, Washington, United States"
"06-30-2020","13277","Tift","Georgia","United States",2020-07-01 04:33:52,31.45743864,-83.5236119,750,26,0,724,"Tift, Georgia, United States"
"06-30-2020","41057","Tillamook","Oregon","United States",2020-07-01 04:33:52,45.46248721,-123.712066,9,0,0,9,"Tillamook, Oregon, United States"
"06-30-2020","40141","Tillman","Oklahoma","United States",2020-07-01 04:33:52,34.37288446,-98.92426619,23,1,0,22,"Tillman, Oklahoma, United States"
"06-30-2020","36107","Tioga","New York","United States",2020-07-01 04:33:52,42.16852837,-76.30835812,143,24,0,119,"Tioga, New York, United States"
"06-30-2020","42117","Tioga","Pennsylvania","United States",2020-07-01 04:33:52,41.77255149,-77.25433032,25,2,0,23,"Tioga, Pennsylvania, United States"
"06-30-2020","28139","Tippah","Mississippi","United States",2020-07-01 04:33:52,34.76872156,-88.90988194,121,11,0,110,"Tippah, Mississippi, United States"
"06-30-2020","18157","Tippecanoe","Indiana","United States",2020-07-01 04:33:52,40.38872739,-86.89413959,633,8,0,625,"Tippecanoe, Indiana, United States"
"06-30-2020","18159","Tipton","Indiana","United States",2020-07-01 04:33:52,40.31123252,-86.05234925,30,1,0,29,"Tipton, Indiana, United States"
"06-30-2020","47167","Tipton","Tennessee","United States",2020-07-01 04:33:52,35.501942,-89.73694895,607,4,0,603,"Tipton, Tennessee, United States"
"06-30-2020","28141","Tishomingo","Mississippi","United States",2020-07-01 04:33:52,34.74023475,-88.23917219,65,1,0,64,"Tishomingo, Mississippi, United States"
"06-30-2020","48449","Titus","Texas","United States",2020-07-01 04:33:52,33.21339719,-94.96797273,702,5,0,697,"Titus, Texas, United States"
"06-30-2020","21219","Todd","Kentucky","United States",2020-07-01 04:33:52,36.8381152,-87.17878374,25,0,0,25,"Todd, Kentucky, United States"
"06-30-2020","27153","Todd","Minnesota","United States",2020-07-01 04:33:52,46.06996226,-94.89785296,398,2,0,396,"Todd, Minnesota, United States"
"06-30-2020","46121","Todd","South Dakota","United States",2020-07-01 04:33:52,43.19338568,-100.7195503,57,1,0,56,"Todd, South Dakota, United States"
"06-30-2020","09013","Tolland","Connecticut","United States",2020-07-01 04:33:52,41.85853803,-72.3308481,913,64,0,849,"Tolland, Connecticut, United States"
"06-30-2020","48451","Tom Green","Texas","United States",2020-07-01 04:33:52,31.40464436,-100.462443,394,2,0,392,"Tom Green, Texas, United States"
"06-30-2020","36109","Tompkins","New York","United States",2020-07-01 04:33:52,42.44945765,-76.47229843,177,0,0,177,"Tompkins, New York, United States"
"06-30-2020","49045","Tooele","Utah","United States",2020-07-01 04:33:52,40.44862644,-113.1295715,244,0,0,244,"Tooele, Utah, United States"
"06-30-2020","30101","Toole","Montana","United States",2020-07-01 04:33:52,48.65577551,-111.6942414,31,6,0,25,"Toole, Montana, United States"
"06-30-2020","13279","Toombs","Georgia","United States",2020-07-01 04:33:52,32.12059861,-82.32957247,244,5,0,239,"Toombs, Georgia, United States"
"06-30-2020","35057","Torrance","New Mexico","United States",2020-07-01 04:33:52,34.64048375,-105.8508949,43,1,0,42,"Torrance, New Mexico, United States"
"06-30-2020","13281","Towns","Georgia","United States",2020-07-01 04:33:52,34.91369188,-83.7410746,45,1,0,44,"Towns, Georgia, United States"
"06-30-2020","38097","Traill","North Dakota","United States",2020-07-01 04:33:52,47.45367788,-97.16323288,17,0,0,17,"Traill, North Dakota, United States"
"06-30-2020","37175","Transylvania","North Carolina","United States",2020-07-01 04:33:52,35.20383864,-82.79638423,22,1,0,21,"Transylvania, North Carolina, United States"
"06-30-2020","27155","Traverse","Minnesota","United States",2020-07-01 04:33:52,45.77298854,-96.47062949,5,0,0,5,"Traverse, Minnesota, United States"
"06-30-2020","48453","Travis","Texas","United States",2020-07-01 04:33:52,30.33432034,-97.7853562,8969,121,0,8848,"Travis, Texas, United States"
"06-30-2020","30103","Treasure","Montana","United States",2020-07-01 04:33:52,46.2097322,-107.2666516,2,0,0,2,"Treasure, Montana, United States"
"06-30-2020","20195","Trego","Kansas","United States",2020-07-01 04:33:52,38.91467218,-99.87284448,1,0,0,1,"Trego, Kansas, United States"
"06-30-2020","55121","Trempealeau","Wisconsin","United States",2020-07-01 04:33:52,44.30360275,-91.35893614,116,0,0,116,"Trempealeau, Wisconsin, United States"
"06-30-2020","13283","Treutlen","Georgia","United States",2020-07-01 04:33:52,32.40422134,-82.56904553,23,1,0,22,"Treutlen, Georgia, United States"
"06-30-2020",NA,"TriCounty","Utah","United States",2020-07-01 04:33:52,40.12491499,-109.5174415,50,0,0,50,"TriCounty, Utah, United States"
"06-30-2020","21221","Trigg","Kentucky","United States",2020-07-01 04:33:52,36.80767017,-87.87333656,26,0,0,26,"Trigg, Kentucky, United States"
"06-30-2020","21223","Trimble","Kentucky","United States",2020-07-01 04:33:52,38.61056487,-85.33775972,6,0,0,6,"Trimble, Kentucky, United States"
"06-30-2020","06105","Trinity","California","United States",2020-07-01 04:33:52,40.6491767,-123.114713,2,0,0,2,"Trinity, California, United States"
"06-30-2020","48455","Trinity","Texas","United States",2020-07-01 04:33:52,31.0879489,-95.1367187,32,0,0,32,"Trinity, Texas, United States"
"06-30-2020","46123","Tripp","South Dakota","United States",2020-07-01 04:33:52,43.34459388,-99.8854891,16,0,0,16,"Tripp, South Dakota, United States"
"06-30-2020","13285","Troup","Georgia","United States",2020-07-01 04:33:52,33.03349196,-85.02812115,1398,32,0,1366,"Troup, Georgia, United States"
"06-30-2020","47169","Trousdale","Tennessee","United States",2020-07-01 04:33:52,36.39026213,-86.16087954,1485,5,0,1480,"Trousdale, Tennessee, United States"
"06-30-2020","39155","Trumbull","Ohio","United States",2020-07-01 04:33:52,41.31735028,-80.76109643,834,62,0,772,"Trumbull, Ohio, United States"
"06-30-2020","54093","Tucker","West Virginia","United States",2020-07-01 04:33:52,39.11240885,-79.57053576,6,0,0,6,"Tucker, West Virginia, United States"
"06-30-2020","06107","Tulare","California","United States",2020-07-01 04:33:52,36.22026558,-118.8020203,4156,126,0,4030,"Tulare, California, United States"
"06-30-2020","40143","Tulsa","Oklahoma","United States",2020-07-01 04:33:52,36.11939621,-95.94013939,3424,67,0,3357,"Tulsa, Oklahoma, United States"
"06-30-2020","28143","Tunica","Mississippi","United States",2020-07-01 04:33:52,34.64967704,-90.37481167,89,3,0,86,"Tunica, Mississippi, United States"
"06-30-2020","06109","Tuolumne","California","United States",2020-07-01 04:33:52,38.02644018,-119.9525093,28,0,0,28,"Tuolumne, California, United States"
"06-30-2020","13287","Turner","Georgia","United States",2020-07-01 04:33:52,31.71612656,-83.62069378,177,16,0,161,"Turner, Georgia, United States"
"06-30-2020","46125","Turner","South Dakota","United States",2020-07-01 04:33:52,43.3109081,-97.14865776,24,0,0,24,"Turner, South Dakota, United States"
