"Date_Published","FIPS","Admin2","Province_State","Country_Region","Last_Update","Latitude","Longitude","Confirmed","Deaths","Recovered","Active","Combined_Key"
"06-30-2020","51057","Essex","Virginia","United States",2020-07-01 04:33:52,37.93357639,-76.94230311,58,0,0,58,"Essex, Virginia, United States"
"06-30-2020","21065","Estill","Kentucky","United States",2020-07-01 04:33:52,37.69241417,-83.95956369,4,0,0,4,"Estill, Kentucky, United States"
"06-30-2020","01055","Etowah","Alabama","United States",2020-07-01 04:33:52,34.04567266,-86.04051873,628,13,0,615,"Etowah, Alabama, United States"
"06-30-2020","32011","Eureka","Nevada","United States",2020-07-01 04:33:52,39.98100864,-116.2683204,1,0,0,1,"Eureka, Nevada, United States"
"06-30-2020","22039","Evangeline","Louisiana","United States",2020-07-01 04:33:52,30.72985248,-92.39915924,192,1,0,191,"Evangeline, Louisiana, United States"
"06-30-2020","13109","Evans","Georgia","United States",2020-07-01 04:33:52,32.15328841,-81.8870105,23,0,0,23,"Evans, Georgia, United States"
"06-30-2020","02090","Fairbanks North Star","Alaska","United States",2020-07-01 04:33:52,64.80726247,-146.5692662,144,2,0,142,"Fairbanks North Star, Alaska, United States"
"06-30-2020","51059","Fairfax","Virginia","United States",2020-07-01 04:33:52,38.83677558,-77.27565836,13850,488,0,13362,"Fairfax, Virginia, United States"
"06-30-2020","51600","Fairfax City","Virginia","United States",2020-07-01 04:33:52,38.85157547,-77.2977964,70,7,0,63,"Fairfax City, Virginia, United States"
"06-30-2020","09001","Fairfield","Connecticut","United States",2020-07-01 04:33:52,41.26809896,-73.3881171,16703,1376,0,15327,"Fairfield, Connecticut, United States"
"06-30-2020","39045","Fairfield","Ohio","United States",2020-07-01 04:33:52,39.75107189,-82.63088163,481,16,0,465,"Fairfield, Ohio, United States"
"06-30-2020","45039","Fairfield","South Carolina","United States",2020-07-01 04:33:52,34.39287073,-81.1195624,298,21,0,277,"Fairfield, South Carolina, United States"
"06-30-2020","46047","Fall River","South Dakota","United States",2020-07-01 04:33:52,43.23929297,-103.5275691,12,0,0,12,"Fall River, South Dakota, United States"
"06-30-2020","48145","Falls","Texas","United States",2020-07-01 04:33:52,31.25350609,-96.93630086,29,0,0,29,"Falls, Texas, United States"
"06-30-2020","51610","Falls Church","Virginia","United States",2020-07-01 04:33:52,38.88485255,-77.17560759,56,8,0,48,"Falls Church, Virginia, United States"
"06-30-2020","13111","Fannin","Georgia","United States",2020-07-01 04:33:52,34.86430205,-84.316964,97,1,0,96,"Fannin, Georgia, United States"
"06-30-2020","48147","Fannin","Texas","United States",2020-07-01 04:33:52,33.59564294,-96.10751083,88,7,0,81,"Fannin, Texas, United States"
"06-30-2020","27043","Faribault","Minnesota","United States",2020-07-01 04:33:52,43.67381499,-93.94787458,53,0,0,53,"Faribault, Minnesota, United States"
"06-30-2020","46049","Faulk","South Dakota","United States",2020-07-01 04:33:52,45.07082625,-99.14535601,23,1,0,22,"Faulk, South Dakota, United States"
"06-30-2020","05045","Faulkner","Arkansas","United States",2020-07-01 04:33:52,35.14719007,-92.33717519,477,3,0,474,"Faulkner, Arkansas, United States"
"06-30-2020","51061","Fauquier","Virginia","United States",2020-07-01 04:33:52,38.73564842,-77.80647472,420,6,0,414,"Fauquier, Virginia, United States"
"06-30-2020","01057","Fayette","Alabama","United States",2020-07-01 04:33:52,33.72076938,-87.73886638,73,1,0,72,"Fayette, Alabama, United States"
"06-30-2020","13113","Fayette","Georgia","United States",2020-07-01 04:33:52,33.41357794,-84.49089434,341,17,0,324,"Fayette, Georgia, United States"
"06-30-2020","17051","Fayette","Illinois","United States",2020-07-01 04:33:52,39.00072038,-89.02452658,23,3,0,20,"Fayette, Illinois, United States"
"06-30-2020","18041","Fayette","Indiana","United States",2020-07-01 04:33:52,39.63684962,-85.17797541,95,7,0,88,"Fayette, Indiana, United States"
"06-30-2020","19065","Fayette","Iowa","United States",2020-07-01 04:33:52,42.86271799,-91.8441231,33,0,0,33,"Fayette, Iowa, United States"
"06-30-2020","21067","Fayette","Kentucky","United States",2020-07-01 04:33:52,38.0368225,-84.45576892,1432,26,0,1406,"Fayette, Kentucky, United States"
"06-30-2020","39047","Fayette","Ohio","United States",2020-07-01 04:33:52,39.56021306,-83.4562016,46,0,0,46,"Fayette, Ohio, United States"
"06-30-2020","42051","Fayette","Pennsylvania","United States",2020-07-01 04:33:52,39.92041012,-79.64291195,116,4,0,112,"Fayette, Pennsylvania, United States"
"06-30-2020","47047","Fayette","Tennessee","United States",2020-07-01 04:33:52,35.19615831,-89.41399032,273,2,0,271,"Fayette, Tennessee, United States"
"06-30-2020","48149","Fayette","Texas","United States",2020-07-01 04:33:52,29.87788372,-96.92076062,86,2,0,84,"Fayette, Texas, United States"
"06-30-2020","54019","Fayette","West Virginia","United States",2020-07-01 04:33:52,38.02974928,-81.08286634,66,4,0,62,"Fayette, West Virginia, United States"
"06-30-2020",NA,"Federal Correctional Institution (FCI)","Michigan","United States",2020-07-01 04:33:52,NA,NA,183,5,0,178,"Federal Correctional Institution (FCI), Michigan, United States"
"06-30-2020","47049","Fentress","Tennessee","United States",2020-07-01 04:33:52,36.38128818,-84.92870012,17,0,0,17,"Fentress, Tennessee, United States"
"06-30-2020","30027","Fergus","Montana","United States",2020-07-01 04:33:52,47.26331584,-109.2245206,2,0,0,2,"Fergus, Montana, United States"
"06-30-2020","53019","Ferry","Washington","United States",2020-07-01 04:33:52,48.4711431,-118.5154041,1,0,0,1,"Ferry, Washington, United States"
"06-30-2020","27045","Fillmore","Minnesota","United States",2020-07-01 04:33:52,43.67394126,-92.08980382,25,0,0,25,"Fillmore, Minnesota, United States"
"06-30-2020","31059","Fillmore","Nebraska","United States",2020-07-01 04:33:52,40.52458567,-97.59646937,14,1,0,13,"Fillmore, Nebraska, United States"
"06-30-2020","20055","Finney","Kansas","United States",2020-07-01 04:33:52,38.04340344,-100.7381938,1570,10,0,1560,"Finney, Kansas, United States"
"06-30-2020","48151","Fisher","Texas","United States",2020-07-01 04:33:52,32.74281316,-100.4019302,5,1,0,4,"Fisher, Texas, United States"
"06-30-2020","12035","Flagler","Florida","United States",2020-07-01 04:33:52,29.45933576,-81.31508595,310,5,0,305,"Flagler, Florida, United States"
"06-30-2020","30029","Flathead","Montana","United States",2020-07-01 04:33:52,48.29575866,-114.0520569,58,2,0,56,"Flathead, Montana, United States"
"06-30-2020","21069","Fleming","Kentucky","United States",2020-07-01 04:33:52,38.36758311,-83.69657514,20,0,0,20,"Fleming, Kentucky, United States"
"06-30-2020","45041","Florence","South Carolina","United States",2020-07-01 04:33:52,34.02361754,-79.70189312,1199,51,0,1148,"Florence, South Carolina, United States"
"06-30-2020","55037","Florence","Wisconsin","United States",2020-07-01 04:33:52,45.84963535,-88.39804137,3,0,0,3,"Florence, Wisconsin, United States"
"06-30-2020","13115","Floyd","Georgia","United States",2020-07-01 04:33:52,34.26268279,-85.21577392,514,15,0,499,"Floyd, Georgia, United States"
"06-30-2020","18043","Floyd","Indiana","United States",2020-07-01 04:33:52,38.32117957,-85.90385377,362,44,0,318,"Floyd, Indiana, United States"
"06-30-2020","19067","Floyd","Iowa","United States",2020-07-01 04:33:52,43.0600053,-92.78940097,65,2,0,63,"Floyd, Iowa, United States"
"06-30-2020","21071","Floyd","Kentucky","United States",2020-07-01 04:33:52,37.56213922,-82.74750924,29,0,0,29,"Floyd, Kentucky, United States"
"06-30-2020","48153","Floyd","Texas","United States",2020-07-01 04:33:52,34.07227468,-101.3031546,28,1,0,27,"Floyd, Texas, United States"
"06-30-2020","51063","Floyd","Virginia","United States",2020-07-01 04:33:52,36.9302126,-80.36738849,17,1,0,16,"Floyd, Virginia, United States"
"06-30-2020","51065","Fluvanna","Virginia","United States",2020-07-01 04:33:52,37.84157909,-78.27715475,110,7,0,103,"Fluvanna, Virginia, United States"
"06-30-2020","55039","Fond du Lac","Wisconsin","United States",2020-07-01 04:33:52,43.75354908,-88.48885325,311,6,0,305,"Fond du Lac, Wisconsin, United States"
"06-30-2020","17053","Ford","Illinois","United States",2020-07-01 04:33:52,40.59706922,-88.22350769,31,1,0,30,"Ford, Illinois, United States"
"06-30-2020","20057","Ford","Kansas","United States",2020-07-01 04:33:52,37.69200114,-99.88825298,1944,8,0,1936,"Ford, Kansas, United States"
"06-30-2020","42053","Forest","Pennsylvania","United States",2020-07-01 04:33:52,41.51095103,-79.23229292,7,0,0,7,"Forest, Pennsylvania, United States"
"06-30-2020","55041","Forest","Wisconsin","United States",2020-07-01 04:33:52,45.66678019,-88.77084892,39,3,0,36,"Forest, Wisconsin, United States"
"06-30-2020","28035","Forrest","Mississippi","United States",2020-07-01 04:33:52,31.18961454,-89.25832496,798,42,0,756,"Forrest, Mississippi, United States"
"06-30-2020","13117","Forsyth","Georgia","United States",2020-07-01 04:33:52,34.22604035,-84.1231513,828,15,0,813,"Forsyth, Georgia, United States"
"06-30-2020","37067","Forsyth","North Carolina","United States",2020-07-01 04:33:52,36.12859861,-80.25459052,2996,34,0,2962,"Forsyth, North Carolina, United States"
"06-30-2020","48157","Fort Bend","Texas","United States",2020-07-01 04:33:52,29.52704478,-95.77219463,3722,53,0,3669,"Fort Bend, Texas, United States"
"06-30-2020","38031","Foster","North Dakota","United States",2020-07-01 04:33:52,47.4571084,-98.88279923,2,0,0,2,"Foster, North Dakota, United States"
"06-30-2020","18045","Fountain","Indiana","United States",2020-07-01 04:33:52,40.12361933,-87.24217689,28,2,0,26,"Fountain, Indiana, United States"
"06-30-2020","01059","Franklin","Alabama","United States",2020-07-01 04:33:52,34.44235334,-87.84289505,857,13,0,844,"Franklin, Alabama, United States"
"06-30-2020","05047","Franklin","Arkansas","United States",2020-07-01 04:33:52,35.51202821,-93.89299569,21,0,0,21,"Franklin, Arkansas, United States"
"06-30-2020","12037","Franklin","Florida","United States",2020-07-01 04:33:52,29.83791238,-84.82731662,6,0,0,6,"Franklin, Florida, United States"
"06-30-2020","13119","Franklin","Georgia","United States",2020-07-01 04:33:52,34.37525597,-83.23159927,193,1,0,192,"Franklin, Georgia, United States"
"06-30-2020","16041","Franklin","Idaho","United States",2020-07-01 04:33:52,42.18332217,-111.8149666,25,0,0,25,"Franklin, Idaho, United States"
"06-30-2020","17055","Franklin","Illinois","United States",2020-07-01 04:33:52,37.99189086,-88.92567818,14,0,0,14,"Franklin, Illinois, United States"
"06-30-2020","18047","Franklin","Indiana","United States",2020-07-01 04:33:52,39.4142482,-85.06062647,124,8,0,116,"Franklin, Indiana, United States"
"06-30-2020","19069","Franklin","Iowa","United States",2020-07-01 04:33:52,42.73270384,-93.26256925,75,0,0,75,"Franklin, Iowa, United States"
"06-30-2020","20059","Franklin","Kansas","United States",2020-07-01 04:33:52,38.56443815,-95.28644341,71,0,0,71,"Franklin, Kansas, United States"
"06-30-2020","21073","Franklin","Kentucky","United States",2020-07-01 04:33:52,38.2379395,-84.87962551,135,4,0,131,"Franklin, Kentucky, United States"
"06-30-2020","22041","Franklin","Louisiana","United States",2020-07-01 04:33:52,32.13675181,-91.67589857,467,14,0,453,"Franklin, Louisiana, United States"
"06-30-2020","23007","Franklin","Maine","United States",2020-07-01 04:33:52,44.97330019,-70.44381045,41,1,0,40,"Franklin, Maine, United States"
"06-30-2020","25011","Franklin","Massachusetts","United States",2020-07-01 04:33:52,42.58119713,-72.58602547,366,54,0,312,"Franklin, Massachusetts, United States"
"06-30-2020","28037","Franklin","Mississippi","United States",2020-07-01 04:33:52,31.47786634,-90.89672989,38,2,0,36,"Franklin, Mississippi, United States"
"06-30-2020","29071","Franklin","Missouri","United States",2020-07-01 04:33:52,38.41127108,-91.07522826,204,18,0,186,"Franklin, Missouri, United States"
"06-30-2020","31061","Franklin","Nebraska","United States",2020-07-01 04:33:52,40.17636348,-98.95299073,6,0,0,6,"Franklin, Nebraska, United States"
"06-30-2020","36033","Franklin","New York","United States",2020-07-01 04:33:52,44.59040891,-74.29926032,30,0,0,30,"Franklin, New York, United States"
"06-30-2020","37069","Franklin","North Carolina","United States",2020-07-01 04:33:52,36.081519,-78.28708884,345,21,0,324,"Franklin, North Carolina, United States"
"06-30-2020","39049","Franklin","Ohio","United States",2020-07-01 04:33:52,39.96995815,-83.01115755,9148,404,0,8744,"Franklin, Ohio, United States"
"06-30-2020","42055","Franklin","Pennsylvania","United States",2020-07-01 04:33:52,39.92956518,-77.72157791,925,43,0,882,"Franklin, Pennsylvania, United States"
"06-30-2020","47051","Franklin","Tennessee","United States",2020-07-01 04:33:52,35.15634626,-86.09201039,75,3,0,72,"Franklin, Tennessee, United States"
"06-30-2020","48159","Franklin","Texas","United States",2020-07-01 04:33:52,33.17653242,-95.21917243,41,0,0,41,"Franklin, Texas, United States"
"06-30-2020","50011","Franklin","Vermont","United States",2020-07-01 04:33:52,44.85627605,-72.91249563,104,6,0,98,"Franklin, Vermont, United States"
"06-30-2020","51067","Franklin","Virginia","United States",2020-07-01 04:33:52,36.99536167,-79.88023649,88,1,0,87,"Franklin, Virginia, United States"
"06-30-2020","53021","Franklin","Washington","United States",2020-07-01 04:33:52,46.53351425,-118.9018212,1746,32,0,1714,"Franklin, Washington, United States"
"06-30-2020","51620","Franklin City","Virginia","United States",2020-07-01 04:33:52,36.6831435,-76.93859681,51,2,0,49,"Franklin City, Virginia, United States"
"06-30-2020","24021","Frederick","Maryland","United States",2020-07-01 04:33:52,39.47296601,-77.39999394,2490,117,0,2373,"Frederick, Maryland, United States"
"06-30-2020","51069","Frederick","Virginia","United States",2020-07-01 04:33:52,39.20172582,-78.25974949,493,6,0,487,"Frederick, Virginia, United States"
"06-30-2020","51630","Fredericksburg","Virginia","United States",2020-07-01 04:33:52,38.2977863,-77.4922454,246,0,0,246,"Fredericksburg, Virginia, United States"
"06-30-2020","27047","Freeborn","Minnesota","United States",2020-07-01 04:33:52,43.67385583,-93.34884422,281,0,0,281,"Freeborn, Minnesota, United States"
"06-30-2020","48161","Freestone","Texas","United States",2020-07-01 04:33:52,31.70422788,-96.15072516,28,0,0,28,"Freestone, Texas, United States"
"06-30-2020","08043","Fremont","Colorado","United States",2020-07-01 04:33:52,38.47362326,-105.4399667,36,0,0,36,"Fremont, Colorado, United States"
"06-30-2020","16043","Fremont","Idaho","United States",2020-07-01 04:33:52,44.22800938,-111.4809943,7,0,0,7,"Fremont, Idaho, United States"
"06-30-2020","19071","Fremont","Iowa","United States",2020-07-01 04:33:52,40.7454272,-95.60129045,7,0,0,7,"Fremont, Iowa, United States"
"06-30-2020","56013","Fremont","Wyoming","United States",2020-07-01 04:33:52,43.04183996,-108.6296893,355,0,0,355,"Fremont, Wyoming, United States"
"06-30-2020","06019","Fresno","California","United States",2020-07-01 04:33:52,36.75733899,-119.6466953,4811,72,0,4739,"Fresno, California, United States"
"06-30-2020","48163","Frio","Texas","United States",2020-07-01 04:33:52,28.86751206,-99.10804207,192,0,0,192,"Frio, Texas, United States"
"06-30-2020","31063","Frontier","Nebraska","United States",2020-07-01 04:33:52,40.52993007,-100.3924658,1,0,0,1,"Frontier, Nebraska, United States"
"06-30-2020","05049","Fulton","Arkansas","United States",2020-07-01 04:33:52,36.38177105,-91.81729127,12,0,0,12,"Fulton, Arkansas, United States"
"06-30-2020","13121","Fulton","Georgia","United States",2020-07-01 04:33:52,33.79216944,-84.46319413,6965,312,0,6653,"Fulton, Georgia, United States"
"06-30-2020","17057","Fulton","Illinois","United States",2020-07-01 04:33:52,40.47289135,-90.20862357,15,0,0,15,"Fulton, Illinois, United States"
"06-30-2020","18049","Fulton","Indiana","United States",2020-07-01 04:33:52,41.0469907,-86.26252745,66,1,0,65,"Fulton, Indiana, United States"
"06-30-2020","21075","Fulton","Kentucky","United States",2020-07-01 04:33:52,36.55238827,-89.20140068,23,0,0,23,"Fulton, Kentucky, United States"
"06-30-2020","36035","Fulton","New York","United States",2020-07-01 04:33:52,43.11363907,-74.41798804,256,24,0,232,"Fulton, New York, United States"
"06-30-2020","39051","Fulton","Ohio","United States",2020-07-01 04:33:52,41.60213491,-84.12571393,57,0,0,57,"Fulton, Ohio, United States"
"06-30-2020","42057","Fulton","Pennsylvania","United States",2020-07-01 04:33:52,39.92913544,-78.11163677,18,1,0,17,"Fulton, Pennsylvania, United States"
"06-30-2020","31065","Furnas","Nebraska","United States",2020-07-01 04:33:52,40.17642064,-99.91247454,10,1,0,9,"Furnas, Nebraska, United States"
"06-30-2020","12039","Gadsden","Florida","United States",2020-07-01 04:33:52,30.57796289,-84.61915825,379,7,0,372,"Gadsden, Florida, United States"
"06-30-2020","31067","Gage","Nebraska","United States",2020-07-01 04:33:52,40.26186809,-96.68946704,52,4,0,48,"Gage, Nebraska, United States"
"06-30-2020","48165","Gaines","Texas","United States",2020-07-01 04:33:52,32.74055318,-102.6353295,16,0,0,16,"Gaines, Texas, United States"
"06-30-2020","51640","Galax","Virginia","United States",2020-07-01 04:33:52,36.66601852,-80.91703124,253,13,0,240,"Galax, Virginia, United States"
"06-30-2020","17059","Gallatin","Illinois","United States",2020-07-01 04:33:52,37.76430935,-88.22953869,2,0,0,2,"Gallatin, Illinois, United States"
"06-30-2020","21077","Gallatin","Kentucky","United States",2020-07-01 04:33:52,38.75398691,-84.8558382,61,7,0,54,"Gallatin, Kentucky, United States"
"06-30-2020","30031","Gallatin","Montana","United States",2020-07-01 04:33:52,45.54486106,-111.1692571,263,1,0,262,"Gallatin, Montana, United States"
"06-30-2020","39053","Gallia","Ohio","United States",2020-07-01 04:33:52,38.82708533,-82.31647569,14,1,0,13,"Gallia, Ohio, United States"
"06-30-2020","48167","Galveston","Texas","United States",2020-07-01 04:33:52,29.40167322,-94.90469073,3293,40,0,3253,"Galveston, Texas, United States"
"06-30-2020","31069","Garden","Nebraska","United States",2020-07-01 04:33:52,41.61703149,-102.3313973,4,0,0,4,"Garden, Nebraska, United States"
"06-30-2020","08045","Garfield","Colorado","United States",2020-07-01 04:33:52,39.59921777,-107.902708,298,2,0,296,"Garfield, Colorado, United States"
"06-30-2020","31071","Garfield","Nebraska","United States",2020-07-01 04:33:52,41.91428955,-98.99111827,1,0,0,1,"Garfield, Nebraska, United States"
"06-30-2020","40047","Garfield","Oklahoma","United States",2020-07-01 04:33:52,36.3791334,-97.78265517,67,2,0,65,"Garfield, Oklahoma, United States"
"06-30-2020","53023","Garfield","Washington","United States",2020-07-01 04:33:52,46.43197502,-117.5454032,7932,0,0,7932,"Garfield, Washington, United States"
"06-30-2020","05051","Garland","Arkansas","United States",2020-07-01 04:33:52,34.57692074,-93.14921604,248,1,0,247,"Garland, Arkansas, United States"
"06-30-2020","21079","Garrard","Kentucky","United States",2020-07-01 04:33:52,37.6388668,-84.53289319,23,0,0,23,"Garrard, Kentucky, United States"
"06-30-2020","24023","Garrett","Maryland","United States",2020-07-01 04:33:52,39.52786077,-79.27355126,11,0,0,11,"Garrett, Maryland, United States"
"06-30-2020","40049","Garvin","Oklahoma","United States",2020-07-01 04:33:52,34.70418038,-97.30811132,70,1,0,69,"Garvin, Oklahoma, United States"
"06-30-2020","48169","Garza","Texas","United States",2020-07-01 04:33:52,33.17969345,-101.2984114,12,0,0,12,"Garza, Texas, United States"
"06-30-2020","29073","Gasconade","Missouri","United States",2020-07-01 04:33:52,38.43947277,-91.50847147,11,0,0,11,"Gasconade, Missouri, United States"
"06-30-2020","37071","Gaston","North Carolina","United States",2020-07-01 04:33:52,35.29373559,-81.17477045,1083,12,0,1071,"Gaston, North Carolina, United States"
"06-30-2020","37073","Gates","North Carolina","United States",2020-07-01 04:33:52,36.44667547,-76.69749701,27,2,0,25,"Gates, North Carolina, United States"
"06-30-2020","20061","Geary","Kansas","United States",2020-07-01 04:33:52,38.99871131,-96.7577178,57,1,0,56,"Geary, Kansas, United States"
"06-30-2020","39055","Geauga","Ohio","United States",2020-07-01 04:33:52,41.49952319,-81.17935342,387,42,0,345,"Geauga, Ohio, United States"
"06-30-2020","16045","Gem","Idaho","United States",2020-07-01 04:33:52,44.06482372,-116.398376,26,0,0,26,"Gem, Idaho, United States"
"06-30-2020","26049","Genesee","Michigan","United States",2020-07-01 04:33:52,43.02244215,-83.70589709,2734,288,0,2446,"Genesee, Michigan, United States"
"06-30-2020","36037","Genesee","New York","United States",2020-07-01 04:33:52,43.0022601,-78.19135193,238,5,0,233,"Genesee, New York, United States"
"06-30-2020","01061","Geneva","Alabama","United States",2020-07-01 04:33:52,31.09389027,-85.83572839,70,0,0,70,"Geneva, Alabama, United States"
"06-30-2020","29075","Gentry","Missouri","United States",2020-07-01 04:33:52,40.21097916,-94.40944419,57,9,0,48,"Gentry, Missouri, United States"
"06-30-2020","28039","George","Mississippi","United States",2020-07-01 04:33:52,30.86259065,-88.64436789,73,3,0,70,"George, Mississippi, United States"
"06-30-2020","45043","Georgetown","South Carolina","United States",2020-07-01 04:33:52,33.43443342,-79.33202141,458,3,0,455,"Georgetown, South Carolina, United States"
"06-30-2020","18051","Gibson","Indiana","United States",2020-07-01 04:33:52,38.30393723,-87.58054938,41,2,0,39,"Gibson, Indiana, United States"
"06-30-2020","47053","Gibson","Tennessee","United States",2020-07-01 04:33:52,35.99438059,-88.93358327,100,1,0,99,"Gibson, Tennessee, United States"
"06-30-2020","04007","Gila","Arizona","United States",2020-07-01 04:33:52,33.80190085,-110.8132779,292,5,0,287,"Gila, Arizona, United States"
"06-30-2020","12041","Gilchrist","Florida","United States",2020-07-01 04:33:52,29.72856978,-82.79880657,97,0,0,97,"Gilchrist, Florida, United States"
"06-30-2020","47055","Giles","Tennessee","United States",2020-07-01 04:33:52,35.20222469,-87.03992678,50,1,0,49,"Giles, Tennessee, United States"
"06-30-2020","51071","Giles","Virginia","United States",2020-07-01 04:33:52,37.31234791,-80.70636931,15,0,0,15,"Giles, Virginia, United States"
"06-30-2020","48171","Gillespie","Texas","United States",2020-07-01 04:33:52,30.31824095,-98.94676915,42,0,0,42,"Gillespie, Texas, United States"
"06-30-2020","41021","Gilliam","Oregon","United States",2020-07-01 04:33:52,45.37160076,-120.2048869,0,0,0,0,"Gilliam, Oregon, United States"
"06-30-2020","13123","Gilmer","Georgia","United States",2020-07-01 04:33:52,34.69316688,-84.45802506,184,2,0,182,"Gilmer, Georgia, United States"
"06-30-2020","54021","Gilmer","West Virginia","United States",2020-07-01 04:33:52,38.9251277,-80.85952723,13,0,0,13,"Gilmer, West Virginia, United States"
"06-30-2020","08047","Gilpin","Colorado","United States",2020-07-01 04:33:52,39.85646523,-105.5252597,7,0,0,7,"Gilpin, Colorado, United States"
"06-30-2020","30035","Glacier","Montana","United States",2020-07-01 04:33:52,48.70513576,-112.9934235,18,0,0,18,"Glacier, Montana, United States"
"06-30-2020","12043","Glades","Florida","United States",2020-07-01 04:33:52,26.95635849,-81.18996211,175,1,0,174,"Glades, Florida, United States"
"06-30-2020","26051","Gladwin","Michigan","United States",2020-07-01 04:33:52,43.98901072,-84.38774817,27,1,0,26,"Gladwin, Michigan, United States"
"06-30-2020","13125","Glascock","Georgia","United States",2020-07-01 04:33:52,33.22879932,-82.61297636,7,0,0,7,"Glascock, Georgia, United States"
"06-30-2020","48173","Glasscock","Texas","United States",2020-07-01 04:33:52,31.86942909,-101.5207776,5,0,0,5,"Glasscock, Texas, United States"
"06-30-2020","06021","Glenn","California","United States",2020-07-01 04:33:52,39.59875897,-122.3938452,103,0,0,103,"Glenn, California, United States"
"06-30-2020","34015","Gloucester","New Jersey","United States",2020-07-01 04:33:52,39.71581067,-75.13995546,2578,182,0,2396,"Gloucester, New Jersey, United States"
"06-30-2020","51073","Gloucester","Virginia","United States",2020-07-01 04:33:52,37.40809042,-76.53524337,49,1,0,48,"Gloucester, Virginia, United States"
"06-30-2020","13127","Glynn","Georgia","United States",2020-07-01 04:33:52,31.23279254,-81.53811412,788,6,0,782,"Glynn, Georgia, United States"
"06-30-2020","26053","Gogebic","Michigan","United States",2020-07-01 04:33:52,46.40862701,-89.69377193,7,1,0,6,"Gogebic, Michigan, United States"
"06-30-2020","30037","Golden Valley","Montana","United States",2020-07-01 04:33:52,46.3816474,-109.1768522,3,0,0,3,"Golden Valley, Montana, United States"
"06-30-2020","48175","Goliad","Texas","United States",2020-07-01 04:33:52,28.65696592,-97.42760647,14,0,0,14,"Goliad, Texas, United States"
"06-30-2020","48177","Gonzales","Texas","United States",2020-07-01 04:33:52,29.45634206,-97.49424032,260,4,0,256,"Gonzales, Texas, United States"
"06-30-2020","51075","Goochland","Virginia","United States",2020-07-01 04:33:52,37.71714806,-77.90381514,119,6,0,113,"Goochland, Virginia, United States"
"06-30-2020","27049","Goodhue","Minnesota","United States",2020-07-01 04:33:52,44.40849741,-92.7234195,119,8,0,111,"Goodhue, Minnesota, United States"
"06-30-2020","16047","Gooding","Idaho","United States",2020-07-01 04:33:52,42.96927962,-114.8108306,65,1,0,64,"Gooding, Idaho, United States"
"06-30-2020","13129","Gordon","Georgia","United States",2020-07-01 04:33:52,34.50487351,-84.87296253,380,18,0,362,"Gordon, Georgia, United States"
"06-30-2020","56015","Goshen","Wyoming","United States",2020-07-01 04:33:52,42.08798185,-104.3534743,5,0,0,5,"Goshen, Wyoming, United States"
"06-30-2020","31073","Gosper","Nebraska","United States",2020-07-01 04:33:52,40.51481965,-99.83020279,13,0,0,13,"Gosper, Nebraska, United States"
"06-30-2020","20063","Gove","Kansas","United States",2020-07-01 04:33:52,38.91588178,-100.4829321,1,0,0,1,"Gove, Kansas, United States"
"06-30-2020","13131","Grady","Georgia","United States",2020-07-01 04:33:52,30.87454847,-84.23418364,192,4,0,188,"Grady, Georgia, United States"
