"Date_Published","FIPS","Admin2","Province_State","Country_Region","Last_Update","Latitude","Longitude","Confirmed","Deaths","Recovered","Active","Combined_Key"
"06-30-2020","55071","Manitowoc","Wisconsin","United States",2020-07-01 04:33:52,44.11946801,-87.80928853,94,1,0,93,"Manitowoc, Wisconsin, United States"
"06-30-2020","55073","Marathon","Wisconsin","United States",2020-07-01 04:33:52,44.89792533,-89.75863384,168,1,0,167,"Marathon, Wisconsin, United States"
"06-30-2020","01091","Marengo","Alabama","United States",2020-07-01 04:33:52,32.24767634,-87.78796182,279,11,0,268,"Marengo, Alabama, United States"
"06-30-2020","04013","Maricopa","Arizona","United States",2020-07-01 04:33:52,33.34835867,-112.4918154,48592,771,0,47821,"Maricopa, Arizona, United States"
"06-30-2020","29125","Maries","Missouri","United States",2020-07-01 04:33:52,38.16193985,-91.92249662,4,0,0,4,"Maries, Missouri, United States"
"06-30-2020","06041","Marin","California","United States",2020-07-01 04:33:52,38.07122463,-122.7210631,2210,18,0,2192,"Marin, California, United States"
"06-30-2020","55075","Marinette","Wisconsin","United States",2020-07-01 04:33:52,45.38553432,-88.033246,56,3,0,53,"Marinette, Wisconsin, United States"
"06-30-2020","01093","Marion","Alabama","United States",2020-07-01 04:33:52,34.13697363,-87.88704173,205,12,0,193,"Marion, Alabama, United States"
"06-30-2020","05089","Marion","Arkansas","United States",2020-07-01 04:33:52,36.26844485,-92.68451899,6,0,0,6,"Marion, Arkansas, United States"
"06-30-2020","12083","Marion","Florida","United States",2020-07-01 04:33:52,29.21227113,-82.05803627,672,10,0,662,"Marion, Florida, United States"
"06-30-2020","13197","Marion","Georgia","United States",2020-07-01 04:33:52,32.3483402,-84.52733571,79,2,0,77,"Marion, Georgia, United States"
"06-30-2020","17121","Marion","Illinois","United States",2020-07-01 04:33:52,38.64963204,-88.91899208,65,0,0,65,"Marion, Illinois, United States"
"06-30-2020","18097","Marion","Indiana","United States",2020-07-01 04:33:52,39.78163624,-86.13826325,11329,679,0,10650,"Marion, Indiana, United States"
"06-30-2020","19125","Marion","Iowa","United States",2020-07-01 04:33:52,41.33445101,-93.09934783,66,0,0,66,"Marion, Iowa, United States"
"06-30-2020","20115","Marion","Kansas","United States",2020-07-01 04:33:52,38.35855394,-97.0985251,9,1,0,8,"Marion, Kansas, United States"
"06-30-2020","21155","Marion","Kentucky","United States",2020-07-01 04:33:52,37.55218078,-85.26898542,51,0,0,51,"Marion, Kentucky, United States"
"06-30-2020","28091","Marion","Mississippi","United States",2020-07-01 04:33:52,31.23132643,-89.8209217,240,11,0,229,"Marion, Mississippi, United States"
"06-30-2020","29127","Marion","Missouri","United States",2020-07-01 04:33:52,39.80601912,-91.62203062,15,0,0,15,"Marion, Missouri, United States"
"06-30-2020","39101","Marion","Ohio","United States",2020-07-01 04:33:52,40.58610662,-83.15736305,2726,38,0,2688,"Marion, Ohio, United States"
"06-30-2020","41047","Marion","Oregon","United States",2020-07-01 04:33:52,44.90287942,-122.5815117,1514,46,0,1468,"Marion, Oregon, United States"
"06-30-2020","45067","Marion","South Carolina","United States",2020-07-01 04:33:52,34.07859748,-79.36400756,208,7,0,201,"Marion, South Carolina, United States"
"06-30-2020","47115","Marion","Tennessee","United States",2020-07-01 04:33:52,35.12997174,-85.62265895,64,4,0,60,"Marion, Tennessee, United States"
"06-30-2020","48315","Marion","Texas","United States",2020-07-01 04:33:52,32.79868409,-94.3566123,26,1,0,25,"Marion, Texas, United States"
"06-30-2020","54049","Marion","West Virginia","United States",2020-07-01 04:33:52,39.50984542,-80.24244659,59,2,0,57,"Marion, West Virginia, United States"
"06-30-2020","06043","Mariposa","California","United States",2020-07-01 04:33:52,37.57978556,-119.9073334,26,1,0,25,"Mariposa, California, United States"
"06-30-2020","45069","Marlboro","South Carolina","United States",2020-07-01 04:33:52,34.59905577,-79.67561152,302,4,0,298,"Marlboro, South Carolina, United States"
"06-30-2020","26103","Marquette","Michigan","United States",2020-07-01 04:33:52,46.4338914,-87.64043701,64,11,0,53,"Marquette, Michigan, United States"
"06-30-2020","55077","Marquette","Wisconsin","United States",2020-07-01 04:33:52,43.81911946,-89.40073763,13,1,0,12,"Marquette, Wisconsin, United States"
"06-30-2020","01095","Marshall","Alabama","United States",2020-07-01 04:33:52,34.36975964,-86.30486727,1526,9,0,1517,"Marshall, Alabama, United States"
"06-30-2020","17123","Marshall","Illinois","United States",2020-07-01 04:33:52,41.0327901,-89.34510444,8,0,0,8,"Marshall, Illinois, United States"
"06-30-2020","18099","Marshall","Indiana","United States",2020-07-01 04:33:52,41.32467367,-86.26185087,409,3,0,406,"Marshall, Indiana, United States"
"06-30-2020","19127","Marshall","Iowa","United States",2020-07-01 04:33:52,42.03586837,-92.9990819,1012,18,0,994,"Marshall, Iowa, United States"
"06-30-2020","20117","Marshall","Kansas","United States",2020-07-01 04:33:52,39.78359669,-96.52278974,2,0,0,2,"Marshall, Kansas, United States"
"06-30-2020","21157","Marshall","Kentucky","United States",2020-07-01 04:33:52,36.8800707,-88.32803576,58,2,0,56,"Marshall, Kentucky, United States"
"06-30-2020","27089","Marshall","Minnesota","United States",2020-07-01 04:33:52,48.35825983,-96.37017407,12,0,0,12,"Marshall, Minnesota, United States"
"06-30-2020","28093","Marshall","Mississippi","United States",2020-07-01 04:33:52,34.76216286,-89.50299462,196,3,0,193,"Marshall, Mississippi, United States"
"06-30-2020","40095","Marshall","Oklahoma","United States",2020-07-01 04:33:52,34.02311222,-96.76855464,32,0,0,32,"Marshall, Oklahoma, United States"
"06-30-2020","46091","Marshall","South Dakota","United States",2020-07-01 04:33:52,45.75870838,-97.59855639,5,0,0,5,"Marshall, South Dakota, United States"
"06-30-2020","47117","Marshall","Tennessee","United States",2020-07-01 04:33:52,35.45798777,-86.76420988,71,1,0,70,"Marshall, Tennessee, United States"
"06-30-2020","54051","Marshall","West Virginia","United States",2020-07-01 04:33:52,39.86064362,-80.66591062,40,0,0,40,"Marshall, West Virginia, United States"
"06-30-2020","12085","Martin","Florida","United States",2020-07-01 04:33:52,27.0772071,-80.43109784,2055,25,0,2030,"Martin, Florida, United States"
"06-30-2020","18101","Martin","Indiana","United States",2020-07-01 04:33:52,38.7099921,-86.80373186,22,0,0,22,"Martin, Indiana, United States"
"06-30-2020","21159","Martin","Kentucky","United States",2020-07-01 04:33:52,37.79990579,-82.51247478,5,0,0,5,"Martin, Kentucky, United States"
"06-30-2020","27091","Martin","Minnesota","United States",2020-07-01 04:33:52,43.67429718,-94.55099908,156,5,0,151,"Martin, Minnesota, United States"
"06-30-2020","37117","Martin","North Carolina","United States",2020-07-01 04:33:52,35.84326734,-77.10860251,133,4,0,129,"Martin, North Carolina, United States"
"06-30-2020","48317","Martin","Texas","United States",2020-07-01 04:33:52,32.30600051,-101.9513518,16,1,0,15,"Martin, Texas, United States"
"06-30-2020","51690","Martinsville","Virginia","United States",2020-07-01 04:33:52,36.68212094,-79.86352771,78,1,0,77,"Martinsville, Virginia, United States"
"06-30-2020","17125","Mason","Illinois","United States",2020-07-01 04:33:52,40.23917274,-89.91824452,22,0,0,22,"Mason, Illinois, United States"
"06-30-2020","21161","Mason","Kentucky","United States",2020-07-01 04:33:52,38.59471935,-83.82151043,31,0,0,31,"Mason, Kentucky, United States"
"06-30-2020","26105","Mason","Michigan","United States",2020-07-01 04:33:52,43.99509218,-86.24988902,51,0,0,51,"Mason, Michigan, United States"
"06-30-2020","48319","Mason","Texas","United States",2020-07-01 04:33:52,30.71780434,-99.22629416,33,0,0,33,"Mason, Texas, United States"
"06-30-2020","53045","Mason","Washington","United States",2020-07-01 04:33:52,47.35007586,-123.1863685,52,1,0,51,"Mason, Washington, United States"
"06-30-2020","54053","Mason","West Virginia","United States",2020-07-01 04:33:52,38.77071799,-82.02524219,18,0,0,18,"Mason, West Virginia, United States"
"06-30-2020","17127","Massac","Illinois","United States",2020-07-01 04:33:52,37.22078441,-88.71036614,11,0,0,11,"Massac, Illinois, United States"
"06-30-2020","48321","Matagorda","Texas","United States",2020-07-01 04:33:52,28.81955746,-96.01230294,172,5,0,167,"Matagorda, Texas, United States"
"06-30-2020","02170","Matanuska-Susitna","Alaska","United States",2020-07-01 04:33:52,62.31305045,-149.5741743,81,1,0,80,"Matanuska-Susitna, Alaska, United States"
"06-30-2020","51115","Mathews","Virginia","United States",2020-07-01 04:33:52,37.44164146,-76.34098896,6,0,0,6,"Mathews, Virginia, United States"
"06-30-2020","15009","Maui","Hawaii","United States",2020-07-01 04:33:52,20.86399628,-156.5689097,123,6,0,117,"Maui, Hawaii, United States"
"06-30-2020","47119","Maury","Tennessee","United States",2020-07-01 04:33:52,35.6187413,-87.07462444,287,3,0,284,"Maury, Tennessee, United States"
"06-30-2020","48323","Maverick","Texas","United States",2020-07-01 04:33:52,28.7429195,-100.3157686,311,2,0,309,"Maverick, Texas, United States"
"06-30-2020","40097","Mayes","Oklahoma","United States",2020-07-01 04:33:52,36.30179091,-95.23175116,81,5,0,76,"Mayes, Oklahoma, United States"
"06-30-2020","40087","McClain","Oklahoma","United States",2020-07-01 04:33:52,35.01123903,-97.44572302,159,4,0,155,"McClain, Oklahoma, United States"
"06-30-2020","46087","McCook","South Dakota","United States",2020-07-01 04:33:52,43.6742571,-97.36863144,10,1,0,9,"McCook, South Dakota, United States"
"06-30-2020","45065","McCormick","South Carolina","United States",2020-07-01 04:33:52,33.90161443,-82.30794338,17,2,0,15,"McCormick, South Carolina, United States"
"06-30-2020","21145","McCracken","Kentucky","United States",2020-07-01 04:33:52,37.05350953,-88.70445755,166,3,0,163,"McCracken, Kentucky, United States"
"06-30-2020","21147","McCreary","Kentucky","United States",2020-07-01 04:33:52,36.73874143,-84.48102924,18,0,0,18,"McCreary, Kentucky, United States"
"06-30-2020","48307","McCulloch","Texas","United States",2020-07-01 04:33:52,31.1925468,-99.34682807,12,0,0,12,"McCulloch, Texas, United States"
"06-30-2020","40089","McCurtain","Oklahoma","United States",2020-07-01 04:33:52,34.11664328,-94.77222373,471,4,0,467,"McCurtain, Oklahoma, United States"
"06-30-2020","29119","McDonald","Missouri","United States",2020-07-01 04:33:52,36.62869595,-94.34867205,498,1,0,497,"McDonald, Missouri, United States"
"06-30-2020","17109","McDonough","Illinois","United States",2020-07-01 04:33:52,40.45674722,-90.67775541,100,15,0,85,"McDonough, Illinois, United States"
"06-30-2020","37111","McDowell","North Carolina","United States",2020-07-01 04:33:52,35.67736232,-82.0482425,235,2,0,233,"McDowell, North Carolina, United States"
"06-30-2020","54047","McDowell","West Virginia","United States",2020-07-01 04:33:52,37.38002939,-81.65083669,6,0,0,6,"McDowell, West Virginia, United States"
"06-30-2020","13189","McDuffie","Georgia","United States",2020-07-01 04:33:52,33.47851918,-82.48252774,92,6,0,86,"McDuffie, Georgia, United States"
"06-30-2020","17111","McHenry","Illinois","United States",2020-07-01 04:33:52,42.32451172,-88.45248227,2032,97,0,1935,"McHenry, Illinois, United States"
"06-30-2020","38049","McHenry","North Dakota","United States",2020-07-01 04:33:52,48.23104458,-100.6324822,3,1,0,2,"McHenry, North Dakota, United States"
"06-30-2020","13191","McIntosh","Georgia","United States",2020-07-01 04:33:52,31.49683595,-81.40163426,41,1,0,40,"McIntosh, Georgia, United States"
"06-30-2020","38051","McIntosh","North Dakota","United States",2020-07-01 04:33:52,46.11182017,-99.44145858,2,0,0,2,"McIntosh, North Dakota, United States"
"06-30-2020","40091","McIntosh","Oklahoma","United States",2020-07-01 04:33:52,35.37235506,-95.66599306,57,1,0,56,"McIntosh, Oklahoma, United States"
"06-30-2020","42083","McKean","Pennsylvania","United States",2020-07-01 04:33:52,41.80938602,-78.56478358,17,1,0,16,"McKean, Pennsylvania, United States"
"06-30-2020","38053","McKenzie","North Dakota","United States",2020-07-01 04:33:52,47.7413337,-103.395905,27,0,0,27,"McKenzie, North Dakota, United States"
"06-30-2020","35031","McKinley","New Mexico","United States",2020-07-01 04:33:52,35.5800772,-108.262245,3375,168,0,3207,"McKinley, New Mexico, United States"
"06-30-2020","17113","McLean","Illinois","United States",2020-07-01 04:33:52,40.48996987,-88.84621113,260,13,0,247,"McLean, Illinois, United States"
"06-30-2020","21149","McLean","Kentucky","United States",2020-07-01 04:33:52,37.5301951,-87.26803443,24,1,0,23,"McLean, Kentucky, United States"
"06-30-2020","38055","McLean","North Dakota","United States",2020-07-01 04:33:52,47.60766714,-101.3182418,11,0,0,11,"McLean, North Dakota, United States"
"06-30-2020","48309","McLennan","Texas","United States",2020-07-01 04:33:52,31.55255453,-97.20217694,795,8,0,787,"McLennan, Texas, United States"
"06-30-2020","27085","McLeod","Minnesota","United States",2020-07-01 04:33:52,44.82367677,-94.27287017,81,0,0,81,"McLeod, Minnesota, United States"
"06-30-2020","47107","McMinn","Tennessee","United States",2020-07-01 04:33:52,35.42812616,-84.61520715,210,17,0,193,"McMinn, Tennessee, United States"
"06-30-2020","47109","McNairy","Tennessee","United States",2020-07-01 04:33:52,35.17468549,-88.5647812,58,0,0,58,"McNairy, Tennessee, United States"
"06-30-2020","20113","McPherson","Kansas","United States",2020-07-01 04:33:52,38.39184858,-97.64769869,72,0,0,72,"McPherson, Kansas, United States"
"06-30-2020","31117","McPherson","Nebraska","United States",2020-07-01 04:33:52,41.56797682,-101.0599362,0,0,0,0,"McPherson, Nebraska, United States"
"06-30-2020","46089","McPherson","South Dakota","United States",2020-07-01 04:33:52,45.76626028,-99.22118798,4,0,0,4,"McPherson, South Dakota, United States"
"06-30-2020","20119","Meade","Kansas","United States",2020-07-01 04:33:52,37.23859987,-100.364831,30,0,0,30,"Meade, Kansas, United States"
"06-30-2020","21163","Meade","Kentucky","United States",2020-07-01 04:33:52,37.96163597,-86.21028219,26,2,0,24,"Meade, Kentucky, United States"
"06-30-2020","46093","Meade","South Dakota","United States",2020-07-01 04:33:52,44.56676791,-102.7162741,48,1,0,47,"Meade, South Dakota, United States"
"06-30-2020","30059","Meagher","Montana","United States",2020-07-01 04:33:52,46.59907074,-110.8898557,2,0,0,2,"Meagher, Montana, United States"
"06-30-2020","37119","Mecklenburg","North Carolina","United States",2020-07-01 04:33:52,35.24469268,-80.8317671,11170,150,0,11020,"Mecklenburg, North Carolina, United States"
"06-30-2020","51117","Mecklenburg","Virginia","United States",2020-07-01 04:33:52,36.67882005,-78.36131056,240,26,0,214,"Mecklenburg, Virginia, United States"
"06-30-2020","26107","Mecosta","Michigan","United States",2020-07-01 04:33:52,43.64064262,-85.32463223,29,2,0,27,"Mecosta, Michigan, United States"
"06-30-2020","39103","Medina","Ohio","United States",2020-07-01 04:33:52,41.11770589,-81.8998621,480,32,0,448,"Medina, Ohio, United States"
"06-30-2020","48325","Medina","Texas","United States",2020-07-01 04:33:52,29.3557301,-99.11030298,255,2,0,253,"Medina, Texas, United States"
"06-30-2020","27093","Meeker","Minnesota","United States",2020-07-01 04:33:52,45.12328869,-94.52839455,58,1,0,57,"Meeker, Minnesota, United States"
"06-30-2020","39105","Meigs","Ohio","United States",2020-07-01 04:33:52,39.09224872,-82.0305041,11,0,0,11,"Meigs, Ohio, United States"
"06-30-2020","47121","Meigs","Tennessee","United States",2020-07-01 04:33:52,35.51558739,-84.81482914,32,0,0,32,"Meigs, Tennessee, United States"
"06-30-2020","46095","Mellette","South Dakota","United States",2020-07-01 04:33:52,43.58078848,-100.7563186,3,0,0,3,"Mellette, South Dakota, United States"
"06-30-2020","17129","Menard","Illinois","United States",2020-07-01 04:33:52,40.02742725,-89.80246001,25,0,0,25,"Menard, Illinois, United States"
"06-30-2020","48327","Menard","Texas","United States",2020-07-01 04:33:52,30.88990665,-99.8204794,6,0,0,6,"Menard, Texas, United States"
"06-30-2020","06045","Mendocino","California","United States",2020-07-01 04:33:52,39.4381191,-123.3911313,78,0,0,78,"Mendocino, California, United States"
"06-30-2020","21165","Menifee","Kentucky","United States",2020-07-01 04:33:52,37.94090733,-83.59985712,13,0,0,13,"Menifee, Kentucky, United States"
"06-30-2020","26109","Menominee","Michigan","United States",2020-07-01 04:33:52,45.58038692,-87.55370409,16,0,0,16,"Menominee, Michigan, United States"
"06-30-2020","55078","Menominee","Wisconsin","United States",2020-07-01 04:33:52,45.00422544,-88.70950714,7,0,0,7,"Menominee, Wisconsin, United States"
"06-30-2020","06047","Merced","California","United States",2020-07-01 04:33:52,37.18922369,-120.7209035,979,11,0,968,"Merced, California, United States"
"06-30-2020","17131","Mercer","Illinois","United States",2020-07-01 04:33:52,41.20596782,-90.74290052,20,0,0,20,"Mercer, Illinois, United States"
"06-30-2020","21167","Mercer","Kentucky","United States",2020-07-01 04:33:52,37.81474237,-84.87488475,23,0,0,23,"Mercer, Kentucky, United States"
"06-30-2020","29129","Mercer","Missouri","United States",2020-07-01 04:33:52,40.42212303,-93.5682959,6,0,0,6,"Mercer, Missouri, United States"
"06-30-2020","34021","Mercer","New Jersey","United States",2020-07-01 04:33:52,40.28047017,-74.70479631,7659,577,0,7082,"Mercer, New Jersey, United States"
"06-30-2020","38057","Mercer","North Dakota","United States",2020-07-01 04:33:52,47.31213126,-101.8318399,6,0,0,6,"Mercer, North Dakota, United States"
"06-30-2020","39107","Mercer","Ohio","United States",2020-07-01 04:33:52,40.54043046,-84.62912742,270,8,0,262,"Mercer, Ohio, United States"
"06-30-2020","42085","Mercer","Pennsylvania","United States",2020-07-01 04:33:52,41.30248872,-80.25816981,140,6,0,134,"Mercer, Pennsylvania, United States"
"06-30-2020","54055","Mercer","West Virginia","United States",2020-07-01 04:33:52,37.40481169,-81.11023142,39,0,0,39,"Mercer, West Virginia, United States"
"06-30-2020","13199","Meriwether","Georgia","United States",2020-07-01 04:33:52,33.04163534,-84.68859732,183,2,0,181,"Meriwether, Georgia, United States"
"06-30-2020","31121","Merrick","Nebraska","United States",2020-07-01 04:33:52,41.16624273,-98.0374887,38,0,0,38,"Merrick, Nebraska, United States"
"06-30-2020","33013","Merrimack","New Hampshire","United States",2020-07-01 04:33:52,43.29662971,-71.6811573,410,18,0,392,"Merrimack, New Hampshire, United States"
"06-30-2020","08077","Mesa","Colorado","United States",2020-07-01 04:33:52,39.01787888,-108.469799,96,0,0,96,"Mesa, Colorado, United States"
"06-30-2020","21169","Metcalfe","Kentucky","United States",2020-07-01 04:33:52,36.99459295,-85.63123699,9,2,0,7,"Metcalfe, Kentucky, United States"
"06-30-2020","18103","Miami","Indiana","United States",2020-07-01 04:33:52,40.76940965,-86.04525048,180,2,0,178,"Miami, Indiana, United States"
"06-30-2020","20121","Miami","Kansas","United States",2020-07-01 04:33:52,38.56383358,-94.83832189,27,0,0,27,"Miami, Kansas, United States"
"06-30-2020","39109","Miami","Ohio","United States",2020-07-01 04:33:52,40.0543329,-84.22871271,437,31,0,406,"Miami, Ohio, United States"
"06-30-2020","12086","Miami-Dade","Florida","United States",2020-07-01 04:33:52,25.6112362,-80.55170587,36820,991,0,35829,"Miami-Dade, Florida, United States"
"06-30-2020",NA,"Michigan Department of Corrections (MDOC)","Michigan","United States",2020-07-01 04:33:52,NA,NA,4107,68,0,4039,"Michigan Department of Corrections (MDOC), Michigan, United States"
"06-30-2020","09007","Middlesex","Connecticut","United States",2020-07-01 04:33:52,41.45949668,-72.53714864,1305,184,0,1121,"Middlesex, Connecticut, United States"
"06-30-2020","25017","Middlesex","Massachusetts","United States",2020-07-01 04:33:52,42.48607732,-71.39049229,23962,1851,0,22111,"Middlesex, Massachusetts, United States"
"06-30-2020","34023","Middlesex","New Jersey","United States",2020-07-01 04:33:52,40.43629879,-74.41426991,16816,1322,0,15494,"Middlesex, New Jersey, United States"
"06-30-2020","51119","Middlesex","Virginia","United States",2020-07-01 04:33:52,37.63191998,-76.55064617,15,0,0,15,"Middlesex, Virginia, United States"
"06-30-2020","26111","Midland","Michigan","United States",2020-07-01 04:33:52,43.64330771,-84.38804374,166,9,0,157,"Midland, Michigan, United States"
"06-30-2020","48329","Midland","Texas","United States",2020-07-01 04:33:52,31.86904128,-102.0315682,651,14,0,637,"Midland, Texas, United States"
"06-30-2020","42087","Mifflin","Pennsylvania","United States",2020-07-01 04:33:52,40.61116939,-77.61070738,63,1,0,62,"Mifflin, Pennsylvania, United States"
"06-30-2020","48331","Milam","Texas","United States",2020-07-01 04:33:52,30.7858183,-96.97718698,83,1,0,82,"Milam, Texas, United States"
"06-30-2020","27095","Mille Lacs","Minnesota","United States",2020-07-01 04:33:52,45.93705297,-93.63236823,32,2,0,30,"Mille Lacs, Minnesota, United States"
"06-30-2020","05091","Miller","Arkansas","United States",2020-07-01 04:33:52,33.31403423,-93.89285258,114,2,0,112,"Miller, Arkansas, United States"
"06-30-2020","13201","Miller","Georgia","United States",2020-07-01 04:33:52,31.16568912,-84.73151117,47,0,0,47,"Miller, Georgia, United States"
"06-30-2020","29131","Miller","Missouri","United States",2020-07-01 04:33:52,38.21450288,-92.42610898,12,0,0,12,"Miller, Missouri, United States"
"06-30-2020","19129","Mills","Iowa","United States",2020-07-01 04:33:52,41.03299766,-95.61920963,34,0,0,34,"Mills, Iowa, United States"
"06-30-2020","48333","Mills","Texas","United States",2020-07-01 04:33:52,31.49557106,-98.59272068,1,0,0,1,"Mills, Texas, United States"
"06-30-2020","55079","Milwaukee","Wisconsin","United States",2020-07-01 04:33:52,43.00486062,-87.96733172,11358,390,0,10968,"Milwaukee, Wisconsin, United States"
"06-30-2020","46097","Miner","South Dakota","United States",2020-07-01 04:33:52,44.02197882,-97.60992207,9,0,0,9,"Miner, South Dakota, United States"
"06-30-2020","08079","Mineral","Colorado","United States",2020-07-01 04:33:52,37.66954283,-106.9281698,7,0,0,7,"Mineral, Colorado, United States"
"06-30-2020","32021","Mineral","Nevada","United States",2020-07-01 04:33:52,38.53841696,-118.4344506,5,0,0,5,"Mineral, Nevada, United States"
"06-30-2020","54057","Mineral","West Virginia","United States",2020-07-01 04:33:52,39.41561583,-78.94104895,56,3,0,53,"Mineral, West Virginia, United States"
"06-30-2020","54059","Mingo","West Virginia","United States",2020-07-01 04:33:52,37.73048351,-82.13338365,20,2,0,18,"Mingo, West Virginia, United States"
"06-30-2020","16067","Minidoka","Idaho","United States",2020-07-01 04:33:52,42.85518524,-113.6357257,185,0,0,185,"Minidoka, Idaho, United States"
"06-30-2020","46099","Minnehaha","South Dakota","United States",2020-07-01 04:33:52,43.67441641,-96.7910885,3610,57,0,3553,"Minnehaha, South Dakota, United States"
"06-30-2020","26113","Missaukee","Michigan","United States",2020-07-01 04:33:52,44.33772443,-85.09256478,29,1,0,28,"Missaukee, Michigan, United States"
"06-30-2020","05093","Mississippi","Arkansas","United States",2020-07-01 04:33:52,35.76271485,-90.0519437,168,3,0,165,"Mississippi, Arkansas, United States"
"06-30-2020","29133","Mississippi","Missouri","United States",2020-07-01 04:33:52,36.82516239,-89.29505753,88,0,0,88,"Mississippi, Missouri, United States"
"06-30-2020","30063","Missoula","Montana","United States",2020-07-01 04:33:52,47.03728583,-113.9213508,86,1,0,85,"Missoula, Montana, United States"
"06-30-2020","13205","Mitchell","Georgia","United States",2020-07-01 04:33:52,31.22483255,-84.19381821,450,38,0,412,"Mitchell, Georgia, United States"
"06-30-2020","19131","Mitchell","Iowa","United States",2020-07-01 04:33:52,43.35638371,-92.78887719,23,0,0,23,"Mitchell, Iowa, United States"
"06-30-2020","20123","Mitchell","Kansas","United States",2020-07-01 04:33:52,39.39331582,-98.20906732,4,0,0,4,"Mitchell, Kansas, United States"
"06-30-2020","37121","Mitchell","North Carolina","United States",2020-07-01 04:33:52,36.01059309,-82.1582442,32,0,0,32,"Mitchell, North Carolina, United States"
"06-30-2020","48335","Mitchell","Texas","United States",2020-07-01 04:33:52,32.30623474,-100.9212058,5,0,0,5,"Mitchell, Texas, United States"
"06-30-2020","01097","Mobile","Alabama","United States",2020-07-01 04:33:52,30.78472347,-88.20842409,3699,134,0,3565,"Mobile, Alabama, United States"
"06-30-2020","08081","Moffat","Colorado","United States",2020-07-01 04:33:52,40.61810999,-108.2070876,14,0,0,14,"Moffat, Colorado, United States"
"06-30-2020","04015","Mohave","Arizona","United States",2020-07-01 04:33:52,35.70471703,-113.7577902,1071,85,0,986,"Mohave, Arizona, United States"
"06-30-2020","29135","Moniteau","Missouri","United States",2020-07-01 04:33:52,38.63571781,-92.57976951,49,1,0,48,"Moniteau, Missouri, United States"
"06-30-2020","34025","Monmouth","New Jersey","United States",2020-07-01 04:33:52,40.26549699,-74.22240686,9140,807,0,8333,"Monmouth, New Jersey, United States"
"06-30-2020","06051","Mono","California","United States",2020-07-01 04:33:52,37.93899289,-118.8872409,42,1,0,41,"Mono, California, United States"
"06-30-2020","19133","Monona","Iowa","United States",2020-07-01 04:33:52,42.05220391,-95.95743843,70,0,0,70,"Monona, Iowa, United States"
"06-30-2020","54061","Monongalia","West Virginia","United States",2020-07-01 04:33:52,39.63218457,-80.04766838,171,5,0,166,"Monongalia, West Virginia, United States"
"06-30-2020","01099","Monroe","Alabama","United States",2020-07-01 04:33:52,31.56729412,-87.36995001,194,2,0,192,"Monroe, Alabama, United States"
"06-30-2020","05095","Monroe","Arkansas","United States",2020-07-01 04:33:52,34.6815935,-91.20540287,12,0,0,12,"Monroe, Arkansas, United States"
"06-30-2020","12087","Monroe","Florida","United States",2020-07-01 04:33:52,25.20904673,-81.07812416,259,4,0,255,"Monroe, Florida, United States"
"06-30-2020","13207","Monroe","Georgia","United States",2020-07-01 04:33:52,33.014289,-83.92097166,160,17,0,143,"Monroe, Georgia, United States"
