"Date_Published","FIPS","Admin2","Province_State","Country_Region","Last_Update","Latitude","Longitude","Confirmed","Deaths","Recovered","Active","Combined_Key"
"07-08-2020","48453","Travis","Texas","United States",2020-07-09 04:34:23,30.33432034,-97.7853562,12408,151,0,12257,"Travis, Texas, United States"
"07-08-2020","30103","Treasure","Montana","United States",2020-07-09 04:34:23,46.2097322,-107.2666516,2,0,0,2,"Treasure, Montana, United States"
"07-08-2020","20195","Trego","Kansas","United States",2020-07-09 04:34:23,38.91467218,-99.87284448,2,0,0,2,"Trego, Kansas, United States"
"07-08-2020","55121","Trempealeau","Wisconsin","United States",2020-07-09 04:34:23,44.30360275,-91.35893614,158,0,0,158,"Trempealeau, Wisconsin, United States"
"07-08-2020","13283","Treutlen","Georgia","United States",2020-07-09 04:34:23,32.40422134,-82.56904553,36,1,0,35,"Treutlen, Georgia, United States"
"07-08-2020",NA,"TriCounty","Utah","United States",2020-07-09 04:34:23,40.12491499,-109.5174415,59,0,0,59,"TriCounty, Utah, United States"
"07-08-2020","21221","Trigg","Kentucky","United States",2020-07-09 04:34:23,36.80767017,-87.87333656,26,0,0,26,"Trigg, Kentucky, United States"
"07-08-2020","21223","Trimble","Kentucky","United States",2020-07-09 04:34:23,38.61056487,-85.33775972,7,0,0,7,"Trimble, Kentucky, United States"
"07-08-2020","06105","Trinity","California","United States",2020-07-09 04:34:23,40.6491767,-123.114713,2,0,0,2,"Trinity, California, United States"
"07-08-2020","48455","Trinity","Texas","United States",2020-07-09 04:34:23,31.0879489,-95.1367187,48,0,0,48,"Trinity, Texas, United States"
"07-08-2020","46123","Tripp","South Dakota","United States",2020-07-09 04:34:23,43.34459388,-99.8854891,18,0,0,18,"Tripp, South Dakota, United States"
"07-08-2020","13285","Troup","Georgia","United States",2020-07-09 04:34:23,33.03349196,-85.02812115,1678,36,0,1642,"Troup, Georgia, United States"
"07-08-2020","47169","Trousdale","Tennessee","United States",2020-07-09 04:34:23,36.39026213,-86.16087954,1503,5,0,1498,"Trousdale, Tennessee, United States"
"07-08-2020","39155","Trumbull","Ohio","United States",2020-07-09 04:34:23,41.31735028,-80.76109643,997,81,0,916,"Trumbull, Ohio, United States"
"07-08-2020","54093","Tucker","West Virginia","United States",2020-07-09 04:34:23,39.11240885,-79.57053576,6,0,0,6,"Tucker, West Virginia, United States"
"07-08-2020","06107","Tulare","California","United States",2020-07-09 04:34:23,36.22026558,-118.8020203,5298,148,0,5150,"Tulare, California, United States"
"07-08-2020","40143","Tulsa","Oklahoma","United States",2020-07-09 04:34:23,36.11939621,-95.94013939,4571,72,0,4499,"Tulsa, Oklahoma, United States"
"07-08-2020","28143","Tunica","Mississippi","United States",2020-07-09 04:34:23,34.64967704,-90.37481167,115,3,0,112,"Tunica, Mississippi, United States"
"07-08-2020","06109","Tuolumne","California","United States",2020-07-09 04:34:23,38.02644018,-119.9525093,58,0,0,58,"Tuolumne, California, United States"
"07-08-2020","13287","Turner","Georgia","United States",2020-07-09 04:34:23,31.71612656,-83.62069378,183,17,0,166,"Turner, Georgia, United States"
"07-08-2020","46125","Turner","South Dakota","United States",2020-07-09 04:34:23,43.3109081,-97.14865776,27,0,0,27,"Turner, South Dakota, United States"
"07-08-2020","01125","Tuscaloosa","Alabama","United States",2020-07-09 04:34:23,33.28726072,-87.52556818,2475,48,0,2427,"Tuscaloosa, Alabama, United States"
"07-08-2020","39157","Tuscarawas","Ohio","United States",2020-07-09 04:34:23,40.44214695,-81.47226262,585,11,0,574,"Tuscarawas, Ohio, United States"
"07-08-2020","26157","Tuscola","Michigan","United States",2020-07-09 04:34:23,43.46606813,-83.41897025,241,26,0,215,"Tuscola, Michigan, United States"
"07-08-2020","13289","Twiggs","Georgia","United States",2020-07-09 04:34:23,32.67435595,-83.43078662,40,1,0,39,"Twiggs, Georgia, United States"
"07-08-2020","16083","Twin Falls","Idaho","United States",2020-07-09 04:34:23,42.35440512,-114.6685381,756,25,0,731,"Twin Falls, Idaho, United States"
"07-08-2020","48457","Tyler","Texas","United States",2020-07-09 04:34:23,30.77031716,-94.37690895,30,0,0,30,"Tyler, Texas, United States"
"07-08-2020","54095","Tyler","West Virginia","United States",2020-07-09 04:34:23,39.46811972,-80.88772676,7,0,0,7,"Tyler, West Virginia, United States"
"07-08-2020","37177","Tyrrell","North Carolina","United States",2020-07-09 04:34:23,35.87147226,-76.17055253,30,1,0,29,"Tyrrell, North Carolina, United States"
"07-08-2020","56041","Uinta","Wyoming","United States",2020-07-09 04:34:23,41.2878183,-110.5475782,192,0,0,192,"Uinta, Wyoming, United States"
"07-08-2020","36111","Ulster","New York","United States",2020-07-09 04:34:23,41.89027881,-74.26252104,1845,86,0,1759,"Ulster, New York, United States"
"07-08-2020","41059","Umatilla","Oregon","United States",2020-07-09 04:34:23,45.59073056,-118.7353826,834,6,0,828,"Umatilla, Oregon, United States"
"07-08-2020","90001","Unassigned","Alabama","United States",2020-07-09 04:34:23,NA,NA,0,26,0,NA,"Unassigned, Alabama, United States"
"07-08-2020","90002","Unassigned","Alaska","United States",2020-07-09 04:34:23,NA,NA,0,2,0,NA,"Unassigned, Alaska, United States"
"07-08-2020","90004","Unassigned","Arizona","United States",2020-07-09 04:34:23,NA,NA,0,1,0,NA,"Unassigned, Arizona, United States"
"07-08-2020","90005","Unassigned","Arkansas","United States",2020-07-09 04:34:23,NA,NA,945,0,0,945,"Unassigned, Arkansas, United States"
"07-08-2020","90006","Unassigned","California","United States",2020-07-09 04:34:23,NA,NA,0,0,0,0,"Unassigned, California, United States"
"07-08-2020","90008","Unassigned","Colorado","United States",2020-07-09 04:34:23,NA,NA,17,0,0,17,"Unassigned, Colorado, United States"
"07-08-2020","90009","Unassigned","Connecticut","United States",2020-07-09 04:34:23,NA,NA,228,0,0,228,"Unassigned, Connecticut, United States"
"07-08-2020","90010","Unassigned","Delaware","United States",2020-07-09 02:48:04,NA,NA,101,0,0,101,"Unassigned, Delaware, United States"
"07-08-2020","90012","Unassigned","Florida","United States",2020-07-09 04:34:23,NA,NA,251,0,0,251,"Unassigned, Florida, United States"
"07-08-2020","90013","Unassigned","Georgia","United States",2020-07-09 04:34:23,NA,NA,1159,2,0,1157,"Unassigned, Georgia, United States"
"07-08-2020","90015","Unassigned","Hawaii","United States",2020-07-09 04:34:23,NA,NA,0,0,0,0,"Unassigned, Hawaii, United States"
"07-08-2020","90016","Unassigned","Idaho","United States",2020-07-09 04:34:23,NA,NA,1,0,0,1,"Unassigned, Idaho, United States"
"07-08-2020","90017","Unassigned","Illinois","United States",2020-07-09 04:34:23,NA,NA,1170,210,0,960,"Unassigned, Illinois, United States"
"07-08-2020","90018","Unassigned","Indiana","United States",2020-07-09 04:34:23,NA,NA,0,113,0,NA,"Unassigned, Indiana, United States"
"07-08-2020","90019","Unassigned","Iowa","United States",2020-07-09 04:34:23,NA,NA,20,0,0,20,"Unassigned, Iowa, United States"
"07-08-2020","90020","Unassigned","Kansas","United States",2020-07-09 04:34:23,NA,NA,0,1,0,NA,"Unassigned, Kansas, United States"
"07-08-2020","90021","Unassigned","Kentucky","United States",2020-07-09 04:34:23,NA,NA,1,0,0,1,"Unassigned, Kentucky, United States"
"07-08-2020","90022","Unassigned","Louisiana","United States",2020-07-09 04:34:23,NA,NA,0,108,0,NA,"Unassigned, Louisiana, United States"
"07-08-2020","90023","Unassigned","Maine","United States",2020-07-09 04:34:23,NA,NA,2,0,0,2,"Unassigned, Maine, United States"
"07-08-2020","90024","Unassigned","Maryland","United States",2020-07-09 04:34:23,NA,NA,0,19,0,NA,"Unassigned, Maryland, United States"
"07-08-2020","90025","Unassigned","Massachusetts","United States",2020-07-09 04:34:23,NA,NA,298,7,0,291,"Unassigned, Massachusetts, United States"
"07-08-2020","90026","Unassigned","Michigan","United States",2020-07-09 04:34:23,NA,NA,4,0,0,4,"Unassigned, Michigan, United States"
"07-08-2020","90027","Unassigned","Minnesota","United States",2020-07-09 04:34:23,NA,NA,87,38,0,49,"Unassigned, Minnesota, United States"
"07-08-2020","90028","Unassigned","Mississippi","United States",2020-07-09 04:34:23,NA,NA,0,0,0,0,"Unassigned, Mississippi, United States"
"07-08-2020","90029","Unassigned","Missouri","United States",2020-07-09 04:34:23,NA,NA,1,0,0,1,"Unassigned, Missouri, United States"
"07-08-2020","90030","Unassigned","Montana","United States",2020-07-09 04:34:23,NA,NA,0,0,0,0,"Unassigned, Montana, United States"
"07-08-2020","90031","Unassigned","Nebraska","United States",2020-07-09 04:34:23,NA,NA,123,1,0,122,"Unassigned, Nebraska, United States"
"07-08-2020","90032","Unassigned","Nevada","United States",2020-07-09 04:34:23,NA,NA,0,0,0,0,"Unassigned, Nevada, United States"
"07-08-2020","90033","Unassigned","New Hampshire","United States",2020-07-09 04:34:23,NA,NA,1,0,0,1,"Unassigned, New Hampshire, United States"
"07-08-2020","90034","Unassigned","New Jersey","United States",2020-07-09 04:34:23,NA,NA,656,0,0,656,"Unassigned, New Jersey, United States"
"07-08-2020","90035","Unassigned","New Mexico","United States",2020-07-09 04:34:23,NA,NA,933,0,0,933,"Unassigned, New Mexico, United States"
"07-08-2020","90036","Unassigned","New York","United States",2020-07-09 04:34:23,NA,NA,0,0,0,0,"Unassigned, New York, United States"
"07-08-2020","90037","Unassigned","North Carolina","United States",2020-07-09 04:34:23,NA,NA,0,0,0,0,"Unassigned, North Carolina, United States"
"07-08-2020","90038","Unassigned","North Dakota","United States",2020-07-09 04:34:23,NA,NA,0,0,0,0,"Unassigned, North Dakota, United States"
"07-08-2020","90039","Unassigned","Ohio","United States",2020-07-09 04:34:23,NA,NA,0,0,0,0,"Unassigned, Ohio, United States"
"07-08-2020","90040","Unassigned","Oklahoma","United States",2020-07-09 04:34:23,NA,NA,0,0,0,0,"Unassigned, Oklahoma, United States"
"07-08-2020","90041","Unassigned","Oregon","United States",2020-07-09 04:34:23,NA,NA,0,0,0,0,"Unassigned, Oregon, United States"
"07-08-2020","90042","Unassigned","Pennsylvania","United States",2020-07-09 04:34:23,NA,NA,0,0,0,0,"Unassigned, Pennsylvania, United States"
"07-08-2020","90044","Unassigned","Rhode Island","United States",2020-07-09 04:34:23,NA,NA,1701,971,0,730,"Unassigned, Rhode Island, United States"
"07-08-2020","90045","Unassigned","South Carolina","United States",2020-07-09 04:34:23,NA,NA,0,0,0,0,"Unassigned, South Carolina, United States"
"07-08-2020","90046","Unassigned","South Dakota","United States",2020-07-09 04:34:23,NA,NA,0,0,0,0,"Unassigned, South Dakota, United States"
"07-08-2020","90047","Unassigned","Tennessee","United States",2020-07-09 04:34:23,NA,NA,830,2,0,828,"Unassigned, Tennessee, United States"
"07-08-2020","90048","Unassigned","Texas","United States",2020-07-09 04:34:23,NA,NA,0,0,0,0,"Unassigned, Texas, United States"
"07-08-2020","90049","Unassigned","Utah","United States",2020-07-09 04:34:23,NA,NA,0,0,0,0,"Unassigned, Utah, United States"
"07-08-2020","90050","Unassigned","Vermont","United States",2020-07-09 04:34:23,NA,NA,5,0,0,5,"Unassigned, Vermont, United States"
"07-08-2020","90051","Unassigned","Virginia","United States",2020-07-09 04:34:23,NA,NA,0,0,0,0,"Unassigned, Virginia, United States"
"07-08-2020","90053","Unassigned","Washington","United States",2020-07-09 04:34:23,NA,NA,35,0,0,35,"Unassigned, Washington, United States"
"07-08-2020","90054","Unassigned","West Virginia","United States",2020-07-09 04:34:23,NA,NA,0,0,0,0,"Unassigned, West Virginia, United States"
"07-08-2020","90055","Unassigned","Wisconsin","United States",2020-07-09 04:34:23,NA,NA,0,0,0,0,"Unassigned, Wisconsin, United States"
"07-08-2020","90056","Unassigned","Wyoming","United States",2020-07-09 04:34:23,NA,NA,0,20,0,NA,"Unassigned, Wyoming, United States"
"07-08-2020","47171","Unicoi","Tennessee","United States",2020-07-09 04:34:23,36.10890856,-82.43709629,56,0,0,56,"Unicoi, Tennessee, United States"
"07-08-2020","05139","Union","Arkansas","United States",2020-07-09 04:34:23,33.16887091,-92.59746952,264,13,0,251,"Union, Arkansas, United States"
"07-08-2020","12125","Union","Florida","United States",2020-07-09 04:34:23,30.04412971,-82.37497443,99,2,0,97,"Union, Florida, United States"
"07-08-2020","13291","Union","Georgia","United States",2020-07-09 04:34:23,34.82995757,-83.98967069,89,3,0,86,"Union, Georgia, United States"
"07-08-2020","17181","Union","Illinois","United States",2020-07-09 04:34:23,37.47119609,-89.25548938,195,19,0,176,"Union, Illinois, United States"
"07-08-2020","18161","Union","Indiana","United States",2020-07-09 04:34:23,39.62550777,-84.92497066,13,0,0,13,"Union, Indiana, United States"
"07-08-2020","19175","Union","Iowa","United States",2020-07-09 04:34:23,41.0277278,-94.24234847,36,0,0,36,"Union, Iowa, United States"
"07-08-2020","21225","Union","Kentucky","United States",2020-07-09 04:34:23,37.66166713,-87.94300009,30,0,0,30,"Union, Kentucky, United States"
"07-08-2020","22111","Union","Louisiana","United States",2020-07-09 04:34:23,32.83121059,-92.3749373,452,27,0,425,"Union, Louisiana, United States"
"07-08-2020","28145","Union","Mississippi","United States",2020-07-09 04:34:23,34.49162015,-89.00776006,233,11,0,222,"Union, Mississippi, United States"
"07-08-2020","34039","Union","New Jersey","United States",2020-07-09 04:34:23,40.65835409,-74.30680092,16558,1330,0,15228,"Union, New Jersey, United States"
"07-08-2020","35059","Union","New Mexico","United States",2020-07-09 04:34:23,36.48126404,-103.4709624,8,0,0,8,"Union, New Mexico, United States"
"07-08-2020","37179","Union","North Carolina","United States",2020-07-09 04:34:23,34.98960527,-80.52955873,1579,25,0,1554,"Union, North Carolina, United States"
"07-08-2020","39159","Union","Ohio","United States",2020-07-09 04:34:23,40.30016061,-83.37239023,92,1,0,91,"Union, Ohio, United States"
"07-08-2020","41061","Union","Oregon","United States",2020-07-09 04:34:23,45.30915495,-118.0068979,363,1,0,362,"Union, Oregon, United States"
"07-08-2020","42119","Union","Pennsylvania","United States",2020-07-09 04:34:23,40.96188846,-77.05996014,98,2,0,96,"Union, Pennsylvania, United States"
"07-08-2020","45087","Union","South Carolina","United States",2020-07-09 04:34:23,34.68835752,-81.61730349,127,0,0,127,"Union, South Carolina, United States"
"07-08-2020","46127","Union","South Dakota","United States",2020-07-09 04:34:23,42.83112163,-96.6557828,138,1,0,137,"Union, South Dakota, United States"
"07-08-2020","47173","Union","Tennessee","United States",2020-07-09 04:34:23,36.28590426,-83.83651902,19,0,0,19,"Union, Tennessee, United States"
"07-08-2020","48459","Upshur","Texas","United States",2020-07-09 04:34:23,32.73706798,-94.93999853,78,0,0,78,"Upshur, Texas, United States"
"07-08-2020","54097","Upshur","West Virginia","United States",2020-07-09 04:34:23,38.89285061,-80.23689136,22,0,0,22,"Upshur, West Virginia, United States"
"07-08-2020","13293","Upson","Georgia","United States",2020-07-09 04:34:23,32.87920671,-84.30024826,382,45,0,337,"Upson, Georgia, United States"
"07-08-2020","48461","Upton","Texas","United States",2020-07-09 04:34:23,31.36868194,-102.0423217,7,0,0,7,"Upton, Texas, United States"
"07-08-2020","49049","Utah","Utah","United States",2020-07-09 04:34:23,40.1166722,-111.6657662,4894,27,0,4867,"Utah, Utah, United States"
"07-08-2020","48463","Uvalde","Texas","United States",2020-07-09 04:34:23,29.35739637,-99.76229172,179,1,0,178,"Uvalde, Texas, United States"
"07-08-2020","48465","Val Verde","Texas","United States",2020-07-09 04:34:23,29.89149232,-101.1525205,509,1,0,508,"Val Verde, Texas, United States"
"07-08-2020","02261","Valdez-Cordova","Alaska","United States",2020-07-09 04:34:23,61.47502768,-144.7126799,6,0,0,6,"Valdez-Cordova, Alaska, United States"
"07-08-2020","35061","Valencia","New Mexico","United States",2020-07-09 04:34:23,34.71669834,-106.8103733,163,2,0,161,"Valencia, New Mexico, United States"
"07-08-2020","16085","Valley","Idaho","United States",2020-07-09 04:34:23,44.76728382,-115.5676773,23,0,0,23,"Valley, Idaho, United States"
"07-08-2020","30105","Valley","Montana","United States",2020-07-09 04:34:23,48.36435097,-106.6669635,4,0,0,4,"Valley, Montana, United States"
"07-08-2020","31175","Valley","Nebraska","United States",2020-07-09 04:34:23,41.56730777,-98.98197724,8,0,0,8,"Valley, Nebraska, United States"
"07-08-2020","05141","Van Buren","Arkansas","United States",2020-07-09 04:34:23,35.58095779,-92.51295036,36,2,0,34,"Van Buren, Arkansas, United States"
"07-08-2020","19177","Van Buren","Iowa","United States",2020-07-09 04:34:23,40.75326764,-91.95017958,21,0,0,21,"Van Buren, Iowa, United States"
"07-08-2020","26159","Van Buren","Michigan","United States",2020-07-09 04:34:23,42.25190229,-86.01939087,256,8,0,248,"Van Buren, Michigan, United States"
"07-08-2020","47175","Van Buren","Tennessee","United States",2020-07-09 04:34:23,35.69864497,-85.45221699,7,0,0,7,"Van Buren, Tennessee, United States"
"07-08-2020","39161","Van Wert","Ohio","United States",2020-07-09 04:34:23,40.8554138,-84.591117,42,1,0,41,"Van Wert, Ohio, United States"
"07-08-2020","48467","Van Zandt","Texas","United States",2020-07-09 04:34:23,32.56483801,-95.83766469,150,3,0,147,"Van Zandt, Texas, United States"
"07-08-2020","37181","Vance","North Carolina","United States",2020-07-09 04:34:23,36.36880673,-78.40670845,537,40,0,497,"Vance, North Carolina, United States"
"07-08-2020","18163","Vanderburgh","Indiana","United States",2020-07-09 04:34:23,38.02658833,-87.58763124,587,6,0,581,"Vanderburgh, Indiana, United States"
"07-08-2020","42121","Venango","Pennsylvania","United States",2020-07-09 04:34:23,41.40323442,-79.75845449,34,0,0,34,"Venango, Pennsylvania, United States"
"07-08-2020","06111","Ventura","California","United States",2020-07-09 04:34:23,34.44465746,-119.0910613,3858,50,0,3808,"Ventura, California, United States"
"07-08-2020","17183","Vermilion","Illinois","United States",2020-07-09 04:34:23,40.18417171,-87.73384359,82,2,0,80,"Vermilion, Illinois, United States"
"07-08-2020","22113","Vermilion","Louisiana","United States",2020-07-09 04:34:23,29.83517605,-92.30292538,425,6,0,419,"Vermilion, Louisiana, United States"
"07-08-2020","18165","Vermillion","Indiana","United States",2020-07-09 04:34:23,39.8523352,-87.46160542,14,0,0,14,"Vermillion, Indiana, United States"
"07-08-2020","22115","Vernon","Louisiana","United States",2020-07-09 04:34:23,31.10884837,-93.18153838,223,9,0,214,"Vernon, Louisiana, United States"
"07-08-2020","29217","Vernon","Missouri","United States",2020-07-09 04:34:23,37.8457799,-94.34127305,26,0,0,26,"Vernon, Missouri, United States"
"07-08-2020","55123","Vernon","Wisconsin","United States",2020-07-09 04:34:23,43.59422667,-90.8324691,39,0,0,39,"Vernon, Wisconsin, United States"
"07-08-2020","48469","Victoria","Texas","United States",2020-07-09 04:34:23,28.79780988,-96.96813006,1334,9,0,1325,"Victoria, Texas, United States"
"07-08-2020","18167","Vigo","Indiana","United States",2020-07-09 04:34:23,39.42944561,-87.39169027,238,8,0,230,"Vigo, Indiana, United States"
"07-08-2020","55125","Vilas","Wisconsin","United States",2020-07-09 04:34:23,46.05467334,-89.51719204,14,0,0,14,"Vilas, Wisconsin, United States"
"07-08-2020","39163","Vinton","Ohio","United States",2020-07-09 04:34:23,39.25208988,-82.4831444,22,2,0,20,"Vinton, Ohio, United States"
"07-08-2020","51810","Virginia Beach","Virginia","United States",2020-07-09 04:34:23,36.73285734,-76.04566934,1520,30,0,1490,"Virginia Beach, Virginia, United States"
"07-08-2020","12127","Volusia","Florida","United States",2020-07-09 04:34:23,29.05858895,-81.18263252,3070,62,0,3008,"Volusia, Florida, United States"
"07-08-2020","17185","Wabash","Illinois","United States",2020-07-09 04:34:23,38.44272901,-87.84922065,23,0,0,23,"Wabash, Illinois, United States"
"07-08-2020","18169","Wabash","Indiana","United States",2020-07-09 04:34:23,40.84704239,-85.79328272,114,2,0,112,"Wabash, Indiana, United States"
"07-08-2020","27157","Wabasha","Minnesota","United States",2020-07-09 04:34:23,44.28424356,-92.23121312,35,0,0,35,"Wabasha, Minnesota, United States"
"07-08-2020","20197","Wabaunsee","Kansas","United States",2020-07-09 04:34:23,38.95471985,-96.20350509,37,0,0,37,"Wabaunsee, Kansas, United States"
"07-08-2020","27159","Wadena","Minnesota","United States",2020-07-09 04:34:23,46.58589171,-94.96968506,15,0,0,15,"Wadena, Minnesota, United States"
"07-08-2020","40145","Wagoner","Oklahoma","United States",2020-07-09 04:34:23,35.96024096,-95.51911308,336,19,0,317,"Wagoner, Oklahoma, United States"
"07-08-2020","53069","Wahkiakum","Washington","United States",2020-07-09 04:34:23,46.2918004,-123.4250831,5,0,0,5,"Wahkiakum, Washington, United States"
"07-08-2020","37183","Wake","North Carolina","United States",2020-07-09 04:34:23,35.78879266,-78.65249174,6471,54,0,6417,"Wake, North Carolina, United States"
"07-08-2020","12129","Wakulla","Florida","United States",2020-07-09 04:34:23,30.16548905,-84.39895211,94,1,0,93,"Wakulla, Florida, United States"
"07-08-2020","23027","Waldo","Maine","United States",2020-07-09 04:34:23,44.4858305,-69.12061935,58,14,0,44,"Waldo, Maine, United States"
"07-08-2020","01127","Walker","Alabama","United States",2020-07-09 04:34:23,33.80270512,-87.30027177,1066,25,0,1041,"Walker, Alabama, United States"
"07-08-2020","13295","Walker","Georgia","United States",2020-07-09 04:34:23,34.73376362,-85.30165174,363,12,0,351,"Walker, Georgia, United States"
"07-08-2020","48471","Walker","Texas","United States",2020-07-09 04:34:23,30.73872995,-95.57440968,2149,28,0,2121,"Walker, Texas, United States"
"07-08-2020","53071","Walla Walla","Washington","United States",2020-07-09 04:34:23,46.23040051,-118.4775539,199,2,0,197,"Walla Walla, Washington, United States"
"07-08-2020","48473","Waller","Texas","United States",2020-07-09 04:34:23,30.01058447,-95.99011759,205,0,0,205,"Waller, Texas, United States"
"07-08-2020","41063","Wallowa","Oregon","United States",2020-07-09 04:34:23,45.57894064,-117.183538,11,0,0,11,"Wallowa, Oregon, United States"
"07-08-2020","38099","Walsh","North Dakota","United States",2020-07-09 04:34:23,48.36876964,-97.72574783,31,0,0,31,"Walsh, North Dakota, United States"
"07-08-2020","28147","Walthall","Mississippi","United States",2020-07-09 04:34:23,31.14971548,-90.10446654,208,7,0,201,"Walthall, Mississippi, United States"
"07-08-2020","12131","Walton","Florida","United States",2020-07-09 04:34:23,30.64204028,-86.16935664,395,9,0,386,"Walton, Florida, United States"
"07-08-2020","13297","Walton","Georgia","United States",2020-07-09 04:34:23,33.78017694,-83.73552314,497,28,0,469,"Walton, Georgia, United States"
"07-08-2020","46129","Walworth","South Dakota","United States",2020-07-09 04:34:23,45.43019636,-100.0307514,16,0,0,16,"Walworth, South Dakota, United States"
"07-08-2020","55127","Walworth","Wisconsin","United States",2020-07-09 04:34:23,42.66858202,-88.54163073,713,18,0,695,"Walworth, Wisconsin, United States"
"07-08-2020","19179","Wapello","Iowa","United States",2020-07-09 04:34:23,41.03064984,-92.40954728,712,31,0,681,"Wapello, Iowa, United States"
"07-08-2020","38101","Ward","North Dakota","United States",2020-07-09 04:34:23,48.22390169,-101.5436763,65,1,0,64,"Ward, North Dakota, United States"
"07-08-2020","48475","Ward","Texas","United States",2020-07-09 04:34:23,31.50999644,-103.0927909,29,0,0,29,"Ward, Texas, United States"
"07-08-2020","13299","Ware","Georgia","United States",2020-07-09 04:34:23,31.05449097,-82.42224148,555,16,0,539,"Ware, Georgia, United States"
"07-08-2020","13301","Warren","Georgia","United States",2020-07-09 04:34:23,33.41146451,-82.67795848,30,0,0,30,"Warren, Georgia, United States"
"07-08-2020","17187","Warren","Illinois","United States",2020-07-09 04:34:23,40.84925021,-90.6147432,147,0,0,147,"Warren, Illinois, United States"
"07-08-2020","18171","Warren","Indiana","United States",2020-07-09 04:34:23,40.34728141,-87.35602659,14,1,0,13,"Warren, Indiana, United States"
"07-08-2020","19181","Warren","Iowa","United States",2020-07-09 04:34:23,41.33559454,-93.56007641,297,1,0,296,"Warren, Iowa, United States"
"07-08-2020","21227","Warren","Kentucky","United States",2020-07-09 04:34:23,36.99903045,-86.42672751,1672,14,0,1658,"Warren, Kentucky, United States"
"07-08-2020","28149","Warren","Mississippi","United States",2020-07-09 04:34:23,32.35810271,-90.83352619,540,20,0,520,"Warren, Mississippi, United States"
"07-08-2020","29219","Warren","Missouri","United States",2020-07-09 04:34:23,38.76529479,-91.16124662,53,0,0,53,"Warren, Missouri, United States"
"07-08-2020","34041","Warren","New Jersey","United States",2020-07-09 04:34:23,40.85951833,-74.99556527,1269,164,0,1105,"Warren, New Jersey, United States"
"07-08-2020","36113","Warren","New York","United States",2020-07-09 04:34:23,43.56173026,-73.8433699,273,33,0,240,"Warren, New York, United States"
"07-08-2020","37185","Warren","North Carolina","United States",2020-07-09 04:34:23,36.39728256,-78.10652228,176,5,0,171,"Warren, North Carolina, United States"
"07-08-2020","39165","Warren","Ohio","United States",2020-07-09 04:34:23,39.42581994,-84.16557457,895,27,0,868,"Warren, Ohio, United States"
"07-08-2020","42123","Warren","Pennsylvania","United States",2020-07-09 04:34:23,41.81304978,-79.26969577,7,1,0,6,"Warren, Pennsylvania, United States"
"07-08-2020","47177","Warren","Tennessee","United States",2020-07-09 04:34:23,35.6728299,-85.77969117,100,0,0,100,"Warren, Tennessee, United States"
"07-08-2020","51187","Warren","Virginia","United States",2020-07-09 04:34:23,38.90847745,-78.20280433,302,8,0,294,"Warren, Virginia, United States"
"07-08-2020","18173","Warrick","Indiana","United States",2020-07-09 04:34:23,38.08922676,-87.2716085,227,29,0,198,"Warrick, Indiana, United States"
"07-08-2020","49051","Wasatch","Utah","United States",2020-07-09 04:34:23,40.33110236,-111.1691419,436,4,0,432,"Wasatch, Utah, United States"
"07-08-2020","41065","Wasco","Oregon","United States",2020-07-09 04:34:23,45.16292781,-121.1670954,97,1,0,96,"Wasco, Oregon, United States"
