"Date_Published","FIPS","Admin2","Province_State","Country_Region","Last_Update","Latitude","Longitude","Confirmed","Deaths","Recovered","Active","Combined_Key"
"07-08-2020","47113","Madison","Tennessee","United States",2020-07-09 04:34:23,35.61181957,-88.84076036,339,2,0,337,"Madison, Tennessee, United States"
"07-08-2020","48313","Madison","Texas","United States",2020-07-09 04:34:23,30.96694679,-95.93003775,75,0,0,75,"Madison, Texas, United States"
"07-08-2020","51113","Madison","Virginia","United States",2020-07-09 04:34:23,38.41531222,-78.28220331,46,1,0,45,"Madison, Virginia, United States"
"07-08-2020","21153","Magoffin","Kentucky","United States",2020-07-09 04:34:23,37.70820545,-83.0657714,7,0,0,7,"Magoffin, Kentucky, United States"
"07-08-2020","19123","Mahaska","Iowa","United States",2020-07-09 04:34:23,41.33521503,-92.64083907,118,17,0,101,"Mahaska, Iowa, United States"
"07-08-2020","27087","Mahnomen","Minnesota","United States",2020-07-09 04:34:23,47.32557075,-95.80921485,10,1,0,9,"Mahnomen, Minnesota, United States"
"07-08-2020","39099","Mahoning","Ohio","United States",2020-07-09 04:34:23,41.01631101,-80.77287029,1861,240,0,1621,"Mahoning, Ohio, United States"
"07-08-2020","40093","Major","Oklahoma","United States",2020-07-09 04:34:23,36.31149996,-98.53467076,9,1,0,8,"Major, Oklahoma, United States"
"07-08-2020","41045","Malheur","Oregon","United States",2020-07-09 04:34:23,43.1937027,-117.6227395,235,1,0,234,"Malheur, Oregon, United States"
"07-08-2020","51683","Manassas","Virginia","United States",2020-07-09 04:34:23,38.7464321,-77.48509905,1464,18,0,1446,"Manassas, Virginia, United States"
"07-08-2020","51685","Manassas Park","Virginia","United States",2020-07-09 04:34:23,38.77058531,-77.44399307,449,6,0,443,"Manassas Park, Virginia, United States"
"07-08-2020","12081","Manatee","Florida","United States",2020-07-09 04:34:23,27.47196942,-82.31831044,4080,135,0,3945,"Manatee, Florida, United States"
"07-08-2020","26101","Manistee","Michigan","United States",2020-07-09 04:34:23,44.33352407,-86.05626916,25,0,0,25,"Manistee, Michigan, United States"
"07-08-2020","55071","Manitowoc","Wisconsin","United States",2020-07-09 04:34:23,44.11946801,-87.80928853,128,1,0,127,"Manitowoc, Wisconsin, United States"
"07-08-2020","55073","Marathon","Wisconsin","United States",2020-07-09 04:34:23,44.89792533,-89.75863384,233,1,0,232,"Marathon, Wisconsin, United States"
"07-08-2020","01091","Marengo","Alabama","United States",2020-07-09 04:34:23,32.24767634,-87.78796182,321,11,0,310,"Marengo, Alabama, United States"
"07-08-2020","04013","Maricopa","Arizona","United States",2020-07-09 04:34:23,33.34835867,-112.4918154,70128,959,0,69169,"Maricopa, Arizona, United States"
"07-08-2020","29125","Maries","Missouri","United States",2020-07-09 04:34:23,38.16193985,-91.92249662,6,0,0,6,"Maries, Missouri, United States"
"07-08-2020","06041","Marin","California","United States",2020-07-09 04:34:23,38.07122463,-122.7210631,3232,26,0,3206,"Marin, California, United States"
"07-08-2020","55075","Marinette","Wisconsin","United States",2020-07-09 04:34:23,45.38553432,-88.033246,73,3,0,70,"Marinette, Wisconsin, United States"
"07-08-2020","01093","Marion","Alabama","United States",2020-07-09 04:34:23,34.13697363,-87.88704173,241,14,0,227,"Marion, Alabama, United States"
"07-08-2020","05089","Marion","Arkansas","United States",2020-07-09 04:34:23,36.26844485,-92.68451899,12,0,0,12,"Marion, Arkansas, United States"
"07-08-2020","12083","Marion","Florida","United States",2020-07-09 04:34:23,29.21227113,-82.05803627,1111,12,0,1099,"Marion, Florida, United States"
"07-08-2020","13197","Marion","Georgia","United States",2020-07-09 04:34:23,32.3483402,-84.52733571,88,2,0,86,"Marion, Georgia, United States"
"07-08-2020","17121","Marion","Illinois","United States",2020-07-09 04:34:23,38.64963204,-88.91899208,73,0,0,73,"Marion, Illinois, United States"
"07-08-2020","18097","Marion","Indiana","United States",2020-07-09 04:34:23,39.78163624,-86.13826325,11760,689,0,11071,"Marion, Indiana, United States"
"07-08-2020","19125","Marion","Iowa","United States",2020-07-09 04:34:23,41.33445101,-93.09934783,74,0,0,74,"Marion, Iowa, United States"
"07-08-2020","20115","Marion","Kansas","United States",2020-07-09 04:34:23,38.35855394,-97.0985251,13,1,0,12,"Marion, Kansas, United States"
"07-08-2020","21155","Marion","Kentucky","United States",2020-07-09 04:34:23,37.55218078,-85.26898542,58,0,0,58,"Marion, Kentucky, United States"
"07-08-2020","28091","Marion","Mississippi","United States",2020-07-09 04:34:23,31.23132643,-89.8209217,308,12,0,296,"Marion, Mississippi, United States"
"07-08-2020","29127","Marion","Missouri","United States",2020-07-09 04:34:23,39.80601912,-91.62203062,27,0,0,27,"Marion, Missouri, United States"
"07-08-2020","39101","Marion","Ohio","United States",2020-07-09 04:34:23,40.58610662,-83.15736305,2736,39,0,2697,"Marion, Ohio, United States"
"07-08-2020","41047","Marion","Oregon","United States",2020-07-09 04:34:23,44.90287942,-122.5815117,1697,51,0,1646,"Marion, Oregon, United States"
"07-08-2020","45067","Marion","South Carolina","United States",2020-07-09 04:34:23,34.07859748,-79.36400756,285,9,0,276,"Marion, South Carolina, United States"
"07-08-2020","47115","Marion","Tennessee","United States",2020-07-09 04:34:23,35.12997174,-85.62265895,87,4,0,83,"Marion, Tennessee, United States"
"07-08-2020","48315","Marion","Texas","United States",2020-07-09 04:34:23,32.79868409,-94.3566123,37,1,0,36,"Marion, Texas, United States"
"07-08-2020","54049","Marion","West Virginia","United States",2020-07-09 04:34:23,39.50984542,-80.24244659,95,2,0,93,"Marion, West Virginia, United States"
"07-08-2020","06043","Mariposa","California","United States",2020-07-09 04:34:23,37.57978556,-119.9073334,31,1,0,30,"Mariposa, California, United States"
"07-08-2020","45069","Marlboro","South Carolina","United States",2020-07-09 04:34:23,34.59905577,-79.67561152,327,4,0,323,"Marlboro, South Carolina, United States"
"07-08-2020","26103","Marquette","Michigan","United States",2020-07-09 04:34:23,46.4338914,-87.64043701,84,11,0,73,"Marquette, Michigan, United States"
"07-08-2020","55077","Marquette","Wisconsin","United States",2020-07-09 04:34:23,43.81911946,-89.40073763,35,1,0,34,"Marquette, Wisconsin, United States"
"07-08-2020","01095","Marshall","Alabama","United States",2020-07-09 04:34:23,34.36975964,-86.30486727,1853,11,0,1842,"Marshall, Alabama, United States"
"07-08-2020","17123","Marshall","Illinois","United States",2020-07-09 04:34:23,41.0327901,-89.34510444,12,0,0,12,"Marshall, Illinois, United States"
"07-08-2020","18099","Marshall","Indiana","United States",2020-07-09 04:34:23,41.32467367,-86.26185087,501,6,0,495,"Marshall, Indiana, United States"
"07-08-2020","19127","Marshall","Iowa","United States",2020-07-09 04:34:23,42.03586837,-92.9990819,1063,19,0,1044,"Marshall, Iowa, United States"
"07-08-2020","20117","Marshall","Kansas","United States",2020-07-09 04:34:23,39.78359669,-96.52278974,2,0,0,2,"Marshall, Kansas, United States"
"07-08-2020","21157","Marshall","Kentucky","United States",2020-07-09 04:34:23,36.8800707,-88.32803576,66,2,0,64,"Marshall, Kentucky, United States"
"07-08-2020","27089","Marshall","Minnesota","United States",2020-07-09 04:34:23,48.35825983,-96.37017407,12,0,0,12,"Marshall, Minnesota, United States"
"07-08-2020","28093","Marshall","Mississippi","United States",2020-07-09 04:34:23,34.76216286,-89.50299462,264,3,0,261,"Marshall, Mississippi, United States"
"07-08-2020","40095","Marshall","Oklahoma","United States",2020-07-09 04:34:23,34.02311222,-96.76855464,43,0,0,43,"Marshall, Oklahoma, United States"
"07-08-2020","46091","Marshall","South Dakota","United States",2020-07-09 04:34:23,45.75870838,-97.59855639,5,0,0,5,"Marshall, South Dakota, United States"
"07-08-2020","47117","Marshall","Tennessee","United States",2020-07-09 04:34:23,35.45798777,-86.76420988,101,1,0,100,"Marshall, Tennessee, United States"
"07-08-2020","54051","Marshall","West Virginia","United States",2020-07-09 04:34:23,39.86064362,-80.66591062,49,0,0,49,"Marshall, West Virginia, United States"
"07-08-2020","12085","Martin","Florida","United States",2020-07-09 04:34:23,27.0772071,-80.43109784,2503,34,0,2469,"Martin, Florida, United States"
"07-08-2020","18101","Martin","Indiana","United States",2020-07-09 04:34:23,38.7099921,-86.80373186,22,0,0,22,"Martin, Indiana, United States"
"07-08-2020","21159","Martin","Kentucky","United States",2020-07-09 04:34:23,37.79990579,-82.51247478,10,0,0,10,"Martin, Kentucky, United States"
"07-08-2020","27091","Martin","Minnesota","United States",2020-07-09 04:34:23,43.67429718,-94.55099908,171,5,0,166,"Martin, Minnesota, United States"
"07-08-2020","37117","Martin","North Carolina","United States",2020-07-09 04:34:23,35.84326734,-77.10860251,153,5,0,148,"Martin, North Carolina, United States"
"07-08-2020","48317","Martin","Texas","United States",2020-07-09 04:34:23,32.30600051,-101.9513518,21,1,0,20,"Martin, Texas, United States"
"07-08-2020","51690","Martinsville","Virginia","United States",2020-07-09 04:34:23,36.68212094,-79.86352771,101,1,0,100,"Martinsville, Virginia, United States"
"07-08-2020","17125","Mason","Illinois","United States",2020-07-09 04:34:23,40.23917274,-89.91824452,23,0,0,23,"Mason, Illinois, United States"
"07-08-2020","21161","Mason","Kentucky","United States",2020-07-09 04:34:23,38.59471935,-83.82151043,39,1,0,38,"Mason, Kentucky, United States"
"07-08-2020","26105","Mason","Michigan","United States",2020-07-09 04:34:23,43.99509218,-86.24988902,70,0,0,70,"Mason, Michigan, United States"
"07-08-2020","48319","Mason","Texas","United States",2020-07-09 04:34:23,30.71780434,-99.22629416,35,0,0,35,"Mason, Texas, United States"
"07-08-2020","53045","Mason","Washington","United States",2020-07-09 04:34:23,47.35007586,-123.1863685,55,1,0,54,"Mason, Washington, United States"
"07-08-2020","54053","Mason","West Virginia","United States",2020-07-09 04:34:23,38.77071799,-82.02524219,21,0,0,21,"Mason, West Virginia, United States"
"07-08-2020","17127","Massac","Illinois","United States",2020-07-09 04:34:23,37.22078441,-88.71036614,15,0,0,15,"Massac, Illinois, United States"
"07-08-2020","48321","Matagorda","Texas","United States",2020-07-09 04:34:23,28.81955746,-96.01230294,286,5,0,281,"Matagorda, Texas, United States"
"07-08-2020","02170","Matanuska-Susitna","Alaska","United States",2020-07-09 04:34:23,62.31305045,-149.5741743,121,1,0,120,"Matanuska-Susitna, Alaska, United States"
"07-08-2020","51115","Mathews","Virginia","United States",2020-07-09 04:34:23,37.44164146,-76.34098896,6,0,0,6,"Mathews, Virginia, United States"
"07-08-2020","15009","Maui","Hawaii","United States",2020-07-09 04:34:23,20.86399628,-156.5689097,130,6,0,124,"Maui, Hawaii, United States"
"07-08-2020","47119","Maury","Tennessee","United States",2020-07-09 04:34:23,35.6187413,-87.07462444,406,3,0,403,"Maury, Tennessee, United States"
"07-08-2020","48323","Maverick","Texas","United States",2020-07-09 04:34:23,28.7429195,-100.3157686,550,5,0,545,"Maverick, Texas, United States"
"07-08-2020","40097","Mayes","Oklahoma","United States",2020-07-09 04:34:23,36.30179091,-95.23175116,105,5,0,100,"Mayes, Oklahoma, United States"
"07-08-2020","40087","McClain","Oklahoma","United States",2020-07-09 04:34:23,35.01123903,-97.44572302,221,4,0,217,"McClain, Oklahoma, United States"
"07-08-2020","46087","McCook","South Dakota","United States",2020-07-09 04:34:23,43.6742571,-97.36863144,14,1,0,13,"McCook, South Dakota, United States"
"07-08-2020","45065","McCormick","South Carolina","United States",2020-07-09 04:34:23,33.90161443,-82.30794338,28,2,0,26,"McCormick, South Carolina, United States"
"07-08-2020","21145","McCracken","Kentucky","United States",2020-07-09 04:34:23,37.05350953,-88.70445755,181,3,0,178,"McCracken, Kentucky, United States"
"07-08-2020","21147","McCreary","Kentucky","United States",2020-07-09 04:34:23,36.73874143,-84.48102924,18,0,0,18,"McCreary, Kentucky, United States"
"07-08-2020","48307","McCulloch","Texas","United States",2020-07-09 04:34:23,31.1925468,-99.34682807,22,0,0,22,"McCulloch, Texas, United States"
"07-08-2020","40089","McCurtain","Oklahoma","United States",2020-07-09 04:34:23,34.11664328,-94.77222373,581,9,0,572,"McCurtain, Oklahoma, United States"
"07-08-2020","29119","McDonald","Missouri","United States",2020-07-09 04:34:23,36.62869595,-94.34867205,670,1,0,669,"McDonald, Missouri, United States"
"07-08-2020","17109","McDonough","Illinois","United States",2020-07-09 04:34:23,40.45674722,-90.67775541,104,15,0,89,"McDonough, Illinois, United States"
"07-08-2020","37111","McDowell","North Carolina","United States",2020-07-09 04:34:23,35.67736232,-82.0482425,292,2,0,290,"McDowell, North Carolina, United States"
"07-08-2020","54047","McDowell","West Virginia","United States",2020-07-09 04:34:23,37.38002939,-81.65083669,6,0,0,6,"McDowell, West Virginia, United States"
"07-08-2020","13189","McDuffie","Georgia","United States",2020-07-09 04:34:23,33.47851918,-82.48252774,132,7,0,125,"McDuffie, Georgia, United States"
"07-08-2020","17111","McHenry","Illinois","United States",2020-07-09 04:34:23,42.32451172,-88.45248227,2179,100,0,2079,"McHenry, Illinois, United States"
"07-08-2020","38049","McHenry","North Dakota","United States",2020-07-09 04:34:23,48.23104458,-100.6324822,6,1,0,5,"McHenry, North Dakota, United States"
"07-08-2020","13191","McIntosh","Georgia","United States",2020-07-09 04:34:23,31.49683595,-81.40163426,71,1,0,70,"McIntosh, Georgia, United States"
"07-08-2020","38051","McIntosh","North Dakota","United States",2020-07-09 04:34:23,46.11182017,-99.44145858,3,0,0,3,"McIntosh, North Dakota, United States"
"07-08-2020","40091","McIntosh","Oklahoma","United States",2020-07-09 04:34:23,35.37235506,-95.66599306,71,1,0,70,"McIntosh, Oklahoma, United States"
"07-08-2020","42083","McKean","Pennsylvania","United States",2020-07-09 04:34:23,41.80938602,-78.56478358,20,1,0,19,"McKean, Pennsylvania, United States"
"07-08-2020","38053","McKenzie","North Dakota","United States",2020-07-09 04:34:23,47.7413337,-103.395905,29,0,0,29,"McKenzie, North Dakota, United States"
"07-08-2020","35031","McKinley","New Mexico","United States",2020-07-09 04:34:23,35.5800772,-108.262245,3548,184,0,3364,"McKinley, New Mexico, United States"
"07-08-2020","17113","McLean","Illinois","United States",2020-07-09 04:34:23,40.48996987,-88.84621113,292,14,0,278,"McLean, Illinois, United States"
"07-08-2020","21149","McLean","Kentucky","United States",2020-07-09 04:34:23,37.5301951,-87.26803443,27,1,0,26,"McLean, Kentucky, United States"
"07-08-2020","38055","McLean","North Dakota","United States",2020-07-09 04:34:23,47.60766714,-101.3182418,11,0,0,11,"McLean, North Dakota, United States"
"07-08-2020","48309","McLennan","Texas","United States",2020-07-09 04:34:23,31.55255453,-97.20217694,2044,13,0,2031,"McLennan, Texas, United States"
"07-08-2020","27085","McLeod","Minnesota","United States",2020-07-09 04:34:23,44.82367677,-94.27287017,94,0,0,94,"McLeod, Minnesota, United States"
"07-08-2020","47107","McMinn","Tennessee","United States",2020-07-09 04:34:23,35.42812616,-84.61520715,255,18,0,237,"McMinn, Tennessee, United States"
"07-08-2020","47109","McNairy","Tennessee","United States",2020-07-09 04:34:23,35.17468549,-88.5647812,84,1,0,83,"McNairy, Tennessee, United States"
"07-08-2020","20113","McPherson","Kansas","United States",2020-07-09 04:34:23,38.39184858,-97.64769869,81,0,0,81,"McPherson, Kansas, United States"
"07-08-2020","31117","McPherson","Nebraska","United States",2020-07-09 04:34:23,41.56797682,-101.0599362,0,0,0,0,"McPherson, Nebraska, United States"
"07-08-2020","46089","McPherson","South Dakota","United States",2020-07-09 04:34:23,45.76626028,-99.22118798,5,0,0,5,"McPherson, South Dakota, United States"
"07-08-2020","20119","Meade","Kansas","United States",2020-07-09 04:34:23,37.23859987,-100.364831,30,0,0,30,"Meade, Kansas, United States"
"07-08-2020","21163","Meade","Kentucky","United States",2020-07-09 04:34:23,37.96163597,-86.21028219,30,2,0,28,"Meade, Kentucky, United States"
"07-08-2020","46093","Meade","South Dakota","United States",2020-07-09 04:34:23,44.56676791,-102.7162741,53,1,0,52,"Meade, South Dakota, United States"
"07-08-2020","30059","Meagher","Montana","United States",2020-07-09 04:34:23,46.59907074,-110.8898557,4,0,0,4,"Meagher, Montana, United States"
"07-08-2020","37119","Mecklenburg","North Carolina","United States",2020-07-09 04:34:23,35.24469268,-80.8317671,13489,158,0,13331,"Mecklenburg, North Carolina, United States"
"07-08-2020","51117","Mecklenburg","Virginia","United States",2020-07-09 04:34:23,36.67882005,-78.36131056,250,29,0,221,"Mecklenburg, Virginia, United States"
"07-08-2020","26107","Mecosta","Michigan","United States",2020-07-09 04:34:23,43.64064262,-85.32463223,32,2,0,30,"Mecosta, Michigan, United States"
"07-08-2020","39103","Medina","Ohio","United States",2020-07-09 04:34:23,41.11770589,-81.8998621,543,31,0,512,"Medina, Ohio, United States"
"07-08-2020","48325","Medina","Texas","United States",2020-07-09 04:34:23,29.3557301,-99.11030298,335,3,0,332,"Medina, Texas, United States"
"07-08-2020","27093","Meeker","Minnesota","United States",2020-07-09 04:34:23,45.12328869,-94.52839455,61,1,0,60,"Meeker, Minnesota, United States"
"07-08-2020","39105","Meigs","Ohio","United States",2020-07-09 04:34:23,39.09224872,-82.0305041,12,0,0,12,"Meigs, Ohio, United States"
"07-08-2020","47121","Meigs","Tennessee","United States",2020-07-09 04:34:23,35.51558739,-84.81482914,34,0,0,34,"Meigs, Tennessee, United States"
"07-08-2020","46095","Mellette","South Dakota","United States",2020-07-09 04:34:23,43.58078848,-100.7563186,6,0,0,6,"Mellette, South Dakota, United States"
"07-08-2020","17129","Menard","Illinois","United States",2020-07-09 04:34:23,40.02742725,-89.80246001,26,0,0,26,"Menard, Illinois, United States"
"07-08-2020","48327","Menard","Texas","United States",2020-07-09 04:34:23,30.88990665,-99.8204794,12,0,0,12,"Menard, Texas, United States"
"07-08-2020","06045","Mendocino","California","United States",2020-07-09 04:34:23,39.4381191,-123.3911313,98,0,0,98,"Mendocino, California, United States"
"07-08-2020","21165","Menifee","Kentucky","United States",2020-07-09 04:34:23,37.94090733,-83.59985712,13,0,0,13,"Menifee, Kentucky, United States"
"07-08-2020","26109","Menominee","Michigan","United States",2020-07-09 04:34:23,45.58038692,-87.55370409,29,0,0,29,"Menominee, Michigan, United States"
"07-08-2020","55078","Menominee","Wisconsin","United States",2020-07-09 04:34:23,45.00422544,-88.70950714,9,0,0,9,"Menominee, Wisconsin, United States"
"07-08-2020","06047","Merced","California","United States",2020-07-09 04:34:23,37.18922369,-120.7209035,1623,11,0,1612,"Merced, California, United States"
"07-08-2020","17131","Mercer","Illinois","United States",2020-07-09 04:34:23,41.20596782,-90.74290052,25,0,0,25,"Mercer, Illinois, United States"
"07-08-2020","21167","Mercer","Kentucky","United States",2020-07-09 04:34:23,37.81474237,-84.87488475,26,0,0,26,"Mercer, Kentucky, United States"
"07-08-2020","29129","Mercer","Missouri","United States",2020-07-09 04:34:23,40.42212303,-93.5682959,6,0,0,6,"Mercer, Missouri, United States"
"07-08-2020","34021","Mercer","New Jersey","United States",2020-07-09 04:34:23,40.28047017,-74.70479631,7761,595,0,7166,"Mercer, New Jersey, United States"
"07-08-2020","38057","Mercer","North Dakota","United States",2020-07-09 04:34:23,47.31213126,-101.8318399,7,0,0,7,"Mercer, North Dakota, United States"
"07-08-2020","39107","Mercer","Ohio","United States",2020-07-09 04:34:23,40.54043046,-84.62912742,290,11,0,279,"Mercer, Ohio, United States"
"07-08-2020","42085","Mercer","Pennsylvania","United States",2020-07-09 04:34:23,41.30248872,-80.25816981,159,6,0,153,"Mercer, Pennsylvania, United States"
"07-08-2020","54055","Mercer","West Virginia","United States",2020-07-09 04:34:23,37.40481169,-81.11023142,59,0,0,59,"Mercer, West Virginia, United States"
"07-08-2020","13199","Meriwether","Georgia","United States",2020-07-09 04:34:23,33.04163534,-84.68859732,230,3,0,227,"Meriwether, Georgia, United States"
"07-08-2020","31121","Merrick","Nebraska","United States",2020-07-09 04:34:23,41.16624273,-98.0374887,39,0,0,39,"Merrick, Nebraska, United States"
"07-08-2020","33013","Merrimack","New Hampshire","United States",2020-07-09 04:34:23,43.29662971,-71.6811573,421,19,0,402,"Merrimack, New Hampshire, United States"
"07-08-2020","08077","Mesa","Colorado","United States",2020-07-09 04:34:23,39.01787888,-108.469799,125,0,0,125,"Mesa, Colorado, United States"
"07-08-2020","21169","Metcalfe","Kentucky","United States",2020-07-09 04:34:23,36.99459295,-85.63123699,14,2,0,12,"Metcalfe, Kentucky, United States"
"07-08-2020","18103","Miami","Indiana","United States",2020-07-09 04:34:23,40.76940965,-86.04525048,186,2,0,184,"Miami, Indiana, United States"
"07-08-2020","20121","Miami","Kansas","United States",2020-07-09 04:34:23,38.56383358,-94.83832189,48,0,0,48,"Miami, Kansas, United States"
"07-08-2020","39109","Miami","Ohio","United States",2020-07-09 04:34:23,40.0543329,-84.22871271,475,31,0,444,"Miami, Ohio, United States"
"07-08-2020","12086","Miami-Dade","Florida","United States",2020-07-09 04:34:23,25.6112362,-80.55170587,53974,1068,0,52906,"Miami-Dade, Florida, United States"
"07-08-2020",NA,"Michigan Department of Corrections (MDOC)","Michigan","United States",2020-07-09 04:34:23,NA,NA,4118,68,0,4050,"Michigan Department of Corrections (MDOC), Michigan, United States"
"07-08-2020","09007","Middlesex","Connecticut","United States",2020-07-09 04:34:23,41.45949668,-72.53714864,1331,187,0,1144,"Middlesex, Connecticut, United States"
"07-08-2020","25017","Middlesex","Massachusetts","United States",2020-07-09 04:34:23,42.48607732,-71.39049229,24300,1897,0,22403,"Middlesex, Massachusetts, United States"
"07-08-2020","34023","Middlesex","New Jersey","United States",2020-07-09 04:34:23,40.43629879,-74.41426991,17013,1348,0,15665,"Middlesex, New Jersey, United States"
"07-08-2020","51119","Middlesex","Virginia","United States",2020-07-09 04:34:23,37.63191998,-76.55064617,15,0,0,15,"Middlesex, Virginia, United States"
"07-08-2020","26111","Midland","Michigan","United States",2020-07-09 04:34:23,43.64330771,-84.38804374,173,9,0,164,"Midland, Michigan, United States"
"07-08-2020","48329","Midland","Texas","United States",2020-07-09 04:34:23,31.86904128,-102.0315682,976,19,0,957,"Midland, Texas, United States"
"07-08-2020","42087","Mifflin","Pennsylvania","United States",2020-07-09 04:34:23,40.61116939,-77.61070738,68,1,0,67,"Mifflin, Pennsylvania, United States"
"07-08-2020","48331","Milam","Texas","United States",2020-07-09 04:34:23,30.7858183,-96.97718698,120,1,0,119,"Milam, Texas, United States"
"07-08-2020","27095","Mille Lacs","Minnesota","United States",2020-07-09 04:34:23,45.93705297,-93.63236823,34,2,0,32,"Mille Lacs, Minnesota, United States"
"07-08-2020","05091","Miller","Arkansas","United States",2020-07-09 04:34:23,33.31403423,-93.89285258,233,2,0,231,"Miller, Arkansas, United States"
"07-08-2020","13201","Miller","Georgia","United States",2020-07-09 04:34:23,31.16568912,-84.73151117,53,0,0,53,"Miller, Georgia, United States"
"07-08-2020","29131","Miller","Missouri","United States",2020-07-09 04:34:23,38.21450288,-92.42610898,22,0,0,22,"Miller, Missouri, United States"
"07-08-2020","19129","Mills","Iowa","United States",2020-07-09 04:34:23,41.03299766,-95.61920963,43,0,0,43,"Mills, Iowa, United States"
"07-08-2020","48333","Mills","Texas","United States",2020-07-09 04:34:23,31.49557106,-98.59272068,3,0,0,3,"Mills, Texas, United States"
"07-08-2020","55079","Milwaukee","Wisconsin","United States",2020-07-09 04:34:23,43.00486062,-87.96733172,12728,397,0,12331,"Milwaukee, Wisconsin, United States"
"07-08-2020","46097","Miner","South Dakota","United States",2020-07-09 04:34:23,44.02197882,-97.60992207,10,0,0,10,"Miner, South Dakota, United States"
"07-08-2020","08079","Mineral","Colorado","United States",2020-07-09 04:34:23,37.66954283,-106.9281698,14,0,0,14,"Mineral, Colorado, United States"
"07-08-2020","32021","Mineral","Nevada","United States",2020-07-09 04:34:23,38.53841696,-118.4344506,5,0,0,5,"Mineral, Nevada, United States"
"07-08-2020","54057","Mineral","West Virginia","United States",2020-07-09 04:34:23,39.41561583,-78.94104895,61,3,0,58,"Mineral, West Virginia, United States"
"07-08-2020","54059","Mingo","West Virginia","United States",2020-07-09 04:34:23,37.73048351,-82.13338365,26,2,0,24,"Mingo, West Virginia, United States"
"07-08-2020","16067","Minidoka","Idaho","United States",2020-07-09 04:34:23,42.85518524,-113.6357257,238,0,0,238,"Minidoka, Idaho, United States"
"07-08-2020","46099","Minnehaha","South Dakota","United States",2020-07-09 04:34:23,43.67441641,-96.7910885,3706,59,0,3647,"Minnehaha, South Dakota, United States"
"07-08-2020","26113","Missaukee","Michigan","United States",2020-07-09 04:34:23,44.33772443,-85.09256478,34,1,0,33,"Missaukee, Michigan, United States"
"07-08-2020","05093","Mississippi","Arkansas","United States",2020-07-09 04:34:23,35.76271485,-90.0519437,265,3,0,262,"Mississippi, Arkansas, United States"
"07-08-2020","29133","Mississippi","Missouri","United States",2020-07-09 04:34:23,36.82516239,-89.29505753,95,0,0,95,"Mississippi, Missouri, United States"
"07-08-2020","30063","Missoula","Montana","United States",2020-07-09 04:34:23,47.03728583,-113.9213508,121,1,0,120,"Missoula, Montana, United States"
"07-08-2020","13205","Mitchell","Georgia","United States",2020-07-09 04:34:23,31.22483255,-84.19381821,475,39,0,436,"Mitchell, Georgia, United States"
"07-08-2020","19131","Mitchell","Iowa","United States",2020-07-09 04:34:23,43.35638371,-92.78887719,41,0,0,41,"Mitchell, Iowa, United States"
"07-08-2020","20123","Mitchell","Kansas","United States",2020-07-09 04:34:23,39.39331582,-98.20906732,5,0,0,5,"Mitchell, Kansas, United States"
