"Date_Published","FIPS","Admin2","Province_State","Country_Region","Last_Update","Latitude","Longitude","Confirmed","Deaths","Recovered","Active","Combined_Key"
"07-08-2020","32009","Esmeralda","Nevada","United States",2020-07-09 04:34:23,37.78436681,-117.6319999,0,0,0,0,"Esmeralda, Nevada, United States"
"07-08-2020","25009","Essex","Massachusetts","United States",2020-07-09 04:34:23,42.6687626,-70.94687179,16342,1131,0,15211,"Essex, Massachusetts, United States"
"07-08-2020","34013","Essex","New Jersey","United States",2020-07-09 04:34:23,40.78681335,-74.24657979,19028,2046,0,16982,"Essex, New Jersey, United States"
"07-08-2020","36031","Essex","New York","United States",2020-07-09 04:34:23,44.11630765,-73.77297842,49,0,0,49,"Essex, New York, United States"
"07-08-2020","50009","Essex","Vermont","United States",2020-07-09 04:34:23,44.72736416,-71.73579864,4,0,0,4,"Essex, Vermont, United States"
"07-08-2020","51057","Essex","Virginia","United States",2020-07-09 04:34:23,37.93357639,-76.94230311,59,0,0,59,"Essex, Virginia, United States"
"07-08-2020","21065","Estill","Kentucky","United States",2020-07-09 04:34:23,37.69241417,-83.95956369,5,0,0,5,"Estill, Kentucky, United States"
"07-08-2020","01055","Etowah","Alabama","United States",2020-07-09 04:34:23,34.04567266,-86.04051873,874,13,0,861,"Etowah, Alabama, United States"
"07-08-2020","32011","Eureka","Nevada","United States",2020-07-09 04:34:23,39.98100864,-116.2683204,1,0,0,1,"Eureka, Nevada, United States"
"07-08-2020","22039","Evangeline","Louisiana","United States",2020-07-09 04:34:23,30.72985248,-92.39915924,261,1,0,260,"Evangeline, Louisiana, United States"
"07-08-2020","13109","Evans","Georgia","United States",2020-07-09 04:34:23,32.15328841,-81.8870105,34,0,0,34,"Evans, Georgia, United States"
"07-08-2020","02090","Fairbanks North Star","Alaska","United States",2020-07-09 04:34:23,64.80726247,-146.5692662,177,2,0,175,"Fairbanks North Star, Alaska, United States"
"07-08-2020","51059","Fairfax","Virginia","United States",2020-07-09 04:34:23,38.83677558,-77.27565836,14253,495,0,13758,"Fairfax, Virginia, United States"
"07-08-2020","51600","Fairfax City","Virginia","United States",2020-07-09 04:34:23,38.85157547,-77.2977964,72,7,0,65,"Fairfax City, Virginia, United States"
"07-08-2020","09001","Fairfield","Connecticut","United States",2020-07-09 04:34:23,41.26809896,-73.3881171,16859,1378,0,15481,"Fairfield, Connecticut, United States"
"07-08-2020","39045","Fairfield","Ohio","United States",2020-07-09 04:34:23,39.75107189,-82.63088163,605,17,0,588,"Fairfield, Ohio, United States"
"07-08-2020","45039","Fairfield","South Carolina","United States",2020-07-09 04:34:23,34.39287073,-81.1195624,325,22,0,303,"Fairfield, South Carolina, United States"
"07-08-2020","46047","Fall River","South Dakota","United States",2020-07-09 04:34:23,43.23929297,-103.5275691,13,0,0,13,"Fall River, South Dakota, United States"
"07-08-2020","48145","Falls","Texas","United States",2020-07-09 04:34:23,31.25350609,-96.93630086,44,0,0,44,"Falls, Texas, United States"
"07-08-2020","51610","Falls Church","Virginia","United States",2020-07-09 04:34:23,38.88485255,-77.17560759,54,8,0,46,"Falls Church, Virginia, United States"
"07-08-2020","13111","Fannin","Georgia","United States",2020-07-09 04:34:23,34.86430205,-84.316964,112,1,0,111,"Fannin, Georgia, United States"
"07-08-2020","48147","Fannin","Texas","United States",2020-07-09 04:34:23,33.59564294,-96.10751083,122,8,0,114,"Fannin, Texas, United States"
"07-08-2020","27043","Faribault","Minnesota","United States",2020-07-09 04:34:23,43.67381499,-93.94787458,60,0,0,60,"Faribault, Minnesota, United States"
"07-08-2020","46049","Faulk","South Dakota","United States",2020-07-09 04:34:23,45.07082625,-99.14535601,23,1,0,22,"Faulk, South Dakota, United States"
"07-08-2020","05045","Faulkner","Arkansas","United States",2020-07-09 04:34:23,35.14719007,-92.33717519,648,3,0,645,"Faulkner, Arkansas, United States"
"07-08-2020","51061","Fauquier","Virginia","United States",2020-07-09 04:34:23,38.73564842,-77.80647472,455,8,0,447,"Fauquier, Virginia, United States"
"07-08-2020","01057","Fayette","Alabama","United States",2020-07-09 04:34:23,33.72076938,-87.73886638,89,1,0,88,"Fayette, Alabama, United States"
"07-08-2020","13113","Fayette","Georgia","United States",2020-07-09 04:34:23,33.41357794,-84.49089434,472,19,0,453,"Fayette, Georgia, United States"
"07-08-2020","17051","Fayette","Illinois","United States",2020-07-09 04:34:23,39.00072038,-89.02452658,24,3,0,21,"Fayette, Illinois, United States"
"07-08-2020","18041","Fayette","Indiana","United States",2020-07-09 04:34:23,39.63684962,-85.17797541,103,7,0,96,"Fayette, Indiana, United States"
"07-08-2020","19065","Fayette","Iowa","United States",2020-07-09 04:34:23,42.86271799,-91.8441231,52,0,0,52,"Fayette, Iowa, United States"
"07-08-2020","21067","Fayette","Kentucky","United States",2020-07-09 04:34:23,38.0368225,-84.45576892,1696,30,0,1666,"Fayette, Kentucky, United States"
"07-08-2020","39047","Fayette","Ohio","United States",2020-07-09 04:34:23,39.56021306,-83.4562016,48,0,0,48,"Fayette, Ohio, United States"
"07-08-2020","42051","Fayette","Pennsylvania","United States",2020-07-09 04:34:23,39.92041012,-79.64291195,160,4,0,156,"Fayette, Pennsylvania, United States"
"07-08-2020","47047","Fayette","Tennessee","United States",2020-07-09 04:34:23,35.19615831,-89.41399032,344,3,0,341,"Fayette, Tennessee, United States"
"07-08-2020","48149","Fayette","Texas","United States",2020-07-09 04:34:23,29.87788372,-96.92076062,134,3,0,131,"Fayette, Texas, United States"
"07-08-2020","54019","Fayette","West Virginia","United States",2020-07-09 04:34:23,38.02974928,-81.08286634,78,4,0,74,"Fayette, West Virginia, United States"
"07-08-2020",NA,"Federal Correctional Institution (FCI)","Michigan","United States",2020-07-09 04:34:23,NA,NA,186,5,0,181,"Federal Correctional Institution (FCI), Michigan, United States"
"07-08-2020","47049","Fentress","Tennessee","United States",2020-07-09 04:34:23,36.38128818,-84.92870012,25,0,0,25,"Fentress, Tennessee, United States"
"07-08-2020","30027","Fergus","Montana","United States",2020-07-09 04:34:23,47.26331584,-109.2245206,2,0,0,2,"Fergus, Montana, United States"
"07-08-2020","53019","Ferry","Washington","United States",2020-07-09 04:34:23,48.4711431,-118.5154041,2,0,0,2,"Ferry, Washington, United States"
"07-08-2020","27045","Fillmore","Minnesota","United States",2020-07-09 04:34:23,43.67394126,-92.08980382,30,0,0,30,"Fillmore, Minnesota, United States"
"07-08-2020","31059","Fillmore","Nebraska","United States",2020-07-09 04:34:23,40.52458567,-97.59646937,17,1,0,16,"Fillmore, Nebraska, United States"
"07-08-2020","20055","Finney","Kansas","United States",2020-07-09 04:34:23,38.04340344,-100.7381938,1586,10,0,1576,"Finney, Kansas, United States"
"07-08-2020","48151","Fisher","Texas","United States",2020-07-09 04:34:23,32.74281316,-100.4019302,11,1,0,10,"Fisher, Texas, United States"
"07-08-2020","12035","Flagler","Florida","United States",2020-07-09 04:34:23,29.45933576,-81.31508595,424,5,0,419,"Flagler, Florida, United States"
"07-08-2020","30029","Flathead","Montana","United States",2020-07-09 04:34:23,48.29575866,-114.0520569,64,2,0,62,"Flathead, Montana, United States"
"07-08-2020","21069","Fleming","Kentucky","United States",2020-07-09 04:34:23,38.36758311,-83.69657514,25,0,0,25,"Fleming, Kentucky, United States"
"07-08-2020","45041","Florence","South Carolina","United States",2020-07-09 04:34:23,34.02361754,-79.70189312,1458,56,0,1402,"Florence, South Carolina, United States"
"07-08-2020","55037","Florence","Wisconsin","United States",2020-07-09 04:34:23,45.84963535,-88.39804137,4,0,0,4,"Florence, Wisconsin, United States"
"07-08-2020","13115","Floyd","Georgia","United States",2020-07-09 04:34:23,34.26268279,-85.21577392,654,15,0,639,"Floyd, Georgia, United States"
"07-08-2020","18043","Floyd","Indiana","United States",2020-07-09 04:34:23,38.32117957,-85.90385377,384,44,0,340,"Floyd, Indiana, United States"
"07-08-2020","19067","Floyd","Iowa","United States",2020-07-09 04:34:23,43.0600053,-92.78940097,74,2,0,72,"Floyd, Iowa, United States"
"07-08-2020","21071","Floyd","Kentucky","United States",2020-07-09 04:34:23,37.56213922,-82.74750924,38,0,0,38,"Floyd, Kentucky, United States"
"07-08-2020","48153","Floyd","Texas","United States",2020-07-09 04:34:23,34.07227468,-101.3031546,49,1,0,48,"Floyd, Texas, United States"
"07-08-2020","51063","Floyd","Virginia","United States",2020-07-09 04:34:23,36.9302126,-80.36738849,20,1,0,19,"Floyd, Virginia, United States"
"07-08-2020","51065","Fluvanna","Virginia","United States",2020-07-09 04:34:23,37.84157909,-78.27715475,125,8,0,117,"Fluvanna, Virginia, United States"
"07-08-2020","55039","Fond du Lac","Wisconsin","United States",2020-07-09 04:34:23,43.75354908,-88.48885325,347,6,0,341,"Fond du Lac, Wisconsin, United States"
"07-08-2020","17053","Ford","Illinois","United States",2020-07-09 04:34:23,40.59706922,-88.22350769,41,1,0,40,"Ford, Illinois, United States"
"07-08-2020","20057","Ford","Kansas","United States",2020-07-09 04:34:23,37.69200114,-99.88825298,1960,8,0,1952,"Ford, Kansas, United States"
"07-08-2020","42053","Forest","Pennsylvania","United States",2020-07-09 04:34:23,41.51095103,-79.23229292,7,0,0,7,"Forest, Pennsylvania, United States"
"07-08-2020","55041","Forest","Wisconsin","United States",2020-07-09 04:34:23,45.66678019,-88.77084892,41,3,0,38,"Forest, Wisconsin, United States"
"07-08-2020","28035","Forrest","Mississippi","United States",2020-07-09 04:34:23,31.18961454,-89.25832496,927,43,0,884,"Forrest, Mississippi, United States"
"07-08-2020","13117","Forsyth","Georgia","United States",2020-07-09 04:34:23,34.22604035,-84.1231513,1042,15,0,1027,"Forsyth, Georgia, United States"
"07-08-2020","37067","Forsyth","North Carolina","United States",2020-07-09 04:34:23,36.12859861,-80.25459052,3450,37,0,3413,"Forsyth, North Carolina, United States"
"07-08-2020","48157","Fort Bend","Texas","United States",2020-07-09 04:34:23,29.52704478,-95.77219463,4346,59,0,4287,"Fort Bend, Texas, United States"
"07-08-2020","38031","Foster","North Dakota","United States",2020-07-09 04:34:23,47.4571084,-98.88279923,4,0,0,4,"Foster, North Dakota, United States"
"07-08-2020","18045","Fountain","Indiana","United States",2020-07-09 04:34:23,40.12361933,-87.24217689,32,2,0,30,"Fountain, Indiana, United States"
"07-08-2020","01059","Franklin","Alabama","United States",2020-07-09 04:34:23,34.44235334,-87.84289505,923,16,0,907,"Franklin, Alabama, United States"
"07-08-2020","05047","Franklin","Arkansas","United States",2020-07-09 04:34:23,35.51202821,-93.89299569,27,1,0,26,"Franklin, Arkansas, United States"
"07-08-2020","12037","Franklin","Florida","United States",2020-07-09 04:34:23,29.83791238,-84.82731662,19,0,0,19,"Franklin, Florida, United States"
"07-08-2020","13119","Franklin","Georgia","United States",2020-07-09 04:34:23,34.37525597,-83.23159927,234,1,0,233,"Franklin, Georgia, United States"
"07-08-2020","16041","Franklin","Idaho","United States",2020-07-09 04:34:23,42.18332217,-111.8149666,30,0,0,30,"Franklin, Idaho, United States"
"07-08-2020","17055","Franklin","Illinois","United States",2020-07-09 04:34:23,37.99189086,-88.92567818,36,0,0,36,"Franklin, Illinois, United States"
"07-08-2020","18047","Franklin","Indiana","United States",2020-07-09 04:34:23,39.4142482,-85.06062647,126,8,0,118,"Franklin, Indiana, United States"
"07-08-2020","19069","Franklin","Iowa","United States",2020-07-09 04:34:23,42.73270384,-93.26256925,98,0,0,98,"Franklin, Iowa, United States"
"07-08-2020","20059","Franklin","Kansas","United States",2020-07-09 04:34:23,38.56443815,-95.28644341,80,1,0,79,"Franklin, Kansas, United States"
"07-08-2020","21073","Franklin","Kentucky","United States",2020-07-09 04:34:23,38.2379395,-84.87962551,153,4,0,149,"Franklin, Kentucky, United States"
"07-08-2020","22041","Franklin","Louisiana","United States",2020-07-09 04:34:23,32.13675181,-91.67589857,508,14,0,494,"Franklin, Louisiana, United States"
"07-08-2020","23007","Franklin","Maine","United States",2020-07-09 04:34:23,44.97330019,-70.44381045,40,1,0,39,"Franklin, Maine, United States"
"07-08-2020","25011","Franklin","Massachusetts","United States",2020-07-09 04:34:23,42.58119713,-72.58602547,376,55,0,321,"Franklin, Massachusetts, United States"
"07-08-2020","28037","Franklin","Mississippi","United States",2020-07-09 04:34:23,31.47786634,-90.89672989,47,2,0,45,"Franklin, Mississippi, United States"
"07-08-2020","29071","Franklin","Missouri","United States",2020-07-09 04:34:23,38.41127108,-91.07522826,235,18,0,217,"Franklin, Missouri, United States"
"07-08-2020","31061","Franklin","Nebraska","United States",2020-07-09 04:34:23,40.17636348,-98.95299073,8,0,0,8,"Franklin, Nebraska, United States"
"07-08-2020","36033","Franklin","New York","United States",2020-07-09 04:34:23,44.59040891,-74.29926032,33,0,0,33,"Franklin, New York, United States"
"07-08-2020","37069","Franklin","North Carolina","United States",2020-07-09 04:34:23,36.081519,-78.28708884,413,21,0,392,"Franklin, North Carolina, United States"
"07-08-2020","39049","Franklin","Ohio","United States",2020-07-09 04:34:23,39.96995815,-83.01115755,10879,462,0,10417,"Franklin, Ohio, United States"
"07-08-2020","42055","Franklin","Pennsylvania","United States",2020-07-09 04:34:23,39.92956518,-77.72157791,984,44,0,940,"Franklin, Pennsylvania, United States"
"07-08-2020","47051","Franklin","Tennessee","United States",2020-07-09 04:34:23,35.15634626,-86.09201039,101,3,0,98,"Franklin, Tennessee, United States"
"07-08-2020","48159","Franklin","Texas","United States",2020-07-09 04:34:23,33.17653242,-95.21917243,53,0,0,53,"Franklin, Texas, United States"
"07-08-2020","50011","Franklin","Vermont","United States",2020-07-09 04:34:23,44.85627605,-72.91249563,110,6,0,104,"Franklin, Vermont, United States"
"07-08-2020","51067","Franklin","Virginia","United States",2020-07-09 04:34:23,36.99536167,-79.88023649,104,1,0,103,"Franklin, Virginia, United States"
"07-08-2020","53021","Franklin","Washington","United States",2020-07-09 04:34:23,46.53351425,-118.9018212,2269,33,0,2236,"Franklin, Washington, United States"
"07-08-2020","51620","Franklin City","Virginia","United States",2020-07-09 04:34:23,36.6831435,-76.93859681,61,2,0,59,"Franklin City, Virginia, United States"
"07-08-2020","24021","Frederick","Maryland","United States",2020-07-09 04:34:23,39.47296601,-77.39999394,2553,120,0,2433,"Frederick, Maryland, United States"
"07-08-2020","51069","Frederick","Virginia","United States",2020-07-09 04:34:23,39.20172582,-78.25974949,529,6,0,523,"Frederick, Virginia, United States"
"07-08-2020","51630","Fredericksburg","Virginia","United States",2020-07-09 04:34:23,38.2977863,-77.4922454,263,0,0,263,"Fredericksburg, Virginia, United States"
"07-08-2020","27047","Freeborn","Minnesota","United States",2020-07-09 04:34:23,43.67385583,-93.34884422,298,0,0,298,"Freeborn, Minnesota, United States"
"07-08-2020","48161","Freestone","Texas","United States",2020-07-09 04:34:23,31.70422788,-96.15072516,59,0,0,59,"Freestone, Texas, United States"
"07-08-2020","08043","Fremont","Colorado","United States",2020-07-09 04:34:23,38.47362326,-105.4399667,41,0,0,41,"Fremont, Colorado, United States"
"07-08-2020","16043","Fremont","Idaho","United States",2020-07-09 04:34:23,44.22800938,-111.4809943,8,0,0,8,"Fremont, Idaho, United States"
"07-08-2020","19071","Fremont","Iowa","United States",2020-07-09 04:34:23,40.7454272,-95.60129045,8,0,0,8,"Fremont, Iowa, United States"
"07-08-2020","56013","Fremont","Wyoming","United States",2020-07-09 04:34:23,43.04183996,-108.6296893,373,0,0,373,"Fremont, Wyoming, United States"
"07-08-2020","06019","Fresno","California","United States",2020-07-09 04:34:23,36.75733899,-119.6466953,7281,84,0,7197,"Fresno, California, United States"
"07-08-2020","48163","Frio","Texas","United States",2020-07-09 04:34:23,28.86751206,-99.10804207,239,0,0,239,"Frio, Texas, United States"
"07-08-2020","31063","Frontier","Nebraska","United States",2020-07-09 04:34:23,40.52993007,-100.3924658,1,0,0,1,"Frontier, Nebraska, United States"
"07-08-2020","05049","Fulton","Arkansas","United States",2020-07-09 04:34:23,36.38177105,-91.81729127,16,0,0,16,"Fulton, Arkansas, United States"
"07-08-2020","13121","Fulton","Georgia","United States",2020-07-09 04:34:23,33.79216944,-84.46319413,9358,319,0,9039,"Fulton, Georgia, United States"
"07-08-2020","17057","Fulton","Illinois","United States",2020-07-09 04:34:23,40.47289135,-90.20862357,16,0,0,16,"Fulton, Illinois, United States"
"07-08-2020","18049","Fulton","Indiana","United States",2020-07-09 04:34:23,41.0469907,-86.26252745,72,1,0,71,"Fulton, Indiana, United States"
"07-08-2020","21075","Fulton","Kentucky","United States",2020-07-09 04:34:23,36.55238827,-89.20140068,24,1,0,23,"Fulton, Kentucky, United States"
"07-08-2020","36035","Fulton","New York","United States",2020-07-09 04:34:23,43.11363907,-74.41798804,262,24,0,238,"Fulton, New York, United States"
"07-08-2020","39051","Fulton","Ohio","United States",2020-07-09 04:34:23,41.60213491,-84.12571393,63,0,0,63,"Fulton, Ohio, United States"
"07-08-2020","42057","Fulton","Pennsylvania","United States",2020-07-09 04:34:23,39.92913544,-78.11163677,18,1,0,17,"Fulton, Pennsylvania, United States"
"07-08-2020","31065","Furnas","Nebraska","United States",2020-07-09 04:34:23,40.17642064,-99.91247454,10,1,0,9,"Furnas, Nebraska, United States"
"07-08-2020","12039","Gadsden","Florida","United States",2020-07-09 04:34:23,30.57796289,-84.61915825,481,7,0,474,"Gadsden, Florida, United States"
"07-08-2020","31067","Gage","Nebraska","United States",2020-07-09 04:34:23,40.26186809,-96.68946704,59,3,0,56,"Gage, Nebraska, United States"
"07-08-2020","48165","Gaines","Texas","United States",2020-07-09 04:34:23,32.74055318,-102.6353295,36,0,0,36,"Gaines, Texas, United States"
"07-08-2020","51640","Galax","Virginia","United States",2020-07-09 04:34:23,36.66601852,-80.91703124,282,16,0,266,"Galax, Virginia, United States"
"07-08-2020","17059","Gallatin","Illinois","United States",2020-07-09 04:34:23,37.76430935,-88.22953869,4,0,0,4,"Gallatin, Illinois, United States"
"07-08-2020","21077","Gallatin","Kentucky","United States",2020-07-09 04:34:23,38.75398691,-84.8558382,66,8,0,58,"Gallatin, Kentucky, United States"
"07-08-2020","30031","Gallatin","Montana","United States",2020-07-09 04:34:23,45.54486106,-111.1692571,327,1,0,326,"Gallatin, Montana, United States"
"07-08-2020","39053","Gallia","Ohio","United States",2020-07-09 04:34:23,38.82708533,-82.31647569,20,1,0,19,"Gallia, Ohio, United States"
"07-08-2020","48167","Galveston","Texas","United States",2020-07-09 04:34:23,29.40167322,-94.90469073,4809,50,0,4759,"Galveston, Texas, United States"
"07-08-2020","31069","Garden","Nebraska","United States",2020-07-09 04:34:23,41.61703149,-102.3313973,4,0,0,4,"Garden, Nebraska, United States"
"07-08-2020","08045","Garfield","Colorado","United States",2020-07-09 04:34:23,39.59921777,-107.902708,339,3,0,336,"Garfield, Colorado, United States"
"07-08-2020","31071","Garfield","Nebraska","United States",2020-07-09 04:34:23,41.91428955,-98.99111827,1,0,0,1,"Garfield, Nebraska, United States"
"07-08-2020","40047","Garfield","Oklahoma","United States",2020-07-09 04:34:23,36.3791334,-97.78265517,86,2,0,84,"Garfield, Oklahoma, United States"
"07-08-2020","53023","Garfield","Washington","United States",2020-07-09 04:34:23,46.43197502,-117.5454032,0,0,0,0,"Garfield, Washington, United States"
"07-08-2020","05051","Garland","Arkansas","United States",2020-07-09 04:34:23,34.57692074,-93.14921604,300,2,0,298,"Garland, Arkansas, United States"
"07-08-2020","21079","Garrard","Kentucky","United States",2020-07-09 04:34:23,37.6388668,-84.53289319,32,0,0,32,"Garrard, Kentucky, United States"
"07-08-2020","24023","Garrett","Maryland","United States",2020-07-09 04:34:23,39.52786077,-79.27355126,16,0,0,16,"Garrett, Maryland, United States"
"07-08-2020","40049","Garvin","Oklahoma","United States",2020-07-09 04:34:23,34.70418038,-97.30811132,98,2,0,96,"Garvin, Oklahoma, United States"
"07-08-2020","48169","Garza","Texas","United States",2020-07-09 04:34:23,33.17969345,-101.2984114,18,0,0,18,"Garza, Texas, United States"
"07-08-2020","29073","Gasconade","Missouri","United States",2020-07-09 04:34:23,38.43947277,-91.50847147,13,0,0,13,"Gasconade, Missouri, United States"
"07-08-2020","37071","Gaston","North Carolina","United States",2020-07-09 04:34:23,35.29373559,-81.17477045,1479,15,0,1464,"Gaston, North Carolina, United States"
"07-08-2020","37073","Gates","North Carolina","United States",2020-07-09 04:34:23,36.44667547,-76.69749701,28,2,0,26,"Gates, North Carolina, United States"
"07-08-2020","20061","Geary","Kansas","United States",2020-07-09 04:34:23,38.99871131,-96.7577178,73,1,0,72,"Geary, Kansas, United States"
"07-08-2020","39055","Geauga","Ohio","United States",2020-07-09 04:34:23,41.49952319,-81.17935342,414,43,0,371,"Geauga, Ohio, United States"
"07-08-2020","16045","Gem","Idaho","United States",2020-07-09 04:34:23,44.06482372,-116.398376,42,0,0,42,"Gem, Idaho, United States"
"07-08-2020","26049","Genesee","Michigan","United States",2020-07-09 04:34:23,43.02244215,-83.70589709,2860,290,0,2570,"Genesee, Michigan, United States"
"07-08-2020","36037","Genesee","New York","United States",2020-07-09 04:34:23,43.0022601,-78.19135193,244,5,0,239,"Genesee, New York, United States"
"07-08-2020","01061","Geneva","Alabama","United States",2020-07-09 04:34:23,31.09389027,-85.83572839,95,0,0,95,"Geneva, Alabama, United States"
"07-08-2020","29075","Gentry","Missouri","United States",2020-07-09 04:34:23,40.21097916,-94.40944419,63,9,0,54,"Gentry, Missouri, United States"
"07-08-2020","28039","George","Mississippi","United States",2020-07-09 04:34:23,30.86259065,-88.64436789,94,3,0,91,"George, Mississippi, United States"
"07-08-2020","45043","Georgetown","South Carolina","United States",2020-07-09 04:34:23,33.43443342,-79.33202141,691,8,0,683,"Georgetown, South Carolina, United States"
"07-08-2020","18051","Gibson","Indiana","United States",2020-07-09 04:34:23,38.30393723,-87.58054938,98,2,0,96,"Gibson, Indiana, United States"
"07-08-2020","47053","Gibson","Tennessee","United States",2020-07-09 04:34:23,35.99438059,-88.93358327,147,1,0,146,"Gibson, Tennessee, United States"
"07-08-2020","04007","Gila","Arizona","United States",2020-07-09 04:34:23,33.80190085,-110.8132779,373,9,0,364,"Gila, Arizona, United States"
"07-08-2020","12041","Gilchrist","Florida","United States",2020-07-09 04:34:23,29.72856978,-82.79880657,124,0,0,124,"Gilchrist, Florida, United States"
"07-08-2020","47055","Giles","Tennessee","United States",2020-07-09 04:34:23,35.20222469,-87.03992678,77,1,0,76,"Giles, Tennessee, United States"
"07-08-2020","51071","Giles","Virginia","United States",2020-07-09 04:34:23,37.31234791,-80.70636931,18,0,0,18,"Giles, Virginia, United States"
"07-08-2020","48171","Gillespie","Texas","United States",2020-07-09 04:34:23,30.31824095,-98.94676915,53,0,0,53,"Gillespie, Texas, United States"
"07-08-2020","41021","Gilliam","Oregon","United States",2020-07-09 04:34:23,45.37160076,-120.2048869,1,0,0,1,"Gilliam, Oregon, United States"
"07-08-2020","13123","Gilmer","Georgia","United States",2020-07-09 04:34:23,34.69316688,-84.45802506,202,2,0,200,"Gilmer, Georgia, United States"
"07-08-2020","54021","Gilmer","West Virginia","United States",2020-07-09 04:34:23,38.9251277,-80.85952723,13,0,0,13,"Gilmer, West Virginia, United States"
"07-08-2020","08047","Gilpin","Colorado","United States",2020-07-09 04:34:23,39.85646523,-105.5252597,8,0,0,8,"Gilpin, Colorado, United States"
"07-08-2020","30035","Glacier","Montana","United States",2020-07-09 04:34:23,48.70513576,-112.9934235,25,0,0,25,"Glacier, Montana, United States"
"07-08-2020","12043","Glades","Florida","United States",2020-07-09 04:34:23,26.95635849,-81.18996211,189,1,0,188,"Glades, Florida, United States"
"07-08-2020","26051","Gladwin","Michigan","United States",2020-07-09 04:34:23,43.98901072,-84.38774817,28,1,0,27,"Gladwin, Michigan, United States"
"07-08-2020","13125","Glascock","Georgia","United States",2020-07-09 04:34:23,33.22879932,-82.61297636,13,0,0,13,"Glascock, Georgia, United States"
"07-08-2020","48173","Glasscock","Texas","United States",2020-07-09 04:34:23,31.86942909,-101.5207776,6,0,0,6,"Glasscock, Texas, United States"
"07-08-2020","06021","Glenn","California","United States",2020-07-09 04:34:23,39.59875897,-122.3938452,153,0,0,153,"Glenn, California, United States"
"07-08-2020","34015","Gloucester","New Jersey","United States",2020-07-09 04:34:23,39.71581067,-75.13995546,2714,192,0,2522,"Gloucester, New Jersey, United States"
"07-08-2020","51073","Gloucester","Virginia","United States",2020-07-09 04:34:23,37.40809042,-76.53524337,52,1,0,51,"Gloucester, Virginia, United States"
"07-08-2020","13127","Glynn","Georgia","United States",2020-07-09 04:34:23,31.23279254,-81.53811412,1322,8,0,1314,"Glynn, Georgia, United States"
"07-08-2020","26053","Gogebic","Michigan","United States",2020-07-09 04:34:23,46.40862701,-89.69377193,11,1,0,10,"Gogebic, Michigan, United States"
"07-08-2020","30037","Golden Valley","Montana","United States",2020-07-09 04:34:23,46.3816474,-109.1768522,3,0,0,3,"Golden Valley, Montana, United States"
"07-08-2020","48175","Goliad","Texas","United States",2020-07-09 04:34:23,28.65696592,-97.42760647,15,0,0,15,"Goliad, Texas, United States"
"07-08-2020","48177","Gonzales","Texas","United States",2020-07-09 04:34:23,29.45634206,-97.49424032,314,4,0,310,"Gonzales, Texas, United States"
"07-08-2020","51075","Goochland","Virginia","United States",2020-07-09 04:34:23,37.71714806,-77.90381514,128,6,0,122,"Goochland, Virginia, United States"
"07-08-2020","27049","Goodhue","Minnesota","United States",2020-07-09 04:34:23,44.40849741,-92.7234195,132,8,0,124,"Goodhue, Minnesota, United States"
