"Date_Published","FIPS","Admin2","Province_State","Country_Region","Last_Update","Latitude","Longitude","Confirmed","Deaths","Recovered","Active","Combined_Key"
"07-31-2020","13101","Echols","Georgia","United States",2020-08-01 04:36:27,30.71101099,-82.89687287,220,1,0,219,"Echols, Georgia, United States"
"07-31-2020","48135","Ector","Texas","United States",2020-08-01 04:36:27,31.86898877,-102.5429428,3287,49,0,3238,"Ector, Texas, United States"
"07-31-2020","35015","Eddy","New Mexico","United States",2020-08-01 04:36:27,32.47167456,-104.3053527,242,3,0,239,"Eddy, New Mexico, United States"
"07-31-2020","38027","Eddy","North Dakota","United States",2020-08-01 04:36:27,47.71701474,-98.90432337,13,0,0,13,"Eddy, North Dakota, United States"
"07-31-2020","17045","Edgar","Illinois","United States",2020-08-01 04:36:27,39.6809186,-87.74759563,25,0,0,25,"Edgar, Illinois, United States"
"07-31-2020","37065","Edgecombe","North Carolina","United States",2020-08-01 04:36:27,35.91230639,-77.59436892,564,11,0,553,"Edgecombe, North Carolina, United States"
"07-31-2020","45037","Edgefield","South Carolina","United States",2020-08-01 04:36:27,33.77221995,-81.96231108,273,6,0,267,"Edgefield, South Carolina, United States"
"07-31-2020","21061","Edmonson","Kentucky","United States",2020-08-01 04:36:27,37.21218923,-86.23955613,89,12,0,77,"Edmonson, Kentucky, United States"
"07-31-2020","46045","Edmunds","South Dakota","United States",2020-08-01 04:36:27,45.41846445,-99.21545423,13,0,0,13,"Edmunds, South Dakota, United States"
"07-31-2020","17047","Edwards","Illinois","United States",2020-08-01 04:36:27,38.41353228,-88.05720863,12,0,0,12,"Edwards, Illinois, United States"
"07-31-2020","20047","Edwards","Kansas","United States",2020-08-01 04:36:27,37.88735543,-99.31263309,10,0,0,10,"Edwards, Kansas, United States"
"07-31-2020","48137","Edwards","Texas","United States",2020-08-01 04:36:27,29.98202582,-100.304252,24,0,0,24,"Edwards, Texas, United States"
"07-31-2020","13103","Effingham","Georgia","United States",2020-08-01 04:36:27,32.36616021,-81.34280942,614,1,0,613,"Effingham, Georgia, United States"
"07-31-2020","17049","Effingham","Illinois","United States",2020-08-01 04:36:27,39.05935711,-88.58969584,83,1,0,82,"Effingham, Illinois, United States"
"07-31-2020","06017","El Dorado","California","United States",2020-08-01 04:36:27,38.77965956,-120.5233166,637,1,0,636,"El Dorado, California, United States"
"07-31-2020","08041","El Paso","Colorado","United States",2020-08-01 04:36:27,38.83240149,-104.5251411,4473,135,0,4338,"El Paso, Colorado, United States"
"07-31-2020","48141","El Paso","Texas","United States",2020-08-01 04:36:27,31.76980765,-106.2363275,14276,237,0,14039,"El Paso, Texas, United States"
"07-31-2020","08039","Elbert","Colorado","United States",2020-08-01 04:36:27,39.28656773,-104.1358721,85,2,0,83,"Elbert, Colorado, United States"
"07-31-2020","13105","Elbert","Georgia","United States",2020-08-01 04:36:27,34.11302332,-82.83936148,318,1,0,317,"Elbert, Georgia, United States"
"07-31-2020","20049","Elk","Kansas","United States",2020-08-01 04:36:27,37.45338105,-96.24369667,1,0,0,1,"Elk, Kansas, United States"
"07-31-2020","42047","Elk","Pennsylvania","United States",2020-08-01 04:36:27,41.42822061,-78.64524744,43,2,0,41,"Elk, Pennsylvania, United States"
"07-31-2020","18039","Elkhart","Indiana","United States",2020-08-01 04:36:27,41.59761169,-85.85875695,4521,76,0,4445,"Elkhart, Indiana, United States"
"07-31-2020","32007","Elko","Nevada","United States",2020-08-01 04:36:27,41.14531606,-115.3577619,461,2,0,459,"Elko, Nevada, United States"
"07-31-2020","21063","Elliott","Kentucky","United States",2020-08-01 04:36:27,38.11624059,-83.09771563,7,0,0,7,"Elliott, Kentucky, United States"
"07-31-2020","20051","Ellis","Kansas","United States",2020-08-01 04:36:27,38.91458712,-99.31751551,128,1,0,127,"Ellis, Kansas, United States"
"07-31-2020","40045","Ellis","Oklahoma","United States",2020-08-01 04:36:27,36.2180194,-99.75324573,3,0,0,3,"Ellis, Oklahoma, United States"
"07-31-2020","48139","Ellis","Texas","United States",2020-08-01 04:36:27,32.34894117,-96.79371841,2452,33,0,2419,"Ellis, Texas, United States"
"07-31-2020","20053","Ellsworth","Kansas","United States",2020-08-01 04:36:27,38.69677695,-98.20462799,18,0,0,18,"Ellsworth, Kansas, United States"
"07-31-2020","01051","Elmore","Alabama","United States",2020-08-01 04:36:27,32.59785413,-86.14415284,1586,35,0,1551,"Elmore, Alabama, United States"
"07-31-2020","16039","Elmore","Idaho","United States",2020-08-01 04:36:27,43.3507101,-115.4701578,197,3,0,194,"Elmore, Idaho, United States"
"07-31-2020","13107","Emanuel","Georgia","United States",2020-08-01 04:36:27,32.59221302,-82.30239915,391,7,0,384,"Emanuel, Georgia, United States"
"07-31-2020","19063","Emmet","Iowa","United States",2020-08-01 04:36:27,43.37782951,-94.67858943,178,1,0,177,"Emmet, Iowa, United States"
"07-31-2020","26047","Emmet","Michigan","United States",2020-08-01 04:36:27,45.52625509,-84.89083249,58,2,0,56,"Emmet, Michigan, United States"
"07-31-2020","38029","Emmons","North Dakota","United States",2020-08-01 04:36:27,46.28398398,-100.2389766,15,1,0,14,"Emmons, North Dakota, United States"
"07-31-2020","51595","Emporia","Virginia","United States",2020-08-01 04:36:27,36.69455571,-77.53406129,163,15,0,148,"Emporia, Virginia, United States"
"07-31-2020","48143","Erath","Texas","United States",2020-08-01 04:36:27,32.23602653,-98.21773417,457,5,0,452,"Erath, Texas, United States"
"07-31-2020","36029","Erie","New York","United States",2020-08-01 04:36:27,42.76249024,-78.73063652,8492,669,0,7823,"Erie, New York, United States"
"07-31-2020","39043","Erie","Ohio","United States",2020-08-01 04:36:27,41.36796058,-82.62904521,499,26,0,473,"Erie, Ohio, United States"
"07-31-2020","42049","Erie","Pennsylvania","United States",2020-08-01 04:36:27,41.99253829,-80.03301954,923,16,0,907,"Erie, Pennsylvania, United States"
"07-31-2020","01053","Escambia","Alabama","United States",2020-08-01 04:36:27,31.1256789,-87.15918694,1006,15,0,991,"Escambia, Alabama, United States"
"07-31-2020","12033","Escambia","Florida","United States",2020-08-01 04:36:27,30.67652764,-87.37284571,7738,95,0,7643,"Escambia, Florida, United States"
"07-31-2020","32009","Esmeralda","Nevada","United States",2020-08-01 04:36:27,37.78436681,-117.6319999,0,0,0,0,"Esmeralda, Nevada, United States"
"07-31-2020","25009","Essex","Massachusetts","United States",2020-08-01 04:36:27,42.6687626,-70.94687179,17232,1177,0,16055,"Essex, Massachusetts, United States"
"07-31-2020","34013","Essex","New Jersey","United States",2020-08-01 04:36:27,40.78681335,-74.24657979,19652,2102,0,17550,"Essex, New Jersey, United States"
"07-31-2020","36031","Essex","New York","United States",2020-08-01 04:36:27,44.11630765,-73.77297842,55,0,0,55,"Essex, New York, United States"
"07-31-2020","50009","Essex","Vermont","United States",2020-08-01 04:36:27,44.72736416,-71.73579864,4,0,0,4,"Essex, Vermont, United States"
"07-31-2020","51057","Essex","Virginia","United States",2020-08-01 04:36:27,37.93357639,-76.94230311,75,1,0,74,"Essex, Virginia, United States"
"07-31-2020","21065","Estill","Kentucky","United States",2020-08-01 04:36:27,37.69241417,-83.95956369,12,0,0,12,"Estill, Kentucky, United States"
"07-31-2020","01055","Etowah","Alabama","United States",2020-08-01 04:36:27,34.04567266,-86.04051873,1917,19,0,1898,"Etowah, Alabama, United States"
"07-31-2020","32011","Eureka","Nevada","United States",2020-08-01 04:36:27,39.98100864,-116.2683204,2,0,0,2,"Eureka, Nevada, United States"
"07-31-2020","22039","Evangeline","Louisiana","United States",2020-08-01 04:36:27,30.72985248,-92.39915924,699,2,0,697,"Evangeline, Louisiana, United States"
"07-31-2020","13109","Evans","Georgia","United States",2020-08-01 04:36:27,32.15328841,-81.8870105,202,1,0,201,"Evans, Georgia, United States"
"07-31-2020","02090","Fairbanks North Star","Alaska","United States",2020-08-01 04:36:27,64.80726247,-146.5692662,398,5,0,393,"Fairbanks North Star, Alaska, United States"
"07-31-2020","51059","Fairfax","Virginia","United States",2020-08-01 04:36:27,38.83677558,-77.27565836,15616,520,0,15096,"Fairfax, Virginia, United States"
"07-31-2020","51600","Fairfax City","Virginia","United States",2020-08-01 04:36:27,38.85157547,-77.2977964,79,7,0,72,"Fairfax City, Virginia, United States"
"07-31-2020","09001","Fairfield","Connecticut","United States",2020-08-01 04:36:27,41.26809896,-73.3881171,17793,1406,0,16387,"Fairfield, Connecticut, United States"
"07-31-2020","39045","Fairfield","Ohio","United States",2020-08-01 04:36:27,39.75107189,-82.63088163,1216,22,0,1194,"Fairfield, Ohio, United States"
"07-31-2020","45039","Fairfield","South Carolina","United States",2020-08-01 04:36:27,34.39287073,-81.1195624,525,23,0,502,"Fairfield, South Carolina, United States"
"07-31-2020","72053","Fajardo","Puerto Rico","United States",2020-08-01 04:36:27,18.318373,-65.666866,180,0,0,180,"Fajardo, Puerto Rico, United States"
"07-31-2020","46047","Fall River","South Dakota","United States",2020-08-01 04:36:27,43.23929297,-103.5275691,14,0,0,14,"Fall River, South Dakota, United States"
"07-31-2020","30025","Fallon","Montana","United States",2020-08-01 04:36:27,46.33478338,-104.4183565,2,0,0,2,"Fallon, Montana, United States"
"07-31-2020","48145","Falls","Texas","United States",2020-08-01 04:36:27,31.25350609,-96.93630086,109,2,0,107,"Falls, Texas, United States"
"07-31-2020","51610","Falls Church","Virginia","United States",2020-08-01 04:36:27,38.88485255,-77.17560759,60,6,0,54,"Falls Church, Virginia, United States"
"07-31-2020","13111","Fannin","Georgia","United States",2020-08-01 04:36:27,34.86430205,-84.316964,266,2,0,264,"Fannin, Georgia, United States"
"07-31-2020","48147","Fannin","Texas","United States",2020-08-01 04:36:27,33.59564294,-96.10751083,214,8,0,206,"Fannin, Texas, United States"
"07-31-2020","27043","Faribault","Minnesota","United States",2020-08-01 04:36:27,43.67381499,-93.94787458,80,0,0,80,"Faribault, Minnesota, United States"
"07-31-2020","46049","Faulk","South Dakota","United States",2020-08-01 04:36:27,45.07082625,-99.14535601,26,1,0,25,"Faulk, South Dakota, United States"
"07-31-2020","05045","Faulkner","Arkansas","United States",2020-08-01 04:36:27,35.14719007,-92.33717519,1175,5,0,1170,"Faulkner, Arkansas, United States"
"07-31-2020","51061","Fauquier","Virginia","United States",2020-08-01 04:36:27,38.73564842,-77.80647472,571,8,0,563,"Fauquier, Virginia, United States"
"07-31-2020","01057","Fayette","Alabama","United States",2020-08-01 04:36:27,33.72076938,-87.73886638,188,5,0,183,"Fayette, Alabama, United States"
"07-31-2020","13113","Fayette","Georgia","United States",2020-08-01 04:36:27,33.41357794,-84.49089434,918,24,0,894,"Fayette, Georgia, United States"
"07-31-2020","17051","Fayette","Illinois","United States",2020-08-01 04:36:27,39.00072038,-89.02452658,53,3,0,50,"Fayette, Illinois, United States"
"07-31-2020","18041","Fayette","Indiana","United States",2020-08-01 04:36:27,39.63684962,-85.17797541,149,7,0,142,"Fayette, Indiana, United States"
"07-31-2020","19065","Fayette","Iowa","United States",2020-08-01 04:36:27,42.86271799,-91.8441231,77,0,0,77,"Fayette, Iowa, United States"
"07-31-2020","21067","Fayette","Kentucky","United States",2020-08-01 04:36:27,38.0368225,-84.45576892,2654,46,0,2608,"Fayette, Kentucky, United States"
"07-31-2020","39047","Fayette","Ohio","United States",2020-08-01 04:36:27,39.56021306,-83.4562016,88,0,0,88,"Fayette, Ohio, United States"
"07-31-2020","42051","Fayette","Pennsylvania","United States",2020-08-01 04:36:27,39.92041012,-79.64291195,387,4,0,383,"Fayette, Pennsylvania, United States"
"07-31-2020","47047","Fayette","Tennessee","United States",2020-08-01 04:36:27,35.19615831,-89.41399032,596,8,0,588,"Fayette, Tennessee, United States"
"07-31-2020","48149","Fayette","Texas","United States",2020-08-01 04:36:27,29.87788372,-96.92076062,367,13,0,354,"Fayette, Texas, United States"
"07-31-2020","54019","Fayette","West Virginia","United States",2020-08-01 04:36:27,38.02974928,-81.08286634,125,5,0,120,"Fayette, West Virginia, United States"
"07-31-2020",NA,"Federal Correctional Institution (FCI)","Michigan","United States",2020-08-01 04:36:27,NA,NA,193,5,0,188,"Federal Correctional Institution (FCI), Michigan, United States"
"07-31-2020","47049","Fentress","Tennessee","United States",2020-08-01 04:36:27,36.38128818,-84.92870012,71,0,0,71,"Fentress, Tennessee, United States"
"07-31-2020","30027","Fergus","Montana","United States",2020-08-01 04:36:27,47.26331584,-109.2245206,6,0,0,6,"Fergus, Montana, United States"
"07-31-2020","53019","Ferry","Washington","United States",2020-08-01 04:36:27,48.4711431,-118.5154041,14,0,0,14,"Ferry, Washington, United States"
"07-31-2020","27045","Fillmore","Minnesota","United States",2020-08-01 04:36:27,43.67394126,-92.08980382,59,0,0,59,"Fillmore, Minnesota, United States"
"07-31-2020","31059","Fillmore","Nebraska","United States",2020-08-01 04:36:27,40.52458567,-97.59646937,22,1,0,21,"Fillmore, Nebraska, United States"
"07-31-2020","20055","Finney","Kansas","United States",2020-08-01 04:36:27,38.04340344,-100.7381938,1737,10,0,1727,"Finney, Kansas, United States"
"07-31-2020","48151","Fisher","Texas","United States",2020-08-01 04:36:27,32.74281316,-100.4019302,24,1,0,23,"Fisher, Texas, United States"
"07-31-2020","12035","Flagler","Florida","United States",2020-08-01 04:36:27,29.45933576,-81.31508595,901,10,0,891,"Flagler, Florida, United States"
"07-31-2020","30029","Flathead","Montana","United States",2020-08-01 04:36:27,48.29575866,-114.0520569,237,2,0,235,"Flathead, Montana, United States"
"07-31-2020","21069","Fleming","Kentucky","United States",2020-08-01 04:36:27,38.36758311,-83.69657514,53,0,0,53,"Fleming, Kentucky, United States"
"07-31-2020","45041","Florence","South Carolina","United States",2020-08-01 04:36:27,34.02361754,-79.70189312,2853,93,0,2760,"Florence, South Carolina, United States"
"07-31-2020","55037","Florence","Wisconsin","United States",2020-08-01 04:36:27,45.84963535,-88.39804137,7,0,0,7,"Florence, Wisconsin, United States"
"07-31-2020","72054","Florida","Puerto Rico","United States",2020-08-01 04:36:27,18.373715,-66.560488,136,0,0,136,"Florida, Puerto Rico, United States"
"07-31-2020","13115","Floyd","Georgia","United States",2020-08-01 04:36:27,34.26268279,-85.21577392,1206,15,0,1191,"Floyd, Georgia, United States"
"07-31-2020","18043","Floyd","Indiana","United States",2020-08-01 04:36:27,38.32117957,-85.90385377,658,44,0,614,"Floyd, Indiana, United States"
"07-31-2020","19067","Floyd","Iowa","United States",2020-08-01 04:36:27,43.0600053,-92.78940097,109,2,0,107,"Floyd, Iowa, United States"
"07-31-2020","21071","Floyd","Kentucky","United States",2020-08-01 04:36:27,37.56213922,-82.74750924,80,1,0,79,"Floyd, Kentucky, United States"
"07-31-2020","48153","Floyd","Texas","United States",2020-08-01 04:36:27,34.07227468,-101.3031546,83,5,0,78,"Floyd, Texas, United States"
"07-31-2020","51063","Floyd","Virginia","United States",2020-08-01 04:36:27,36.9302126,-80.36738849,32,1,0,31,"Floyd, Virginia, United States"
"07-31-2020","51065","Fluvanna","Virginia","United States",2020-08-01 04:36:27,37.84157909,-78.27715475,173,8,0,165,"Fluvanna, Virginia, United States"
"07-31-2020","48155","Foard","Texas","United States",2020-08-01 04:36:27,33.97308618,-99.7767797,2,0,0,2,"Foard, Texas, United States"
"07-31-2020","55039","Fond du Lac","Wisconsin","United States",2020-08-01 04:36:27,43.75354908,-88.48885325,529,6,0,523,"Fond du Lac, Wisconsin, United States"
"07-31-2020","17053","Ford","Illinois","United States",2020-08-01 04:36:27,40.59706922,-88.22350769,38,1,0,37,"Ford, Illinois, United States"
"07-31-2020","20057","Ford","Kansas","United States",2020-08-01 04:36:27,37.69200114,-99.88825298,2026,8,0,2018,"Ford, Kansas, United States"
"07-31-2020","42053","Forest","Pennsylvania","United States",2020-08-01 04:36:27,41.51095103,-79.23229292,9,0,0,9,"Forest, Pennsylvania, United States"
"07-31-2020","55041","Forest","Wisconsin","United States",2020-08-01 04:36:27,45.66678019,-88.77084892,58,4,0,54,"Forest, Wisconsin, United States"
"07-31-2020","28035","Forrest","Mississippi","United States",2020-08-01 04:36:27,31.18961454,-89.25832496,1564,50,0,1514,"Forrest, Mississippi, United States"
"07-31-2020","13117","Forsyth","Georgia","United States",2020-08-01 04:36:27,34.22604035,-84.1231513,1858,19,0,1839,"Forsyth, Georgia, United States"
"07-31-2020","37067","Forsyth","North Carolina","United States",2020-08-01 04:36:27,36.12859861,-80.25459052,4833,49,0,4784,"Forsyth, North Carolina, United States"
"07-31-2020","48157","Fort Bend","Texas","United States",2020-08-01 04:36:27,29.52704478,-95.77219463,7082,140,0,6942,"Fort Bend, Texas, United States"
"07-31-2020","38031","Foster","North Dakota","United States",2020-08-01 04:36:27,47.4571084,-98.88279923,12,0,0,12,"Foster, North Dakota, United States"
"07-31-2020","18045","Fountain","Indiana","United States",2020-08-01 04:36:27,40.12361933,-87.24217689,61,2,0,59,"Fountain, Indiana, United States"
"07-31-2020","01059","Franklin","Alabama","United States",2020-08-01 04:36:27,34.44235334,-87.84289505,1177,20,0,1157,"Franklin, Alabama, United States"
"07-31-2020","05047","Franklin","Arkansas","United States",2020-08-01 04:36:27,35.51202821,-93.89299569,104,2,0,102,"Franklin, Arkansas, United States"
"07-31-2020","12037","Franklin","Florida","United States",2020-08-01 04:36:27,29.83791238,-84.82731662,108,1,0,107,"Franklin, Florida, United States"
"07-31-2020","13119","Franklin","Georgia","United States",2020-08-01 04:36:27,34.37525597,-83.23159927,350,4,0,346,"Franklin, Georgia, United States"
"07-31-2020","16041","Franklin","Idaho","United States",2020-08-01 04:36:27,42.18332217,-111.8149666,47,0,0,47,"Franklin, Idaho, United States"
"07-31-2020","17055","Franklin","Illinois","United States",2020-08-01 04:36:27,37.99189086,-88.92567818,116,0,0,116,"Franklin, Illinois, United States"
"07-31-2020","18047","Franklin","Indiana","United States",2020-08-01 04:36:27,39.4142482,-85.06062647,191,9,0,182,"Franklin, Indiana, United States"
"07-31-2020","19069","Franklin","Iowa","United States",2020-08-01 04:36:27,42.73270384,-93.26256925,209,4,0,205,"Franklin, Iowa, United States"
"07-31-2020","20059","Franklin","Kansas","United States",2020-08-01 04:36:27,38.56443815,-95.28644341,149,1,0,148,"Franklin, Kansas, United States"
"07-31-2020","21073","Franklin","Kentucky","United States",2020-08-01 04:36:27,38.2379395,-84.87962551,245,5,0,240,"Franklin, Kentucky, United States"
"07-31-2020","22041","Franklin","Louisiana","United States",2020-08-01 04:36:27,32.13675181,-91.67589857,785,16,0,769,"Franklin, Louisiana, United States"
"07-31-2020","23007","Franklin","Maine","United States",2020-08-01 04:36:27,44.97330019,-70.44381045,45,1,0,44,"Franklin, Maine, United States"
"07-31-2020","25011","Franklin","Massachusetts","United States",2020-08-01 04:36:27,42.58119713,-72.58602547,402,60,0,342,"Franklin, Massachusetts, United States"
"07-31-2020","28037","Franklin","Mississippi","United States",2020-08-01 04:36:27,31.47786634,-90.89672989,111,3,0,108,"Franklin, Mississippi, United States"
"07-31-2020","29071","Franklin","Missouri","United States",2020-08-01 04:36:27,38.41127108,-91.07522826,509,18,0,491,"Franklin, Missouri, United States"
"07-31-2020","31061","Franklin","Nebraska","United States",2020-08-01 04:36:27,40.17636348,-98.95299073,9,0,0,9,"Franklin, Nebraska, United States"
"07-31-2020","36033","Franklin","New York","United States",2020-08-01 04:36:27,44.59040891,-74.29926032,50,0,0,50,"Franklin, New York, United States"
"07-31-2020","37069","Franklin","North Carolina","United States",2020-08-01 04:36:27,36.081519,-78.28708884,762,25,0,737,"Franklin, North Carolina, United States"
"07-31-2020","39049","Franklin","Ohio","United States",2020-08-01 04:36:27,39.96995815,-83.01115755,16842,511,0,16331,"Franklin, Ohio, United States"
"07-31-2020","42055","Franklin","Pennsylvania","United States",2020-08-01 04:36:27,39.92956518,-77.72157791,1268,46,0,1222,"Franklin, Pennsylvania, United States"
"07-31-2020","47051","Franklin","Tennessee","United States",2020-08-01 04:36:27,35.15634626,-86.09201039,258,4,0,254,"Franklin, Tennessee, United States"
"07-31-2020","48159","Franklin","Texas","United States",2020-08-01 04:36:27,33.17653242,-95.21917243,83,1,0,82,"Franklin, Texas, United States"
"07-31-2020","50011","Franklin","Vermont","United States",2020-08-01 04:36:27,44.85627605,-72.91249563,117,6,0,111,"Franklin, Vermont, United States"
"07-31-2020","51067","Franklin","Virginia","United States",2020-08-01 04:36:27,36.99536167,-79.88023649,151,1,0,150,"Franklin, Virginia, United States"
"07-31-2020","53021","Franklin","Washington","United States",2020-08-01 04:36:27,46.53351425,-118.9018212,3317,45,0,3272,"Franklin, Washington, United States"
"07-31-2020","51620","Franklin City","Virginia","United States",2020-08-01 04:36:27,36.6831435,-76.93859681,119,6,0,113,"Franklin City, Virginia, United States"
"07-31-2020","24021","Frederick","Maryland","United States",2020-08-01 04:36:27,39.47296601,-77.39999394,2986,121,0,2865,"Frederick, Maryland, United States"
"07-31-2020","51069","Frederick","Virginia","United States",2020-08-01 04:36:27,39.20172582,-78.25974949,651,7,0,644,"Frederick, Virginia, United States"
"07-31-2020","51630","Fredericksburg","Virginia","United States",2020-08-01 04:36:27,38.2977863,-77.4922454,348,2,0,346,"Fredericksburg, Virginia, United States"
"07-31-2020","27047","Freeborn","Minnesota","United States",2020-08-01 04:36:27,43.67385583,-93.34884422,353,1,0,352,"Freeborn, Minnesota, United States"
"07-31-2020","48161","Freestone","Texas","United States",2020-08-01 04:36:27,31.70422788,-96.15072516,138,0,0,138,"Freestone, Texas, United States"
"07-31-2020","08043","Fremont","Colorado","United States",2020-08-01 04:36:27,38.47362326,-105.4399667,102,0,0,102,"Fremont, Colorado, United States"
"07-31-2020","16043","Fremont","Idaho","United States",2020-08-01 04:36:27,44.22800938,-111.4809943,45,0,0,45,"Fremont, Idaho, United States"
"07-31-2020","19071","Fremont","Iowa","United States",2020-08-01 04:36:27,40.7454272,-95.60129045,32,0,0,32,"Fremont, Iowa, United States"
"07-31-2020","56013","Fremont","Wyoming","United States",2020-08-01 04:36:27,43.04183996,-108.6296893,468,0,0,468,"Fremont, Wyoming, United States"
"07-31-2020","06019","Fresno","California","United States",2020-08-01 04:36:27,36.75733899,-119.6466953,14439,138,0,14301,"Fresno, California, United States"
"07-31-2020","48163","Frio","Texas","United States",2020-08-01 04:36:27,28.86751206,-99.10804207,458,5,0,453,"Frio, Texas, United States"
"07-31-2020","31063","Frontier","Nebraska","United States",2020-08-01 04:36:27,40.52993007,-100.3924658,3,0,0,3,"Frontier, Nebraska, United States"
"07-31-2020","05049","Fulton","Arkansas","United States",2020-08-01 04:36:27,36.38177105,-91.81729127,27,0,0,27,"Fulton, Arkansas, United States"
"07-31-2020","13121","Fulton","Georgia","United States",2020-08-01 04:36:27,33.79216944,-84.46319413,17646,389,0,17257,"Fulton, Georgia, United States"
"07-31-2020","17057","Fulton","Illinois","United States",2020-08-01 04:36:27,40.47289135,-90.20862357,24,0,0,24,"Fulton, Illinois, United States"
"07-31-2020","18049","Fulton","Indiana","United States",2020-08-01 04:36:27,41.0469907,-86.26252745,134,1,0,133,"Fulton, Indiana, United States"
"07-31-2020","21075","Fulton","Kentucky","United States",2020-08-01 04:36:27,36.55238827,-89.20140068,49,1,0,48,"Fulton, Kentucky, United States"
"07-31-2020","36035","Fulton","New York","United States",2020-08-01 04:36:27,43.11363907,-74.41798804,275,24,0,251,"Fulton, New York, United States"
"07-31-2020","39051","Fulton","Ohio","United States",2020-08-01 04:36:27,41.60213491,-84.12571393,137,1,0,136,"Fulton, Ohio, United States"
"07-31-2020","42057","Fulton","Pennsylvania","United States",2020-08-01 04:36:27,39.92913544,-78.11163677,22,2,0,20,"Fulton, Pennsylvania, United States"
"07-31-2020","31065","Furnas","Nebraska","United States",2020-08-01 04:36:27,40.17642064,-99.91247454,15,1,0,14,"Furnas, Nebraska, United States"
"07-31-2020","12039","Gadsden","Florida","United States",2020-08-01 04:36:27,30.57796289,-84.61915825,1347,18,0,1329,"Gadsden, Florida, United States"
"07-31-2020","31067","Gage","Nebraska","United States",2020-08-01 04:36:27,40.26186809,-96.68946704,81,4,0,77,"Gage, Nebraska, United States"
"07-31-2020","48165","Gaines","Texas","United States",2020-08-01 04:36:27,32.74055318,-102.6353295,119,0,0,119,"Gaines, Texas, United States"
"07-31-2020","51640","Galax","Virginia","United States",2020-08-01 04:36:27,36.66601852,-80.91703124,331,19,0,312,"Galax, Virginia, United States"
"07-31-2020","17059","Gallatin","Illinois","United States",2020-08-01 04:36:27,37.76430935,-88.22953869,42,0,0,42,"Gallatin, Illinois, United States"
"07-31-2020","21077","Gallatin","Kentucky","United States",2020-08-01 04:36:27,38.75398691,-84.8558382,77,8,0,69,"Gallatin, Kentucky, United States"
"07-31-2020","30031","Gallatin","Montana","United States",2020-08-01 04:36:27,45.54486106,-111.1692571,849,2,0,847,"Gallatin, Montana, United States"
"07-31-2020","39053","Gallia","Ohio","United States",2020-08-01 04:36:27,38.82708533,-82.31647569,49,1,0,48,"Gallia, Ohio, United States"
"07-31-2020","48167","Galveston","Texas","United States",2020-08-01 04:36:27,29.40167322,-94.90469073,8721,95,0,8626,"Galveston, Texas, United States"
"07-31-2020","31069","Garden","Nebraska","United States",2020-08-01 04:36:27,41.61703149,-102.3313973,4,0,0,4,"Garden, Nebraska, United States"
"07-31-2020","08045","Garfield","Colorado","United States",2020-08-01 04:36:27,39.59921777,-107.902708,691,4,0,687,"Garfield, Colorado, United States"
"07-31-2020","30033","Garfield","Montana","United States",2020-08-01 04:36:27,47.27545948,-107.0002351,12,0,0,12,"Garfield, Montana, United States"
