"Date_Published","FIPS","Admin2","Province_State","Country_Region","Last_Update","Latitude","Longitude","Confirmed","Deaths","Recovered","Active","Combined_Key"
"07-31-2020","37169","Stokes","North Carolina","United States",2020-08-01 04:36:27,36.4017975,-80.23893369,248,3,0,245,"Stokes, North Carolina, United States"
"07-31-2020","05137","Stone","Arkansas","United States",2020-08-01 04:36:27,35.86251946,-92.15684085,52,1,0,51,"Stone, Arkansas, United States"
"07-31-2020","28131","Stone","Mississippi","United States",2020-08-01 04:36:27,30.79187949,-89.11547539,144,3,0,141,"Stone, Mississippi, United States"
"07-31-2020","29209","Stone","Missouri","United States",2020-08-01 04:36:27,36.75000327,-93.45256475,80,1,0,79,"Stone, Missouri, United States"
"07-31-2020","48433","Stonewall","Texas","United States",2020-08-01 04:36:27,33.17906744,-100.2538401,4,0,0,4,"Stonewall, Texas, United States"
"07-31-2020","32029","Storey","Nevada","United States",2020-08-01 04:36:27,39.44875482,-119.5250207,4,0,0,4,"Storey, Nevada, United States"
"07-31-2020","19169","Story","Iowa","United States",2020-08-01 04:36:27,42.03621213,-93.46499005,1088,13,0,1075,"Story, Iowa, United States"
"07-31-2020","33017","Strafford","New Hampshire","United States",2020-08-01 04:36:27,43.291833,-71.02336013,325,13,0,312,"Strafford, New Hampshire, United States"
"07-31-2020","38093","Stutsman","North Dakota","United States",2020-08-01 04:36:27,46.97962541,-98.95637318,105,2,0,103,"Stutsman, North Dakota, United States"
"07-31-2020","56035","Sublette","Wyoming","United States",2020-08-01 04:36:27,42.76558279,-109.9130922,34,0,0,34,"Sublette, Wyoming, United States"
"07-31-2020","25025","Suffolk","Massachusetts","United States",2020-08-01 04:36:27,42.3279514,-71.07850442,21222,1055,0,20167,"Suffolk, Massachusetts, United States"
"07-31-2020","36103","Suffolk","New York","United States",2020-08-01 04:36:27,40.88320119,-72.8012172,43224,1996,0,41228,"Suffolk, New York, United States"
"07-31-2020","51800","Suffolk","Virginia","United States",2020-08-01 04:36:27,36.70155394,-76.63603554,1034,49,0,985,"Suffolk, Virginia, United States"
"07-31-2020","18153","Sullivan","Indiana","United States",2020-08-01 04:36:27,39.08952258,-87.41414469,69,1,0,68,"Sullivan, Indiana, United States"
"07-31-2020","29211","Sullivan","Missouri","United States",2020-08-01 04:36:27,40.2099105,-93.11150106,134,0,0,134,"Sullivan, Missouri, United States"
"07-31-2020","33019","Sullivan","New Hampshire","United States",2020-08-01 04:36:27,43.36094111,-72.22203125,39,1,0,38,"Sullivan, New Hampshire, United States"
"07-31-2020","36105","Sullivan","New York","United States",2020-08-01 04:36:27,41.71579493,-74.76394559,1480,48,0,1432,"Sullivan, New York, United States"
"07-31-2020","42113","Sullivan","Pennsylvania","United States",2020-08-01 04:36:27,41.44634738,-76.51246591,10,0,0,10,"Sullivan, Pennsylvania, United States"
"07-31-2020","47163","Sullivan","Tennessee","United States",2020-08-01 04:36:27,36.51240691,-82.30412917,729,8,0,721,"Sullivan, Tennessee, United States"
"07-31-2020","46119","Sully","South Dakota","United States",2020-08-01 04:36:27,44.71571812,-100.1278092,1,0,0,1,"Sully, South Dakota, United States"
"07-31-2020","54089","Summers","West Virginia","United States",2020-08-01 04:36:27,37.65390597,-80.86009693,7,0,0,7,"Summers, West Virginia, United States"
"07-31-2020","08117","Summit","Colorado","United States",2020-08-01 04:36:27,39.63803232,-106.1150762,322,4,0,318,"Summit, Colorado, United States"
"07-31-2020","39153","Summit","Ohio","United States",2020-08-01 04:36:27,41.12464734,-81.53123079,3188,216,0,2972,"Summit, Ohio, United States"
"07-31-2020","49043","Summit","Utah","United States",2020-08-01 04:36:27,40.86688146,-110.9535882,687,1,0,686,"Summit, Utah, United States"
"07-31-2020","20191","Sumner","Kansas","United States",2020-08-01 04:36:27,37.23682549,-97.47721621,97,3,0,94,"Sumner, Kansas, United States"
"07-31-2020","47165","Sumner","Tennessee","United States",2020-08-01 04:36:27,36.46824103,-86.45917204,3106,69,0,3037,"Sumner, Tennessee, United States"
"07-31-2020","01119","Sumter","Alabama","United States",2020-08-01 04:36:27,32.59117397,-88.19916205,369,17,0,352,"Sumter, Alabama, United States"
"07-31-2020","12119","Sumter","Florida","United States",2020-08-01 04:36:27,28.70181754,-82.0794267,1077,30,0,1047,"Sumter, Florida, United States"
"07-31-2020","13261","Sumter","Georgia","United States",2020-08-01 04:36:27,32.03650571,-84.19821492,717,56,0,661,"Sumter, Georgia, United States"
"07-31-2020","45085","Sumter","South Carolina","United States",2020-08-01 04:36:27,33.91826534,-80.37942316,2227,43,0,2184,"Sumter, South Carolina, United States"
"07-31-2020","28133","Sunflower","Mississippi","United States",2020-08-01 04:36:27,33.60192578,-90.58882684,893,21,0,872,"Sunflower, Mississippi, United States"
"07-31-2020","37171","Surry","North Carolina","United States",2020-08-01 04:36:27,36.41689489,-80.69102283,845,7,0,838,"Surry, North Carolina, United States"
"07-31-2020","51181","Surry","Virginia","United States",2020-08-01 04:36:27,37.11781893,-76.88450012,35,2,0,33,"Surry, Virginia, United States"
"07-31-2020","42115","Susquehanna","Pennsylvania","United States",2020-08-01 04:36:27,41.82147784,-75.80071959,209,26,0,183,"Susquehanna, Pennsylvania, United States"
"07-31-2020","10005","Sussex","Delaware","United States",2020-08-01 04:36:27,38.66143781,-75.39031349,5608,194,0,5414,"Sussex, Delaware, United States"
"07-31-2020","34037","Sussex","New Jersey","United States",2020-08-01 04:36:27,41.13891592,-74.69118243,1306,195,0,1111,"Sussex, New Jersey, United States"
"07-31-2020","51183","Sussex","Virginia","United States",2020-08-01 04:36:27,36.92432914,-77.25791182,276,9,0,267,"Sussex, Virginia, United States"
"07-31-2020","06101","Sutter","California","United States",2020-08-01 04:36:27,39.03417539,-121.6945899,755,6,0,749,"Sutter, California, United States"
"07-31-2020","48435","Sutton","Texas","United States",2020-08-01 04:36:27,30.49856623,-100.5382014,58,1,0,57,"Sutton, Texas, United States"
"07-31-2020","12121","Suwannee","Florida","United States",2020-08-01 04:36:27,30.19746066,-82.9909967,1131,32,0,1099,"Suwannee, Florida, United States"
"07-31-2020","37173","Swain","North Carolina","United States",2020-08-01 04:36:27,35.48665845,-83.48748932,103,2,0,101,"Swain, North Carolina, United States"
"07-31-2020","30097","Sweet Grass","Montana","United States",2020-08-01 04:36:27,45.81367654,-109.9425686,4,1,0,3,"Sweet Grass, Montana, United States"
"07-31-2020","56037","Sweetwater","Wyoming","United States",2020-08-01 04:36:27,41.65943896,-108.8827882,240,0,0,240,"Sweetwater, Wyoming, United States"
"07-31-2020","27151","Swift","Minnesota","United States",2020-08-01 04:36:27,45.2829032,-95.68264092,51,1,0,50,"Swift, Minnesota, United States"
"07-31-2020","48437","Swisher","Texas","United States",2020-08-01 04:36:27,34.53028891,-101.7349174,75,2,0,73,"Swisher, Texas, United States"
"07-31-2020","18155","Switzerland","Indiana","United States",2020-08-01 04:36:27,38.82767338,-85.03022429,40,0,0,40,"Switzerland, Indiana, United States"
"07-31-2020","13263","Talbot","Georgia","United States",2020-08-01 04:36:27,32.69642758,-84.53351366,122,3,0,119,"Talbot, Georgia, United States"
"07-31-2020","24041","Talbot","Maryland","United States",2020-08-01 04:36:27,38.76618159,-76.10882561,340,4,0,336,"Talbot, Maryland, United States"
"07-31-2020","13265","Taliaferro","Georgia","United States",2020-08-01 04:36:27,33.56543317,-82.88136816,12,0,0,12,"Taliaferro, Georgia, United States"
"07-31-2020","01121","Talladega","Alabama","United States",2020-08-01 04:36:27,33.37823223,-86.16886178,999,12,0,987,"Talladega, Alabama, United States"
"07-31-2020","28135","Tallahatchie","Mississippi","United States",2020-08-01 04:36:27,33.95339918,-90.1729398,399,10,0,389,"Tallahatchie, Mississippi, United States"
"07-31-2020","01123","Tallapoosa","Alabama","United States",2020-08-01 04:36:27,32.86698258,-85.79833053,835,78,0,757,"Tallapoosa, Alabama, United States"
"07-31-2020","19171","Tama","Iowa","United States",2020-08-01 04:36:27,42.07991767,-92.53266945,534,29,0,505,"Tama, Iowa, United States"
"07-31-2020","29213","Taney","Missouri","United States",2020-08-01 04:36:27,36.65465345,-93.04075153,391,3,0,388,"Taney, Missouri, United States"
"07-31-2020","22105","Tangipahoa","Louisiana","United States",2020-08-01 04:36:27,30.62888673,-90.40664996,3037,62,0,2975,"Tangipahoa, Louisiana, United States"
"07-31-2020","35055","Taos","New Mexico","United States",2020-08-01 04:36:27,36.58006022,-105.6310198,94,1,0,93,"Taos, New Mexico, United States"
"07-31-2020","48439","Tarrant","Texas","United States",2020-08-01 04:36:27,32.77143818,-97.29101614,28871,566,0,28305,"Tarrant, Texas, United States"
"07-31-2020","28137","Tate","Mississippi","United States",2020-08-01 04:36:27,34.65133709,-89.94485778,621,21,0,600,"Tate, Mississippi, United States"
"07-31-2020","13267","Tattnall","Georgia","United States",2020-08-01 04:36:27,32.04785085,-82.05539188,394,1,0,393,"Tattnall, Georgia, United States"
"07-31-2020","12123","Taylor","Florida","United States",2020-08-01 04:36:27,30.04848048,-83.60445406,330,3,0,327,"Taylor, Florida, United States"
"07-31-2020","13269","Taylor","Georgia","United States",2020-08-01 04:36:27,32.55792548,-84.25077141,69,2,0,67,"Taylor, Georgia, United States"
"07-31-2020","19173","Taylor","Iowa","United States",2020-08-01 04:36:27,40.73710579,-94.69778563,93,0,0,93,"Taylor, Iowa, United States"
"07-31-2020","21217","Taylor","Kentucky","United States",2020-08-01 04:36:27,37.3677562,-85.3329931,100,2,0,98,"Taylor, Kentucky, United States"
"07-31-2020","48441","Taylor","Texas","United States",2020-08-01 04:36:27,32.30163422,-99.89007449,1077,19,0,1058,"Taylor, Texas, United States"
"07-31-2020","54091","Taylor","West Virginia","United States",2020-08-01 04:36:27,39.33602617,-80.0421439,52,0,0,52,"Taylor, West Virginia, United States"
"07-31-2020","55119","Taylor","Wisconsin","United States",2020-08-01 04:36:27,45.21179252,-90.5004405,47,0,0,47,"Taylor, Wisconsin, United States"
"07-31-2020","17179","Tazewell","Illinois","United States",2020-08-01 04:36:27,40.50716185,-89.51404662,335,8,0,327,"Tazewell, Illinois, United States"
"07-31-2020","51185","Tazewell","Virginia","United States",2020-08-01 04:36:27,37.12191123,-81.56685568,87,0,0,87,"Tazewell, Virginia, United States"
"07-31-2020","06103","Tehama","California","United States",2020-08-01 04:36:27,40.12570935,-122.2370171,227,1,0,226,"Tehama, California, United States"
"07-31-2020","13271","Telfair","Georgia","United States",2020-08-01 04:36:27,31.92829517,-82.93491155,251,6,0,245,"Telfair, Georgia, United States"
"07-31-2020","08119","Teller","Colorado","United States",2020-08-01 04:36:27,38.88133511,-105.1614893,110,3,0,107,"Teller, Colorado, United States"
"07-31-2020","22107","Tensas","Louisiana","United States",2020-08-01 04:36:27,32.00760749,-91.32915234,56,0,0,56,"Tensas, Louisiana, United States"
"07-31-2020","22109","Terrebonne","Louisiana","United States",2020-08-01 04:36:27,29.37343766,-90.82626855,2693,74,0,2619,"Terrebonne, Louisiana, United States"
"07-31-2020","13273","Terrell","Georgia","United States",2020-08-01 04:36:27,31.77527543,-84.44069698,289,30,0,259,"Terrell, Georgia, United States"
"07-31-2020","48443","Terrell","Texas","United States",2020-08-01 04:36:27,30.22429013,-102.0766732,2,0,0,2,"Terrell, Texas, United States"
"07-31-2020","48445","Terry","Texas","United States",2020-08-01 04:36:27,33.17402785,-102.3354521,110,1,0,109,"Terry, Texas, United States"
"07-31-2020","16081","Teton","Idaho","United States",2020-08-01 04:36:27,43.75303583,-111.2056773,57,0,0,57,"Teton, Idaho, United States"
"07-31-2020","30099","Teton","Montana","United States",2020-08-01 04:36:27,47.83741052,-112.2410688,15,0,0,15,"Teton, Montana, United States"
"07-31-2020","56039","Teton","Wyoming","United States",2020-08-01 04:36:27,43.93522482,-110.5890801,335,0,0,335,"Teton, Wyoming, United States"
"07-31-2020","29215","Texas","Missouri","United States",2020-08-01 04:36:27,37.31728859,-91.96564727,32,0,0,32,"Texas, Missouri, United States"
"07-31-2020","40139","Texas","Oklahoma","United States",2020-08-01 04:36:27,36.74777635,-101.4889765,1031,7,0,1024,"Texas, Oklahoma, United States"
"07-31-2020","31169","Thayer","Nebraska","United States",2020-08-01 04:36:27,40.17626377,-97.59504381,25,0,0,25,"Thayer, Nebraska, United States"
"07-31-2020","13275","Thomas","Georgia","United States",2020-08-01 04:36:27,30.86392347,-83.91847289,943,39,0,904,"Thomas, Georgia, United States"
"07-31-2020","20193","Thomas","Kansas","United States",2020-08-01 04:36:27,39.35107575,-101.0553705,32,0,0,32,"Thomas, Kansas, United States"
"07-31-2020","31171","Thomas","Nebraska","United States",2020-08-01 04:36:27,41.91358968,-100.5556632,1,0,0,1,"Thomas, Nebraska, United States"
"07-31-2020","48447","Throckmorton","Texas","United States",2020-08-01 04:36:27,33.17751417,-99.21226795,3,0,0,3,"Throckmorton, Texas, United States"
"07-31-2020","31173","Thurston","Nebraska","United States",2020-08-01 04:36:27,42.15725356,-96.54157099,200,4,0,196,"Thurston, Nebraska, United States"
"07-31-2020","53067","Thurston","Washington","United States",2020-08-01 04:36:27,46.9291895,-122.8290656,635,9,0,626,"Thurston, Washington, United States"
"07-31-2020","13277","Tift","Georgia","United States",2020-08-01 04:36:27,31.45743864,-83.5236119,1220,34,0,1186,"Tift, Georgia, United States"
"07-31-2020","41057","Tillamook","Oregon","United States",2020-08-01 04:36:27,45.46248721,-123.712066,24,0,0,24,"Tillamook, Oregon, United States"
"07-31-2020","40141","Tillman","Oklahoma","United States",2020-08-01 04:36:27,34.37288446,-98.92426619,53,1,0,52,"Tillman, Oklahoma, United States"
"07-31-2020","36107","Tioga","New York","United States",2020-08-01 04:36:27,42.16852837,-76.30835812,187,24,0,163,"Tioga, New York, United States"
"07-31-2020","42117","Tioga","Pennsylvania","United States",2020-08-01 04:36:27,41.77255149,-77.25433032,35,2,0,33,"Tioga, Pennsylvania, United States"
"07-31-2020","28139","Tippah","Mississippi","United States",2020-08-01 04:36:27,34.76872156,-88.90988194,285,12,0,273,"Tippah, Mississippi, United States"
"07-31-2020","18157","Tippecanoe","Indiana","United States",2020-08-01 04:36:27,40.38872739,-86.89413959,1053,11,0,1042,"Tippecanoe, Indiana, United States"
"07-31-2020","18159","Tipton","Indiana","United States",2020-08-01 04:36:27,40.31123252,-86.05234925,96,5,0,91,"Tipton, Indiana, United States"
"07-31-2020","47167","Tipton","Tennessee","United States",2020-08-01 04:36:27,35.501942,-89.73694895,1065,9,0,1056,"Tipton, Tennessee, United States"
"07-31-2020","28141","Tishomingo","Mississippi","United States",2020-08-01 04:36:27,34.74023475,-88.23917219,299,3,0,296,"Tishomingo, Mississippi, United States"
"07-31-2020","48449","Titus","Texas","United States",2020-08-01 04:36:27,33.21339719,-94.96797273,1156,14,0,1142,"Titus, Texas, United States"
"07-31-2020","72135","Toa Alta","Puerto Rico","United States",2020-08-01 04:36:27,18.362406,-66.246616,410,0,0,410,"Toa Alta, Puerto Rico, United States"
"07-31-2020","72137","Toa Baja","Puerto Rico","United States",2020-08-01 04:36:27,18.431446,-66.213553,395,0,0,395,"Toa Baja, Puerto Rico, United States"
"07-31-2020","21219","Todd","Kentucky","United States",2020-08-01 04:36:27,36.8381152,-87.17878374,31,0,0,31,"Todd, Kentucky, United States"
"07-31-2020","27153","Todd","Minnesota","United States",2020-08-01 04:36:27,46.06996226,-94.89785296,413,2,0,411,"Todd, Minnesota, United States"
"07-31-2020","46121","Todd","South Dakota","United States",2020-08-01 04:36:27,43.19338568,-100.7195503,66,4,0,62,"Todd, South Dakota, United States"
"07-31-2020","09013","Tolland","Connecticut","United States",2020-08-01 04:36:27,41.85853803,-72.3308481,1019,66,0,953,"Tolland, Connecticut, United States"
"07-31-2020","48451","Tom Green","Texas","United States",2020-08-01 04:36:27,31.40464436,-100.462443,2310,24,0,2286,"Tom Green, Texas, United States"
"07-31-2020","36109","Tompkins","New York","United States",2020-08-01 04:36:27,42.44945765,-76.47229843,228,0,0,228,"Tompkins, New York, United States"
"07-31-2020","49045","Tooele","Utah","United States",2020-08-01 04:36:27,40.44862644,-113.1295715,527,0,0,527,"Tooele, Utah, United States"
"07-31-2020","30101","Toole","Montana","United States",2020-08-01 04:36:27,48.65577551,-111.6942414,31,6,0,25,"Toole, Montana, United States"
"07-31-2020","13279","Toombs","Georgia","United States",2020-08-01 04:36:27,32.12059861,-82.32957247,592,6,0,586,"Toombs, Georgia, United States"
"07-31-2020","35057","Torrance","New Mexico","United States",2020-08-01 04:36:27,34.64048375,-105.8508949,59,1,0,58,"Torrance, New Mexico, United States"
"07-31-2020","38095","Towner","North Dakota","United States",2020-08-01 04:36:27,48.68565745,-99.24564265,6,0,0,6,"Towner, North Dakota, United States"
"07-31-2020","13281","Towns","Georgia","United States",2020-08-01 04:36:27,34.91369188,-83.7410746,107,1,0,106,"Towns, Georgia, United States"
"07-31-2020","38097","Traill","North Dakota","United States",2020-08-01 04:36:27,47.45367788,-97.16323288,41,0,0,41,"Traill, North Dakota, United States"
"07-31-2020","37175","Transylvania","North Carolina","United States",2020-08-01 04:36:27,35.20383864,-82.79638423,121,1,0,120,"Transylvania, North Carolina, United States"
"07-31-2020","27155","Traverse","Minnesota","United States",2020-08-01 04:36:27,45.77298854,-96.47062949,10,0,0,10,"Traverse, Minnesota, United States"
"07-31-2020","48453","Travis","Texas","United States",2020-08-01 04:36:27,30.33432034,-97.7853562,20465,229,0,20236,"Travis, Texas, United States"
"07-31-2020","30103","Treasure","Montana","United States",2020-08-01 04:36:27,46.2097322,-107.2666516,2,0,0,2,"Treasure, Montana, United States"
"07-31-2020","20195","Trego","Kansas","United States",2020-08-01 04:36:27,38.91467218,-99.87284448,5,1,0,4,"Trego, Kansas, United States"
"07-31-2020","55121","Trempealeau","Wisconsin","United States",2020-08-01 04:36:27,44.30360275,-91.35893614,301,2,0,299,"Trempealeau, Wisconsin, United States"
"07-31-2020","13283","Treutlen","Georgia","United States",2020-08-01 04:36:27,32.40422134,-82.56904553,89,3,0,86,"Treutlen, Georgia, United States"
"07-31-2020",NA,"TriCounty","Utah","United States",2020-08-01 04:36:27,40.12491499,-109.5174415,153,0,0,153,"TriCounty, Utah, United States"
"07-31-2020","21221","Trigg","Kentucky","United States",2020-08-01 04:36:27,36.80767017,-87.87333656,48,0,0,48,"Trigg, Kentucky, United States"
"07-31-2020","21223","Trimble","Kentucky","United States",2020-08-01 04:36:27,38.61056487,-85.33775972,32,0,0,32,"Trimble, Kentucky, United States"
"07-31-2020","06105","Trinity","California","United States",2020-08-01 04:36:27,40.6491767,-123.114713,5,0,0,5,"Trinity, California, United States"
"07-31-2020","48455","Trinity","Texas","United States",2020-08-01 04:36:27,31.0879489,-95.1367187,129,2,0,127,"Trinity, Texas, United States"
"07-31-2020","46123","Tripp","South Dakota","United States",2020-08-01 04:36:27,43.34459388,-99.8854891,20,0,0,20,"Tripp, South Dakota, United States"
"07-31-2020","13285","Troup","Georgia","United States",2020-08-01 04:36:27,33.03349196,-85.02812115,2158,58,0,2100,"Troup, Georgia, United States"
"07-31-2020","47169","Trousdale","Tennessee","United States",2020-08-01 04:36:27,36.39026213,-86.16087954,1570,6,0,1564,"Trousdale, Tennessee, United States"
"07-31-2020","72139","Trujillo Alto","Puerto Rico","United States",2020-08-01 04:36:27,18.336159,-65.998884,372,0,0,372,"Trujillo Alto, Puerto Rico, United States"
"07-31-2020","39155","Trumbull","Ohio","United States",2020-08-01 04:36:27,41.31735028,-80.76109643,1393,100,0,1293,"Trumbull, Ohio, United States"
"07-31-2020","54093","Tucker","West Virginia","United States",2020-08-01 04:36:27,39.11240885,-79.57053576,9,0,0,9,"Tucker, West Virginia, United States"
"07-31-2020","06107","Tulare","California","United States",2020-08-01 04:36:27,36.22026558,-118.8020203,9454,178,0,9276,"Tulare, California, United States"
"07-31-2020","40143","Tulsa","Oklahoma","United States",2020-08-01 04:36:27,36.11939621,-95.94013939,8710,98,0,8612,"Tulsa, Oklahoma, United States"
"07-31-2020","28143","Tunica","Mississippi","United States",2020-08-01 04:36:27,34.64967704,-90.37481167,228,5,0,223,"Tunica, Mississippi, United States"
"07-31-2020","06109","Tuolumne","California","United States",2020-08-01 04:36:27,38.02644018,-119.9525093,141,2,0,139,"Tuolumne, California, United States"
"07-31-2020","13287","Turner","Georgia","United States",2020-08-01 04:36:27,31.71612656,-83.62069378,222,18,0,204,"Turner, Georgia, United States"
"07-31-2020","46125","Turner","South Dakota","United States",2020-08-01 04:36:27,43.3109081,-97.14865776,44,0,0,44,"Turner, South Dakota, United States"
"07-31-2020","01125","Tuscaloosa","Alabama","United States",2020-08-01 04:36:27,33.28726072,-87.52556818,3840,61,0,3779,"Tuscaloosa, Alabama, United States"
"07-31-2020","39157","Tuscarawas","Ohio","United States",2020-08-01 04:36:27,40.44214695,-81.47226262,736,13,0,723,"Tuscarawas, Ohio, United States"
"07-31-2020","26157","Tuscola","Michigan","United States",2020-08-01 04:36:27,43.46606813,-83.41897025,300,27,0,273,"Tuscola, Michigan, United States"
"07-31-2020","13289","Twiggs","Georgia","United States",2020-08-01 04:36:27,32.67435595,-83.43078662,93,3,0,90,"Twiggs, Georgia, United States"
"07-31-2020","16083","Twin Falls","Idaho","United States",2020-08-01 04:36:27,42.35440512,-114.6685381,1199,31,0,1168,"Twin Falls, Idaho, United States"
"07-31-2020","48457","Tyler","Texas","United States",2020-08-01 04:36:27,30.77031716,-94.37690895,112,1,0,111,"Tyler, Texas, United States"
"07-31-2020","54095","Tyler","West Virginia","United States",2020-08-01 04:36:27,39.46811972,-80.88772676,12,0,0,12,"Tyler, West Virginia, United States"
"07-31-2020","37177","Tyrrell","North Carolina","United States",2020-08-01 04:36:27,35.87147226,-76.17055253,91,1,0,90,"Tyrrell, North Carolina, United States"
"07-31-2020","56041","Uinta","Wyoming","United States",2020-08-01 04:36:27,41.2878183,-110.5475782,254,0,0,254,"Uinta, Wyoming, United States"
"07-31-2020","36111","Ulster","New York","United States",2020-08-01 04:36:27,41.89027881,-74.26252104,2021,91,0,1930,"Ulster, New York, United States"
"07-31-2020","41059","Umatilla","Oregon","United States",2020-08-01 04:36:27,45.59073056,-118.7353826,1943,23,0,1920,"Umatilla, Oregon, United States"
"07-31-2020","90001","Unassigned","Alabama","United States",2020-08-01 04:36:27,NA,NA,0,49,0,NA,"Unassigned, Alabama, United States"
"07-31-2020","90002","Unassigned","Alaska","United States",2020-08-01 04:36:27,NA,NA,0,0,0,0,"Unassigned, Alaska, United States"
"07-31-2020","90004","Unassigned","Arizona","United States",2020-08-01 04:36:27,NA,NA,0,1,0,NA,"Unassigned, Arizona, United States"
"07-31-2020","90005","Unassigned","Arkansas","United States",2020-08-01 04:36:27,NA,NA,1554,0,0,1554,"Unassigned, Arkansas, United States"
"07-31-2020","90006","Unassigned","California","United States",2020-08-01 04:36:27,NA,NA,0,0,0,0,"Unassigned, California, United States"
"07-31-2020","90008","Unassigned","Colorado","United States",2020-08-01 04:36:27,NA,NA,18,0,0,18,"Unassigned, Colorado, United States"
"07-31-2020","90009","Unassigned","Connecticut","United States",2020-08-01 04:36:27,NA,NA,243,0,0,243,"Unassigned, Connecticut, United States"
"07-31-2020","90010","Unassigned","Delaware","United States",2020-08-01 04:36:27,NA,NA,219,10,0,209,"Unassigned, Delaware, United States"
"07-31-2020","90012","Unassigned","Florida","United States",2020-08-01 04:36:27,NA,NA,570,0,0,570,"Unassigned, Florida, United States"
"07-31-2020","90013","Unassigned","Georgia","United States",2020-08-01 04:36:27,NA,NA,2311,6,0,2305,"Unassigned, Georgia, United States"
"07-31-2020","90015","Unassigned","Hawaii","United States",2020-08-01 04:36:27,NA,NA,0,0,0,0,"Unassigned, Hawaii, United States"
"07-31-2020","90016","Unassigned","Idaho","United States",2020-08-01 04:36:27,NA,NA,0,0,0,0,"Unassigned, Idaho, United States"
"07-31-2020","90017","Unassigned","Illinois","United States",2020-08-01 04:36:27,NA,NA,1344,197,0,1147,"Unassigned, Illinois, United States"
"07-31-2020","90018","Unassigned","Indiana","United States",2020-08-01 04:36:27,NA,NA,0,121,0,NA,"Unassigned, Indiana, United States"
"07-31-2020","90019","Unassigned","Iowa","United States",2020-08-01 04:36:27,NA,NA,5,0,0,5,"Unassigned, Iowa, United States"
"07-31-2020","90020","Unassigned","Kansas","United States",2020-08-01 04:36:27,NA,NA,0,1,0,NA,"Unassigned, Kansas, United States"
"07-31-2020","90021","Unassigned","Kentucky","United States",2020-08-01 04:36:27,NA,NA,0,0,0,0,"Unassigned, Kentucky, United States"
"07-31-2020","90022","Unassigned","Louisiana","United States",2020-08-01 04:36:27,NA,NA,10,114,0,NA,"Unassigned, Louisiana, United States"
"07-31-2020","90023","Unassigned","Maine","United States",2020-08-01 04:36:27,NA,NA,2,0,0,2,"Unassigned, Maine, United States"
"07-31-2020","90024","Unassigned","Maryland","United States",2020-08-01 04:36:27,NA,NA,0,13,0,NA,"Unassigned, Maryland, United States"
"07-31-2020","90025","Unassigned","Massachusetts","United States",2020-08-01 04:36:27,NA,NA,307,6,0,301,"Unassigned, Massachusetts, United States"
"07-31-2020","90026","Unassigned","Michigan","United States",2020-08-01 04:36:27,NA,NA,4,0,0,4,"Unassigned, Michigan, United States"
"07-31-2020","90027","Unassigned","Minnesota","United States",2020-08-01 04:36:27,NA,NA,116,40,0,76,"Unassigned, Minnesota, United States"
"07-31-2020","90028","Unassigned","Mississippi","United States",2020-08-01 04:36:27,NA,NA,0,0,0,0,"Unassigned, Mississippi, United States"
"07-31-2020","90029","Unassigned","Missouri","United States",2020-08-01 04:36:27,NA,NA,0,0,0,0,"Unassigned, Missouri, United States"
