"Date_Published","FIPS","Admin2","Province_State","Country_Region","Last_Update","Latitude","Longitude","Confirmed","Deaths","Recovered","Active","Combined_Key"
"07-30-2020","45001","Abbeville","South Carolina","United States",2020-07-31 04:35:18,34.22333378,-82.46170658,285,7,0,278,"Abbeville, South Carolina, United States"
"07-30-2020","22001","Acadia","Louisiana","United States",2020-07-31 04:35:18,30.2950649,-92.41419698,2299,71,0,2228,"Acadia, Louisiana, United States"
"07-30-2020","51001","Accomack","Virginia","United States",2020-07-31 04:35:18,37.76707161,-75.63234615,1074,15,0,1059,"Accomack, Virginia, United States"
"07-30-2020","16001","Ada","Idaho","United States",2020-07-31 04:35:18,43.4526575,-116.2415516,7681,55,0,7626,"Ada, Idaho, United States"
"07-30-2020","19001","Adair","Iowa","United States",2020-07-31 04:35:18,41.33075609,-94.47105874,20,0,0,20,"Adair, Iowa, United States"
"07-30-2020","21001","Adair","Kentucky","United States",2020-07-31 04:35:18,37.10459774,-85.28129668,197,19,0,178,"Adair, Kentucky, United States"
"07-30-2020","29001","Adair","Missouri","United States",2020-07-31 04:35:18,40.19058551,-92.60078167,130,0,0,130,"Adair, Missouri, United States"
"07-30-2020","40001","Adair","Oklahoma","United States",2020-07-31 04:35:18,35.88494195,-94.65859267,274,5,0,269,"Adair, Oklahoma, United States"
"07-30-2020","08001","Adams","Colorado","United States",2020-07-31 04:35:18,39.87432092,-104.3362578,5868,168,0,5700,"Adams, Colorado, United States"
"07-30-2020","16003","Adams","Idaho","United States",2020-07-31 04:35:18,44.89333571,-116.4545247,18,0,0,18,"Adams, Idaho, United States"
"07-30-2020","17001","Adams","Illinois","United States",2020-07-31 04:35:18,39.98815591,-91.18786813,363,1,0,362,"Adams, Illinois, United States"
"07-30-2020","18001","Adams","Indiana","United States",2020-07-31 04:35:18,40.7457653,-84.93671406,73,1,0,72,"Adams, Indiana, United States"
"07-30-2020","19003","Adams","Iowa","United States",2020-07-31 04:35:18,41.02903567,-94.69932645,15,0,0,15,"Adams, Iowa, United States"
"07-30-2020","28001","Adams","Mississippi","United States",2020-07-31 04:35:18,31.47669768,-91.35326037,552,23,0,529,"Adams, Mississippi, United States"
"07-30-2020","31001","Adams","Nebraska","United States",2020-07-31 04:35:18,40.5244942,-98.50117804,336,11,0,325,"Adams, Nebraska, United States"
"07-30-2020","38001","Adams","North Dakota","United States",2020-07-31 04:35:18,46.09686891,-102.5285397,2,0,0,2,"Adams, North Dakota, United States"
"07-30-2020","39001","Adams","Ohio","United States",2020-07-31 04:35:18,38.84541072,-83.4718964,53,2,0,51,"Adams, Ohio, United States"
"07-30-2020","42001","Adams","Pennsylvania","United States",2020-07-31 04:35:18,39.87140411,-77.21610347,461,19,0,442,"Adams, Pennsylvania, United States"
"07-30-2020","53001","Adams","Washington","United States",2020-07-31 04:35:18,46.98299757,-118.5601734,374,3,0,371,"Adams, Washington, United States"
"07-30-2020","55001","Adams","Wisconsin","United States",2020-07-31 04:35:18,43.96974651,-89.76782777,66,2,0,64,"Adams, Wisconsin, United States"
"07-30-2020","50001","Addison","Vermont","United States",2020-07-31 04:35:18,44.03217337,-73.14130877,71,2,0,69,"Addison, Vermont, United States"
"07-30-2020","72001","Adjuntas","Puerto Rico","United States",2020-07-31 04:35:18,18.180117,-66.754367,78,0,0,78,"Adjuntas, Puerto Rico, United States"
"07-30-2020","72003","Aguada","Puerto Rico","United States",2020-07-31 04:35:18,18.360255,-67.175131,97,0,0,97,"Aguada, Puerto Rico, United States"
"07-30-2020","72005","Aguadilla","Puerto Rico","United States",2020-07-31 04:35:18,18.459681,-67.120815,166,0,0,166,"Aguadilla, Puerto Rico, United States"
"07-30-2020","72007","Aguas Buenas","Puerto Rico","United States",2020-07-31 04:35:18,18.251619,-66.126806,102,0,0,102,"Aguas Buenas, Puerto Rico, United States"
"07-30-2020","72009","Aibonito","Puerto Rico","United States",2020-07-31 04:35:18,18.131361,-66.264131,73,0,0,73,"Aibonito, Puerto Rico, United States"
"07-30-2020","45003","Aiken","South Carolina","United States",2020-07-31 04:35:18,33.54338026,-81.63645384,1444,24,0,1420,"Aiken, South Carolina, United States"
"07-30-2020","27001","Aitkin","Minnesota","United States",2020-07-31 04:35:18,46.60962049,-93.4116826,25,0,0,25,"Aitkin, Minnesota, United States"
"07-30-2020","12001","Alachua","Florida","United States",2020-07-31 04:35:18,29.67866525,-82.35928158,3448,20,0,3428,"Alachua, Florida, United States"
"07-30-2020","37001","Alamance","North Carolina","United States",2020-07-31 04:35:18,36.0434701,-79.39976137,2101,41,0,2060,"Alamance, North Carolina, United States"
"07-30-2020","06001","Alameda","California","United States",2020-07-31 04:35:18,37.64629437,-121.8929271,11131,182,0,10949,"Alameda, California, United States"
"07-30-2020","08003","Alamosa","Colorado","United States",2020-07-31 04:35:18,37.57250606,-105.7885451,222,8,0,214,"Alamosa, Colorado, United States"
"07-30-2020","36001","Albany","New York","United States",2020-07-31 04:35:18,42.60060306,-73.97723916,2493,126,0,2367,"Albany, New York, United States"
"07-30-2020","56001","Albany","Wyoming","United States",2020-07-31 04:35:18,41.65498705,-105.7235415,83,0,0,83,"Albany, Wyoming, United States"
"07-30-2020","51003","Albemarle","Virginia","United States",2020-07-31 04:35:18,38.02080697,-78.55481085,733,10,0,723,"Albemarle, Virginia, United States"
"07-30-2020","26001","Alcona","Michigan","United States",2020-07-31 04:35:18,44.6846864,-83.59507875,28,1,0,27,"Alcona, Michigan, United States"
"07-30-2020","28003","Alcorn","Mississippi","United States",2020-07-31 04:35:18,34.88084463,-88.57996173,331,3,0,328,"Alcorn, Mississippi, United States"
"07-30-2020","02013","Aleutians East","Alaska","United States",2020-07-31 04:35:18,55.32222414,-161.9722021,1,0,0,1,"Aleutians East, Alaska, United States"
"07-30-2020","02016","Aleutians West","Alaska","United States",2020-07-31 04:35:18,52.3233,-174.1596,4,0,0,4,"Aleutians West, Alaska, United States"
"07-30-2020","17003","Alexander","Illinois","United States",2020-07-31 04:35:18,37.18049267,-89.32910838,35,0,0,35,"Alexander, Illinois, United States"
"07-30-2020","37003","Alexander","North Carolina","United States",2020-07-31 04:35:18,35.9223796,-81.17751948,295,2,0,293,"Alexander, North Carolina, United States"
"07-30-2020","51510","Alexandria","Virginia","United States",2020-07-31 04:35:18,38.814003,-77.08183073,2779,57,0,2722,"Alexandria, Virginia, United States"
"07-30-2020","40003","Alfalfa","Oklahoma","United States",2020-07-31 04:35:18,36.73090616,-98.32408495,4,0,0,4,"Alfalfa, Oklahoma, United States"
"07-30-2020","26003","Alger","Michigan","United States",2020-07-31 04:35:18,46.41292944,-86.60260122,6,0,0,6,"Alger, Michigan, United States"
"07-30-2020","19005","Allamakee","Iowa","United States",2020-07-31 04:35:18,43.28383218,-91.37860922,146,4,0,142,"Allamakee, Iowa, United States"
"07-30-2020","26005","Allegan","Michigan","United States",2020-07-31 04:35:18,42.59147037,-85.89102866,485,7,0,478,"Allegan, Michigan, United States"
"07-30-2020","24001","Allegany","Maryland","United States",2020-07-31 04:35:18,39.62357628,-78.69280486,264,18,0,246,"Allegany, Maryland, United States"
"07-30-2020","36003","Allegany","New York","United States",2020-07-31 04:35:18,42.25748406,-78.02750466,74,1,0,73,"Allegany, New York, United States"
"07-30-2020","37005","Alleghany","North Carolina","United States",2020-07-31 04:35:18,36.49360862,-81.12857041,66,0,0,66,"Alleghany, North Carolina, United States"
"07-30-2020","51005","Alleghany","Virginia","United States",2020-07-31 04:35:18,37.78636074,-80.00222498,56,3,0,53,"Alleghany, Virginia, United States"
"07-30-2020","42003","Allegheny","Pennsylvania","United States",2020-07-31 04:35:18,40.46809875,-79.98167747,7850,227,0,7623,"Allegheny, Pennsylvania, United States"
"07-30-2020","18003","Allen","Indiana","United States",2020-07-31 04:35:18,41.09194313,-85.06800636,3480,155,0,3325,"Allen, Indiana, United States"
"07-30-2020","20001","Allen","Kansas","United States",2020-07-31 04:35:18,37.88582951,-95.30030847,14,0,0,14,"Allen, Kansas, United States"
"07-30-2020","21003","Allen","Kentucky","United States",2020-07-31 04:35:18,36.75197631,-86.19457544,215,8,0,207,"Allen, Kentucky, United States"
"07-30-2020","22003","Allen","Louisiana","United States",2020-07-31 04:35:18,30.65385745,-92.82442028,1029,19,0,1010,"Allen, Louisiana, United States"
"07-30-2020","39003","Allen","Ohio","United States",2020-07-31 04:35:18,40.77285242,-84.10802343,603,42,0,561,"Allen, Ohio, United States"
"07-30-2020","45005","Allendale","South Carolina","United States",2020-07-31 04:35:18,32.98837386,-81.35321066,172,3,0,169,"Allendale, South Carolina, United States"
"07-30-2020","26007","Alpena","Michigan","United States",2020-07-31 04:35:18,45.03477666,-83.62212411,125,13,0,112,"Alpena, Michigan, United States"
"07-30-2020","06003","Alpine","California","United States",2020-07-31 04:35:18,38.59678594,-119.8223594,2,0,0,2,"Alpine, California, United States"
"07-30-2020","06005","Amador","California","United States",2020-07-31 04:35:18,38.44583082,-120.65696,110,0,0,110,"Amador, California, United States"
"07-30-2020","51007","Amelia","Virginia","United States",2020-07-31 04:35:18,37.34081025,-77.98584649,72,1,0,71,"Amelia, Virginia, United States"
"07-30-2020","51009","Amherst","Virginia","United States",2020-07-31 04:35:18,37.60308293,-79.14548696,101,0,0,101,"Amherst, Virginia, United States"
"07-30-2020","28005","Amite","Mississippi","United States",2020-07-31 04:35:18,31.17467303,-90.80501621,192,4,0,188,"Amite, Mississippi, United States"
"07-30-2020","72011","Anasco","Puerto Rico","United States",2020-07-31 04:35:18,18.287985,-67.120611,108,0,0,108,"Anasco, Puerto Rico, United States"
"07-30-2020","02020","Anchorage","Alaska","United States",2020-07-31 04:35:18,61.14998174,-149.1426986,1576,10,0,1566,"Anchorage, Alaska, United States"
"07-30-2020","20003","Anderson","Kansas","United States",2020-07-31 04:35:18,38.21413251,-95.29272815,26,0,0,26,"Anderson, Kansas, United States"
"07-30-2020","21005","Anderson","Kentucky","United States",2020-07-31 04:35:18,38.00671029,-84.99171713,67,1,0,66,"Anderson, Kentucky, United States"
"07-30-2020","45007","Anderson","South Carolina","United States",2020-07-31 04:35:18,34.51828081,-82.63959517,1882,41,0,1841,"Anderson, South Carolina, United States"
"07-30-2020","47001","Anderson","Tennessee","United States",2020-07-31 04:35:18,36.12684348,-84.19965764,550,5,0,545,"Anderson, Tennessee, United States"
"07-30-2020","48001","Anderson","Texas","United States",2020-07-31 04:35:18,31.81534745,-95.65354823,2174,7,0,2167,"Anderson, Texas, United States"
"07-30-2020","29003","Andrew","Missouri","United States",2020-07-31 04:35:18,39.98492163,-94.80163024,80,1,0,79,"Andrew, Missouri, United States"
"07-30-2020","48003","Andrews","Texas","United States",2020-07-31 04:35:18,32.30468633,-102.6376548,253,6,0,247,"Andrews, Texas, United States"
"07-30-2020","23001","Androscoggin","Maine","United States",2020-07-31 04:35:18,44.1664747,-70.20380627,547,6,0,541,"Androscoggin, Maine, United States"
"07-30-2020","48005","Angelina","Texas","United States",2020-07-31 04:35:18,31.25457347,-94.60901487,1606,32,0,1574,"Angelina, Texas, United States"
"07-30-2020","24003","Anne Arundel","Maryland","United States",2020-07-31 04:35:18,39.00670238,-76.60329337,6684,216,0,6468,"Anne Arundel, Maryland, United States"
"07-30-2020","27003","Anoka","Minnesota","United States",2020-07-31 04:35:18,45.27476015,-93.24604565,3190,112,0,3078,"Anoka, Minnesota, United States"
"07-30-2020","37007","Anson","North Carolina","United States",2020-07-31 04:35:18,34.97403241,-80.09953279,298,2,0,296,"Anson, North Carolina, United States"
"07-30-2020","31003","Antelope","Nebraska","United States",2020-07-31 04:35:18,42.17695516,-98.0666283,18,1,0,17,"Antelope, Nebraska, United States"
"07-30-2020","26009","Antrim","Michigan","United States",2020-07-31 04:35:18,44.99690221,-85.15503082,34,0,0,34,"Antrim, Michigan, United States"
"07-30-2020","04001","Apache","Arizona","United States",2020-07-31 04:35:18,35.39465006,-109.4892383,2969,129,0,2840,"Apache, Arizona, United States"
"07-30-2020","19007","Appanoose","Iowa","United States",2020-07-31 04:35:18,40.74324454,-92.86865906,40,3,0,37,"Appanoose, Iowa, United States"
"07-30-2020","13001","Appling","Georgia","United States",2020-07-31 04:35:18,31.74847232,-82.28909114,544,16,0,528,"Appling, Georgia, United States"
"07-30-2020","51011","Appomattox","Virginia","United States",2020-07-31 04:35:18,37.37569884,-78.81340003,67,0,0,67,"Appomattox, Virginia, United States"
"07-30-2020","48007","Aransas","Texas","United States",2020-07-31 04:35:18,28.10556197,-96.9995047,149,12,0,137,"Aransas, Texas, United States"
"07-30-2020","08005","Arapahoe","Colorado","United States",2020-07-31 04:35:18,39.64977461,-104.3353617,6798,362,0,6436,"Arapahoe, Colorado, United States"
"07-30-2020","48009","Archer","Texas","United States",2020-07-31 04:35:18,33.61569967,-98.68754589,17,0,0,17,"Archer, Texas, United States"
"07-30-2020","08007","Archuleta","Colorado","United States",2020-07-31 04:35:18,37.19474156,-107.0476867,31,0,0,31,"Archuleta, Colorado, United States"
"07-30-2020","72013","Arecibo","Puerto Rico","United States",2020-07-31 04:35:18,18.406631,-66.675077,237,0,0,237,"Arecibo, Puerto Rico, United States"
"07-30-2020","26011","Arenac","Michigan","United States",2020-07-31 04:35:18,44.0636262,-83.89277559,40,3,0,37,"Arenac, Michigan, United States"
"07-30-2020","05001","Arkansas","Arkansas","United States",2020-07-31 04:35:18,34.29145151,-91.37277296,183,1,0,182,"Arkansas, Arkansas, United States"
"07-30-2020","51013","Arlington","Virginia","United States",2020-07-31 04:35:18,38.8767675,-77.10139853,2874,135,0,2739,"Arlington, Virginia, United States"
"07-30-2020","42005","Armstrong","Pennsylvania","United States",2020-07-31 04:35:18,40.81665618,-79.46290811,178,6,0,172,"Armstrong, Pennsylvania, United States"
"07-30-2020","48011","Armstrong","Texas","United States",2020-07-31 04:35:18,34.96507426,-101.3574874,5,0,0,5,"Armstrong, Texas, United States"
"07-30-2020","23003","Aroostook","Maine","United States",2020-07-31 04:35:18,46.65926321,-68.59841248,32,1,0,31,"Aroostook, Maine, United States"
"07-30-2020","72015","Arroyo","Puerto Rico","United States",2020-07-31 04:35:18,17.998457,-66.056546,76,0,0,76,"Arroyo, Puerto Rico, United States"
"07-30-2020","31005","Arthur","Nebraska","United States",2020-07-31 04:35:18,41.56896142,-101.6959559,0,0,0,0,"Arthur, Nebraska, United States"
"07-30-2020","22005","Ascension","Louisiana","United States",2020-07-31 04:35:18,30.20406249,-90.9132841,2444,67,0,2377,"Ascension, Louisiana, United States"
"07-30-2020","37009","Ashe","North Carolina","United States",2020-07-31 04:35:18,36.43296207,-81.49862729,109,1,0,108,"Ashe, North Carolina, United States"
"07-30-2020","39005","Ashland","Ohio","United States",2020-07-31 04:35:18,40.84772277,-82.27280781,123,3,0,120,"Ashland, Ohio, United States"
"07-30-2020","55003","Ashland","Wisconsin","United States",2020-07-31 04:35:18,46.31956891,-90.67837132,15,0,0,15,"Ashland, Wisconsin, United States"
"07-30-2020","05003","Ashley","Arkansas","United States",2020-07-31 04:35:18,33.19153461,-91.7698471,214,4,0,210,"Ashley, Arkansas, United States"
"07-30-2020","39007","Ashtabula","Ohio","United States",2020-07-31 04:35:18,41.70860332,-80.74830218,530,44,0,486,"Ashtabula, Ohio, United States"
"07-30-2020","53003","Asotin","Washington","United States",2020-07-31 04:35:18,46.18894415,-117.2022851,24,2,0,22,"Asotin, Washington, United States"
"07-30-2020","22007","Assumption","Louisiana","United States",2020-07-31 04:35:18,29.89946234,-91.06461642,531,19,0,512,"Assumption, Louisiana, United States"
"07-30-2020","48013","Atascosa","Texas","United States",2020-07-31 04:35:18,28.89333001,-98.52730485,405,13,0,392,"Atascosa, Texas, United States"
"07-30-2020","20005","Atchison","Kansas","United States",2020-07-31 04:35:18,39.53185661,-95.30870026,59,0,0,59,"Atchison, Kansas, United States"
"07-30-2020","29005","Atchison","Missouri","United States",2020-07-31 04:35:18,40.43238737,-95.42970639,11,0,0,11,"Atchison, Missouri, United States"
"07-30-2020","39009","Athens","Ohio","United States",2020-07-31 04:35:18,39.33425634,-82.04278644,334,1,0,333,"Athens, Ohio, United States"
"07-30-2020","13003","Atkinson","Georgia","United States",2020-07-31 04:35:18,31.29633502,-82.87545866,276,2,0,274,"Atkinson, Georgia, United States"
"07-30-2020","34001","Atlantic","New Jersey","United States",2020-07-31 04:35:18,39.47538693,-74.65848483,3331,250,0,3081,"Atlantic, New Jersey, United States"
"07-30-2020","40005","Atoka","Oklahoma","United States",2020-07-31 04:35:18,34.37366573,-96.03802487,60,0,0,60,"Atoka, Oklahoma, United States"
"07-30-2020","28007","Attala","Mississippi","United States",2020-07-31 04:35:18,33.08658803,-89.57838564,480,23,0,457,"Attala, Mississippi, United States"
"07-30-2020","29007","Audrain","Missouri","United States",2020-07-31 04:35:18,39.215877,-91.84242683,190,1,0,189,"Audrain, Missouri, United States"
"07-30-2020","19009","Audubon","Iowa","United States",2020-07-31 04:35:18,41.6844628,-94.90581859,28,1,0,27,"Audubon, Iowa, United States"
"07-30-2020","39011","Auglaize","Ohio","United States",2020-07-31 04:35:18,40.55998859,-84.2242143,192,5,0,187,"Auglaize, Ohio, United States"
"07-30-2020","51015","Augusta","Virginia","United States",2020-07-31 04:35:18,38.16404586,-79.12461614,246,4,0,242,"Augusta, Virginia, United States"
"07-30-2020","46003","Aurora","South Dakota","United States",2020-07-31 04:35:18,43.71757685,-98.56050467,37,0,0,37,"Aurora, South Dakota, United States"
"07-30-2020","48015","Austin","Texas","United States",2020-07-31 04:35:18,29.88548725,-96.27736949,211,3,0,208,"Austin, Texas, United States"
"07-30-2020","01001","Autauga","Alabama","United States",2020-07-31 04:35:18,32.53952745,-86.64408227,1029,20,0,1009,"Autauga, Alabama, United States"
"07-30-2020","37011","Avery","North Carolina","United States",2020-07-31 04:35:18,36.07569796,-81.92308483,82,0,0,82,"Avery, North Carolina, United States"
"07-30-2020","22009","Avoyelles","Louisiana","United States",2020-07-31 04:35:18,31.07796211,-92.00079449,895,26,0,869,"Avoyelles, Louisiana, United States"
"07-30-2020","08009","Baca","Colorado","United States",2020-07-31 04:35:18,37.31940883,-102.5603223,14,0,0,14,"Baca, Colorado, United States"
"07-30-2020","13005","Bacon","Georgia","United States",2020-07-31 04:35:18,31.55456473,-82.45936528,399,6,0,393,"Bacon, Georgia, United States"
"07-30-2020","48017","Bailey","Texas","United States",2020-07-31 04:35:18,34.06854817,-102.8299707,151,3,0,148,"Bailey, Texas, United States"
"07-30-2020","12003","Baker","Florida","United States",2020-07-31 04:35:18,30.33060121,-82.28467476,343,4,0,339,"Baker, Florida, United States"
"07-30-2020","13007","Baker","Georgia","United States",2020-07-31 04:35:18,31.32669878,-84.44218806,55,3,0,52,"Baker, Georgia, United States"
"07-30-2020","41001","Baker","Oregon","United States",2020-07-31 04:35:18,44.70915557,-117.6749883,25,0,0,25,"Baker, Oregon, United States"
"07-30-2020","01003","Baldwin","Alabama","United States",2020-07-31 04:35:18,30.72774991,-87.72207058,3075,20,0,3055,"Baldwin, Alabama, United States"
"07-30-2020","13009","Baldwin","Georgia","United States",2020-07-31 04:35:18,33.06882326,-83.24701748,913,38,0,875,"Baldwin, Georgia, United States"
"07-30-2020","21007","Ballard","Kentucky","United States",2020-07-31 04:35:18,37.05842757,-88.99427697,30,0,0,30,"Ballard, Kentucky, United States"
"07-30-2020","24005","Baltimore","Maryland","United States",2020-07-31 04:35:18,39.45784712,-76.62911955,11615,545,0,11070,"Baltimore, Maryland, United States"
"07-30-2020","24510","Baltimore City","Maryland","United States",2020-07-31 04:35:18,39.30211911,-76.61151012,11004,406,0,10598,"Baltimore City, Maryland, United States"
"07-30-2020","45009","Bamberg","South Carolina","United States",2020-07-31 04:35:18,33.21927586,-81.05659969,414,15,0,399,"Bamberg, South Carolina, United States"
"07-30-2020","48019","Bandera","Texas","United States",2020-07-31 04:35:18,29.74619598,-99.24598147,83,1,0,82,"Bandera, Texas, United States"
"07-30-2020","13011","Banks","Georgia","United States",2020-07-31 04:35:18,34.35607081,-83.49644388,228,3,0,225,"Banks, Georgia, United States"
"07-30-2020","31007","Banner","Nebraska","United States",2020-07-31 04:35:18,41.54634427,-103.7114332,2,0,0,2,"Banner, Nebraska, United States"
"07-30-2020","16005","Bannock","Idaho","United States",2020-07-31 04:35:18,42.67002716,-112.2233311,299,2,0,297,"Bannock, Idaho, United States"
"07-30-2020","26013","Baraga","Michigan","United States",2020-07-31 04:35:18,46.6720582,-88.36363591,5,0,0,5,"Baraga, Michigan, United States"
"07-30-2020","20007","Barber","Kansas","United States",2020-07-31 04:35:18,37.2288586,-98.68460053,4,0,0,4,"Barber, Kansas, United States"
"07-30-2020","01005","Barbour","Alabama","United States",2020-07-31 04:35:18,31.868263,-85.3871286,598,5,0,593,"Barbour, Alabama, United States"
"07-30-2020","54001","Barbour","West Virginia","United States",2020-07-31 04:35:18,39.1307219,-80.00350858,29,1,0,28,"Barbour, West Virginia, United States"
"07-30-2020","72017","Barceloneta","Puerto Rico","United States",2020-07-31 04:35:18,18.445533,-66.560531,65,0,0,65,"Barceloneta, Puerto Rico, United States"
"07-30-2020","38003","Barnes","North Dakota","United States",2020-07-31 04:35:18,46.93579637,-98.06605978,31,0,0,31,"Barnes, North Dakota, United States"
"07-30-2020","25001","Barnstable","Massachusetts","United States",2020-07-31 04:35:18,41.72980578,-70.28854339,1742,155,0,1587,"Barnstable, Massachusetts, United States"
"07-30-2020","45011","Barnwell","South Carolina","United States",2020-07-31 04:35:18,33.26679302,-81.43584352,313,4,0,309,"Barnwell, South Carolina, United States"
"07-30-2020","72019","Barranquitas","Puerto Rico","United States",2020-07-31 04:35:18,18.201592,-66.30963,172,0,0,172,"Barranquitas, Puerto Rico, United States"
"07-30-2020","21009","Barren","Kentucky","United States",2020-07-31 04:35:18,36.96469836,-85.93338945,302,2,0,300,"Barren, Kentucky, United States"
"07-30-2020","55005","Barron","Wisconsin","United States",2020-07-31 04:35:18,45.42372701,-91.84833627,207,3,0,204,"Barron, Wisconsin, United States"
"07-30-2020","13013","Barrow","Georgia","United States",2020-07-31 04:35:18,33.99148694,-83.71436292,1030,32,0,998,"Barrow, Georgia, United States"
"07-30-2020","26015","Barry","Michigan","United States",2020-07-31 04:35:18,42.59513984,-85.30834519,169,2,0,167,"Barry, Michigan, United States"
"07-30-2020","29009","Barry","Missouri","United States",2020-07-31 04:35:18,36.70978521,-93.82919888,213,0,0,213,"Barry, Missouri, United States"
"07-30-2020","18005","Bartholomew","Indiana","United States",2020-07-31 04:35:18,39.20744865,-85.89558181,715,47,0,668,"Bartholomew, Indiana, United States"
"07-30-2020","20009","Barton","Kansas","United States",2020-07-31 04:35:18,38.47889676,-98.75636726,104,3,0,101,"Barton, Kansas, United States"
"07-30-2020","29011","Barton","Missouri","United States",2020-07-31 04:35:18,37.50207671,-94.34757022,64,0,0,64,"Barton, Missouri, United States"
"07-30-2020","13015","Bartow","Georgia","United States",2020-07-31 04:35:18,34.23732119,-84.83887523,1495,55,0,1440,"Bartow, Georgia, United States"
"07-30-2020","48021","Bastrop","Texas","United States",2020-07-31 04:35:18,30.10370699,-97.31206354,1277,18,0,1259,"Bastrop, Texas, United States"
"07-30-2020","29013","Bates","Missouri","United States",2020-07-31 04:35:18,38.25271289,-94.34113157,34,1,0,33,"Bates, Missouri, United States"
"07-30-2020","21011","Bath","Kentucky","United States",2020-07-31 04:35:18,38.14735938,-83.74588932,32,1,0,31,"Bath, Kentucky, United States"
"07-30-2020","51017","Bath","Virginia","United States",2020-07-31 04:35:18,38.05852573,-79.73912095,4,0,0,4,"Bath, Virginia, United States"
"07-30-2020","05005","Baxter","Arkansas","United States",2020-07-31 04:35:18,36.28784385,-92.33782872,61,0,0,61,"Baxter, Arkansas, United States"
"07-30-2020","12005","Bay","Florida","United States",2020-07-31 04:35:18,30.26548745,-85.62122584,3357,21,0,3336,"Bay, Florida, United States"
"07-30-2020","26017","Bay","Michigan","United States",2020-07-31 04:35:18,43.70639106,-83.98731479,536,31,0,505,"Bay, Michigan, United States"
"07-30-2020","72021","Bayamon","Puerto Rico","United States",2020-07-31 04:35:18,18.34946,-66.168435,1053,0,0,1053,"Bayamon, Puerto Rico, United States"
"07-30-2020","55007","Bayfield","Wisconsin","United States",2020-07-31 04:35:18,46.52868768,-91.19716729,18,1,0,17,"Bayfield, Wisconsin, United States"
"07-30-2020","48023","Baylor","Texas","United States",2020-07-31 04:35:18,33.61640794,-99.21352901,5,0,0,5,"Baylor, Texas, United States"
"07-30-2020","46005","Beadle","South Dakota","United States",2020-07-31 04:35:18,44.41464384,-98.27858469,585,9,0,576,"Beadle, South Dakota, United States"
"07-30-2020","16007","Bear Lake","Idaho","United States",2020-07-31 04:35:18,42.28269683,-111.3289238,6,0,0,6,"Bear Lake, Idaho, United States"
"07-30-2020",NA,"Bear River","Utah","United States",2020-07-31 04:35:18,41.52106798,-113.0832816,2141,5,0,2136,"Bear River, Utah, United States"
"07-30-2020","37013","Beaufort","North Carolina","United States",2020-07-31 04:35:18,35.48531943,-76.84325809,331,2,0,329,"Beaufort, North Carolina, United States"
"07-30-2020","45013","Beaufort","South Carolina","United States",2020-07-31 04:35:18,32.39226291,-80.72619758,3398,44,0,3354,"Beaufort, South Carolina, United States"
"07-30-2020","22011","Beauregard","Louisiana","United States",2020-07-31 04:35:18,30.64836518,-93.34173616,697,13,0,684,"Beauregard, Louisiana, United States"
"07-30-2020","40007","Beaver","Oklahoma","United States",2020-07-31 04:35:18,36.7496847,-100.4758872,36,0,0,36,"Beaver, Oklahoma, United States"
