"Date_Published","FIPS","Admin2","Province_State","Country_Region","Last_Update","Latitude","Longitude","Confirmed","Deaths","Recovered","Active","Combined_Key"
"07-30-2020","48299","Llano","Texas","United States",2020-07-31 04:35:18,30.70645047,-98.68475262,85,0,0,85,"Llano, Texas, United States"
"07-30-2020","05083","Logan","Arkansas","United States",2020-07-31 04:35:18,35.21413234,-93.71951016,134,0,0,134,"Logan, Arkansas, United States"
"07-30-2020","08075","Logan","Colorado","United States",2020-07-31 04:35:18,40.7249637,-103.110817,647,5,0,642,"Logan, Colorado, United States"
"07-30-2020","17107","Logan","Illinois","United States",2020-07-31 04:35:18,40.12581572,-89.36638784,74,0,0,74,"Logan, Illinois, United States"
"07-30-2020","20109","Logan","Kansas","United States",2020-07-31 04:35:18,38.91735806,-101.148475,2,0,0,2,"Logan, Kansas, United States"
"07-30-2020","21141","Logan","Kentucky","United States",2020-07-31 04:35:18,36.85949479,-86.877635,297,22,0,275,"Logan, Kentucky, United States"
"07-30-2020","31113","Logan","Nebraska","United States",2020-07-31 04:35:18,41.56650314,-100.4817851,0,0,0,0,"Logan, Nebraska, United States"
"07-30-2020","38047","Logan","North Dakota","United States",2020-07-31 04:35:18,46.45729487,-99.47719806,3,0,0,3,"Logan, North Dakota, United States"
"07-30-2020","39091","Logan","Ohio","United States",2020-07-31 04:35:18,40.38996525,-83.76784341,109,1,0,108,"Logan, Ohio, United States"
"07-30-2020","40083","Logan","Oklahoma","United States",2020-07-31 04:35:18,35.91899576,-97.44352845,164,1,0,163,"Logan, Oklahoma, United States"
"07-30-2020","54045","Logan","West Virginia","United States",2020-07-31 04:35:18,37.8299889,-81.93528571,108,1,0,107,"Logan, West Virginia, United States"
"07-30-2020","72087","Loiza","Puerto Rico","United States",2020-07-31 04:35:18,18.425688,-65.89943,76,0,0,76,"Loiza, Puerto Rico, United States"
"07-30-2020","13183","Long","Georgia","United States",2020-07-31 04:35:18,31.75218791,-81.74952375,111,1,0,110,"Long, Georgia, United States"
"07-30-2020","05085","Lonoke","Arkansas","United States",2020-07-31 04:35:18,34.75392199,-91.88742357,393,2,0,391,"Lonoke, Arkansas, United States"
"07-30-2020","39093","Lorain","Ohio","United States",2020-07-31 04:35:18,41.29553751,-82.15083537,1563,75,0,1488,"Lorain, Ohio, United States"
"07-30-2020","35028","Los Alamos","New Mexico","United States",2020-07-31 04:35:18,35.86631386,-106.3134985,18,0,0,18,"Los Alamos, New Mexico, United States"
"07-30-2020","06037","Los Angeles","California","United States",2020-07-31 04:35:18,34.30828379,-118.2282411,186036,4559,0,181477,"Los Angeles, California, United States"
"07-30-2020","47105","Loudon","Tennessee","United States",2020-07-31 04:35:18,35.73939663,-84.31145275,590,3,0,587,"Loudon, Tennessee, United States"
"07-30-2020","51107","Loudoun","Virginia","United States",2020-07-31 04:35:18,39.08990083,-77.63481877,4985,109,0,4876,"Loudoun, Virginia, United States"
"07-30-2020","19115","Louisa","Iowa","United States",2020-07-31 04:35:18,41.21842119,-91.26102611,377,14,0,363,"Louisa, Iowa, United States"
"07-30-2020","51109","Louisa","Virginia","United States",2020-07-31 04:35:18,37.97850256,-77.96274807,165,2,0,163,"Louisa, Virginia, United States"
"07-30-2020","31115","Loup","Nebraska","United States",2020-07-31 04:35:18,41.91371961,-99.45440415,0,0,0,0,"Loup, Nebraska, United States"
"07-30-2020","40085","Love","Oklahoma","United States",2020-07-31 04:35:18,33.95273467,-97.23906784,64,0,0,64,"Love, Oklahoma, United States"
"07-30-2020","01085","Lowndes","Alabama","United States",2020-07-31 04:35:18,32.1597283,-86.65158371,552,24,0,528,"Lowndes, Alabama, United States"
"07-30-2020","13185","Lowndes","Georgia","United States",2020-07-31 04:35:18,30.83568832,-83.27056716,2825,26,0,2799,"Lowndes, Georgia, United States"
"07-30-2020","28087","Lowndes","Mississippi","United States",2020-07-31 04:35:18,33.47386518,-88.4419153,922,26,0,896,"Lowndes, Mississippi, United States"
"07-30-2020","48303","Lubbock","Texas","United States",2020-07-31 04:35:18,33.61008596,-101.8204789,5328,63,0,5265,"Lubbock, Texas, United States"
"07-30-2020","19117","Lucas","Iowa","United States",2020-07-31 04:35:18,41.02958964,-93.32780803,41,4,0,37,"Lucas, Iowa, United States"
"07-30-2020","39095","Lucas","Ohio","United States",2020-07-31 04:35:18,41.62101218,-83.65468618,4521,313,0,4208,"Lucas, Ohio, United States"
"07-30-2020","26095","Luce","Michigan","United States",2020-07-31 04:35:18,46.47227431,-85.54471223,3,0,0,3,"Luce, Michigan, United States"
"07-30-2020","13187","Lumpkin","Georgia","United States",2020-07-31 04:35:18,34.57286511,-84.00425681,275,6,0,269,"Lumpkin, Georgia, United States"
"07-30-2020","35029","Luna","New Mexico","United States",2020-07-31 04:35:18,32.18179341,-107.7508826,220,3,0,217,"Luna, New Mexico, United States"
"07-30-2020","51111","Lunenburg","Virginia","United States",2020-07-31 04:35:18,36.94618528,-78.24133319,54,1,0,53,"Lunenburg, Virginia, United States"
"07-30-2020","72089","Luquillo","Puerto Rico","United States",2020-07-31 04:35:18,18.342114,-65.725097,86,0,0,86,"Luquillo, Puerto Rico, United States"
"07-30-2020","42079","Luzerne","Pennsylvania","United States",2020-07-31 04:35:18,41.17823008,-75.98447579,3239,183,0,3056,"Luzerne, Pennsylvania, United States"
"07-30-2020","42081","Lycoming","Pennsylvania","United States",2020-07-31 04:35:18,41.34310539,-77.06629984,314,20,0,294,"Lycoming, Pennsylvania, United States"
"07-30-2020","46085","Lyman","South Dakota","United States",2020-07-31 04:35:18,43.89522709,-99.85201878,85,2,0,83,"Lyman, South Dakota, United States"
"07-30-2020","51680","Lynchburg","Virginia","United States",2020-07-31 04:35:18,37.40021399,-79.19888138,396,2,0,394,"Lynchburg, Virginia, United States"
"07-30-2020","48305","Lynn","Texas","United States",2020-07-31 04:35:18,33.17657705,-101.8162849,63,4,0,59,"Lynn, Texas, United States"
"07-30-2020","19119","Lyon","Iowa","United States",2020-07-31 04:35:18,43.38107862,-96.20926845,98,0,0,98,"Lyon, Iowa, United States"
"07-30-2020","20111","Lyon","Kansas","United States",2020-07-31 04:35:18,38.45576156,-96.15275715,640,11,0,629,"Lyon, Kansas, United States"
"07-30-2020","21143","Lyon","Kentucky","United States",2020-07-31 04:35:18,37.02080035,-88.07886257,29,4,0,25,"Lyon, Kentucky, United States"
"07-30-2020","27083","Lyon","Minnesota","United States",2020-07-31 04:35:18,44.41327865,-95.83806103,414,3,0,411,"Lyon, Minnesota, United States"
"07-30-2020","32019","Lyon","Nevada","United States",2020-07-31 04:35:18,39.01777974,-119.1870479,188,3,0,185,"Lyon, Nevada, United States"
"07-30-2020","26097","Mackinac","Michigan","United States",2020-07-31 04:35:18,46.07028979,-85.04980537,20,0,0,20,"Mackinac, Michigan, United States"
"07-30-2020","26099","Macomb","Michigan","United States",2020-07-31 04:35:18,42.69158356,-82.92752801,9314,936,0,8378,"Macomb, Michigan, United States"
"07-30-2020","01087","Macon","Alabama","United States",2020-07-31 04:35:18,32.38759944,-85.69267724,312,12,0,300,"Macon, Alabama, United States"
"07-30-2020","13193","Macon","Georgia","United States",2020-07-31 04:35:18,32.35207048,-84.04234127,170,10,0,160,"Macon, Georgia, United States"
"07-30-2020","17115","Macon","Illinois","United States",2020-07-31 04:35:18,39.86064913,-88.96342505,424,23,0,401,"Macon, Illinois, United States"
"07-30-2020","29121","Macon","Missouri","United States",2020-07-31 04:35:18,39.83049768,-92.56453089,47,0,0,47,"Macon, Missouri, United States"
"07-30-2020","37113","Macon","North Carolina","United States",2020-07-31 04:35:18,35.14867843,-83.41696617,445,2,0,443,"Macon, North Carolina, United States"
"07-30-2020","47111","Macon","Tennessee","United States",2020-07-31 04:35:18,36.53157855,-86.00778595,803,13,0,790,"Macon, Tennessee, United States"
"07-30-2020","17117","Macoupin","Illinois","United States",2020-07-31 04:35:18,39.26119767,-89.92424028,123,3,0,120,"Macoupin, Illinois, United States"
"07-30-2020","06039","Madera","California","United States",2020-07-31 04:35:18,37.21513971,-119.7665589,1886,28,0,1858,"Madera, California, United States"
"07-30-2020","01089","Madison","Alabama","United States",2020-07-31 04:35:18,34.76327133,-86.55069633,4574,25,0,4549,"Madison, Alabama, United States"
"07-30-2020","05087","Madison","Arkansas","United States",2020-07-31 04:35:18,36.01038185,-93.72524943,253,1,0,252,"Madison, Arkansas, United States"
"07-30-2020","12079","Madison","Florida","United States",2020-07-31 04:35:18,30.44396917,-83.47398594,583,7,0,576,"Madison, Florida, United States"
"07-30-2020","13195","Madison","Georgia","United States",2020-07-31 04:35:18,34.12920917,-83.21218732,304,4,0,300,"Madison, Georgia, United States"
"07-30-2020","16065","Madison","Idaho","United States",2020-07-31 04:35:18,43.78141028,-111.6538474,131,0,0,131,"Madison, Idaho, United States"
"07-30-2020","17119","Madison","Illinois","United States",2020-07-31 04:35:18,38.83042506,-89.90422563,2047,72,0,1975,"Madison, Illinois, United States"
"07-30-2020","18095","Madison","Indiana","United States",2020-07-31 04:35:18,40.16143691,-85.71964711,789,64,0,725,"Madison, Indiana, United States"
"07-30-2020","19121","Madison","Iowa","United States",2020-07-31 04:35:18,41.33081904,-94.01554631,93,2,0,91,"Madison, Iowa, United States"
"07-30-2020","21151","Madison","Kentucky","United States",2020-07-31 04:35:18,37.71659336,-84.27220275,344,1,0,343,"Madison, Kentucky, United States"
"07-30-2020","22065","Madison","Louisiana","United States",2020-07-31 04:35:18,32.36918118,-91.23973355,536,6,0,530,"Madison, Louisiana, United States"
"07-30-2020","28089","Madison","Mississippi","United States",2020-07-31 04:35:18,32.63389156,-90.03513564,2211,50,0,2161,"Madison, Mississippi, United States"
"07-30-2020","29123","Madison","Missouri","United States",2020-07-31 04:35:18,37.47865134,-90.3467143,16,0,0,16,"Madison, Missouri, United States"
"07-30-2020","30057","Madison","Montana","United States",2020-07-31 04:35:18,45.30080065,-111.9173017,69,1,0,68,"Madison, Montana, United States"
"07-30-2020","31119","Madison","Nebraska","United States",2020-07-31 04:35:18,41.91676024,-97.6005481,407,5,0,402,"Madison, Nebraska, United States"
"07-30-2020","36053","Madison","New York","United States",2020-07-31 04:35:18,42.91653905,-75.67266639,396,17,0,379,"Madison, New York, United States"
"07-30-2020","37115","Madison","North Carolina","United States",2020-07-31 04:35:18,35.85402722,-82.71346418,36,0,0,36,"Madison, North Carolina, United States"
"07-30-2020","39097","Madison","Ohio","United States",2020-07-31 04:35:18,39.89381073,-83.40178317,308,9,0,299,"Madison, Ohio, United States"
"07-30-2020","47113","Madison","Tennessee","United States",2020-07-31 04:35:18,35.61181957,-88.84076036,739,11,0,728,"Madison, Tennessee, United States"
"07-30-2020","48313","Madison","Texas","United States",2020-07-31 04:35:18,30.96694679,-95.93003775,637,0,0,637,"Madison, Texas, United States"
"07-30-2020","51113","Madison","Virginia","United States",2020-07-31 04:35:18,38.41531222,-78.28220331,58,1,0,57,"Madison, Virginia, United States"
"07-30-2020","21153","Magoffin","Kentucky","United States",2020-07-31 04:35:18,37.70820545,-83.0657714,16,0,0,16,"Magoffin, Kentucky, United States"
"07-30-2020","19123","Mahaska","Iowa","United States",2020-07-31 04:35:18,41.33521503,-92.64083907,133,17,0,116,"Mahaska, Iowa, United States"
"07-30-2020","27087","Mahnomen","Minnesota","United States",2020-07-31 04:35:18,47.32557075,-95.80921485,20,1,0,19,"Mahnomen, Minnesota, United States"
"07-30-2020","39099","Mahoning","Ohio","United States",2020-07-31 04:35:18,41.01631101,-80.77287029,2349,249,0,2100,"Mahoning, Ohio, United States"
"07-30-2020","40093","Major","Oklahoma","United States",2020-07-31 04:35:18,36.31149996,-98.53467076,23,1,0,22,"Major, Oklahoma, United States"
"07-30-2020","41045","Malheur","Oregon","United States",2020-07-31 04:35:18,43.1937027,-117.6227395,634,9,0,625,"Malheur, Oregon, United States"
"07-30-2020","51683","Manassas","Virginia","United States",2020-07-31 04:35:18,38.7464321,-77.48509905,1596,20,0,1576,"Manassas, Virginia, United States"
"07-30-2020","51685","Manassas Park","Virginia","United States",2020-07-31 04:35:18,38.77058531,-77.44399307,495,7,0,488,"Manassas Park, Virginia, United States"
"07-30-2020","12081","Manatee","Florida","United States",2020-07-31 04:35:18,27.47196942,-82.31831044,8337,176,0,8161,"Manatee, Florida, United States"
"07-30-2020","72091","Manati","Puerto Rico","United States",2020-07-31 04:35:18,18.420473,-66.490461,178,0,0,178,"Manati, Puerto Rico, United States"
"07-30-2020","26101","Manistee","Michigan","United States",2020-07-31 04:35:18,44.33352407,-86.05626916,31,0,0,31,"Manistee, Michigan, United States"
"07-30-2020","55071","Manitowoc","Wisconsin","United States",2020-07-31 04:35:18,44.11946801,-87.80928853,281,1,0,280,"Manitowoc, Wisconsin, United States"
"07-30-2020","55073","Marathon","Wisconsin","United States",2020-07-31 04:35:18,44.89792533,-89.75863384,532,5,0,527,"Marathon, Wisconsin, United States"
"07-30-2020","01091","Marengo","Alabama","United States",2020-07-31 04:35:18,32.24767634,-87.78796182,498,14,0,484,"Marengo, Alabama, United States"
"07-30-2020","72093","Maricao","Puerto Rico","United States",2020-07-31 04:35:18,18.171795,-66.942126,40,0,0,40,"Maricao, Puerto Rico, United States"
"07-30-2020","04013","Maricopa","Arizona","United States",2020-07-31 04:35:18,33.34835867,-112.4918154,114852,2011,0,112841,"Maricopa, Arizona, United States"
"07-30-2020","29125","Maries","Missouri","United States",2020-07-31 04:35:18,38.16193985,-91.92249662,11,0,0,11,"Maries, Missouri, United States"
"07-30-2020","06041","Marin","California","United States",2020-07-31 04:35:18,38.07122463,-122.7210631,4934,64,0,4870,"Marin, California, United States"
"07-30-2020","55075","Marinette","Wisconsin","United States",2020-07-31 04:35:18,45.38553432,-88.033246,272,3,0,269,"Marinette, Wisconsin, United States"
"07-30-2020","01093","Marion","Alabama","United States",2020-07-31 04:35:18,34.13697363,-87.88704173,535,24,0,511,"Marion, Alabama, United States"
"07-30-2020","05089","Marion","Arkansas","United States",2020-07-31 04:35:18,36.26844485,-92.68451899,22,0,0,22,"Marion, Arkansas, United States"
"07-30-2020","12083","Marion","Florida","United States",2020-07-31 04:35:18,29.21227113,-82.05803627,4682,56,0,4626,"Marion, Florida, United States"
"07-30-2020","13197","Marion","Georgia","United States",2020-07-31 04:35:18,32.3483402,-84.52733571,131,4,0,127,"Marion, Georgia, United States"
"07-30-2020","17121","Marion","Illinois","United States",2020-07-31 04:35:18,38.64963204,-88.91899208,125,0,0,125,"Marion, Illinois, United States"
"07-30-2020","18097","Marion","Indiana","United States",2020-07-31 04:35:18,39.78163624,-86.13826325,14270,717,0,13553,"Marion, Indiana, United States"
"07-30-2020","19125","Marion","Iowa","United States",2020-07-31 04:35:18,41.33445101,-93.09934783,142,0,0,142,"Marion, Iowa, United States"
"07-30-2020","20115","Marion","Kansas","United States",2020-07-31 04:35:18,38.35855394,-97.0985251,48,1,0,47,"Marion, Kansas, United States"
"07-30-2020","21155","Marion","Kentucky","United States",2020-07-31 04:35:18,37.55218078,-85.26898542,97,0,0,97,"Marion, Kentucky, United States"
"07-30-2020","28091","Marion","Mississippi","United States",2020-07-31 04:35:18,31.23132643,-89.8209217,569,16,0,553,"Marion, Mississippi, United States"
"07-30-2020","29127","Marion","Missouri","United States",2020-07-31 04:35:18,39.80601912,-91.62203062,127,1,0,126,"Marion, Missouri, United States"
"07-30-2020","39101","Marion","Ohio","United States",2020-07-31 04:35:18,40.58610662,-83.15736305,2855,42,0,2813,"Marion, Ohio, United States"
"07-30-2020","41047","Marion","Oregon","United States",2020-07-31 04:35:18,44.90287942,-122.5815117,2533,67,0,2466,"Marion, Oregon, United States"
"07-30-2020","45067","Marion","South Carolina","United States",2020-07-31 04:35:18,34.07859748,-79.36400756,498,12,0,486,"Marion, South Carolina, United States"
"07-30-2020","47115","Marion","Tennessee","United States",2020-07-31 04:35:18,35.12997174,-85.62265895,190,4,0,186,"Marion, Tennessee, United States"
"07-30-2020","48315","Marion","Texas","United States",2020-07-31 04:35:18,32.79868409,-94.3566123,122,7,0,115,"Marion, Texas, United States"
"07-30-2020","54049","Marion","West Virginia","United States",2020-07-31 04:35:18,39.50984542,-80.24244659,169,2,0,167,"Marion, West Virginia, United States"
"07-30-2020","06043","Mariposa","California","United States",2020-07-31 04:35:18,37.57978556,-119.9073334,53,2,0,51,"Mariposa, California, United States"
"07-30-2020","45069","Marlboro","South Carolina","United States",2020-07-31 04:35:18,34.59905577,-79.67561152,409,4,0,405,"Marlboro, South Carolina, United States"
"07-30-2020","26103","Marquette","Michigan","United States",2020-07-31 04:35:18,46.4338914,-87.64043701,122,11,0,111,"Marquette, Michigan, United States"
"07-30-2020","55077","Marquette","Wisconsin","United States",2020-07-31 04:35:18,43.81911946,-89.40073763,67,1,0,66,"Marquette, Wisconsin, United States"
"07-30-2020","01095","Marshall","Alabama","United States",2020-07-31 04:35:18,34.36975964,-86.30486727,2796,28,0,2768,"Marshall, Alabama, United States"
"07-30-2020","17123","Marshall","Illinois","United States",2020-07-31 04:35:18,41.0327901,-89.34510444,18,0,0,18,"Marshall, Illinois, United States"
"07-30-2020","18099","Marshall","Indiana","United States",2020-07-31 04:35:18,41.32467367,-86.26185087,722,21,0,701,"Marshall, Indiana, United States"
"07-30-2020","19127","Marshall","Iowa","United States",2020-07-31 04:35:18,42.03586837,-92.9990819,1364,24,0,1340,"Marshall, Iowa, United States"
"07-30-2020","20117","Marshall","Kansas","United States",2020-07-31 04:35:18,39.78359669,-96.52278974,9,0,0,9,"Marshall, Kansas, United States"
"07-30-2020","21157","Marshall","Kentucky","United States",2020-07-31 04:35:18,36.8800707,-88.32803576,115,2,0,113,"Marshall, Kentucky, United States"
"07-30-2020","27089","Marshall","Minnesota","United States",2020-07-31 04:35:18,48.35825983,-96.37017407,27,0,0,27,"Marshall, Minnesota, United States"
"07-30-2020","28093","Marshall","Mississippi","United States",2020-07-31 04:35:18,34.76216286,-89.50299462,526,8,0,518,"Marshall, Mississippi, United States"
"07-30-2020","40095","Marshall","Oklahoma","United States",2020-07-31 04:35:18,34.02311222,-96.76855464,83,0,0,83,"Marshall, Oklahoma, United States"
"07-30-2020","46091","Marshall","South Dakota","United States",2020-07-31 04:35:18,45.75870838,-97.59855639,8,0,0,8,"Marshall, South Dakota, United States"
"07-30-2020","47117","Marshall","Tennessee","United States",2020-07-31 04:35:18,35.45798777,-86.76420988,242,2,0,240,"Marshall, Tennessee, United States"
"07-30-2020","54051","Marshall","West Virginia","United States",2020-07-31 04:35:18,39.86064362,-80.66591062,118,0,0,118,"Marshall, West Virginia, United States"
"07-30-2020","12085","Martin","Florida","United States",2020-07-31 04:35:18,27.0772071,-80.43109784,3561,73,0,3488,"Martin, Florida, United States"
"07-30-2020","18101","Martin","Indiana","United States",2020-07-31 04:35:18,38.7099921,-86.80373186,42,0,0,42,"Martin, Indiana, United States"
"07-30-2020","21159","Martin","Kentucky","United States",2020-07-31 04:35:18,37.79990579,-82.51247478,29,0,0,29,"Martin, Kentucky, United States"
"07-30-2020","27091","Martin","Minnesota","United States",2020-07-31 04:35:18,43.67429718,-94.55099908,198,5,0,193,"Martin, Minnesota, United States"
"07-30-2020","37117","Martin","North Carolina","United States",2020-07-31 04:35:18,35.84326734,-77.10860251,235,6,0,229,"Martin, North Carolina, United States"
"07-30-2020","48317","Martin","Texas","United States",2020-07-31 04:35:18,32.30600051,-101.9513518,44,2,0,42,"Martin, Texas, United States"
"07-30-2020","51690","Martinsville","Virginia","United States",2020-07-31 04:35:18,36.68212094,-79.86352771,159,3,0,156,"Martinsville, Virginia, United States"
"07-30-2020","17125","Mason","Illinois","United States",2020-07-31 04:35:18,40.23917274,-89.91824452,42,0,0,42,"Mason, Illinois, United States"
"07-30-2020","21161","Mason","Kentucky","United States",2020-07-31 04:35:18,38.59471935,-83.82151043,48,1,0,47,"Mason, Kentucky, United States"
"07-30-2020","26105","Mason","Michigan","United States",2020-07-31 04:35:18,43.99509218,-86.24988902,94,0,0,94,"Mason, Michigan, United States"
"07-30-2020","48319","Mason","Texas","United States",2020-07-31 04:35:18,30.71780434,-99.22629416,39,0,0,39,"Mason, Texas, United States"
"07-30-2020","53045","Mason","Washington","United States",2020-07-31 04:35:18,47.35007586,-123.1863685,145,1,0,144,"Mason, Washington, United States"
"07-30-2020","54053","Mason","West Virginia","United States",2020-07-31 04:35:18,38.77071799,-82.02524219,45,1,0,44,"Mason, West Virginia, United States"
"07-30-2020","17127","Massac","Illinois","United States",2020-07-31 04:35:18,37.22078441,-88.71036614,33,0,0,33,"Massac, Illinois, United States"
"07-30-2020","48321","Matagorda","Texas","United States",2020-07-31 04:35:18,28.81955746,-96.01230294,644,20,0,624,"Matagorda, Texas, United States"
"07-30-2020","02170","Matanuska-Susitna","Alaska","United States",2020-07-31 04:35:18,62.31305045,-149.5741743,259,2,0,257,"Matanuska-Susitna, Alaska, United States"
"07-30-2020","51115","Mathews","Virginia","United States",2020-07-31 04:35:18,37.44164146,-76.34098896,12,0,0,12,"Mathews, Virginia, United States"
"07-30-2020","15009","Maui","Hawaii","United States",2020-07-31 04:35:18,20.86399628,-156.5689097,167,6,0,161,"Maui, Hawaii, United States"
"07-30-2020","72095","Maunabo","Puerto Rico","United States",2020-07-31 04:35:18,18.017889,-65.922235,49,0,0,49,"Maunabo, Puerto Rico, United States"
"07-30-2020","47119","Maury","Tennessee","United States",2020-07-31 04:35:18,35.6187413,-87.07462444,971,5,0,966,"Maury, Tennessee, United States"
"07-30-2020","48323","Maverick","Texas","United States",2020-07-31 04:35:18,28.7429195,-100.3157686,1852,36,0,1816,"Maverick, Texas, United States"
"07-30-2020","72097","Mayaguez","Puerto Rico","United States",2020-07-31 04:35:18,18.2013,-67.1452,414,0,0,414,"Mayaguez, Puerto Rico, United States"
"07-30-2020","40097","Mayes","Oklahoma","United States",2020-07-31 04:35:18,36.30179091,-95.23175116,270,6,0,264,"Mayes, Oklahoma, United States"
"07-30-2020","40087","McClain","Oklahoma","United States",2020-07-31 04:35:18,35.01123903,-97.44572302,379,4,0,375,"McClain, Oklahoma, United States"
"07-30-2020","30055","McCone","Montana","United States",2020-07-31 04:35:18,47.64469406,-105.7944994,1,0,0,1,"McCone, Montana, United States"
"07-30-2020","46087","McCook","South Dakota","United States",2020-07-31 04:35:18,43.6742571,-97.36863144,24,1,0,23,"McCook, South Dakota, United States"
"07-30-2020","45065","McCormick","South Carolina","United States",2020-07-31 04:35:18,33.90161443,-82.30794338,100,2,0,98,"McCormick, South Carolina, United States"
"07-30-2020","21145","McCracken","Kentucky","United States",2020-07-31 04:35:18,37.05350953,-88.70445755,313,4,0,309,"McCracken, Kentucky, United States"
"07-30-2020","21147","McCreary","Kentucky","United States",2020-07-31 04:35:18,36.73874143,-84.48102924,28,0,0,28,"McCreary, Kentucky, United States"
"07-30-2020","48307","McCulloch","Texas","United States",2020-07-31 04:35:18,31.1925468,-99.34682807,35,1,0,34,"McCulloch, Texas, United States"
"07-30-2020","40089","McCurtain","Oklahoma","United States",2020-07-31 04:35:18,34.11664328,-94.77222373,814,25,0,789,"McCurtain, Oklahoma, United States"
"07-30-2020","29119","McDonald","Missouri","United States",2020-07-31 04:35:18,36.62869595,-94.34867205,916,7,0,909,"McDonald, Missouri, United States"
"07-30-2020","17109","McDonough","Illinois","United States",2020-07-31 04:35:18,40.45674722,-90.67775541,123,15,0,108,"McDonough, Illinois, United States"
"07-30-2020","37111","McDowell","North Carolina","United States",2020-07-31 04:35:18,35.67736232,-82.0482425,539,8,0,531,"McDowell, North Carolina, United States"
"07-30-2020","54047","McDowell","West Virginia","United States",2020-07-31 04:35:18,37.38002939,-81.65083669,20,0,0,20,"McDowell, West Virginia, United States"
"07-30-2020","13189","McDuffie","Georgia","United States",2020-07-31 04:35:18,33.47851918,-82.48252774,272,9,0,263,"McDuffie, Georgia, United States"
"07-30-2020","17111","McHenry","Illinois","United States",2020-07-31 04:35:18,42.32451172,-88.45248227,2824,112,0,2712,"McHenry, Illinois, United States"
"07-30-2020","38049","McHenry","North Dakota","United States",2020-07-31 04:35:18,48.23104458,-100.6324822,14,1,0,13,"McHenry, North Dakota, United States"
"07-30-2020","13191","McIntosh","Georgia","United States",2020-07-31 04:35:18,31.49683595,-81.40163426,141,2,0,139,"McIntosh, Georgia, United States"
"07-30-2020","38051","McIntosh","North Dakota","United States",2020-07-31 04:35:18,46.11182017,-99.44145858,16,1,0,15,"McIntosh, North Dakota, United States"
"07-30-2020","40091","McIntosh","Oklahoma","United States",2020-07-31 04:35:18,35.37235506,-95.66599306,141,1,0,140,"McIntosh, Oklahoma, United States"
"07-30-2020","42083","McKean","Pennsylvania","United States",2020-07-31 04:35:18,41.80938602,-78.56478358,26,1,0,25,"McKean, Pennsylvania, United States"
"07-30-2020","38053","McKenzie","North Dakota","United States",2020-07-31 04:35:18,47.7413337,-103.395905,73,1,0,72,"McKenzie, North Dakota, United States"
"07-30-2020","35031","McKinley","New Mexico","United States",2020-07-31 04:35:18,35.5800772,-108.262245,3977,219,0,3758,"McKinley, New Mexico, United States"
"07-30-2020","17113","McLean","Illinois","United States",2020-07-31 04:35:18,40.48996987,-88.84621113,520,15,0,505,"McLean, Illinois, United States"
"07-30-2020","21149","McLean","Kentucky","United States",2020-07-31 04:35:18,37.5301951,-87.26803443,38,1,0,37,"McLean, Kentucky, United States"
