"Date_Published","FIPS","Admin2","Province_State","Country_Region","Last_Update","Latitude","Longitude","Confirmed","Deaths","Recovered","Active","Combined_Key"
"07-30-2020","48135","Ector","Texas","United States",2020-07-31 04:35:18,31.86898877,-102.5429428,3266,49,0,3217,"Ector, Texas, United States"
"07-30-2020","35015","Eddy","New Mexico","United States",2020-07-31 04:35:18,32.47167456,-104.3053527,239,3,0,236,"Eddy, New Mexico, United States"
"07-30-2020","38027","Eddy","North Dakota","United States",2020-07-31 04:35:18,47.71701474,-98.90432337,13,0,0,13,"Eddy, North Dakota, United States"
"07-30-2020","17045","Edgar","Illinois","United States",2020-07-31 04:35:18,39.6809186,-87.74759563,25,0,0,25,"Edgar, Illinois, United States"
"07-30-2020","37065","Edgecombe","North Carolina","United States",2020-07-31 04:35:18,35.91230639,-77.59436892,560,11,0,549,"Edgecombe, North Carolina, United States"
"07-30-2020","45037","Edgefield","South Carolina","United States",2020-07-31 04:35:18,33.77221995,-81.96231108,264,6,0,258,"Edgefield, South Carolina, United States"
"07-30-2020","21061","Edmonson","Kentucky","United States",2020-07-31 04:35:18,37.21218923,-86.23955613,89,12,0,77,"Edmonson, Kentucky, United States"
"07-30-2020","46045","Edmunds","South Dakota","United States",2020-07-31 04:35:18,45.41846445,-99.21545423,10,0,0,10,"Edmunds, South Dakota, United States"
"07-30-2020","17047","Edwards","Illinois","United States",2020-07-31 04:35:18,38.41353228,-88.05720863,12,0,0,12,"Edwards, Illinois, United States"
"07-30-2020","20047","Edwards","Kansas","United States",2020-07-31 04:35:18,37.88735543,-99.31263309,10,0,0,10,"Edwards, Kansas, United States"
"07-30-2020","48137","Edwards","Texas","United States",2020-07-31 04:35:18,29.98202582,-100.304252,24,0,0,24,"Edwards, Texas, United States"
"07-30-2020","13103","Effingham","Georgia","United States",2020-07-31 04:35:18,32.36616021,-81.34280942,587,1,0,586,"Effingham, Georgia, United States"
"07-30-2020","17049","Effingham","Illinois","United States",2020-07-31 04:35:18,39.05935711,-88.58969584,81,1,0,80,"Effingham, Illinois, United States"
"07-30-2020","06017","El Dorado","California","United States",2020-07-31 04:35:18,38.77965956,-120.5233166,613,1,0,612,"El Dorado, California, United States"
"07-30-2020","08041","El Paso","Colorado","United States",2020-07-31 04:35:18,38.83240149,-104.5251411,4381,130,0,4251,"El Paso, Colorado, United States"
"07-30-2020","48141","El Paso","Texas","United States",2020-07-31 04:35:18,31.76980765,-106.2363275,13939,232,0,13707,"El Paso, Texas, United States"
"07-30-2020","08039","Elbert","Colorado","United States",2020-07-31 04:35:18,39.28656773,-104.1358721,83,2,0,81,"Elbert, Colorado, United States"
"07-30-2020","13105","Elbert","Georgia","United States",2020-07-31 04:35:18,34.11302332,-82.83936148,314,1,0,313,"Elbert, Georgia, United States"
"07-30-2020","20049","Elk","Kansas","United States",2020-07-31 04:35:18,37.45338105,-96.24369667,1,0,0,1,"Elk, Kansas, United States"
"07-30-2020","42047","Elk","Pennsylvania","United States",2020-07-31 04:35:18,41.42822061,-78.64524744,42,2,0,40,"Elk, Pennsylvania, United States"
"07-30-2020","18039","Elkhart","Indiana","United States",2020-07-31 04:35:18,41.59761169,-85.85875695,4467,75,0,4392,"Elkhart, Indiana, United States"
"07-30-2020","32007","Elko","Nevada","United States",2020-07-31 04:35:18,41.14531606,-115.3577619,443,2,0,441,"Elko, Nevada, United States"
"07-30-2020","21063","Elliott","Kentucky","United States",2020-07-31 04:35:18,38.11624059,-83.09771563,7,0,0,7,"Elliott, Kentucky, United States"
"07-30-2020","20051","Ellis","Kansas","United States",2020-07-31 04:35:18,38.91458712,-99.31751551,125,1,0,124,"Ellis, Kansas, United States"
"07-30-2020","40045","Ellis","Oklahoma","United States",2020-07-31 04:35:18,36.2180194,-99.75324573,3,0,0,3,"Ellis, Oklahoma, United States"
"07-30-2020","48139","Ellis","Texas","United States",2020-07-31 04:35:18,32.34894117,-96.79371841,2407,33,0,2374,"Ellis, Texas, United States"
"07-30-2020","20053","Ellsworth","Kansas","United States",2020-07-31 04:35:18,38.69677695,-98.20462799,18,0,0,18,"Ellsworth, Kansas, United States"
"07-30-2020","01051","Elmore","Alabama","United States",2020-07-31 04:35:18,32.59785413,-86.14415284,1567,35,0,1532,"Elmore, Alabama, United States"
"07-30-2020","16039","Elmore","Idaho","United States",2020-07-31 04:35:18,43.3507101,-115.4701578,186,2,0,184,"Elmore, Idaho, United States"
"07-30-2020","13107","Emanuel","Georgia","United States",2020-07-31 04:35:18,32.59221302,-82.30239915,387,7,0,380,"Emanuel, Georgia, United States"
"07-30-2020","19063","Emmet","Iowa","United States",2020-07-31 04:35:18,43.37782951,-94.67858943,171,1,0,170,"Emmet, Iowa, United States"
"07-30-2020","26047","Emmet","Michigan","United States",2020-07-31 04:35:18,45.52625509,-84.89083249,56,2,0,54,"Emmet, Michigan, United States"
"07-30-2020","38029","Emmons","North Dakota","United States",2020-07-31 04:35:18,46.28398398,-100.2389766,15,1,0,14,"Emmons, North Dakota, United States"
"07-30-2020","51595","Emporia","Virginia","United States",2020-07-31 04:35:18,36.69455571,-77.53406129,163,15,0,148,"Emporia, Virginia, United States"
"07-30-2020","48143","Erath","Texas","United States",2020-07-31 04:35:18,32.23602653,-98.21773417,447,5,0,442,"Erath, Texas, United States"
"07-30-2020","36029","Erie","New York","United States",2020-07-31 04:35:18,42.76249024,-78.73063652,8434,669,0,7765,"Erie, New York, United States"
"07-30-2020","39043","Erie","Ohio","United States",2020-07-31 04:35:18,41.36796058,-82.62904521,488,25,0,463,"Erie, Ohio, United States"
"07-30-2020","42049","Erie","Pennsylvania","United States",2020-07-31 04:35:18,41.99253829,-80.03301954,905,15,0,890,"Erie, Pennsylvania, United States"
"07-30-2020","01053","Escambia","Alabama","United States",2020-07-31 04:35:18,31.1256789,-87.15918694,996,15,0,981,"Escambia, Alabama, United States"
"07-30-2020","12033","Escambia","Florida","United States",2020-07-31 04:35:18,30.67652764,-87.37284571,7598,92,0,7506,"Escambia, Florida, United States"
"07-30-2020","32009","Esmeralda","Nevada","United States",2020-07-31 04:35:18,37.78436681,-117.6319999,0,0,0,0,"Esmeralda, Nevada, United States"
"07-30-2020","25009","Essex","Massachusetts","United States",2020-07-31 04:35:18,42.6687626,-70.94687179,17169,1175,0,15994,"Essex, Massachusetts, United States"
"07-30-2020","34013","Essex","New Jersey","United States",2020-07-31 04:35:18,40.78681335,-74.24657979,19441,2100,0,17341,"Essex, New Jersey, United States"
"07-30-2020","36031","Essex","New York","United States",2020-07-31 04:35:18,44.11630765,-73.77297842,55,0,0,55,"Essex, New York, United States"
"07-30-2020","50009","Essex","Vermont","United States",2020-07-31 04:35:18,44.72736416,-71.73579864,4,0,0,4,"Essex, Vermont, United States"
"07-30-2020","51057","Essex","Virginia","United States",2020-07-31 04:35:18,37.93357639,-76.94230311,74,1,0,73,"Essex, Virginia, United States"
"07-30-2020","21065","Estill","Kentucky","United States",2020-07-31 04:35:18,37.69241417,-83.95956369,11,0,0,11,"Estill, Kentucky, United States"
"07-30-2020","01055","Etowah","Alabama","United States",2020-07-31 04:35:18,34.04567266,-86.04051873,1888,19,0,1869,"Etowah, Alabama, United States"
"07-30-2020","32011","Eureka","Nevada","United States",2020-07-31 04:35:18,39.98100864,-116.2683204,2,0,0,2,"Eureka, Nevada, United States"
"07-30-2020","22039","Evangeline","Louisiana","United States",2020-07-31 04:35:18,30.72985248,-92.39915924,686,2,0,684,"Evangeline, Louisiana, United States"
"07-30-2020","13109","Evans","Georgia","United States",2020-07-31 04:35:18,32.15328841,-81.8870105,195,1,0,194,"Evans, Georgia, United States"
"07-30-2020","02090","Fairbanks North Star","Alaska","United States",2020-07-31 04:35:18,64.80726247,-146.5692662,386,5,0,381,"Fairbanks North Star, Alaska, United States"
"07-30-2020","51059","Fairfax","Virginia","United States",2020-07-31 04:35:18,38.83677558,-77.27565836,15606,519,0,15087,"Fairfax, Virginia, United States"
"07-30-2020","51600","Fairfax City","Virginia","United States",2020-07-31 04:35:18,38.85157547,-77.2977964,81,7,0,74,"Fairfax City, Virginia, United States"
"07-30-2020","09001","Fairfield","Connecticut","United States",2020-07-31 04:35:18,41.26809896,-73.3881171,17786,1406,0,16380,"Fairfield, Connecticut, United States"
"07-30-2020","39045","Fairfield","Ohio","United States",2020-07-31 04:35:18,39.75107189,-82.63088163,1177,22,0,1155,"Fairfield, Ohio, United States"
"07-30-2020","45039","Fairfield","South Carolina","United States",2020-07-31 04:35:18,34.39287073,-81.1195624,517,23,0,494,"Fairfield, South Carolina, United States"
"07-30-2020","72053","Fajardo","Puerto Rico","United States",2020-07-31 04:35:18,18.318373,-65.666866,176,0,0,176,"Fajardo, Puerto Rico, United States"
"07-30-2020","46047","Fall River","South Dakota","United States",2020-07-31 04:35:18,43.23929297,-103.5275691,14,0,0,14,"Fall River, South Dakota, United States"
"07-30-2020","30025","Fallon","Montana","United States",2020-07-31 04:35:18,46.33478338,-104.4183565,2,0,0,2,"Fallon, Montana, United States"
"07-30-2020","48145","Falls","Texas","United States",2020-07-31 04:35:18,31.25350609,-96.93630086,108,2,0,106,"Falls, Texas, United States"
"07-30-2020","51610","Falls Church","Virginia","United States",2020-07-31 04:35:18,38.88485255,-77.17560759,61,6,0,55,"Falls Church, Virginia, United States"
"07-30-2020","13111","Fannin","Georgia","United States",2020-07-31 04:35:18,34.86430205,-84.316964,259,2,0,257,"Fannin, Georgia, United States"
"07-30-2020","48147","Fannin","Texas","United States",2020-07-31 04:35:18,33.59564294,-96.10751083,211,7,0,204,"Fannin, Texas, United States"
"07-30-2020","27043","Faribault","Minnesota","United States",2020-07-31 04:35:18,43.67381499,-93.94787458,78,0,0,78,"Faribault, Minnesota, United States"
"07-30-2020","46049","Faulk","South Dakota","United States",2020-07-31 04:35:18,45.07082625,-99.14535601,26,1,0,25,"Faulk, South Dakota, United States"
"07-30-2020","05045","Faulkner","Arkansas","United States",2020-07-31 04:35:18,35.14719007,-92.33717519,1158,5,0,1153,"Faulkner, Arkansas, United States"
"07-30-2020","51061","Fauquier","Virginia","United States",2020-07-31 04:35:18,38.73564842,-77.80647472,571,8,0,563,"Fauquier, Virginia, United States"
"07-30-2020","01057","Fayette","Alabama","United States",2020-07-31 04:35:18,33.72076938,-87.73886638,184,5,0,179,"Fayette, Alabama, United States"
"07-30-2020","13113","Fayette","Georgia","United States",2020-07-31 04:35:18,33.41357794,-84.49089434,898,24,0,874,"Fayette, Georgia, United States"
"07-30-2020","17051","Fayette","Illinois","United States",2020-07-31 04:35:18,39.00072038,-89.02452658,52,3,0,49,"Fayette, Illinois, United States"
"07-30-2020","18041","Fayette","Indiana","United States",2020-07-31 04:35:18,39.63684962,-85.17797541,143,7,0,136,"Fayette, Indiana, United States"
"07-30-2020","19065","Fayette","Iowa","United States",2020-07-31 04:35:18,42.86271799,-91.8441231,75,0,0,75,"Fayette, Iowa, United States"
"07-30-2020","21067","Fayette","Kentucky","United States",2020-07-31 04:35:18,38.0368225,-84.45576892,2604,45,0,2559,"Fayette, Kentucky, United States"
"07-30-2020","39047","Fayette","Ohio","United States",2020-07-31 04:35:18,39.56021306,-83.4562016,80,0,0,80,"Fayette, Ohio, United States"
"07-30-2020","42051","Fayette","Pennsylvania","United States",2020-07-31 04:35:18,39.92041012,-79.64291195,363,4,0,359,"Fayette, Pennsylvania, United States"
"07-30-2020","47047","Fayette","Tennessee","United States",2020-07-31 04:35:18,35.19615831,-89.41399032,584,8,0,576,"Fayette, Tennessee, United States"
"07-30-2020","48149","Fayette","Texas","United States",2020-07-31 04:35:18,29.87788372,-96.92076062,365,13,0,352,"Fayette, Texas, United States"
"07-30-2020","54019","Fayette","West Virginia","United States",2020-07-31 04:35:18,38.02974928,-81.08286634,124,5,0,119,"Fayette, West Virginia, United States"
"07-30-2020",NA,"Federal Correctional Institution (FCI)","Michigan","United States",2020-07-31 04:35:18,NA,NA,193,5,0,188,"Federal Correctional Institution (FCI), Michigan, United States"
"07-30-2020","47049","Fentress","Tennessee","United States",2020-07-31 04:35:18,36.38128818,-84.92870012,66,0,0,66,"Fentress, Tennessee, United States"
"07-30-2020","30027","Fergus","Montana","United States",2020-07-31 04:35:18,47.26331584,-109.2245206,6,0,0,6,"Fergus, Montana, United States"
"07-30-2020","53019","Ferry","Washington","United States",2020-07-31 04:35:18,48.4711431,-118.5154041,12,0,0,12,"Ferry, Washington, United States"
"07-30-2020","27045","Fillmore","Minnesota","United States",2020-07-31 04:35:18,43.67394126,-92.08980382,58,0,0,58,"Fillmore, Minnesota, United States"
"07-30-2020","31059","Fillmore","Nebraska","United States",2020-07-31 04:35:18,40.52458567,-97.59646937,22,1,0,21,"Fillmore, Nebraska, United States"
"07-30-2020","20055","Finney","Kansas","United States",2020-07-31 04:35:18,38.04340344,-100.7381938,1716,10,0,1706,"Finney, Kansas, United States"
"07-30-2020","48151","Fisher","Texas","United States",2020-07-31 04:35:18,32.74281316,-100.4019302,23,1,0,22,"Fisher, Texas, United States"
"07-30-2020","12035","Flagler","Florida","United States",2020-07-31 04:35:18,29.45933576,-81.31508595,867,10,0,857,"Flagler, Florida, United States"
"07-30-2020","30029","Flathead","Montana","United States",2020-07-31 04:35:18,48.29575866,-114.0520569,220,2,0,218,"Flathead, Montana, United States"
"07-30-2020","21069","Fleming","Kentucky","United States",2020-07-31 04:35:18,38.36758311,-83.69657514,49,0,0,49,"Fleming, Kentucky, United States"
"07-30-2020","45041","Florence","South Carolina","United States",2020-07-31 04:35:18,34.02361754,-79.70189312,2789,91,0,2698,"Florence, South Carolina, United States"
"07-30-2020","55037","Florence","Wisconsin","United States",2020-07-31 04:35:18,45.84963535,-88.39804137,7,0,0,7,"Florence, Wisconsin, United States"
"07-30-2020","72054","Florida","Puerto Rico","United States",2020-07-31 04:35:18,18.373715,-66.560488,130,0,0,130,"Florida, Puerto Rico, United States"
"07-30-2020","13115","Floyd","Georgia","United States",2020-07-31 04:35:18,34.26268279,-85.21577392,1168,15,0,1153,"Floyd, Georgia, United States"
"07-30-2020","18043","Floyd","Indiana","United States",2020-07-31 04:35:18,38.32117957,-85.90385377,636,44,0,592,"Floyd, Indiana, United States"
"07-30-2020","19067","Floyd","Iowa","United States",2020-07-31 04:35:18,43.0600053,-92.78940097,105,2,0,103,"Floyd, Iowa, United States"
"07-30-2020","21071","Floyd","Kentucky","United States",2020-07-31 04:35:18,37.56213922,-82.74750924,78,1,0,77,"Floyd, Kentucky, United States"
"07-30-2020","48153","Floyd","Texas","United States",2020-07-31 04:35:18,34.07227468,-101.3031546,82,4,0,78,"Floyd, Texas, United States"
"07-30-2020","51063","Floyd","Virginia","United States",2020-07-31 04:35:18,36.9302126,-80.36738849,31,1,0,30,"Floyd, Virginia, United States"
"07-30-2020","51065","Fluvanna","Virginia","United States",2020-07-31 04:35:18,37.84157909,-78.27715475,170,8,0,162,"Fluvanna, Virginia, United States"
"07-30-2020","48155","Foard","Texas","United States",2020-07-31 04:35:18,33.97308618,-99.7767797,2,0,0,2,"Foard, Texas, United States"
"07-30-2020","55039","Fond du Lac","Wisconsin","United States",2020-07-31 04:35:18,43.75354908,-88.48885325,522,6,0,516,"Fond du Lac, Wisconsin, United States"
"07-30-2020","17053","Ford","Illinois","United States",2020-07-31 04:35:18,40.59706922,-88.22350769,38,1,0,37,"Ford, Illinois, United States"
"07-30-2020","20057","Ford","Kansas","United States",2020-07-31 04:35:18,37.69200114,-99.88825298,2017,8,0,2009,"Ford, Kansas, United States"
"07-30-2020","42053","Forest","Pennsylvania","United States",2020-07-31 04:35:18,41.51095103,-79.23229292,9,0,0,9,"Forest, Pennsylvania, United States"
"07-30-2020","55041","Forest","Wisconsin","United States",2020-07-31 04:35:18,45.66678019,-88.77084892,57,4,0,53,"Forest, Wisconsin, United States"
"07-30-2020","28035","Forrest","Mississippi","United States",2020-07-31 04:35:18,31.18961454,-89.25832496,1540,50,0,1490,"Forrest, Mississippi, United States"
"07-30-2020","13117","Forsyth","Georgia","United States",2020-07-31 04:35:18,34.22604035,-84.1231513,1796,19,0,1777,"Forsyth, Georgia, United States"
"07-30-2020","37067","Forsyth","North Carolina","United States",2020-07-31 04:35:18,36.12859861,-80.25459052,4791,49,0,4742,"Forsyth, North Carolina, United States"
"07-30-2020","48157","Fort Bend","Texas","United States",2020-07-31 04:35:18,29.52704478,-95.77219463,6960,136,0,6824,"Fort Bend, Texas, United States"
"07-30-2020","38031","Foster","North Dakota","United States",2020-07-31 04:35:18,47.4571084,-98.88279923,12,0,0,12,"Foster, North Dakota, United States"
"07-30-2020","18045","Fountain","Indiana","United States",2020-07-31 04:35:18,40.12361933,-87.24217689,60,2,0,58,"Fountain, Indiana, United States"
"07-30-2020","01059","Franklin","Alabama","United States",2020-07-31 04:35:18,34.44235334,-87.84289505,1172,20,0,1152,"Franklin, Alabama, United States"
"07-30-2020","05047","Franklin","Arkansas","United States",2020-07-31 04:35:18,35.51202821,-93.89299569,101,2,0,99,"Franklin, Arkansas, United States"
"07-30-2020","12037","Franklin","Florida","United States",2020-07-31 04:35:18,29.83791238,-84.82731662,105,1,0,104,"Franklin, Florida, United States"
"07-30-2020","13119","Franklin","Georgia","United States",2020-07-31 04:35:18,34.37525597,-83.23159927,346,4,0,342,"Franklin, Georgia, United States"
"07-30-2020","16041","Franklin","Idaho","United States",2020-07-31 04:35:18,42.18332217,-111.8149666,47,0,0,47,"Franklin, Idaho, United States"
"07-30-2020","17055","Franklin","Illinois","United States",2020-07-31 04:35:18,37.99189086,-88.92567818,110,0,0,110,"Franklin, Illinois, United States"
"07-30-2020","18047","Franklin","Indiana","United States",2020-07-31 04:35:18,39.4142482,-85.06062647,187,8,0,179,"Franklin, Indiana, United States"
"07-30-2020","19069","Franklin","Iowa","United States",2020-07-31 04:35:18,42.73270384,-93.26256925,204,4,0,200,"Franklin, Iowa, United States"
"07-30-2020","20059","Franklin","Kansas","United States",2020-07-31 04:35:18,38.56443815,-95.28644341,142,1,0,141,"Franklin, Kansas, United States"
"07-30-2020","21073","Franklin","Kentucky","United States",2020-07-31 04:35:18,38.2379395,-84.87962551,238,5,0,233,"Franklin, Kentucky, United States"
"07-30-2020","22041","Franklin","Louisiana","United States",2020-07-31 04:35:18,32.13675181,-91.67589857,759,16,0,743,"Franklin, Louisiana, United States"
"07-30-2020","23007","Franklin","Maine","United States",2020-07-31 04:35:18,44.97330019,-70.44381045,45,1,0,44,"Franklin, Maine, United States"
"07-30-2020","25011","Franklin","Massachusetts","United States",2020-07-31 04:35:18,42.58119713,-72.58602547,398,60,0,338,"Franklin, Massachusetts, United States"
"07-30-2020","28037","Franklin","Mississippi","United States",2020-07-31 04:35:18,31.47786634,-90.89672989,101,3,0,98,"Franklin, Mississippi, United States"
"07-30-2020","29071","Franklin","Missouri","United States",2020-07-31 04:35:18,38.41127108,-91.07522826,490,18,0,472,"Franklin, Missouri, United States"
"07-30-2020","31061","Franklin","Nebraska","United States",2020-07-31 04:35:18,40.17636348,-98.95299073,9,0,0,9,"Franklin, Nebraska, United States"
"07-30-2020","36033","Franklin","New York","United States",2020-07-31 04:35:18,44.59040891,-74.29926032,48,0,0,48,"Franklin, New York, United States"
"07-30-2020","37069","Franklin","North Carolina","United States",2020-07-31 04:35:18,36.081519,-78.28708884,747,25,0,722,"Franklin, North Carolina, United States"
"07-30-2020","39049","Franklin","Ohio","United States",2020-07-31 04:35:18,39.96995815,-83.01115755,16630,507,0,16123,"Franklin, Ohio, United States"
"07-30-2020","42055","Franklin","Pennsylvania","United States",2020-07-31 04:35:18,39.92956518,-77.72157791,1259,46,0,1213,"Franklin, Pennsylvania, United States"
"07-30-2020","47051","Franklin","Tennessee","United States",2020-07-31 04:35:18,35.15634626,-86.09201039,242,4,0,238,"Franklin, Tennessee, United States"
"07-30-2020","48159","Franklin","Texas","United States",2020-07-31 04:35:18,33.17653242,-95.21917243,84,1,0,83,"Franklin, Texas, United States"
"07-30-2020","50011","Franklin","Vermont","United States",2020-07-31 04:35:18,44.85627605,-72.91249563,115,6,0,109,"Franklin, Vermont, United States"
"07-30-2020","51067","Franklin","Virginia","United States",2020-07-31 04:35:18,36.99536167,-79.88023649,150,1,0,149,"Franklin, Virginia, United States"
"07-30-2020","53021","Franklin","Washington","United States",2020-07-31 04:35:18,46.53351425,-118.9018212,3210,46,0,3164,"Franklin, Washington, United States"
"07-30-2020","51620","Franklin City","Virginia","United States",2020-07-31 04:35:18,36.6831435,-76.93859681,117,6,0,111,"Franklin City, Virginia, United States"
"07-30-2020","24021","Frederick","Maryland","United States",2020-07-31 04:35:18,39.47296601,-77.39999394,2964,121,0,2843,"Frederick, Maryland, United States"
"07-30-2020","51069","Frederick","Virginia","United States",2020-07-31 04:35:18,39.20172582,-78.25974949,649,7,0,642,"Frederick, Virginia, United States"
"07-30-2020","51630","Fredericksburg","Virginia","United States",2020-07-31 04:35:18,38.2977863,-77.4922454,345,2,0,343,"Fredericksburg, Virginia, United States"
"07-30-2020","27047","Freeborn","Minnesota","United States",2020-07-31 04:35:18,43.67385583,-93.34884422,352,1,0,351,"Freeborn, Minnesota, United States"
"07-30-2020","48161","Freestone","Texas","United States",2020-07-31 04:35:18,31.70422788,-96.15072516,137,0,0,137,"Freestone, Texas, United States"
"07-30-2020","08043","Fremont","Colorado","United States",2020-07-31 04:35:18,38.47362326,-105.4399667,101,0,0,101,"Fremont, Colorado, United States"
"07-30-2020","16043","Fremont","Idaho","United States",2020-07-31 04:35:18,44.22800938,-111.4809943,44,0,0,44,"Fremont, Idaho, United States"
"07-30-2020","19071","Fremont","Iowa","United States",2020-07-31 04:35:18,40.7454272,-95.60129045,31,0,0,31,"Fremont, Iowa, United States"
"07-30-2020","56013","Fremont","Wyoming","United States",2020-07-31 04:35:18,43.04183996,-108.6296893,464,0,0,464,"Fremont, Wyoming, United States"
"07-30-2020","06019","Fresno","California","United States",2020-07-31 04:35:18,36.75733899,-119.6466953,14312,120,0,14192,"Fresno, California, United States"
"07-30-2020","48163","Frio","Texas","United States",2020-07-31 04:35:18,28.86751206,-99.10804207,458,5,0,453,"Frio, Texas, United States"
"07-30-2020","31063","Frontier","Nebraska","United States",2020-07-31 04:35:18,40.52993007,-100.3924658,3,0,0,3,"Frontier, Nebraska, United States"
"07-30-2020","05049","Fulton","Arkansas","United States",2020-07-31 04:35:18,36.38177105,-91.81729127,26,0,0,26,"Fulton, Arkansas, United States"
"07-30-2020","13121","Fulton","Georgia","United States",2020-07-31 04:35:18,33.79216944,-84.46319413,17286,383,0,16903,"Fulton, Georgia, United States"
"07-30-2020","17057","Fulton","Illinois","United States",2020-07-31 04:35:18,40.47289135,-90.20862357,25,0,0,25,"Fulton, Illinois, United States"
"07-30-2020","18049","Fulton","Indiana","United States",2020-07-31 04:35:18,41.0469907,-86.26252745,130,1,0,129,"Fulton, Indiana, United States"
"07-30-2020","21075","Fulton","Kentucky","United States",2020-07-31 04:35:18,36.55238827,-89.20140068,47,1,0,46,"Fulton, Kentucky, United States"
"07-30-2020","36035","Fulton","New York","United States",2020-07-31 04:35:18,43.11363907,-74.41798804,275,24,0,251,"Fulton, New York, United States"
"07-30-2020","39051","Fulton","Ohio","United States",2020-07-31 04:35:18,41.60213491,-84.12571393,133,0,0,133,"Fulton, Ohio, United States"
"07-30-2020","42057","Fulton","Pennsylvania","United States",2020-07-31 04:35:18,39.92913544,-78.11163677,22,2,0,20,"Fulton, Pennsylvania, United States"
"07-30-2020","31065","Furnas","Nebraska","United States",2020-07-31 04:35:18,40.17642064,-99.91247454,15,1,0,14,"Furnas, Nebraska, United States"
"07-30-2020","12039","Gadsden","Florida","United States",2020-07-31 04:35:18,30.57796289,-84.61915825,1315,17,0,1298,"Gadsden, Florida, United States"
"07-30-2020","31067","Gage","Nebraska","United States",2020-07-31 04:35:18,40.26186809,-96.68946704,78,4,0,74,"Gage, Nebraska, United States"
"07-30-2020","48165","Gaines","Texas","United States",2020-07-31 04:35:18,32.74055318,-102.6353295,114,0,0,114,"Gaines, Texas, United States"
"07-30-2020","51640","Galax","Virginia","United States",2020-07-31 04:35:18,36.66601852,-80.91703124,329,17,0,312,"Galax, Virginia, United States"
"07-30-2020","17059","Gallatin","Illinois","United States",2020-07-31 04:35:18,37.76430935,-88.22953869,42,0,0,42,"Gallatin, Illinois, United States"
"07-30-2020","21077","Gallatin","Kentucky","United States",2020-07-31 04:35:18,38.75398691,-84.8558382,77,8,0,69,"Gallatin, Kentucky, United States"
"07-30-2020","30031","Gallatin","Montana","United States",2020-07-31 04:35:18,45.54486106,-111.1692571,833,2,0,831,"Gallatin, Montana, United States"
"07-30-2020","39053","Gallia","Ohio","United States",2020-07-31 04:35:18,38.82708533,-82.31647569,49,1,0,48,"Gallia, Ohio, United States"
"07-30-2020","48167","Galveston","Texas","United States",2020-07-31 04:35:18,29.40167322,-94.90469073,8605,92,0,8513,"Galveston, Texas, United States"
"07-30-2020","31069","Garden","Nebraska","United States",2020-07-31 04:35:18,41.61703149,-102.3313973,4,0,0,4,"Garden, Nebraska, United States"
"07-30-2020","08045","Garfield","Colorado","United States",2020-07-31 04:35:18,39.59921777,-107.902708,682,4,0,678,"Garfield, Colorado, United States"
"07-30-2020","30033","Garfield","Montana","United States",2020-07-31 04:35:18,47.27545948,-107.0002351,12,0,0,12,"Garfield, Montana, United States"
"07-30-2020","31071","Garfield","Nebraska","United States",2020-07-31 04:35:18,41.91428955,-98.99111827,3,0,0,3,"Garfield, Nebraska, United States"
