"Date_Published","FIPS","Admin2","Province_State","Country_Region","Last_Update","Latitude","Longitude","Confirmed","Deaths","Recovered","Active","Combined_Key"
"08-01-2020","13101","Echols","Georgia","United States",2020-08-02 04:34:47,30.71101099,-82.89687287,218,2,0,216,"Echols, Georgia, United States"
"08-01-2020","48135","Ector","Texas","United States",2020-08-02 04:34:47,31.86898877,-102.5429428,3287,49,0,3238,"Ector, Texas, United States"
"08-01-2020","35015","Eddy","New Mexico","United States",2020-08-02 04:34:47,32.47167456,-104.3053527,247,4,0,243,"Eddy, New Mexico, United States"
"08-01-2020","38027","Eddy","North Dakota","United States",2020-08-02 04:34:47,47.71701474,-98.90432337,13,0,0,13,"Eddy, North Dakota, United States"
"08-01-2020","17045","Edgar","Illinois","United States",2020-08-02 04:34:47,39.6809186,-87.74759563,25,0,0,25,"Edgar, Illinois, United States"
"08-01-2020","37065","Edgecombe","North Carolina","United States",2020-08-02 04:34:47,35.91230639,-77.59436892,574,11,0,563,"Edgecombe, North Carolina, United States"
"08-01-2020","45037","Edgefield","South Carolina","United States",2020-08-02 04:34:47,33.77221995,-81.96231108,277,6,0,271,"Edgefield, South Carolina, United States"
"08-01-2020","21061","Edmonson","Kentucky","United States",2020-08-02 04:34:47,37.21218923,-86.23955613,91,12,0,79,"Edmonson, Kentucky, United States"
"08-01-2020","46045","Edmunds","South Dakota","United States",2020-08-02 04:34:47,45.41846445,-99.21545423,13,0,0,13,"Edmunds, South Dakota, United States"
"08-01-2020","17047","Edwards","Illinois","United States",2020-08-02 04:34:47,38.41353228,-88.05720863,13,0,0,13,"Edwards, Illinois, United States"
"08-01-2020","20047","Edwards","Kansas","United States",2020-08-02 04:34:47,37.88735543,-99.31263309,10,0,0,10,"Edwards, Kansas, United States"
"08-01-2020","48137","Edwards","Texas","United States",2020-08-02 04:34:47,29.98202582,-100.304252,24,0,0,24,"Edwards, Texas, United States"
"08-01-2020","13103","Effingham","Georgia","United States",2020-08-02 04:34:47,32.36616021,-81.34280942,626,1,0,625,"Effingham, Georgia, United States"
"08-01-2020","17049","Effingham","Illinois","United States",2020-08-02 04:34:47,39.05935711,-88.58969584,95,1,0,94,"Effingham, Illinois, United States"
"08-01-2020","06017","El Dorado","California","United States",2020-08-02 04:34:47,38.77965956,-120.5233166,637,1,0,636,"El Dorado, California, United States"
"08-01-2020","08041","El Paso","Colorado","United States",2020-08-02 04:34:47,38.83240149,-104.5251411,4541,135,0,4406,"El Paso, Colorado, United States"
"08-01-2020","48141","El Paso","Texas","United States",2020-08-02 04:34:47,31.76980765,-106.2363275,14410,248,0,14162,"El Paso, Texas, United States"
"08-01-2020","08039","Elbert","Colorado","United States",2020-08-02 04:34:47,39.28656773,-104.1358721,85,2,0,83,"Elbert, Colorado, United States"
"08-01-2020","13105","Elbert","Georgia","United States",2020-08-02 04:34:47,34.11302332,-82.83936148,323,1,0,322,"Elbert, Georgia, United States"
"08-01-2020","20049","Elk","Kansas","United States",2020-08-02 04:34:47,37.45338105,-96.24369667,1,0,0,1,"Elk, Kansas, United States"
"08-01-2020","42047","Elk","Pennsylvania","United States",2020-08-02 04:34:47,41.42822061,-78.64524744,43,2,0,41,"Elk, Pennsylvania, United States"
"08-01-2020","18039","Elkhart","Indiana","United States",2020-08-02 04:34:47,41.59761169,-85.85875695,4566,76,0,4490,"Elkhart, Indiana, United States"
"08-01-2020","32007","Elko","Nevada","United States",2020-08-02 04:34:47,41.14531606,-115.3577619,467,2,0,465,"Elko, Nevada, United States"
"08-01-2020","21063","Elliott","Kentucky","United States",2020-08-02 04:34:47,38.11624059,-83.09771563,7,0,0,7,"Elliott, Kentucky, United States"
"08-01-2020","20051","Ellis","Kansas","United States",2020-08-02 04:34:47,38.91458712,-99.31751551,128,1,0,127,"Ellis, Kansas, United States"
"08-01-2020","40045","Ellis","Oklahoma","United States",2020-08-02 04:34:47,36.2180194,-99.75324573,3,0,0,3,"Ellis, Oklahoma, United States"
"08-01-2020","48139","Ellis","Texas","United States",2020-08-02 04:34:47,32.34894117,-96.79371841,2472,34,0,2438,"Ellis, Texas, United States"
"08-01-2020","20053","Ellsworth","Kansas","United States",2020-08-02 04:34:47,38.69677695,-98.20462799,18,0,0,18,"Ellsworth, Kansas, United States"
"08-01-2020","01051","Elmore","Alabama","United States",2020-08-02 04:34:47,32.59785413,-86.14415284,1608,37,0,1571,"Elmore, Alabama, United States"
"08-01-2020","16039","Elmore","Idaho","United States",2020-08-02 04:34:47,43.3507101,-115.4701578,200,3,0,197,"Elmore, Idaho, United States"
"08-01-2020","13107","Emanuel","Georgia","United States",2020-08-02 04:34:47,32.59221302,-82.30239915,409,7,0,402,"Emanuel, Georgia, United States"
"08-01-2020","19063","Emmet","Iowa","United States",2020-08-02 04:34:47,43.37782951,-94.67858943,178,1,0,177,"Emmet, Iowa, United States"
"08-01-2020","26047","Emmet","Michigan","United States",2020-08-02 04:34:47,45.52625509,-84.89083249,56,2,0,54,"Emmet, Michigan, United States"
"08-01-2020","38029","Emmons","North Dakota","United States",2020-08-02 04:34:47,46.28398398,-100.2389766,15,1,0,14,"Emmons, North Dakota, United States"
"08-01-2020","51595","Emporia","Virginia","United States",2020-08-02 04:34:47,36.69455571,-77.53406129,165,15,0,150,"Emporia, Virginia, United States"
"08-01-2020","48143","Erath","Texas","United States",2020-08-02 04:34:47,32.23602653,-98.21773417,462,5,0,457,"Erath, Texas, United States"
"08-01-2020","36029","Erie","New York","United States",2020-08-02 04:34:47,42.76249024,-78.73063652,8548,669,0,7879,"Erie, New York, United States"
"08-01-2020","39043","Erie","Ohio","United States",2020-08-02 04:34:47,41.36796058,-82.62904521,507,18,0,489,"Erie, Ohio, United States"
"08-01-2020","42049","Erie","Pennsylvania","United States",2020-08-02 04:34:47,41.99253829,-80.03301954,954,16,0,938,"Erie, Pennsylvania, United States"
"08-01-2020","01053","Escambia","Alabama","United States",2020-08-02 04:34:47,31.1256789,-87.15918694,1019,15,0,1004,"Escambia, Alabama, United States"
"08-01-2020","12033","Escambia","Florida","United States",2020-08-02 04:34:47,30.67652764,-87.37284571,7908,97,0,7811,"Escambia, Florida, United States"
"08-01-2020","32009","Esmeralda","Nevada","United States",2020-08-02 04:34:47,37.78436681,-117.6319999,0,0,0,0,"Esmeralda, Nevada, United States"
"08-01-2020","25009","Essex","Massachusetts","United States",2020-08-02 04:34:47,42.6687626,-70.94687179,17305,1182,0,16123,"Essex, Massachusetts, United States"
"08-01-2020","34013","Essex","New Jersey","United States",2020-08-02 04:34:47,40.78681335,-74.24657979,19671,2102,0,17569,"Essex, New Jersey, United States"
"08-01-2020","36031","Essex","New York","United States",2020-08-02 04:34:47,44.11630765,-73.77297842,55,0,0,55,"Essex, New York, United States"
"08-01-2020","50009","Essex","Vermont","United States",2020-08-02 04:34:47,44.72736416,-71.73579864,4,0,0,4,"Essex, Vermont, United States"
"08-01-2020","51057","Essex","Virginia","United States",2020-08-02 04:34:47,37.93357639,-76.94230311,76,1,0,75,"Essex, Virginia, United States"
"08-01-2020","21065","Estill","Kentucky","United States",2020-08-02 04:34:47,37.69241417,-83.95956369,12,0,0,12,"Estill, Kentucky, United States"
"08-01-2020","01055","Etowah","Alabama","United States",2020-08-02 04:34:47,34.04567266,-86.04051873,1953,24,0,1929,"Etowah, Alabama, United States"
"08-01-2020","32011","Eureka","Nevada","United States",2020-08-02 04:34:47,39.98100864,-116.2683204,2,0,0,2,"Eureka, Nevada, United States"
"08-01-2020","22039","Evangeline","Louisiana","United States",2020-08-02 04:34:47,30.72985248,-92.39915924,699,2,0,697,"Evangeline, Louisiana, United States"
"08-01-2020","13109","Evans","Georgia","United States",2020-08-02 04:34:47,32.15328841,-81.8870105,210,1,0,209,"Evans, Georgia, United States"
"08-01-2020","02090","Fairbanks North Star","Alaska","United States",2020-08-02 04:34:47,64.80726247,-146.5692662,403,5,0,398,"Fairbanks North Star, Alaska, United States"
"08-01-2020","51059","Fairfax","Virginia","United States",2020-08-02 04:34:47,38.83677558,-77.27565836,15689,522,0,15167,"Fairfax, Virginia, United States"
"08-01-2020","51600","Fairfax City","Virginia","United States",2020-08-02 04:34:47,38.85157547,-77.2977964,80,7,0,73,"Fairfax City, Virginia, United States"
"08-01-2020","09001","Fairfield","Connecticut","United States",2020-08-02 04:34:47,41.26809896,-73.3881171,17793,1406,0,16387,"Fairfield, Connecticut, United States"
"08-01-2020","39045","Fairfield","Ohio","United States",2020-08-02 04:34:47,39.75107189,-82.63088163,1228,25,0,1203,"Fairfield, Ohio, United States"
"08-01-2020","45039","Fairfield","South Carolina","United States",2020-08-02 04:34:47,34.39287073,-81.1195624,531,23,0,508,"Fairfield, South Carolina, United States"
"08-01-2020","72053","Fajardo","Puerto Rico","United States",2020-08-02 04:34:47,18.318373,-65.666866,196,0,0,196,"Fajardo, Puerto Rico, United States"
"08-01-2020","46047","Fall River","South Dakota","United States",2020-08-02 04:34:47,43.23929297,-103.5275691,15,0,0,15,"Fall River, South Dakota, United States"
"08-01-2020","30025","Fallon","Montana","United States",2020-08-02 04:34:47,46.33478338,-104.4183565,2,0,0,2,"Fallon, Montana, United States"
"08-01-2020","48145","Falls","Texas","United States",2020-08-02 04:34:47,31.25350609,-96.93630086,110,2,0,108,"Falls, Texas, United States"
"08-01-2020","51610","Falls Church","Virginia","United States",2020-08-02 04:34:47,38.88485255,-77.17560759,59,6,0,53,"Falls Church, Virginia, United States"
"08-01-2020","13111","Fannin","Georgia","United States",2020-08-02 04:34:47,34.86430205,-84.316964,270,2,0,268,"Fannin, Georgia, United States"
"08-01-2020","48147","Fannin","Texas","United States",2020-08-02 04:34:47,33.59564294,-96.10751083,214,8,0,206,"Fannin, Texas, United States"
"08-01-2020","27043","Faribault","Minnesota","United States",2020-08-02 04:34:47,43.67381499,-93.94787458,82,0,0,82,"Faribault, Minnesota, United States"
"08-01-2020","46049","Faulk","South Dakota","United States",2020-08-02 04:34:47,45.07082625,-99.14535601,26,1,0,25,"Faulk, South Dakota, United States"
"08-01-2020","05045","Faulkner","Arkansas","United States",2020-08-02 04:34:47,35.14719007,-92.33717519,1190,5,0,1185,"Faulkner, Arkansas, United States"
"08-01-2020","51061","Fauquier","Virginia","United States",2020-08-02 04:34:47,38.73564842,-77.80647472,572,8,0,564,"Fauquier, Virginia, United States"
"08-01-2020","01057","Fayette","Alabama","United States",2020-08-02 04:34:47,33.72076938,-87.73886638,190,5,0,185,"Fayette, Alabama, United States"
"08-01-2020","13113","Fayette","Georgia","United States",2020-08-02 04:34:47,33.41357794,-84.49089434,949,25,0,924,"Fayette, Georgia, United States"
"08-01-2020","17051","Fayette","Illinois","United States",2020-08-02 04:34:47,39.00072038,-89.02452658,54,3,0,51,"Fayette, Illinois, United States"
"08-01-2020","18041","Fayette","Indiana","United States",2020-08-02 04:34:47,39.63684962,-85.17797541,150,7,0,143,"Fayette, Indiana, United States"
"08-01-2020","19065","Fayette","Iowa","United States",2020-08-02 04:34:47,42.86271799,-91.8441231,77,0,0,77,"Fayette, Iowa, United States"
"08-01-2020","21067","Fayette","Kentucky","United States",2020-08-02 04:34:47,38.0368225,-84.45576892,2697,46,0,2651,"Fayette, Kentucky, United States"
"08-01-2020","39047","Fayette","Ohio","United States",2020-08-02 04:34:47,39.56021306,-83.4562016,91,0,0,91,"Fayette, Ohio, United States"
"08-01-2020","42051","Fayette","Pennsylvania","United States",2020-08-02 04:34:47,39.92041012,-79.64291195,403,4,0,399,"Fayette, Pennsylvania, United States"
"08-01-2020","47047","Fayette","Tennessee","United States",2020-08-02 04:34:47,35.19615831,-89.41399032,616,8,0,608,"Fayette, Tennessee, United States"
"08-01-2020","48149","Fayette","Texas","United States",2020-08-02 04:34:47,29.87788372,-96.92076062,367,13,0,354,"Fayette, Texas, United States"
"08-01-2020","54019","Fayette","West Virginia","United States",2020-08-02 04:34:47,38.02974928,-81.08286634,129,5,0,124,"Fayette, West Virginia, United States"
"08-01-2020",NA,"Federal Correctional Institution (FCI)","Michigan","United States",2020-08-02 04:34:47,NA,NA,194,5,0,189,"Federal Correctional Institution (FCI), Michigan, United States"
"08-01-2020","47049","Fentress","Tennessee","United States",2020-08-02 04:34:47,36.38128818,-84.92870012,73,0,0,73,"Fentress, Tennessee, United States"
"08-01-2020","30027","Fergus","Montana","United States",2020-08-02 04:34:47,47.26331584,-109.2245206,6,0,0,6,"Fergus, Montana, United States"
"08-01-2020","53019","Ferry","Washington","United States",2020-08-02 04:34:47,48.4711431,-118.5154041,18,0,0,18,"Ferry, Washington, United States"
"08-01-2020","27045","Fillmore","Minnesota","United States",2020-08-02 04:34:47,43.67394126,-92.08980382,61,0,0,61,"Fillmore, Minnesota, United States"
"08-01-2020","31059","Fillmore","Nebraska","United States",2020-08-02 04:34:47,40.52458567,-97.59646937,23,1,0,22,"Fillmore, Nebraska, United States"
"08-01-2020","20055","Finney","Kansas","United States",2020-08-02 04:34:47,38.04340344,-100.7381938,1737,10,0,1727,"Finney, Kansas, United States"
"08-01-2020","48151","Fisher","Texas","United States",2020-08-02 04:34:47,32.74281316,-100.4019302,24,1,0,23,"Fisher, Texas, United States"
"08-01-2020","12035","Flagler","Florida","United States",2020-08-02 04:34:47,29.45933576,-81.31508595,919,10,0,909,"Flagler, Florida, United States"
"08-01-2020","30029","Flathead","Montana","United States",2020-08-02 04:34:47,48.29575866,-114.0520569,253,2,0,251,"Flathead, Montana, United States"
"08-01-2020","21069","Fleming","Kentucky","United States",2020-08-02 04:34:47,38.36758311,-83.69657514,54,0,0,54,"Fleming, Kentucky, United States"
"08-01-2020","45041","Florence","South Carolina","United States",2020-08-02 04:34:47,34.02361754,-79.70189312,2938,96,0,2842,"Florence, South Carolina, United States"
"08-01-2020","55037","Florence","Wisconsin","United States",2020-08-02 04:34:47,45.84963535,-88.39804137,7,0,0,7,"Florence, Wisconsin, United States"
"08-01-2020","72054","Florida","Puerto Rico","United States",2020-08-02 04:34:47,18.373715,-66.560488,141,0,0,141,"Florida, Puerto Rico, United States"
"08-01-2020","13115","Floyd","Georgia","United States",2020-08-02 04:34:47,34.26268279,-85.21577392,1243,15,0,1228,"Floyd, Georgia, United States"
"08-01-2020","18043","Floyd","Indiana","United States",2020-08-02 04:34:47,38.32117957,-85.90385377,665,44,0,621,"Floyd, Indiana, United States"
"08-01-2020","19067","Floyd","Iowa","United States",2020-08-02 04:34:47,43.0600053,-92.78940097,116,2,0,114,"Floyd, Iowa, United States"
"08-01-2020","21071","Floyd","Kentucky","United States",2020-08-02 04:34:47,37.56213922,-82.74750924,81,1,0,80,"Floyd, Kentucky, United States"
"08-01-2020","48153","Floyd","Texas","United States",2020-08-02 04:34:47,34.07227468,-101.3031546,83,5,0,78,"Floyd, Texas, United States"
"08-01-2020","51063","Floyd","Virginia","United States",2020-08-02 04:34:47,36.9302126,-80.36738849,33,1,0,32,"Floyd, Virginia, United States"
"08-01-2020","51065","Fluvanna","Virginia","United States",2020-08-02 04:34:47,37.84157909,-78.27715475,173,8,0,165,"Fluvanna, Virginia, United States"
"08-01-2020","48155","Foard","Texas","United States",2020-08-02 04:34:47,33.97308618,-99.7767797,2,0,0,2,"Foard, Texas, United States"
"08-01-2020","55039","Fond du Lac","Wisconsin","United States",2020-08-02 04:34:47,43.75354908,-88.48885325,545,6,0,539,"Fond du Lac, Wisconsin, United States"
"08-01-2020","17053","Ford","Illinois","United States",2020-08-02 04:34:47,40.59706922,-88.22350769,39,1,0,38,"Ford, Illinois, United States"
"08-01-2020","20057","Ford","Kansas","United States",2020-08-02 04:34:47,37.69200114,-99.88825298,2026,8,0,2018,"Ford, Kansas, United States"
"08-01-2020","42053","Forest","Pennsylvania","United States",2020-08-02 04:34:47,41.51095103,-79.23229292,9,0,0,9,"Forest, Pennsylvania, United States"
"08-01-2020","55041","Forest","Wisconsin","United States",2020-08-02 04:34:47,45.66678019,-88.77084892,59,4,0,55,"Forest, Wisconsin, United States"
"08-01-2020","28035","Forrest","Mississippi","United States",2020-08-02 04:34:47,31.18961454,-89.25832496,1615,51,0,1564,"Forrest, Mississippi, United States"
"08-01-2020","13117","Forsyth","Georgia","United States",2020-08-02 04:34:47,34.22604035,-84.1231513,1898,19,0,1879,"Forsyth, Georgia, United States"
"08-01-2020","37067","Forsyth","North Carolina","United States",2020-08-02 04:34:47,36.12859861,-80.25459052,4883,49,0,4834,"Forsyth, North Carolina, United States"
"08-01-2020","48157","Fort Bend","Texas","United States",2020-08-02 04:34:47,29.52704478,-95.77219463,7082,145,0,6937,"Fort Bend, Texas, United States"
"08-01-2020","38031","Foster","North Dakota","United States",2020-08-02 04:34:47,47.4571084,-98.88279923,17,0,0,17,"Foster, North Dakota, United States"
"08-01-2020","18045","Fountain","Indiana","United States",2020-08-02 04:34:47,40.12361933,-87.24217689,62,2,0,60,"Fountain, Indiana, United States"
"08-01-2020","01059","Franklin","Alabama","United States",2020-08-02 04:34:47,34.44235334,-87.84289505,1198,20,0,1178,"Franklin, Alabama, United States"
"08-01-2020","05047","Franklin","Arkansas","United States",2020-08-02 04:34:47,35.51202821,-93.89299569,105,2,0,103,"Franklin, Arkansas, United States"
"08-01-2020","12037","Franklin","Florida","United States",2020-08-02 04:34:47,29.83791238,-84.82731662,116,2,0,114,"Franklin, Florida, United States"
"08-01-2020","13119","Franklin","Georgia","United States",2020-08-02 04:34:47,34.37525597,-83.23159927,354,4,0,350,"Franklin, Georgia, United States"
"08-01-2020","16041","Franklin","Idaho","United States",2020-08-02 04:34:47,42.18332217,-111.8149666,47,0,0,47,"Franklin, Idaho, United States"
"08-01-2020","17055","Franklin","Illinois","United States",2020-08-02 04:34:47,37.99189086,-88.92567818,118,0,0,118,"Franklin, Illinois, United States"
"08-01-2020","18047","Franklin","Indiana","United States",2020-08-02 04:34:47,39.4142482,-85.06062647,197,10,0,187,"Franklin, Indiana, United States"
"08-01-2020","19069","Franklin","Iowa","United States",2020-08-02 04:34:47,42.73270384,-93.26256925,212,4,0,208,"Franklin, Iowa, United States"
"08-01-2020","20059","Franklin","Kansas","United States",2020-08-02 04:34:47,38.56443815,-95.28644341,149,1,0,148,"Franklin, Kansas, United States"
"08-01-2020","21073","Franklin","Kentucky","United States",2020-08-02 04:34:47,38.2379395,-84.87962551,250,5,0,245,"Franklin, Kentucky, United States"
"08-01-2020","22041","Franklin","Louisiana","United States",2020-08-02 04:34:47,32.13675181,-91.67589857,785,16,0,769,"Franklin, Louisiana, United States"
"08-01-2020","23007","Franklin","Maine","United States",2020-08-02 04:34:47,44.97330019,-70.44381045,45,1,0,44,"Franklin, Maine, United States"
"08-01-2020","25011","Franklin","Massachusetts","United States",2020-08-02 04:34:47,42.58119713,-72.58602547,404,60,0,344,"Franklin, Massachusetts, United States"
"08-01-2020","28037","Franklin","Mississippi","United States",2020-08-02 04:34:47,31.47786634,-90.89672989,111,2,0,109,"Franklin, Mississippi, United States"
"08-01-2020","29071","Franklin","Missouri","United States",2020-08-02 04:34:47,38.41127108,-91.07522826,516,18,0,498,"Franklin, Missouri, United States"
"08-01-2020","31061","Franklin","Nebraska","United States",2020-08-02 04:34:47,40.17636348,-98.95299073,9,0,0,9,"Franklin, Nebraska, United States"
"08-01-2020","36033","Franklin","New York","United States",2020-08-02 04:34:47,44.59040891,-74.29926032,50,0,0,50,"Franklin, New York, United States"
"08-01-2020","37069","Franklin","North Carolina","United States",2020-08-02 04:34:47,36.081519,-78.28708884,774,25,0,749,"Franklin, North Carolina, United States"
"08-01-2020","39049","Franklin","Ohio","United States",2020-08-02 04:34:47,39.96995815,-83.01115755,16952,419,0,16533,"Franklin, Ohio, United States"
"08-01-2020","42055","Franklin","Pennsylvania","United States",2020-08-02 04:34:47,39.92956518,-77.72157791,1276,46,0,1230,"Franklin, Pennsylvania, United States"
"08-01-2020","47051","Franklin","Tennessee","United States",2020-08-02 04:34:47,35.15634626,-86.09201039,271,4,0,267,"Franklin, Tennessee, United States"
"08-01-2020","48159","Franklin","Texas","United States",2020-08-02 04:34:47,33.17653242,-95.21917243,84,1,0,83,"Franklin, Texas, United States"
"08-01-2020","50011","Franklin","Vermont","United States",2020-08-02 04:34:47,44.85627605,-72.91249563,117,6,0,111,"Franklin, Vermont, United States"
"08-01-2020","51067","Franklin","Virginia","United States",2020-08-02 04:34:47,36.99536167,-79.88023649,156,1,0,155,"Franklin, Virginia, United States"
"08-01-2020","53021","Franklin","Washington","United States",2020-08-02 04:34:47,46.53351425,-118.9018212,3343,45,0,3298,"Franklin, Washington, United States"
"08-01-2020","51620","Franklin City","Virginia","United States",2020-08-02 04:34:47,36.6831435,-76.93859681,120,6,0,114,"Franklin City, Virginia, United States"
"08-01-2020","24021","Frederick","Maryland","United States",2020-08-02 04:34:47,39.47296601,-77.39999394,2989,121,0,2868,"Frederick, Maryland, United States"
"08-01-2020","51069","Frederick","Virginia","United States",2020-08-02 04:34:47,39.20172582,-78.25974949,661,9,0,652,"Frederick, Virginia, United States"
"08-01-2020","51630","Fredericksburg","Virginia","United States",2020-08-02 04:34:47,38.2977863,-77.4922454,356,2,0,354,"Fredericksburg, Virginia, United States"
"08-01-2020","27047","Freeborn","Minnesota","United States",2020-08-02 04:34:47,43.67385583,-93.34884422,354,1,0,353,"Freeborn, Minnesota, United States"
"08-01-2020","48161","Freestone","Texas","United States",2020-08-02 04:34:47,31.70422788,-96.15072516,138,0,0,138,"Freestone, Texas, United States"
"08-01-2020","08043","Fremont","Colorado","United States",2020-08-02 04:34:47,38.47362326,-105.4399667,110,0,0,110,"Fremont, Colorado, United States"
"08-01-2020","16043","Fremont","Idaho","United States",2020-08-02 04:34:47,44.22800938,-111.4809943,50,0,0,50,"Fremont, Idaho, United States"
"08-01-2020","19071","Fremont","Iowa","United States",2020-08-02 04:34:47,40.7454272,-95.60129045,35,0,0,35,"Fremont, Iowa, United States"
"08-01-2020","56013","Fremont","Wyoming","United States",2020-08-02 04:34:47,43.04183996,-108.6296893,473,0,0,473,"Fremont, Wyoming, United States"
"08-01-2020","06019","Fresno","California","United States",2020-08-02 04:34:47,36.75733899,-119.6466953,14439,138,0,14301,"Fresno, California, United States"
"08-01-2020","48163","Frio","Texas","United States",2020-08-02 04:34:47,28.86751206,-99.10804207,475,5,0,470,"Frio, Texas, United States"
"08-01-2020","31063","Frontier","Nebraska","United States",2020-08-02 04:34:47,40.52993007,-100.3924658,3,0,0,3,"Frontier, Nebraska, United States"
"08-01-2020","05049","Fulton","Arkansas","United States",2020-08-02 04:34:47,36.38177105,-91.81729127,27,0,0,27,"Fulton, Arkansas, United States"
"08-01-2020","13121","Fulton","Georgia","United States",2020-08-02 04:34:47,33.79216944,-84.46319413,17858,398,0,17460,"Fulton, Georgia, United States"
"08-01-2020","17057","Fulton","Illinois","United States",2020-08-02 04:34:47,40.47289135,-90.20862357,25,0,0,25,"Fulton, Illinois, United States"
"08-01-2020","18049","Fulton","Indiana","United States",2020-08-02 04:34:47,41.0469907,-86.26252745,139,1,0,138,"Fulton, Indiana, United States"
"08-01-2020","21075","Fulton","Kentucky","United States",2020-08-02 04:34:47,36.55238827,-89.20140068,56,1,0,55,"Fulton, Kentucky, United States"
"08-01-2020","36035","Fulton","New York","United States",2020-08-02 04:34:47,43.11363907,-74.41798804,282,24,0,258,"Fulton, New York, United States"
"08-01-2020","39051","Fulton","Ohio","United States",2020-08-02 04:34:47,41.60213491,-84.12571393,138,5,0,133,"Fulton, Ohio, United States"
"08-01-2020","42057","Fulton","Pennsylvania","United States",2020-08-02 04:34:47,39.92913544,-78.11163677,22,2,0,20,"Fulton, Pennsylvania, United States"
"08-01-2020","31065","Furnas","Nebraska","United States",2020-08-02 04:34:47,40.17642064,-99.91247454,15,1,0,14,"Furnas, Nebraska, United States"
"08-01-2020","12039","Gadsden","Florida","United States",2020-08-02 04:34:47,30.57796289,-84.61915825,1437,19,0,1418,"Gadsden, Florida, United States"
"08-01-2020","31067","Gage","Nebraska","United States",2020-08-02 04:34:47,40.26186809,-96.68946704,81,4,0,77,"Gage, Nebraska, United States"
"08-01-2020","48165","Gaines","Texas","United States",2020-08-02 04:34:47,32.74055318,-102.6353295,132,0,0,132,"Gaines, Texas, United States"
"08-01-2020","51640","Galax","Virginia","United States",2020-08-02 04:34:47,36.66601852,-80.91703124,331,21,0,310,"Galax, Virginia, United States"
"08-01-2020","17059","Gallatin","Illinois","United States",2020-08-02 04:34:47,37.76430935,-88.22953869,43,0,0,43,"Gallatin, Illinois, United States"
"08-01-2020","21077","Gallatin","Kentucky","United States",2020-08-02 04:34:47,38.75398691,-84.8558382,79,8,0,71,"Gallatin, Kentucky, United States"
"08-01-2020","30031","Gallatin","Montana","United States",2020-08-02 04:34:47,45.54486106,-111.1692571,864,3,0,861,"Gallatin, Montana, United States"
"08-01-2020","39053","Gallia","Ohio","United States",2020-08-02 04:34:47,38.82708533,-82.31647569,58,2,0,56,"Gallia, Ohio, United States"
"08-01-2020","48167","Galveston","Texas","United States",2020-08-02 04:34:47,29.40167322,-94.90469073,8721,97,0,8624,"Galveston, Texas, United States"
"08-01-2020","31069","Garden","Nebraska","United States",2020-08-02 04:34:47,41.61703149,-102.3313973,4,0,0,4,"Garden, Nebraska, United States"
"08-01-2020","08045","Garfield","Colorado","United States",2020-08-02 04:34:47,39.59921777,-107.902708,705,4,0,701,"Garfield, Colorado, United States"
"08-01-2020","30033","Garfield","Montana","United States",2020-08-02 04:34:47,47.27545948,-107.0002351,12,0,0,12,"Garfield, Montana, United States"
