"Date_Published","FIPS","Admin2","Province_State","Country_Region","Last_Update","Latitude","Longitude","Confirmed","Deaths","Recovered","Active","Combined_Key"
"08-01-2020","45001","Abbeville","South Carolina","United States",2020-08-02 04:34:47,34.22333378,-82.46170658,288,7,0,281,"Abbeville, South Carolina, United States"
"08-01-2020","22001","Acadia","Louisiana","United States",2020-08-02 04:34:47,30.2950649,-92.41419698,2331,71,0,2260,"Acadia, Louisiana, United States"
"08-01-2020","51001","Accomack","Virginia","United States",2020-08-02 04:34:47,37.76707161,-75.63234615,1077,15,0,1062,"Accomack, Virginia, United States"
"08-01-2020","16001","Ada","Idaho","United States",2020-08-02 04:34:47,43.4526575,-116.2415516,8004,62,0,7942,"Ada, Idaho, United States"
"08-01-2020","19001","Adair","Iowa","United States",2020-08-02 04:34:47,41.33075609,-94.47105874,20,0,0,20,"Adair, Iowa, United States"
"08-01-2020","21001","Adair","Kentucky","United States",2020-08-02 04:34:47,37.10459774,-85.28129668,201,19,0,182,"Adair, Kentucky, United States"
"08-01-2020","29001","Adair","Missouri","United States",2020-08-02 04:34:47,40.19058551,-92.60078167,134,0,0,134,"Adair, Missouri, United States"
"08-01-2020","40001","Adair","Oklahoma","United States",2020-08-02 04:34:47,35.88494195,-94.65859267,289,5,0,284,"Adair, Oklahoma, United States"
"08-01-2020","08001","Adams","Colorado","United States",2020-08-02 04:34:47,39.87432092,-104.3362578,6018,171,0,5847,"Adams, Colorado, United States"
"08-01-2020","16003","Adams","Idaho","United States",2020-08-02 04:34:47,44.89333571,-116.4545247,18,0,0,18,"Adams, Idaho, United States"
"08-01-2020","17001","Adams","Illinois","United States",2020-08-02 04:34:47,39.98815591,-91.18786813,410,1,0,409,"Adams, Illinois, United States"
"08-01-2020","18001","Adams","Indiana","United States",2020-08-02 04:34:47,40.7457653,-84.93671406,79,2,0,77,"Adams, Indiana, United States"
"08-01-2020","19003","Adams","Iowa","United States",2020-08-02 04:34:47,41.02903567,-94.69932645,16,0,0,16,"Adams, Iowa, United States"
"08-01-2020","28001","Adams","Mississippi","United States",2020-08-02 04:34:47,31.47669768,-91.35326037,578,25,0,553,"Adams, Mississippi, United States"
"08-01-2020","31001","Adams","Nebraska","United States",2020-08-02 04:34:47,40.5244942,-98.50117804,340,11,0,329,"Adams, Nebraska, United States"
"08-01-2020","38001","Adams","North Dakota","United States",2020-08-02 04:34:47,46.09686891,-102.5285397,2,0,0,2,"Adams, North Dakota, United States"
"08-01-2020","39001","Adams","Ohio","United States",2020-08-02 04:34:47,38.84541072,-83.4718964,53,1,0,52,"Adams, Ohio, United States"
"08-01-2020","42001","Adams","Pennsylvania","United States",2020-08-02 04:34:47,39.87140411,-77.21610347,469,20,0,449,"Adams, Pennsylvania, United States"
"08-01-2020","53001","Adams","Washington","United States",2020-08-02 04:34:47,46.98299757,-118.5601734,394,4,0,390,"Adams, Washington, United States"
"08-01-2020","55001","Adams","Wisconsin","United States",2020-08-02 04:34:47,43.96974651,-89.76782777,69,2,0,67,"Adams, Wisconsin, United States"
"08-01-2020","50001","Addison","Vermont","United States",2020-08-02 04:34:47,44.03217337,-73.14130877,72,2,0,70,"Addison, Vermont, United States"
"08-01-2020","72001","Adjuntas","Puerto Rico","United States",2020-08-02 04:34:47,18.180117,-66.754367,85,0,0,85,"Adjuntas, Puerto Rico, United States"
"08-01-2020","72003","Aguada","Puerto Rico","United States",2020-08-02 04:34:47,18.360255,-67.175131,101,0,0,101,"Aguada, Puerto Rico, United States"
"08-01-2020","72005","Aguadilla","Puerto Rico","United States",2020-08-02 04:34:47,18.459681,-67.120815,180,0,0,180,"Aguadilla, Puerto Rico, United States"
"08-01-2020","72007","Aguas Buenas","Puerto Rico","United States",2020-08-02 04:34:47,18.251619,-66.126806,107,0,0,107,"Aguas Buenas, Puerto Rico, United States"
"08-01-2020","72009","Aibonito","Puerto Rico","United States",2020-08-02 04:34:47,18.131361,-66.264131,76,0,0,76,"Aibonito, Puerto Rico, United States"
"08-01-2020","45003","Aiken","South Carolina","United States",2020-08-02 04:34:47,33.54338026,-81.63645384,1538,26,0,1512,"Aiken, South Carolina, United States"
"08-01-2020","27001","Aitkin","Minnesota","United States",2020-08-02 04:34:47,46.60962049,-93.4116826,28,0,0,28,"Aitkin, Minnesota, United States"
"08-01-2020","12001","Alachua","Florida","United States",2020-08-02 04:34:47,29.67866525,-82.35928158,3590,21,0,3569,"Alachua, Florida, United States"
"08-01-2020","37001","Alamance","North Carolina","United States",2020-08-02 04:34:47,36.0434701,-79.39976137,2189,41,0,2148,"Alamance, North Carolina, United States"
"08-01-2020","06001","Alameda","California","United States",2020-08-02 04:34:47,37.64629437,-121.8929271,11484,189,0,11295,"Alameda, California, United States"
"08-01-2020","08003","Alamosa","Colorado","United States",2020-08-02 04:34:47,37.57250606,-105.7885451,224,9,0,215,"Alamosa, Colorado, United States"
"08-01-2020","36001","Albany","New York","United States",2020-08-02 04:34:47,42.60060306,-73.97723916,2515,126,0,2389,"Albany, New York, United States"
"08-01-2020","56001","Albany","Wyoming","United States",2020-08-02 04:34:47,41.65498705,-105.7235415,85,0,0,85,"Albany, Wyoming, United States"
"08-01-2020","51003","Albemarle","Virginia","United States",2020-08-02 04:34:47,38.02080697,-78.55481085,741,12,0,729,"Albemarle, Virginia, United States"
"08-01-2020","26001","Alcona","Michigan","United States",2020-08-02 04:34:47,44.6846864,-83.59507875,28,1,0,27,"Alcona, Michigan, United States"
"08-01-2020","28003","Alcorn","Mississippi","United States",2020-08-02 04:34:47,34.88084463,-88.57996173,349,4,0,345,"Alcorn, Mississippi, United States"
"08-01-2020","02013","Aleutians East","Alaska","United States",2020-08-02 04:34:47,55.32222414,-161.9722021,1,0,0,1,"Aleutians East, Alaska, United States"
"08-01-2020","02016","Aleutians West","Alaska","United States",2020-08-02 04:34:47,52.3233,-174.1596,5,0,0,5,"Aleutians West, Alaska, United States"
"08-01-2020","17003","Alexander","Illinois","United States",2020-08-02 04:34:47,37.18049267,-89.32910838,36,0,0,36,"Alexander, Illinois, United States"
"08-01-2020","37003","Alexander","North Carolina","United States",2020-08-02 04:34:47,35.9223796,-81.17751948,295,2,0,293,"Alexander, North Carolina, United States"
"08-01-2020","51510","Alexandria","Virginia","United States",2020-08-02 04:34:47,38.814003,-77.08183073,2811,59,0,2752,"Alexandria, Virginia, United States"
"08-01-2020","40003","Alfalfa","Oklahoma","United States",2020-08-02 04:34:47,36.73090616,-98.32408495,3,0,0,3,"Alfalfa, Oklahoma, United States"
"08-01-2020","26003","Alger","Michigan","United States",2020-08-02 04:34:47,46.41292944,-86.60260122,8,0,0,8,"Alger, Michigan, United States"
"08-01-2020","19005","Allamakee","Iowa","United States",2020-08-02 04:34:47,43.28383218,-91.37860922,149,4,0,145,"Allamakee, Iowa, United States"
"08-01-2020","26005","Allegan","Michigan","United States",2020-08-02 04:34:47,42.59147037,-85.89102866,498,7,0,491,"Allegan, Michigan, United States"
"08-01-2020","24001","Allegany","Maryland","United States",2020-08-02 04:34:47,39.62357628,-78.69280486,267,18,0,249,"Allegany, Maryland, United States"
"08-01-2020","36003","Allegany","New York","United States",2020-08-02 04:34:47,42.25748406,-78.02750466,74,1,0,73,"Allegany, New York, United States"
"08-01-2020","37005","Alleghany","North Carolina","United States",2020-08-02 04:34:47,36.49360862,-81.12857041,67,0,0,67,"Alleghany, North Carolina, United States"
"08-01-2020","51005","Alleghany","Virginia","United States",2020-08-02 04:34:47,37.78636074,-80.00222498,56,3,0,53,"Alleghany, Virginia, United States"
"08-01-2020","42003","Allegheny","Pennsylvania","United States",2020-08-02 04:34:47,40.46809875,-79.98167747,8160,233,0,7927,"Allegheny, Pennsylvania, United States"
"08-01-2020","18003","Allen","Indiana","United States",2020-08-02 04:34:47,41.09194313,-85.06800636,3557,157,0,3400,"Allen, Indiana, United States"
"08-01-2020","20001","Allen","Kansas","United States",2020-08-02 04:34:47,37.88582951,-95.30030847,14,0,0,14,"Allen, Kansas, United States"
"08-01-2020","21003","Allen","Kentucky","United States",2020-08-02 04:34:47,36.75197631,-86.19457544,217,8,0,209,"Allen, Kentucky, United States"
"08-01-2020","22003","Allen","Louisiana","United States",2020-08-02 04:34:47,30.65385745,-92.82442028,1036,19,0,1017,"Allen, Louisiana, United States"
"08-01-2020","39003","Allen","Ohio","United States",2020-08-02 04:34:47,40.77285242,-84.10802343,635,36,0,599,"Allen, Ohio, United States"
"08-01-2020","45005","Allendale","South Carolina","United States",2020-08-02 04:34:47,32.98837386,-81.35321066,179,3,0,176,"Allendale, South Carolina, United States"
"08-01-2020","26007","Alpena","Michigan","United States",2020-08-02 04:34:47,45.03477666,-83.62212411,125,13,0,112,"Alpena, Michigan, United States"
"08-01-2020","06003","Alpine","California","United States",2020-08-02 04:34:47,38.59678594,-119.8223594,2,0,0,2,"Alpine, California, United States"
"08-01-2020","06005","Amador","California","United States",2020-08-02 04:34:47,38.44583082,-120.65696,125,0,0,125,"Amador, California, United States"
"08-01-2020","51007","Amelia","Virginia","United States",2020-08-02 04:34:47,37.34081025,-77.98584649,73,1,0,72,"Amelia, Virginia, United States"
"08-01-2020","51009","Amherst","Virginia","United States",2020-08-02 04:34:47,37.60308293,-79.14548696,108,0,0,108,"Amherst, Virginia, United States"
"08-01-2020","28005","Amite","Mississippi","United States",2020-08-02 04:34:47,31.17467303,-90.80501621,204,5,0,199,"Amite, Mississippi, United States"
"08-01-2020","72011","Anasco","Puerto Rico","United States",2020-08-02 04:34:47,18.287985,-67.120611,122,0,0,122,"Anasco, Puerto Rico, United States"
"08-01-2020","02020","Anchorage","Alaska","United States",2020-08-02 04:34:47,61.14998174,-149.1426986,1769,12,0,1757,"Anchorage, Alaska, United States"
"08-01-2020","20003","Anderson","Kansas","United States",2020-08-02 04:34:47,38.21413251,-95.29272815,27,0,0,27,"Anderson, Kansas, United States"
"08-01-2020","21005","Anderson","Kentucky","United States",2020-08-02 04:34:47,38.00671029,-84.99171713,74,1,0,73,"Anderson, Kentucky, United States"
"08-01-2020","45007","Anderson","South Carolina","United States",2020-08-02 04:34:47,34.51828081,-82.63959517,2059,46,0,2013,"Anderson, South Carolina, United States"
"08-01-2020","47001","Anderson","Tennessee","United States",2020-08-02 04:34:47,36.12684348,-84.19965764,583,5,0,578,"Anderson, Tennessee, United States"
"08-01-2020","48001","Anderson","Texas","United States",2020-08-02 04:34:47,31.81534745,-95.65354823,2209,8,0,2201,"Anderson, Texas, United States"
"08-01-2020","29003","Andrew","Missouri","United States",2020-08-02 04:34:47,39.98492163,-94.80163024,83,1,0,82,"Andrew, Missouri, United States"
"08-01-2020","48003","Andrews","Texas","United States",2020-08-02 04:34:47,32.30468633,-102.6376548,255,6,0,249,"Andrews, Texas, United States"
"08-01-2020","23001","Androscoggin","Maine","United States",2020-08-02 04:34:47,44.1664747,-70.20380627,550,7,0,543,"Androscoggin, Maine, United States"
"08-01-2020","48005","Angelina","Texas","United States",2020-08-02 04:34:47,31.25457347,-94.60901487,1647,35,0,1612,"Angelina, Texas, United States"
"08-01-2020","24003","Anne Arundel","Maryland","United States",2020-08-02 04:34:47,39.00670238,-76.60329337,6855,217,0,6638,"Anne Arundel, Maryland, United States"
"08-01-2020","27003","Anoka","Minnesota","United States",2020-08-02 04:34:47,45.27476015,-93.24604565,3277,112,0,3165,"Anoka, Minnesota, United States"
"08-01-2020","37007","Anson","North Carolina","United States",2020-08-02 04:34:47,34.97403241,-80.09953279,301,2,0,299,"Anson, North Carolina, United States"
"08-01-2020","31003","Antelope","Nebraska","United States",2020-08-02 04:34:47,42.17695516,-98.0666283,18,1,0,17,"Antelope, Nebraska, United States"
"08-01-2020","26009","Antrim","Michigan","United States",2020-08-02 04:34:47,44.99690221,-85.15503082,36,0,0,36,"Antrim, Michigan, United States"
"08-01-2020","04001","Apache","Arizona","United States",2020-08-02 04:34:47,35.39465006,-109.4892383,3054,135,0,2919,"Apache, Arizona, United States"
"08-01-2020","19007","Appanoose","Iowa","United States",2020-08-02 04:34:47,40.74324454,-92.86865906,40,3,0,37,"Appanoose, Iowa, United States"
"08-01-2020","13001","Appling","Georgia","United States",2020-08-02 04:34:47,31.74847232,-82.28909114,586,16,0,570,"Appling, Georgia, United States"
"08-01-2020","51011","Appomattox","Virginia","United States",2020-08-02 04:34:47,37.37569884,-78.81340003,68,0,0,68,"Appomattox, Virginia, United States"
"08-01-2020","48007","Aransas","Texas","United States",2020-08-02 04:34:47,28.10556197,-96.9995047,153,12,0,141,"Aransas, Texas, United States"
"08-01-2020","08005","Arapahoe","Colorado","United States",2020-08-02 04:34:47,39.64977461,-104.3353617,6932,363,0,6569,"Arapahoe, Colorado, United States"
"08-01-2020","48009","Archer","Texas","United States",2020-08-02 04:34:47,33.61569967,-98.68754589,20,0,0,20,"Archer, Texas, United States"
"08-01-2020","08007","Archuleta","Colorado","United States",2020-08-02 04:34:47,37.19474156,-107.0476867,33,0,0,33,"Archuleta, Colorado, United States"
"08-01-2020","72013","Arecibo","Puerto Rico","United States",2020-08-02 04:34:47,18.406631,-66.675077,254,0,0,254,"Arecibo, Puerto Rico, United States"
"08-01-2020","26011","Arenac","Michigan","United States",2020-08-02 04:34:47,44.0636262,-83.89277559,40,3,0,37,"Arenac, Michigan, United States"
"08-01-2020","05001","Arkansas","Arkansas","United States",2020-08-02 04:34:47,34.29145151,-91.37277296,194,0,0,194,"Arkansas, Arkansas, United States"
"08-01-2020","51013","Arlington","Virginia","United States",2020-08-02 04:34:47,38.8767675,-77.10139853,2906,136,0,2770,"Arlington, Virginia, United States"
"08-01-2020","42005","Armstrong","Pennsylvania","United States",2020-08-02 04:34:47,40.81665618,-79.46290811,184,6,0,178,"Armstrong, Pennsylvania, United States"
"08-01-2020","48011","Armstrong","Texas","United States",2020-08-02 04:34:47,34.96507426,-101.3574874,8,0,0,8,"Armstrong, Texas, United States"
"08-01-2020","23003","Aroostook","Maine","United States",2020-08-02 04:34:47,46.65926321,-68.59841248,32,1,0,31,"Aroostook, Maine, United States"
"08-01-2020","72015","Arroyo","Puerto Rico","United States",2020-08-02 04:34:47,17.998457,-66.056546,78,0,0,78,"Arroyo, Puerto Rico, United States"
"08-01-2020","31005","Arthur","Nebraska","United States",2020-08-02 04:34:47,41.56896142,-101.6959559,0,0,0,0,"Arthur, Nebraska, United States"
"08-01-2020","22005","Ascension","Louisiana","United States",2020-08-02 04:34:47,30.20406249,-90.9132841,2458,68,0,2390,"Ascension, Louisiana, United States"
"08-01-2020","37009","Ashe","North Carolina","United States",2020-08-02 04:34:47,36.43296207,-81.49862729,119,1,0,118,"Ashe, North Carolina, United States"
"08-01-2020","39005","Ashland","Ohio","United States",2020-08-02 04:34:47,40.84772277,-82.27280781,127,4,0,123,"Ashland, Ohio, United States"
"08-01-2020","55003","Ashland","Wisconsin","United States",2020-08-02 04:34:47,46.31956891,-90.67837132,19,0,0,19,"Ashland, Wisconsin, United States"
"08-01-2020","05003","Ashley","Arkansas","United States",2020-08-02 04:34:47,33.19153461,-91.7698471,238,4,0,234,"Ashley, Arkansas, United States"
"08-01-2020","39007","Ashtabula","Ohio","United States",2020-08-02 04:34:47,41.70860332,-80.74830218,537,37,0,500,"Ashtabula, Ohio, United States"
"08-01-2020","53003","Asotin","Washington","United States",2020-08-02 04:34:47,46.18894415,-117.2022851,24,2,0,22,"Asotin, Washington, United States"
"08-01-2020","22007","Assumption","Louisiana","United States",2020-08-02 04:34:47,29.89946234,-91.06461642,537,19,0,518,"Assumption, Louisiana, United States"
"08-01-2020","48013","Atascosa","Texas","United States",2020-08-02 04:34:47,28.89333001,-98.52730485,405,15,0,390,"Atascosa, Texas, United States"
"08-01-2020","20005","Atchison","Kansas","United States",2020-08-02 04:34:47,39.53185661,-95.30870026,61,0,0,61,"Atchison, Kansas, United States"
"08-01-2020","29005","Atchison","Missouri","United States",2020-08-02 04:34:47,40.43238737,-95.42970639,11,0,0,11,"Atchison, Missouri, United States"
"08-01-2020","39009","Athens","Ohio","United States",2020-08-02 04:34:47,39.33425634,-82.04278644,342,2,0,340,"Athens, Ohio, United States"
"08-01-2020","13003","Atkinson","Georgia","United States",2020-08-02 04:34:47,31.29633502,-82.87545866,289,2,0,287,"Atkinson, Georgia, United States"
"08-01-2020","34001","Atlantic","New Jersey","United States",2020-08-02 04:34:47,39.47538693,-74.65848483,3481,252,0,3229,"Atlantic, New Jersey, United States"
"08-01-2020","40005","Atoka","Oklahoma","United States",2020-08-02 04:34:47,34.37366573,-96.03802487,62,0,0,62,"Atoka, Oklahoma, United States"
"08-01-2020","28007","Attala","Mississippi","United States",2020-08-02 04:34:47,33.08658803,-89.57838564,495,24,0,471,"Attala, Mississippi, United States"
"08-01-2020","29007","Audrain","Missouri","United States",2020-08-02 04:34:47,39.215877,-91.84242683,192,1,0,191,"Audrain, Missouri, United States"
"08-01-2020","19009","Audubon","Iowa","United States",2020-08-02 04:34:47,41.6844628,-94.90581859,28,1,0,27,"Audubon, Iowa, United States"
"08-01-2020","39011","Auglaize","Ohio","United States",2020-08-02 04:34:47,40.55998859,-84.2242143,208,3,0,205,"Auglaize, Ohio, United States"
"08-01-2020","51015","Augusta","Virginia","United States",2020-08-02 04:34:47,38.16404586,-79.12461614,251,4,0,247,"Augusta, Virginia, United States"
"08-01-2020","46003","Aurora","South Dakota","United States",2020-08-02 04:34:47,43.71757685,-98.56050467,37,0,0,37,"Aurora, South Dakota, United States"
"08-01-2020","48015","Austin","Texas","United States",2020-08-02 04:34:47,29.88548725,-96.27736949,213,3,0,210,"Austin, Texas, United States"
"08-01-2020","01001","Autauga","Alabama","United States",2020-08-02 04:34:47,32.53952745,-86.64408227,1064,20,0,1044,"Autauga, Alabama, United States"
"08-01-2020","37011","Avery","North Carolina","United States",2020-08-02 04:34:47,36.07569796,-81.92308483,82,0,0,82,"Avery, North Carolina, United States"
"08-01-2020","22009","Avoyelles","Louisiana","United States",2020-08-02 04:34:47,31.07796211,-92.00079449,907,26,0,881,"Avoyelles, Louisiana, United States"
"08-01-2020","08009","Baca","Colorado","United States",2020-08-02 04:34:47,37.31940883,-102.5603223,14,0,0,14,"Baca, Colorado, United States"
"08-01-2020","13005","Bacon","Georgia","United States",2020-08-02 04:34:47,31.55456473,-82.45936528,410,6,0,404,"Bacon, Georgia, United States"
"08-01-2020","48017","Bailey","Texas","United States",2020-08-02 04:34:47,34.06854817,-102.8299707,158,4,0,154,"Bailey, Texas, United States"
"08-01-2020","12003","Baker","Florida","United States",2020-08-02 04:34:47,30.33060121,-82.28467476,371,4,0,367,"Baker, Florida, United States"
"08-01-2020","13007","Baker","Georgia","United States",2020-08-02 04:34:47,31.32669878,-84.44218806,58,3,0,55,"Baker, Georgia, United States"
"08-01-2020","41001","Baker","Oregon","United States",2020-08-02 04:34:47,44.70915557,-117.6749883,30,0,0,30,"Baker, Oregon, United States"
"08-01-2020","01003","Baldwin","Alabama","United States",2020-08-02 04:34:47,30.72774991,-87.72207058,3194,21,0,3173,"Baldwin, Alabama, United States"
"08-01-2020","13009","Baldwin","Georgia","United States",2020-08-02 04:34:47,33.06882326,-83.24701748,943,38,0,905,"Baldwin, Georgia, United States"
"08-01-2020","21007","Ballard","Kentucky","United States",2020-08-02 04:34:47,37.05842757,-88.99427697,30,0,0,30,"Ballard, Kentucky, United States"
"08-01-2020","24005","Baltimore","Maryland","United States",2020-08-02 04:34:47,39.45784712,-76.62911955,11997,549,0,11448,"Baltimore, Maryland, United States"
"08-01-2020","24510","Baltimore City","Maryland","United States",2020-08-02 04:34:47,39.30211911,-76.61151012,11406,409,0,10997,"Baltimore City, Maryland, United States"
"08-01-2020","45009","Bamberg","South Carolina","United States",2020-08-02 04:34:47,33.21927586,-81.05659969,434,16,0,418,"Bamberg, South Carolina, United States"
"08-01-2020","48019","Bandera","Texas","United States",2020-08-02 04:34:47,29.74619598,-99.24598147,83,3,0,80,"Bandera, Texas, United States"
"08-01-2020","13011","Banks","Georgia","United States",2020-08-02 04:34:47,34.35607081,-83.49644388,241,3,0,238,"Banks, Georgia, United States"
"08-01-2020","31007","Banner","Nebraska","United States",2020-08-02 04:34:47,41.54634427,-103.7114332,2,0,0,2,"Banner, Nebraska, United States"
"08-01-2020","16005","Bannock","Idaho","United States",2020-08-02 04:34:47,42.67002716,-112.2233311,302,2,0,300,"Bannock, Idaho, United States"
"08-01-2020","26013","Baraga","Michigan","United States",2020-08-02 04:34:47,46.6720582,-88.36363591,5,0,0,5,"Baraga, Michigan, United States"
"08-01-2020","20007","Barber","Kansas","United States",2020-08-02 04:34:47,37.2288586,-98.68460053,4,0,0,4,"Barber, Kansas, United States"
"08-01-2020","01005","Barbour","Alabama","United States",2020-08-02 04:34:47,31.868263,-85.3871286,611,5,0,606,"Barbour, Alabama, United States"
"08-01-2020","54001","Barbour","West Virginia","United States",2020-08-02 04:34:47,39.1307219,-80.00350858,29,1,0,28,"Barbour, West Virginia, United States"
"08-01-2020","72017","Barceloneta","Puerto Rico","United States",2020-08-02 04:34:47,18.445533,-66.560531,69,0,0,69,"Barceloneta, Puerto Rico, United States"
"08-01-2020","38003","Barnes","North Dakota","United States",2020-08-02 04:34:47,46.93579637,-98.06605978,32,0,0,32,"Barnes, North Dakota, United States"
"08-01-2020","25001","Barnstable","Massachusetts","United States",2020-08-02 04:34:47,41.72980578,-70.28854339,1755,156,0,1599,"Barnstable, Massachusetts, United States"
"08-01-2020","45011","Barnwell","South Carolina","United States",2020-08-02 04:34:47,33.26679302,-81.43584352,328,4,0,324,"Barnwell, South Carolina, United States"
"08-01-2020","72019","Barranquitas","Puerto Rico","United States",2020-08-02 04:34:47,18.201592,-66.30963,207,0,0,207,"Barranquitas, Puerto Rico, United States"
"08-01-2020","21009","Barren","Kentucky","United States",2020-08-02 04:34:47,36.96469836,-85.93338945,324,2,0,322,"Barren, Kentucky, United States"
"08-01-2020","55005","Barron","Wisconsin","United States",2020-08-02 04:34:47,45.42372701,-91.84833627,253,3,0,250,"Barron, Wisconsin, United States"
"08-01-2020","13013","Barrow","Georgia","United States",2020-08-02 04:34:47,33.99148694,-83.71436292,1096,32,0,1064,"Barrow, Georgia, United States"
"08-01-2020","26015","Barry","Michigan","United States",2020-08-02 04:34:47,42.59513984,-85.30834519,171,2,0,169,"Barry, Michigan, United States"
"08-01-2020","29009","Barry","Missouri","United States",2020-08-02 04:34:47,36.70978521,-93.82919888,227,0,0,227,"Barry, Missouri, United States"
"08-01-2020","18005","Bartholomew","Indiana","United States",2020-08-02 04:34:47,39.20744865,-85.89558181,727,47,0,680,"Bartholomew, Indiana, United States"
"08-01-2020","20009","Barton","Kansas","United States",2020-08-02 04:34:47,38.47889676,-98.75636726,114,3,0,111,"Barton, Kansas, United States"
"08-01-2020","29011","Barton","Missouri","United States",2020-08-02 04:34:47,37.50207671,-94.34757022,65,0,0,65,"Barton, Missouri, United States"
"08-01-2020","13015","Bartow","Georgia","United States",2020-08-02 04:34:47,34.23732119,-84.83887523,1583,59,0,1524,"Bartow, Georgia, United States"
"08-01-2020","48021","Bastrop","Texas","United States",2020-08-02 04:34:47,30.10370699,-97.31206354,1296,18,0,1278,"Bastrop, Texas, United States"
"08-01-2020","29013","Bates","Missouri","United States",2020-08-02 04:34:47,38.25271289,-94.34113157,39,1,0,38,"Bates, Missouri, United States"
"08-01-2020","21011","Bath","Kentucky","United States",2020-08-02 04:34:47,38.14735938,-83.74588932,34,1,0,33,"Bath, Kentucky, United States"
"08-01-2020","51017","Bath","Virginia","United States",2020-08-02 04:34:47,38.05852573,-79.73912095,4,0,0,4,"Bath, Virginia, United States"
"08-01-2020","05005","Baxter","Arkansas","United States",2020-08-02 04:34:47,36.28784385,-92.33782872,60,0,0,60,"Baxter, Arkansas, United States"
"08-01-2020","12005","Bay","Florida","United States",2020-08-02 04:34:47,30.26548745,-85.62122584,3620,21,0,3599,"Bay, Florida, United States"
"08-01-2020","26017","Bay","Michigan","United States",2020-08-02 04:34:47,43.70639106,-83.98731479,542,31,0,511,"Bay, Michigan, United States"
"08-01-2020","72021","Bayamon","Puerto Rico","United States",2020-08-02 04:34:47,18.34946,-66.168435,1146,0,0,1146,"Bayamon, Puerto Rico, United States"
"08-01-2020","55007","Bayfield","Wisconsin","United States",2020-08-02 04:34:47,46.52868768,-91.19716729,19,1,0,18,"Bayfield, Wisconsin, United States"
"08-01-2020","48023","Baylor","Texas","United States",2020-08-02 04:34:47,33.61640794,-99.21352901,7,0,0,7,"Baylor, Texas, United States"
"08-01-2020","46005","Beadle","South Dakota","United States",2020-08-02 04:34:47,44.41464384,-98.27858469,587,9,0,578,"Beadle, South Dakota, United States"
"08-01-2020","16007","Bear Lake","Idaho","United States",2020-08-02 04:34:47,42.28269683,-111.3289238,6,0,0,6,"Bear Lake, Idaho, United States"
"08-01-2020",NA,"Bear River","Utah","United States",2020-08-02 04:34:47,41.52106798,-113.0832816,2169,6,0,2163,"Bear River, Utah, United States"
"08-01-2020","37013","Beaufort","North Carolina","United States",2020-08-02 04:34:47,35.48531943,-76.84325809,339,2,0,337,"Beaufort, North Carolina, United States"
"08-01-2020","45013","Beaufort","South Carolina","United States",2020-08-02 04:34:47,32.39226291,-80.72619758,3577,48,0,3529,"Beaufort, South Carolina, United States"
"08-01-2020","22011","Beauregard","Louisiana","United States",2020-08-02 04:34:47,30.64836518,-93.34173616,743,14,0,729,"Beauregard, Louisiana, United States"
"08-01-2020","40007","Beaver","Oklahoma","United States",2020-08-02 04:34:47,36.7496847,-100.4758872,36,0,0,36,"Beaver, Oklahoma, United States"
