"Date_Published","FIPS","Admin2","Province_State","Country_Region","Last_Update","Latitude","Longitude","Confirmed","Deaths","Recovered","Active","Combined_Key"
"08-01-2020","37169","Stokes","North Carolina","United States",2020-08-02 04:34:47,36.4017975,-80.23893369,256,3,0,253,"Stokes, North Carolina, United States"
"08-01-2020","05137","Stone","Arkansas","United States",2020-08-02 04:34:47,35.86251946,-92.15684085,52,1,0,51,"Stone, Arkansas, United States"
"08-01-2020","28131","Stone","Mississippi","United States",2020-08-02 04:34:47,30.79187949,-89.11547539,146,3,0,143,"Stone, Mississippi, United States"
"08-01-2020","29209","Stone","Missouri","United States",2020-08-02 04:34:47,36.75000327,-93.45256475,82,1,0,81,"Stone, Missouri, United States"
"08-01-2020","48433","Stonewall","Texas","United States",2020-08-02 04:34:47,33.17906744,-100.2538401,4,0,0,4,"Stonewall, Texas, United States"
"08-01-2020","32029","Storey","Nevada","United States",2020-08-02 04:34:47,39.44875482,-119.5250207,4,0,0,4,"Storey, Nevada, United States"
"08-01-2020","19169","Story","Iowa","United States",2020-08-02 04:34:47,42.03621213,-93.46499005,1101,13,0,1088,"Story, Iowa, United States"
"08-01-2020","33017","Strafford","New Hampshire","United States",2020-08-02 04:34:47,43.291833,-71.02336013,328,13,0,315,"Strafford, New Hampshire, United States"
"08-01-2020","38093","Stutsman","North Dakota","United States",2020-08-02 04:34:47,46.97962541,-98.95637318,109,2,0,107,"Stutsman, North Dakota, United States"
"08-01-2020","56035","Sublette","Wyoming","United States",2020-08-02 04:34:47,42.76558279,-109.9130922,36,0,0,36,"Sublette, Wyoming, United States"
"08-01-2020","25025","Suffolk","Massachusetts","United States",2020-08-02 04:34:47,42.3279514,-71.07850442,21279,1057,0,20222,"Suffolk, Massachusetts, United States"
"08-01-2020","36103","Suffolk","New York","United States",2020-08-02 04:34:47,40.88320119,-72.8012172,43300,1996,0,41304,"Suffolk, New York, United States"
"08-01-2020","51800","Suffolk","Virginia","United States",2020-08-02 04:34:47,36.70155394,-76.63603554,1059,49,0,1010,"Suffolk, Virginia, United States"
"08-01-2020","18153","Sullivan","Indiana","United States",2020-08-02 04:34:47,39.08952258,-87.41414469,74,1,0,73,"Sullivan, Indiana, United States"
"08-01-2020","29211","Sullivan","Missouri","United States",2020-08-02 04:34:47,40.2099105,-93.11150106,134,0,0,134,"Sullivan, Missouri, United States"
"08-01-2020","33019","Sullivan","New Hampshire","United States",2020-08-02 04:34:47,43.36094111,-72.22203125,40,1,0,39,"Sullivan, New Hampshire, United States"
"08-01-2020","36105","Sullivan","New York","United States",2020-08-02 04:34:47,41.71579493,-74.76394559,1483,48,0,1435,"Sullivan, New York, United States"
"08-01-2020","42113","Sullivan","Pennsylvania","United States",2020-08-02 04:34:47,41.44634738,-76.51246591,10,0,0,10,"Sullivan, Pennsylvania, United States"
"08-01-2020","47163","Sullivan","Tennessee","United States",2020-08-02 04:34:47,36.51240691,-82.30412917,758,8,0,750,"Sullivan, Tennessee, United States"
"08-01-2020","46119","Sully","South Dakota","United States",2020-08-02 04:34:47,44.71571812,-100.1278092,1,0,0,1,"Sully, South Dakota, United States"
"08-01-2020","54089","Summers","West Virginia","United States",2020-08-02 04:34:47,37.65390597,-80.86009693,7,0,0,7,"Summers, West Virginia, United States"
"08-01-2020","08117","Summit","Colorado","United States",2020-08-02 04:34:47,39.63803232,-106.1150762,322,4,0,318,"Summit, Colorado, United States"
"08-01-2020","39153","Summit","Ohio","United States",2020-08-02 04:34:47,41.12464734,-81.53123079,3212,173,0,3039,"Summit, Ohio, United States"
"08-01-2020","49043","Summit","Utah","United States",2020-08-02 04:34:47,40.86688146,-110.9535882,689,1,0,688,"Summit, Utah, United States"
"08-01-2020","20191","Sumner","Kansas","United States",2020-08-02 04:34:47,37.23682549,-97.47721621,97,3,0,94,"Sumner, Kansas, United States"
"08-01-2020","47165","Sumner","Tennessee","United States",2020-08-02 04:34:47,36.46824103,-86.45917204,3136,69,0,3067,"Sumner, Tennessee, United States"
"08-01-2020","01119","Sumter","Alabama","United States",2020-08-02 04:34:47,32.59117397,-88.19916205,369,18,0,351,"Sumter, Alabama, United States"
"08-01-2020","12119","Sumter","Florida","United States",2020-08-02 04:34:47,28.70181754,-82.0794267,1091,32,0,1059,"Sumter, Florida, United States"
"08-01-2020","13261","Sumter","Georgia","United States",2020-08-02 04:34:47,32.03650571,-84.19821492,724,56,0,668,"Sumter, Georgia, United States"
"08-01-2020","45085","Sumter","South Carolina","United States",2020-08-02 04:34:47,33.91826534,-80.37942316,2289,45,0,2244,"Sumter, South Carolina, United States"
"08-01-2020","28133","Sunflower","Mississippi","United States",2020-08-02 04:34:47,33.60192578,-90.58882684,903,22,0,881,"Sunflower, Mississippi, United States"
"08-01-2020","37171","Surry","North Carolina","United States",2020-08-02 04:34:47,36.41689489,-80.69102283,860,7,0,853,"Surry, North Carolina, United States"
"08-01-2020","51181","Surry","Virginia","United States",2020-08-02 04:34:47,37.11781893,-76.88450012,37,2,0,35,"Surry, Virginia, United States"
"08-01-2020","42115","Susquehanna","Pennsylvania","United States",2020-08-02 04:34:47,41.82147784,-75.80071959,209,26,0,183,"Susquehanna, Pennsylvania, United States"
"08-01-2020","10005","Sussex","Delaware","United States",2020-08-02 04:34:47,38.66143781,-75.39031349,5630,195,0,5435,"Sussex, Delaware, United States"
"08-01-2020","34037","Sussex","New Jersey","United States",2020-08-02 04:34:47,41.13891592,-74.69118243,1312,195,0,1117,"Sussex, New Jersey, United States"
"08-01-2020","51183","Sussex","Virginia","United States",2020-08-02 04:34:47,36.92432914,-77.25791182,277,9,0,268,"Sussex, Virginia, United States"
"08-01-2020","06101","Sutter","California","United States",2020-08-02 04:34:47,39.03417539,-121.6945899,768,6,0,762,"Sutter, California, United States"
"08-01-2020","48435","Sutton","Texas","United States",2020-08-02 04:34:47,30.49856623,-100.5382014,58,1,0,57,"Sutton, Texas, United States"
"08-01-2020","12121","Suwannee","Florida","United States",2020-08-02 04:34:47,30.19746066,-82.9909967,1155,32,0,1123,"Suwannee, Florida, United States"
"08-01-2020","37173","Swain","North Carolina","United States",2020-08-02 04:34:47,35.48665845,-83.48748932,103,2,0,101,"Swain, North Carolina, United States"
"08-01-2020","30097","Sweet Grass","Montana","United States",2020-08-02 04:34:47,45.81367654,-109.9425686,4,1,0,3,"Sweet Grass, Montana, United States"
"08-01-2020","56037","Sweetwater","Wyoming","United States",2020-08-02 04:34:47,41.65943896,-108.8827882,242,0,0,242,"Sweetwater, Wyoming, United States"
"08-01-2020","27151","Swift","Minnesota","United States",2020-08-02 04:34:47,45.2829032,-95.68264092,51,1,0,50,"Swift, Minnesota, United States"
"08-01-2020","48437","Swisher","Texas","United States",2020-08-02 04:34:47,34.53028891,-101.7349174,75,2,0,73,"Swisher, Texas, United States"
"08-01-2020","18155","Switzerland","Indiana","United States",2020-08-02 04:34:47,38.82767338,-85.03022429,43,0,0,43,"Switzerland, Indiana, United States"
"08-01-2020","13263","Talbot","Georgia","United States",2020-08-02 04:34:47,32.69642758,-84.53351366,126,3,0,123,"Talbot, Georgia, United States"
"08-01-2020","24041","Talbot","Maryland","United States",2020-08-02 04:34:47,38.76618159,-76.10882561,361,4,0,357,"Talbot, Maryland, United States"
"08-01-2020","13265","Taliaferro","Georgia","United States",2020-08-02 04:34:47,33.56543317,-82.88136816,12,0,0,12,"Taliaferro, Georgia, United States"
"08-01-2020","01121","Talladega","Alabama","United States",2020-08-02 04:34:47,33.37823223,-86.16886178,1029,13,0,1016,"Talladega, Alabama, United States"
"08-01-2020","28135","Tallahatchie","Mississippi","United States",2020-08-02 04:34:47,33.95339918,-90.1729398,446,10,0,436,"Tallahatchie, Mississippi, United States"
"08-01-2020","01123","Tallapoosa","Alabama","United States",2020-08-02 04:34:47,32.86698258,-85.79833053,841,78,0,763,"Tallapoosa, Alabama, United States"
"08-01-2020","19171","Tama","Iowa","United States",2020-08-02 04:34:47,42.07991767,-92.53266945,535,29,0,506,"Tama, Iowa, United States"
"08-01-2020","29213","Taney","Missouri","United States",2020-08-02 04:34:47,36.65465345,-93.04075153,403,3,0,400,"Taney, Missouri, United States"
"08-01-2020","22105","Tangipahoa","Louisiana","United States",2020-08-02 04:34:47,30.62888673,-90.40664996,3037,62,0,2975,"Tangipahoa, Louisiana, United States"
"08-01-2020","35055","Taos","New Mexico","United States",2020-08-02 04:34:47,36.58006022,-105.6310198,96,1,0,95,"Taos, New Mexico, United States"
"08-01-2020","48439","Tarrant","Texas","United States",2020-08-02 04:34:47,32.77143818,-97.29101614,29054,576,0,28478,"Tarrant, Texas, United States"
"08-01-2020","28137","Tate","Mississippi","United States",2020-08-02 04:34:47,34.65133709,-89.94485778,638,22,0,616,"Tate, Mississippi, United States"
"08-01-2020","13267","Tattnall","Georgia","United States",2020-08-02 04:34:47,32.04785085,-82.05539188,407,1,0,406,"Tattnall, Georgia, United States"
"08-01-2020","12123","Taylor","Florida","United States",2020-08-02 04:34:47,30.04848048,-83.60445406,360,3,0,357,"Taylor, Florida, United States"
"08-01-2020","13269","Taylor","Georgia","United States",2020-08-02 04:34:47,32.55792548,-84.25077141,69,2,0,67,"Taylor, Georgia, United States"
"08-01-2020","19173","Taylor","Iowa","United States",2020-08-02 04:34:47,40.73710579,-94.69778563,93,0,0,93,"Taylor, Iowa, United States"
"08-01-2020","21217","Taylor","Kentucky","United States",2020-08-02 04:34:47,37.3677562,-85.3329931,100,2,0,98,"Taylor, Kentucky, United States"
"08-01-2020","48441","Taylor","Texas","United States",2020-08-02 04:34:47,32.30163422,-99.89007449,1082,19,0,1063,"Taylor, Texas, United States"
"08-01-2020","54091","Taylor","West Virginia","United States",2020-08-02 04:34:47,39.33602617,-80.0421439,52,0,0,52,"Taylor, West Virginia, United States"
"08-01-2020","55119","Taylor","Wisconsin","United States",2020-08-02 04:34:47,45.21179252,-90.5004405,50,0,0,50,"Taylor, Wisconsin, United States"
"08-01-2020","17179","Tazewell","Illinois","United States",2020-08-02 04:34:47,40.50716185,-89.51404662,361,8,0,353,"Tazewell, Illinois, United States"
"08-01-2020","51185","Tazewell","Virginia","United States",2020-08-02 04:34:47,37.12191123,-81.56685568,92,0,0,92,"Tazewell, Virginia, United States"
"08-01-2020","06103","Tehama","California","United States",2020-08-02 04:34:47,40.12570935,-122.2370171,234,1,0,233,"Tehama, California, United States"
"08-01-2020","13271","Telfair","Georgia","United States",2020-08-02 04:34:47,31.92829517,-82.93491155,251,7,0,244,"Telfair, Georgia, United States"
"08-01-2020","08119","Teller","Colorado","United States",2020-08-02 04:34:47,38.88133511,-105.1614893,112,3,0,109,"Teller, Colorado, United States"
"08-01-2020","22107","Tensas","Louisiana","United States",2020-08-02 04:34:47,32.00760749,-91.32915234,56,0,0,56,"Tensas, Louisiana, United States"
"08-01-2020","22109","Terrebonne","Louisiana","United States",2020-08-02 04:34:47,29.37343766,-90.82626855,2693,74,0,2619,"Terrebonne, Louisiana, United States"
"08-01-2020","13273","Terrell","Georgia","United States",2020-08-02 04:34:47,31.77527543,-84.44069698,291,30,0,261,"Terrell, Georgia, United States"
"08-01-2020","48443","Terrell","Texas","United States",2020-08-02 04:34:47,30.22429013,-102.0766732,2,0,0,2,"Terrell, Texas, United States"
"08-01-2020","48445","Terry","Texas","United States",2020-08-02 04:34:47,33.17402785,-102.3354521,116,1,0,115,"Terry, Texas, United States"
"08-01-2020","16081","Teton","Idaho","United States",2020-08-02 04:34:47,43.75303583,-111.2056773,58,0,0,58,"Teton, Idaho, United States"
"08-01-2020","30099","Teton","Montana","United States",2020-08-02 04:34:47,47.83741052,-112.2410688,15,0,0,15,"Teton, Montana, United States"
"08-01-2020","56039","Teton","Wyoming","United States",2020-08-02 04:34:47,43.93522482,-110.5890801,348,0,0,348,"Teton, Wyoming, United States"
"08-01-2020","29215","Texas","Missouri","United States",2020-08-02 04:34:47,37.31728859,-91.96564727,35,0,0,35,"Texas, Missouri, United States"
"08-01-2020","40139","Texas","Oklahoma","United States",2020-08-02 04:34:47,36.74777635,-101.4889765,1034,7,0,1027,"Texas, Oklahoma, United States"
"08-01-2020","31169","Thayer","Nebraska","United States",2020-08-02 04:34:47,40.17626377,-97.59504381,25,0,0,25,"Thayer, Nebraska, United States"
"08-01-2020","13275","Thomas","Georgia","United States",2020-08-02 04:34:47,30.86392347,-83.91847289,982,39,0,943,"Thomas, Georgia, United States"
"08-01-2020","20193","Thomas","Kansas","United States",2020-08-02 04:34:47,39.35107575,-101.0553705,32,0,0,32,"Thomas, Kansas, United States"
"08-01-2020","31171","Thomas","Nebraska","United States",2020-08-02 04:34:47,41.91358968,-100.5556632,1,0,0,1,"Thomas, Nebraska, United States"
"08-01-2020","48447","Throckmorton","Texas","United States",2020-08-02 04:34:47,33.17751417,-99.21226795,4,0,0,4,"Throckmorton, Texas, United States"
"08-01-2020","31173","Thurston","Nebraska","United States",2020-08-02 04:34:47,42.15725356,-96.54157099,201,4,0,197,"Thurston, Nebraska, United States"
"08-01-2020","53067","Thurston","Washington","United States",2020-08-02 04:34:47,46.9291895,-122.8290656,638,9,0,629,"Thurston, Washington, United States"
"08-01-2020","13277","Tift","Georgia","United States",2020-08-02 04:34:47,31.45743864,-83.5236119,1241,35,0,1206,"Tift, Georgia, United States"
"08-01-2020","41057","Tillamook","Oregon","United States",2020-08-02 04:34:47,45.46248721,-123.712066,24,0,0,24,"Tillamook, Oregon, United States"
"08-01-2020","40141","Tillman","Oklahoma","United States",2020-08-02 04:34:47,34.37288446,-98.92426619,55,1,0,54,"Tillman, Oklahoma, United States"
"08-01-2020","36107","Tioga","New York","United States",2020-08-02 04:34:47,42.16852837,-76.30835812,188,24,0,164,"Tioga, New York, United States"
"08-01-2020","42117","Tioga","Pennsylvania","United States",2020-08-02 04:34:47,41.77255149,-77.25433032,35,2,0,33,"Tioga, Pennsylvania, United States"
"08-01-2020","28139","Tippah","Mississippi","United States",2020-08-02 04:34:47,34.76872156,-88.90988194,294,12,0,282,"Tippah, Mississippi, United States"
"08-01-2020","18157","Tippecanoe","Indiana","United States",2020-08-02 04:34:47,40.38872739,-86.89413959,1085,11,0,1074,"Tippecanoe, Indiana, United States"
"08-01-2020","18159","Tipton","Indiana","United States",2020-08-02 04:34:47,40.31123252,-86.05234925,102,5,0,97,"Tipton, Indiana, United States"
"08-01-2020","47167","Tipton","Tennessee","United States",2020-08-02 04:34:47,35.501942,-89.73694895,1094,9,0,1085,"Tipton, Tennessee, United States"
"08-01-2020","28141","Tishomingo","Mississippi","United States",2020-08-02 04:34:47,34.74023475,-88.23917219,306,3,0,303,"Tishomingo, Mississippi, United States"
"08-01-2020","48449","Titus","Texas","United States",2020-08-02 04:34:47,33.21339719,-94.96797273,1167,14,0,1153,"Titus, Texas, United States"
"08-01-2020","72135","Toa Alta","Puerto Rico","United States",2020-08-02 04:34:47,18.362406,-66.246616,458,0,0,458,"Toa Alta, Puerto Rico, United States"
"08-01-2020","72137","Toa Baja","Puerto Rico","United States",2020-08-02 04:34:47,18.431446,-66.213553,419,0,0,419,"Toa Baja, Puerto Rico, United States"
"08-01-2020","21219","Todd","Kentucky","United States",2020-08-02 04:34:47,36.8381152,-87.17878374,33,0,0,33,"Todd, Kentucky, United States"
"08-01-2020","27153","Todd","Minnesota","United States",2020-08-02 04:34:47,46.06996226,-94.89785296,413,2,0,411,"Todd, Minnesota, United States"
"08-01-2020","46121","Todd","South Dakota","United States",2020-08-02 04:34:47,43.19338568,-100.7195503,66,4,0,62,"Todd, South Dakota, United States"
"08-01-2020","09013","Tolland","Connecticut","United States",2020-08-02 04:34:47,41.85853803,-72.3308481,1019,66,0,953,"Tolland, Connecticut, United States"
"08-01-2020","48451","Tom Green","Texas","United States",2020-08-02 04:34:47,31.40464436,-100.462443,2343,24,0,2319,"Tom Green, Texas, United States"
"08-01-2020","36109","Tompkins","New York","United States",2020-08-02 04:34:47,42.44945765,-76.47229843,230,0,0,230,"Tompkins, New York, United States"
"08-01-2020","49045","Tooele","Utah","United States",2020-08-02 04:34:47,40.44862644,-113.1295715,532,0,0,532,"Tooele, Utah, United States"
"08-01-2020","30101","Toole","Montana","United States",2020-08-02 04:34:47,48.65577551,-111.6942414,31,6,0,25,"Toole, Montana, United States"
"08-01-2020","13279","Toombs","Georgia","United States",2020-08-02 04:34:47,32.12059861,-82.32957247,622,6,0,616,"Toombs, Georgia, United States"
"08-01-2020","35057","Torrance","New Mexico","United States",2020-08-02 04:34:47,34.64048375,-105.8508949,59,1,0,58,"Torrance, New Mexico, United States"
"08-01-2020","38095","Towner","North Dakota","United States",2020-08-02 04:34:47,48.68565745,-99.24564265,6,0,0,6,"Towner, North Dakota, United States"
"08-01-2020","13281","Towns","Georgia","United States",2020-08-02 04:34:47,34.91369188,-83.7410746,111,1,0,110,"Towns, Georgia, United States"
"08-01-2020","38097","Traill","North Dakota","United States",2020-08-02 04:34:47,47.45367788,-97.16323288,42,0,0,42,"Traill, North Dakota, United States"
"08-01-2020","37175","Transylvania","North Carolina","United States",2020-08-02 04:34:47,35.20383864,-82.79638423,122,1,0,121,"Transylvania, North Carolina, United States"
"08-01-2020","27155","Traverse","Minnesota","United States",2020-08-02 04:34:47,45.77298854,-96.47062949,10,0,0,10,"Traverse, Minnesota, United States"
"08-01-2020","48453","Travis","Texas","United States",2020-08-02 04:34:47,30.33432034,-97.7853562,20745,234,0,20511,"Travis, Texas, United States"
"08-01-2020","30103","Treasure","Montana","United States",2020-08-02 04:34:47,46.2097322,-107.2666516,2,0,0,2,"Treasure, Montana, United States"
"08-01-2020","20195","Trego","Kansas","United States",2020-08-02 04:34:47,38.91467218,-99.87284448,5,1,0,4,"Trego, Kansas, United States"
"08-01-2020","55121","Trempealeau","Wisconsin","United States",2020-08-02 04:34:47,44.30360275,-91.35893614,305,2,0,303,"Trempealeau, Wisconsin, United States"
"08-01-2020","13283","Treutlen","Georgia","United States",2020-08-02 04:34:47,32.40422134,-82.56904553,96,3,0,93,"Treutlen, Georgia, United States"
"08-01-2020",NA,"TriCounty","Utah","United States",2020-08-02 04:34:47,40.12491499,-109.5174415,162,0,0,162,"TriCounty, Utah, United States"
"08-01-2020","21221","Trigg","Kentucky","United States",2020-08-02 04:34:47,36.80767017,-87.87333656,48,0,0,48,"Trigg, Kentucky, United States"
"08-01-2020","21223","Trimble","Kentucky","United States",2020-08-02 04:34:47,38.61056487,-85.33775972,32,0,0,32,"Trimble, Kentucky, United States"
"08-01-2020","06105","Trinity","California","United States",2020-08-02 04:34:47,40.6491767,-123.114713,5,0,0,5,"Trinity, California, United States"
"08-01-2020","48455","Trinity","Texas","United States",2020-08-02 04:34:47,31.0879489,-95.1367187,135,2,0,133,"Trinity, Texas, United States"
"08-01-2020","46123","Tripp","South Dakota","United States",2020-08-02 04:34:47,43.34459388,-99.8854891,20,0,0,20,"Tripp, South Dakota, United States"
"08-01-2020","13285","Troup","Georgia","United States",2020-08-02 04:34:47,33.03349196,-85.02812115,2159,63,0,2096,"Troup, Georgia, United States"
"08-01-2020","47169","Trousdale","Tennessee","United States",2020-08-02 04:34:47,36.39026213,-86.16087954,1572,6,0,1566,"Trousdale, Tennessee, United States"
"08-01-2020","72139","Trujillo Alto","Puerto Rico","United States",2020-08-02 04:34:47,18.336159,-65.998884,411,0,0,411,"Trujillo Alto, Puerto Rico, United States"
"08-01-2020","39155","Trumbull","Ohio","United States",2020-08-02 04:34:47,41.31735028,-80.76109643,1408,94,0,1314,"Trumbull, Ohio, United States"
"08-01-2020","54093","Tucker","West Virginia","United States",2020-08-02 04:34:47,39.11240885,-79.57053576,10,0,0,10,"Tucker, West Virginia, United States"
"08-01-2020","06107","Tulare","California","United States",2020-08-02 04:34:47,36.22026558,-118.8020203,9454,178,0,9276,"Tulare, California, United States"
"08-01-2020","40143","Tulsa","Oklahoma","United States",2020-08-02 04:34:47,36.11939621,-95.94013939,8986,101,0,8885,"Tulsa, Oklahoma, United States"
"08-01-2020","28143","Tunica","Mississippi","United States",2020-08-02 04:34:47,34.64967704,-90.37481167,252,6,0,246,"Tunica, Mississippi, United States"
"08-01-2020","06109","Tuolumne","California","United States",2020-08-02 04:34:47,38.02644018,-119.9525093,141,2,0,139,"Tuolumne, California, United States"
"08-01-2020","13287","Turner","Georgia","United States",2020-08-02 04:34:47,31.71612656,-83.62069378,224,18,0,206,"Turner, Georgia, United States"
"08-01-2020","46125","Turner","South Dakota","United States",2020-08-02 04:34:47,43.3109081,-97.14865776,44,0,0,44,"Turner, South Dakota, United States"
"08-01-2020","01125","Tuscaloosa","Alabama","United States",2020-08-02 04:34:47,33.28726072,-87.52556818,3900,61,0,3839,"Tuscaloosa, Alabama, United States"
"08-01-2020","39157","Tuscarawas","Ohio","United States",2020-08-02 04:34:47,40.44214695,-81.47226262,743,12,0,731,"Tuscarawas, Ohio, United States"
"08-01-2020","26157","Tuscola","Michigan","United States",2020-08-02 04:34:47,43.46606813,-83.41897025,304,27,0,277,"Tuscola, Michigan, United States"
"08-01-2020","13289","Twiggs","Georgia","United States",2020-08-02 04:34:47,32.67435595,-83.43078662,93,3,0,90,"Twiggs, Georgia, United States"
"08-01-2020","16083","Twin Falls","Idaho","United States",2020-08-02 04:34:47,42.35440512,-114.6685381,1206,31,0,1175,"Twin Falls, Idaho, United States"
"08-01-2020","48457","Tyler","Texas","United States",2020-08-02 04:34:47,30.77031716,-94.37690895,115,1,0,114,"Tyler, Texas, United States"
"08-01-2020","54095","Tyler","West Virginia","United States",2020-08-02 04:34:47,39.46811972,-80.88772676,12,0,0,12,"Tyler, West Virginia, United States"
"08-01-2020","37177","Tyrrell","North Carolina","United States",2020-08-02 04:34:47,35.87147226,-76.17055253,91,1,0,90,"Tyrrell, North Carolina, United States"
"08-01-2020","56041","Uinta","Wyoming","United States",2020-08-02 04:34:47,41.2878183,-110.5475782,259,0,0,259,"Uinta, Wyoming, United States"
"08-01-2020","36111","Ulster","New York","United States",2020-08-02 04:34:47,41.89027881,-74.26252104,2026,91,0,1935,"Ulster, New York, United States"
"08-01-2020","41059","Umatilla","Oregon","United States",2020-08-02 04:34:47,45.59073056,-118.7353826,1977,24,0,1953,"Umatilla, Oregon, United States"
"08-01-2020","90001","Unassigned","Alabama","United States",2020-08-02 04:34:47,NA,NA,0,50,0,NA,"Unassigned, Alabama, United States"
"08-01-2020","90002","Unassigned","Alaska","United States",2020-08-02 04:34:47,NA,NA,0,0,0,0,"Unassigned, Alaska, United States"
"08-01-2020","90004","Unassigned","Arizona","United States",2020-08-02 04:34:47,NA,NA,0,1,0,NA,"Unassigned, Arizona, United States"
"08-01-2020","90005","Unassigned","Arkansas","United States",2020-08-02 04:34:47,NA,NA,1555,0,0,1555,"Unassigned, Arkansas, United States"
"08-01-2020","90006","Unassigned","California","United States",2020-08-02 04:34:47,NA,NA,0,0,0,0,"Unassigned, California, United States"
"08-01-2020","90008","Unassigned","Colorado","United States",2020-08-02 04:34:47,NA,NA,18,0,0,18,"Unassigned, Colorado, United States"
"08-01-2020","90009","Unassigned","Connecticut","United States",2020-08-02 04:34:47,NA,NA,243,0,0,243,"Unassigned, Connecticut, United States"
"08-01-2020","90010","Unassigned","Delaware","United States",2020-08-02 04:34:47,NA,NA,221,0,0,221,"Unassigned, Delaware, United States"
"08-01-2020","90012","Unassigned","Florida","United States",2020-08-02 04:34:47,NA,NA,601,0,0,601,"Unassigned, Florida, United States"
"08-01-2020","90013","Unassigned","Georgia","United States",2020-08-02 04:34:47,NA,NA,2377,6,0,2371,"Unassigned, Georgia, United States"
"08-01-2020","90015","Unassigned","Hawaii","United States",2020-08-02 04:34:47,NA,NA,0,0,0,0,"Unassigned, Hawaii, United States"
"08-01-2020","90016","Unassigned","Idaho","United States",2020-08-02 04:34:47,NA,NA,0,0,0,0,"Unassigned, Idaho, United States"
"08-01-2020","90017","Unassigned","Illinois","United States",2020-08-02 04:34:47,NA,NA,1339,197,0,1142,"Unassigned, Illinois, United States"
"08-01-2020","90018","Unassigned","Indiana","United States",2020-08-02 04:34:47,NA,NA,0,128,0,NA,"Unassigned, Indiana, United States"
"08-01-2020","90019","Unassigned","Iowa","United States",2020-08-02 04:34:47,NA,NA,5,0,0,5,"Unassigned, Iowa, United States"
"08-01-2020","90020","Unassigned","Kansas","United States",2020-08-02 04:34:47,NA,NA,0,1,0,NA,"Unassigned, Kansas, United States"
"08-01-2020","90021","Unassigned","Kentucky","United States",2020-08-02 04:34:47,NA,NA,0,0,0,0,"Unassigned, Kentucky, United States"
"08-01-2020","90022","Unassigned","Louisiana","United States",2020-08-02 04:34:47,NA,NA,10,114,0,NA,"Unassigned, Louisiana, United States"
"08-01-2020","90023","Unassigned","Maine","United States",2020-08-02 04:34:47,NA,NA,2,0,0,2,"Unassigned, Maine, United States"
"08-01-2020","90024","Unassigned","Maryland","United States",2020-08-02 04:34:47,NA,NA,0,16,0,NA,"Unassigned, Maryland, United States"
"08-01-2020","90025","Unassigned","Massachusetts","United States",2020-08-02 04:34:47,NA,NA,303,6,0,297,"Unassigned, Massachusetts, United States"
"08-01-2020","90026","Unassigned","Michigan","United States",2020-08-02 04:34:47,NA,NA,4,0,0,4,"Unassigned, Michigan, United States"
"08-01-2020","90027","Unassigned","Minnesota","United States",2020-08-02 04:34:47,NA,NA,128,40,0,88,"Unassigned, Minnesota, United States"
"08-01-2020","90028","Unassigned","Mississippi","United States",2020-08-02 04:34:47,NA,NA,0,0,0,0,"Unassigned, Mississippi, United States"
"08-01-2020","90029","Unassigned","Missouri","United States",2020-08-02 04:34:47,NA,NA,490,0,0,490,"Unassigned, Missouri, United States"
