"Date_Published","FIPS","Admin2","Province_State","Country_Region","Last_Update","Latitude","Longitude","Confirmed","Deaths","Recovered","Active","Combined_Key"
"08-01-2020","36051","Livingston","New York","United States",2020-08-02 04:34:47,42.72596275,-77.77966158,166,8,0,158,"Livingston, New York, United States"
"08-01-2020","48299","Llano","Texas","United States",2020-08-02 04:34:47,30.70645047,-98.68475262,86,1,0,85,"Llano, Texas, United States"
"08-01-2020","05083","Logan","Arkansas","United States",2020-08-02 04:34:47,35.21413234,-93.71951016,141,0,0,141,"Logan, Arkansas, United States"
"08-01-2020","08075","Logan","Colorado","United States",2020-08-02 04:34:47,40.7249637,-103.110817,647,5,0,642,"Logan, Colorado, United States"
"08-01-2020","17107","Logan","Illinois","United States",2020-08-02 04:34:47,40.12581572,-89.36638784,85,0,0,85,"Logan, Illinois, United States"
"08-01-2020","20109","Logan","Kansas","United States",2020-08-02 04:34:47,38.91735806,-101.148475,2,0,0,2,"Logan, Kansas, United States"
"08-01-2020","21141","Logan","Kentucky","United States",2020-08-02 04:34:47,36.85949479,-86.877635,300,22,0,278,"Logan, Kentucky, United States"
"08-01-2020","31113","Logan","Nebraska","United States",2020-08-02 04:34:47,41.56650314,-100.4817851,0,0,0,0,"Logan, Nebraska, United States"
"08-01-2020","38047","Logan","North Dakota","United States",2020-08-02 04:34:47,46.45729487,-99.47719806,4,0,0,4,"Logan, North Dakota, United States"
"08-01-2020","39091","Logan","Ohio","United States",2020-08-02 04:34:47,40.38996525,-83.76784341,116,4,0,112,"Logan, Ohio, United States"
"08-01-2020","40083","Logan","Oklahoma","United States",2020-08-02 04:34:47,35.91899576,-97.44352845,180,1,0,179,"Logan, Oklahoma, United States"
"08-01-2020","54045","Logan","West Virginia","United States",2020-08-02 04:34:47,37.8299889,-81.93528571,137,3,0,134,"Logan, West Virginia, United States"
"08-01-2020","72087","Loiza","Puerto Rico","United States",2020-08-02 04:34:47,18.425688,-65.89943,88,0,0,88,"Loiza, Puerto Rico, United States"
"08-01-2020","13183","Long","Georgia","United States",2020-08-02 04:34:47,31.75218791,-81.74952375,122,1,0,121,"Long, Georgia, United States"
"08-01-2020","05085","Lonoke","Arkansas","United States",2020-08-02 04:34:47,34.75392199,-91.88742357,416,2,0,414,"Lonoke, Arkansas, United States"
"08-01-2020","39093","Lorain","Ohio","United States",2020-08-02 04:34:47,41.29553751,-82.15083537,1596,74,0,1522,"Lorain, Ohio, United States"
"08-01-2020","35028","Los Alamos","New Mexico","United States",2020-08-02 04:34:47,35.86631386,-106.3134985,20,0,0,20,"Los Alamos, New Mexico, United States"
"08-01-2020","06037","Los Angeles","California","United States",2020-08-02 04:34:47,34.30828379,-118.2282411,190857,4669,0,186188,"Los Angeles, California, United States"
"08-01-2020","47105","Loudon","Tennessee","United States",2020-08-02 04:34:47,35.73939663,-84.31145275,643,3,0,640,"Loudon, Tennessee, United States"
"08-01-2020","51107","Loudoun","Virginia","United States",2020-08-02 04:34:47,39.08990083,-77.63481877,5014,112,0,4902,"Loudoun, Virginia, United States"
"08-01-2020","19115","Louisa","Iowa","United States",2020-08-02 04:34:47,41.21842119,-91.26102611,377,14,0,363,"Louisa, Iowa, United States"
"08-01-2020","51109","Louisa","Virginia","United States",2020-08-02 04:34:47,37.97850256,-77.96274807,166,2,0,164,"Louisa, Virginia, United States"
"08-01-2020","31115","Loup","Nebraska","United States",2020-08-02 04:34:47,41.91371961,-99.45440415,0,0,0,0,"Loup, Nebraska, United States"
"08-01-2020","40085","Love","Oklahoma","United States",2020-08-02 04:34:47,33.95273467,-97.23906784,64,0,0,64,"Love, Oklahoma, United States"
"08-01-2020","01085","Lowndes","Alabama","United States",2020-08-02 04:34:47,32.1597283,-86.65158371,553,24,0,529,"Lowndes, Alabama, United States"
"08-01-2020","13185","Lowndes","Georgia","United States",2020-08-02 04:34:47,30.83568832,-83.27056716,2931,32,0,2899,"Lowndes, Georgia, United States"
"08-01-2020","28087","Lowndes","Mississippi","United States",2020-08-02 04:34:47,33.47386518,-88.4419153,958,30,0,928,"Lowndes, Mississippi, United States"
"08-01-2020","48303","Lubbock","Texas","United States",2020-08-02 04:34:47,33.61008596,-101.8204789,5512,64,0,5448,"Lubbock, Texas, United States"
"08-01-2020","19117","Lucas","Iowa","United States",2020-08-02 04:34:47,41.02958964,-93.32780803,42,4,0,38,"Lucas, Iowa, United States"
"08-01-2020","39095","Lucas","Ohio","United States",2020-08-02 04:34:47,41.62101218,-83.65468618,4762,284,0,4478,"Lucas, Ohio, United States"
"08-01-2020","26095","Luce","Michigan","United States",2020-08-02 04:34:47,46.47227431,-85.54471223,3,0,0,3,"Luce, Michigan, United States"
"08-01-2020","13187","Lumpkin","Georgia","United States",2020-08-02 04:34:47,34.57286511,-84.00425681,301,6,0,295,"Lumpkin, Georgia, United States"
"08-01-2020","35029","Luna","New Mexico","United States",2020-08-02 04:34:47,32.18179341,-107.7508826,225,3,0,222,"Luna, New Mexico, United States"
"08-01-2020","51111","Lunenburg","Virginia","United States",2020-08-02 04:34:47,36.94618528,-78.24133319,55,1,0,54,"Lunenburg, Virginia, United States"
"08-01-2020","72089","Luquillo","Puerto Rico","United States",2020-08-02 04:34:47,18.342114,-65.725097,90,0,0,90,"Luquillo, Puerto Rico, United States"
"08-01-2020","42079","Luzerne","Pennsylvania","United States",2020-08-02 04:34:47,41.17823008,-75.98447579,3276,183,0,3093,"Luzerne, Pennsylvania, United States"
"08-01-2020","42081","Lycoming","Pennsylvania","United States",2020-08-02 04:34:47,41.34310539,-77.06629984,332,20,0,312,"Lycoming, Pennsylvania, United States"
"08-01-2020","46085","Lyman","South Dakota","United States",2020-08-02 04:34:47,43.89522709,-99.85201878,88,2,0,86,"Lyman, South Dakota, United States"
"08-01-2020","51680","Lynchburg","Virginia","United States",2020-08-02 04:34:47,37.40021399,-79.19888138,440,2,0,438,"Lynchburg, Virginia, United States"
"08-01-2020","48305","Lynn","Texas","United States",2020-08-02 04:34:47,33.17657705,-101.8162849,65,4,0,61,"Lynn, Texas, United States"
"08-01-2020","19119","Lyon","Iowa","United States",2020-08-02 04:34:47,43.38107862,-96.20926845,99,0,0,99,"Lyon, Iowa, United States"
"08-01-2020","20111","Lyon","Kansas","United States",2020-08-02 04:34:47,38.45576156,-96.15275715,644,11,0,633,"Lyon, Kansas, United States"
"08-01-2020","21143","Lyon","Kentucky","United States",2020-08-02 04:34:47,37.02080035,-88.07886257,30,4,0,26,"Lyon, Kentucky, United States"
"08-01-2020","27083","Lyon","Minnesota","United States",2020-08-02 04:34:47,44.41327865,-95.83806103,414,3,0,411,"Lyon, Minnesota, United States"
"08-01-2020","32019","Lyon","Nevada","United States",2020-08-02 04:34:47,39.01777974,-119.1870479,201,5,0,196,"Lyon, Nevada, United States"
"08-01-2020","26097","Mackinac","Michigan","United States",2020-08-02 04:34:47,46.07028979,-85.04980537,20,0,0,20,"Mackinac, Michigan, United States"
"08-01-2020","26099","Macomb","Michigan","United States",2020-08-02 04:34:47,42.69158356,-82.92752801,9565,936,0,8629,"Macomb, Michigan, United States"
"08-01-2020","01087","Macon","Alabama","United States",2020-08-02 04:34:47,32.38759944,-85.69267724,320,12,0,308,"Macon, Alabama, United States"
"08-01-2020","13193","Macon","Georgia","United States",2020-08-02 04:34:47,32.35207048,-84.04234127,174,10,0,164,"Macon, Georgia, United States"
"08-01-2020","17115","Macon","Illinois","United States",2020-08-02 04:34:47,39.86064913,-88.96342505,450,23,0,427,"Macon, Illinois, United States"
"08-01-2020","29121","Macon","Missouri","United States",2020-08-02 04:34:47,39.83049768,-92.56453089,53,0,0,53,"Macon, Missouri, United States"
"08-01-2020","37113","Macon","North Carolina","United States",2020-08-02 04:34:47,35.14867843,-83.41696617,445,2,0,443,"Macon, North Carolina, United States"
"08-01-2020","47111","Macon","Tennessee","United States",2020-08-02 04:34:47,36.53157855,-86.00778595,834,13,0,821,"Macon, Tennessee, United States"
"08-01-2020","17117","Macoupin","Illinois","United States",2020-08-02 04:34:47,39.26119767,-89.92424028,131,3,0,128,"Macoupin, Illinois, United States"
"08-01-2020","06039","Madera","California","United States",2020-08-02 04:34:47,37.21513971,-119.7665589,1943,30,0,1913,"Madera, California, United States"
"08-01-2020","01089","Madison","Alabama","United States",2020-08-02 04:34:47,34.76327133,-86.55069633,4790,25,0,4765,"Madison, Alabama, United States"
"08-01-2020","05087","Madison","Arkansas","United States",2020-08-02 04:34:47,36.01038185,-93.72524943,254,1,0,253,"Madison, Arkansas, United States"
"08-01-2020","12079","Madison","Florida","United States",2020-08-02 04:34:47,30.44396917,-83.47398594,618,7,0,611,"Madison, Florida, United States"
"08-01-2020","13195","Madison","Georgia","United States",2020-08-02 04:34:47,34.12920917,-83.21218732,326,4,0,322,"Madison, Georgia, United States"
"08-01-2020","16065","Madison","Idaho","United States",2020-08-02 04:34:47,43.78141028,-111.6538474,132,0,0,132,"Madison, Idaho, United States"
"08-01-2020","17119","Madison","Illinois","United States",2020-08-02 04:34:47,38.83042506,-89.90422563,2137,72,0,2065,"Madison, Illinois, United States"
"08-01-2020","18095","Madison","Indiana","United States",2020-08-02 04:34:47,40.16143691,-85.71964711,833,64,0,769,"Madison, Indiana, United States"
"08-01-2020","19121","Madison","Iowa","United States",2020-08-02 04:34:47,41.33081904,-94.01554631,96,2,0,94,"Madison, Iowa, United States"
"08-01-2020","21151","Madison","Kentucky","United States",2020-08-02 04:34:47,37.71659336,-84.27220275,380,1,0,379,"Madison, Kentucky, United States"
"08-01-2020","22065","Madison","Louisiana","United States",2020-08-02 04:34:47,32.36918118,-91.23973355,551,6,0,545,"Madison, Louisiana, United States"
"08-01-2020","28089","Madison","Mississippi","United States",2020-08-02 04:34:47,32.63389156,-90.03513564,2272,53,0,2219,"Madison, Mississippi, United States"
"08-01-2020","29123","Madison","Missouri","United States",2020-08-02 04:34:47,37.47865134,-90.3467143,17,0,0,17,"Madison, Missouri, United States"
"08-01-2020","30057","Madison","Montana","United States",2020-08-02 04:34:47,45.30080065,-111.9173017,74,1,0,73,"Madison, Montana, United States"
"08-01-2020","31119","Madison","Nebraska","United States",2020-08-02 04:34:47,41.91676024,-97.6005481,415,5,0,410,"Madison, Nebraska, United States"
"08-01-2020","36053","Madison","New York","United States",2020-08-02 04:34:47,42.91653905,-75.67266639,399,17,0,382,"Madison, New York, United States"
"08-01-2020","37115","Madison","North Carolina","United States",2020-08-02 04:34:47,35.85402722,-82.71346418,38,0,0,38,"Madison, North Carolina, United States"
"08-01-2020","39097","Madison","Ohio","United States",2020-08-02 04:34:47,39.89381073,-83.40178317,322,8,0,314,"Madison, Ohio, United States"
"08-01-2020","47113","Madison","Tennessee","United States",2020-08-02 04:34:47,35.61181957,-88.84076036,863,12,0,851,"Madison, Tennessee, United States"
"08-01-2020","48313","Madison","Texas","United States",2020-08-02 04:34:47,30.96694679,-95.93003775,645,2,0,643,"Madison, Texas, United States"
"08-01-2020","51113","Madison","Virginia","United States",2020-08-02 04:34:47,38.41531222,-78.28220331,61,1,0,60,"Madison, Virginia, United States"
"08-01-2020","21153","Magoffin","Kentucky","United States",2020-08-02 04:34:47,37.70820545,-83.0657714,19,0,0,19,"Magoffin, Kentucky, United States"
"08-01-2020","19123","Mahaska","Iowa","United States",2020-08-02 04:34:47,41.33521503,-92.64083907,135,17,0,118,"Mahaska, Iowa, United States"
"08-01-2020","27087","Mahnomen","Minnesota","United States",2020-08-02 04:34:47,47.32557075,-95.80921485,22,1,0,21,"Mahnomen, Minnesota, United States"
"08-01-2020","39099","Mahoning","Ohio","United States",2020-08-02 04:34:47,41.01631101,-80.77287029,2383,227,0,2156,"Mahoning, Ohio, United States"
"08-01-2020","40093","Major","Oklahoma","United States",2020-08-02 04:34:47,36.31149996,-98.53467076,25,1,0,24,"Major, Oklahoma, United States"
"08-01-2020","41045","Malheur","Oregon","United States",2020-08-02 04:34:47,43.1937027,-117.6227395,663,9,0,654,"Malheur, Oregon, United States"
"08-01-2020","51683","Manassas","Virginia","United States",2020-08-02 04:34:47,38.7464321,-77.48509905,1607,20,0,1587,"Manassas, Virginia, United States"
"08-01-2020","51685","Manassas Park","Virginia","United States",2020-08-02 04:34:47,38.77058531,-77.44399307,498,7,0,491,"Manassas Park, Virginia, United States"
"08-01-2020","12081","Manatee","Florida","United States",2020-08-02 04:34:47,27.47196942,-82.31831044,8655,185,0,8470,"Manatee, Florida, United States"
"08-01-2020","72091","Manati","Puerto Rico","United States",2020-08-02 04:34:47,18.420473,-66.490461,192,0,0,192,"Manati, Puerto Rico, United States"
"08-01-2020","26101","Manistee","Michigan","United States",2020-08-02 04:34:47,44.33352407,-86.05626916,32,0,0,32,"Manistee, Michigan, United States"
"08-01-2020","55071","Manitowoc","Wisconsin","United States",2020-08-02 04:34:47,44.11946801,-87.80928853,295,1,0,294,"Manitowoc, Wisconsin, United States"
"08-01-2020","55073","Marathon","Wisconsin","United States",2020-08-02 04:34:47,44.89792533,-89.75863384,561,6,0,555,"Marathon, Wisconsin, United States"
"08-01-2020","01091","Marengo","Alabama","United States",2020-08-02 04:34:47,32.24767634,-87.78796182,509,14,0,495,"Marengo, Alabama, United States"
"08-01-2020","72093","Maricao","Puerto Rico","United States",2020-08-02 04:34:47,18.171795,-66.942126,41,0,0,41,"Maricao, Puerto Rico, United States"
"08-01-2020","04013","Maricopa","Arizona","United States",2020-08-02 04:34:47,33.34835867,-112.4918154,119295,2089,0,117206,"Maricopa, Arizona, United States"
"08-01-2020","29125","Maries","Missouri","United States",2020-08-02 04:34:47,38.16193985,-91.92249662,14,0,0,14,"Maries, Missouri, United States"
"08-01-2020","06041","Marin","California","United States",2020-08-02 04:34:47,38.07122463,-122.7210631,4994,70,0,4924,"Marin, California, United States"
"08-01-2020","55075","Marinette","Wisconsin","United States",2020-08-02 04:34:47,45.38553432,-88.033246,298,3,0,295,"Marinette, Wisconsin, United States"
"08-01-2020","01093","Marion","Alabama","United States",2020-08-02 04:34:47,34.13697363,-87.88704173,548,24,0,524,"Marion, Alabama, United States"
"08-01-2020","05089","Marion","Arkansas","United States",2020-08-02 04:34:47,36.26844485,-92.68451899,23,0,0,23,"Marion, Arkansas, United States"
"08-01-2020","12083","Marion","Florida","United States",2020-08-02 04:34:47,29.21227113,-82.05803627,5069,61,0,5008,"Marion, Florida, United States"
"08-01-2020","13197","Marion","Georgia","United States",2020-08-02 04:34:47,32.3483402,-84.52733571,142,4,0,138,"Marion, Georgia, United States"
"08-01-2020","17121","Marion","Illinois","United States",2020-08-02 04:34:47,38.64963204,-88.91899208,132,0,0,132,"Marion, Illinois, United States"
"08-01-2020","18097","Marion","Indiana","United States",2020-08-02 04:34:47,39.78163624,-86.13826325,14578,718,0,13860,"Marion, Indiana, United States"
"08-01-2020","19125","Marion","Iowa","United States",2020-08-02 04:34:47,41.33445101,-93.09934783,148,0,0,148,"Marion, Iowa, United States"
"08-01-2020","20115","Marion","Kansas","United States",2020-08-02 04:34:47,38.35855394,-97.0985251,42,1,0,41,"Marion, Kansas, United States"
"08-01-2020","21155","Marion","Kentucky","United States",2020-08-02 04:34:47,37.55218078,-85.26898542,102,0,0,102,"Marion, Kentucky, United States"
"08-01-2020","28091","Marion","Mississippi","United States",2020-08-02 04:34:47,31.23132643,-89.8209217,594,18,0,576,"Marion, Mississippi, United States"
"08-01-2020","29127","Marion","Missouri","United States",2020-08-02 04:34:47,39.80601912,-91.62203062,150,1,0,149,"Marion, Missouri, United States"
"08-01-2020","39101","Marion","Ohio","United States",2020-08-02 04:34:47,40.58610662,-83.15736305,2867,32,0,2835,"Marion, Ohio, United States"
"08-01-2020","41047","Marion","Oregon","United States",2020-08-02 04:34:47,44.90287942,-122.5815117,2614,67,0,2547,"Marion, Oregon, United States"
"08-01-2020","45067","Marion","South Carolina","United States",2020-08-02 04:34:47,34.07859748,-79.36400756,513,12,0,501,"Marion, South Carolina, United States"
"08-01-2020","47115","Marion","Tennessee","United States",2020-08-02 04:34:47,35.12997174,-85.62265895,199,4,0,195,"Marion, Tennessee, United States"
"08-01-2020","48315","Marion","Texas","United States",2020-08-02 04:34:47,32.79868409,-94.3566123,123,7,0,116,"Marion, Texas, United States"
"08-01-2020","54049","Marion","West Virginia","United States",2020-08-02 04:34:47,39.50984542,-80.24244659,172,2,0,170,"Marion, West Virginia, United States"
"08-01-2020","06043","Mariposa","California","United States",2020-08-02 04:34:47,37.57978556,-119.9073334,54,2,0,52,"Mariposa, California, United States"
"08-01-2020","45069","Marlboro","South Carolina","United States",2020-08-02 04:34:47,34.59905577,-79.67561152,429,4,0,425,"Marlboro, South Carolina, United States"
"08-01-2020","26103","Marquette","Michigan","United States",2020-08-02 04:34:47,46.4338914,-87.64043701,133,11,0,122,"Marquette, Michigan, United States"
"08-01-2020","55077","Marquette","Wisconsin","United States",2020-08-02 04:34:47,43.81911946,-89.40073763,69,1,0,68,"Marquette, Wisconsin, United States"
"08-01-2020","01095","Marshall","Alabama","United States",2020-08-02 04:34:47,34.36975964,-86.30486727,2912,30,0,2882,"Marshall, Alabama, United States"
"08-01-2020","17123","Marshall","Illinois","United States",2020-08-02 04:34:47,41.0327901,-89.34510444,21,0,0,21,"Marshall, Illinois, United States"
"08-01-2020","18099","Marshall","Indiana","United States",2020-08-02 04:34:47,41.32467367,-86.26185087,739,22,0,717,"Marshall, Indiana, United States"
"08-01-2020","19127","Marshall","Iowa","United States",2020-08-02 04:34:47,42.03586837,-92.9990819,1381,24,0,1357,"Marshall, Iowa, United States"
"08-01-2020","20117","Marshall","Kansas","United States",2020-08-02 04:34:47,39.78359669,-96.52278974,9,0,0,9,"Marshall, Kansas, United States"
"08-01-2020","21157","Marshall","Kentucky","United States",2020-08-02 04:34:47,36.8800707,-88.32803576,124,2,0,122,"Marshall, Kentucky, United States"
"08-01-2020","27089","Marshall","Minnesota","United States",2020-08-02 04:34:47,48.35825983,-96.37017407,28,0,0,28,"Marshall, Minnesota, United States"
"08-01-2020","28093","Marshall","Mississippi","United States",2020-08-02 04:34:47,34.76216286,-89.50299462,556,8,0,548,"Marshall, Mississippi, United States"
"08-01-2020","40095","Marshall","Oklahoma","United States",2020-08-02 04:34:47,34.02311222,-96.76855464,97,0,0,97,"Marshall, Oklahoma, United States"
"08-01-2020","46091","Marshall","South Dakota","United States",2020-08-02 04:34:47,45.75870838,-97.59855639,8,0,0,8,"Marshall, South Dakota, United States"
"08-01-2020","47117","Marshall","Tennessee","United States",2020-08-02 04:34:47,35.45798777,-86.76420988,261,2,0,259,"Marshall, Tennessee, United States"
"08-01-2020","54051","Marshall","West Virginia","United States",2020-08-02 04:34:47,39.86064362,-80.66591062,124,0,0,124,"Marshall, West Virginia, United States"
"08-01-2020","12085","Martin","Florida","United States",2020-08-02 04:34:47,27.0772071,-80.43109784,3626,75,0,3551,"Martin, Florida, United States"
"08-01-2020","18101","Martin","Indiana","United States",2020-08-02 04:34:47,38.7099921,-86.80373186,42,0,0,42,"Martin, Indiana, United States"
"08-01-2020","21159","Martin","Kentucky","United States",2020-08-02 04:34:47,37.79990579,-82.51247478,29,0,0,29,"Martin, Kentucky, United States"
"08-01-2020","27091","Martin","Minnesota","United States",2020-08-02 04:34:47,43.67429718,-94.55099908,201,5,0,196,"Martin, Minnesota, United States"
"08-01-2020","37117","Martin","North Carolina","United States",2020-08-02 04:34:47,35.84326734,-77.10860251,239,6,0,233,"Martin, North Carolina, United States"
"08-01-2020","48317","Martin","Texas","United States",2020-08-02 04:34:47,32.30600051,-101.9513518,45,3,0,42,"Martin, Texas, United States"
"08-01-2020","51690","Martinsville","Virginia","United States",2020-08-02 04:34:47,36.68212094,-79.86352771,168,3,0,165,"Martinsville, Virginia, United States"
"08-01-2020","17125","Mason","Illinois","United States",2020-08-02 04:34:47,40.23917274,-89.91824452,42,0,0,42,"Mason, Illinois, United States"
"08-01-2020","21161","Mason","Kentucky","United States",2020-08-02 04:34:47,38.59471935,-83.82151043,53,1,0,52,"Mason, Kentucky, United States"
"08-01-2020","26105","Mason","Michigan","United States",2020-08-02 04:34:47,43.99509218,-86.24988902,97,0,0,97,"Mason, Michigan, United States"
"08-01-2020","48319","Mason","Texas","United States",2020-08-02 04:34:47,30.71780434,-99.22629416,40,0,0,40,"Mason, Texas, United States"
"08-01-2020","53045","Mason","Washington","United States",2020-08-02 04:34:47,47.35007586,-123.1863685,157,1,0,156,"Mason, Washington, United States"
"08-01-2020","54053","Mason","West Virginia","United States",2020-08-02 04:34:47,38.77071799,-82.02524219,46,1,0,45,"Mason, West Virginia, United States"
"08-01-2020","17127","Massac","Illinois","United States",2020-08-02 04:34:47,37.22078441,-88.71036614,34,0,0,34,"Massac, Illinois, United States"
"08-01-2020","48321","Matagorda","Texas","United States",2020-08-02 04:34:47,28.81955746,-96.01230294,673,21,0,652,"Matagorda, Texas, United States"
"08-01-2020","02170","Matanuska-Susitna","Alaska","United States",2020-08-02 04:34:47,62.31305045,-149.5741743,287,2,0,285,"Matanuska-Susitna, Alaska, United States"
"08-01-2020","51115","Mathews","Virginia","United States",2020-08-02 04:34:47,37.44164146,-76.34098896,13,0,0,13,"Mathews, Virginia, United States"
"08-01-2020","15009","Maui","Hawaii","United States",2020-08-02 04:34:47,20.86399628,-156.5689097,170,6,0,164,"Maui, Hawaii, United States"
"08-01-2020","72095","Maunabo","Puerto Rico","United States",2020-08-02 04:34:47,18.017889,-65.922235,52,0,0,52,"Maunabo, Puerto Rico, United States"
"08-01-2020","47119","Maury","Tennessee","United States",2020-08-02 04:34:47,35.6187413,-87.07462444,1050,5,0,1045,"Maury, Tennessee, United States"
"08-01-2020","48323","Maverick","Texas","United States",2020-08-02 04:34:47,28.7429195,-100.3157686,1989,39,0,1950,"Maverick, Texas, United States"
"08-01-2020","72097","Mayaguez","Puerto Rico","United States",2020-08-02 04:34:47,18.2013,-67.1452,427,0,0,427,"Mayaguez, Puerto Rico, United States"
"08-01-2020","40097","Mayes","Oklahoma","United States",2020-08-02 04:34:47,36.30179091,-95.23175116,282,6,0,276,"Mayes, Oklahoma, United States"
"08-01-2020","40087","McClain","Oklahoma","United States",2020-08-02 04:34:47,35.01123903,-97.44572302,389,4,0,385,"McClain, Oklahoma, United States"
"08-01-2020","30055","McCone","Montana","United States",2020-08-02 04:34:47,47.64469406,-105.7944994,1,0,0,1,"McCone, Montana, United States"
"08-01-2020","46087","McCook","South Dakota","United States",2020-08-02 04:34:47,43.6742571,-97.36863144,24,1,0,23,"McCook, South Dakota, United States"
"08-01-2020","45065","McCormick","South Carolina","United States",2020-08-02 04:34:47,33.90161443,-82.30794338,103,2,0,101,"McCormick, South Carolina, United States"
"08-01-2020","21145","McCracken","Kentucky","United States",2020-08-02 04:34:47,37.05350953,-88.70445755,328,4,0,324,"McCracken, Kentucky, United States"
"08-01-2020","21147","McCreary","Kentucky","United States",2020-08-02 04:34:47,36.73874143,-84.48102924,35,0,0,35,"McCreary, Kentucky, United States"
"08-01-2020","48307","McCulloch","Texas","United States",2020-08-02 04:34:47,31.1925468,-99.34682807,41,1,0,40,"McCulloch, Texas, United States"
"08-01-2020","40089","McCurtain","Oklahoma","United States",2020-08-02 04:34:47,34.11664328,-94.77222373,818,25,0,793,"McCurtain, Oklahoma, United States"
"08-01-2020","29119","McDonald","Missouri","United States",2020-08-02 04:34:47,36.62869595,-94.34867205,926,7,0,919,"McDonald, Missouri, United States"
"08-01-2020","17109","McDonough","Illinois","United States",2020-08-02 04:34:47,40.45674722,-90.67775541,125,15,0,110,"McDonough, Illinois, United States"
"08-01-2020","37111","McDowell","North Carolina","United States",2020-08-02 04:34:47,35.67736232,-82.0482425,595,9,0,586,"McDowell, North Carolina, United States"
"08-01-2020","54047","McDowell","West Virginia","United States",2020-08-02 04:34:47,37.38002939,-81.65083669,32,0,0,32,"McDowell, West Virginia, United States"
"08-01-2020","13189","McDuffie","Georgia","United States",2020-08-02 04:34:47,33.47851918,-82.48252774,286,9,0,277,"McDuffie, Georgia, United States"
"08-01-2020","17111","McHenry","Illinois","United States",2020-08-02 04:34:47,42.32451172,-88.45248227,2909,113,0,2796,"McHenry, Illinois, United States"
"08-01-2020","38049","McHenry","North Dakota","United States",2020-08-02 04:34:47,48.23104458,-100.6324822,14,1,0,13,"McHenry, North Dakota, United States"
"08-01-2020","13191","McIntosh","Georgia","United States",2020-08-02 04:34:47,31.49683595,-81.40163426,147,2,0,145,"McIntosh, Georgia, United States"
"08-01-2020","38051","McIntosh","North Dakota","United States",2020-08-02 04:34:47,46.11182017,-99.44145858,19,1,0,18,"McIntosh, North Dakota, United States"
"08-01-2020","40091","McIntosh","Oklahoma","United States",2020-08-02 04:34:47,35.37235506,-95.66599306,151,1,0,150,"McIntosh, Oklahoma, United States"
"08-01-2020","42083","McKean","Pennsylvania","United States",2020-08-02 04:34:47,41.80938602,-78.56478358,28,1,0,27,"McKean, Pennsylvania, United States"
"08-01-2020","38053","McKenzie","North Dakota","United States",2020-08-02 04:34:47,47.7413337,-103.395905,78,1,0,77,"McKenzie, North Dakota, United States"
"08-01-2020","35031","McKinley","New Mexico","United States",2020-08-02 04:34:47,35.5800772,-108.262245,3999,220,0,3779,"McKinley, New Mexico, United States"
"08-01-2020","17113","McLean","Illinois","United States",2020-08-02 04:34:47,40.48996987,-88.84621113,552,15,0,537,"McLean, Illinois, United States"
